Date,URL,Title,Body,Score,COVID-19 Mentions,Sentiment
2020-04-29 19:25:03,https://www.youtube.com/watch?v=Z5wo4SDWPw0,"For anyone else whose lost their mind as well, check this out",,1,{},"{'label': 'POSITIVE', 'score': 0.8919534087181091}"
2020-04-29 07:06:33,https://i.redd.it/peayzc79oqv41.jpg,"Be careful out there, lads.",,104,{},"{'label': 'NEGATIVE', 'score': 0.8908693194389343}"
2020-04-29 04:44:19,https://www.reddit.com/r/StopSpeeding/comments/ga5twa/how_fucked_am_i_and_is_there_a_chance_ill_ever/,How fucked am i and is there a chance ill ever get normal?,I little camper.,2,{},"{'label': 'NEGATIVE', 'score': 0.9988654851913452}"
2020-04-28 14:57:08,https://www.reddit.com/r/StopSpeeding/comments/g9t5q6/paranoia/,Paranoia,"In an attempt to quit, and stay quit, each day I am going to try to write about a particular aspect of my journey with amphetamine addiction. My hope is that with each segment, I will force myself to confront the horrors to which we all know or have known at some point. Today, I would like to talk about my own experience with drug-induced paranoia. 

During one night of my habitual bullshit, which included copious amounts of adderall and vyvanse, no sleep, no food, lots and lots of nicotine and porn, I turned to this subreddit and read something that resonated with me on a deep level. The comment had read something along the lines of: “I spend most of my time using thinking and researching how to get off this drug lol”. I had never agreed with any statement more in my life. The flip side of that statement was also true. I spent most of my time off the drug fantasizing about being on it. 

This oxymoron is perhaps the epitome of addict psychology. All of us struggle with our chemically-drained brain romanticizing speed, and its effects. For me, any benefits are rapidly diminishing, at best, and have been for quite awhile. The truth is, I know exactly what is gonna happen when I pop those pills. 

At the peak of my use, I lived in a constant state of pure terror. It goes so much deeper than paranoia. Quite literally, these pills drove me to insanity. Back when I was at school, let's just say I had a very dysfunctional routine. My morning always, no matter what, consisted of popping say 100 mg of adderall. I would go to the library, and try to concoct a list of things to do for that day. When I first got into adderall, there was nothing I like to do more than knock out a week's worth of school work in a day. It made me feel invincible. Speaking of paranoia, at the beginning of the semester, I skipped all of my classes because I was on ridiculous amounts of stimulants and I was terrified of being like that surrounded by 50 people and a professor. After I missed that first week, It was game over. I convinced myself that had I showed up in that class, everyone would fixate on me for not being there the first week, and then notice that I was tweaking, so I couldn’t show my face. I kid you not, I did not show up for a single class for an entire year. You’re probably wondering how this flew with my parents right about now. I went to astonishing lengths in order to keep my secret life going. Every single second of every day, I was worrying about when they were going to find out and force me to come home. Things had already been bad before that year, so my parents required that I call them pretty much daily. My life had become the ultimate antithesis of what I projected to others. Everything I did completely centered around making sure my image was upheld. As a greater distance arose between my external image and internal state, paranoia took over my life. In both physical and mental ways, I became consumed by it. To keep the ruse up for my parents, I would literally write entire essays to send to them that I never handed in. I would go into my grades on google chrome and change the code of the website to project higher grades. You see, in the beginning, I had so many opportunities to go to someone, anyone, for help. Instead, I grew so paranoid that even after missing only one class, or telling one lie, it was too much for me to deal with. I knew that things were headed to my never being allowed back at that institution at the end of the school year, and the idea of explaining this to my friends caused me stark horror. I had no interest in helping myself, even stopped caring about the pain I was causing to my family, all I wanted to do was pretend like things were normal, and that I was okay inside. Everytime I consumed stimulants, It made me that much more aware of where I was headed. Ultimately, that was to a deep pit, the likes of which I still probably haven’t fully comprehended. Paranoia is vicious, it entraps you in a web of false reality, it builds mountains out of moles, and it will eat you alive. In the worst of it, I lived in a state of terror, crippling anxiety, stress, and psychosis. I could barely even walk through campus anymore, out of fear of everyone else’s gaze, just that was enough to make me retreat. This quickly got overbearing, so I did the only sensible thing in a situation like that, I started drinking daily, even during the day, to calm myself down. The funny thing is that adhd meds are supposed to help you sit still, but by that point I couldn’t keep myself in the same position on a couch, or a table, for more than a few minutes. I became hyper self-aware of all my newfound tics, and body movements. At one point, I couldn’t even be in the same study room as any of my friends without getting up to leave every 10 minutes. So I would make up some narrative like I had class, killing two birds with one stone, and I would go find a new room to occupy by my lonesome. If that didn’t exist because it was a busy day, I would go home. I lived in a fraternity house with 16 other dudes throughout the duration of this. In other words, there was no escape ever. No peaceful room I could go lock because I had a roommate. No moment of the day where everyone home wasn’t seated on our family room couch watching some show and bantering. This was a ruthless place. Each time you sat down you had a pretty significant chance of getting roasted for one thing or another. This did nothing to help my anxiety about coming home for the day. Back to the routine, so in the morning I would go to the library, and basically stay for as long as I could handle the paranoia. Generally speaking, this wasn’t very long. Oftentimes I would lock myself into a study room, and start hearing voices talking outside, as if someone was going to barge in and arrest me or they knew I was tweaking. It would, without fail, become too much to handle at some point. I would look down at what I was supposed to be doing, and immediately look back up to the door, trying to hone my hearing in on what was going on, whether someone was about to come in. This cycle repeated itself until I inevitably gave up. It was a special kind of hell. In preparing to go home, usually a little after lunch time, I would have to stop at the liquor store. This was always the worst. I drove a bright red car that you could make from a mile away, I was always so terrified of being spotted in the middle of the day walking back to my car, with a bottle of vodka or tequila. After that I would grab some diet cokes or sprites and pour some of the vodka into a bottle of soda. I would then drive around campus, past many police cars I might add, sipping that drink until life became a little more tolerable. I would have to find some time to lie to my parents about my activities for that day, and most days I would put it off as long as I could. More recently, I went back through texts with my dad where it was me going “I’ll call you in an hour” at 10 am, then at 10, saying after lunch, then saying before dinner, etc. I was deathly afraid of that daily phone call, it was one the most real reminders of what I was doing with my life and the consequences it had. I simply could not do anything at the time. I’m not exaggerating at all. Even returning a text felt too overbearing. There were several times I missed flights home because I just didn’t go to the airport, like the time I skipped Easter with my family including grandpa who shortly after passed. I was so afraid of everything, I ran as far away as I knew how. Retreating to booze, xanax, and weed. It's genuinely a miracle I made it home to get help, I still remember what was going through my head. My parents were considering having me drive back to Florida, so that they wouldn’t have to pay for shipping the car or one of them to go up and get it. I had already planned on drinking that entire 20 hour drive, through NY City even. I would not have made it. Yet in my paranoia, that was better than facing what was waiting for me. They decided to have my fly home, and left explicit instructions to park the car at a long-term facility that my dad’s work had a discount with. I instead drove to the airport drunk, and parked in the short term lot at the airport, and still barely made it on time. The car was an absolute mess, throwing up everywhere, bottles of vodka and rotted food on the seats. Not to mention the fact that my leaving the car there cost my parents an extra thousand and my dad had to go get it a few days after I got back, the car didn’t even have working windshield wipers. I was supposed to get them fixed weeks ago, but couldn’t put up with the idea of sitting at the shop while it was getting done. Even at home, in my recent missteps, the paranoia has made a full fledged return. During this quarantine, I will be in my room at night, waiting for my family to go to sleep before I can go crazy with porn and nicotine, and that moment seemingly never comes. It has gotten to the point where I can’t even look at my phone out of this fear of my parents laying awake trying to fake me out and expose my entire plan. This has never once happened, never in four years has she come into my room after probably 10:30 p.m., but that doesn’t stop my head from assuming it's gonna happen at any moment. I am left lying there, wide awake doing nothing but thinking. Concurrently, I hear her voice or the hardwood floors squeak every minute. I literally jump every time too. My love-hate affair with amphetamines has been plagued by a never ending cycle of terror, anxiety, hallucinations, and psychosis. Almost immediately after I feel the effects coming on, I immediately regret the decision. 

Anyone who has ever tweaked before is aware of the anxious state that comes along with it, and I truly would not wish this state on anyone. It is corrosive and destructive. Let us never forget that.",11,{'quarantine': 1},"{'label': 'POSITIVE', 'score': 0.9082250595092773}"
2020-04-28 11:49:34,https://www.reddit.com/r/StopSpeeding/comments/g9pnbr/survey_gaps_in_substance_use_treatment/,Survey] Gaps in substance use treatment,"Hi everyone!

I'm a psychology graduate sharing a survey here [https://www.surveymonkey.com/r/9RMF9GB](https://www.surveymonkey.com/r/9RMF9GB) to collect data on barriers individuals struggling with a substance use problem face when trying to find appropriate help, and how technology might help eliminate some of those barriers. I wasn't able to get enough responses the first time so I'm sharing it again with the hopes of getting some more! :)

No names or personally identifiable information are collected, and the survey is completely anonymous. I would really appreciate it if you could share your experience. Thank you and hope everyone is staying safe!",1,{},"{'label': 'NEGATIVE', 'score': 0.9893574118614197}"
2020-04-28 04:22:06,https://www.reddit.com/r/StopSpeeding/comments/g9jbzq/when_does_cravings_regret_and_depression_stop_i/,"When does cravings, regret, and depression stop? I need help/advice urgently.","For close to a year I shot meth. I went very hard and exteme with the needle. For over a year I used meth. Today is day 45 sober. I did it by my own free will.

Every single day i still have strong cravings. Every time I glance at my arms and every time I see a vein on my body i get triggered and crave about shooting up. Ive been in a grey kind of depressive mood. I think back to the times of getting high and I feel the sensation of the rush coming up. It happens a lot still, every single day. When does it end? Im struggling right now and I need help and advice.",12,{},"{'label': 'NEGATIVE', 'score': 0.9668120741844177}"
2020-04-27 22:47:40,/r/Benzedrex/comments/g9f3ih/attention/,HOLA COMO ESTAS,,1,{},"{'label': 'POSITIVE', 'score': 0.9583714604377747}"
2020-04-27 22:22:04,https://www.reddit.com/r/StopSpeeding/comments/g9eqpi/buddhist_scripture_that_encourages_me/,Buddhist scripture that encourages me,"“Do not think lightly of evil, saying ‘It will not come to me.’ Even a water-pot is filled by the falling of drops. Likewise the fool, gathering it drop by drop, fills himself with evil.”

“Do not think lightly of good, saying: ‘It will not come to me.’ Even as a water-pot is filled by the falling of drops, so the wise man, gathering it drop by drop, fills himself with good.”
 
The Words of Truth
Selections from The Dhammapada
Found in What the Buddha Taught by Walpola Rahula",10,{},"{'label': 'NEGATIVE', 'score': 0.8988910913467407}"
2020-04-27 17:45:16,https://i.redd.it/93lff3mwkfv41.jpg,567 Days Sober From Cocaine!,,94,{},"{'label': 'NEGATIVE', 'score': 0.9851247072219849}"
2020-04-27 09:37:21,https://www.reddit.com/r/StopSpeeding/comments/g90tpf/i_dont_get_any_withdrawal_effects_at_all/,I don't get any withdrawal effects at all.,"I take 20mg of adderall a day every couple of days.

When I stop taking it, I don't feel any withdrawal effects at all.
I don't feel to sleep more, eat more or any of the exhaustion that usually accompanies it. In fact, I barely feel any different on the days that I take it and the days that I don't take it.

Is my dose too low or something?",3,{},"{'label': 'NEGATIVE', 'score': 0.9961568713188171}"
2020-04-26 23:24:39,https://www.reddit.com/r/StopSpeeding/comments/g8sp8o/hit_a_wall_in_recovery_from_adderall_at_118_days/,"Hit a wall in recovery from Adderall at 118 days, triggered by having to apply for jobs","I've been thinking a lot about adderall lately as I am trying to apply to a job (I heard about a specific opening from a friend who could help me get it) and I've just been psyched out for almost a week not making any headway on the cover letter/resume/and application. 

I've made a lot of progress in other ways (especially diet and exercise and also making more friends with fellows and going to a lot of 12 steps meetings) in recovery but it's frustrating that the underlying issues that prompted me to start using adderall and ultimately abuse it are psyching me out so bad (reading, writing, more ""Administrative"" work, etc.). 

I'm not even at 4 months off it and having abused adderall for almost ten years nearly every day, I know it's way to early even to entertain the idea of ""using it in moderation"" again, because my brain still needs more time to heal. So I am not going to use adderall, but i worry about falling into a depression. I had a panic attack of sorts today, for the first time in a while. It was like I was having a panic attack because I was so stressed.

I'm gonna keep trying but wanted to check in here.",6,{},"{'label': 'NEGATIVE', 'score': 0.9984744191169739}"
2020-04-26 17:37:36,https://i.redd.it/72464ahme8v41.jpg,Posting this here aswell,,20,{},"{'label': 'NEGATIVE', 'score': 0.9874292016029358}"
2020-04-26 11:29:30,https://www.reddit.com/r/StopSpeeding/comments/g8g938/when_will_i_stop_this_madness/,when will I stop this madness,"so I started doing meth when I was 18, haven’t been able to stop for more than 4 months. Been to rehab multiple times. I was an IV user but stopped that. I’m 21 now and have a 3 year old daughter who has been put through me leaving her with my mom and choosing drugs. Well this past year I’ve had her most of the time, I am in school and doing really good but I slip up every now and then. It hurts me to see my family hurting and I don’t know why the hell I do what I do. When will enough be enough? I do the dumbest things when I’m high too that I regret like having sex with guys. I just feel stupid and I don’t want to tell my sponsor. Since quarantine I’ve been doing good and then three days ago I just went and got it and haven’t stopped since but I’m ready to put it down. I just need some advice I’m being so hard on myself and just feel like screw it whatever happens happens. I continue to do this to myself 😞 I don’t want to lose my family again or be in prison.",15,{'quarantine': 1},"{'label': 'NEGATIVE', 'score': 0.9959838390350342}"
2020-04-26 09:45:21,https://www.reddit.com/r/StopSpeeding/comments/g8elbs/ive_reached_the_end_of_the_road_with_this/,I've reached the end of the road with this.,"Last night was the last time for me. I realise the only way to get my life back is to quit. I have 2 children, and my boy, 7, has started to notice the abuse. I cannot continue with the notion I'm not present with my children, and pretending I'm always busy trying to  fix, mend or make something is way short of what they really need.
I've told my wife that it's over, having admitted this morning that I have an addiction problem. Thank you all poster's in this subreddit for helping my see the way, the only way forward.
I also found this whilst trawling for answers on the Internet, maybe many of you have already read it but it also made great sense to me so I share it here. https://quittingadderall.wordpress.com/how-to-quit-adderall-2/
Wish me luck, it's still day one of a 4 year binge.",6,{},"{'label': 'NEGATIVE', 'score': 0.9442692995071411}"
2020-04-25 19:33:46,https://www.reddit.com/r/StopSpeeding/comments/g83s8n/day_560_without_amphetamines/,Day 560 without Amphetamines!,"After 3 years of heavy abuse today is day 560 since I’ve quit taking amphetamines! It’s been tough, boy has it been tough, but I’m so happy of my progress. Each day I feel myself getting a little better, this last year and a half I’ve made so many improvements to my life that I wouldn’t have been able to do without quitting the devils drug. 
I don’t really post anything, but looking at posts and reading stories here has helped me more than anything.
I wish the best for everyone quitting, we’re all in this together :)",78,{},"{'label': 'POSITIVE', 'score': 0.9988886713981628}"
2020-04-25 16:36:14,https://imgur.com/zpsDerr,Every day's a new record,,9,{},"{'label': 'POSITIVE', 'score': 0.9996334314346313}"
2020-04-25 04:47:07,/r/Stims/comments/g7qbhu/goodbye_wish_you_all_the_best/,Ill be staying in this sub but not others,,4,{},"{'label': 'NEGATIVE', 'score': 0.9778333902359009}"
2020-04-24 23:35:29,/r/Benzedrex/comments/g7flci/ididditagain/,Hello 👋,,1,{},"{'label': 'POSITIVE', 'score': 0.9989393353462219}"
2020-04-24 23:02:13,https://www.reddit.com/r/StopSpeeding/comments/g7madz/quarantine_quitting/,Quarantine Quitting,"I've never seriously thought about quitting. But the voice inside me saying I have to eventually is louder. Right now is the perfect time to quit - I'm working from home and it's slow anyway. I'm taking probably around 50xr per day and I'm still the same weight as when I started. It only helps me function normally now. I am quite worried about the weight gain. I've been taking Adderall pretty much daily for about 8 years. I fear that my metabolism will never return. Just wanted to put my thoughts out there, I've never posted here before or even stated I need to quit to anyone.",12,{'quarantine': 1},"{'label': 'NEGATIVE', 'score': 0.9964209794998169}"
2020-04-24 17:10:22,https://www.reddit.com/r/StopSpeeding/comments/g7gpih/start_over_tomorrow/,Start over tomorrow?,"If any of you lacks wisdom, let him ask God, who gives generously to all without reproach, and it will be given him.
James 1:5 ESV
https://bible.com/bible/59/jas.1.5.ESV",0,{},"{'label': 'POSITIVE', 'score': 0.9593552350997925}"
2020-04-24 14:41:21,https://www.reddit.com/r/StopSpeeding/comments/g7dyxq/i_have_been_off_adderall_for_about_a_month_and_a/,I have been off adderall for about a month and a half,"I feel so much better. I have been way more productive, mood is more stable, starting to be able to organize thoughts better. I still have some ways to go but....... I've gained 10 lbs and its making me fucking 2 seconds away from relapsing. Logically I know its stupid and not worth it. But the evil addiction is like it's just a pill, you're in quarantine anyway. (I've been walking, I cant exercise much due to surgery recovery). I cant believe I'm a jackass that would rather be skinny asf in bed than chubby or fat living in the outside world.",15,{'quarantine': 1},"{'label': 'NEGATIVE', 'score': 0.9974027276039124}"
2020-04-24 05:08:56,https://i.redd.it/8zyj5wc8fqu41.jpg,Ice o lated,,188,{},"{'label': 'NEGATIVE', 'score': 0.9714373350143433}"
2020-04-24 05:05:36,https://www.reddit.com/r/StopSpeeding/comments/g754ml/what_do_yall_do_when_you_can_feel_like_your_gonna/,What do y'all do when you can feel like your gonna use again anytime but you want to avoid it?,"You know what I mean? Like that feeling where instead of thinking about how much you hate meth all the time, you start thinking about how much you miss it?",6,{},"{'label': 'NEGATIVE', 'score': 0.998027503490448}"
2020-04-24 01:37:34,https://www.reddit.com/r/StopSpeeding/comments/g72rad/on_day_43_and_struggling/,On day 43 and struggling,"Hi y'all,

I went through the initial pink cloud and was loving my recovery but the past week my mood has been really low. Today Ive just been wandering around home, feeling quite lost. Tbh I don't know where the days gone. I have a sponsor I could call and a few friends in recovery, but I dont see the point in calling and just complaining. I find it hard to reach out when Im down. 

My thoughts keep going to using. I really miss drugs right now. But I also dont if that makes sense? 

I saw a new therapist yesterday and a lot of triggering shit came up, she seemed focussed on talking about my childhood and now Im kinda obsessing about memories and things from growing up. Ive always struggled with depression and anxiety (currently on lexapro, serequel if i cant sleep, and modafinal). 

Im stressed that the therapist isnt a good fit for me, but dont know if thats just my anxious mind. Im lacking motivation to seek out alternative therapist options. 

I guess im just looking for hope that this too shall pass

How do you guys fill time in the early days? Im finding myself bored/restless/bleh",3,{},"{'label': 'NEGATIVE', 'score': 0.998627781867981}"
2020-04-24 00:54:12,https://www.reddit.com/r/StopSpeeding/comments/g728a4/anyone_else_feel_like_they_cant_enjoy_weed/,anyone else feel like they can't enjoy weed anymore after quitting stims?,"I've smoked weed semi regularly since mid 2018.  Never felt it could be addicting for me and I used it responsibly, but I loved it.  I thought the euphoria and laughter and ability to find mundane shit interesting was awesome.  but since quitting, weed actually exacerbates my issues (lethargic, completely unfocused because of incessant random mental chatter, slow/foggy) and doesn't rly give euphoria from the stim withdrawal anhedonia.  Anyone else experiencing the same thing?",2,{},"{'label': 'POSITIVE', 'score': 0.6044150590896606}"
2020-04-23 23:30:34,https://youtu.be/OAy_1b9ryq4,Your soul,,0,{},"{'label': 'POSITIVE', 'score': 0.9988613128662109}"
2020-04-23 12:29:26,https://www.reddit.com/r/StopSpeeding/comments/g6pssc/the_meth_test_that_everyone_seems_to_keep_failing/,The Meth Test that everyone seems to keep failing at.,"I want to be done with this shit! I could check myself into a recovery/addiction program, but that won’t help when I’m outside of the facility. 

As a habitual offender of crystal meth for the past 5-6 years, the longest span without was 3-4 months; idfk why I went back to the shit after getting away from it for what is a long ass period of time for me... Not overly, overly abused, but enough to keep me coming back to the shit, primarily bc I couldn’t get shit done (I mean necessary and simple tasks) and could have possibly slept months at a time if possible. 

How do I fix this for fxcking good? What would be a good PoA (if at all costs avoiding a rehab commit) or suggestions for dealing with the constant exhaustion and lack of care pertaining to, simply put, living better than I am now?

ANYTHING would be a godsend atp! Thanks in advance!",16,{},"{'label': 'NEGATIVE', 'score': 0.9974800944328308}"
