Date,URL,Title,Body,Score,COVID-19 Mentions,Sentiment
2020-04-23 02:54:09,https://www.reddit.com/r/StopSpeeding/comments/g6hyb0/im_ruined_gave_myself_away_to_someone_who_claimed/,I'm RUINED. Gave myself away to someone who claimed they went through the same things than I am going through.,"Me & my ex broke up 9 years ago because he cheated on me with one of my friends from high school after a big fight we had.  Last year in November I messaged him about my addiction and how I haven't felt like myself since me & him knew each other. I've been on Adderall since my freshman year of college, and that was the year my step-mom gave me one of her pills and after that I got my own prescription and went on my way to get addicted to it a few years later (junior year of college). Been addicted to it since then. I feel like a prisoner in my own life because without it I am depressed, useless, and feel like my life will never get better due to my fucked up brain where I am not motivated to do a damn thing at the ripe age of 26. 

Anyways, after trying to convince myself to quit on my own, I decided to contact my ex that I felt like knew me better than anyone else (we dated for about 4 years before he cheated). Told him things that I haven't even told my best friend. He went through his own phase of addiction, so he says. He was addicted to spice & has always been smoking a shit ton of weed since I've known him. 

He always told me that our relationship was the one thing he regretted in his entire life. Even tried to kill himself at one point not too long after he was out of my life.  Fed me lies about how he felt about me and I truly believed that he felt genuine feelings for me. So I told him my deepest darkest thoughts about how I really felt about my addiction. Let him back into my life because I felt like it was right and I felt good about trying to get better with him around.

Now I'm left here worse off then I was before I let him back in. Told me that these pills ruined me. And that I am needy and will always be lonely. Obviously I am going through a rough time trying to end this horrible addiction that I think drives my life sometimes. Makes me feel useless when I'm without them. 

I just can't believe I've done this to myself. I knew I wanted to get better & I truly thought that, since he had been through similar things (so he says) that things would be okay and that I could be able to finally see myself being happy after I've gotten through the hardest part. I feel ruined and so hurt that I'm now on a binge of my pills and drinking a lot of alcohol to numb this hollow pain I feel now.

This almost makes me want to prove him wrong about everything. That I can get better and be better off without him too. But it also escalated my feeling of being so depressed and slightly suicidal in that I will never feel like myself again.

I hope one day that I prove myself wrong first, and him.",10,{},"{'label': 'NEGATIVE', 'score': 0.9970079064369202}"
2020-04-22 20:00:21,https://www.reddit.com/r/StopSpeeding/comments/g6cfm9/an_interesting_title/,An interesting title.,"Your text post. (0ptional)
I'm coming down off 2 Benzedrex inhalers. - I gotta practice being sober. This sucks. Im stoned- need to heal self with food. I don't have the will to change. But I wanna live now and I have to make choices about what I am doing Hello!  So I'm kinda high and optimistic.",3,{},"{'label': 'NEGATIVE', 'score': 0.8168814778327942}"
2020-04-22 19:56:12,https://www.reddit.com/r/StopSpeeding/comments/g6cd9i/my_eating_disorder_is_going_to_make_me_relapse/,My eating disorder is going to make me relapse,"I've only been clean from smoking meth for a week and half or something, and all we've done is go to the pharmacy for his meds and lay in bed and eat munchies and get stoned and I can tell I've put on so much weight and gone from tiny little meth fairy to this nasty animal in the mirror now and even though I know it's the dysmorphia I can't handle it anymore. I miss when I didn't need to eat, and even though I know I looked gross and strung out at least I was tiny. 

My boyfriend says he likes me better with more weight on me but he literally doesn't even want to touch me, he just busts in my mouth and tells me it's because he's coming off dope and that's making his dick not work and I honestly can't handle it anymore and I don't even have money to go pick up so I'm gonna have to beg him to please go get me some dope so I don't lose it 

I know I'm overreacting and I probably won't end up using today but I can feel that the e.d. and dysmorphia are going to fuck this up for me",16,{},"{'label': 'NEGATIVE', 'score': 0.9988328814506531}"
2020-04-22 09:15:10,https://www.reddit.com/r/StopSpeeding/comments/g60wjl/i_relapsed/,I relapsed.,"So, I have a lot to say that you may have heard before. Hell, you may be able to relate to it in some way. I'll try not to go overboard, but I just need a release...

For starters, let me give you a little backstory:

I had used some form of substance since I was 17 years old. Not bad considering a majority of people I know that use now or have in the past started using drugs or alcohol years before they were 17... I digress.

I started the typical drinking and smoking at age 17, smoked a shit ton of tobacco, a shit ton of pot and i dabbed for a while... I took advantage of a golden opportunity to attend university and dropped out after my first year, met a drug dealer that I fell head over heels in love with, and that's when I began experimenting with other drugs. I tried psychedelics, pills, an assortment of uppers and downers... then I met that evil bitch Tina. 

My boyfriend had no problem coaching me through my first time doing meth, but was adamant about never allowing me to do it again. He was the type to always be able to go on a bender and drop it like it was nothing. 
We had a chaotic relationship given that I was only 18 and still in that reckless, stubborn phase .. After a few abusive arguments, I called up my mom (the one person I can count on whenever shit gets rough) and I left. I left and I walked straight into the arms of the drug I felt would comfort me.

Fast forward two and a half years later to when I found my rock bottom. I had gotten myself into some hard fucking times, all to chase a high I'd never get again... I'd sold my body. I sold drugs. I stole from people and surrounded myself with criminals that I had no business being around. I escaped being sold to a sex trafficking ring by the skin of my teeth. I had become homeless and bounced from trap house to trap house until I just... woke up one day. I really don't know how to explain it, but there was a day when the drugs weren't getting me high, the company I kept had suddenly started disgusting me and I was finally fed up with the bullshit.

By the grace of my amazing family, I flew out to Wisconsin (I'm from California, but my family moved to Wisconsin and I stayed behind and chose ""the lifestyle.""), spent the first couple weeks in a daze; I ate, slept... woke up, cried hysterically, ate some more and slept a LOT more, and on February 1st of 2016, I began my year long journey to rehabilitation.  I attended inpatient rehab until March of 2017, and I was feeling like a brand new person, as most do for a while...

That feeling lasted for a while until I found myself becoming bored with life as it should be... I had found a decent paying job that consumed a lot of my life, and I fucking hated it. I had a decent relationship, but I was putting more effort into it than was fair and I ended up hating that too. I had fallen into a deep depression and had reintroduced myself to alcohol, and that's when I slowly crept back into bad habits that I thought were dead and gone.

I was pouring everything I had into a job and relationship that gave me little in return and I was so unhappy. I became so tired of what I was doing that I allowed myself an excuse to drown myself in liquor, thinking that it would ease my pain enough to keep holding on until things ""got better."" One DUI later and I had slowed my roll a bit, but only for a short while. Eventually, instead of drinking at bars, I took my vice home and drank alone. 

I had a few too many one night and woke up still drunk, sick but not as sick as I was going to be the next day. I endured the dreaded two day hangover and went to work feeling okay, but something was off. This behavior added to my already traumatic past triggered the most severe anxiety I had ever experienced in my life. My family has a history of clinical anxiety and depression, and I had begun to feel the anxiety when I was in rehab, but nothing compared to the constant state of panic I had found myself in after that heavy binge drinking episode. I had become so riddled with anxiety that I was having severe panic attacks more than once daily (at least), and I had so much trouble getting out of bed let alone going to work. 

I filed for FMLA to cover absence from work until I got my mental health squared away, but they only allowed me four days of excused absence a MONTH. Given that I was adjusting to trial runs of different medication that made my condition worse for a while and also given that I was continuing to have daily episodes that were holding me back from performing the way management wanted, I lost my job after two years of commitment to the shitshow of a place. Albeit, I wasn't too disappointed as I know that I did all I could and that management was a fucking joke from the start. 

I had found a new job a couple months later once I found the right medication to help ease my panic disorder, and I fucking loved it. I am currently employed at this place and continue to enjoy every day I get to go to work (which has never happened to me before)... I had left the relationship that was dragging me down, and finally felt like I could move forward and get my mental wellbeing back into shape.

Almost a year into working, I had gotten back into touch with my ex (the one I had first used dope with), and it took me by surprise. I was skeptical at first, but we spoke for a while and somehow the spark between us reignited, he moved to WI and we moved back in together. 

Things turned sour once I realized he never changed, and he realized I had changed more than he anticipated. We have broken up and reunited a few times now and he still insists on trying again, but I'm not sure I want to dive into the same of cycle of toxicity all over again.

What does aaaall this have to do with r/StopSpeeding , you might ask? Well... 

I made a choice recently after having my last blow up argument with my ex and temporarily losing my job due to COVID-19... I had spent the first week enjoying school break, and usually I would've had a few beers and smoked a little weed to cap off the night... One night, out of sheer stupidity and lack of reasonable consideration, I ended up getting a small amount of
dope. I racked up a line (i used to smoke, but I felt more in control by racking up), took it to the face and got spun for the first time in 4 years. 

It surely did what it's known for. I had energy that I forgot was attainable. I was able to focus on things that I haven't found interesting in such a long time (like painting, drawing, writing, etc.) and was even motivated to do my schoolwork (I am attending college again for the first time since I dropped out in 2013). I felt all the energy that laid dormant for four years resurface in a way that (for some reason) I didn't expect. I hate glorifying something that is certainly not a good thing, but I fully believe in transparency and this is just how I felt at the time.

Since being under quarantine, I had given myself an excuse to dabble for a short while. I knew what to expect this time around, and I made the strict decision to stop with ample time for the comedown once I got a return date from my manager.
It's been about a month now since I've picked up the shit again (about a month and a half of no work) and my manager sprung it on me that we are due back to work this upcoming weekend under strict limitations. 

While I am happy to be able to go back to work and have something positive and productive to do, I have about two and a half days to come down and I was not  entirely prepared to be going back to work until another couple weeks.

I am ready to come down and have been through this ride before, but I am just analyzing the whole situation and I sorta feel shitty. I know that sobriety is a daily battle and that failure is often inevitable, but I just hate being reminded that I will forever have this demon stalking my every move, waiting for the day it can convince me that drugs or alcohol are the only things that can ease the pain for a while.

I don't want to lie to myself or to you all and say that this is it for me. I'm not going to say I will not make the mistake of doing drugs or drinking again... but I know for right now that I can get through this, and I know it will be easier than before. After all that I've gone through, I have made it through much worse. I have my vices, and they will sneak up on me again, but I will not allow them to take away the strength I have gained from years of heartache. I hope the same for others who have struggled or are struggling now. 

Thanks for reading if you've made it this far... If you can take anything from this novel of a post, just take comfort in the fact that you are not completely alone on your journey. You will fall. You will get back up for a while, and you will fall again. As long as a breath remains in your lungs, there is hope. 

TL;DR - I relapsed after reaching four years clean from meth, and I'm quitting this bender with humility and a refreshed point of view.",39,"{'covid': 1, 'quarantine': 1}","{'label': 'NEGATIVE', 'score': 0.9949234127998352}"
2020-04-21 16:39:37,https://www.reddit.com/r/StopSpeeding/comments/g5n78z/anyone_here_ever_become_immune_to_adderalls/,anyone here ever become immune to Adderall's effects?,"College student here trying to salvage the semester as much as possible.  In other words, I'll be prescribed taking addy till my last exam on may 4rd.

I've been on it since spring 2018, but granted I was taking too high of a dose from the get go.  I'm at the point where I've taken a total of 60 mg Adderall IR (orally) over the course of about 6ish hours and have felt extremely minimal effects.  Virtually no mental stimulation of any kind - no significant increases in focus, anxiety, euphoria, analysis acceleration, etc. Had some Mild physical effects: some sweating, some dry mouth, slight vasoconstriction, feeling a little more awake ""physically"" but not mentally.  The only reason I take it anymore is to avoid being completely unfocused and lethargic so I can at least do some academic work.

Just taking more would probably not do anything good: If I took like 90 mg all at once, I'm certain all I'd feel is weird/uncomfortable physical stimulation with little effect on mental stimulation, maybe some anxiety.  **If I'm taking as much as I am and still getting minimal effects have I ""hit the roof"" on my oral amphetamine use?**

much love to y'all",2,{'immun': 1},"{'label': 'NEGATIVE', 'score': 0.9994955062866211}"
2020-04-21 04:56:24,https://www.reddit.com/r/StopSpeeding/comments/g5brl2/i_quit_adderal_4_days_ago_for_first_time/,I quit adderal 4 days ago for first time,"Been on 40mg IR Adderal for about a year and in that year lost 20 lbs, Im 5 10 , 20 years old and 130 lbs. As much as people told me to not to cold turkey, I did. And honestly, not as bad as I thought it would be. Yeah I was tired as fuck the first 3 days but it’s day 4 now and it’s subsided a bit(little easier to wake up). I’ve been having weird food cravings, it’s like, i won’t be hungry one minute then I’ll see something on tv or hear someone talking about it and then go into a frenzy and just raid the kitchen lol. My mood has seemed to be pretty decent and motivation up and down. Have noticed my cravings the last day or 2 have been kind of strong. Also my insomnia is kicking in pretty hard now. Anything recommendations for getting through this as Im new to subreddit? Thanks!",3,{},"{'label': 'NEGATIVE', 'score': 0.9781361222267151}"
2020-04-20 21:54:25,https://www.reddit.com/r/StopSpeeding/comments/g5699g/question_re_supplements_for_quitting_stims/,"Question re- supplements for quitting stims: L-tyrosine, 5HTP, L-dopa","Hello everyone! 

I am trying to get sober and I have been reading lots about supplements that have helped many with their withdrawal symtoms/ extreme brain fog associated with coming off of stims. In particular, I read a lot about L-tryosine and 5HTP. I have been trying to figure out the proper dosing ratio and after reading this article : [https://www.ncbi.nlm.nih.gov/pmc/articles/PMC3415362/](https://www.ncbi.nlm.nih.gov/pmc/articles/PMC3415362/)  I am extremely confused as to what I should be using as a supplement. This article states that in order to see any positive effects from 5HTP, it is important that you take it with L-tyrosine and L-dopa, and it is crucial that they are all properly balanced. 

Just wondering if anyone has any thoughts related to this or if they have any recommendations for supplements (and what amounts) they used to help them get sober.

Thanks in advance!! All suggestions are welcome - at this point I am pretty desperate but I want to make sure I'm not doing more damage to my body by incorrectly dosing supplements.",6,{},"{'label': 'NEGATIVE', 'score': 0.9897447228431702}"
2020-04-20 20:15:38,https://www.reddit.com/r/StopSpeeding/comments/g54no8/8_days_and_im_losing_my_damn_mind/,8 Days and I’m Losing My Damn Mind,"Today is day 8 and it’s not going so well. I feel like if I still feel like this when my refill is due I am gonna refill it. I don’t know if I ever will be able to let go of it completely as I have narcolepsy and the less addictive wakefulness drugs don’t agree with me-seizure risk and terrible psychological and other physical side effects. Actually, no narcolepsy drug (and there aren’t many) are helpful. To drive responsibly I would need to have it on my person. *sigh 
I’m just so fucking RESTLESS. I have severe ADHD as well and while I’m absolutely exhausted I can sit still or focus on anything for more than 5 minutes. I literally just get up to pre even though I don’t have to because I’m so uncomfortable. Hoping I’ll continue to balance out!",4,{},"{'label': 'NEGATIVE', 'score': 0.9992044568061829}"
2020-04-20 17:02:36,https://www.reddit.com/r/StopSpeeding/comments/g517w8/how_on_earth_do_i_quit_meth/,How on earth do I quit meth?,"The longest I've gone is two weeks, I just relapsed today after 10 or so days.

The cravings are so all-consuming and the dreams as well. And I'm bored in quarantine so have nothing to occupy my mind",26,{'quarantine': 1},"{'label': 'NEGATIVE', 'score': 0.9994207620620728}"
2020-04-20 15:04:07,https://www.reddit.com/r/StopSpeeding/comments/g4yzpv/quitting_during_quarantine/,Quitting during quarantine ?,"Is anyone trying to use this time to quit stimulants? I’m working with a life coach on rebuilding skills during this time but excuses to take meds keep coming up. 

Any strategies to stick with it during this time?",10,{'quarantine': 1},"{'label': 'NEGATIVE', 'score': 0.9992014765739441}"
2020-04-20 11:27:55,https://www.reddit.com/r/StopSpeeding/comments/g4uu6e/today_is_day_1/,Today is day 1,Wish me luck everybody... I know i can do this!,46,{},"{'label': 'POSITIVE', 'score': 0.9996821880340576}"
2020-04-19 23:04:31,https://www.reddit.com/r/StopSpeeding/comments/g4kyz8/im_16_days_clean_on_meth_use/?utm_source=ifttt,I'm 16 days clean on meth use,,1,{},"{'label': 'NEGATIVE', 'score': 0.9714677929878235}"
2020-04-19 15:22:36,https://www.reddit.com/r/StopSpeeding/comments/g4dmtu/35_months_clean_in_rehab_urge_to_use_getting_hard/,3.5 months clean - In rehab - urge to use getting hard to ignore,"Hey :)

So I've been clean from meth since the beginning of January. I've been addicted for 1.5 years, with 4 months clean in between. Unfortunately I switched to crack and used more Heroin and pills than before, knowing that I'd go to rehab in March.

I was a fucking literal crackhead at that time, smoking 30-60 bucks of crack and used a G of brown a day. That was obviously enough to keep me off the clear.

Now I've been almost 2 months clean off of everything and until a few days ago everything was great. I put on 8 kilos got a fucking Sixpacks going ain't talking beer.

The problem is that I get insane urges to take meth and have sex/masturbate again, which is all I did stimd up. I always think about that and get a dopamine rush that makes me wanna use and it's very uncomfortable.

Will this ever stop? I feel like I can never experience sex the same and never forget what it felt like.
Is there anything I can do?

Thanks for reading :)

TL;DR: What can I do to stop the urge to use meth even after 3 months clean. I don't wanna relapse.",4,{},"{'label': 'NEGATIVE', 'score': 0.9376786351203918}"
2020-04-19 08:35:46,https://www.reddit.com/r/StopSpeeding/comments/g46yv4/taking_vyvanse_30mg_3x_a_week_enough_to_prevent/,Taking Vyvanse 30mg 3x a week enough to prevent addiction?,"Hi guys,

I wanna take Lisdexamphetamine (30mg) to treat my ADD. I am scared of the longterm effects on my brain and becoming dependent on it though.

Do you think taking 30mg only on mondays, wednesdays and fridays is enough to prevent a tolerance?

Thanks!",10,{},"{'label': 'NEGATIVE', 'score': 0.9929516911506653}"
2020-04-18 17:25:25,https://www.reddit.com/r/StopSpeeding/comments/g3vdtz/is_it_okay_to_use_once_in_a_while_whilst_quitting/,Is it okay to use once in a while whilst quitting Adyrulllll?,"Heyo. So it's been 25 days since I have used Adderall. I'm looking to quit, and now seems to be the best time to do so. (Quarantine senior year before going into the real world.) However I'm falling way behind on the online school work and college application stuff I still have, and meanwhile my laundry is everryywhhereeee making little things feel impossible. After a weekish of internal debating, I felt that I had decided and called in a refill two days ago. It should be ready today, and my plan is to take 1 or 2 for myself to clean for a weekend, and give the rest to my buddy who can hold onto it for me. I don't expect the quitting mindset to vanish once I dose because the negative effects are so permanently seared into my noggin, so once I come down from that then should proceed to make sober progress on school work, home maintenance, life skills etc. in a cleaner, non-overwhelming environment.

When I first started using Adderall it was only every once in a while and so it felt really good and the side effects didn't build up, nor did I feel like death the next day. If I can have some self control with it (and a friend's help for now) then I think this could work, similarly to how it did in the beginning. (Except i'd be tapering off instead.)

Does anybody think this could work? Or see a higher advantage in continuing cold turkey? Also are there variations on the ""days clean"" approach to quitting that would fit this style, like x doses in x days? All thoughts are welcome and appreciated!",1,{'quarantine': 1},"{'label': 'NEGATIVE', 'score': 0.9695632457733154}"
2020-04-18 16:37:09,https://www.reddit.com/r/StopSpeeding/comments/g3ukmy/207_days_sober/,207 Days Sober,"Wow. Just, wow. Everything is going well, and I am incredibly grateful. 

I got confirmation today that the apartment I want is ready for me to move into. I’m still working despite this pandemic, logging 55 hours a week. 

Sobriety is so worth it, you guys. Keep going. Everything is going to be okay. You can do it.",65,{'pandemic': 1},"{'label': 'POSITIVE', 'score': 0.9998540878295898}"
2020-04-18 12:03:17,https://www.reddit.com/r/StopSpeeding/comments/g3pvgu/going_to_only_use_once_or_twice_a_monthi_swearto/,"going to only use once or twice a month,i swear(to be realistic)","I started a year ago and was finding myself doing binges once or twice every two weeks each lasting 2-3 days max
After that i managed to keep my dosage low and was using two times in two weeks
Lately i've only been doing small bumps once in 10 days and currently feel that the risk/reward ratio is huge at this point as i feel much healthier
I even have a bag with lots of good quality stuff sitting and i'm not even in the mood for touching it
I've finally reached a point where my life doesn't even have meth in its content as a main concern.
phew,what a year on that shit can do ....
never really was a heavy addict or doing it daily but fuck,magic gets lost too quickly and seems like i'm over with it,as with other drugs in the past that i eventually got enough of.
i'm not at the point where i can imagine my life without it whatsoever like with lsd,ecstasy,coke,heroin etc but i can definitely feel i'm not gonna repeat past behavior",8,{},"{'label': 'NEGATIVE', 'score': 0.9982996582984924}"
2020-04-17 16:26:59,https://i.redd.it/ygxypkittft41.jpg,an entire jello pudding box to the dome. Withdrawals make u fat,,54,{},"{'label': 'NEGATIVE', 'score': 0.9995772242546082}"
