Date,URL,Title,Body,Score,COVID-19 Mentions,Sentiment
2021-01-13 19:22:42,https://www.reddit.com/r/StopSpeeding/comments/kwtyv1/128_days_sober_from_6ish_years_of_adderall_abuse/,128 days sober from 6ish years of adderall abuse. Finally starting to feel alive again!,"Honestly I had to look up how long it has been since Labor Day, as I pretty much stopped counting after 100 days. 



As the title states, I am finally, FINALLY beginning to feel alive again. I’m so grateful for all of the hard work that I put into myself during this time. Quitting adderall really made me look my depression in the face and that was a lot to reckon with. Therapy was so hard but worth it to identify and work on some of my negative thought patterns. Volunteering has helped me create relationships with wonderful people



Doing yoga twice a week has helped tremendously with being more present, and running and biking have helped me stay in shape. I’ve actually went from 196lbs to 175lbs over the last 4+ months. 



For a very long time there it felt like things were never going to get better. Nothing interested me at all. My hobbies all bored me. It was hard for me to pay attention to movies etc. On top of it all I had a nasty case of imposter syndrome and felt like I was no longer capable of socializing or as charming/clever/smart as I was before. My libido was in the toilet. 



I don’t know what it was but last week something clicked. The anxiety and depression subsided. I felt like me again!! For the first time in years I felt genuine connection with people. Things come in waves so I may not be out of the woods yet but I’m very happy to finally see some noticeable improvement. Stay strong everybody 💜",38,{},"{'label': 'POSITIVE', 'score': 0.8585464954376221}"
2021-01-13 16:31:03,https://i.redd.it/ilylju8a46b61.jpg,this group got me here!! 30 days baby!!!,,111,{},"{'label': 'POSITIVE', 'score': 0.9954360127449036}"
2021-01-13 06:17:20,https://www.reddit.com/r/StopSpeeding/comments/kwefwa/tips_for_resuming_exercise_after_longtern_cns/,Tips for resuming exercise after long-tern CNS stimulant abuse possible damage?,"My stimulant use has gradually ramped up over three years, culminating over the past five months with unchecked abuse of a variety of substances like a-pvp, a-php, 3-mmc, various amphetamine analogues and others.

My primary concern is that my resting heart rate is now consistently around 100bpm, even if I haven't taken anything in a few days. So, is this evidence of damage or is it a symptom of withdrawal that will smooth out?

I guess my dilemma is that the best way to lower your resting heart rate is to exercise regularly, but if my cardiovascular system is so fucked up is it even safe to do so? I'm avoiding going to the doctor about it for A: Not a healthcare priority during a pandemic and B: I don't want 'drug abuse' on my medical record for the rest of my life.

For reference I'm 24, 6'2"" 155lbs with a very sedentary lifestyle.",6,{'pandemic': 1},"{'label': 'NEGATIVE', 'score': 0.9979617595672607}"
2021-01-13 04:24:48,https://www.reddit.com/r/StopSpeeding/comments/kwd1xi/will_life_ever_be_the_same_after_meth/,Will life ever be the same after meth?,"I’ve been struggling to stay clean for the past 5 years, in and out of rehab. The longest stint I’ve had was 8 1/2 months of clean time, but just like every other time the meth calls me back. I feel like once you have a taste of life on meth, sobriety just seems so dull and boring. Nothing really compares. Even when I had 8 1/2 months I still felt this way. So I guess my question is, have you been able to get past the hold meth holds on you and are you able to have fun and avoid boredom in sobriety?",10,{},"{'label': 'NEGATIVE', 'score': 0.9988580942153931}"
2021-01-13 01:45:29,https://i.redd.it/dgovp2f6q1b61.jpg,Major Milestone!!!,,121,{},"{'label': 'POSITIVE', 'score': 0.9996167421340942}"
2021-01-12 13:24:33,https://www.reddit.com/r/StopSpeeding/comments/kvxcfg/tips_for_writingstudyingbeing_productive_again/,Tips for writing/studying/being productive again when you are quitting? (Day 4),"I’m finding it easy to distract myself and not feel horrible (enjoying sex, food, exercise, movies again). I’m even feeling more productive with housework bc I don’t go into weird obsessive irrelevant holes. 

However, the reason I got a prescription 9 years ago (and the way I abused it) was for writing and graduate school work. I have major deadlines coming up and would normally take a lot of adderall to make it happen. Now I can barely bring myself to open an email. I feel anxious even thinking about it, which is making me totally avoid my computer. 

Does anyone have any tips for getting back into writing/school work? Or for confronting the massive amount of work you have put off while detoxing? I know my writing and editing wasn’t better when I was on it, but I think it helped me forget my insecurities.",27,{},"{'label': 'NEGATIVE', 'score': 0.997312068939209}"
2021-01-11 15:01:05,https://www.reddit.com/r/StopSpeeding/comments/kvaoyr/relapsed_thursday_sunday_dumped_my_prescription/,Relapsed Thursday - Sunday. Dumped my prescription last night after reading an old post here,"Was clean for almost 60 days and could feel the stress creeping in due to working two intense contract jobs and grad school starting back up this week. Not an excuse to start again, but definitely a crutch that I readily used.

Decided to request a refill. Took it as less than subscribed Thurs-Friday. Blasted through so much work, but could already feel myself wanting more and more. Yesterday I recognized that I was starting to structure myself around it again. When should I take it next? I can’t eat breakfast because my stomach needs to be empty for the full effect. Did I have anything acidic? The robot feeling came back and I hid it from my husband that I’d got the refill and was taking it again. That feeling is fucking awful.

Last night I got on this Reddit and read new posts and reread posts I’d read in the past. Without a second thought, I got up and dumped it all. Zero hesitation this time. I’m tired today, since I’ve been struggling with not eating and getting limited sleep the last few days. Although I’m disappointed in my relapse, I am incredibly proud of myself for stopping when I did. I’ve set up an appointment to cancel the prescription indefinitely. This drug is insidious and strong, but I’m resilient and stronger. Here’s to day 1 again. I’m already feeling less strung out and happy than I have been the last four days. I turned back into myself over the last 59 days, especially recognizing that I was depressed for years and I didn’t need adderall: I need food and laughter. I need to turn off work mode and I need to engage with my family. Those are the things I need to be successful, and I fortunately have them all in abundance without a drug.",46,{},"{'label': 'NEGATIVE', 'score': 0.9715954065322876}"
2021-01-11 09:34:17,https://www.reddit.com/r/StopSpeeding/comments/kv3sfi/do_milestones_make_you_want_to_relapse/,Do milestones make you want to relapse?,Today is 6 months of adderall. I’m getting busier at work and it gives me nothing but anxiety. My days are getting longer and I feel like the further I get from adderall the more I need it. There are days I don’t even think about it but then there are days like today where I want nothing more than to have just one for a long day at work or to help me get organized. Im supposed to feel proud of myself today. Instead Im just remembering how easy long days were with it. 😩,23,{},"{'label': 'NEGATIVE', 'score': 0.7695174813270569}"
2021-01-11 07:13:30,https://www.reddit.com/r/StopSpeeding/comments/kv1hyy/thank_you_for_this_subreddit_its_a_blessing/,Thank you for this subreddit. It’s a blessing,"Every time the urge is strong, this sub is the remedy. Works every time.

Stay strong and thank you all!",40,{},"{'label': 'POSITIVE', 'score': 0.9998692274093628}"
2021-01-11 00:48:38,https://www.reddit.com/r/StopSpeeding/comments/kuwg5h/need_some_hope/,Need some hope,"I posted in here 1 month ago about quitting adderall and cymbalta (been on addy for 4 years and cymbalta for 1). 

I’m thankful to say I’ve made it a month cold turkey off of both. The first few weeks were legitimately awful - could not stay awake, constant (literally) brain zaps, ZERO motivation, etc. 

Things seemed to have improved slightly in that my brain zaps are more spread out and I can usually make it through the day without needing a long nap. However, things are still so hard. 

My energy is very low and I’m constantly lacking motivation. Ironically I also struggle sleeping at night and feel like I’m slipping deeper into depression despite this accomplishment. 

Are there truly better days ahead? Is there any sort of general timeline anyone can speak to? I don’t want to go back to the meds but living in this current state doesn’t feel very sustainable - especially with a crazy job and 2 young kids",12,{},"{'label': 'NEGATIVE', 'score': 0.9986068606376648}"
2021-01-10 23:08:41,https://www.reddit.com/r/StopSpeeding/comments/kuuudb/adhd_help/,Adhd help,"Really struggling and need advice from you guys. In 2019 I was diagnosed with adhd, put on concerta and after some tweaking of meds etc ended up on dex. It changed my life and I became the guy I had been struggling for years to become. In terms of doing things I could do everything I wanted to but felt empty and a little numb, like I was unable to celebrate the successes. I didn’t like this zombie feeling so tried switching to vyvanse, then strattera then modafinil and all of them weren’t as helpful as dex. At the end of the year I felt like I wanted to be free of having to rely on dex to do everything so tried to quit the meds and since then life has been a complete roller coaster. I was so exhausted so lethargic and tired and just gaming all day and eating. Fast forward 3 weeks and things feel that they haven’t improved, I tried taking dxm to supposedly lower tolerance and speed up withdrawal, found some of my modafinil for some days that were unbearable. I feel like the control I had over my life has shattered without the meds. On the one hand that makes me feel like I need them, on the other it makes me feel useless because I can’t enjoy or be proud of any of my successes on meds because they weren’t me and were just the drugs. I gave my mum the dex and asked her to give it back after 3 months to see if I can handle when my brain has gotten over dependence but today it was too much and I took my brothers (who also has adhd) vyvanse. Feel trapped between, I am adhd and I need meds to live a meaningful life and I am the way I am now because I have become used to dex. I never abused it only taking the daily dose prescribed but at times I would sometimes take sublingually or with tums to make it last longer. I know this is long but I need some advice from people. The adhd reddit is so pro meds they’ll justify taking like 100mg plus and ignore all possible negative long term side affects",5,{},"{'label': 'NEGATIVE', 'score': 0.999249279499054}"
2021-01-10 20:43:51,https://www.reddit.com/r/StopSpeeding/comments/kuscyi/attn_residents_of_wncavl_are_you_a_user_or_do_you/,"ATTN: Residents of WNC/AVL! Are you a user, or do you know a user? Tainted meth, mass influx of OD cases 1/9 & 1/10"," 

Out of Asheville NC this morning 1/10/2020:

&#x200B;

""Please  be advised, there is a spike  happening in central/downtown Asheville  which began yesterday and  continues today. Individuals are consistently  reporting using meth and  not knowing it was tainted. Due to the volume  of overdoses in such a  short time, I am sending this out to those who  can get to participants  the fastest on the weekend. A wider alert may  go out on Monday should  the spike continue.

&#x200B;

Thank you for all each of you do to save lives.""",33,{},"{'label': 'NEGATIVE', 'score': 0.9919646978378296}"
2021-01-10 19:39:09,https://www.reddit.com/r/StopSpeeding/comments/kur7k2/guestion_needed_answered/,Guestion needed answered,First time seeing rash / or facial marks and just wanna know when do they clear up?,2,{},"{'label': 'NEGATIVE', 'score': 0.994961142539978}"
2021-01-10 18:11:47,https://www.reddit.com/r/StopSpeeding/comments/kupl0j/fighting_the_urge/,Fighting the urge.,"Hate the feeling of temptation. Driving down the same roads, where I used to get it. Secretly hoping I run into the same people so I can do it one last time. But it’s never the last time. Praying for y’all. Do the same for me.",26,{},"{'label': 'NEGATIVE', 'score': 0.9101890325546265}"
2021-01-10 14:37:54,https://www.reddit.com/r/StopSpeeding/comments/kul5qt/reasons_for_quitting_meth/,Reasons for quitting meth,"I'm proud of you guys for making the decision to quit meth. I would like to ask what are the reasons why you quit? I'll start off with my reasons.

- Moderate to Overwhelming paranoia
- Moderate to Overwhelming anxiety especially when I'm out in public. 
- Psychosis (disturbing visuals and auditory hallucinations)
- Disgusting body odor
- Terrible nausea (sometimes) 
- Uncomfortable and intense sweating
- Decreased appetite. Eating is extremely difficult if not impossible. Food loses it's flavour, difficult to swallow food. Sometimes I cough up the food.
- Difficulties drinking water
- Uncontrollable shaking. It looks like I'm very nervous about something.
- Difficulties urinating even when I drink water.
- Word Salad and studdering issues (sometimes)
- constantly thinking about having unprotected sex while watching porn
- Shitty comedown, sometimes I cry due too very low dopamine receptors. I start having bad, weird and disturbing thoughts during this time.
- I lose myself and keep redosing and redosing
- mental issues that carried over to my sober thinking for example I constantly think people are talking about me when ppl are in fact minding there own business.

Well that's my list and no I wasn't high when I wrote this. What are you're guys reasons for quitting?",31,{},"{'label': 'NEGATIVE', 'score': 0.9991796612739563}"
2021-01-09 20:45:06,https://www.reddit.com/r/StopSpeeding/comments/ku4mtg/anybody_have_experience_with_straterra_or_other/,Anybody have experience with Straterra or other non-narcotic ADHD meds?,"I have severe ADHD which I try to manage through mindfulness and coping mechanisms like lists etc. But being on medication changes the quality of my life and ability to function at work and in my personal life drastically. I find the allure of productivity of amphetamines very addicting... But at the same time I just want to be a regular person and not limit my success. To me, at times, the rewards outweigh the risks so I have not been completely sober as of late... As long as I can control and stop myself before psychosis or creating unproductive rituals like a stimfap sesh, etc.  But if I could completely eliminate the temptation, I would. So: How many of y'all have tried straterra? I am already on Wellbutrin and it helps a LOT. I was also thinking about microdosing mushrooms because I've read that they also can be used to treat ADHD; they work by globallizing brain function, which is, allegedly the function of adderall, vyvanse, concerta etc. when given to individuals with ADHD. Thanks.",14,{},"{'label': 'POSITIVE', 'score': 0.904808759689331}"
2021-01-09 14:24:32,https://www.reddit.com/r/StopSpeeding/comments/ktxgx7/got_up_around_11_which_is_good_for_me_since/,"got up around 11 ( which is good for me since quitting) made me some eggs, gonna strap on my ankle weights & use my new treadmill i set up! walked 5 miles yesterday , off to a good start :) feeling much better already! been a week since i’ve last taken it. treadmill was an awesome investment 👍🏻",,76,{},"{'label': 'POSITIVE', 'score': 0.9942135214805603}"
2021-01-09 12:55:39,https://www.reddit.com/r/StopSpeeding/comments/ktvowr/i_got_adderall_again_and_now_i_dont_like_it/,"I got adderall again, and now I don’t like it","I’m going back to school, and I’ve been dealing with pretty bad brain fog, forgetfulness and weird inability to remember like random actors names and stuff (I realize it’s trite but it’s messed with my head). 
Talked with my doctor, she prescribed 10mg 2x daily. Yesterday I took 2.5 mg at 6 am to see how I respond, and a ton of feelings came back with respect to using. I didn’t drink nearly as much caffeine throughout the day, didn’t redose at all, and today I don’t feel like taking any more.


Maybe when I’m back in school there may be a legit use for this as a medication, but for now, I would rather  just drink coffee, it’s way more tolerable and I just don’t want that thing back in my life. 

Self control is a hell of a rush, comrades. 
Two years clean in two weeks.",6,{},"{'label': 'NEGATIVE', 'score': 0.9957411289215088}"
2021-01-09 12:35:30,https://www.reddit.com/r/StopSpeeding/comments/ktvag0/update_just_came_to_an_obvious_realization/,Update: Just came to an obvious realization,"I’ve gone through detox and I’m on my way to rehab. It’s a 28 day program an hour south of where I live. I’m pretty motivated. I haven’t been to residential treatment in 7 years and when I first went it was to get out of consequences for a DUI. If I get any responses, I probably won’t see them until a month from now because I should be there in about 30 mins. Thanks again for the support and wish me luck. 

Original post text: So I got fired this morning because I’ve been showing up to work fucked up and sleep deprived the last few days. So I accept it, kinda knew it was coming and head back to the motel since it’s only 10am. So I’m feeling all sorry for myself and pissed at myself for picking up meth again. I start writing this long ass post about how I’ve lost everything and I’m stuck in this horrible situation that I can’t escape. That I’m doomed to die a junkie. Then, for literally the first time in weeks, it hits me. Hey maybe if you quit smoking meth some of those problems will clear up. I understand it’s easier said than done. But I haven’t even tried. I’ve been buying the same amount every day while my life crumbles around me. That thought never even crossed my mind. I’m so glad I came to this on my own and no one had to tell me, regardless of how long it took me to get there. Anyways, I’m not saying I’m cured of my addiction and withdrawals are gonna be joke time. I just spent hours today in absolute despair not knowing what to do next. So that’s the plan. Fucking try a little lmao.",20,{},"{'label': 'NEGATIVE', 'score': 0.9985476136207581}"
2021-01-09 10:44:25,https://www.reddit.com/r/StopSpeeding/comments/ktt3wh/2_months_addy_free/,2 months Addy free,"Today marks two months sober from Adderall. I feel like a sack of fat potatoes. Some days are better than others, but overall I’ve gained a shit ton of wait and feel depressed on a daily basis. I long for those little orange footballs. The better part of me knows it would do no good, but feeling like this is a rip. I realize this is the process, I just hope it gets better sooner than later. 

I do have some leftover physical side effects that worry me. My blood pressure is higher than normal and I’m not sure if it’s just me being a fat ass or if the Adderall did some damage? I also can’t tell if I’ve developed a slight kankle or if I have swelling in my extremities? Can anyone share if they’ve experienced the same? Is this permanent cardiovascular damage or can I reverse it with some gym time? 

Thank you all for your support. I appreciate it.",19,{},"{'label': 'NEGATIVE', 'score': 0.9964052438735962}"
2021-01-09 08:10:17,https://i.redd.it/x53ymaja3ba61.jpg,"Sometimes recovery isn’t linear, and that’s okay.",,157,{},"{'label': 'POSITIVE', 'score': 0.9995500445365906}"
2021-01-09 02:49:27,https://www.reddit.com/r/StopSpeeding/comments/ktmp78/living_life_finally/,"Living life, finally","Hi. I'm 43years old. I'm an addict who's choosing recovery. 
I started drinking and smoking herbs when I was 12. Thats just what we did in the town I grew up in. I started getting into trouble then. Ungovernability is what they called it. In reality I wouldn't listen to my newly divorced mom and was sent to group homes and then to the juvenile detention facility in my home state. I was supposed to be there for 30 days. I bucked all authority and they ended up keeping me there for 6 months. That being the maximum time they could keep me for misdemeanors. I was released and returned to my moms. She didn't want me and I didn't want to be there so I was sent to my dads. He was a buddy at best. Never a father figure.  I spent my high-school years smoking/drinking and bouncing from school to school and parent to parent. I stayed out of trouble ( didn't get caught), dropped out of h.s. and got my g.e.d.. it was simple as I am intelligent and well read. I enrolled in college when I was 18. Scheduled my classed around ""wasted wensday"" and the other parties that come with college if thats what your there for. During this time I was also stealing checks, creating fake checks with other peoples routing numbers, and spending mad amounts of other people's money. After 3 semesters of this I was busted. At 19 I received 3 ten year sentences run concurrently. I went to the state penitentiary and received parole after 3 years. Kept drinking and smoking herb and using other people's piss to pass my ua's. Met a girl and ""fell in love"". Introduced to meth and jumped all in. Wasnt out long before my parole was revoked. During the time I was out I picked up a new Federal offense of destruction of an air navigation system. I vandalized a v.o.r. in the woods on the top of a mountain.  I went back to prison to finish my 10 plus another 21 months Federal. During this time I was getting day for day good time which I got 6 months revoked. I ended up discharging my state time after 5 years and 6 months and going to a Federal prison for my 21 month sentence.  I got out of prison in 2002. Smoked weed every day all day.Did my 3 years supervised release buying piss clean drinks every week and smoking constantly.  Had my daughter in 05 and my son in 07. Got my B.A. in broadcast journalism and got a job as a local reporter. Had my green card, got pulled over for speeding in the news rig, had a 11 year old warrant, went to jail and was fired for the oz of herb in my company car. Got a couple editing jobs and landed my dream job. Was a camera man for an award winning Discovery Channel show. Traveled all over. Smoking and drinking like a rock star. Company AMEX. Met the woman of my dreams. Got fired for losing some footage. It wrecked me. Destroyed any self esteem I had. I bounced from one shitty labor job to the next. Spent the next 8 years hiding from my life. Staying stoned, drunk and miserable. Knowing that I did not deserve the love I was getting from the woman I was with. Got prescribed adderall and xanax. Got reacquainted with meth and smoked herb all day every day. I love her and her daughter. Our kids grew up together and they are brother and sisters. 
She left me in November.  I didn't see it coming at all. Told myself I was going to change. Quit the addies,xanys,meth and gambling.  Held onto the herbies with a dead man's grip. Found NA and a great group of people. Relapsed one night with meth. The next day I made the choice to quit. Everything.  I've been clean exactly 21 days. I have so many emotions right now. I am so very sad. I just went to see my dad and he didn't know me or my kids. It will be the last time I see him. I miss my ex so much it hurts. I am so sorry to her. I'm sorry I brought her with me on this o so shitty ride. And ya, fuck 2020 and covid. 
But I am thankful. I don't think I would have gotten clean without this pain. I needed it. I don't want it and I wish it would go away... but I am thankful for it. For the opportunity that I have right now to become the best me that I can be. I've jumped into NA with the same gusto that I jumped into dope. Have a sponsor and am working my first step. One minute at a time trying to become someone who I'm proud of. 
My life is shitty right now. I'm unemployed. About to be homeless. But I keep showing myself that I can do something I never thought possible. If I can stay clean through all this shit I can do anything.  Its going to take time. I have alot of problems I've ignored and let compound. But I so so so want to be a man that I am proud to be. Everything else will come with that. 
If you made it this dang far thanks for reading.  I've been a lurker on this sub for years. Wanted to thank you and make myself more accountable to myself and others. Again, thank you.",18,{'covid': 1},"{'label': 'NEGATIVE', 'score': 0.8475170135498047}"
