Date,URL,Title,Body,Score
2021-06-29 22:11:48,https://www.reddit.com/r/StopSpeeding/comments/oan7r9/its_like_a_death/,It’s Like a death,"The depression is for me, simply the sad realization that its not possible to keep going at that beautiful frantic pace. physically, tired for a bit. Dehydrated usually,; after long run it takes a while to convince your body that every morsel of food it receives wont be its last .Couple weeks you'll feel better. Stay busy, interact, do all the positive things suggested. Then the missing starts. The remembering. It's like learning your not just Clark Kent, your'e Superman. But earth is a no fly zone.
And you only notice the tweakers. I've met 70 yr old farmers overalls and chewing tobacco. Grandkids, tractors. Been using ( as a tool) 50 yrs. What you spot is the sheeple. Thats why the stigma. That word usually is sooo broad",6
2021-06-29 19:16:19,https://www.reddit.com/r/StopSpeeding/comments/oak1j8/day_35/,Day 35🤘,"So I’m 35 days clean from meth. Slowly but surely things are getting better. I cut out weed two days ago because I want to really focus on developing coping skills rather than being in a blazed fog. I started working last week, that’s going well so far, starting to feel like a productive member of society rather than a leech. I’m attending NA meetings, but haven’t been going as much as I was in the first month. I have my issues with the program and philosophy, but I do get something from meeting other addicts and hearing their stories. Plus it gives me something to do lol. It’s lonely in recovery but I put myself here. I pushed everyone away in my addiction and I’m reaping what I sowed. I love this community, it’s helped immensely. I just want you all to know that quitting that shit is tough and we are some bad motherfuckers. No matter if you’re actively using and wanting to quit, clean for a day or a decade, keep fighting the good fight. Be nice to each other but most importantly be nice to yourself. You are not whatever you did in active addiction, you’re a good person who made some bad choices and lost control to one of the most addictive substances on earth.",36
2021-06-29 18:42:38,https://www.reddit.com/r/StopSpeeding/comments/oaje4h/officially_relapsed_i_hope_this_is_the_last_time/,"Officially relapsed, I hope this is the last time","I feel so guilty it takes the fun out of what it used to be. It numbs my emotions, which is nice, but i feel so depressed and guilty and anxious. Honestly, I used to go to r/cocaine all the time to chat about it and its just a fucking sad subreddit. It makes me wanna stop that much more. 
I never wanted to be this person, when I was a kid I thought i'd be so successful and i wouldnt ever touch drugs. As an adult its all I can think about. It makes me feel like I can't be successful at anything. I hate the lying and the hiding but I am so embarrassed about it, i just shut down and shut everyone out. 
I really appreciate the support and good stuff in this subreddit. Its really helping me even though I've relapsed.",22
2021-06-29 17:59:38,https://www.reddit.com/r/StopSpeeding/comments/oaij31/im_a_month_and_a_half_off_adderall_and_wondered/,I’m a month and a half off adderall and wondered if my brain would continue to recover it’s dopamine receptors if I went back to using a small 20mg dose once a week or so?,"Look I know it’s a stupid idea but hypothetically could my brain continue to recover from a 75-85mg a day habit if I use like a 20mg day every now and then? Or does that stunt/revert the progress I’ve made. I’m talking solely on a physical level here. Please don’t say don’t you’ll relapse please, I realize all that",2
2021-06-29 16:17:37,https://www.reddit.com/r/StopSpeeding/comments/oagd1v/how_do_i_forgive_myself/,How do I forgive myself?,"I wasted two years of my life.. the amount of damage I inflicted on my family friends life in general…

It hurts man.. realizing it was really me the whole time destroying, blaming constantly blaming everyone but myself.. 

Damn. Two days sober( from IV meth )and this is the first time quitting that I’ve actually understand why the fuck I am quitting. It’s to grow the fuck up and quit causing pain. 

Just wanted to vent. Thanks for reading.",27
2021-06-29 15:25:32,https://v.redd.it/qt0lqlq199871,Stop speeding.... Keep driving,,0
2021-06-29 13:33:14,https://www.reddit.com/r/StopSpeeding/comments/oad38m/my_recovery_so_far/,My recovery so far,"Backstory, I did vyvanse heavy for 3 years(ages 15-18). 70mg script and abused it. Dropped outta school and played video games all day and sexted girls. I eventually quit, and the first year I was truly convinced I was retarded. I lost all my social skills due to drug abuse. Couldn't really function or drive. Still found myself staring in the mirror for some reason picking at my face even though I was clean. And every day felt like the first day until I said I needed help. I went to sober living. Then relapsed on Benzedrex because it was all I had. Ended up in rehab at 19. And now I'm out and in sober living again. Even though my roommates are understanding, they still think I'm slow. I stare at the wall, sleep all day, and basically do nothing at all. I keep getting fired from jobs for not being fast pace enough. And do nothing but chain smoke. And I'm just wondering when this pain will end. I then realized. If opioid addicts get put on maintenance meds then why can't a tweaker. So I tried some antidepressants and straterra and other crap. The only thing that's helped is Lamictal and Abilify. But even then I still have to have(not exaggerating) 4 bang energy drinks before I get outta bed. But even though this has been my life. I'm still trying. I can't dig the hole any deeper or shit will be even worse than it is right now and has been. Reality is a bitch, but I just wanted to share this to vent and maybe help someone know their not alone. Drugs will bring you to your rock bottom, but there's no where else to go but up. It might just take some time",16
2021-06-29 13:28:43,https://www.reddit.com/r/StopSpeeding/comments/oad014/quitting_meth/,Quitting meth,Today is day 1 of not using. Ive used meth everyday for 2 months. Smoking around .3 a day. The last week i have been using iv also. Feel ok now and have to work in a factory the rest of the week. I have .1 saved up so i plan on taking a hit or two if im super tired and cant wake up. I feel ok right now tho and havent used since last night. What you guys think? Have you ever quit and held down your job? Howd you do it?,3
2021-06-29 11:59:49,https://www.reddit.com/r/StopSpeeding/comments/oab7a8/this_isnt_sustainable/,This isn't sustainable.,"Hey everyone,

Prescribed Adderall for some years, but never took them very consistently because I am an opioid addict and know how detrimental adderall is.  

Well, I came off of opioids about 2 months ago, with a small 3 day relapse a month ago. I decided to use my meds as prescribed, 40-60mgs per day. Been on them for a couple of months. 

My fucking joints hurt, my skin has cystic acne, oily as hell, and my heart feels fucked all the time. I can't sustain this even though I'm sleeping and eating regularly. 

I'm in the worst health of my life and dreading the withdrawal, plus on top of that, it's been covering up the dreaded opioid withdrawals/PAWS, so I know when I jump off tomorrow, it is all going to come rushing back. No tapering, I'm just fucking done with it. I have scars from the acne that popped up from this garbage and pissed. 

I know it isn't anything comparable to what you guys are going through with big meth habits. I have no idea how people stay on this fucking poison. 

Couple of questions:

I am prescribed gabapentin, never take them consistently because fuck gaba withdrawals. Has anyone ever utilized this for adderall withdrawal? 

What can I expect from this withdrawal of taking 40-60mgs per day for 2 months? I have about 4 days to get through this, will I still be extremely fucked after this short time frame?

I have shrooms for microdosing and also LSD. When can I start utilizing these to help with the depression and withdrawal?

Any advice would be helpful. Thanks.",11
2021-06-29 03:08:25,https://www.reddit.com/r/StopSpeeding/comments/oa35gr/a_sad_realization/,A Sad Realization,"After 5 years of consistent cocaine use I've been clean for a little over a year.  I was proud of myself and thought I had my addiction under control.  But I recently realized that my battle has only begun.  I'm still very selfish and only think of things through my own personal lens.  I have a wife and two children that I absolutely adore.  But over the past year I've been lying to my wife after she asked me not to stay in contact with my former drug dealer, who happened to be one of my close friends growing up.  We texted maybe 3 times over the year, and it didn't have anything to do with drugs; but I still did that behind her back and rationalized it by saying ""we were friends before using, and I don't want to totally cut him out of my life"".  Besides this example, I find that I often put myself first and don't consider other people.  I thought I was a good dad (other people, including my wife said this too, so it's not totally made up), but I realized that part of being a good dad is being a good, considerate husband; and I have not been that.

Has anybody else noticed these tendencies within themselves?  If so, has anything helped you be more empathetic, considerate, and less selfish?  Thanks for your time in reading this.  This is my first time posting but long time lurking.",17
2021-06-29 02:22:04,https://www.reddit.com/r/StopSpeeding/comments/oa2kco/well_its_that_time/,Well. It’s that time.,"October will be 1 year of smoking if I don’t stop. And I don’t want to get to that. I am over it, I am so frail and am constantly fighting skin issues. My self esteem is shot, I don’t feel anything like myself. I feel gross, ashamed.... I’m ready but fkn scared. I’ve never withdrawn off anything before... I have a rx for seroquel that I haven’t been taking and upcoming psych appts  for bi polar disorder (they’re unaware of me using) 

Should I tell them? I don’t plan to.. and is there anything I can get from them that may help me thru the process? Anything OTC / homeopathic? ANY advice and tips are appreciated.",5
2021-06-28 23:33:39,https://www.reddit.com/r/StopSpeeding/comments/oa055e/fell_off_the_wagonagain/,Fell off the wagon...again,"    I finished the last of my stash after my best friend died of cancer. Wasn't related to his death at all, but he was always disapproving and worried of my use; especially when i picked it back up after promising him I'd stop, after our best friend died from OD (opiates).  
   I feel like a shitty friend to him for this, but truthfully he didnt hate me for it. He understood what I was going through, and kind of gave me a pass. I guess he figured that it was better than when I was using heroin. Honestly after i picked coke up again it was in the name of dropping H forever. Fuck that shit. 
    Well it didn't work out that way. I ended up falling into a near daily 4 month long binge. I blew so much money, put my body at risk and I wasnt myself. It helped me get my house chores done and my sex drive (which is non existent, im in my 20's and it sucks.) 
   My best friend passed and I finished my shit and didnt pick it up again; i went 3 months without using...until today. 
    Saw my junkie family member and she just offered me a bump and i just said yes before i could think ""probably shouldn't"" or ""i stopped"". One bump turned into like 4 lines (which honestly, isn't that much compared to my binge  use). 
    Totally fulfilled my craving I've had for *months*....i fucking missed that rush. Don't like the come down but, 4 lines really wasn't much of one since I took some xanax and did some dabs. 
    I don't want to go down that road again. I don't want to have to hide my problem from my SO. I don't want to deal with the comedowns again. I really don't...there's something fucking wrong with me. How, after everything that has happened can I be thinking about ""well maybe just a gram and thats it"".
   The *hell* is wrong with me?
*Why* can't I resist the urge? 
I almost even crave heroin again. Why would I want to make myself sick again? I wish I wasn't always craving drugs. I don't want to disrespect my late best friend, but I already contacted the connect. 
    Its like, I don't wanna go through the bad parts, but I REALLY love doing coke, and all my friends are dead anyways, so whose to stop me? And why does it even matter. 
    I know thats depressing but, i don't know. I cant handle all the grief, the stress of just life, my mental health being absolute garbage. Its just bullshit. 
Hopefully I can say no this time.

To add on; i just really dont feel like I will ever be motivated without it. I am so depressed. Im off my meds, but even when I was on them I still ended up using heroin, abusing xanax and ambien, and eventually cocaine. I dont know how, or if i will ever stop craving fucking myself up. I dont want to be here. Honestly, i am so scared to end up like so many of my friends that arent with me anymore. On the flip side, i dont care about myself that much.",24
2021-06-28 09:04:36,https://www.reddit.com/r/StopSpeeding/comments/o9juow/relapse_round_2/,Relapse: Round 2,"This is a long one here, sorry if it sounds a bit dodgy, still coming down

Hey y'all,

Last time I posted on here was during my last relapse and well, it happened again. Somehow, adderall found me on vacation out in a Minnesota town of 1,000 people. I was introduced to a good friend of my friends and his brother had adderall. In my drunken state, as soon as he mentioned that word the gears started turning again. He is not aware of my past of addiction so he didn't hesitate to give me two. After it hit me 30 minutes later, I literally started salivating for more. I asked, he said no, so while he wasn't looking I grabbed the pill bottle, took 2 more, and pocketed 2 for later. 

&#x200B;

I don't understand myself, and I don't understand this. How can my mind's barriers against addiction be instantly broken down by someone SAYING the word adderall?? That feeling I got from taking the adderall initially was other worldly. I felt like I was back to my old, happy and giddy self again who could talk to anyone or make anyone laugh. I felt like a god compared to what I have been feeling like these past few months I need this comedown to whoop my ass again so I can scare myself straight into not doing it again, and I am afraid it wont. I just stole from a guy I barely knew and it was medication someone actually needed. I just don't even know what to say for myself at this point. I don't feel like I have the ability to create a life that is without drugs and alcohol anymore. Sober life is fucking miserable 98% of the time. Everything I do in my life feels half-assed even though that's all the energy I have to do it. I don't care about anything when I'm sober. I am so used to self sabotage that I refuse to do anything helpful to help me move forward in life. Taking this adderall was the only thing that could get my head above the dark and stormy waters that is my life. I never ever steal from anyone yet I betrayed his trust and snuck a few more. I don't know what to do. I guess I have to face the music which is the horrid adderall comedown in a few hours. 

Stay safe everyone, thanks for reading.

Aiboh",9
2021-06-28 06:04:07,https://www.reddit.com/r/StopSpeeding/comments/o9h7uv/literally_everytime_i_do_adderall_it_feels/,Literally everytime i do adderall it feels distinctly bad. Why do i want to do it everytime i feel kinda good anyways?,"Literally as soon as i pop anywhere between 5-20mg ir i feel instantly bad and frightened and HAVE to smoke immedietely to get some sense of control over my nerves and then need kratom (red vein) asap to calm anxiety at which point the adderall feels totally cancelled out. And you may think i am an idiot after i say this, which is fair because i am, but still i want vry badly to pop adderall everytime i feel sortof good despite this. had a few absolutely majestic experiences when i first tried it and ive been seeking that since. look, im not compleeeetely stupid, ik this is cliché but heres my question: what about the first few times made it different? ive tried the supplementation route, replenishing b vitamins and dopamine and alllllll that jazz and still get the same bad effects. ive tried taking downers PRIOR to adderall- doesnt work, still is unpleasant. why do i feel like this, and what could replace this feeling or make this craving go away? if im a mouse and the cheese is infact attainable, then ofc id rather get the cheese consequences be damned. but if im a mouse who seeks unattainable cheese then how can i accept the cheese i seek is a delirious idealistic daydream?",8
2021-06-28 02:42:17,https://www.reddit.com/r/StopSpeeding/comments/o9eqb5/weight_gain_is_triggering_former_ed_issues_over/,Weight gain is triggering former ED issues - Over 100 days clean,"Hello, I just need to vent. When I was 14 I hit 133lbs (60kg) . and it developed into fasting, purging, and spit chewing. I have not thrown up since I was 24 because even if I did it seldomly (2x a week) x (10 years) would mean I have purged over 1000 times. I've been addicted to uppers since I was 18: street amphetamine, ritalin, concerta, modafinil and for the last two years meth - Over 100 days clean now, but between quitting uppers and being put on sertraline and Wellbutrin. I've gained 38lbs (17kg) hitting that 133, totally messing with my head, I need someone to tell me it's ok. I'm going to the gym 4h a week. But this is either making me want to throw up or rummage to get all the ritalin and concerta I have left in my storage room.

EDIT: I forgot to mention I'm a 5'2 (156cm) female, just to put it in perspective.",18
2021-06-27 12:10:35,https://www.reddit.com/r/StopSpeeding/comments/o902kj/stop_cravings/,Stop Cravings,"Jut interested to know if anyone has any advice to curb the cravings for speed, really trying to stay off. Thank You.",15
2021-06-27 05:07:06,https://www.reddit.com/r/StopSpeeding/comments/o8tj3q/dealing_with_drunk_judgemental_douchebags/,"dealing with drunk, judgemental douchebags","Went to the bars with some friends in town tonight. Guy kept pointing to me like im some square kid with nothing but lollipos and sunshine to my name. MOTHER FUCKER. I was so upset. All night people asking if im too young to be out with my friends. Assuming my life is perfect because I dressed up nice. I worked really hard to get off speed and get a job. 

I know its petty, but it really pisses me off when im off drugs and people assume I'm ""not hard"" or some shit. I hate looking like a teenager. Everyone thinks I'm a joke and I only get mild human respect when I mention sobriety. 

Maybe it's not good to say in this sub but I wanna be king. Fuck these guys. I'm very strong willed and very determined. I just wanna feel like my hard work is paying off, man. This is the shit that used to make me relapse. Not today. I'm playing the long game. I'm gonna show this asshole that I work for my shit. 

I'll see you again mother fucker. You won't be laughing at me next time you look me in the eyes and shake my hand. 

Anyways, thanks for reading, gang. Keep up the hard work everybody.",14
2021-06-27 02:49:27,https://www.reddit.com/r/StopSpeeding/comments/o8ru7y/drug_use_shnssi_and_ssi/,Drug Use ~ SH/NSSI and SSI,"Have you ever used your Drug of choice for the purposes of self harm, non suicidal self Injury or suicidal self injury

[View Poll](https://www.reddit.com/poll/o8ru7y)",4
2021-06-27 00:01:36,https://www.reddit.com/r/StopSpeeding/comments/o8poet/went_to_the_mall_today_to_shop_for_new_clothes/,Went to the mall today to shop for new clothes,"It's been years since I bought new clothes. Obviously my adderall was more important and hell my 4 shirts, a couple of shorts, and 7 socks got me through just fine.

But I quit and I look like a bum and I deserve to look good and have a nice wardrobe. So to the mall I go.

But I have no money. Really nothing. I knew that I couldn't bring anything home.

But just going in and trying on these crisp, trendy new clothes, and seeing how good I was wearing them did so much. For years I've looked in the mirror seeing the same sad dude in the same raggedy ass clothes looking back at me. 

I wasn't seeing new clothes that I could buy if I keep it up,  I was seeing a new me, a better looking me. And just contemplating which clothes I like tie most made me realize that I have the freedom of choice. In a few weeks I can buy those clothes. Or instead buy new bedding. Hell can go hiking in the fucking rocky mountains and enjoy the beauty of nature before fall.

I can do all of those things and millions more, or I can use. I'm Dumbfounded at how I forgot that I can choose to do so many things and that I have a say in what my life experiences will be.

These are such obvious simple things that people know and do all the time just to enjoy life. Duh, that's living - wanting something, working to get it, getting it,  experiencing it for what it is, and then move on to whatever you want next  

Here I am with this one dimensional inner struggle between ""get some pills man you need it,"" and ""no I can't keep wasting everything on binges and crashes""

All I saw was, either I use, or i don't use. 

Guys. We can use, or we can literally do whatever the fuck else we want. We can use, or we can go on vacation. We can use, or we can meet new friends. We can use, or we can learn a new skill. We can use, or we can have a good love life. We can use, or we can start a family. We can use, or we can get the world. 

It's almost laughable that I forgot that I want stuff other than drugs. I don't even want the drugs. And I sure as fuck don't want the hookers whose ads I look up for hours on ent l end. 

I have experiences and likes and humor and wisdom and empathy and love and a fucking lust for life and connection to people and society and our fucking planet. And I can get it, it' all just there for us right in front of our noses. 

Maybe tomorrow I'll go to a car dealership and test drive an Audi, or perhaps an open house. It's gotta have a pool though, I've always wanted a pool.",31
2021-06-26 20:00:52,https://www.reddit.com/r/StopSpeeding/comments/o8m2qy/relapse_so_upset/,Relapse - So upset,"So I’ve been clean for over a year. (Meth IV). The 2020 relapse lasted 4 months or so. 

Prior to that I’ve had years I didn’t use at all, years I’ve used once or twice and entire years on it. I’m 32 started when I was 14. 

I’ve been really killing it this year. Top grades at University, Work is good, family is good and I’m planning on buying a house soon. 

I have schizophrenia, BPD and CPTSD. Which are all good.

I also quit smoking cigarettes and alcohol about 4 months ago. 

So I looked at the medication (neuroleptics/antipsychotics and benzos). I cut them down and got off them, but about 4 weeks later I was in a full blown psychotic state and extremely suicidal. 

I got back on my meds 2 weeks ago. But in the meantime to cope I’m back on cigarettes and alcohol which I’m devastated at myself about. 

Now I’m still not right. Meds take about 6 weeks to work. Living in psychosis and suicdality until then.  

Then last night at used Meth. It was so horrific I felt like I was gonna have a stroke, I didn’t get happy high at all. It was just so shit. With psychotic features and I feel like shit. 

And here’s a he kicker, Now I wanna just do it again cause I’m angry at myself and hope I do have a fatal stroke or at the very least wanna punish myself. I am great at going on paths of self destructions when I’m in these states. 

I just wanna get put into a coma until my meds work again Btw. I did say to my counsellor that I would rather die  then take meth again and that is a real issue for me. 

Any tips",12
2021-06-26 18:05:18,https://www.reddit.com/r/StopSpeeding/comments/o8k43t/sos_i_need_help_asap/,SOS I NEED HELP ASAP,Am currently 19 months clean and I’m about to throw it all down the drain cuz a bunch of negative shit all happened at the same time... my bf and I have hardly been talking seemingly out of nowhere and I’ve had to cut off all my using friends so I’ve been super isolated and I feel like nobody loves me and I’d only be hurting myself at this point so why not.... feeling major self destructive and I pretty much think it some ppl gave me some good reasons why I shouldn’t do it it might stop me before it’s too late.. It’s just a phone call away at this point,13
