Date,URL,Title,Body,Score,COVID-19 Mentions,Sentiment
2021-10-30 16:35:09,https://www.reddit.com/r/StopSpeeding/comments/qja06w/when_does_your_brain_start_to_recover_from_meth/,When does your brain start to recover from Meth use? Need some hope right now. Been clean for a month and a half,Doesn't seem like anything improving.,24,{},"{'label': 'negative', 'score': 0.77751815}"
2021-10-30 15:40:37,https://www.reddit.com/r/StopSpeeding/comments/qj8x51/needing_support/,Needing support,"I’m truly at my wit’s end and I could use some support. As of last night I was scouring this and other groups for some information and I’m a bit overwhelmed. A little about me… I’m going to be 50 this year and I’ve been addicted to some sort of stimulant for about 25 years. The first 10 it was meth, smoking around an 8-ball a day. I got clean, stayed that way for about 4 years. My daughter was prescribed Ritalin and the doctor suggested it would help me too, I used it relatively as prescribed for about a year before I really went full force. I started getting it off the street in addition to my prescription and almost lost my job. I stayed off about a year and got back on so for about the last 10 years we’ll say I’ve gone back and forth between stages of crazy abuse and more controlled abuse. Currently I have a prescription for adderall, 90 10mg pills monthly but usually take most of my daughters Ritalin prescription as well. 

I’m sure you’ve heard all this before…
When I try to stop I don’t last more than time to get my next refill. I’m the only one supporting my family and I have my own business and I’ll be starting a new one next week. This last week of work really did me in. I have a little more to get done this weekend. 

I can’t live like this anymore. I’m letting down my family, my clients and as I was laying there trying to rest last night, all of the denial I’ve been fooling myself with became apparent. I really want to give this up. For what it’s worth, I do have ADHD. I have a job in the community that really precludes me from getting help publicly, although I’m starting to realize I can’t use that as an excuse. I do have to support my family financially though. I can possibly take a week off but I’m really going to need a plan that can help me get out of bed and at least do the minimum for awhile. 

I probably have about 6 pills left ( btw, I crush and snort them) this time my prescription lasted less than a week. I’ll stay up for days on end and really have no control over my use. Stress makes it worse. 

Unfortunately most of the time, my abuse has been rewarded. At least professionally.  My marriage is on the rocks… we’re currently separated and I’m not sure if I use more because I’m unhappy in my marriage or the other way around. My spouse enables a lot of my behavior and would take me back in a heartbeat. I feel guilty about it, but so far not guilty enough to change. 

I posted in the /stackadvice group to get support with supplements. I need some emotional support as well. 💔",13,{},"{'label': 'negative', 'score': 0.5531332}"
2021-10-30 13:14:28,https://www.reddit.com/r/StopSpeeding/comments/qj5ydx/im_thinking_of_stopping/,I’m thinking of stopping.,"I’m wanting to take a break at least but I don’t know what it’s going to be like. Like I don’t want to get so depressed or be so tired all the time. Can someone explain the time line of what to expect…
I’ve used daily for 6mths about .2 a day.",13,{},"{'label': 'negative', 'score': 0.79804206}"
2021-10-30 12:45:38,https://www.reddit.com/r/StopSpeeding/comments/qj5cyl/adhd_and_meds_help/,Adhd and meds help,"Hi I really want some advice. I was recently diagnosed with ADHD, and prescribed stimulant medication. 
I genuinely don't know how to feel about it. I've been doing all this research but articles don't help I need to hear from real people's experiences. I'm scared I'm making the wrong decisions or that meds aren't for me, as I have an obsessive personality I'm scared I'll become addicted. 

I'm on a 30mg dose of Elvanse, for about nearly 2 months. I honestly don't know if it works or even makes a difference? Somedays I'm like yeah I can tell the difference  and then others I just don't. When I didn't take it one day I was just lethargic and couldn't find the motivation to do the things I wanted to do, or do the chores that needed to be done. But sometimes I feel too jittery when I take them. But I've felt those ways long before I was even diagnosed. So to me, I just can't tell? 

I'm scared I'll become tolerant and ill suffer addiction and side effects. I want to increase my dose to see if I feel a difference, but I'm scared I'll become tolerant or dependant. 

I just feel hopeless. I know its not the same as street drugs but the properties are still the same. 

Can anyone tell me the difference or what it feels like to be on a too high dose? Or to addicted to it? Or what euphoria feels like? Or what it feels to be on a stimulant for someone who isn't diagnosed with adhd? 

I've never taken speed before or any drug for that matter so I have no base line to compare.",3,{},"{'label': 'negative', 'score': 0.7936067}"
2021-10-30 09:24:51,https://www.reddit.com/r/StopSpeeding/comments/qj1fne/day_25_of_being_clean_but_the_extremely_intense/,Day 25 of being clean.. But the extremely Intense cravings are coming back,"The cravings weren't quite as bad for a few days,  but now they are back and with a vengence. I thought I was supposed to keep feeling better,  not worse?",8,{},"{'label': 'negative', 'score': 0.5129222}"
2021-10-30 08:22:40,https://www.reddit.com/r/StopSpeeding/comments/qj0e6i/how_do_yous_cope_with_the_drop_in_libido_that/,How do yous cope with the drop in libido that comes with abstinence?,"I'm at the 1 week mark and my libido shows no signs of returning. The thing is I would say I have more interest in sex than the average person, which leads to this weird mismatch where I have no physical desire to have sexual activity but I still kind of want to - even if it's just a quick wank and nothing more. 

So is there anything to do other than wait it out? Maybe there are some supplements that are particularly helpful in restoring libido? 

This has been a problem for me for a while now, it's been a cause of relapses around the 1 week mark many times - and unfortunately with my tolerance it's not like I can take just a little in a minirelapse to get off, it has to be at least half a gram bare minimum at which point I don't think that counts as a minirelapse anymore, and it's clearly harmful in terms of resetting the withdrawal clock etc.",5,{},"{'label': 'negative', 'score': 0.7581252}"
2021-10-30 03:42:59,https://www.reddit.com/r/StopSpeeding/comments/qiwkum/what_do_you_do_when_you_want_to_use/,What do you do when you want to use?,"I feel like I don’t even try to stop myself sometimes cause it seems like a good idea to get high. Or my brain just goes into autopilot and there’s not really a thought process besides finding adderall. I gotta stop though it’s messing up my whole life again. I was clean for like 6 or 7 months but over the past few months I started slipping and surprise it got bad again. 

I have such a lack of control over this drug and everything I want goes out the window for it. How do you interrupt your brain or distract yourself when the urges are so convincing? I don’t want it to get as bad as it used to be before I stop again. But shit I love getting geeked and it feels like I’ll never feel ready to let that go.",14,{},"{'label': 'negative', 'score': 0.8718416}"
2021-10-30 00:48:24,https://www.reddit.com/r/StopSpeeding/comments/qiu82x/living_at_home_at_26_and_feel_completely_lost/,"Living at home at 26 and feel completely lost, polydrug... help me","As title says, im polydrug addict living at home and working 40 hrs a week.

Parents are super needy and controlling, Emotionally abusive at times. Past childhood trauma from them also comes into play occasionally. I work a full time job but outside of that I just do any and all drugs as much as possible.

I feel so fucking lost, I legit hate everything and have no purpose in life. I feel trapped in my job and home, hating every second of every day. I work a shitty job and then come home and have to deal with shitty people that just annoy the fuck out of me. Taking drugs obviously doesnt solve anything and is actively making everything worse tenfold. I’m slowly killing myself and I keep waiting for the day when I wake up and suddenly I know what to do with my life.

I have decent savings and could move out but I have no vehicle of my own (parents let me use “my” car to go to work, its fully theirs tho). I also have looked at doing so but constantly get manipulated emotionally by them. I have absolutely no fucking life and virtually no friends in any capacity. 

I’ve destroyed my life on purpose and I dont want to stop. I want to die yet I dont want to kill myself, make sense? All these drugs, whether its meth or weed or pcp or heroin or whatever barely even do shit all for me. It doesnt even provide the escape I so desperately seek. 

I’m fully capable of turning my life around but I have no direction, no purpose, and no idea what the fuck the point of living is.

I want to quit my job and leave my parents and start fresh... I know thats what I need most. I can’t do this shit anymore in this environment and situation. Fuck",22,{},"{'label': 'negative', 'score': 0.9758373}"
2021-10-29 21:30:40,https://www.reddit.com/r/StopSpeeding/comments/qir4pl/excessive_sweating_and_dyspnea_postwithdrawal/,Excessive sweating and dyspnea post-withdrawal,"So I'm 10 days free of mephedrone (or mephedrone-like substances) now. Heavy use including IV for a few months. I feel ill. I sweat excessively with even minor physical effort, breathing is weird/slightly hard sometimes (dyspnea), I feel weak. The weakness is slowly improving, the sweating/dyspnea situation not so much.

Can anyone relate? Does it go away with time?

Note I don't think it's just in my mind. I feel surprisingly well psychologically now (the first few days were hell though), even the cravings have almost subsided by now.",2,{},"{'label': 'positive', 'score': 0.6330426}"
2021-10-29 18:12:21,https://www.reddit.com/r/StopSpeeding/comments/qinpdr/guys_i_am_taking_courses_for_coding_i_wanna/,"Guys, I am taking courses for coding. I wanna become a software engineer, AND I wanna do it without addy. Words of encouragement are appreciated :)",,20,{},"{'label': 'positive', 'score': 0.9226652}"
2021-10-29 15:22:59,https://www.reddit.com/r/StopSpeeding/comments/qikb7u/i_have_a_cocaine_and_porn_addiction_and_it_is/,I have a cocaine and porn addiction and it is ruining my life.,"I don't know how to stop, this shit is ruining me. I'm going to rehab Monday for 3 months, and I'm praying this helps me stop. For those who overcame stims and porn, what advice can you give?",28,{},"{'label': 'negative', 'score': 0.9390743}"
2021-10-29 11:38:48,https://www.reddit.com/r/StopSpeeding/comments/qifl6y/its_all_coming_back_feeling_like_myself/,It’s all coming back… feeling like myself,"I’m starting to feel those sparks of who I used to be before the amphetamine. Have been way more social, and just recently aced my chem exam- highest score in the school- perfect exam. They said I’d flunk out if I went off my meds freshmen year of college. Proving them wrong 

“You may be whatever you resolve to be.” -Stonewall Jackson

Med school here I come.",39,{},"{'label': 'positive', 'score': 0.6373549}"
2021-10-29 08:37:22,https://www.reddit.com/r/StopSpeeding/comments/qibutd/sobriety_coaching_through_discord/,Sobriety coaching through Discord,"Hey everyone. We in the mod team on our Discord server have been discussing the idea of having a mentor/sobriety buddy program, somewhat similar to the support an NA/AA sponsor would give to their sponsorees . This mentor would be someone a recovering addict could call/message whenever they feel the urge to use or relapse but want to be talked out of it, or during stressful times, etc. It could potentially involve contact outside of Discord at the discretion of the mentor and mentoree. Mentors will be carefully chosen, be expected to follow an ethical code of conduct in their relationship with mentorees and require at least one year of clean time. Would anyone here be interested in either being a mentor or having a mentor to message during difficult times, if we had such a program here? 

This would only be for quitting stimulants. Quitting other drugs would also be great, but not necessarily required by the program.

Also, this would not involve working the 12 steps or anything like that. This is our own thing we're considering doing here.

If you are indeed interested, please state whether you would be interested in being a mentor, a mentoree, or just interested in having the program in general (or not interested at all.)

[View Poll](https://www.reddit.com/poll/qibutd)",2,{},"{'label': 'neutral', 'score': 0.5816103}"
2021-10-29 01:35:14,https://www.reddit.com/r/StopSpeeding/comments/qi5oip/alcohol_isnt_the_same_anymore/,Alcohol isn't the same anymore,"I'm not imagining this...

Before stim abuse started a single pint of beer or a glass of wine used to give me a gentle buzz always an improved mood even if subtle. More social.

Now even though sober and in a good mood a single glass of wine or pint of beer will cause me to shut down and feel sort of agitated and discontent. It's a sharp change in personality that's hard to hide.

It seems my brain overcompensates for any chemical stimulation now.

Is this relatable?",18,{},"{'label': 'negative', 'score': 0.66270846}"
2021-10-29 00:34:53,https://i.redd.it/oyay7g9fibw71.jpg,3 weeks. Let’s go boys and girls! I love food and eating,,8,{},"{'label': 'positive', 'score': 0.99032724}"
2021-10-28 23:21:20,https://www.reddit.com/r/StopSpeeding/comments/qi3jh1/is_throwing_up_a_sign_of_too_much_use/,Is throwing up a sign of too much use?,"I have been throwing up every day for over a week, any time I eat anything. I also have been using crack heavily, more than normal. At first I thought it was withdrawal causing me to throw up if I didn’t smoke that day but now I’m just throwing up no matter what. I’m trying to quit but having the worst time at it. Have I fucked up my stomach or something?",4,{},"{'label': 'negative', 'score': 0.9428373}"
2021-10-28 20:18:42,https://i.redd.it/99jepgvp8aw71.jpg,i’m two weeks clean from my 2 month long relapse and i feel better than ever! don’t give up we can do this,,48,{},"{'label': 'positive', 'score': 0.9745008}"
2021-10-28 16:32:41,https://www.reddit.com/r/StopSpeeding/comments/qhvx2c/day_24_i_went_to_the_gym_this_morning_and_forgot/,"Day 24.. I went to the gym this morning and forgot how much I love lifting, trying to restyle my life again","It was a great start to the day.  Got up at 4am,  went to gym at 5am,  got a coffee and a cigarette (lol don't judge) on the way back home and idk now I just feel so ready for the day",19,{},"{'label': 'positive', 'score': 0.9839793}"
2021-10-28 11:20:42,https://www.reddit.com/r/StopSpeeding/comments/qhpe7p/virtual_sponsor/,Virtual Sponsor?,I’m three days into 90 meetings in 90 days. I live in a very rural area and the nearest local meeting is 2 hours away so I’ve been doing virtual meetings. It’s always a different group of people at a different time just. I was clean for 8 years after rehab and moved to a new state and life events happened and I’ve let myself relapse. I know I need help and a sponsor to guide me back through the steps would help me but it’s hard for me to connect personally in a virtual setting does anyone have advice,5,{},"{'label': 'neutral', 'score': 0.47791132}"
2021-10-28 10:26:16,https://www.reddit.com/r/StopSpeeding/comments/qho8nm/nearly_relapsed/,Nearly Relapsed...,"I've been clean for 10 days, which feels like an achievement for me. 

Earlier on tonight I was relaxing in my bedroom when I received a message from a good friend that I used to partake in stims with. He was having a really rough day and wanted me to go over to his place to talk to him. He also wanted me to bring some alcohol. I knew that going over to his place would result in me relapsing, so I told him I didn't want to go over due to me being sober. He understood and the conversation ended there.

Since then I've been having cravings. Instead of caving in to the cravings, I've been playing Skyrim and decided to post here.

Thanks for reading.",26,{},"{'label': 'positive', 'score': 0.5386711}"
2021-10-28 03:09:10,https://www.reddit.com/r/StopSpeeding/comments/qhhajh/at_the_point_of_no_return/,At the point of no return,"If started off so innocent. Just something fun for the weekends and I still can be normal the rest of the week until next time I get to use again. Maybe I over used it. Maybe they weren't exaggerating when they said that meth would take over my mind completely. I don't know who I am anymore. I'm scared and cautious unreasonably so at times. I can't do this much longer. i don't know how to find help without burning bridges. People think I'm sober): so when I say I'm struggling they'll know how much of a liar I have been, just to be able to pretend I'm ok.  I really wish there was an easier way to quit 

Right now I'm starting to really increase my use. My mental health is failing me. I need to stop ): if someone could give input or advice that would be appreciat",25,{},"{'label': 'negative', 'score': 0.8412569}"
2021-10-27 13:13:16,https://www.reddit.com/r/StopSpeeding/comments/qh1jcw/our_stopspeeding_discord_server_has_2/,Our StopSpeeding Discord server has 2 recovery-focused meetings a week now.,"Hey former speeders, if you're interested in attending a recovery meeting all about quitting stimulants, please join our StopSpeeding Discord, and the meetings are every Wednesday at 3pm EST (GMT -4) and every Sunday at 12pm EST in the 'recovery meeting' voice chat channel.

&#x200B;

All are welcome to attend, clean or not, although we prefer you not share too much if you're currently intoxicated.

The meetings are being lead by someone who was addicted to Adderall for 15 years but quit, and now he wants to help others learn how to quit stims as well. He's even writing a book about it.

&#x200B;

These are not NA meetings. It's our own thing we're experimenting with, and so far everyone has been really satisfied with how the meetings have been going. They are really laid back and chill. It's a great way to get to know everyone there too, if you want to spend some time on the Discord.

&#x200B;

As with the subreddit, our Discord server has several simple rules we expect all members to follow.

&#x200B;

Hope to see you at the meetings!",16,{},"{'label': 'positive', 'score': 0.916637}"
2021-10-27 12:47:00,https://www.reddit.com/r/StopSpeeding/comments/qh0yq6/11_months_clean_from_adderall_check_in/,11 MONTHS clean from Adderall (check in),"10-27-2021 
ELEVEN MONTHS off Adderall

Yesterday was a very positive day and it ended with the notification that I am 11 months clean from Adderall.

I’m very vulnerable and emotional.
Mornings are very difficult. I wake up missing my GF who out of nowhere cut me out of her life (I researched and I strongly believe she has Borderline Personality Disorder).

I want to hear from her so bad. I don’t know how I became so emotionally dependent on this person. 

For these eleven months I have been unmotivated and undriven in my creative work and my career. People have been contacting me to start projects 💵 and I’m slowly starting again but like I mentioned earlier, getting my day started takes forever.

I took a part time job at Target to force myself out of the house and to be around people and that has helped immensely with alleviating the strong feelings of loneliness and depression.

I don’t necessarily crave Adderall, I just crave the feeling of feeling excited about life. I guess for 5 years I was artificially creating that feeling by popping an Adderall immediately upon waking up.

I’ve had a decent amount of moments where I’m fully functional and social without drugs so that is positive.

I have a LOT of anxiety in my stomach constantly and I attribute that to being completely confused about my future (career, relationship, finances -- etc).

Also, This month I passed the TWO YEAR mark of quitting my nasty addiction to Kratom.

I think I’m going to start journaling again because it seems to help my mood when I get all of these thoughts out of my head.

As you can probably tell by my writing, my mind is jumping all over the place.

I am looking forward to being completely sober for the holidays. I have PTSD about Thanksgiving because that is my sober anniversary for Adderall and that was my rock bottom. I really miss my best friend / GF but I am strong because I have made it this far with basically only the verbal support from my parents. These past eleven months have been a completely awful emotional and physical prison sentence.

I need to get the unstoppable drive back that I had when taking Adderall. One thing is for sure though, I do not miss being stuck in a stimulated state (i.e. cracked out). Nothing is permanent and things will change for the better.

I have to get ready for work.I would love to hear any responses and to know that there are people out there. ✌️",46,{},"{'label': 'neutral', 'score': 0.40704155}"
2021-10-27 08:34:50,https://www.reddit.com/r/StopSpeeding/comments/qgvo66/cravings_getting_really_bad_again/,Cravings getting really bad again,"So I had a couple days that were OK,  but the cravings are coming back really bad.  I keeping thinking that once I get my own place I'll just start using again and go hard because I'm most likely going to lose my license anyway (I got drug tested by a police officer recently and it was positive). I keep thinking of well,  I'll have to get a taxi to work anyway so I'm safe to use then.  I keep thinking of I'll just do it once or twice. I keep forgetting how bad it is and my brain is trying to tell me it's OK and it's fine and it's totally normal to snort and smoke meth. I'm getting bad flash backs of be using again. They take me right back to the moment and god my whole body aches for it.",8,{},"{'label': 'negative', 'score': 0.78095436}"
2021-10-27 07:27:04,https://www.reddit.com/gallery/qguhjd,"Numbness, burning and white/grey toes, how serious do you think this is? Anyone else experience this? Daily meth user for 2.5 years. I’m going to the doctor and to rehab this week, I’m ready to get better. Wish me luck 👍🏼",,12,{},"{'label': 'neutral', 'score': 0.4308018}"
2021-10-26 22:23:30,https://www.reddit.com/r/StopSpeeding/comments/qgmclm/chronic_cardiovascular_complications_from/,Chronic Cardiovascular complications from multiple years of stimulant abuse? No longer able to take medication as prescribed?,"At the end of my use I found myself taking an entire script of Methyhenidate, Vyvanse in 2-3 days/nights. I would be able to take close to a half gram or so in one night. Doses were mixed with Kratom and Cannabis mostly. Towards the end I started to notice with Concerta that I would get bad chest pains associated and eventually shortness of breath and palpitations. I figured that I was simply taking wayyyy to much ( I was, obvs) and if I cut down or simply took the dose prescribed ( I have horrible terrible ADHD) the negative cardiovascular effects would subside. This was not the case. At the end I was experiencing the same negative chest pains that I would after binging a gram in two nights, just from taking 10mg or so. I then thought well maybe the Vyvanse would not have the same effect if taken as directed.. This was not the case. 10-20 mgs of Vyvanse had the same effect. Same with Focalin. These are substances that I took and abused for 10 years in very high dosages and dangerous combinations, with zero to little noticeable immediate adverse reactions. Now any stimulant I take even in the smallest dose prescribed I get very cardiovascular issues. I am waiting on  seeing the cardiologist next month. Chest ray and EKG came back with zero issues. I am convinced that I did some type of irreversible damage. I understand that anxiety can cause this and very significantly but this is 100% different. The second I would take a dose it would start and then for a few days after chest pains would continue. After a few days off they would subside.      


Does anyone have any experience with this? I understand no one can diagnose anything over the internet but any wisdom would be amazing. I'm not looking to hear that I'm fine or anything specific, I just want to get to the bottom of this, whatever the truth may be.  


 If nothing else let this be a warning, please. I injected meth for many years and abused all the stims there were with zero effects. Then all of a sudden after a binge on methlyphenidate, it all changed. I really need to be on this medication and when I finally started taking it normally my life changed for the best and my ADHD was finally being addressed. Now I no longer have the option of taking a stimulant. I never thought anything like this could happen to me, nor did I have any awareness this could happen to anyone really. But here we are. I will update after the cardiologist. Thanks for reading if you have somehow managed to get through this wall of text.",8,{},"{'label': 'negative', 'score': 0.714829}"
