Date,URL,Title,Body,Score,COVID-19 Mentions,Sentiment
2021-01-30 21:07:58,https://www.reddit.com/r/StopSpeeding/comments/l91wmn/it_finally_happened_i_feel_like_im_in_hell/,It finally happened. I feel like I'm in hell.," I have been a functional meth addict for quite some time. but, my cover finally got blown. My boss gave me a week off, and said when I return I gotta take a piss test. Pass, keep job. Fail, and ya know, no job. Meth gave me the strength to face the world. Sobriety is hell, but I have to keep this job for my Wife and little girl. I'm suffering so bad and this is only day 1. Any tips on how to deal with the agonizing depression? I feel like I'm in mourning. I love meth. I love who I am on meth. I hate who I am without it, and I'll never have it again. I will never feel happiness again.",34,{},"{'label': 'NEGATIVE', 'score': 0.9928955435752869}"
2021-01-30 17:11:16,https://www.reddit.com/r/StopSpeeding/comments/l8x40w/how_is_everyones_teeth_ive_spent_a_lot_on_getting/,How is everyone’s teeth? I’ve spent A LOT on getting back just a regular looking smile.,,6,{},"{'label': 'NEGATIVE', 'score': 0.9948267340660095}"
2021-01-30 16:21:49,https://www.reddit.com/r/StopSpeeding/comments/l8w1r2/oh_my_sweet_little_orange_pill/,Oh my sweet little orange pill.,"Thank you for blessing me with all the memories, showing me what it felt like to feel better about myself than I ever knew possible, and making every day mundane tasks seem like a blast..for awhile. On that note, fuck you for destroying my meaningful relationships, making me feel worse than I have ever felt about myself, and making every day mundane tasks seem harder than imaginable. 
We shared a solid three years together, first two were relatively fun actually. You were always there for me to cheer me up. Until I couldn't find you for a day or two, my heart would miss you so much I had to call into work and stay in bed all day. Truly, that last year and a half you were so needy you consumed every waking moment I wasn't at work. Even then, I only worked to be able to support your expenses. Eventually I had to even start stealing from my amazing family..but for some reason I loved you enough that it was somehow justified. We were toxic, even though I didn't love you anymore I didn't wanna live without you. I was scared how lonely and broken that would leave me because I was already both. Eventually, my very best friend called me one morning and opened my eyes. She gave it to me straight and told me to get away from you for good. I guess maybe I was so embarrassed because for the first time ever, someone called me out on it. I was naive for ever thinking people didn't know I was trapped. I went from overweight to rocking body in less than 8 months and everyone knows I wasn't stepping in a gym. I did it for you, correction I did it with you. Doesn't really matter, that phone call somehow gave me the strength to call my work and tell them I was gonna need some time off. I was about to get out of them most draining relationship I've ever been in. I was foolish for thinking I could do it in month. I didn't expect you to take my will to live for the next year and a half though. I didn't even know it was possible to sleep 17-20 hours a day for months on end. My whole family was constantly worried that I was actually going to end up killing myself over you.. Not that it didn't sound good on a few occasions. Luckily somewhere deep down I was able to pull the only little bit of strength I had to fight. I couldn't hold down a job, but I really tried. I would do for a couple days, probably the excitement to tell my family I was making steps in the right direction. Then it would fade away and I couldn't pull myself to get showered and ready for the day. I couldn't even look in a mirror, I was so disgusted with myself. Please don't be fooled and think that the thought didn't cross my mind that despite all the damage and pain you had already caused me It was easier to just go crawling back. Fortunately, I had no money. I couldn't even steal the money for you because I had already drained from my loved ones. I spent tens of thousands of dollars on you. I didn't pay my little car payment for you, and I loved that car. I finally was able to get out of bed for an entire day, but I didn't even know that it was possible to be that bored. I didn't have anyone to do anything with anyways. I tried eating, it worked for awhile. Enough to make me double in weight but that got old too. The only thing that helped break the cycle was alcohol. Which was cheaper but much worse. I was an angry drunk. The alcohol did hold me over long enough that my family forced me to go to rehab for two weeks. That was the longest two weeks of my life. I couldn't even be with my other one true love, Lola. I regret all of those days I'd leave her behind, and then after that all the days I didn't get out of bed. Thank God for her, when I got home from rehab and looked in those perfect eyes I realized I was a fool. Loving her is a high unlike any other. I was finally able to  be a good momma, the momma she deserved. That gave me the motivation to get a job, get my shit together. Once I held down the same job for over month it just got easier every day. I still look for you around, and sometimes I even find you. I enjoy our random hangouts here and there. It reminds me of our first time together. That's all I want from you. A reminder that we were good, in the beginning. Also a reminder of how ugly things got in years to follow. So I think for now, we are gonna stay this way.",46,{},"{'label': 'NEGATIVE', 'score': 0.5522672533988953}"
2021-01-30 09:44:35,https://www.reddit.com/r/StopSpeeding/comments/l8n3n9/i_wish_i_had_known_about_the_nightmares/,I wish I had known about the nightmares,"I wish I had known about the nightmares before doing meth, it wouldn't prevent me from doing it but al least I would've prepared for this (don't know how but doesn't matter).

My journey of quitting started a week ago when I posted here, but it wasn't until this week that I've stopped. I read A LOT about withdrawal before quitting. I've quit different drugs without any problem or relapse but meth had me worried. I got mentally prepared or so I thought.

That my depression was going to be worst? Fuck, ok. Psychosis? Ok, never had that in my life before but I'll prefer the consequences. Fatigue, anxiety, binge eating, irritability? Damn, I'll deal with that. I didn't took it lightly but I wanted to stop putting poison in my body and that weighted more. But you know what's the first thing that happens when you quit? Immediately you start sleeping a lot. 

Sleeping used to be a scape to me and more than that, for me it is even more important than eating. I dreamed every night, almost all my dreams were lucid and I could do anything I wanted. I used to sleep at 9 or 10pm and wake up at 6-7am every day just because, I couldn't help it, I've always been like this and I love it, it was something I was very proud of. Sleep is beautiful, sacred, holy, I don't know, you got the point. I could even sleep when I used cocaine but meth fucked this up. You know how it goes: lots of days without sleeping and eating. 

Now, this is day 4 for me after quitting. I've been sleeping a lot, A LOOOOT. 18 hours only interrumpted by a quick visit to the bathroom or to the kitchen. When I wake up I can't even open my eyes because of how tired I am but God, how I fucking hate the moment I have to go to sleep. The first night I had the most vivid and visceral nightmare, I woke up scared as fuck and, to my damn bad luck, the sleep paralysis started in that moment. I tried to move, to scream, to do something but I couldn't, then I falled asleep again and had another nightmare. This went on and on. Nightmares about murder, accidents, my family being hurted, people melting, ghosts, drug dealers trying to force me into eating my brother (WTF), rape, fights that come with the company of hallucinations of my boyfriend and friends mocking me for being an useless piece of shit that has done nothing with his life (the hallucinations only happens when I get the sleep paralysis). It is scary as fuck because It feels awfully real. The next night (or the next moment I had to go to sleep again), before I could even sleep completely, the sleep paralysis kicked in again. Woke up after struggling what felt like years and when I tried to sleep again, I kept hearing noises that made me jump off my bed (there was nothing here, it was all in my fucking head). I went to sleep eventually. Had nightmares. Sleep paralysis.

Now I'm fucking terrified of sleeping. The simple thought of it makes my heart go wild, it makes me fucking nervous when it used to be delightful. Last night all this happened again, the paralysis, the nightmares, and I only slept 3 hours. I called my bf and tried to calm because I dreamed about my child being murder by a shadow (I don't even have kids but the feeling... FUCKKKK!). 

I wish I had known about the nightmares before. I wanna sleep like I used to. I hope one day I learn how to forgive me for doing this. I don't feel like using (I mean, yeah, obviously I have the most horrible cravings but I won't fucking touch it). I miss me.",24,{},"{'label': 'NEGATIVE', 'score': 0.9919986128807068}"
2021-01-30 07:14:03,https://www.reddit.com/r/StopSpeeding/comments/l8kh2k/i_guess_this_is_me_reaching_out/,I guess this is me reaching out,"I've been fighting back and forth trying to stay clean off meth after smoking heavily almost everyday(fucking covid)for the last year and about 3 years off and on altogether, longest I've stuck it out was 3 days. The cravings keep winning, I know it's because I let them, but I'm also just feeling completely alone. The only person that knows of my use is my mom because that's how I started and where I get it. Been struggling to even make a fucking doctors appointment for myself or call the hotline, even though I know the rewards of sobriety are worth it. All the relationships and friendships I've destroyed, everything good in my life ruined by me with the help of this drug, when will i finally say enough is enough? I'm embarrassed and ashamed to reach out to anyone that I know for help. My mom's so deep in denial about her own addiction and recovery it's just a lost cause. Idk I guess I'm just asking for a friend. A little bit of hope in such a dark fucking time not only in my world but this cruel reality I keep fucking waking up to. I never post on these things but I'm always lurking. I just i don't know where to turn, y'all always seem so supportive and uplifting.",17,{'covid': 1},"{'label': 'NEGATIVE', 'score': 0.9915468096733093}"
2021-01-30 06:50:31,https://www.reddit.com/r/StopSpeeding/comments/l8k41y/how_to_learn_to_love_myself/,How to learn to love myself,I use such harsh negative language towards myself and I think its a problem. I have to love myself because there are so many good things about me. Just because I'm struggling at 25 doesn't mean I don't have a good life ahead of me. Things are going to get better man stop beating yourself up! Idiot! Just kidding,13,{},"{'label': 'NEGATIVE', 'score': 0.9900076389312744}"
2021-01-30 03:33:39,https://www.reddit.com/r/StopSpeeding/comments/l8hf7u/paws_and_that_time_of_the_month/,PAWS and that time of the month.,"To all my ladies,
Did you feel like your paws waves would get worst around that time of the month? I quit 20mg addy CT... it’s been 4 months, and at this point I’m starting to confuse paws with pmdd. Or is one just affecting the other ? I get really like waves of anxiety, panic, depression, insomnia, fatigue. Feels like there’s no end in sight 😭",10,{},"{'label': 'NEGATIVE', 'score': 0.9995964169502258}"
2021-01-29 15:30:31,https://www.reddit.com/r/StopSpeeding/comments/l83aj8/how_would_you_decide_your_sober_date/,How would you decide your sober date?,"Last time I did meth was 11 months ago, but last July I relapsed on MDMA for one night. How would you decide your sober date?

Getting clean from meth was my life goal for almost 3 years but I wanted to be 100% clean, so I'm not sure what to decide as my sober date",14,{},"{'label': 'NEGATIVE', 'score': 0.9987194538116455}"
2021-01-29 12:46:58,https://www.reddit.com/r/StopSpeeding/comments/l7yxcc/pocket_change/,Pocket change,"I have a family member who’s currently using meth. He hasn’t admitted it but has been arrested twice in the last year for possession. He’s frequently asking for small amounts of money $3, $5, $10. He says to help supplement rent payments. Is this consistent with addictive behavior or could this really be a legitimate need for financial support?",10,{},"{'label': 'NEGATIVE', 'score': 0.9981058835983276}"
2021-01-29 11:39:58,https://www.reddit.com/r/StopSpeeding/comments/l7x5p7/last_day_with_meth/,Last Day With Meth,Today  is my full last day with meth I'm nervous as anything and worried as well. I'm not too sure how the withdrawls will be if there is any do it yourself techniques that someone can  suggest I've been using everyday close to a year now. I'm hoping to find some like minded people in here that could give me some advice and possibly be willing to chat sometime. Recovery or addiction isn't new to me neither is clean time. But its always hard going back to be clean  with a drug that's so addictive which has taken almost a year of my life. I've defeated a Heroin  and crack addiction and should be able to defeat a meth addiction too. But meth is something different for some reason I feel it has some type of hold on me that I'm afraid I wont be able to break. I don't normally  post alot but I know the support and such could be beneficial for me figured I'd let my ego down and give it a shot. Well I hope to hear from some of you.,33,{},"{'label': 'POSITIVE', 'score': 0.9749759435653687}"
2021-01-29 01:46:08,https://www.reddit.com/r/StopSpeeding/comments/l7lrsf/8_months_sober_update/,8 months sober update,"Hit 8 months back on January 17th.  Cravings are admittedly peaking, and I feel like my excessive overuse of substituted mental crutches like cigarettes and energy drinks are a combination of two things; 1. Me trying to recreate literally ANY resemblance to how meth felt (I know its not possible but my brain wants me to believe it is), and 2. It's taking a toll on my overall physical and mental health.  I wish I could feel normal without any substances at all, but I can't see myself quitting cigarettes or even caffeine for that matter without seeing an exponentially detrimental skyrocket with my meth cravings.  Part of me feels like the legal substances I listed play a big role in keeping me sober.  My mindset is that, its not a lot, but its *SOMETHING*.  Anyways, hope everyone's staying safe and healthy.",46,{},"{'label': 'NEGATIVE', 'score': 0.9923382997512817}"
2021-01-28 18:07:57,https://www.reddit.com/r/StopSpeeding/comments/l7bxdx/dont_know_what_to_do/,dont know what to do...,"hello, my friend went to my appartment and he bring Coke Here, i didnt take any But i think 0.1% of it landed on my pizza and 5 min after i ate it i started to crave Coke insanely much (used to abuse Coke for 2 years and am currently 7 months sober",6,{},"{'label': 'NEGATIVE', 'score': 0.9971178770065308}"
2021-01-28 15:11:26,https://www.reddit.com/r/StopSpeeding/comments/l77c3r/i_recently_discovered_that_my_mom_gives_my_15yo/,I recently discovered that my Mom gives my 15yo sister adderall at 4:30AM before she leaves for work at 5AM on school days so she can watch her take it.,"Some back story: my sister still lives at home and I'm 25 living on my own. 

Shes been on adderall since around age 10 due to lack of motivation in school. Shes never taken it in the summer or on the weekends.

Recently she was saying my mom leaves earlier than her and she doesn't need to be up for school until 7AM but my mom always wakes her up to take it and then go back to sleep to make sure she gets it in her before school. 

She is now so skinny with no appetite and has high anxiety. She told me it doesn't bother her to take it on school days but she wishes she could take it later so she can eat first. 

After struggling with adderall through college it pains me to see someone so young on this substance. Especially my sister.

Would you say something to your mom if you were me?
Thoughts on this situation? 

My mom is a nurse, shes never taken adderall but had all of her 4 kids on it at one point. She strongly believes everything the medical system recommends.",11,{},"{'label': 'NEGATIVE', 'score': 0.9933872818946838}"
2021-01-28 13:41:11,https://www.reddit.com/r/StopSpeeding/comments/l74svm/traumatic_experience_and_palpitations_during/,Traumatic experience and Palpitations During Comedown,"I’m not sure if I should be too worried or not and could really use some advice. For the last 1 1/2- 2 years I was using meth, for majority of that time it was off and on, rarely used more than a couple days in a row, always slept, drank water, and ate food. Until about 8 months ago, my now ex boyfriend, was in a very dark place, and deep in his addiction to meth. I had a problem with enabling and giving up all of myself for him, leading to me feeding his addiction to keep him happy, but ended up worsening my own problem because I didn’t want to face reality. Almost 6 months ago, my ex tried to kill himself during a psychotic break where he thought the neighbors in the apartment above us were fucking with him, but really he just had about 6 different voices in his head. He tried slitting his neck open in front of me. Luckily I had already called 911 and the cops arrived right as he was cutting into his neck with broken glass. He was committed for a week and a half, then released. During the time he was committed, I told myself that he always controlled everything in our life for the last 6 years, and now he’s gone, I can do and have whatever I want. I wanted to actually experience the drug without him there to control or ruin it. Since that day, I’ve used nearly every single day after. He since came home, was sober but still had voices. Attempted suicide in front of me again, and much more violently, a week after I ended the relationship 2 months ago. He very nearly succeeded. Over the last two months, I’ve used more than I ever have, I lost my job, I’ve been trying to repair the nearly $3,000 worth of damages done to my apartment that I have to fix by myself since he isn’t allowed back on the property or near me due to a no contact order. I lost all but 1 friend, and now have realized meth has ruined my life and the life of someone I once loved that will never be capable of being the same person I fell in love with. So, it’s time to get clean. That, and I have no money left. Today is day 1 of sobriety. The main reason I started this post, is because I have been having very strong heart palpitations, and just want to know how worried I should be? I am a 23 year old female with IgA Nephropathy, an auto-immune Kidney disease. I was diagnosed with the kidney disease at 16, they said I have 80% functionality of both my kidneys and I have had 0 progression of the disease since diagnosis. I know heart and kidneys go hand in hand, but I just recently had my annual labs done and my kidneys are the same. Are palpitations normal during a meth comedown? It feels like a very strong fluttering in my chest and it makes me light headed at times or slightly woozy for a second when I first get up.",5,{'immun': 1},"{'label': 'NEGATIVE', 'score': 0.9989331364631653}"
2021-01-28 12:21:19,https://www.reddit.com/r/StopSpeeding/comments/l72xi6/anyone_else_feel_totally_normal_after_quitting/,Anyone else feel totally normal after quitting?,"Kinda felt like checking in on this sub as I spent a bit of time here while I was going through withdrawals.  I was addicted as shit and my saving grace was that I mail-ordered my speed and I got scammed once while I was already a week deep into detox and it just seemed like time.

I was really worried I killed a bunch of brain cells.  Honestly though, it feels like so little of my tweaker days have stayed with me.  I’m doing good in school now... like really good... and nobody would ever know any better.

Trust me guys, no matter how shitty you feel you can always get better.",64,{},"{'label': 'NEGATIVE', 'score': 0.9900009632110596}"
2021-01-28 07:25:05,https://www.reddit.com/r/StopSpeeding/comments/l6vd4q/eight_months_clean_and_still_struggling/,Eight Months Clean and Still Struggling,"Bring out the balloons; it's pity party time.

I'm now eight months out from the marijuana and Vyvanse overdose that made me give up both. I still feel pretty awful.

What worries me is that I don't really know if I'll recover any more than I already have. There are two scary variables here:

1. I was prescribed Vyvanse in the first place because a few years ago mononucleosis seems to have attacked my brain and caused some problems: chronic fatigue, brain fog, depression, loss of libido, flattened emotions. It feels like my brain is swollen all the time.
2. Something really bad seemed to have happened during the overdose. Parts of my vision temporarily went dark. In the days after, it felt as if I could only have one thought at a time, like they just sparked slowly in my brain, disconnected from each other. My body felt weird to me. Sometimes, for example, I would try to use the restroom, and my brain felt like it was ""looking"" for the right parts to use. I'm worried I did permanent damage.

These days the fatigue is worse than it was before the overdose, the feeling of my brain being swollen is worse, the depression is worse--I just feel so hopeless. Leading up to the overdose, everything in my life was already falling apart. Now it's fallen apart further, and I don't understand where I'm supposed to get the energy to even begin to put it back together. I spend my days unable to stop thinking about every shameful thing I've ever done, about how there's always seemed to be something off about me, and about all the people I feel would actually enjoy my suffering if they knew the full extent of it. These are horrible thoughts, but I have no will to fight them. And yes, I'm seeing both a talk therapist and a psychiatrist.

I'm aware that people see improvements past the eight month mark. I'm aware also that it may not be surprising that recovery seems unending in the middle of a pandemic. And I am taking steps to improve myself: I read every day, I exercise at least a little, I've been playing video games and piano to stimulate myself. I'm not taking this lying down.

But some days, like today, I just get really scared that this will be my life now. I'm scared that between the post-viral syndrome and overdose, my brain is so trashed that I'll never really enjoy life again.

Send your spare hope and strength.",12,"{'flatten': 1, 'pandemic': 1, 'viral': 1}","{'label': 'NEGATIVE', 'score': 0.9993435740470886}"
2021-01-28 07:02:11,https://www.reddit.com/r/StopSpeeding/comments/l6uzj6/today_im_1_year_and_8_months_20_months_sober/,Today I’m 1 year and 8 months (20 months) sober,,28,{},"{'label': 'NEGATIVE', 'score': 0.9967842102050781}"
2021-01-27 22:30:40,https://www.reddit.com/r/StopSpeeding/comments/l6mv22/curious_how_many_other_started_using_the_same_as/,Curious how many other started using the same as myself,"Before I found stims I was on opiates for years. No specific type. Along with that habit I was also on xanax. I had to have both or I was unable to function.

After years of battling the addictions I already had I was then prescribed tramadol by my family doctor. That was the start of a whole other life consuming habit that legit almost killed me.

 I was on these for about 6 years and the 2 years before I was able to switch that addiction to suboxone I was up to using 90 every three days most of the time. I would also take neurontin, fiorcet, lyrica and whatever other pill i could find that would give me a head change. I experimented with cocaine, crack, heroin and luckily those didnt stick the way other stuff did and I never found myself fully addicted to those. 

 I still currently use suboxone and its been almost 8 years and honestly I believe I'd be dead had I not found it.

 After I started suboxone I was introduced to aderall. I was using it and vyvanse daily for about 2 years up until I found meth. I'm using it along with my suboxone daily. I claim to be a well functioning addict on only these two drugs (intravenously) but I also know I'm in denial. 

Anyways, the point of this post was to ask what type of drug did others start with. Im just curious to know if any of you started similarly to the way I did.",3,{},"{'label': 'NEGATIVE', 'score': 0.9973044395446777}"
