Date,URL,Title,Body,Score,COVID-19 Mentions,Sentiment
2021-10-11 17:31:05,https://www.reddit.com/r/StopSpeeding/comments/q66c8z/i_think_im_done/,I think I'm done.,"I got a few hours of sleep last night, woke up, and took probably 200-300 mg of Adderall that I had to steal from my husband because I ran through my prescription a week after I got it.

I don't even get anything done anymore. I have to take so much to get those few minutes of euphoria that I'm too fucked up and riddled with intrusive thoughts to even do anything, and it's not worth it anymore... I'm still sad. I'm still anxious. My house is still a shit hole. So I'm over it. I don't care if I gain weight. My brain is fried, and I want to go to sleep.",34,{},"{'label': 'negative', 'score': 0.95431995}"
2021-10-11 08:48:20,https://www.reddit.com/r/StopSpeeding/comments/q5v34v/tiktok_vids_glorifying_rx_stims/,tiktok vids glorifying rx stims,"being on the other side of my six year adderal addiction for a few years now, it's weird seeing ppl on tiktok joking/prasing their stim rx habits. i get it, i was there once too.. but the path that stims led me down was god effing awful. i wanna chime in and let ppl know the dangers of longterm abuse, but i know they won't listen. i wouldn't have. I don't wanna be a wet blanket but anyone else this was or has seen this?",10,{},"{'label': 'negative', 'score': 0.928564}"
2021-10-11 04:57:47,https://www.reddit.com/r/StopSpeeding/comments/q5rp50/one_year_clean_from_amphetamines/,One year clean from amphetamines!,"One year ago I relapsed for a full month and put my future family on the line. 

I made myself believe that I could smoke amphetamine-like chemicals every once in a while. But that's impossible for me. I went back to full blown addict after one hit. 

Now I'm a proud and tired father of my twindaughters. 

And still there is a little demon whispering in my ear from time to time that tells me I can control the speed. 

But I keep telling him he's full of shit.",48,{},"{'label': 'negative', 'score': 0.81303596}"
2021-10-11 04:15:25,https://i.imgur.com/qnCexf2.jpg,"Idk if anyone can relate, but after being a homeless junkie two years ago, today it means a lot to me how many keys I have/have been trusted with.",,55,{},"{'label': 'positive', 'score': 0.5973265}"
2021-10-11 03:13:18,https://www.reddit.com/r/StopSpeeding/comments/q5qfko/meth_abuse_trigger_forgotten_traumatic_memories/,Meth abuse trigger forgotten traumatic memories??,"I want to ask if anyone took enough meth/amphetamines that traumatic memories come back, like traumatic memories that you completely forget about, like amnesia as the brain's way of coping to severe psychological trauma. I'm not sure how much of it was real though since I was also having psychotic symptoms, but I'm pretty sure some of the super vivid flashback/hallucination conversations from childhood did happen and wasn't just my brain making it up. That was 8 months ago, and when I think back I'm pretty sure some traumatic events did happen because it fits missing pieces in my childhood. It was like I was reliving them, even though I didn't remember them. I still remember what happened, but they don't haunt me anymore and made me stop for good, thank God.",13,{},"{'label': 'neutral', 'score': 0.48582402}"
2021-10-10 20:02:45,https://www.reddit.com/r/StopSpeeding/comments/q5jwee/by_some_miracle_i_will_be_21_months_clean_on/,"by some miracle, I will be 21 months clean on October 18th. My DOC was IV meth/heroin/fent. I spent 10 years throwing my life away, lost everything from my kids to my car to my house and job. These past 21 months have shown me that it is possible to rebuild myself and my life from scratch.",,43,{},"{'label': 'neutral', 'score': 0.41639602}"
2021-10-09 23:27:18,https://www.reddit.com/r/StopSpeeding/comments/q50798/it_never_ends/,it never ends,"I’ve been taking adderall on and off since i was 12-13. I always liked the stuff because I grew up overweight and naturally, I enjoyed the hunger suppressant aspect. I started abusing it almost immediately and I will take amounts of it that are extremely dangerous and I’ve done this on and off for over a decade, mixed with periods where i was either doing coke or both at the same time and now i’m an almost 26 year old (f) and my brain is so ruined from this. I spent all of quarantine living alone taking 200+ mg a day and going insane. I keep trying to stop because the mood swings have become too much to handle. I keep lying to myself about how bad it is and i’ve gotten sober from a million things a million times but i’m worried if I don’t stop now my brain will get even more damaged and it will be irreversible. i just want to enjoy life and can’t believe i ruined everything with adderall and coke.",11,{'quarantine': 1},"{'label': 'negative', 'score': 0.9105242}"
2021-10-09 20:10:02,https://www.reddit.com/r/StopSpeeding/comments/q4x8xr/for_those_of_you_who_have_admitted_adderall/,"For those of you who have admitted Adderall script abuse to your doctor, what happened?","So I really think the only way I’m gonna be able to quit Adderall is if I cut off my supply (doctor). It’s so hard for me to turn down my monthly script if I still have access to it. I really like the idea of coming clean to my doctor - I truly never want to have the opportunity to be prescribed this drug ever again. However, I was wondering if anyone has been denied life insurance or increased cost of your health insurance due to having substance abuser on your medical record?

Also, let’s say I’m 80 & need my hip or something replaced - are the doctors gonna see that I had a substance abuse problem when I was 23 & deny me any pain medication? 

I’m so ready to end this addiction cycle & begin recovery. Any past experience & advice on how to go about this would be greatly appreciated.",12,{},"{'label': 'negative', 'score': 0.61361897}"
2021-10-09 19:19:44,https://www.reddit.com/r/StopSpeeding/comments/q4wgap/flushed_that_fucking_shit/,Flushed that fucking shit,"3 months ago I’ve relapsed to abusing Ritalin IR -mostly snorting- , my scholarship at university was about be cut off due to a mistaken attendance  report. I was mentally so prepared for that fresh start of semester after quitting my poly drug addiction -Xanax for comedowns, ibuprofen for the headaches and sore throat, anti acid medications, antipsychotics… basically anything to just fucking enjoy Ritalin-. 


Since that 3 months I don’t know how many prescriptions I binged in. Almost 60-80 mg daily usage and I wasn’t even getting high or being productive on it like I used to when I first started it. Tho it cleared that I still have my scholarship, I wasted 3 weeks of the curriculum hating myself, chasing the imaginary dragon, going to raves, meeting people then not talking any single one of them back after… 

It took tonight for me to give the decision to flush the rest of my prescription. I relapsed on a bing purge episode, completely isolated myself at my room but while wanting to be social, I couldn’t even look at myself in the mirror anymore. It was after that I throw up and looked at myself, truly looked at myself to stop killing myself slowly. My dark circles, my watery eyes, my enlarged pores but mostly the emotions showing adding all those details together. I heard my intuition, my higher self crying for help. 

I got so much to lose. My professors are worried about me because they see my potential, there are people listening, my mom paying for my therapy sessions, my friends telling me that they want me to be happy, my cat, my lovely sister, my hard earned degree, my body and my mind that I so hardly built up before all of this started.

I am never going back. This is day 0, again. I know self loathing, guilt, PAWS, depressive episodes are waiting for me but I now acknowledge the strength I have against them. They are not going to win.

I don’t need to learn to love myself. I need to practice it. 


There must be a reason for me to still surviving, if I failed all of my suicide attempts as a child, because I was convinced my psychopathic father was going to do it anyway. I survived earthquakes, I survived changing cities every 4 years growing up because my family was in military, I survived watching my mom going through intense PTSD after one night we finally escaped my father. I survived the man that I was damn sure to have my life with abandon me at the abortion clinic and her mom dying out of cancer. 


DRUGS ARE NOT GOING TO WIN. 


I’m so happy this subreddit exists, for all the validation and hearing other people’s stories.


Wish me luck…",15,{},"{'label': 'negative', 'score': 0.8264538}"
2021-10-09 17:25:50,https://www.reddit.com/r/StopSpeeding/comments/q4uf6c/day_5/,Day 5,"Feeling flat. At work. This is hell.
Been eating and sleeping.
I feel like there is no point to anything.
I feel dissconected from every thing.
I Hope this goes away.
Off meth.
1.5 years.",9,{},"{'label': 'negative', 'score': 0.9347386}"
2021-10-09 14:05:11,https://www.reddit.com/r/StopSpeeding/comments/q4qku5/day_3/,Day 3,"I feel like my brain is at war with itself. I want to get out of bed and do something productive but it just seems like i can’t force my body to get up for more than a few minutes. i don’t feel weak and sore anymore, just tired and lacking motivation to do anything except eat. i’ve been binge eating junk food because i barely ate for several days and junk food is my only source of dopamine right now. i’m so upset with myself for the way i’ve been treating my body. i used to do so good and it all turned to complete shit. i really don’t know what to do about any of this. 

i told my grandpa i would visit him today. i want to do that if absolutely nothing else. i also have to study for a test i have when i go back to school, which i haven’t done. i’m supposed to work a 7 hour shift tomorrow which sounds like absolute hell. i don’t know what to do. i don’t want to do any of it. 

sorry for the lack of positivity. i know brighter days will come eventually, i just hope it’s soon.",7,{},"{'label': 'negative', 'score': 0.95368516}"
2021-10-09 01:02:39,https://www.reddit.com/r/StopSpeeding/comments/q4elc0/looking_for_advice_or_direction_for_quitting/,Looking for advice or direction for quitting ritalin (~200mg daily) and what to expect,"Sorry didn’t let me add the body

Essentially for the past year or maybe a little more I have worked my way up to an ungodly amount of ritalin and because I’m no longer able to afford it and inpatient treatment takes forever I’m going to be forced to go cold turkey by Monday. Also I’m 21m 165 6ft5in 

My dosage and use includes 70-80 mg in the morning along with 40-50mg a few times throughout the day which average it about 20 10mg ritalin per day

I am on rx Hydrocodone and tramadol and so not allowed benzos to help 

I do have some modafinil which idk if that would be counterproductive to detox or not and how often or how much I’d take 

Any experience regarding this amount taken and what timeline I should expect would be greatly appreciated",8,{},"{'label': 'negative', 'score': 0.48895764}"
2021-10-08 22:30:17,https://www.reddit.com/r/StopSpeeding/comments/q4cf82/almost_6_months/,Almost 6 months.,I'm almost six months clean. Within days of it. Meth is nothing like it was when I was a kid in the 90s living in Texas. It's heavily laced with fent here in Tennessee. I had a stroke and quit after my 2 8 balls a week habit for free from my kids dad. ( My ex) this shit is so hard to quit. I'm glad I did. There have been 4 overdoses in my old circle in a week. Things are sad. If you want to quit do it. I can't believe how much of an assh** I was. Thank God for good friends and catching myself before I fell. Stroke recovery plus quitting has been hell on me but no going back. What are your long term problems from using? My sciatic nerve and the stroke on the left side have kicked my rear end but I'm glad to be almost 6 months free!,21,{},"{'label': 'negative', 'score': 0.41797233}"
2021-10-08 20:14:24,https://www.reddit.com/r/StopSpeeding/comments/q4aa9u/day_24_still_going_strong/,Day 24: still going strong,"I feel like I’m back to normal again. I don’t really have any cravings anymore. I still vape nicotine but it hasn’t led me back to stimulants so that’s good. I look back at all the money I spent on this year long trip and I’m like “what the hell was I thinking?”. It makes me feel good to see that I’ve saved $5500.70 since I quit. There’s an app I use called Quit Meth Addiction that I use to track my progress. I’ve gained probably around 10 kilograms (22 pounds) since I quit. I used to stay up for 3 days and have probably two meals in that time, now I’m back to 2-3 per day. I’m feeling good, some days are better than others but it’s nice to get out of my room and go out around other people. To the moon healthy I’m sure I’ll be able to keep this up. When I was cleaning my room I found two baggies with a little bit left at the bottom. Not gonna lie I thought about it. Threw them in the bin. I’m out at the moment but I think when I get home I’ll throw out my two glass pipes, I’m not sure exactly why I have kept them so long I guess a part of me was not sure if I’d go back to it... 

Day 5: https://www.reddit.com/r/StopSpeeding/comments/pprzx1/5_days_and_counting/?utm_source=share&utm_medium=ios_app&utm_name=iossmf

Day 11: https://www.reddit.com/r/StopSpeeding/comments/ptoka7/update_still_goin_strong_on_day_11/?utm_source=share&utm_medium=ios_app&utm_name=iossmf

Day 16: https://www.reddit.com/r/StopSpeeding/comments/px3pn3/day_16_feeling_like_myself_again/?utm_source=share&utm_medium=ios_app&utm_name=iossmf",8,{},"{'label': 'positive', 'score': 0.70607805}"
2021-10-08 16:57:14,https://www.reddit.com/r/StopSpeeding/comments/q46nxt/poststim_purgatory_adhd/,Post-Stim Purgatory (ADHD?),"So I was prescribed Vyvanse for about 8 or 9 years, ostensibly for ADHD (I do think I actually have it, to the degree that it exists). For the last three years of that I also had a prescription for Adderall.

Anyhow, standard story, I started abusing the Adderall, snorting it, binging it, stim fapping, etc. I ultimately stopped doing all the stims around January, stopped drinking alcohol in April, and went to an outpatient rehab in May. I have been sober since then.

My energy level still feels low. I don't have a job, and I feel like I don't get anything accomplished during the day. I'm sleepy and generally unmotivated, compared to how I was when taking the stimulant medication.

I feel like I'm in a purgatory. The ADHD meds did seem effective, but I did abuse them. I don't think I should start taking them again, but now I'm stuck with the ""untreated ADHD"" lifestyle, which sucks.

It's like I fucked up and got my stim card pulled, so now I'm stuck mulling around, yawning, stuck with the consequences.

All this said, I'm also aware that most recovering addicts having cravings for their former drugs, so I'm also aware my pining for stims could be drug-wanting.

Anyone else felt caught in the post-ADHD-med-abuse purgatory?  Any advice?",5,{},"{'label': 'negative', 'score': 0.85545325}"
2021-10-08 12:56:58,https://www.reddit.com/r/StopSpeeding/comments/q41ty3/a_friend_asking_you_for_advice_thoughts_on_his/,A friend asking you for advice/ thoughts on his speed use,"Imagine a friend telling you this – how would you respond?

Ficticious report: ""The gist is this: I started taking amphetamine only five weeks ago and progressed immediately to the ""daily use"" stage – well, four to six days a week. While I could manage to restrict myself most of the time in the first few weeks (15-25mg a day) I soon started to have binges and increased the dose rather compulsively. This led me to experience the more negative effects of amphetamine. After a short break of five days, I tried reintroducing the drug and was committed to stick to rather strict rules about dosage, frequency and mode of ingestion. – Well, it took exactly two days and I was back to compulsive redosing, which brings us to today. Since I took a dose way too late in the day yesterday and drank excessive amounts of caffeine on top, I wasnt able to sleep at all and today I basically went off the rails and took at least four times the amount I had set for myself. Of course this might mean that yet another sleepless night, more heavoc wrecked on my body and probably a depressive rebound of a couple of days are ahead of me (I already struggle with periodic depressive episodes which can become rather severe). This is the third time I find myself not sticking to the rules I had set for my use. – Do I give up, flush my remaining stash down the toilet?  Should I still try to get medicated for my ADHD by a psychiatrist or am I doomed to repeat this pattern even with drugs like methylphenidate? I would really appreciate your advice. I am worried about my escalating use – to be honest, deep inside I already know the answer to my question, but this is really bothering me right now and I had to get it out somehow. What do you think?""I wouldn't know what to tell him because I do not take any illicit substances, never have.",6,{},"{'label': 'negative', 'score': 0.69333494}"
2021-10-08 07:56:04,https://www.reddit.com/r/StopSpeeding/comments/q3w7zc/quitting_after_using_daily_for_at_least_15_years/,Quitting after using daily for at least 15 years...,"Hi. I'm wondering if there is anyone out there who has successfully quit after daily, long term use. Yesterday I turned 42. I started doing meth when I was 22. For the most part, compared to other users around me, I manage to keep it together which I used to think was a blessing but now I know it's a curse. Maybe if I'd lost everything, or wound up in jail or lost my job - I'd have quit sooner and I'd be done with the stuff. But fortunately/unfortunately that hasn't been the case. I despise dope and want to quit. I wish I could remember what living life felt like without it. I hate being tied down to the stuff and worrying about getting it and it's annoying how much money I've spent on it. I hate lying to everyone around me. Only a handful of people who know me, know I'm an addict. I've tried countless times to stop and the longest I've quit was nearly 2 years but at that point I'd been using for 7 years. Now I've been using for I dunno 15? 18 years? I'm super scared about stopping because I hate feeling so bad. I know everyone feels bad and I'm probably just being a baby. I mean, I guess I have it good compared to people trying to kick heroin but whenever I stop it's just so unbearable. My entire life goes to hell. I stop working. The bills start racking up. I feel depressed and stressed over that stuff. It just gets worse until something real bad is going to happen like were going to lose our house or something then, inevitably, I go get on one and get myself back on track, but I'm not really on track because I'm still using. 

This has happened the last few times I've quit. I honestly feel so hopeless over this like I can't do it. But then I see other people who have. Like my own husband quit dope and became a helicopter pilot. I feel so proud of him and I feel like he deserves a better wife who isn't on drugs.  I feel a lot of guilt over it all and just like what's my problem? Why am I still doing this? Anyway. I was hoping there's someone out there who has had success after long term use because it's so hard for me to imagine myself in that place right now. Thanks for listening.",11,{},"{'label': 'negative', 'score': 0.7836559}"
2021-10-07 19:22:46,https://www.reddit.com/r/StopSpeeding/comments/q3lade/to_those_who_have_quit_iv_meth/,To those who have quit IV meth,"I’m having such a difficult time rn. I can quit cold Turkey for a week or two no problem. But after feeling like a depressed, miserable shell of a person over that time, I always relapse. Its an endless cycle. 

The crazy part meth isn’t even my DOC. I was an opioid addict for 8 years and finally got on methadone and have been clean from opioids for over 3 years. 

Meth has fucked up my mental health more than I thought possible in just 6 months. I had mental health problems before, but it was nothing compared to how bad it is after 6 months of a meth habit.  Anyone who’s successfully built up some sober time, I’d love to hear some tips and advice!",15,{},"{'label': 'negative', 'score': 0.7941057}"
2021-10-07 17:30:19,https://www.reddit.com/r/StopSpeeding/comments/q3j6h4/ive_been_clean_of_adderall_for_4_months/,I’ve been clean of adderall for 4 months :),"Hey, guys! I’m new here but wanted to let you all know that it gets better! I also started Zoloft about 3 weeks ago and so far I’m doing great. If you need any advice for getting off of adderall, let me Know. 🙂",25,{},"{'label': 'positive', 'score': 0.97066265}"
2021-10-07 16:14:07,https://www.reddit.com/r/StopSpeeding/comments/q3hlh9/i_hate_having_no_energy/,I hate having no energy.,"So I relapsed after being sober from Speed after 7 weeks. At this point I don't think it's possible for my brain to produce normally dopamine anymore. I'm going through a comedown now and the following days will be dreadful, I will overeat, won't have enough concentration for my studies, I will feel irritated, anxious, tired and the only relief will come eventually after 3-4 days when I snort the rescuing line to get shit done. I really tried to stay sober but it really sucked. I always compared my sober days to my druggy days where I was really productive and I missed the energy and high concentration when I was sober.

When I was sober I really missed the days where I used to pull all-nighters as I never liked sleeping even when I was a child I hated going to bed on time and always refused to sleep. When I was a child low motivation and low energy were my biggest enemies and I always struggled my whole life with these symptoms. I don't know what I have ADHD, BDP or Depression but I thought I solved my issues with Amphetamines. I just don't get drug comedowns. Why is the human body actually so fucking weak and the results are always terrible comedowns. Why do I have to get anxious, irritated and sad now when I was full of energy, joy and concentration yesterday.",4,{},"{'label': 'negative', 'score': 0.9497823}"
2021-10-07 15:10:02,https://www.reddit.com/r/StopSpeeding/comments/q3g8j6/wish_people_took_this_seriously/,Wish people took this seriously,"I just found this community literally a couple minutes ago after seeing a picture of an adderall capsule on twitter and getting triggered. I’m new to regularly using Reddit so I never thought to look here for community until today. I feel so lonely sometimes. I thought I needed adderall to function and I’ll have a year clean on November 2, but it still gets so hard hearing people talk about their prescriptions and how it supposedly helps them. I hate that something that nearly ruined my life - which I thought was helping me at the time - could actually help someone else. Is that selfish? I don’t know. It just feels so isolating being in adderall recovery - very few people seem to understand how addictive it really is, and just how much of a grip it can have on your life. Sorry if this is a meaningless post - again, still getting used to Reddit and figuring out proper etiquette here. Hope anyone who bothers to read this has a good day.",49,{},"{'label': 'negative', 'score': 0.8494364}"
2021-10-07 03:31:31,https://www.reddit.com/r/StopSpeeding/comments/q33vlf/day_1/,day 1,"after many days of misery i’ve decided that i’m finally ready to cut ties the lingering demon that’s been feeding off of me. i’ve allowed it to rob me of my energy while people are left to wonder why i’m so tired. 
this is day one of my sobriety. no one that knows me knew that i relapsed. i stayed silent because i’m the only one who should suffer the consequences of my actions. 

two days ago a stranger called me out at work. he claimed to know what i had done. he asked if i was okay and i said yes. he said “no you’re not”. he said he could see suffering in me. he gave me $35 and told me that i’m loved. i split it with my coworkers and then cried in silence. that was the first slap. 

a few hours ago my significant other showed up on my doorstep unexpectedly. he told me to ride with him. i could tell something was sitting heavy on his mind. he asked me bluntly if i had relapsed. thats when i spilt everything. he told me about how he was sitting on my porch thinking of how to break up with me, but something told him not to. that was the second slap. it was the slap that finally knocked me back into reality. 

everyone is born with a demon. don’t let it rob you. your energy is sacred and should be used wisely. cherish it. wishing good luck and good health to each and every one of you.",30,{},"{'label': 'negative', 'score': 0.513253}"
