Date,URL,Title,Body,Score,COVID-19 Mentions,Sentiment
2021-10-21 04:30:18,https://www.reddit.com/r/StopSpeeding/comments/qcn6ib/uncontrollable_hand_flapping/,uncontrollable hand flapping,"Last week I finally decided to get clean of adderall for at least a month since my tolerance was so high. I've only been abusing for around a month now, but I know my family has a serious history of addiction and deaths due to drugs, so I finally got wise and decided to quit while I'm ahead. Long story short, that didn't work out too well, and I relapsed on monday, but that's not the point of this post.

Yesterday (this'd be two days after my last use) when I got to school, I started flapping my hands. This is normal for me; I have diet autism (adhd) so it's kinda just a thing I do sometimes. The issue arose when I was simply unable to stop for hours. My teacher made me go see the nurse since I literally couldn't hold my pencil still enough to write or draw (it was an art class). Eventually it just kinda...went away...but it was really bizarre and unlike anything I'd experienced before. And I should qualify that this hand flapping was like really fast and hard, to the point where my hand would often be a blur just twitching back and forth.

Is this a withdrawal symptom? I can't think of what else it could be, besides just mental illness, and the timing seems to imply it's related, but when I was looking at articles describing adderall withdrawal, nothing like that was ever mentioned. I know tweaking is a common thing when you're coming down, but this was several days after my last pill, and I'd already had my coming down symptoms from that.",10,{},"{'label': 'negative', 'score': 0.69171894}"
2021-10-21 01:48:39,https://www.reddit.com/r/StopSpeeding/comments/qckt6v/one_of_the_toughest_things_when_entering_the_road/,One of the toughest things when entering the road to recovery,"Is facing the doubt and misconceptions of yhe people in your life.  Either the long term people who have known you for a long time will either believe in you and know who you really are, or worst case they will doubt you can recover.

But then there is the new people in your life that have only seen the 'bad' version of you.  While understanding their point of view, because they have only seen 1/30th  of your lifespan, of which has been a mess..  the flipside is they never saw the entire time you were the real you.  They don't understand that you are not breaking free from 'YOU', rather, you will return to the real YOU.  which might be a wonderful productive happy person which isn't a deviant.

People in my life will think my only desire is to live the wild life.  In reality, I really enjoyed and accelled at the family life :(",6,{},"{'label': 'neutral', 'score': 0.43303484}"
2021-10-20 21:41:31,https://www.reddit.com/r/StopSpeeding/comments/qcgh43/aftermath/,Aftermath,"Hey guys so meth of course to no surprise took its toll on my physical appearance. Today is day four without it and I’m just really bummed about my appearance. I don’t feel good about myself, don’t wanna go into public, don’t wanna see my family. I’m a picker and so my skin looks terrible. My diet is horrible and so I just feel like I have so far to go before things get better. Could you guys give me some encouragement? Like how long did it take for your skin to get better? Thanks.",10,{},"{'label': 'negative', 'score': 0.89422697}"
2021-10-20 17:52:56,https://www.reddit.com/r/StopSpeeding/comments/qcbzen/24_hours_sober/,24 hours sober...,"I'm officially 24 hours sober... I was up for a week straight, didn't eat, and honestly didn't take care of myself. Im an emotional wreck right now coming down and getting sober.

Anything I can do to make this easier with out relapsing?",12,{},"{'label': 'negative', 'score': 0.42882198}"
2021-10-20 15:53:07,https://www.reddit.com/r/StopSpeeding/comments/qc9dex/finally_admitting_i_need_help/,Finally admitting I need help,"Have an addiction to Adderall about every two weeks I cave and abuse.  Maybe a day or 2 I feel ashamed, unmotivated, and helpless.  When the come down is over, I tell myself I'm done..  Cycle repeats 2 weeks later.  This has been ongoing for about 2-3 years",13,{},"{'label': 'negative', 'score': 0.8977335}"
2021-10-20 15:26:21,https://i.redd.it/6uq0mlr9pnu71.jpg,Crezy,,30,{},"{'label': 'neutral', 'score': 0.51823694}"
2021-10-20 13:20:13,https://www.reddit.com/r/StopSpeeding/comments/qc5ya9/7_months_clean_from_adderall_and_i_received_the/,7 months clean from Adderall and I received the best compliment….,"Hi everyone. I’ve been going through a tough time with PAWS and lack of motivation. I’m pretty depressed and I have ADHD and depression which I’m dealing with now after 10 years of abusing Adderall and finally quitting. 

I had a few months of what I would describe as sober bliss, I felt like myself again and I was riding my bike and laughing and enjoying time with friends and just being ALIVE for the first time in a long time. That has since worn off and I’ve been feeling sluggish, depressed, anxious, a bit dead inside. But I’m determined to get through it. 

Anyway, most of my family doesn’t know (except my sister, who is an ex-meth user, and my dad, who I’m very close to), but recently I was visiting my grandma and grandpa who I absolutely adore and they told me something wonderful. They said “you seem to be at peace.” Wow. I have no idea how I seemed before, but I guarantee my speedy, tweaked out self wasn’t “peaceful” or enjoyable to be around. Even though sometimes I miss being her. So that was really nice to hear from some people I love very much. Just thought I’d share. 

Love to each and every one of you. This sub helped save my life.",101,{},"{'label': 'positive', 'score': 0.8519161}"
2021-10-20 13:13:16,https://www.reddit.com/r/StopSpeeding/comments/qc5sjy/our_stopspeeding_discord_server_has_2/,Our StopSpeeding Discord server has 2 recovery-focused meetings a week now.,"Hey former speeders, if you're interested in attending a recovery meeting all about quitting stimulants, please join our StopSpeeding Discord, and the meetings are every Wednesday at 3pm EST (GMT -4) and every Sunday at 12pm EST in the 'recovery meeting' voice chat channel.

&#x200B;

All are welcome to attend, clean or not, although we prefer you not share too much if you're currently intoxicated.

The meetings are being lead by someone who was addicted to Adderall for 15 years but quit, and now he wants to help others learn how to quit stims as well. He's even writing a book about it.

&#x200B;

These are not NA meetings. It's our own thing we're experimenting with, and so far everyone has been really satisfied with how the meetings have been going. They are really laid back and chill. It's a great way to get to know everyone there too, if you want to spend some time on the Discord.

&#x200B;

As with the subreddit, our Discord server has several simple rules we expect all members to follow.

&#x200B;

Hope to see you at the meetings!",12,{},"{'label': 'positive', 'score': 0.916637}"
2021-10-20 10:12:09,https://www.reddit.com/r/StopSpeeding/comments/qc1sbd/7_days_off_involuntarily/,7 Days Off (Involuntarily),"Well, something must've happened to my supplier, but I'm off 7 days now. Yesterday I turned a corner a bit - I thought to myself that I want to be off and this is my chance. I have an Adderall prescription that refills on the 12th. For reference, I was a benzodiazepines addict but worked with my doctor and now I take it as prescribed. That was a huge hurdle. Due to logistics and paperwork, I don't think the same solution is available for my Adderall. My DoC is street based but for privacy I don't want to call it out. 

Has anyone made it accidentally or by someone getting rolled? I really think this is my shot at turning things around. The Adderall will feel really strong at first as I imagine my tolerance will be way down, so I need a plan on what to do when I refill that medication (I do have legit ADHD but Strattera caused significant, gross side effects and Wellbutrin turns my mouth into hell on Earth. Modafinil may be an option). I feel like I can make it off the hard stuff, I had a dream my supplier called and I just told him I quit. I feel like this is the best shot I've got - any tips or stories will definitely help.",6,{},"{'label': 'neutral', 'score': 0.46312922}"
2021-10-20 07:21:14,https://www.reddit.com/r/StopSpeeding/comments/qbyjsm/in_response_to_the_am_i_going_to_let_a_crackhead/,"In response to the, ""am I going to let a crackhead outhustle me today"" post: Yes. Yes I am. And I'm glad.","I went to the park, I sat by the lake, I watched the birds and got some neat pictures of a squirrel: observe, [the boyyyy.](https://imgur.com/a/oLobSrk)

I came back and had a phone call with my friend and then I rested. Because in accute withdrawal, that's what my body needs and wants and I'm done fighting it at every step of the way.

I didn't get anything productive done at all really. I had a day off from work and my job is pretty lax to begin with. I will never own a yacht, or a fancy car, or an island filled with strippers. That seems wasteful and deeply unfulfilling. I love my family and friends, I love my partner, and I'm good enough: so outhustle me. I'm gonna edit some squirrel photos then go make some deliciously inefficient lunch.",33,{},"{'label': 'positive', 'score': 0.49399826}"
2021-10-20 03:26:57,https://www.reddit.com/r/StopSpeeding/comments/qbvc6y/parents_constantly_pissing_me_off/,Parents constantly pissing me off,How can I indicate to them that I need space.if I tell them to give me space I will probably just get yelled at.  They are constantly on my back asking if I've used.  Fuck I can't even blow my nose without them being like have you slipped up and used.  I am just constantly annoyed at them because they don't leave me alone. All it does when they constantly ask is remind me and make me want to use even more.  I already have extremely bad cravings,12,{},"{'label': 'negative', 'score': 0.9726826}"
2021-10-19 22:47:14,https://www.reddit.com/r/StopSpeeding/comments/qbr9fg/mad_at_myself_for_caving_yet_again/,Mad at Myself for Caving Yet Again...,"Long time adderall user here.  I am a 33 YO male who has used adderall for a good part of a decade now.  It worked great for about the first 4 years of my life, and the last 6 have been a struggle.  I'm at the point where I need to take about 40 mgs (with caffeine) a day just to get me to normal.  I know that this stuff is poison for me, but I have built a ""successful life"" around it, and am too afraid to step off the ledge into the abyss and give up the life I have now.  I run a business, I make about 100K a year, and live a comfortable life, but inside I know I am not happy.  Recently, I had taken serious steps and made a plan to ween off.  I had gotten myself down to about 25 mg's a day, and then too many problems came at me all at once.  I panicked and am back to 40 mgs again.  I know everyone says to go cold turkey, but unless I want to blow up everything I've gained, I really need to ween off of this stuff.  For those of you who have weened, how did you do this successfully, and what are some pointers you can give me?  Thanks in advance for any help.",9,{},"{'label': 'negative', 'score': 0.5915002}"
2021-10-19 22:46:15,https://i.redd.it/6b441sauqiu71.jpg,Saw this posted in /r/antiwork and as an ex-crackhead I personally consider it inspirational to my recovery. See comments.,,58,{},"{'label': 'positive', 'score': 0.85621965}"
2021-10-19 21:58:58,https://www.reddit.com/r/StopSpeeding/comments/qbqf4x/tw_mention_of_roa_fifteen_days_sober_and_first/,TW: Mention of ROA. Fifteen days sober and first day of feeling okay.,"Today is my fifteenth day off the needle with meth and it is the first day in the three times I’ve been in this same place that I actually feel okay and happy.

I hired a personal trainer for my body dysmorphia so I don’t keep doing this.

Idk why I’m even posting this but I literally have zero friends in my life who know or say they know that I do this. My life is very normal and maybe I want attention who cares…but I’m really just posting this to get it off my chest because I want to tell someone and can’t.

Thanks for listening. ❤️

I hope this time it lasts longer than the one month it usually does…but things are going much better than usual.",15,{},"{'label': 'positive', 'score': 0.79359317}"
2021-10-19 18:49:01,https://www.reddit.com/r/StopSpeeding/comments/qbn2fl/feels_like_the_ground_is_moving/,Feels like the ground is moving.,In the last few years I’ve abused adderall on and off. Been completely sober for a week now and trying to keep it that way. But several times a day I get the feeling that the ground/floor is shifting. Like I’m on a boat almost. Anyone else experience this?,4,{},"{'label': 'neutral', 'score': 0.5118714}"
2021-10-19 16:57:36,https://www.reddit.com/r/StopSpeeding/comments/qbksai/i_literally_cannot_accept_the_fact_that_i_cant/,I literally cannot accept the fact that I can't use amphetamines anymore.,"I was on Adderrall and Vyvanse almost daily for five years. I am almost a month clean now. To make a long story short, I got into a mess of abusing them along with other drugs. My psychiatrist found out after I admitted it to him and will no longer prescribe them to me.

I am currently also going through benzo withdrawal and, while it sucks, the worst part about it is that I can no longer do speed. I am almost off the Clonazepam and one of the few things keeping me going is the hope that eventually ass this BS will pass and I will one day be able to get my hands on some Adderall again.

What do I even do? Between being off the speed and the benzos I literally feel like I have brain damage. I'm a freaking vegetable now and I just think about killing myself every freaking day. I crave speed so bad still and this worst part is that I literally cannot use any right now because it would probably damn near give me a seizure.",37,{},"{'label': 'negative', 'score': 0.95618707}"
2021-10-19 12:42:36,https://www.reddit.com/r/StopSpeeding/comments/qbffdn/209_days_ago_i_quit_speeding_cold_turkey_ama/,209 Days Ago I Quit Speeding Cold Turkey. AMA.,"I made a post on this sub during my last ever comedown and have been using it to count the days I've been sober. I'm up to 209 and haven't had any relapses to speak of (though MANY close calls) and would like to help answer any questions people have about the process, how I was able to do it, how my life has improved/declined since and what advice I'd give to people trying to start the recovery process themselves.

I'm going to check back on this post throughout today and tomorrow to answer as many questions as I can! Ask away!",31,{},"{'label': 'positive', 'score': 0.51973206}"
2021-10-18 19:19:15,https://www.reddit.com/r/StopSpeeding/comments/qayl45/trying_to_quit_adhd_meds_what_are_some_methods_to/,Trying to quit ADHD meds… what are some methods to get work done when I’m clean?,"I am trying to free myself from taking various forms of ADHD medication over the past 10 years or so. I can already notice a massive improvement in my sleep and general well being, and feeling way more connected to people than I have in a long time. The problem I am having is with my work. I’m really struggling to get anything done beyond a couple of emails per day, which is why I started taking this medication in the first place. I am thinking about trying some other softer medications (modafinil, etc) to help me work but wondering if that defeats the purpose of getting clean in the first place. Appreciate any tips. Cheers",6,{},"{'label': 'neutral', 'score': 0.43621862}"
2021-10-18 17:41:01,https://www.reddit.com/r/StopSpeeding/comments/qawn4n/anybody_else_still_sweating_excessively_after/,Anybody else still sweating excessively after almost two weeks of not using?,It drives me nuts.  Because I'm at work trying to do my job and I just feel like I'm sweaty all the damn time,5,{},"{'label': 'negative', 'score': 0.9534151}"
2021-10-18 12:50:48,https://www.reddit.com/r/StopSpeeding/comments/qaqo9s/i_posted_about_my_friend_a_while_back/,I posted about my friend a while back,"My best friend told me a few months ago, that she was going to tell her parents about her Adderall addiction, but if she couldn’t bring herself to do it, she wanted me to. 

It’s taken a while to get her on health insurance, and she had to move out of her apartment, but she’s going to treatment today.

I’m proud of her for taking this big step, but I’m sad that I won’t be able to talk to her like I normally do. We live 400 miles apart, but talk almost every day. 

No point to this post, really. Just an update, and I miss my friend. 🥲",16,{},"{'label': 'neutral', 'score': 0.43407232}"
2021-10-18 11:52:47,https://www.reddit.com/r/StopSpeeding/comments/qapgkg/best_way_to_wean/,Best way to wean,"I have to wean off Adderall after 15 years. I take 20mg three times a day for fatigue. I already tried going cold turkey and after 8 weeks, I still couldn't function.  My worst time of day is morning and I'm more awake in the evenings.  Because I've been on it so long, I know I need to go slow or I won't be successful.  Does anybody have a good plan on how to do that? Do I work on cutting out the 3rd dose 1st?",7,{},"{'label': 'negative', 'score': 0.7803803}"
2021-10-18 03:23:47,https://www.reddit.com/r/StopSpeeding/comments/qahpt3/12_days_clean_absolutely_terrifying_nightmares_why/,"12 days clean, Absolutely terrifying nightmares, why?","I have had the same dream over and over again.  Even when I had a nap after work today I had the same dream again. 

In the dream there is this extremely creepy scary girl who kills people, but when people who care about those people notice they are dead,  she targets those people. Like a weird torment game.  And then she kills these people and so on.  It's an extremely freaky dream.  And feels so vivid and real. It's absolutely terrifying.i don't even know where my brain that idea from from.  It's like horror movie level shit.  

Help?  It's making me not want to sleep",22,{},"{'label': 'negative', 'score': 0.96732426}"
2021-10-18 00:19:47,https://www.reddit.com/r/StopSpeeding/comments/qaf66f/thoughts_on_preworkout/,Thoughts on pre-workout?,"I've been clean for about 3 months and have even started working out at home daily for the past couple of weeks. But low energy (as a result of quitting) has made it difficult to feel productive when I go for a run or work out because I run out of steam so fast. Which often trigger cravings as I feel fat after not completing a workout. I've considered trying pre-workout but I'm not sure how I'd react. Higher blood pressure, more alert, a rush of energy... Starting to sound familiar? It sounds like baby- amphetamines to me.

So my question is if anyone has any experience with pwo or if there's any other tips on how to get more energy? Last thing I'd want is for it to trigger a relapse or me starting to abuse PWO, if that even is a thing...",7,{},"{'label': 'negative', 'score': 0.63644886}"
2021-10-17 18:41:05,https://www.reddit.com/r/StopSpeeding/comments/qa9hti/day_5/,Day 5,All I wanna do is sleep..... I get anxiety when I lay there for too long though. Anyone else experience this?,12,{},"{'label': 'negative', 'score': 0.7831774}"
2021-10-17 05:43:00,https://www.reddit.com/r/StopSpeeding/comments/q9vmbr/tw_mention_of_visuals_i_am_really_really/,TW mention of visuals.. I am really really struggling extremely bad,"Hey guys.  So it's been 12 days or not using.  Everyday has been just as miserable and difficult as the last.  I try to keep busy, it doesn't help the cravings. Everyday I imagine myself using again.  I'll be at work and have like a flashback type thing of me snorting a really great line and having s massive high,  I'll see myself snorting it and breathing heavy and smiling to myself at how great I feel and just going wow.  These kind of flashback type things happen all the time.  It makes it really can't to not do it.  I get so angry and irritable all the time.  Everyday I feel like I'm going to cavr.  I just want to feel good again.  I'm tired and my whole body aches so painfully all the time. I don't feel right at all",17,{},"{'label': 'negative', 'score': 0.8024177}"
2021-10-16 14:12:54,https://www.reddit.com/r/StopSpeeding/comments/q9hctq/flushed_my_last_5_grams_of_meth_this_morning/,Flushed my last .5 grams of meth this morning,"After taking one more shot of course. Now a few hours later I am getting that nagging regret, telling myself I should have held on to it for later.",37,{},"{'label': 'negative', 'score': 0.6440601}"
2021-10-16 13:02:59,https://www.reddit.com/r/StopSpeeding/comments/q9g01o/does_your_memory_return_after_quitting_stims/,Does your memory return after quitting stims?,"Been abusing stims off and on since 2001. Recently quit again, hopefully for good this time, and my memory is SO bad. Did anyone else have this problem from stims? I'm talking long-term, short-term, flash memory, any kind of memory I have is straight fried. I literally forget things as I'm doing them. I forget I even know people sometimes, people I've known for months. I read something I wrote a few days ago and have no knowledge of ever writing it. I forget to type important words in sentences, sometimes causing them to make no sense.

Shit like this is part of the reason I need to stay off stims for good this time. I just hope my memory returns someday, so I can go back to being  a functional person.

Did anyone else have their memory improve after quitting?",12,{},"{'label': 'negative', 'score': 0.7873098}"
2021-10-15 21:47:43,https://www.reddit.com/r/StopSpeeding/comments/q92dar/im_43_days_sober_update/,I’m 43 days sober (update),"I spent 38 days in residential treatment and it saved my life.  You can check out my last posts in my history to see where I was at.  

I’m somehow alive and sober.   I never thought I would be able to say I’m sober again.  I thought this shit would surely kill me, and honestly, I wanted it to.  That didn’t happen and I’m somehow alive and sober - life is worth living and I deserve a good one.  If you’re struggling w/ an addiction and feel hopeless, don’t fucking give up!  I was doing 2+ oz of meth a month and was starting to have to supplement w/ heroin just to maintain.  

Thanks to all the advice and if anyone is in the Austin area and in recovery HMU and we can go to some meetings",16,{},"{'label': 'positive', 'score': 0.43200085}"
2021-10-15 20:36:47,https://www.reddit.com/r/StopSpeeding/comments/q918tq/advice_on_stopping_adderall/,Advice on stopping adderall,I’m looking for all the advice I can get right now. I have been on adderall XR and IR for about 3 years now. I was prescribed it shortly after I finished at a treatment center for my eating disorder (specifically bulimia) although deep down I knew I needed to be careful. It was great at first but it has turned me into an angry and very low energy person in the same way my eating disorder did for years prior. I am a hairstylist and work 10 hour days and need to be on my A game all day. The days I try to skip my adderall which are my days off I can barely get out of bed. I sleep for the majority of the day and then I binge eat. Which then trigggers my bulimia again. So I feel as if I’m deciding between staying on a drug I know is bad for me or triggering my eating disorder. I would love any recommendations on how to do this and even what to expect. Fortunately I only take one 15MG extended release and 1 5mg immediate release a day but no idea how to do this without feeling like I’m trading one drug for the other (my eating disorder) … and I know everyone is different but also have no idea how long to expect withdrawals to last. Any help would be so appreciated!!!,4,{},"{'label': 'negative', 'score': 0.42372337}"
2021-10-15 20:26:42,https://www.reddit.com/r/StopSpeeding/comments/q912p7/advice_on_quitting_adderall/,Advice on quitting adderall,,8,{},"{'label': 'neutral', 'score': 0.7887687}"
2021-10-15 09:57:32,https://www.reddit.com/r/StopSpeeding/comments/q8ozkq/clean_as_a_mf/,Clean as a mf,I dont need that shit life is good. well rested employed mind sharp body taken care of. doing better than ever you can be here too just dont give up. i was 2 years in its never too late to start a new beginning. come on we all love you.,31,{},"{'label': 'positive', 'score': 0.92848915}"
