Date,URL,Title,Body,Score,COVID-19 Mentions,Sentiment
2020-04-17 14:48:20,https://www.reddit.com/r/StopSpeeding/comments/g37z6s/survey/,Survey,"Hello everyone,

I'm sharing a survey here [https://www.surveymonkey.com/r/R2YVPGD](https://www.surveymonkey.com/r/R2YVPGD) to collect data on barriers individuals struggling with a substance use problem face when trying to find appropriate help, and how technology might help eliminate some of those barriers. It would be really great if you could fill it out! It's complete anonymous.

Sharing your experience would help advance this research a lot and hopefully eventually help others like you. Thank you and hope everyone is staying safe ! :)",5,{},"{'label': 'POSITIVE', 'score': 0.9952686429023743}"
2020-04-17 13:17:35,https://www.reddit.com/r/StopSpeeding/comments/g368la/badly_need_to_quit_need_some_advice/,"Badly need to quit, need some advice.","I've been doing coke at least 3-5 times a week, for roughly 2 months or so now. I need to stop before I bury myself a hole too deep that's hard to get out of. I'm gonna attempt a detox at home starting today and if I fail this time I'm going to detox then rehab. I'm gonna take L-Tyrosine as it's good for replenishing dopamine and helps comedowns a lot I find. Any other supplements I can take? Will be exercising a lot too.",3,{},"{'label': 'NEGATIVE', 'score': 0.9931186437606812}"
2020-04-17 01:16:46,https://www.reddit.com/r/StopSpeeding/comments/g2vlgu/today_ive_finally_decided_to_stop_forced_to_stop/,Today I’ve finally decided to stop/ forced to stop,"I took the last pill I had today...I am stuck in Quarentine and do not have access to more. I’ve been wanting to stop for good for awhile..and I am ready to take back my life. I have been self medicating for years now off and on and it is damaging my mental health. I am all over the place. One day I think I’m doing great (normally when I’m speeding) then the anxiety hits me, and my come down is awful. I threw up today. My anxiety was so high I just kept working out to fight it and had so much caffine my body just couldn’t take it...but I think it was for the best.",33,{},"{'label': 'NEGATIVE', 'score': 0.9574031829833984}"
2020-04-16 21:32:30,https://www.reddit.com/r/StopSpeeding/comments/g2sdtq/ltyrosine_adderall_withdrawals/,L-tyrosine & Adderall withdrawals,So I read somewhere that L-tyrosine (precursor to dopamine and norepinephrine) helps to restore dopamine which was damaged by adderall & stimulants. I started to take it but still feel nothing . What are your experience and opinions about this supplement and its possible role in stimulant recovery?,17,{},"{'label': 'NEGATIVE', 'score': 0.9977007508277893}"
2020-04-16 18:28:14,https://www.reddit.com/r/StopSpeeding/comments/g2p83q/help_need_advice/,"Help, need advice","So I've been clean now for about 2 years, after having a heavy habit of injecting speed for over 12 years. 
My problem is that I still have no energy, I struggle to get up and get anything done, and end up just sleeping.
I have no motivation whatsoever and really need advice...will it get better?",5,{},"{'label': 'NEGATIVE', 'score': 0.9994978904724121}"
2020-04-16 18:06:29,https://www.reddit.com/r/StopSpeeding/comments/g2otea/dexedrine_the_good_the_bad_and_the_ugly_my/,"Dexedrine: The Good, the Bad and the Ugly (My Experience)","Hey everyone, thought I'd share my own story of struggling with dexedrine/ dextroamphetaine addiction over the past year or two. At the time of writing, I've been clean for about 2-3 weeks and am finally regaining some sense of control over my mind/ life. Running/ exercise and music have really helped in that regard. For reference, I'm a 21-year-old male from Europe, currently one year away from graduating university (I go to school in the U.S.)

The Good

I was first introduced to the drug by my best friend about 1.5 years ago- at that time, my own experience with drugs really only consisted of weed (was a massive stoner at the time) and a few occasional encounters with cocaine and shrooms. My friend had been diagnosed with ADHD from a very early age and had access to a very generous Dexedrine script. As we needed to cram through a relatively important assignment by EOD, he enthusiastically suggested I take some Dex- and as this was an important course, I said fuck it and accepted his offer. It was around 1 pm at the time, he gave me a 15mg XR and two 5mg IR pills, which I took all at once, not expecting much. About 45mins to an hour I really felt it kick in- the only way I could describe it at the time was that it felt like cocaine, but much more controlled and relaxed. I spent the next 9-10 hours demolishing the assignment, before moving onto other schoolwork- I probably completed about a week's worth of work in one sitting. Music sounded unbelievable, my Juul was hitting me on a different level, and I couldn’t stop talking. Although I didn't get a moments sleep and was later introduced to the hell that is as an amphetamine come down, I was fucking sold. For the remainder of the term, I would study with my friend every chance I could, largely to get my hands on more of those magic orange pills, which he was only too happy to provide. My grades shot up, I achieved nothing but As and Bs that term, ending the year with my highest average throughout my time at university. I used the stuff wisely too- when I had no schoolwork left, I applied to internships and jobs like never before, managing to secure a dream position at an investment bank that summer. By the time the exams ended and the term came to a close, I felt unbelievably grateful to have been introduced to this miracle drug- for once in my life/ university career, everything seemed to be under control and headed in the right direction- good grades, great job lines up for the summer and I had been accepted into the exchange program at my university. 

The Bad

There were a few early signals that these new habits were not as perfect as I perhaps imagined. For instance, at the end of the term I remember feeling sad that my exams were over because it meant no more dex-fueled study sessions- looking back, this should have been a major indicator that I was already becoming addicted/ dependent: what kind of fucking student is sad that final exams are over? (Lol). When I got back home to Europe that summer, those first days without access to dex I found myself in a lifeless, depressed state. Regardless, my new job and a generally fun time seeing old friends and partying got me through that summer. But in the back of my mind, I kept thinking about my first study sesh once I was back at school and reunited with my mate (we were both going to be spending the term on exchange). Whilst going on exchange during uni is supposed one of those once-in-a-lifetime experiences, spent partying and meeting new friends, it wouldn’t be the case for me. I ended up bullshitting my way to getting a prescription practically the first week of school (25mg/ day, 15mg XR and 2x5mg IR). I justified spending my days locked in my room studying by telling everyone I was taking a difficult courseload, made worse because it was a new/ different uni. The reality is that at this point I was completely hooked on dex- my daily intake typically hovered around the 50-60mg mark. I would pop them as soon I woke up and would spend the day going through my list of tasks like a robot with intermittent Juul breaks, whilst drinking absurd amounts of water due to the dry mouth. At the end of the day, I would deal with the comedown by smoking absurd amounts of weed- not a particularly healthy combination (mentally and physically). Although the point was to ace all my courses, it started having the opposite effect- although I spent all day studying and working my grades suffered more because I was rarely in class, usually skipping because I had been unable to get any sleep the night before. I lost all sense of enjoyment for the things I used to love- I stopped working out and playing sports completely, and I hadn’t come close to having sex all term (for perspective, I’d pulled 5-6 times that summer). Overall, dex addiction totally ruined what should’ve otherwise been a fantastic experience on exchange. 

The Ugly

We now arrive at the present aka this past school term until it was cut short by coronavirus. At this point, my life mostly consisted of binging dexedrine once I picked up my script, pulling 2/3 all-nighters a week and the occasional back-to-back one. Because I was consuming absurd amounts of the stuff, I’d usually finish my monthly supply within 10-15 days, the spending the time until my next refill as a lazy lump, mostly smoking weed and aimlessly picking around on the internet. I looked like shit- my weight fluctuated constantly and many of my friends remarked that I looked “older”, likely due to how little sleep I usually got. My logic or justification was that this was just temporary- a necessary evil to achieve the ultimate goal of graduating uni and moving onto the next stage of my life. When school moved online due to the coronavirus pandemic a few weeks ago, I ended up going back to my parents house back in Europe again where I was able to quickly transfer my American script and get access to the local equivalent. As usual, I wolfed down my script in no time (took only 10 days or so), but at this point my productivity is nowhere near what it once used to be, and my comedowns are causing me more anxiety than ever. The worst effects, however, would come once I ran out- as I had what can only be defined as a psychotic episode. Whilst attempting to sleep after a 2-3 day binge, I felI into a stream of 5-6 bouts of sleep paralysis in the space of an hour, which is terrifying enough to begin with, but each time felt so intense that I seriously thought I was fully awake and having a stroke. I have been able to really recognise the extent of my addiction/ dependency over these past few weeks- mostly bc of the fact that I’m in my parent's company (who can clearly see my mood swings/ changes in behaviour) and that there’s really no need at this point (moving online basically ended the school term early and most of the outside world is on hold atm). As I really have no reason to try and get more of the stuff (and definitely wouldn’t be able to somehow justify it to my parents), I decided that enough is enough- a long break is needed.",10,"{'rona': 2, 'virus': 2, 'pandemic': 1}","{'label': 'NEGATIVE', 'score': 0.9694191813468933}"
2020-04-16 11:51:41,https://www.reddit.com/r/StopSpeeding/comments/g2hhg9/its_a_cycle/,It's a cycle..,Hello everyone. This is probably a smaller thing to what I've seen so far seen on this page but 6 or so years ago I was diagnosed with ADD and was prescribed dexamphetamine to help with the symptoms. In the beginning I was instructed to take 7 a day (35mg all up) anyway for a while there it really fixed a whole lot but then it started to go pear shaped. I took more and more over the course of maybe 3 years. Usually going through 100 tablets in a week. I always managed to somehow get repeats super early then kept running out and finding myself saying something to my psychiatrist and getting extras when I ran out. I went without in the end because I fucked up and spent 9 months or so unmedicated. Once I made it through the withdrawals I still felt altered. I feel like something is lost. Like nothing is interesting to me anymore unless I'm taking pills and it feels like I can't go back to how I was before I got diagnosed and medicated in the first place. My brain just feels like it's different and I'm nothing without this stuff. It's been running my life for years. I'm just wondering if anyone else has been through this and if you have some advice you could give. Thanks so much :),19,{},"{'label': 'NEGATIVE', 'score': 0.9914785027503967}"
2020-04-16 10:31:39,https://www.reddit.com/r/StopSpeeding/comments/g2fza9/help_im_relapsing/,Help! I’m relapsing...,"5 days sober & I lost the battle, probably because of staying at the same room due to quarantine, the trigger is just insane, any tips due to this crisis for the next battle? Thank you",2,{'quarantine': 1},"{'label': 'NEGATIVE', 'score': 0.9986999034881592}"
2020-04-16 10:24:28,https://www.reddit.com/r/StopSpeeding/comments/g2fulf/i_am_terrified_of_the_likely_damage_i_have/,I am terrified of the likely damage I have incurred to my heart after a year of recreational/heavy cocaine use and really need some hope. Has anyone had lasting damage from use and is it manageable/treatable?,"I am a 27/f Canada, 5’1” and 105 pounds for reference.

I was introduced to coke just over a year ago through my bf and have been using maybe up to 4 times a month, typically long into the night. I don’t know exactly how much I use but would say I do 2-3 lines an hour for up to 8 hours at most sometimes. I’d say half the times I’ve used I was drinking as well which I know is terrible.
Last July (6 months into this type of use) I had an ECG done as part of another checkup and my doctor said there was something unusual about the result, something about q-waves. She said they sometimes see that in people who have had a heart attack but I haven’t had one so she said she wouldn’t worry too much. I didn’t think too much of it and my specialist who was supposed to review the result seemed to have forgot to bring it up during my appointment and she’s retired now.

I am in a state of panic right now because I’m reading more about coke and heart damage. While I knew it was a huge risk, because I wasn’t using daily I didn’t think it would catch up to me like this.
A few days ago I was laughing really hard about something (like a can’t catch my breath type of laugh) and noticed a sort of pressure or pulling on the left side of my chest which eventually dissipated after I stopped laughing and calmed down. This is when I became especially concerned. I looked into anginas and it seems like this could potentially be one except the ache was only in a specific area centre-left of my chest and I didn’t have the pain that supposedly goes down the left arm or anywhere else.

Can someone please tell me if any damage I could have caused is reversible? Does it sound like I could have a heart attack any moment? I know I’m an idiot, know I need to stop. I’m not reliant on it to function but my boyfriend is an addict and sometimes I end up using with him. I’ve also been very depressed for a long time so have not had much respect for my life and body, honestly.",1,{},"{'label': 'NEGATIVE', 'score': 0.9979881048202515}"
2020-04-16 03:25:38,https://www.reddit.com/r/StopSpeeding/comments/g2aass/resources_for_a_friend_experiencing_we_think/,Resources for a friend experiencing (we think) meth-induced psychosis.,"My best friend has begun having auditory hallucinations since the start of the covid lock down. He hears voices, is obviously laughing at himself sometimes, mildly paranoid, and is randomly agitated.

He quit using meth around March 18th after about 8 months of binging behavior, and (according to him) has relapsed once, the voices haven't gotten quieter at any point during his sobriety. The voices keep him up at night and apparently are telling him hearing voices isn't normal and he needs help. He has never had any mental issues before this- and with the voices starting so soon after he quit cold turkey, leads me to believe it is meth induced.

He isn't to a point where this is dangerous in my opinion, I am bigger then him and could over power him in most scenarios. He also recognizes these aren't real voices and normally catches himself if he is getting angry for no reason.

I am kind of lost here, this is my best friend and he dropped most of this on me the last few days and he doesn't know what to do. He is going to stay with me for the week so I can help him get a grip on things.

I hope that if I convince him to sober up permanently from meth, it can help clear this up, but I don't know if maybe I should talk to his dad about getting him set up at a hospital or something for 30 days. Which I doubt they would even accept him with the lock down going on.

Any help or advice would be greatly appreciated.

And any word from anyone that has experienced meth psychosis in the past would be a huge help.",2,{'covid': 1},"{'label': 'NEGATIVE', 'score': 0.995403528213501}"
2020-04-15 18:30:35,https://www.reddit.com/r/StopSpeeding/comments/g22c0c/11_months_sober/,11 months sober.,"No longer get random cravings.

I sometimes get them if someone explicitly describes their experiences on a stimulant. But otherwise, not at all.

It does get better. Keep at it guys. You can do it.",66,{},"{'label': 'NEGATIVE', 'score': 0.8650394678115845}"
2020-04-15 12:55:46,https://www.reddit.com/r/StopSpeeding/comments/g1vtvn/2nd_day_of_the_rest_of_my_life/,2nd Day of the Rest of my Life,"After yet another relapse that lasted about 10 days, I’ve decided to get back with the program of living.  

Each relapse brings a huge loss.  At the moment I am alone in my home having given up the privilege of seeing my children. Fortunately they are with their mom which is a much safer place to be.  

I hope this is rock bottom.  I know that I can potentially go much lower.  Do I need to completely burn my life to the ground before I get serious about staying clean?  I certainly hope not.",7,{},"{'label': 'NEGATIVE', 'score': 0.9985381364822388}"
2020-04-15 10:56:46,https://www.reddit.com/r/StopSpeeding/comments/g1thg0/study_shows_antioxidants_can_repair_damaged/,"Study shows Antioxidants can repair damaged Dopamine Neurons associated with Meth-induced low dopamine levels. Vitamin E, Selenium, NAC, & Melatonin all help restore damaged reward system. Vitamin D helps too but differently.","[https://www.ncbi.nlm.nih.gov/pmc/articles/PMC5266860/](https://www.ncbi.nlm.nih.gov/pmc/articles/PMC5266860/)

&#x200B;

Essential, these supplements reduce/reverse oxidation stress that causes death of Dopamine Neurons. DA neurons death causes low dopamine levels associated with methamphatimine withdrawals, lingering depression, and cravings.  Meth is just oxindated ephedrine  to my limited knowledge. Avoid NSAID's they inhibit these supplements and increase oxindated stress.  Hope this provides some relief to someone.",64,{},"{'label': 'NEGATIVE', 'score': 0.9883164763450623}"
2020-04-15 04:53:50,https://www.reddit.com/r/StopSpeeding/comments/g1oa7a/first_post_here_how_do_you_deal_with_the_cravings/,"First post here, how do you deal with the cravings! :(",I started using meth two years ago when I was really depressed & ever since then its been a shit show. I relapsed after 2 months today because I had a damn craving.. I feel so damn weak to this drug.. What do you guys do about the cravings? Do they ever go away..? Next time I go sober I want to stay sober but I have a horrible track record.,4,{},"{'label': 'NEGATIVE', 'score': 0.998960018157959}"
2020-04-15 04:18:59,https://www.reddit.com/r/StopSpeeding/comments/g1nvbt/i_miss_the_inspiration/,I miss the Inspiration,"I used heavy daily for about 18months and then kicked it in February of this year. I had the best art of my life while using, sold pieces for hundreds of dollars (even surprised myself), had inspiration everywhere, didn't make it my sole income because that's unrealistic. BUT I could draw or create whenever without a pause. I can't draw anymore. I have nothing in my mind and I barely can finish the commission murals I have spent the cash for by surviving COVID-19.

Well quarantine cleaning got me to find some and I jumped down the hole again happily but I don't have the same flow.

Is this a thing for others? Many questions. Or is this just me?",27,"{'covid': 1, 'quarantine': 1}","{'label': 'NEGATIVE', 'score': 0.9964171648025513}"
2020-04-14 18:28:19,https://www.reddit.com/r/StopSpeeding/comments/g1fdhf/the_waiting_room_for_me/,The waiting room for me.,I gotta make a phone call 📞,0,{},"{'label': 'NEGATIVE', 'score': 0.9987308382987976}"
2020-04-14 17:33:06,https://www.reddit.com/r/StopSpeeding/comments/g1ed9s/any_dental_recovery_stories/,Any dental recovery stories?,"26m, >5 years of smoking. My teeth look and feel like mountainous valleys. I'm always aware of how my teeth feel. I want and probably need a gum graft but I have no insurance. My gums are getting so thin and short that I fear my front teeth are going to eventually loosen and fall out. I feel like there's no coming back from this. I just want to keep digging my hole until it's a grave.",5,{},"{'label': 'NEGATIVE', 'score': 0.999313235282898}"
2020-04-14 10:54:40,https://www.reddit.com/r/StopSpeeding/comments/g16ywl/21_days_adderall_free/,21 days adderall free!,"After taking for 3 years. I’m also quitting caffeine too just to give my nervous system a much needed break. I’m starting to regain my normal energy and motivation. It’s tough though, each day is a struggle in almost a different way. Every time a hurdle comes up I have to remind myself that adderall wouldn’t make this any better, the best way to handle this moment is with the innate resources and motivation I have right now and to get a good nights sleep after it. What we have within us is all we ever need. The best drugs are literally our own levels of neurotransmitters and hormones if we learn to channel them appropriately and balance them with nutrition, diet, sleep, routine, purpose, (and if applicable to you, spiritually). Let’s go y’all!",58,{},"{'label': 'NEGATIVE', 'score': 0.6889801621437073}"
2020-04-14 05:48:33,https://www.reddit.com/r/StopSpeeding/comments/g12nuc/quitting_for_now_and_the_foreseeable_future_cant/,Quitting for now and the foreseeable future cant say forever because ive said that before,Used daily since relapse 14 days ago not cool im guessing im gonna be in the bed for 2 days send love i know i can do it wicked headache now on comedown wish instead of relapsing i could snort a line that made me feel like such shit so id know whats up but with crystal i lose control of my will power and i cant be around it without using my brain changes its thinking even tho i know i cant use thats the scary part for me and nothing scares me like that how can it take such a grip no matter tho im stronger🙌 we all are i relapse every time i see my 4 year daily user best friend since 6th grade gonna hurt him i think but cant risk someone who doesn't want to stop so putting myself first over a trash friendship i hate,3,{},"{'label': 'NEGATIVE', 'score': 0.9984408020973206}"
2020-04-14 05:27:25,https://www.reddit.com/r/StopSpeeding/comments/g12fn7/first_time_poster_i_qauit_meth_23_months_and/,First time poster. I qauit meth 2-3 months and relapsed Thursday.,I flushed the rest like an hour ago. Hopefully this time I'll be stronger. I hate meth for making a fool out of me. I'm not special I'm just another person who thought they could handle anything. Wish me luck!,23,{},"{'label': 'NEGATIVE', 'score': 0.9975741505622864}"
2020-04-13 19:59:59,https://www.reddit.com/r/StopSpeeding/comments/g0uqov/getting_sober_while_in_quarantine/,Getting sober while in quarantine,Anyone have any advice on quitting vyvanse while in quarantine - Especially when isolation is a trigger?,13,{'quarantine': 2},"{'label': 'NEGATIVE', 'score': 0.9985232949256897}"
2020-04-13 12:05:10,https://www.reddit.com/r/StopSpeeding/comments/g0lu65/does_adderall_leave_permanent_brain_damage/,Does adderall leave permanent brain damage?,Have been taking 20mg of adderall almost everyday for the past 5-6 years. I quit recently. Do you think this dosage of and length of taking adderall can cause permanent brain damage?,30,{},"{'label': 'NEGATIVE', 'score': 0.9993483424186707}"
2020-04-12 20:57:29,https://www.reddit.com/r/StopSpeeding/comments/g08ls1/sober_4_months_exactly_after_6_years_meth_use/,Sober 4 months exactly after 6 years meth use,Its been hard still feel the urge to use currently in sober living going to stay here 6 months then well see where it goes from there hmu ama,35,{},"{'label': 'NEGATIVE', 'score': 0.8883411288261414}"
