Date,URL,Title,Body,Score,COVID-19 Mentions,Sentiment
2021-01-22 13:54:13,https://www.reddit.com/r/StopSpeeding/comments/l2uaww/how_are_you_doing_today/,How are YOU doing today?,"Hey everyone. I quit adderall 40 days ago and have been doing amazing. I’ve stopped visiting this sub, but wanted to come back on check on everyone. This subreddit really did help me, and I want to do my part and help others. Let me know how you’re doing! I’m always available to message as well.",37,{},"{'label': 'POSITIVE', 'score': 0.9994810223579407}"
2021-01-22 13:44:14,https://www.reddit.com/r/StopSpeeding/comments/l2u3kp/relapse/,relapse,"sometimes i really do wanna relapse; i think about smoking meth almost everyday. it’s always on my mind in some way or form. And the worst part is if the right person asked me, like my ex, asked me if i wanted to smoke with him i would probably say yes. that’s how i know i can never see him again; because i would say yes and i would be an awful person for that. i would love to just run away and fuck off and get high, but i know that right now isn’t the time to do that... but i’m scared to see what will happen once i graduate college.",6,{},"{'label': 'NEGATIVE', 'score': 0.9972508549690247}"
2021-01-22 12:21:40,https://www.reddit.com/r/StopSpeeding/comments/l2sbso/set_up_an_appointment_to_tell_my_doctor_to_cut_me/,Set up an appointment to tell my doctor to cut me off,"TL;DR: Can't stay quit on my own, need to sabotage a future relapse in any way possible. Afraid I will talk myself out of it before the appt. next week. 

First started in on speed when they put me on adderall in 4th or 5th grade.  Started abusing in college.  I'm 33 now and I've tried to quit several times over the past few years.  Longest I'll make it is about 6 months before throwing in the towel and re-upping.  I really thought I was going to kick it for good last year but I caved when things got crazy at work, as always.  I am *100% incapable* of taking this medicine as prescribed.  About to casually run out of a 30 day scrip I filled last week.  The only way is for me to not have an option to go running back to my doctor every time things get tough.

I'm afraid to quit.  I'm working 2 jobs right now, pulling 15 hour days 2-3x/week, and I am overloaded at both jobs. I can't take a week off to sleep all day and I can't just quit and find something less stressful--I'm starting out my career and I need this work to get fully licensed.  I could drop my part-time job but it's such an unbelievable opportunity and with the way things are right now I count myself lucky to even have one job.  Plus I really need the money.  I'm about 70k in the hole after grad school.  Without the stims I am going to struggle and make costly mistakes at work and there is no getting around it. I will be hard-pressed to focus on any hobbies.  I will be depressed as fuck for a while. I will have to accept that.  

That being said, the reasons to quit outweigh any of the negatives that come w/ PAWS and unchecked ADHD. As long as I stay on this bullshit I am missing out on time with my beautiful wife because I want to be alone when I get home. My health is at stake. I have no balls anymore when it comes to doing things I don't want to do. I'm not funny or fun to be around like I used to be. Plus I am hiding it from everyone; nobody knows but me.

This will sound crazy but the number one reason I want to quit is for my dog.  He gives me this look and I can tell...he KNOWS when I'm on this shit and he hates it. And every time I skip a walk to stay at home to be a degenerate is one less walk I'll have with him before he is gone.  That is something I cannot accept. 

Addiction is a crazy thing.  My main concern right now is that I will change my mind before I am scheduled to talk to my doctor--I couldn't get an appointment until next Thursday.  I told the receptionist I want to talk to the doctor about side effects but I'm thinking maybe I should call back and tell her the truth so she passes that message along before I talk myself into some new reason why I should quit some other time.

Sorry for the rant, this felt really good to type out though.  The shame is real.  I'd give a million dollars to have never been given a taste of this stuff to begin with.",7,{},"{'label': 'NEGATIVE', 'score': 0.9988275170326233}"
2021-01-22 04:19:35,https://www.reddit.com/r/StopSpeeding/comments/l2k4lr/im_going_to_quit_nobody_knows_im_alone_and_this/,"I'm going to quit. Nobody knows, I'm alone and this is scary.","I've been doing meth for 1 month (2 months in 3 days) and it started really slow cause I was afraid and felt guilty every time I smoked, now I smoke too much, like... TOO MUCH, a bag used to last maybe 10 days and now it's just like 3 days.  I did it the first time cause I was drunk and I loved the fact that I felt like I didn't need sleep or food and also my sex drive went up. 

Now, I wanna quit cause last week I had a job interview and I felt like shit. The fact that I don't sleep or eat made my body look really thin and sick, I got super tired only by walking a few minutes, my depression got worst, I have problems with my gums and my teeth hurt, I get super grumpy with my bf because I wanna have sex all day (I don't treat him any different, I just hide this) and my HR in rest went from 60 to 100. Now I wake up and the first thing I do is smoke. This is becoming unsustainable and I'm tired of the lies and the fact that I've been hiding all this damn time.

I've been lying to my family, boyfriend and friends, nobody knows and I'm scared to quit alone and feel the simptoms. I hope someone has an advise to quit alone. I'm going to delete the dealer number right now but I don't know wtf to do.",54,{},"{'label': 'NEGATIVE', 'score': 0.9976551532745361}"
2021-01-22 02:43:08,https://www.reddit.com/r/StopSpeeding/comments/l2ivaq/stop_speeding_as_a_student/,Stop speeding as a student,"Has anyone successfully quit meth (or any amphetamines) while attending school and was still able to learn and do well during withdrawal? I am on day 2 without meth, and it took me an hour just to write this post. I am not sure if I can make it sober, especially b/c of covid and online learning.",9,{'covid': 1},"{'label': 'NEGATIVE', 'score': 0.9992454051971436}"
2021-01-21 19:30:47,https://www.reddit.com/r/StopSpeeding/comments/l2bt60/what_does_heavy_adderall_use_do_to_you/,What does heavy adderall use do to you?,"Currently pretty addicted to adderall. However, I also believe I need the adderall in order to go about life. I can’t really imagine a world where I stop. If I just keep using, what will happen? How long can I keep this up? I’m 25 rn.",14,{},"{'label': 'NEGATIVE', 'score': 0.9886351823806763}"
2021-01-21 16:36:47,https://www.reddit.com/r/StopSpeeding/comments/l28f7r/im_miserable_constant_pain_from_gum_recession/,I'm miserable. Constant pain from gum recession.,"27, no issuance. It's making it easier to stay clean but God damn my gum line stays aching. It could be a lot worse though. I got a couple 3-4mm my last dentist visit and possibly a couple 5mm. I remember 3 years or so ago when my canines first started to chip slightly. Fuck this shit. You only get one set of gums and teeth folks. Thanks for listening to me vent 😖",3,{},"{'label': 'NEGATIVE', 'score': 0.9988106489181519}"
2021-01-21 14:44:53,https://www.reddit.com/r/StopSpeeding/comments/l261tf/1_month_clean_today/,1 month clean today,"I don’t know who to tell outside my one family member. It’s just ADHD meds(adderall and vyvanse) but I wanted to tell someone else. Thanks for the support y’all, it keeps me going. I’m not going to give up on myself and neither will you. Yesterday marks a new era for the US and let’s hope that can contribute to a new era of ourselves. It’s hard everyday, but I have hope that I can wait it out.",68,{},"{'label': 'POSITIVE', 'score': 0.9902933835983276}"
2021-01-21 00:14:35,https://www.reddit.com/r/StopSpeeding/comments/l1rp34/advice_for_someone_who_is_about_to_quit/,Advice for someone who is about to quit?,"A little Background - My first time smoking meth was only about two months ago. Each session didn’t last more than a day and in between waited a week or two before doing it again at least. That didn’t change until last week. Last week I smoked for two or three days, this week for three days now, with almost 6 days in between. My gums are inflamed and they started bleeding just in the last three days.

Questions- 
As short and little as I’ve smoked, is it normal for my gums to be this bad? 

What are some ways I can fix my gums?

So far I’ve never had cravings or had problems putting down the pipe. I’ve already thrown away the pipe but I need advice for staving off potential cravings if I do develop them. 

I’d love the advice and welcome all messages from you guys!",3,{},"{'label': 'NEGATIVE', 'score': 0.9953672885894775}"
2021-01-20 20:50:02,https://www.reddit.com/r/StopSpeeding/comments/l1o6w4/this_is_one_of_the_first_times_i_have_been_able/,"This is one of the first times I have been able to tell myself “hey, if I really buckle up and put the effort in, I know I can graduate this year.”","1 month clean from all hard stimulants (1 month clean from Benzedrex, 2.5 months clean from Adderall, 6 months clean from meth). Didn’t think I’d ever make it this far, didn’t ever imagine myself not using stims.",9,{},"{'label': 'NEGATIVE', 'score': 0.559669017791748}"
2021-01-20 14:38:20,https://www.reddit.com/r/StopSpeeding/comments/l1go3r/last_day_of_ritalin/,Last day of Ritalin,"Today is my last day of Ritalin before I start my two week tolerance break. What is the best supplements to help with the fatigue and body heaviness? I’ve tried L-Tyrosine and it helps a lot, but I was wondering if anyone had any other recommendations that would help. I also take an SSRI every night as well, so I know I can’t take St. John’s Wort, Valerian Root, or 5-HTP because of serotonin syndrome. Any suggestions would great. I kind of know what to expect and the first week is always the hardest for me personally.",3,{},"{'label': 'NEGATIVE', 'score': 0.9760839343070984}"
2021-01-19 16:15:33,https://www.reddit.com/r/StopSpeeding/comments/l0tg28/inability_to_develop_a_sense_of_self/,Inability to develop a sense of self,"Been doing stims for about 8 years, started with mph and now moved on to all the big ones meth, yay, and rc's occasionally. I'm 25 now and have no idea what life looks like outside this. I have no idea who I am except for the unhinged dude who exists on the edge of everyone life. When I'm spun I think I come up with a plan for a future but when I sober up they dissapear and I end up just surviving again until the next relapse. I guess the question is how do you develop a sense of self seperate from stims and actually actively live while not on them? I want more than this.",37,{},"{'label': 'NEGATIVE', 'score': 0.9959911704063416}"
2021-01-19 15:00:48,https://www.reddit.com/r/StopSpeeding/comments/l0rujg/cravings/,Cravings,"Hey what up family.. I’m 4+ months clean from daily adderall abuse and honestly haven’t really craved it too much up until now. The issue is I’ve fallen behind on producing music and just get stuck a lot of the time and lose my will to continue. Same thing with the video game I play, I am trying hard to get better but I feel stuck. Adderall always helped with those 2 things my main hobbies. Anyway, I am not going to give in but is it normal to feel “stuck”? Some days are worse than others and some days I don’t even feel like this. I just wonder if it has to do with the withdrawal or if at this point it’s just how I am. Thanks",14,{},"{'label': 'NEGATIVE', 'score': 0.9987635612487793}"
2021-01-19 12:37:43,https://www.reddit.com/r/StopSpeeding/comments/l0orrs/tw_eating_disorder_having_trouble_staying/,"[ TW: Eating disorder ] Having trouble staying motivated to stay clean, when something else is going wrong (relapse)","Hey everyone  I want to start out saying I'm going to talk about eating disorders and my experience, so if this is triggering to you you may want to stay clear :)

&#x200B;

**TL:DR ;  I've relapsed into my anorexia and I've been using stimulant binges as an ""escape"".. I'm a little lost..**

Sooo basically my situation is that I've been doing stims again.... Just like when I first started, I started with a single session that was somewhat responsible, but then it changed into a binge. Now I'm binging on stims once a month or something again...  I had a realization yesterday that my mindset has changed,  I don't really feel motivated to stay clean anymore. I mean I do want it ,but I just don't have the willpower and effort anymore.

This is because, since a few months or more ago, I've relapsed into my restrictive eating disorder (AN). I've been loosing weight and am pretty underweight currently,  luckily I manage to stop myself from going too far most of the time, and try to sustain my health but my weight is still slowly dropping (people notice and some start to worry, idk how long I can go on without reaching a point where I'd need medical attention, even though I'm trying to loose as little as possible). It's very painful because, just like with stims, this is my addiction. It makes me feel really good in a strange way, and whenever something happens that triggers me emotionally,  I turn to eating less and loosing weight. And just like with stimulants,  what gives me the most pain is the thought of having to worry the people close to me.

I really don't want to be and look sick, and worry them, or even end up in the hospital. But since I'm going through all this,  my mind tends to go to ""fuck it"". It's all the same shit over and over in my mind and I'm so tempted to use stims again just to escape it. I'm trying to replace my restrictive addiction with my stimulant addiction:  when I was most recovered from my ED,  I was also at my worst with irresponsible drug use.

I know it doesn't make any sense to replace one with the other, and it will harm me. But it seriously feels like it's impossible to stop both at the same time. On top of this, I'm so scared of asking for help because I've heard from other sufferers before that they won't let you into treatment if you're also an addict,  and if I just go to a rehab,  I'll relapse even harder into ED rituals which makes me afraid for myself. If I just go to ED treatment,  I'll have to quit everything cold turkey and I don't know if I can handle that mentally...

Anyway I don't even know if anyone can give any advice that would help, I just want to get this off of my chest and any encouraging words would be very appreciated. Just feeling a little hopeless and alone, I haven't been able to tell anyone yet because I can't let go over the control I have over my eating and body currently, I get anxious thinking about people knowing because I'll loose that control.",27,{},"{'label': 'NEGATIVE', 'score': 0.9937438368797302}"
2021-01-19 04:45:33,https://www.reddit.com/r/StopSpeeding/comments/l0gohw/addicted_to_mephedrone_what_are_the_first_steps/,Addicted to mephedrone what are the first steps to feeling better?,"I relapsed on rcs this week and i started and havent stopped for 5 days, im so tired of being sober only to fuck it all up after i get offered a line, im just tired of feeling depressed, the messy room that ive been wanting to clean for so long, my mom who i know im only letting down, she cares about me and im just a piece of shit  whos letting everybody down, my whole family and everyone alawys told me i was gonna be somebody once and have something and now they all just feel pity for me and im just so tired of everything.

I just wish i could go back to feeling how i used to.",14,{},"{'label': 'NEGATIVE', 'score': 0.9995885491371155}"
2021-01-19 03:04:40,https://www.reddit.com/r/StopSpeeding/comments/l0fe0h/never_used/,Never used...,"I have a family member that is an addict. Sadly he seems to be too far gone ive had conversations with him about getting clean and it just seems he tells he he wants to/ tryed to just because thats what everyone around him wants him to do. I stumbled into this subreddit scrolling through it almost made me tear up you guys are doing what needs to be done! I know you dont know me but I am very proud of each and everyone of you and to those here looking for help your included

Idk if i can help in anyway but im here",15,{},"{'label': 'NEGATIVE', 'score': 0.9903372526168823}"
2021-01-19 02:30:50,https://i.redd.it/h8qb0tiur8c61.jpg,I cleaned my room for the first time since relapsing on my birthday.,,59,{},"{'label': 'POSITIVE', 'score': 0.9256840348243713}"
2021-01-18 23:55:22,https://www.reddit.com/r/StopSpeeding/comments/l0cm9z/anyone_else_smoke_heavily_through_their_recovery/,Anyone else smoke heavily through their recovery?,"Not like it’s anything new, I’ve been smoking weed for like 8 years now.. the last 2 mostly daily. But since I quit meth, I’ve been a dabbing machine. 24/7 high grade concentrate.

I don’t know if it’s helping me or hurting me.. probably the latter, but for now I’m just happy to be meth free and feeling good.",13,{},"{'label': 'POSITIVE', 'score': 0.9981250166893005}"
2021-01-18 21:47:58,https://www.reddit.com/r/StopSpeeding/comments/l0ae9s/pls_help_vyvanse_addict_whos_life_is_falling_apart/,pls help vyvanse addict who's life is falling apart,mainly cos I cant n never have been able to do anything efficiently without it but all the other symptoms that come w it are making me paranoid im having a heart attack getting heart failure all the god damn time. I just wanna live a productive sober life but I fear im gna go nuts tryna go sober whilst juggling uni and living w my parents who r gna constantly hound me abt getting a job if I do quit uni n oh boy am I gna go insane not having a job or uni during covid FUK HELP,15,{'covid': 1},"{'label': 'NEGATIVE', 'score': 0.9983003735542297}"
2021-01-17 21:14:54,https://www.reddit.com/r/StopSpeeding/comments/kzksj0/fuck_day_29_and_change_been_leaking_tears_all_day/,FUCK... Day 29 and change. Been leaking tears all day.,"Fuck... in 7 hours I will have 30 days clean from meth, adderall, herb, gambling and drink. 
My girlfriend of 9 years left with her daughter 2 months ago. My Dad died last Sunday. I have 14 more days on my lease with nowhere lined up. I spent my last 10 bucks on dinner for my son and I, knowing I wasn't going to have any more money for smokes. 
My ex came over today to drop something off and all I wanted to do was melt into her arms and never leave. Instead I was short and a dick. 
Went to sleep last night listening to a 24 hr NA meeting. Woke up and listened again for an hour or two. 
Literally been leaking tears all day. Sad. Lonely. Having a hard time moving, getting out of bed.
Really wanted that orange 30 day tag from NA that ill get tomorrow night. Thought I was going to feel proud. I've never choosen to be sober. Let alone a streak. My kids have never known me sober. This is the first time. I don't feel proud though. This shits my fault. It all is and all I feel is sad and lonely and severely depressed. 
I have a half of a bottle of ads that I kept to try and sell. Havent though cause I don't want to go around the people who want em so they just sit in my car taunting me. I know I could go to a buddies and take bong rips into oblivion. I haven't though. I just want to succeed at something I didn't think I could do. Kinda. I also kinda just want to say fuck it. Get high as fuck. I keep asking myself, what difference is it going to make? I know though. Ill start tom in the same shitty situation and feel even worse about myself.  Feeling any worse wouldn't be safe. I know that too. So I sit... trapped. By my dream to be a better me. Someone that I respect and love... maybe. Or the disappointment that i knew I wasn't shit but a dope fiend p.o.s.. Or I do nothing and just lay here and cry wishing a bolt of lightning would fly thru a window so it can't be put on me. 
Fuck...",36,{},"{'label': 'NEGATIVE', 'score': 0.9978196620941162}"
2021-01-17 16:58:34,https://v.redd.it/6qbu24nqsyb61,Fuck meth,,155,{},"{'label': 'NEGATIVE', 'score': 0.9987747073173523}"
2021-01-17 13:30:53,https://www.reddit.com/r/StopSpeeding/comments/kzbvwd/update_still_going_strong_250_days_coke_free/,Update: Still going strong 250+ days coke free,"I'll never stop talking about how proud I am to finally kick my coke habit. I made it through the second half of a fucking pandemic maintaining my coke free streak. 252 days according to my quit app. 

If I can do it...you can. Reach out if you need support or help. I'm no expert but I've fought tooth and nail to crawl out of a pretty grim reality. I can listen if you need to vent. Don't wait for tomorrow.

There is a light at the end of the tunnel, no matter how dim it seems initially.",41,{'pandemic': 1},"{'label': 'NEGATIVE', 'score': 0.5836830139160156}"
2021-01-17 09:50:11,https://www.reddit.com/r/StopSpeeding/comments/kz7ou8/17_year_old_might_be_addicted_to_adderall/,17 Year old might be addicted to adderall.,"I don’t really know if I wanna quit but I’m posting this here because I’m sure you guys know wassup with stims.

So I’m diagnosed with pretty bad ADHD (trust me I’m one hyperactive motherfucker when not on stimulants) as a kid. Been prescribed stims since I’d say 5th-6th grade. I’m a junior now. But I’d never take it daily for a very long period of time. During vacations, I’d get like a 1-2 month break from adderall. Same with the week ends. 

People say they don’t like adderall because it kills their personality. Well actually, thats what not having adhd is like. Calm, focused, motivated, etc. I actually love being on stims because I really don’t like it when I’m hyper and day dreaming constantly. I also like being motivated a lot. My personality remains.

Now adderall has kept its effectiveness pretty well over the years. But recently, I really don’t know and it’s kinda scary... here’s why, so whenever I’d take adderall (I’m doing online school) I’d WANT to do something productive, like let’s say I was watching YouTube in front of my laptop where I do my school work. Watching YouTube won’t be enjoyable. Because my brain knows that doing this certain task won’t give me that dopamine hit I’d usually get. But whenever I do school work, I’m enjoying it and getting shit done. 

Now this leads me to my next point. As of recently I have no idea why, but whenever I’m on adderall, I tend to want to get “cheap dopamine”. Basically the complete opposite of what I said in the previous paragraph. Like I’ll enjoy browsing Reddit over doing school work, and this kinda scares me because idk but that may have something to do with being addicted or something with my dopamine receptors. I’d like to also say I take 25mg XR.

This is what blows my mind and is kinda confusing? So I check the medicine cabinet, and I find some Vyvance. Like 10 30mg capsules. I say, why not fuck it. After all it’s a prodrug to adderall right? Metabolizes to adderall pretty much. Well you won’t believe what happened. I got a fuck load of shit done. AND it lasted wayyyy longer. Adderalls focus would be worn off at around 3-4pm but I’m still calm. This shit lasted till like 6pm. Like I wanted to get work done, and any distractions were non existent. I didn’t wanna get “cheap dopamine”. What’s funny is when I was talking to my doctor recently (this was when adderall wasn’t being dog shit) she asked me about Vyvance (I forgot to mention this but whenever I was a kid I tried Vyvance and it sort of killed my personality) I told her it gave me undesirable effects a long time ago. But now I’m kinda thinking of asking her about it because this shit works too good.

What’s also weird is, I was thinking of giving Dexedrine a shot, but idk if I wanna do that now, vyvance works very well for me. 

My question is, why is adderall making me wanna get cheap dopamine and not do my school work? (Forgot to mention this but most of the time I push myself to do my work ik it’s not good to depend on a med). And why does vyvance work so well even though their basically the same drug? Would Dexedrine give me the same result? Thanks",4,{},"{'label': 'NEGATIVE', 'score': 0.9960353970527649}"
2021-01-17 05:28:42,https://www.reddit.com/r/StopSpeeding/comments/kz440a/dealing_with_nostalgia_of_early_usage/,Dealing with nostalgia of early usage?,"So the past days I think alot about my early usage how good it made me feel at the beginning and how alive I felt, I have all those vivid memories of me going outside feeling the sun on my face feeling like im on top of the world and like I'm the best version of myself while high speed paste, Always wishing it was like that again but I know deep down it will never be like that again even if I use again the high is really not what it used to be after 4 years of abuse.

How can I deal with those memories and the cravings that come with them?",9,{},"{'label': 'POSITIVE', 'score': 0.9986783862113953}"
