Date,URL,Title,Body,Score
2021-06-18 02:35:49,https://www.reddit.com/r/StopSpeeding/comments/o2inbk/i_blocked_my_plug_the_other_night/,I blocked my plug the other night,"I’m prescribed adderall for my adhd, 12.5 mg IR 2x a day. I was getting to a point where I would take 60 pills in the span of 3-4 days, and then I would call my plug for some more. In therapeutic doses it is amazing, but I know it takes time to adjust and get in the mindset that my prescribed dose is better in the long run. I know that if I don’t stop I’m going to end up really hurting myself. It’s tough shit. I blocked my plug for good, I told him not to sell to me even if I harass the shit out of him (I don’t do that but I’ve seen people around me get desperate). It’s not completely stopping but it is harm reduction. One day at a time, hopefully this fatigue wears off in the near future. Or it won’t. I have lupus so every day is unpredictable just about. I know abusing adderall definitely doesn’t help my flare ups, and the old me would not have given a shit. I need to start looking after my health because this can be serious and I would hate to hurt the people who love me. I realize how noticeable it is when I’m tweaking, meanwhile I’m thinking about how smart I sound and “look at me! I’m deep cleaning your fucking house even though you never asked”. People would ask me if I’m okay and now I understand why.",19
2021-06-18 00:22:06,https://www.reddit.com/r/StopSpeeding/comments/o2ghb9/24_days/,24 days,"24 days clean from that evil bitch Tina and I feel good about that. I burned my life down around me and am now dealing with the consequences, and today I was bummed fuck out but I didn’t even consider using. This isn’t my first clean time but it will be my last.  I’ve had 3-4 months a couple times this year and luckily only short relapses that haven’t gone more than a week til the last one. I had a close call the other day after an NA meeting. I was just trying to help a struggling person out and give them a ride back to their treatment center and things devolved quickly, I had an option to use and instantly had major anxiety, started sweating profusely, and horrible thoughts of using. I dropped her off, went home called my sponsor then  had some rips of my weed pen and went straight to bed. I was supposed to go see some buddies at their shop but I was shook and I canceled. It scared the absolute shit out of me and I’m still rattled. That being said, I learned how fragile my sobriety is, and I learned that I should set better boundaries with people. I was disgusted with my thoughts and justifications while in panic mode. It’s truly insane how dangerous this addiction can be. Sending good vibes out to all of you, and if anyone is struggling and needs to chat feel free to dm me.",39
2021-06-17 19:33:23,https://www.reddit.com/r/StopSpeeding/comments/o2b2vc/anyone_take_high_doses_of_concerta_and_have/,Anyone take high doses of concerta and have neuropathy in their feet,"A few days a month I will take high doses of concerta and stay awake one night, maybe 2 nights in a row. I am type 2 diabetic and have had neuropathy in my legs for a while now. 

Well on my concerta days my neuropathy is the worst. The tingling and burning feeling is so bad. Plus I have RLS, so I have to constantly move my feet. 

I also smoke cigarettes, take kratom everyday.. does this happen to anyone else?? Anyone know why this is happening? Please someone tell me I am not alone??",7
2021-06-17 08:26:55,https://www.reddit.com/r/StopSpeeding/comments/o1w173/longest_ive_been_sober_in_3_years_is_8_days_i/,Longest I’ve been sober in 3 years is 8 days… I want to quit so bad and could really use any pointers,"Disclaimer: Long post 

i never wanted to quit before honestly. This is the first time. I’m an addict and i can’t change that, but i can change my decisions. I always felt hopeless because I thought after 8 days being sober since I didn’t get my energy back that I might as well not give stims up.

 I’m reaching heart attack level doses now just to get a high and I’m destroying the relationships that I know mean the world to me because of how these fucking pills make me feel. I took 400mg vyvanse and a bunch of modafanil over a 4 day bender the other day and i didnt even want to anymore I almost felt like I had to. They don’t help me anymore. 

Im running away from my problems and I’m losing everything I care about for a fake fucking feeling and I’m done. In the most fucked up way honestly what keeps stopping me from quitting is I feel like without these pills I’m not going to be able to have the confidence or be able to accomplish whatever I’ve done in the last 3 years when I’m off them. I don’t know if I’m going to be able to work thru a rehab stint with my current relationship. I feel like I won’t feel happy ever again and that I’m in too deep now - it feels like now I have to choose between feeling like shit and be a zombie on antidepressants the rest of my life because of the damage I’ve done to my brain, or just accept this is how it is for the rest of my life I just need them to feel anything from now on. 

Sometimes I’ll take a short break and start smoking some weed and I almost feel like a bit of hope is still possible to conquer this without stims but then the weed wears off and I feel even worse. 

I have no idea what to do. I can’t find help right now in my situation because I have a high responsibility job that I can’t take a break from because of people / family that depend on me. I wish I could do 2 months outpatient but I can’t. 

Im in my early 20s, in a relationship with a girl that makes me so happy and sometimes when I come down I’ll get aggressively loud and almost mentally abusive towards her and when I wake up next day i feel so disgusted with myself. I made these decisions and I went down this road. Nobody forced me. If I can make those decisions to start using then I have to be the one to decide to stop. 

This sub has helped me before and I’ve just been a lurker but idk maybe someone else will feel like they’re not alone with this",45
2021-06-16 21:55:53,/r/shrooms/comments/o1le54/microdose_to_help_day_after_stopping_month_long/,Microdose to help day after stopping month long meth usage?,,3
2021-06-16 17:28:36,https://www.reddit.com/r/StopSpeeding/comments/o1g1dp/advice_needed_i_have_34_days_but_am_totes_in/,Advice needed: I have 34 days but am totes in relapse mode.,"I just completed my 4th of 7 short term inpatient facilities two weeks ago. I’ve been doing alright; meetings, outpatient, connection, etc but I still don’t have a sponsor and my phone hasn’t been wiped out nor locked down. Last night, I hit up my dealer and then this morning. In a panic I call long term facility and secured a bed for Tuesday. It’s a two month program. 

But I have 34 days sober because I didn’t cave, I used some tools and genuinely want to keep going. That’s good for something right? 

Or do I take this bed on Tuesday try their program or continue what’s (not) working at home?",14
2021-06-16 15:41:21,https://www.reddit.com/r/StopSpeeding/comments/o1dhym/considering_giving_up_my_adderall_script/,Considering giving up my Adderall script…,"I just don’t sleep well, get paranoid about dumb things like thinking people are staring at me and worrying about my long term health. Just wondered if anyone had some success stories post adderall life that they could share with me to make the final plunge. Thank you to any and everyone in advance.

Edit: I happened to stumble upon this community through another Reddit section and I really can not thank everyone in here enough for the support and words of encouragement. You guys/gals really are awesome and have made me feel stronger about my decision then I did before. I’ve only been on it for about a year and a half now and I’m 27yrs old, so hopefully I didn’t waste too much time and money on that crap. Thank you thank you again.",25
2021-06-16 07:46:16,https://www.reddit.com/r/StopSpeeding/comments/o12yhh/1_week_clean_starting_to_exercise/,1 week clean. Starting to exercise,"My heart and lungs have definitely grown weaker since I’ve used. Sporadic use has proven just as silly as regular use. It’s been  3 years of meth addiction since June 2018

I know there’s no god or person there to push me. Just me and I’m only starting to understand how much responsibility that really is. Im almost 29 and have nothing to show for it. Hopefully this is a start.",18
2021-06-16 05:11:53,https://www.reddit.com/r/StopSpeeding/comments/o10mbz/adderall_withdrawl_tips/,adderall withdrawl tips?,"so ive been prescribed adderall for about 3.5 months now, using it for 5. i have been taking way too high of doses lately and redosing too frequently. i am prescribed 20mg XR and 10mg IR a day but most days for the last month or so i take about twice this amount. i had a busy week so i copped some 30mg IR from a buddy and have probably been averaging at least 100mg a day for a week. 

i dont plan on quitting because i have bad adhd and i need it, but i feel like i desperately need a week or two off to lower tolerance and remind myself i can live without it. i plan on exercising a bit each morning and fixing my sleep, and drinking a lot of water. i take tyrosine, magnesium, zinc, vitamin d, fish oil, and a multi daily. i did some reading and ordered a plethora of nootropics that have been used to increase dopamine receptor upregulation because from my understanding downregulation is a big part of the issue. does anyone have any other useful lifestyle or supplement tips they have found helpful?

i am absolutely dreading this and am worried i cant do it. the fact that i think i wont be able to make it a week depresses and terrifies me. would something like adrafinil help for general lethargy (cant get modafinil)

side note: i am prescribed Pristiq and I use a variety of recreational drugs semi-regularly without any one of them being used consistently except for an occasional cocaine binge. i know xanax is helpful and i have access to those and am open to taking them if i really need to but i would like to avoid depending on this

any and all tips are appreciated and needed:)",9
2021-06-16 03:23:26,https://www.reddit.com/r/StopSpeeding/comments/o0z6qo/i_realized_just_because_im_sober_doesnt_mean_i/,"I realized just because I'm sober, doesn't mean I make the best life decisions.","I thought if I conquered drugs and alcohol, that I would gain all the wisdom in the world. Nope. I'm making mistakes everyday. Just gotta learn from them.",56
2021-06-15 17:21:44,https://www.reddit.com/r/StopSpeeding/comments/o0oxdo/2_days_clean/,2 days clean,"on day 2 of sobriety after a hospital trip due heart palpitations that had my resting rate at 160... it was a terrifying experience but much needed and although the cravings are starting to make an appearance, i’m persevering.. thankful for another day on an earth we take for granted.",12
2021-06-15 02:41:08,https://www.reddit.com/r/StopSpeeding/comments/o07txh/just_turned_20_need_help/,Just turned 20… need help,"Well where do I start…… Just turned 20 and here I am addicted to meth for just under a year. I traveled for work before I got out of high school doing construction and was pretty smart. Out of high school for about a year get the opportunity to go to the sunny south for a few months for work, ended up being about 8months. Love it here and got a raise so I decided to continue to work here after that. In that time I got introduced to drugs first hand and fell right in even though I was so against them due to my mother being addicted to crack since I was 16and up and I had never understood it……. But now I do my love for her has regrown tremendously. Back to the point, I’ve been smoking meth for 9-10 months now started slow then it became everyday. I do take responsibility for my addiction but I am surrounded by bad influences. The top guy above me is the one who I get it from and do it with and I just don’t know what to do. I feel so much dumber than I ever have been so I don’t want to go get a new job that I can’t do good at and I just purchased my first home a few months ago so I can’t afford to not have good steady income. My parents now friends really know what I do but I feel that they suspect it but I just can’t bring myself to tell them especially my father due to my mom. I want to get clean so I can start pursuing makeing a small Business but I need my brain back. My body is shot from constant work, smoking shit , alcohol every day and xanin almost everyday so I can get some sleep for work. It’s starting to catch up with me and I’m done feeling like shit and worrying if my body is going to make it.
(Yes I do eat plenty and hydrate and vitamins) but that only helps so much. I’ve been trying To quit.I was clean about eight days only smoked weed but then start again I don’t have any stuff at my house but I have very easy access to it From one person…… i’ve been slow down since then but definitely nowhere near where I should be or want to be…..I don’t like work, I am stressed ,bunch-of anxiety I just absolutely hate this shit. Don’t talk to my friends or fam really at all…….work and my girlfriend are the only thing that really keep me from going wayyyyyy to far. I need and help anyone has to offer me",4
2021-06-15 02:22:28,https://www.reddit.com/r/StopSpeeding/comments/o07jga/starting_all_over_will_do_a_checkin_daily_for_33/,"Starting all over. Will do a check-in daily for 33 days to begin with. It's fine if no one joins or writes, I'm doing this for me.","The rules: 
-Any form of illegal or OTC stimulant is prohibited.
-If you hop on this challenge, you gotta check in daily with me too. 
-If that happens, then we will support each other. We can exhange Facebook or something. 
-If that doesn't happen, then it's only the captain and the boat, so here I am, wishing myself good luck. 

Apologies in advance in case this daily post bothers you. I hope the mods understand this exercise too and not treat it as spam.

Support🧙
Here we go, starting....",35
2021-06-15 01:41:31,https://www.reddit.com/r/StopSpeeding/comments/o06vid/pink_cloud_confusion_newly_sober_rant/,Pink cloud confusion + newly sober rant,"Not really sure what I'm even trying to ask here, but everytime I feel happy about being newly sober (other than my weed in the evening) I get a really intense feeling like I'd be ok to use again. I try to rationalize using by telling myself that happiness + adderall = invincibility and it feels SO manageable in my head, even though I know this is a lie. Recently relapsed on street addy and xans after about a month off them both. The speed binge lasted longer than the benzos did, but im sober again now. 

This time around I've really been taking sobriety seriously. Feeling so much better especially since I'm finally sleeping and eating again. I'm trying to keep a good attitude but I'm really worried this is just a pink cloud and it won't last forever. I hope this doesnt become a drug in it of itself. 

In general I know its early, but I got a good feeling about this time. My family wasn't the best at helping me out even though I'm blessed they gave me their love and patience. But I'm 21 now and just started my internship today. I'm lucky I made it out for now, but I gotta learn how to be an adult. Learn how to live too. I can't run away from my shit anymore ive wasted too much of my youth. I gotta make some friends and make sure NEVER to find excuses to skip social gatherings just to go on a speed bender making music I don't even end up finishing. I gotta remember my dreams cause everytume I use, I slowly forget how vivid they used to be. 

Anyway, this sub really helped me this last week. Since I've joined the sub I've been trying to catch when I kid myself into thinking I don't have a problem. This group was the cherry on top to helping me admit that. Even more so than zoom outpatient rehab. Hope you're all doing well and thanks for reading my little shpeal.


1 week off adderall 
2 weeks off xanax 
7.5 months off cocaine",11
2021-06-15 01:27:09,https://www.reddit.com/r/StopSpeeding/comments/o06n21/1_month_sober_but_stressed_about_losing_house_im/,"1 month sober, but stressed about losing house I’m renting.. hard not to relapse..","Just found out the place I’ve been renting for 3 years is going to go up for sale.. I’ve been trying so hard to get clean and stay sober.. I’m over a month clean now, but hearing this news made me instantly want to revert to old habits, cause FUCK IT, RIGHT? This shit is fucked.. hard to keep these negative thoughts away.. I’ve been so conditioned that when something bad happens to me I need to get fucking high… fuck.. I just need to sleep this off",10
2021-06-14 21:02:04,https://www.reddit.com/r/StopSpeeding/comments/o01tpe/how_to_deal_with_postacute_depression/,How to deal with post-acute depression?,"I’m a week away from the 90-day mark but the depressive symptoms aren’t getting better and I don’t know how much longer I can push through without outside assistance. I was diagnosed with clinical depression last year during my addiction but I found that the antidepressants I took had no real effect on my mood. I tried sertraline and Welbutrin. Weed helps pass the time but it kills my productivity.

I wake up tired everyday and usually go back to sleep shortly after waking up. I have a really hard time eating at least 2 days each week. I get little to no enjoyment from anything I do and I have no motivation to do anything. Everything in my day feels like a chore. I’m going to see my therapist tomorrow and would like to know if anyone has drug/treatment recommendations that I could ask him about. I know it’s hard to give recommendations with such limited context but literally any suggestion is welcomed.",26
2021-06-14 17:54:18,https://www.reddit.com/r/StopSpeeding/comments/nzy3fk/12_step_cma_and_god/,12 step CMA and god.,"So I'm just coming off a bender after 2 months of sobriety. I feel like I have no control somebody just offered me some dope and I went with it without even thinking.

I'm going to CMA meetings and other 12 step meetings but I'm really struggling with the notion of God and a higher power. 

Please DM me anyone who can help me with this God problem I really feel like I'm powerless but I'm just going to keep relapsing that is what I am now is just a POS tweaker and that's how my life is going to be.",7
2021-06-14 11:32:00,https://www.reddit.com/r/StopSpeeding/comments/nzpgua/have_you_ever_fallen_off_the_wagon_what_helped/,Have you ever fallen off the wagon? What helped you get back on track?,"My partner is a recovering meth addict. Almost two years sober. Previously daily user. We are expecting a baby in September. Things have been alright, except he is struggling to cope with his ADHD. It's been making him miserable. He changed to a more stable full time job to be able to support us while im on maternity leave. But he hates it. Its been making him steadily even more miserable and he's been in a nose dive, drinking heavily and chain smoking cigarettes. Today he repeatedly talked about meth, and I overheard pressuring a friend to get him some. Tonight, he left the house drunk, took $400 cash from our account and didn't come home. Im laying in bed trying to come to grips with our situation. If he relapses tonight, how badly is it likely to effect him? Is it likely he will continue back on this path? Looking for people with similar experiences. What helped you to get back on track?",31
2021-06-14 08:16:52,https://www.reddit.com/r/StopSpeeding/comments/nzlgmr/wtf_causes_a_random_craving_to_pop_up/,wtf causes a random craving to pop up?,"I've never understood how this happens.  I'll be clean of stimulants for weeks and weeks,  feeling okay, balanced, fairly motivated and energized, mood relatively stable. And all of a sudden I get this super intense craving. It's not like a "" I'll die if I don't do it""  type of ' negative'  craving,  I'd compare it more to how it feels when your birthday was coming up as a kid, or you knew you were going to a themepark or something. I suddenly get so excited and it's all I can think about for a few hours.

For me this is the hardest part of quitting:   the days/weeks immediately after quitting, feel so shitty physically and mentally,  that it turns me off of using stims. I just don't feel like it at that point because they've "" punished""  me so much. But then when I feel good again, and my life is doing okay,  I get these cravings. And I feel like I've "" earned""  it beacuse my life is doing good again.

I've really improved my skills in managing stress, forgiving myself, avoiding being around stims and having them nearby, and taking care of my body after abusing stims. But the one thing I still suck at is simply resisting these urges when I'm feeling good. I wish I could understand either what causes them (what the trigger is)  or how to "" get rid""  of them. I often feel like I lack the willpower to feel like that and just say "" no"" .",9
2021-06-13 23:11:12,https://www.reddit.com/r/StopSpeeding/comments/nzd748/10_days_into_withdrawal_my_experiencesupdates/,10 Days Into Withdrawal - My Experiences/Updates,"10 days ago I quit adderall, heavy legal stimulants (benzedrex, extreme pre workouts, even energy shots or caffeine products, etc.), and nicotine cold Turkey. Here are my experiences

Days 1 and 2:
These days SUCKED completely and I couldn’t really do anything, I ate a ton of food all the time, but was never able to have a bowel movement. I also had hiccups that just wouldn’t go away, which actually lasted into day 3. I know this sounds like a weird and minor symptom but it got really painful and annoying, nothing could stop them, they were nonstop for days. No idea why other than maybe overeating.

Day 3:
If days 1 and 2 were bad, this day was straight hell. I had no mental clarity this day at all, it felt like I didn’t even have a self, I was just jumbled thought in a very uncomfortable body. I could barely think, I just did everything automatically like my life was on autopilot. 

Days 4-5:
Last 2 days where I lived on the couch. These days were better. I could still feel really bad withdrawals but I had mental clarity to some extent and was able to do some things. I started feeling more genuine like I was in a mental state that I had earned, unlike taking adderall and being put into a mental state that’s not earned. This was my first glimpse into what the future would feel like. 

Days 6-7:
These days concluded my first week! Overall I felt better than days 4 and 5 and I can absolutely do activities, it’s just really difficult to do them. I was pretty depressed and overall just felt uncomfortable, like I was missing any kind of satisfaction.

Days 8-10:
Worlds better than days 1-3. I am starting to be able to function in normal life again. The only effects I feel now are fatigue, mild depression, which I can only describe as reminiscing on the past and knowing that it’ll never happen again, increased appetite, shortened attention span, less focus, and other things along those lines. But all these things, about 90% of the time, are mild enough to function through. I just am afraid that the rest of my life will feel like this. I know I shouldn’t think like that, so I’m going to be super patient. I hope that I will feel “normal” again. I’m sure I’ll be able to get there eventually.",10
2021-06-13 23:04:50,https://www.reddit.com/r/StopSpeeding/comments/nzd2yk/quitting_again/,Quitting again…,So I’ve been through inpatient rehab 2 times and sober living twice and yet I still end up going back to using meth. I am having emotional problems due to past traumas and drug addiction I had a therapist but my rehab took mine away due to me being on scholarship. I can’t seem to quit and stay clean for longer than 1-2 months. I always end up back on this stuff. Please help some suggestions.,2
2021-06-13 22:05:10,https://www.reddit.com/r/StopSpeeding/comments/nzc0c5/cocaine/,Cocaine,"I’m a 20 year old cocaine addict slowly getting worse and worse, I’ve taken it for about two years started off slow but now I take .2 to .5 of a gram every night alone in my bedroom and the amount I take goes up every month or so, I try to stop everyday but by the time I get back from work I’m back on it again. How do people stop and function ? I can’t stop working at any time and I can’t quit and function. I don’t know what to do.",2
