Date,URL,Title,Body,Score,COVID-19 Mentions,Sentiment
2021-01-17 05:26:40,https://www.reddit.com/r/StopSpeeding/comments/kz438t/an_unexpected_aide_to_quitting_nac_nacetylcysteine/,An Unexpected Aide to Quitting - NAC (N-Acetyl-Cysteine),"After 6 months sober, a shit period in life had me back purchasing some of my drug of choice (starts with an M). It's now flushed and the money wasted will be a painful reminder. The 13th of January marked day 0.

Preface to this - I maintain a strict supplement regime, of which includes NAC (N-acetyl-cysteine). **NAC also has another effect of supposedly reducing cravings and what I didn't realise is also stopping all the fun dopaminergic effects of the drug.** (In a study it blocked all amphetamine-triggered dopaminergic release and prevented the down-regulation of dopamine transporter).

So back to the story... I did what I would usually do and consumed the drug like I usually did.

Heart rate goes up, a nice tingle.... But no pleasure. I knew it was good, had seen the effects on others, but nothing on me.

I then did a stupid thing and took more, a lot more which led to a fun 8 hour effort to stay calm during a fairly significant OD.

It took a whole day of annoyingly awake researching to realise that **it was NAC that caused me not to get my intense euphoric high I craved and that it destroys all the good effects of meth**

And you know something?

It worked. My lingering positive connection I had with the drug is destroyed, I will reassess this in time.

I detest thinking about it and what I went through the last few days.

I'll keep taking NAC, and hopefully this experience will keep me away from meth.

It's handy as a failsafe. Knowing that you can't get high even if you wanted is a powerful mental block to using. I make sure I take it every morning now.",21,{},"{'label': 'NEGATIVE', 'score': 0.9965029954910278}"
2021-01-17 03:24:10,https://www.reddit.com/r/StopSpeeding/comments/kz2ofz/just_had_sex_for_the_first_time_w_my_bf_of_3/,"just had sex for the first time w my bf of 3 years WITH OUT ADDERALL. come to find out it was the root of all of my insecurities & paranoia that would always come along when we did it, which made me avoid it. now i want him like crazy like never before. adderall ruins fuckin relationships!","i am now able for the first time in my life, & with my bf capable of soaking up every bit of him with out having my mind racing & consumed by adderall induced paranoia. it made me SO distracted and not in the moment during sex, or ever for that matter. i wouldn’t show affection to him, it made me unable to be vulnerable & talk about my feelings in the right way, it made me paranoid about literally EVERYTHING in the relationship never letting me be in the present moment to be able appreciate this wonderful man i have. it turned me against him, & made our relationship a nightmare. now being off of it , having my head clear for a few weeks i can see how much i took him for granted , & how much i put him through. he didn’t have a gf for those 3 years, he had a consciousness shell of a human with no soul. i’m so happy he was able to guide me to finally getting off this shit, if it weren’t for him i would have stayed blind & numb forever. guys, i’m telling you adderall RUINS everything. if your struggling getting off of it, remember staying on it will never give u true happiness. not even close.",28,{},"{'label': 'NEGATIVE', 'score': 0.9235005378723145}"
2021-01-16 23:33:01,https://www.reddit.com/r/StopSpeeding/comments/kyzfdq/reporting_back_in_after_deciding_to_quit/,Reporting back in after deciding to quit,"I realize after taking a week break to start my abstinence I should just drop adderall now.

In my last post I described all the horrors of what I've been facing,  but; when I stop using, it just disappears... who would have guessed?

I'm starting to love myself again, I love my ADHD even though it hinders me, I'm thankful to be the way I am. Who else can drive a conversation from sunrise to sunset quite like me?

You don't need a dopamine rush to be productive, all you really need is a well placed sticky note and a friend close by.

All my problems with school were driven by adderall even though I thought I needed it to be successful in college. I dropped out because of adderall and it's taken a slice of my 20s, but it's not getting any more out of me.

Fuck adderall, fuck addiction, and fuck anxiety. That dumb kid clinging to his pills isn't here anymore. He's a part of a bigger whole which makes up a complete dumb ass. Although, it turns out, I still love that dumb ass anyway.

Here's to staying strong and taking on the mantle of life again, cheers.",55,{},"{'label': 'POSITIVE', 'score': 0.7884584665298462}"
2021-01-16 12:51:09,https://www.reddit.com/r/StopSpeeding/comments/kynkr0/relapse_prevention/,Relapse prevention.,Okay. So I start rehab alot but never follow through. I don't trust humans. I really think that I have been self medicating and probably incorrectly. I just wanna stick this through and be honest and see what happens. Virtual iop with my 2 and 3 yo in the room.,3,{},"{'label': 'NEGATIVE', 'score': 0.9945790767669678}"
2021-01-16 11:31:45,https://www.reddit.com/r/StopSpeeding/comments/kym0rs/one_month_even_after_seeing_my_former_connect/,One Month!!! Even after seeing my (former) connect yesterday,"Thank you all so much for participating in this community and helping me ease into recovery and accept my reality over the past year plus. Today I have a month without meth and though I feel like it should be longer for how long I’ve struggled, I am really happy and proud and don’t have many people I can tell. At least for now. I’ve been tired sometimes but this tired is now way better than the drained and anxious I felt using.

So, yay! Out of respect to everyone’s time, this other part below is just for anyone contemplating scenarios in which they decide or happen to encounter dealers, using friends, and places. 

Yesterday I did something that was awkward. I had been ignoring my connect who has also been a close friend in many ways. I finally answered and said I’d take him along when I ran a couple of (non drug) errands. I had told him I was depressed then sick and went on meds, but hadn’t mentioned my IOP. I got there and he pretty much ignored anything that wasn’t part of his clearly high sex fantasy. It made being at his place way less triggering. I was like, “we going?” And he even asked if I wanted to get high first. After he promised not to a little while back. I luckily was both turned off and being careful of interaction with my medication, so it was a much easier “no” than it ever has been since I started using. I feel better about letting that shit go now. At least drawing a boundary that I don’t want to be around him when he’s using. He was fucking annoying and not reading my reactions nor expressing any concern at all after I had texted how rough of a time I’d been having. Maybe a risky decision, I think we will end up discussing in my IOP, but I at least used my non addict mind for the first time in a few years when opportunities to use arise.",16,{},"{'label': 'NEGATIVE', 'score': 0.9945764541625977}"
2021-01-16 09:13:23,https://i.redd.it/m7wgvjmxcpb61.jpg,Well shit 😳,,102,{},"{'label': 'NEGATIVE', 'score': 0.9969937801361084}"
2021-01-16 08:37:14,https://www.reddit.com/r/StopSpeeding/comments/kyj203/4_years_clean_from_all_stimulants_today/,4 Years Clean from all Stimulants Today!,"Hey all. Been looking forward to this day for a couple weeks. Today, 4 years ago, I put down speed, never to be picked up again. The first 6 months were tough, the first year a pleasure/anhedonia Rollercoaster, but for the past 3 years I've been feeling focused and good.

In interest of full disclosure, I picked up an opioid addiction a couple years after I quit stimulants. I'm currently in rehab tapering off suboxone, will finish my taper in a week and hop on vivitrol for relapse prevention. Opioids filled the place of speed in my soul, though I didn't realize until this year that they were related. Now I'm going full abstinence. 

You can do it guys. I'm an impulsive fuck and if I can do it, so can you.",32,{},"{'label': 'POSITIVE', 'score': 0.995912492275238}"
2021-01-16 07:06:59,https://www.reddit.com/r/StopSpeeding/comments/kyhu58/anonymous_online_survey_about_alcohol_and_other/,Anonymous Online Survey about Alcohol and other Drug Use - Lucky draw incentive (AUS/USA 18+)," 

    This survey has been approved by the moderators.  

Hi everyone,

I am Melvin Goh, a PhD student from the University of Wollongong, Australia. My PhD research focuses on improving the health and well-being of people impacted by alcohol and other drugs via health risk communication.

I am conducting a study to survey people living in Australia and the United States of America (USA) about their alcohol and other drug use, health and well-being, health behaviours, and the impact of COVID-19 (UOW Ethics Approval No. 2019/183).

**What’s involved?**

You are invited to complete an anonymous online survey about your use of a range of substances, health and well-being, health behaviours, and COVID-19. The survey may take up to 20 minutes, although some people may complete it faster. Please be assured that your responses will be kept strictly ANONYMOUS as the survey does not ask of any personal identifiable details from you!

**To be eligible to participate, you will need to:**

* Be aged 18 and above living in Australia or the USA;
* Have had problems with illicit drugs or alcohol and/or have attended alcohol or other drugs (AOD) treatment in the past 12 months.

Please visit the following [link](https://uow.au1.qualtrics.com/jfe/form/SV_dm1oXM1GmqDEJQV) to participate or to get more information on the survey.

Eligible participants who complete the entire survey can enter a prize draw to win one of five $50 Amazon gift cards (currency based on location). I understand that a lucky draw for a gift card isn't the most attractive incentive, but I hope you can understand that it is the most I can get as a student. More importantly, it will help me with the PhD and achieve my aim of improving the health and well-being of people impacted by alcohol and/or other drugs.

If you have any questions, please let me know. Thank you to everyone who took the time to read my post and complete my survey :)",4,{'covid': 2},"{'label': 'POSITIVE', 'score': 0.9326913356781006}"
2021-01-16 00:08:38,https://www.reddit.com/r/StopSpeeding/comments/kyck0j/breaking_the_90_day_meth_wall/,Breaking the 90 day meth wall,"I have consistently relapsed every 3 months for the past 5 years.  In 2018, I had my longest sober streak which lasted exactly 6 months.  I relapsed exactly on the day I hit my 6 month mark.  I was happy about my sobriety so I decided to celebrate with a beer. Terrible idea.  That beer turned into 7.  Then 3 hours later my connect is at my house dropping off a baggie. 

I binge for 3 days, then I went 3 months sober.  Rinse and repeat.  Consistently.

I always made it my goal to reach the 6th month mark again. And I am happy to say that I am now 6 months and 10 days sober.

When I hit the 6 month mark on December 22nd 2020, the craving took over my mind for 2 whole days.  I got depressed and the thought of using took over.  It came at me like a wave.  Fortunately, I didn’t cave in.  And 2 days later it went away.

I find it interesting that every 90 days this urge to use hits me like a wave.  I get depressed and irritable.  And then it goes away and I’m back to my normal sober self.

Has anyone else experienced this?  Will it ever go away?  I’m afraid one day I’ll cave in.  I have a good life.  Good income.  My own family.  I don’t want to throw that away.  

Thanks for listening",14,{},"{'label': 'NEGATIVE', 'score': 0.7957579493522644}"
2021-01-15 23:54:11,https://www.reddit.com/r/StopSpeeding/comments/kycbnn/withdrawal_symptoms_will_it_last_forever/,withdrawal symptoms (+ will it last forever?),"hi, i stopped taking vyvanse about 4 days ago. i’d binged about 300mg in a 48/hr period. now i feel really dissociative and “off” — idk how else to describe it. basically, i’m having difficulty focusing and in general, i just don’t feel entirely myself or like i’m a part of the world. 

i’m really scared, i don’t want to be stuck like this forever. has anyone experienced something similar? does it go away? 

please don’t tell me i have permanent brain damage or something haha. if that’s the case, i don’t want to know",6,{},"{'label': 'NEGATIVE', 'score': 0.9988275170326233}"
2021-01-15 22:54:16,https://www.reddit.com/r/StopSpeeding/comments/kybdps/would_like_to_quit_vyvanse/,Would like to quit Vyvanse,"Hi there, I’ve been taking Vyvanse for approximately four years as directed. I started at 30mg per day, went down to 20mg, and am now coming off of 10mg per day. Because there is no dose lower than 10mg, I have been put on 5mg Adderall XR by my psychiatrist, and wow. I hate it. I did not eat a thing today and felt super anxious about covid, etc. 

Would it be better just to quit cold turkey? I also noticed that I had a really hard time meditating today on the Adderall. 

What do you all recommend? I’d like to stop using stimulants because I’m worried about the long term effects. I exercise regularly and have a pretty regimented sleep schedule. What can I expect if I just decide to stop taking my ADHD meds all together? 

I do take 25mg of sertraljne for depression in the evenings, which I plan to keep or swap out for Wellbutrin. 

I have gone off of the Vyvanse before when I did a keto diet and felt I no longer needed it to focus. 

Anyway, interested in hearing y’all’s feedback. Many thanks.",6,{'covid': 1},"{'label': 'NEGATIVE', 'score': 0.9973408579826355}"
2021-01-15 19:45:53,https://www.reddit.com/r/StopSpeeding/comments/ky86aw/what_are_some_signs_of_stimulant_usage_asking_as/,What are some signs of stimulant usage? Asking as a child of a former addict.,"Im sorry this sounds like a strange question, I don't know much about these so I'll try to answer as best as I can. 

I ask this because I know she was a former user years ago for cocaine. For the past few days something felt entirely off with how she reacted. It clearly wasn't a withdrawal of nicotine or even caffeine. She for the past few days was on a binge for cleaning, or just doing mundane tasks, she flipped out on us today, and was something I've never seen before. She was just Going off with a strange smile, she seemed a bit weird in her movements (walking back and forth often, like shaking?).

I know she's insanely protective of her cigarette cartons and where we go in the house, I remeber seeing these weird little like. Black blotches inside one of them a while ago, it didn't seem like tobacco. I could just be wrong on all of this though. She was stressed out on work and she doesn't exaclty have friends to communicate with or vent to on this. So maybe just stress is a factor?",10,{},"{'label': 'NEGATIVE', 'score': 0.9940979480743408}"
2021-01-15 16:54:06,https://www.reddit.com/r/StopSpeeding/comments/ky4v0y/sometimes/,Sometimes...,"Sometimes it doesn't even feel like it's about the weed or adderall or whatever the drug may be. Sometimes it's just about the rush. Not the rush of euphoria or relaxation tied to each one, but the rush of feeling the high coming on and feeling like at that point I am in control and can change things. I think that rush is more motivating than any high, but at the same time even more fleeting.",9,{},"{'label': 'NEGATIVE', 'score': 0.6435925364494324}"
2021-01-15 16:34:01,https://www.reddit.com/r/StopSpeeding/comments/ky4g3z/75_months_clean_when_does_it_get_better/,7.5 months clean... WHEN DOES IT GET BETTER?,"This is so frustrating. I've been clean for so long and I still feel just as lost as I did when I quit. I still can't enjoy music the same way as before, I still can't focus the same way I did before, and corona is making this so much worse. No gym, barely any social contact and so on.

I made a post here about 3 months after getting clean and all I wanted back then was to do amphetamine. What do I want today? ALL I WANT TO DO IS AMPHETAMINE STILL.

I'm diagnosed with ADHD so that probably has something to do with it. I just... want to sit down and be productive for once. I want to be able to make a routine, pursue my hobbies, actually make something. I feel like my brain is fighting me constantly on all of this. Throughout my entire life, the only fix for this so far has been AMPHETAMINE. How am I supposed to live a good life without it?

Anyone else here with ADHD? I don't know man, am I just depressed? How do I fix this?

It's so hard to forget those peaks of using amphetamine. Nothing compares to it. It makes everything so effortless. It feels great. I lose weight. I'm so productive. But.. it also leads to binging. Psychosis. Anxiety. Losing friends. Ugh....",55,{'rona': 1},"{'label': 'NEGATIVE', 'score': 0.9906636476516724}"
2021-01-15 10:36:03,https://www.reddit.com/r/StopSpeeding/comments/kxww9a/anyone_else_notice_the_highs_from_other_drugs/,Anyone else notice the highs from other drugs such as marijuana to be better/more intense the longer they have remained clean from stimulants?,"Like when I spark up now a days my weed highs are MUCH stronger than when I had initially quit meth.. could it be my dopamine,etc  levels finally normalizing.

 I have been clean from meth for 105 days, clean from daily use, severe meth addiction for 232 days. The others were slips but only got high for a day and stopped. 

I notice Sativa dilates my pupils and gives me a stronger mild to moderate euphoria and giggles again. When I initially quit meth I still smoked but had to smoke a lot more.and even then I barely felt OK. Now I can smoke less for the same effect/tolerate edibles better.",24,{},"{'label': 'NEGATIVE', 'score': 0.9932969212532043}"
2021-01-15 04:09:34,https://www.reddit.com/r/StopSpeeding/comments/kxqx6v/avoid_this_dumb_and_probably_fatal_mistake_i_made/,Avoid this dumb and probably fatal mistake I made,"What got me to quit and not look back was my erectile dysfunction.

Thats so sad to say.

About a year and a half later, I started taking aspirin thinking it would fix damage I did to my heart. 

I believe it caused a stroke and I’m in and incredible amount of pain.",7,{},"{'label': 'NEGATIVE', 'score': 0.9782362580299377}"
2021-01-15 02:11:56,https://www.reddit.com/r/StopSpeeding/comments/kxpf58/is_it_normal_for_metabolism_to_skyrocket_once_you/,"Is it normal for metabolism to skyrocket once you start taking care of yourself, making you feel even worse than when you were barely eating?","Started supplementing and eating again, noticed my body is now more physically capable, normal functions are resuming. My nails and hair barely grew in months, and now they’re growing really fast all of a sudden 

On the other hand I run out of energy FAST. I was able to go 1-2 days without eating before but now I have to eat every 3 hours. I guess my body has changed out of starvation but there’s not much fuel left in the tank so I have to keep eating and eating just to avoid almost collapsing.

3 weeks ago I could eat a piece of toast a day, and I wouldn’t even feel the need to eat, my energy was low but it felt fairly stable. All of a sudden I need to eat and eat just to maintain an energy level where I can move, it’s bone crushing fatigue and I’ve replaced water with milk just to keep myself going!

Just wondering how long I can expect this to last because it’s exhausting, I actually feel worse at the moment, I imagine once my body has some reserves stored it will get better.",17,{},"{'label': 'NEGATIVE', 'score': 0.9935327768325806}"
2021-01-14 18:59:49,https://www.reddit.com/r/StopSpeeding/comments/kxi994/i_have_accidentally_convinced_myself_that_meth/,I have accidentally convinced myself that meth isn’t that bad for you. Can I hear some horror stories that may help me change my mind?,"Also posted in r/stims but thought you guys would most likely have some outside perspective. I have a feeling that using meth is bad but I feel like its so similar to adderall that I should be able to function just fine. It has SUCH a bad rep and I truly do not understand why. I have never felt suuuper addicted, I just use it like I used my adderall prescription. 

Why did you guys stop? Should I stop while I'm ahead? Is meth really THAT bad?",14,{},"{'label': 'NEGATIVE', 'score': 0.9977877140045166}"
2021-01-14 16:33:16,https://www.reddit.com/r/StopSpeeding/comments/kxfbz4/1_month_clean/,1 month clean!,"It’s possible. Day by day. Things are clearer, eating and cooking is super enjoyable again, school is easier, and my relationships are being mended. Sober feels amazing. You guys are the best. If you’re wanting to get clean- this is your sign! We got this!",17,{},"{'label': 'POSITIVE', 'score': 0.9998424053192139}"
2021-01-14 09:39:24,https://www.reddit.com/r/StopSpeeding/comments/kx6ufl/tomorrow_is_my_last_day_of_an_adderall_binge/,Tomorrow is my last day of an adderall binge,"I’ve done this song and dance on and off for seven years. I start a new job on Tuesday and my last day of my law firm job and restaurant job is on Friday. Every time I go back to this restaurant I go right back into the adderall addiction limbo. It’s just so easy to get. Tomorrow is my last day at the restaurant. It’s also the day my supply will run out. I’m not looking to ever take adderall again in my life. However, it’d be nice to have someone to talk to who is also taking a similar venture. I’m 28/f and looking for someone to just be able to talk to through the process of quitting. I’ve been manifesting for so long that I need a new, better job, with so much more money and so much less stress because my boss at my firm is a straight up turd. And as luck would have it, I landed a pretty fucking awesome job that I’m about to start. But I am alone in my addiction, I am god damn good at keeping it under wraps. I’m naturally extroverted and driven, so the adderall is really just an enhancement that only I can feel. But it’s time to quit. It doesn’t feel good anymore. So who wants to be my pen pal!? Lol",17,{},"{'label': 'NEGATIVE', 'score': 0.9746436476707458}"
2021-01-14 07:46:26,https://www.reddit.com/r/StopSpeeding/comments/kx4z0e/3_months_free_of_ritalin_really_struggling_to/,3 Months free of Ritalin. Really struggling to regain focus.,"Hey all. About 3 months ago, I quit my Ritalin prescription after a year of taking it. I quit as I began to abuse the drug and became extremely dependent. It took over my life. Don't get me wrong, I'm relieved to be off that horrible carousel of addiction and through the worst part of the withdrawal. I feel more like myself every day. However, I am still absolutely devoid of focus. I can't concentrate on anything for long, and it has really effected my work and social life. I guess my questions are: should I still be struggling so much with after effects after 3 months clean? How long should I expect this slump to go on? How long before I regain the natural focus that the Ritalin has destroyed? Any advice from those who have been in similar situations would be much appreciated. Cheers.",24,{},"{'label': 'NEGATIVE', 'score': 0.9970231652259827}"
2021-01-14 00:57:46,https://www.reddit.com/r/StopSpeeding/comments/kwzowd/i_relapsed_but_will_keep_fighting/,I relapsed but will keep fighting,"I relapsed on amphetamines after 3 weeks clean wasn’t worth it at all. I used about 4 days in a row however haven’t gone near in couple days. I don’t feel like I put myself back to much but it could be dangerous for me since I don’t want to spiral down the addiction cycle again. 

My head feels foggy all the time and can’t do anything really. I just want my brain back and life. I’m struggling with depression and I’m overwhelmed with school and life in general.",10,{},"{'label': 'NEGATIVE', 'score': 0.9929457306861877}"
