Date,URL,Title,Body,Score
2021-06-07 23:00:24,https://www.reddit.com/r/StopSpeeding/comments/nuuqdx/should_i_message_my_doctor_and_tell_her_not_to/,should i message my doctor and tell her not to prescribe me adderall anymore?,"UPDATE 3: I’ve been sober a little over a week now I think and I’m starting to feel like myself again. It’s not easy but just want to thank the people here on this sub for being there to state the obvious when I was too low to make a decision for myself. I asked for help and you guys were there, even though the answer to my question was very obvious. You lifted me up and helped me make the choice I needed to make. I’m beyond grateful. I get to keep my job! And get my life back. Thank you, thank you.

UPDATE 2: Leftover adderall is flushed, the final paper script I had is ripped up and in the trash. I’m now coming down from the weeklong binge I kept going to get through the week. I’ll be taking the weekend to rest, since I’m off on Monday’s. I know it’s not going to be easy or feel good, but I backed myself into a corner so there’s no way to go but up from here. I have a therapist who I also made aware of the situation. She can’t prescribe me meds but she can sure hold me accountable. Thanks you for all the support in helping me to do the right thing. I’m in a city where I don’t know many people so I’ll be checking back here. 

UPDATE: I did it. I messaged my doctor last night and told her I don’t want to take adderall anymore. I just said I felt like it was doing more harm than good, was having too many side effects, and wanted to let her know I’m going to immediately discontinue taking it. She said okay, and I feel good about the fact that I will never feel comfortable asking her to put me back on it, after I made it clear it was having such a negative impact. Also don’t think she’d say yes if I did ask. Thanks for all the kind words and advice! Now, I just need to make it through the day and flush the rest of my last refill. 

I moved to a new state last year, so it wasn't very difficult to get an adderall prescription here, without them knowing my history. I'm debating messaging my doctor and telling her something along the lines of, ""I have a history of not handling this stuff well but I thought maybe I could. I can't."" I've been trying to stop taking adderall for months, to no avail.

I know I won't go looking for it if I don't have access to my prescription anymore, but I'm nervous to message my doctor and tell her what's going on. I also know that if I don't message her now, I'll convince myself not to do it at all in a few days. I'm looking for a way to force myself into recovery again, if that makes sense. Is that stupid? I'm also worried about my doctor judging me, or being labeled a pill seeker in some sort of state-wide database. I know that sounds like I'm hoping to get back on it in the future, but it's more-so just that I don't want to be labeled and ashamed every time I go to a doctors appointment.

Things have gotten to the point where I feel like I'm not in control anymore and I need to do something drastic to get out of my own way. Thoughts?

edit: spelling, grammar",104
2021-06-07 15:59:17,https://i.redd.it/nlbv8hs2gw371.jpg,Got 7 days down! I’m so proud! I feel like these are helping so I wanted to share.,,46
2021-06-07 14:47:40,https://www.reddit.com/r/StopSpeeding/comments/nuk4o8/im_not_sure_if_i_have_the_strength_to_quit/,I’m not sure if I have the strength to quit,I need to quit . For my dog . I love this little dog so much. So much. I’m not sure how he even ate some of my stuff but I could tell by the look in his eyes that he wasn’t sober. I thought he’s going to die. I just spent $700 at the vet to get my dog back to normal and I hate that this had to happen for me to actually be serious about quitting. But I don’t know how I’m supposed to wake up without anything to help get me up and make me actually want to do something besides sleep. I’m tired of life. Nothing makes me smile or happy . Nothing is enjoyable. At least meth would wake me up . I been doing this for 7 years everyday . Not many people know I do this.... I can’t ask anyone to help me throughout this journey to quit. How do I quit when nobody is here to help me fight those  days where I’m really craving a line ? Especially where literally the only thing that brings me joy in my life is my dog.,13
2021-06-07 08:43:44,https://www.reddit.com/r/StopSpeeding/comments/nubm49/day_4/,Day 4,This is my 4th day.,27
2021-06-07 08:37:49,https://www.reddit.com/r/StopSpeeding/comments/nubhvh/physical_symptoms_getting_better_but_mental/,Physical symptoms getting better but mental things not really.,"26M! 11month clean from 1.5 year coke and half year amph. 

The only physical thing what left is my neck tremor/twitch? and tense muscles.

Psychological: mild anxiety with full random intense anxiety episodes without a reason (even at home), mild depression, can’t really enjoy anything what I accomplish.

Back then I only had anxiety when I was dating or something. 

Will it subside or I need to live with anxiety with the rest of my life? 

I know 11 month is pretty much time but it’s still the first year and PAWS can last to 2-3 years.",8
2021-06-07 08:33:51,https://www.reddit.com/r/StopSpeeding/comments/nubf4b/mixing_speed_and_valium/,Mixing speed and Valium?,Is it a deathly combo?,2
2021-06-06 23:04:11,https://www.reddit.com/r/StopSpeeding/comments/nu2g40/just_another_abuse_story_but_i_dont_want_to_kill/,just another abuse story but I don’t want to kill myself.,"long story short I’ve been suicidal since I was about 12. Substance abuse started around 16-17 mostly drinking & smoking weed to much. got a prescription for adderall & things have gotten out of hand. I can’t be honest with anyone about how much I take because it’s embarrassing & scares me. 
I’m tired of being scared & praying I wake up in the morning. Tired of checking my pulse & running out of breathe walking to the kitchen. 
For the first time since I was 12 (I’m now 21) I DONT WANT TO DIE!! but I’m terrified my adderall abuse will kill me. & i want to be able to help people tell my story.  not have it end before it begins. 
So I don’t know what to do. I don’t like asking for help or being honest I would rather paint a picture of reality to myself & others that makes me comfortable. any advice or kind words would mean the world. not in a good headspace at the moment",22
2021-06-05 22:54:32,https://www.reddit.com/r/StopSpeeding/comments/ntbxxd/1_week_off_adderall_i_owe_it_to_this_group/,1 week off adderall & I owe it to this group...,"My adderall prescription was due 10 days ago & I didn’t call for it for the first time....I rested for a week. & yesterday+today, I studied without it for the first time in 4 years. No cold mottled feet/hands from poor circulation, no staying awake for sometimes multiple days straight, no accidentally getting focused on the WRONG thing for hours, no scheduling the upcoming week around my warped sleep schedule....just a Starbucks & an L-Tyrosine 😂

I got much more accomplished than I did when I took my ADHD medicine in the same time frame. & I actually felt proud of a hard days work for the first time in longer than I can remember...

It was something I’ve wanted to do & tried/failed many times over the last few years, until I found this sub a few months ago....
When people say if you read encouraging things enough, you start to believe it for yourself....which eventually happened for me...

It sounds cheesy. but thank you for all your recovery stories & the ones to come. It gave me the final push I’ve desperately been needing.",35
2021-06-05 22:50:13,https://www.reddit.com/r/StopSpeeding/comments/ntbvb7/did_anybody_develop_horrible_anxiety_from_their/,Did anybody develop horrible anxiety from their speed abuse/addiction?,"The most common effects of coming off of a speed addiction are lethargy and depression which makes a lot of sense. I am just wondering though if anybody ended up developing horrible anxiety from their abuse.

I abused Adderall, Vyvanse and even meth (thankfully only once for meth) and I am almost positive it lead to a horrible surge in my anxiety. I f'ed up big time by going on a binge combining Vyvanse with Phenibut that lead to a horrible couple of weeks.

To make a long story short, my psychiatrist found out and I am pretty sure he will be taking me off all of the speed completely, which means I am pretty much done with it because I was only able to get access to it through his scripts (good thing too because it is a really sh%tty and even immoral thing to abuse meds a doctor is prescribing to help you if you think about it.) Been having horrible anxiety ever since then. Granted, being off the Phenibut is causing that mainly, but I know for a fact the stimulant abuse contributed.

Aside from just me though did anybody else end up getting really bad anxiety from their usage? I noticed that especially towards the end, even while using, I started to just get uncomfortable stimulation mixed with anxiety (and in some cases full blown panic attacks.)

Would be very curious to hear anyone else's stories so let me know.",56
2021-06-05 11:23:15,/r/bipolar/comments/nsy123/it_really_is_a_lot_harder_to_be_in_a_bad_mood/,It really is a lot harder to be in a bad mood,,4
2021-06-05 09:59:18,https://neurosciencenews.com/adhd-drugs-epigenetics-18563/,"I know this is on guppies, but Ritalin can impact the behavior of the future generations of the person who takes the drug. Holy shit.",,26
2021-06-04 21:55:12,https://www.reddit.com/r/StopSpeeding/comments/nsl0pf/longtime_lurker_been_living_this_lifestyle_my/,"Longtime lurker, been living this lifestyle my whole young adult life","Anyway, I will be thirty this year. Assuming the universe sees fit to continue giving me time to become myself again. 
I say this because, as I'm sure many here can understand, in addition to my meth habit, is also abuse and inject other nonstimulant street drugs. Regardless, my most intimate companions, nobody made it quite to where I am r n, just agewise.
I am just posting BC I wanted to share about my life as it is now, in active addiction, although w sporadic earnest sobriety attempts.
I got arrested last sat at a gas station. I had recently fixed and must have been acting bizarre. As I often due at this late stage in my addiction. Any way, I had drugs, i had paraphernalia. And I had a revolver, which, though registered to me, shouldn't have been on my person as I'm also a convicted felon add a result of an earlier possession charge. So. Though not a "" hardened criminal"" in my mind, I am now dealing w serious shit. The distinct possibility of actual moderate prison time. 

And for fucking what? What in the fuck has meth or any of the other chemicals i am obsessed with orienting my entire existence atound at the expense of every other elements, WHAT HAS ANY OF THEM DONE FOR ME? ASIDE FROM DAMAGE AND DIMINISH ME??

I've had it. For the hundredth time. It's the bitter fucking end or a sincere and successful attempt at lifelong recovery. 

I hope I can be honest for once in my god damn life. With me.",30
2021-06-04 18:24:39,https://www.reddit.com/r/StopSpeeding/comments/nsh6u3/i_really_want_to_stop/,I really want to stop,"Hello everyone. I’m coming down off of staying up all night and doing coke. I crashed at like 10 am and woke up at 2, but I’m feeling horrible now. 
I’m a once weekly binge drinker. I tell myself it’s okay because I only drink once a week, even though I know that’s bullshit. I’ll have some drinks and every time I drink now, I want cocaine. I would say that I have done coke probably 8 times in the past 3 months or so...but the quantity has gone up the past 2 times I have done it.  I’m starting to scare myself. I just feel like a complete failure today. I think ultimately I need to stop drinking all together because I can’t drink without craving cocaine now. 
Anyways, thanks for reading. I’m feeling so anxious right now, any tips on how to calm myself down would be appreciated.",7
2021-06-04 10:34:14,https://www.reddit.com/r/StopSpeeding/comments/ns6kr8/back_here_after_relapse/,Back here after relapse,"I’m getting back to recovery now after relapsing amidst moving and my addiction care provider essentially abandoning me at an inopportune time when I kinda let it go and didn’t press them for appointments. I finally got an amazing job offer after a long time being out of work and I know I have to stop after a couple of weeks of off and on use so that I’m even remotely okay for starting work in a week and a half. I’m pretty bummed I won’t be able to celebrate my six months clean as planned in a couple weeks. That I don’t feel like I have good therapy to lean on and dissect this relapse. That I struggle to cut my source out of my life, who has been a close friend. That my skins looking bad again and it’s getting really hot out so I can’t cover up easily. But, today is the day it all starts getting better again. At least proud of myself for not falling so far this time and remembering to prioritize my work and my life in general.",7
2021-06-04 06:50:38,https://www.reddit.com/r/StopSpeeding/comments/ns28so/been_fixing_meth_for_nearly_3_yrs_only_19_yrs_old/,"been fixing meth for nearly 3 yrs, only 19 yrs old","all you nice people (& some nice people from other subs) have convinced me to choose myself this time, im deciding to quit today, just squirted a 100 unit shot down the sink, i can't live like this anymore, fixing not to feel good but so i don't feel like shit, the voices coming when i don't sleep, only being able to hang out w/friends that are also users, constantly being exhausted, day after day of destroying my body, most IV users never end up recovering? well this IV user says nah fuck all that, not anymore god dammit, im no saint, but im better than this fucking shit-show of a life, no, we all are",73
2021-06-04 04:59:48,https://www.reddit.com/r/StopSpeeding/comments/ns0jij/i_think_my_13_year_onoff_relationship_has_reached/,I think my 13 year on/off relationship has reached its breaking point and I’m not sure I’m confident I’d ever be able to stay sober.,"The second drug I ever tried was meth…at twelve years old. I am now 25 and I have done it every year since then on and off. I stopped the longest in 2018 when I got into a relationship with someone in recovery. Stayed off of it for around a year before I did it behind his back in 2019. I’d only ever smoked it up and was off if it entirely just because I no longer had a source or people who did it to hang out with/get it from.

Then the worst thing that has happened leading to this post happened around 1.5 - 2 months ago when an old client of mine from many years before who I knew did meth but never did it with, asked me to come over to catch up. He knew I wasn’t on it but offered it to me anyways. Instant addiction response was “fuck yeah.” The only condition was, I only IV and no shops are open.

And the rest is history. I fell harder in love with this shit drug than I ever was. But it is the worst thing to happen to me. I constantly feel like I’m having a heart attack, I get anxiety, I perform poorly at the job I was ranked #1 in until I picked up the needle. I thought I could always keep my drug addictions under control and usually always have but….I don’t know if I can take the unbearable pain and comedown like I’ve been feeling each time I inject. I’m positive I overdosed two nights ago and my body feels different and is painful all over since. Yet, I still am craving it.

I’ve reached out to a 30 day impatient facility because even though I don’t think I’m strong enough, I’m not ready to die at 25 in the bedroom of my parents house. I worked hard to get to the spot I was in before I went back to meth. I’ve never been 100% from any drug/alcohol for longer than a week at max. 

I hope that I can prove to myself that I have what it takes to take control of my life back. No matter the costs or who I lose in the process. 

Sorry…needed to rant. Didn’t know groups like this existed. 

Thanks for reading if you do.",14
2021-06-03 18:27:58,https://www.reddit.com/r/StopSpeeding/comments/nrpt9b/i_guess_i_have_a_problem/,I guess I have a problem,"So long story short - I've started using stims in September 2020. It was speed (amphetamine). I bought 5g of it and it all started from there. Before that drugs I did were weed, benzos, but in a way I didn't care if they existed or not (now it's different). I did oxys meanwhile, from time to time, when I could afford them. 

Soon after speed I've tried all different rc's like 4mm/4cmc and so it is until now. I basically can't find a way to function without it. I smoke weed everyday or stop sometimes randomly. I can go like 3 days or something without it, but then I'm motivated as fuck to get some. Usually after a break I'd go hard for a few days, which is a weird connection. I tried not to give up at once as it's too hard, but to try to use less and less. In fact it worked for some time, but I'm here now after going hard for last 4 days. 

I realized I've got a problem, which I want to fight. I get those thoughts sometimes if I gave up on stimulants it would make me stronger. Scary thing is my brain seeks the reason to use again. Going out, doing house chores and even when I want to listen to music or smoke a cigarette. Literally music about drugs or movies make me crave it even more.

Now I don't get any rush, euphoria or other pleasurable effects. I just feel numb emotionally and I'm able not to sleep or eat for longer period of time. I wonder if there is anything I could do to get rid of them or at least make myself use only few times a month max. 

When I didn't use I did xanax, 1mg too less, 2 mg is perfect. I feel so sociable and cozy, but I guess trading addiction for addiction isn't the best idea.

Do you have any advice, tips, vitamins, medication that help cravings? How to start recovering and forcing yourself not to use?

Good luck and take care.",5
2021-06-03 16:46:04,https://www.reddit.com/r/StopSpeeding/comments/nrnjob/day_four_off_the_sauce/,day four off the sauce,"Four full days since I’ve taken adderall in part due to the support of this community. It’s not my first time quitting but hopefully will be the last. Feel very unproductive and very foggy, like there is a veil over my consciousness. anyone have any tips?

Ps - still beats the awful come downs.",11
2021-06-03 08:54:30,https://www.reddit.com/r/StopSpeeding/comments/nrcte5/ill_be_honest_i_didnt_do_this_for_myself_i_did_it/,"I’ll be honest, I didn’t do this for myself, I did it to keep my marriage. I love my husband more than anything. I have not relapsed, I’ve been in therapy, I’ve been doing everything right. He is leaving anyway.","It’s been over two months since I threw out my pills. I did it for us and the life we were going to build together.

I never really hit my own rock bottom. Pills were still great for me. The comedown sucked but I was productive on my weekend long benders, I got the things done I wanted to do. Plus it felt really fucking good. At the time, the good still out-weighed the bad. Other than the comedown the only really bad part was the fear of my husband finding out and the stress of lying and hiding it from him. 

And when he did find out and I threw them away I didn’t do it for me, I did it for us, and for him. 

I didn’t even fucking relapse, I didn’t DO anything!!! He fucking lost it because I said I miss them and still think about them all the time. He said he wants separate bank accounts for “when you relapse” because if I fuck up *at all* he is gone. Let me be clear: I never bought drugs ever, all I did was fill my 30$ script each month. I’ve never stolen anything. Im not trying to minimize what I did but I really don’t feel like this is proportionate to the situation. Especially since he used to SNORT THEM WITH ME ALL THE TIME!!! He is just mad about the times I hid it from him. Like what the fuck is this!!??

I don’t fucking understand why he is doing this when I have been doing everything right. I wake up everyday fucking hating everything about myself and the world and I still drink enough water and eat pretty healthy and work full fucking time and got a 4.0 last semester WHILE GOING THROUGH WITHDRAWAL AND WORKING 30 HOURS A WEEK!

I went through absolute hell on earth because he said if I failed a class he would leave me. I only did this for him. 

He wanted separate bank accounts and I had a full blown panic attack. I have done everything right. I am the one who uses YNAB, I don’t have a spending problem. This is, and he admits this, because he needs and exit strategy for “when you relapse”. I had a panic attack and now he doesn’t want to be with me. 8 years of marriage. Done. 

What was the fucking point of all of this. I was happier on my pills. And now I have no one I need to worry about hiding them from. 

I honestly don’t see a reason not to go back on them right now.",65
2021-06-02 22:59:17,https://www.reddit.com/r/StopSpeeding/comments/nr3al9/people_would_miss_me_but_i_wouldnt/,"People would miss me, but I wouldn't","I've become such a cold person, using made me feel like I could care about others at least a tiny bit. I'm not using currently and have stopped buying but I can't seem to bring myself to completely live my life without it and quit using. I don't use because I hate why I do it - to be able to understand my feelings better, control them, feel them or repress them. But without them I'm empty. 
I want to cry, I want to hug those close to me. But I have nothing to cry over, I feel nothing and those close to me don't mean anything to me I feel. Just empty friendships and relationships. They care about me and love me, but I can't find any feelings for them so I distance myself which makes it worse",27
2021-06-02 19:36:20,https://i.redd.it/jk6th848ux271.jpg,I've been clean from meth for 7 days now bc I have to be. I'm still prescribed Adderall and I don't abuse it. Now I'm going to get in trouble bc the program I'm going to doesn't differentiate between amphetamines and methamphetamines.,,4
2021-06-02 16:28:40,https://www.reddit.com/r/StopSpeeding/comments/nqvhwu/quitting_adderall_advicetipssuggestions/,Quitting Adderall - Advice/Tips/Suggestions Appreciated,"I’m going to be quitting adderall and I want to know what I have in store for me and definitely any advice if anybody has any. Here’s a little bit of background:

I’m 17 and was prescribed a daily dose of Adderall XR for the past 5 years. For a couple of those years my dose was at 15mg XR per morning. After that my dose got upped to 20mg XR every morning and a 10mg IR pill in the afternoon as needed. I’m not proud of it but I abused the IR pills and instead of taking them in the afternoon as needed, I would save them up and take 30-60mg IR whenever I felt like I needed it or was just wanting the high. Throughout all of this I would never miss my 20mg XR dosage in the morning, except for a day here in there when, for whatever reason, I decided not to take it. That was very rare, I’d say in the 5 years I’ve been on Adderall, I’ve only really had about 7 days where I didn’t take my morning XR. Throughout the past year, I’ve gotten into other stimulants as well, I would regularly use “stimulant junkie” pre workouts with a bunch of caffeine, DMHA, and other stimulants in them. I’ve since quit all other stimulants except Adderall. As I’ve started to mature, at least very slightly, I’ve noticed that Adderall is a cause of a lot of issues in my life and is definitely doing a lot more harm than good in my life, especially with the way I am taking it. I’ve never been able to quit this year because I’ve had school that I need to function for, and without Adderall, I would not be able to keep up with school at all. So I decided to quit cold Turkey over summer, which starts this coming Friday. 

I know quitting like this is going to be very rough, but due to extreme addictive personality, I would be in almost the same amount of misery if I tapered, but over several months. This, among other reasons, is why I’m quitting cold Turkey. 

I’m curious as to your opinions on the timeline of my withdrawal and the severity of my symptoms. I know there’s no exact way of predicting these things, but your opinions are appreciated.

I also want to know if you guys have any recommendations to make this withdrawal easier/better. Any habits I should try to build, supplements I should take, or any other tips you guys have would be amazing.",4
