Date,URL,Title,Body,Score
2021-06-26 15:30:38,https://www.reddit.com/r/StopSpeeding/comments/o8heh0/a_few_things_that_can_help_get_the_ball_rolling/,A few things that can help get the ball rolling again.,"All of us here know how hard it is to quit. Doesn’t matter if we’re 5 years clean or a few hours. It’s hard. A few things I found out along the way are: 
1. My self image dictates what my body feels.
2.If I eat healthy, I get healthy 
3. Lie to yourself.

Take a shower, brush your teeth and floss.
Get a haircut, do your nails, buy great smelling body wash, shampoo. Make your self feel and smell great. Even if you aren’t going anywhere.
Drink water, eat some greens, foods high in protein and then some more water.
Get a gym membership. Even if you don’t want to lift weights. Just hit the treadmill and walk. Everyone in the gym is working on themselves and it’s good to be around people that are on the same page.
Tell yourself that it’s going to be a good day, that you’re happy, and that everything is going to be fine. Eventually all those lies will become true, because you’ve spoken it into existence. 
We’re all here for a reason. We’re all good enough. We deserve everything and more. Leave the past in the past and start building a solid foundation for the future. I believe in you.",54
2021-06-26 07:25:48,https://www.reddit.com/r/StopSpeeding/comments/o88z3q/remember_when_you_were_laying_in_bed_for_hours/,"Remember when you were laying in bed for hours feeling like a brain dead zombie, thinking that nothing will ever motivate you to get up and make your life happen...","And you gave in to your urge and hit up your dealer, thinking the drugs were the only thing that can get you out of this hell?

And do you remember when the second you got the text back saying ""yea man come through"" you immediately felt 100% better? All of a sudden you jump out of bed excited, racing to get dressed and drive to your dealer. You're in a great mood, enjoying the drive and looking forward to a fun night. 

We felt the drugs way before we actually took them. So don't give up or doubt your body's ability to reward us or its ability to produce those feel good chemicals. It's all there for us. 

We just have to put the effort and time into rewiring what releases those feel good chemicals. So much fucking time and effort. 

In a way it feels like a cruel joke. We were so determined to go through life at 100 miles per hour zooming past all those other lame asses laughing at them. Then we find out we went the wrong way and the only way back is through a months long traffic jam that isn't moving. 

It's ironic. And hard. I wanna go fast man fuck this traffic.  😁",67
2021-06-25 23:06:47,/r/Drugs/comments/o82iby/how_do_i_stop_oversharing_when_im_on_speed_omfg/,Ugh,,3
2021-06-25 21:21:37,https://www.reddit.com/r/StopSpeeding/comments/o80yek/science_based_recovery_meeting_tonight_on_discord/,Science based recovery meeting tonight on discord - all are welcome!,"Hello all you beautiful soberinos-

Posting today to let you know we are running a smart meeting in the RedditInRecovery discord! It happens every friday at 9pm central.

If you've ever thought that you need a meeting but you were scared to go in person, or you went to 12 step and it didn't fit with your mindset... I encourage you to check it out.

Here's a quick writeup of the program and how the meetings go:
SMART (Self-Management And Recovery Training) Recovery

SMART is a generalized non-spiritual/non-religious addiction recovery program that is self-driven, as opposed to standard 12-step style programs, built from science-backed psycho-therapeutic techniques (e.g. CBT/DBT/REBT) that are applied in the context of addiction. 

The focus is to help and empower participants by building sensible mental tools as part of their recovery to overcome the logical fallacies, difficulties in emotional regulation and other mental roadblocks that appear during the path to recovery, no matter what stage someone is at (day 1 or day 1000).

The SMART approach is built around ""the 4-point program"":

1. Building and maintaining the motivation to change. 
2. Coping with urges to use.
3. Managing thoughts, feelings, and behaviors in an effective way without addictive behaviors. 
4. Living a balanced, positive, and healthy life.

 Meetings 

SMART meetings are best understood by looking at the meeting format. Unlike other programs, cross-talk (discussion between participants) is encouraged.

1. The meeting opens with a check-in where everyone one-by-one is invited to speak about how they are today, where they currently are in their recovery, any stressors they'd like to work on and anything else that feels relevant in the present.

2. The facilitator will ask people who are dealing with an issue to discuss it, generally inviting other participants to chime in if they have relevant experience or some thoughts, then work with the current person on teaching them (as well as the group as a whole) a tool that is applicable.

3. The meeting closes with a check out in a similar style to the check-in, where feedback is given to facilitator as well as simple how you feel and anything that may have come up that you want to ask about.

If you'd like to join us for the meeting tonight just click this link >> https://discord.gg/S3gEqnFw

I will be 3 years clean in october from various stimulants (adderall, vyvanse, amphetamine, mdma, cocaine) and I really cannot speak highly enough about how much the tools in smart helped me deal with intense urges and cravings along the way.

Hope to see you there!",16
2021-06-25 17:57:30,https://www.reddit.com/r/StopSpeeding/comments/o7xjyd/how_to_sleep_over_the_cravings_at_night/,How to sleep over the cravings at night?,Can't sleep. My body is demanding the stims. I am shaking. My head is all heated up. I wan't to sleep,10
2021-06-25 05:21:06,https://i.redd.it/00b05rnmqd771.jpg,"Using opiates as a general drug quitting counter, almost a day sober 😀",,13
2021-06-25 03:21:27,https://www.reddit.com/r/StopSpeeding/comments/o7iq8s/one_of_the_good_but_tough_things_about_stopping/,One of the good (but tough) things about stopping speeding...is that you are forced to lack back and realize/confront how much you have wasted and lost because of it.,"Been on it for the last five years, got really bad during the last year. Due to a very unpleasant and complex situation I was forced to cold turkey and am now forced to look back on everything I have wasted/lost because of this. So much time wasted. So many events gone away. So many things never accomplished because I spent hours in my room writing lists about the things I was going (but never did) accomplish. It helped me be productive in the beginning but quickly turned into a nightmare of wasted time and a whole bunch of other issues for me. The crazy mood swings, the odd apathy it gives you at times, etc.

And because I am also currently going through what is basically a mild benzo withdrawal at the moment I literally cannot go back to speed right now. I feel like my mind has been let off of a roller coaster and I am forced to look at the wreckage of the past several years.

I regret so much. Words cannot describe the amount of regret.",55
2021-06-25 02:35:49,https://www.reddit.com/r/StopSpeeding/comments/o7i5fi/what_is_your_sober_experience_of_psychosis/,What is your sober experience of psychosis?,"I've always been very curious as to how well folks remember their behavior when experiencing  psychosis.

Now I am not talking about the paranoia that goes away after getting sleep. I am referring to the psychosis that requires hospitalization and antipsychotic administration. I am especially curious about delusions, as opposed to the sensory symptoms. 

Are you able to reflect back and recognize that your behaviour/thoughts were irrational? Or do you still believe many of the thoughts during this period, but it's hard to tease apart from the truth from fiction? Do you have to convince yourself that people weren't after you etc.?",8
2021-06-24 23:28:07,https://www.reddit.com/r/StopSpeeding/comments/o7fhbz/i_relapsed_today/,I relapsed today,I was 13 days off and I took 40mg of adderall today. I’m not gonna take any again I don’t have any access no more. Will this start the whole withdrawl process over again? I literally hated the experience so much when I was on it. I don’t even wanna go back I had so much depression it was the worst.,6
2021-06-24 14:26:32,https://www.reddit.com/r/StopSpeeding/comments/o76vb5/one_year_clean_from_a_13_year_addiction_to/,One year clean from a 13 year addiction to adderall. Depression and fatigue,"It's been a year clean and I'm still not nearly the same as I was before addiction.  I'm so depressed and lazy as hell. I see the pictures of people before/after addiction and they look great. Hair done, makeup done, etc. I haven't worn makeup since I got clean. My house needs to be cleaned so bad. Everytime I get up to clean, it's like something forces me to stop. When I was high on adderall I was a neat freak. Idk if that has something to do with  me not wanting to clean now. 
Does it get better?",13
2021-06-24 12:55:01,https://www.reddit.com/gallery/o74yrk,I have to remember I don’t miss looking like this,,100
2021-06-24 09:40:49,https://www.reddit.com/r/StopSpeeding/comments/o713o8/one_month_clean/,One month clean!?,"Today marks one month clean from meth. I’ve been here before but this time is vastly different. I’ve had to lose it all to finally get it through my head, but finally I understand that there is nothing left for me in that world. Today I start a new job(nothing great but it’s something) and I’m feeling optimistic about the future again. Recovery doesn’t seem daunting anymore. I had a situation a week or so ago that put me way closer to relapse then I would have liked, but I did not use and I dealt with it. To anyone trying to get clean or stay clean, life does get better, you just have to fight for it like your life depends on it. For me at least, it does.",30
2021-06-23 20:51:40,https://www.reddit.com/r/StopSpeeding/comments/o6q2av/im_doing_the_thingrecovery/,I’m doing the thing…recovery,"I’m doing it. I haven’t used meth since May. Over a month now. Im so proud of myself. I’ve been clean off all substances for 26 days now. Fucking amazing. Can’t believe it. Tomorrow Im heading into addiction treatment for the first time. Terrified and anxious and stressed but also excited to work on getting my life back?! Fuck. 

Good vibes only pls. I want and need my life back.",45
2021-06-23 20:04:08,https://www.reddit.com/r/StopSpeeding/comments/o6p9wu/two_months_in_will_the_fatigue_ever_end/,Two months in - will the fatigue ever end?,"Was taking 40-60mg Adderall a day for about 15 years.  Realized it wasn’t really working anymore, keeping me isolated, emotionally numb, impulsive blah blah.  I’m sure I’m not alone here.

Quit and went to Colombia for 8 weeks because they don’t have it there and I’m not a fan of blow.  Drank every.  Single.  Day.  And smoked blunts nonstop and ate terribly and fucked a ton of chicas.

Question is, I’m still dealing with being so blah and get hit with waves of fatigue.  Took two naps today and i started a new job this week.  

When will the fatigue end?  Is the booze?  My body fighting off a jungle std?  Weed?

Help.",8
2021-06-23 16:24:56,https://www.reddit.com/r/StopSpeeding/comments/o6l7ov/i_really_dont_feel_okay_can_someone_text_me_from/,"I really don’t feel okay, can someone text me from messages I really need someone to talk asap. I really need help.",,4
2021-06-23 03:49:24,/r/Stims/comments/o61zrs/im_addicted_to_the_feeling_of_reaching_out_to_my/,-mic drop-,,7
2021-06-22 23:23:28,https://www.reddit.com/r/StopSpeeding/comments/o64hgk/should_i_throw_away_my_vyvanse/,Should I throw away my Vyvanse,Should I throw away my Vyvanse? Have been taking 60 mg a day for about 2 years. Is it dangerous to quit cold turkey?,7
2021-06-21 21:45:33,https://www.reddit.com/r/StopSpeeding/comments/o5b9lb/clean/,Clean,Today I am 24 days clean. Can’t believe it.,14
2021-06-21 16:36:34,https://www.reddit.com/r/StopSpeeding/comments/o54vfp/how_is_your_confidence_and_self_esteem/,How is your confidence and self esteem?,"Hi! Just wanted to ask you, that did you develop self esteem problems after quitting? If yes, how did you manage it. Is it achievable again?

What are your experiences?",6
2021-06-21 15:21:57,https://www.reddit.com/r/StopSpeeding/comments/o53525/4_months_clean_from_alcohol_and_meth/,4 months clean from alcohol and meth!,"So much has improved in 4 months. I'm taking care of responsibilities, bought a house, and started dating again. Therapy, AA, exercise, self improvement books, and antidepressants is helping me live again. Reach out for support. You don't have to do it alone.",23
2021-06-21 15:00:30,https://i.redd.it/9lvqmpuc2o671.jpg,Hit a milestone today.,,97
2021-06-21 14:38:45,https://www.reddit.com/r/StopSpeeding/comments/o524x1/snorting_adhd_meds/,snorting adhd meds,(i’m from france so my english is pretty bad sorry for that) i have an important exam very soon and my doctor gave me 10mg ritalin to be more focused but it didn’t affect me even a little bit when i took it orally then tried snorting it and i’ve been snorting around 30 sometimes 40mg a day and sometimes i mix it with cocaine lately i can’t sleep at night i’m always anxious my anxiety about my life and that exam have been making me want to commit suicide and everynight before sleep i can’t even breathe i always feel like i’m gonna die this night. are there anyone who can give me advices abt how to quit that shit?,6
2021-06-21 09:50:19,https://www.reddit.com/r/StopSpeeding/comments/o4vkoy/day_1/,Day 1,"Im getting off my Vyvanse, I abuse it like crazy and it and alcohol are big problems in my life. 

I believe in myself. I can get off all this poison.

— 

My upper back feels corroded with pain and tightness. My eyes feel dry. I’m thirsty no matter how much water I drink. I’m in pain and wide awake. I feel like a loser. I feel sad and old. I feel sick. I feel anxious and scared. I’m coming off another binge. 

But this might be the one binge too many that changes everything. 

—",6
2021-06-21 04:17:11,https://youtu.be/xTvxa0Rlhpg,I found this very interesting and motivational as a person trying to quit meth: Sleep Is Non-Negotiable: Dr. Matthew Walker | Rich Roll Podcast,,5
2021-06-21 03:22:12,https://www.reddit.com/r/StopSpeeding/comments/o4pl4z/it_rly_is_possible/,it rly is possible,"i’m almost at 4 months and im starting to actually feel like myself again. i just cannot believe how impossible this seemed when i was at my rock bottom. but somehow here i am. u are strong enough to do this

today i was looking out the car window and i felt so present, like the trees and sky were familiar again. idk how to explain it but i feel a little surge of clarity after a rough bout of post acute symptoms",66
2021-06-20 14:50:13,https://www.reddit.com/r/StopSpeeding/comments/o4c99b/i_just_need_to_get_this_is_my_chest/,I just need to get this is my chest,"Probably doesn't belong here since I have been clean from meth for a year but I started drinking with my boyfriend recently and yesterday I got fucking plastered and called the guy who introduced me to meth that I was in love with once.

I'm afraid of being judged by you guys but I hate my boyfriend. When we started dating I thought it was pretty clear that we were a couple if convenience. I told him him that I just wanted someone for company that I could work on my life with but I'm not looking for anything romantic since my fiance passed. He said okay.

I guess he thinks I'm leaving him because he is over the top and talks about how much he cares for me but I can't fucking stand him. It gets harder every day. I invited him to the city and paid over $400 for an Airbnb for us and he kept getting angry about how he had no money and how I wouldn't lend him any to buy a gun. He got angry that we were eating gas station food because I can't afford to take us to restaurants. He gets angry all the time, never has money, and takes all his problems out on me. And I feel guilty because I feel like I'm using him but we were upfront from the beginning. I have been looking for a place to stay almost as soon as I moved in with him and realized it was a mistake but I couldn't.

I feel like the real reason he doesn't want me to leave him is because his wallet will be leaving him. Not his girlfriend. He makes me feel like a piece of shit when I ask him why isn't he getting groceries when it's his turn and he basically told me he expects me to pay for groceries from now on. I feel used and angry and it's making me hate him. And I still feel like I'm using him because he hints I am sometimes. 

He is so draining. I'm tired of being yelled at because the weather is shitty or he's broke because he makes terrible financial decisions. I don't love him, I barely even like him at this point. I wanna leave so fucking badly. This situation isn't good for me.

I feel like I'm trapped. I hate how he constantly criticizes me. He gets angry if I ask him not to bring alcohol around me and he's angry when I let him and drink too much. He makes fun of my body and what I say. I hate how I walk on eggshells all the time. 

I think I'm close to a relapse. I wouldn't have called that guy if I didn't want to use, even after he confirmed he isn't sober. He knows that I lied to my family about where I'm living who I'm with and what my job is because they're super religious so I can't go to them for help because it would expose me. I'm just not ready to give up. 

I'm so angry at my boyfriend and I have no one to tell it to and it's eating me up when I have to act like I'm sorry because he's giving me the silent treatment. I'm not sorry. I'm so angry I'm having chest pains.

Edit: I just broke up with him.",36
2021-06-20 14:20:15,https://www.reddit.com/r/StopSpeeding/comments/o4bnej/microdosing_mushrooms/,Microdosing mushrooms,"So I’m clean from meth for 26 days and I never want to go back. I’m dealing with severe depression/sadness from the things I did and lost during active addiction. I’ve had 3-4 months clean time in a few different stints, but always relapsed, luckily nothing over a week or two. I don’t want to get in to anti depressants and I’ve heard microdosing with mushrooms can have the same effect while also helping to restore damage to my brain. Has anyone tried this method? Any advice or thoughts are welcome. I should add I’m working a program as well as seeking out therapy, trying to be active and eat well, and trying to go easy on myself. I still smoke darts and have an occasional puff or two of my weed pen. Thanks all",6
2021-06-19 19:20:03,https://www.reddit.com/r/StopSpeeding/comments/o3sdot/find_your_people_start_a_group/,Find your people! Start a group!,"I started a weekly zoom chat last year for anyone on this sub to join and found myself in the company of three amazing people who have now become my very close friends. 

I reached my one-year clean date a few weeks ago and it's all thanks to the support of these people. I STRONGLY encourage you all to start your own  groups. Not just in the chat rooms or discord. Set up a weekly FaceTime or zoom or whatever you prefer and see where it goes. 

The opposite of addiction is not recovery. It's connection. I swear I wouldn't be where I am right now without them. 

Find your people!",4
2021-06-19 18:32:43,https://www.reddit.com/r/StopSpeeding/comments/o3ri7k/a_doctor_who_is_starting_to_hate_his_addicted/,A doctor who is starting to hate his addicted brother,"Brother A's background: oldest of 3 siblings, previously sucessful professional with 3 kids who is addicted to crystal meth. Has had multiple relapses and rehab visits in the last 5 years. More recently, he's gotten recurrent psychoses regarding the whole world trying to kill him. Despite these recurrent psychoses, homelessness, separation from wife/kids, he continues to leech off my parents and use.

Me: background in psychology and in a field of medicine that is able to cater to addiction/mental health. I've always been very understanding of mental health, addiction, and giving people the benefit of the doubt because you can never understand their circumstances. A large part of this stemmed from watching my other brother (B) battle through schizophrenia and associated psychoses. It was an extremely difficult time involving jail time, and my oldest brother and I were quite affected by it when it happened about 15 years ago. 

Despite my own background, I have an extremely powerful rage brewing inside me. Even though brother A watched brother B go through psychosis and how dramatically it affected the family, he is more than willing to use. I've had to watch my parents' health deteriorate trying to clean up after his mess. The crystal has made him an entitled narcissist. The first words he asked me when I saw him after a year were ""you got any money?"" He has no regard for his kids and I've had to do my best in visiting the city as frequently as I can to act as a positive male role model to them. 

Right now, he's stabilizing from yet another psychotic episode in the hospital. I  just want to tell him to fuck off and stay away if he wants to continue to use. I just want to cut this cancer off and tell my parents and family to do the same. Its so fucking enraging dealing with him despite me being in a position to be the most understanding about his ""condition"". Why the fuck should I be okay with the family helping someone who will lie, cheat, manipulate, exploit, and steal from them? 

Sigh. Sorry to rant. Looking for some guidance from you folk.

**Edit**: thank you all for your kind advice. Each and every one of you has been so very supportive. Much love.",29
2021-06-19 17:48:50,https://www.reddit.com/r/StopSpeeding/comments/o3qon9/track_marks_how_to_care_for_them/,Track marks… How to care for them?,"I’ve been using Neosporin,  hot and cold compresses, Maderma, Arnicare, and Bactroban when needed but I’m curious to hear if anyone else has their own self care habits and practices. 

I’m also curious of what should I do first when I can tell that a hit will scar? 

Is there hope while the skin damage/ bruise is still fresh that can prevent/minimize the extent of the permanent discoloration? 

Or is it just better to let them heal naturally and use a scar cream down the line?",4
2021-06-19 09:29:44,https://www.reddit.com/r/StopSpeeding/comments/o3g4lj/why_isnt_wellbutrin_classified_as_a_stimulant/,Why isn't wellbutrin classified as a stimulant?,"From what I've read, wellbutrin works by being a dopamine reuptake inhibitor. Isn't this the same way that ritalin works? So if it works like ritalin, why isn't wellbutrin a stimulant?",19
2021-06-18 15:57:21,https://www.reddit.com/r/StopSpeeding/comments/o2yt4m/ughhh_when_will_i_stop_feeling_like_a_zombie_in/,Ughhh when will I stop feeling like a zombie in the mornings?,"After about three hours I feel okay and happy and energized/normal but how do I get over the morning “I wanna die” slump? I pound coffee and it doesn’t do much besides give me diarrhea. Some mornings are better than others but today I was literally dragging myself around the house moaning “I want to diiie” “arrrrgh” “hnnnngh” and shuffling like an extra in Walking Dead. On one hand it’s kind of funny but while it’s happening I literally do wish I was dead. When does this shit subside? 

If it’s relevant, I’m coming off 1.5 years of Adderall addiction (20-40mg/day) and prior to that I took Wellbutrin for about a decade. Not interested in ever taking Wellbutrin or any other antidepressant again btw. I don’t feel depressed, just awful when I wake up.",14
2021-06-18 15:20:02,https://www.reddit.com/r/StopSpeeding/comments/o2xzix/im_gonna_count_this_as_day_one_without_wish_me/,I'm gonna count this as day one without. Wish me luck.,I almost caved this morning but luckily didn't.  Mainly because my eyes are still the size of saucers from the last several days and I need to hide it.,31
2021-06-18 09:43:59,https://www.reddit.com/r/StopSpeeding/comments/o2peu1/i_feel_like_i_cant_stop/,I feel like I can't stop,"Everytime I say OK I'm gonna stop,  I buy more. And the cycle repeats.  Whenever I'm high i get a false sense of confidence and go Yeh I can quit,  I can do this.  But when I start sobering up I feel like I can't stop. Like its not even fun anymore.  I'm freezing cold,  shaky,  hearing shit,  seeing shit and so so paranoid about everything",10
