Date,URL,Title,Body,Score,COVID-19 Mentions,Sentiment
2021-10-15 03:53:07,https://www.reddit.com/r/StopSpeeding/comments/q8jk40/trying_not_to_relapse/,trying not to relapse,"i’m 228 days clean (wow!) and this is the closest i’ve been to relapse. 

last year my doctor prescribed me dexedrine to take if i needed to give a slight boost to my morning vyvanse. i started to abuse it, and when i ran out, they refilled it with 200 pills (i don’t know why they would give that many fucking dexys to a teenager). that was the turning point in my addiction. soon after that i was taking like 30-40 pills in a day, as well as my vyvanse, or just insane amounts of vyvanse at once (that tolerance happens so damn fast). and my dad and brother both have adhd, so i was so far gone in fucking speed wonderland.

within 5-6 months my life had exploded, my brain was fried to word salad and delusions, and one night i hit enough of a rock bottom to quit cold turkey (including weed and nicotine). 

now i take a daily vyvanse prescription—which is locked in a safe and handled by my parents (thank god)—for adhd. but lately more thoughts have been creeping in about skipping a day so i can double dose.

and then today i got the suggestion to add a 10mg booster in the afternoon. i said all the right bullshit to make it happen, but i know if i get it, im gonna save it so i can binge.

i want it so bad. it’s available to me. i am so scared to relapse and i need to find the strength to turn down the scrip. 

tldr: opportunity to relapse, struggling to turn it down",8,{},"{'label': 'negative', 'score': 0.73999584}"
2021-10-14 23:31:19,https://www.reddit.com/r/StopSpeeding/comments/q8fp5f/stimulant_abuse_and_movement_disorders/,Stimulant abuse and movement disorders,"Does anyone else have significant trouble with movement? Like I'm super shaky, I'm always stumbling around and tripping over literally nothing, I'm always dropping things and have trouble holding on to things, my balance is fucked, and I have trouble talking. Anyone else have stuff like this?",17,{},"{'label': 'negative', 'score': 0.9477658}"
2021-10-14 20:10:52,https://www.reddit.com/r/StopSpeeding/comments/q8c7da/so_damn_happy_i_quit_this_shit/,So damn happy I quit this shit.,"I overdosed on fentanyl-laced speed & almost died, and I quit cold turkey since then. Working on cutting weed entirely out of my life too, I only smoke once every 3 weeks or so, and even then, it’s 0.5g, not a gram or two daily like I used to. I’m so happy I’m finally sober. I look better, I’m more confident, less hateful, my grades shot up, I have higher standards for myself, a girl likes me, I’m interested in my hobbies again, I have a better outlook on life in general. I still struggle with depression, as I have since I was 11 or so, but the episodes aren’t permanent like they were when I was a junkie. I’m never touching another hard drug in my life. It’s not worth it, and I regret it deeply everyday.  I’m happy I broke free from this demon drug’s clutches. My life did a 180 in a way I never thought possible. Don’t give up.",41,{},"{'label': 'positive', 'score': 0.67385644}"
2021-10-14 17:05:09,https://www.reddit.com/r/StopSpeeding/comments/q88tmn/following_up_on_earlier_post/,Following up on earlier post,"Hey family. Just letting everyone know my UA did come up dirty, but because I had been honest and up front w him before I even did it, I'm not in trouble. We're gonna explore treatment options for me and get me some help. A massive THANK YOU to everyone who showed such support and love on my earlier post about this situation. It went well, I'm okay, and most importantly not going to jail. 


Much love to all. We're gonna get through this together.",12,{},"{'label': 'positive', 'score': 0.9393048}"
2021-10-14 16:14:03,https://www.reddit.com/r/StopSpeeding/comments/q87syq/day_8_i_think/,day 8 i think,"i’m pretty sure today is day 8. i feel like i’m slowly starting to become myself again. the cravings haven’t stopped, and have actually been getting worse. i expected this though. this is the third time i’ve had to go through getting sober so i knew what to expect. i’ve been missing a lot of school and work and sleeping until the pm which is definitely not helping me in the slightest. i guess it’s time to force myself to be productive. 

i got some cleaning done today and i studied for a test that i’m going to have to make up because i missed it. part of me feels proud but another part of me knows that if i relapse i could get so much more done. it’s like my brain is at literal war with itself.  i’m holding on for now. i hope everyone else who is in recovery is doing as well as they possibly can. sending my love and support to all of you ❤️ this shit is not easy.",8,{},"{'label': 'negative', 'score': 0.41193613}"
2021-10-14 13:35:20,https://www.reddit.com/r/StopSpeeding/comments/q84mbq/our_stopspeeding_discord_server_has_2/,Our StopSpeeding Discord server has 2 recovery-focused meetings a week now.,"Hey former speeders, if you're interested in attending a recovery meeting all about quitting stimulants, please join our StopSpeeding Discord,  and the meetings are every Wednesday at 3pm EST (GMT -4) and every Sunday at 12pm EST in the 'recovery meeting' voice chat channel.

All are welcome to attend, clean or not, although we prefer you not share too much if you're currently intoxicated.

These are not NA meetings. It's our own thing we're experimenting with, and so far everyone has been really satisfied with how the meetings have been going.

As with the subreddit, our Discord server has several simple rules we expect all members to follow.

Hope to see you at the meetings!",12,{},"{'label': 'positive', 'score': 0.88988566}"
2021-10-14 10:39:57,https://www.reddit.com/r/StopSpeeding/comments/q813b3/day_32_clarity_and_consistency/,Day 32: Clarity and Consistency,"Good morning everyone, my name is Randall and I am addicted to feeling elevated. I used to turn to abundant amounts of meth. I normally post update selfies, but I thought I’d spare you.

After 18 months of keeping it a secret from my family I came clean. Then I relapsed soon after. Moved across the country for 12 months stayed clean. Came back 2.5 years ago and used every day. Going into details is irrelevant, use your imagination. Lost my marriage, lost multiple jobs, friends, my truck, almost my house.

And then ironically enough I lost the good feeling that came with using. I had an outer body experience, possibly a clairecognizant experience. But now I eat well, meditate, and just cling to the present while chipping away at short term and mid term goals. 

I’m extremely happy and grateful to want to be here today. I love life, I love y’all. The light at the end of the tunnel is gorgeous. It’s great on this side, come join me 😘",26,{},"{'label': 'positive', 'score': 0.8527473}"
2021-10-14 06:20:06,https://www.reddit.com/gallery/q7wt1r,"another example of why I need to stop immediately: took too many, stayed up all night, and tried to help a scammer",,1,{},"{'label': 'negative', 'score': 0.9533948}"
2021-10-14 02:44:31,https://www.reddit.com/r/StopSpeeding/comments/q7u7mh/quit_adderall_2_weeks_ago_and_my_boss_just_told/,Quit adderall 2 weeks ago and my boss just told me I don’t have enough attention for the job,Fuck me lol. Feeling so disappointed in myself and now I’m worried about keeping my job. (2 weeks clean after 8 years of daily rx use/abuse),15,{},"{'label': 'negative', 'score': 0.96184015}"
2021-10-13 15:27:07,https://www.reddit.com/r/StopSpeeding/comments/q7inwk/cravings/,Cravings,My psychiatrist prescribed me Wellbutrin for Meth cravings. Anyone have success with this or have you taken any other medication for cravings?,9,{},"{'label': 'neutral', 'score': 0.8156261}"
2021-10-13 04:20:54,https://www.reddit.com/gallery/q76n1q,Pls hmu if u have any information has anyone ever experienced Rash after iv? Been 48+ hours hasn't faded. Getting worried. I'm finally done with this done,,2,{},"{'label': 'negative', 'score': 0.47636616}"
2021-10-13 02:33:24,https://v.redd.it/g91rmcivw5t71,Advice.. Am I just really dehydrated? What's happening to my skin.. I'm 22,,3,{},"{'label': 'negative', 'score': 0.6934186}"
2021-10-13 02:28:43,https://www.reddit.com/r/StopSpeeding/comments/q75888/i_used_to_wish_that_i_had_the_strength_to_be/,"I used to wish that I had the strength to be sober like some people here while using 180 mg of adderall daily, and now i’m 6 weeks clean.","I would be tweaking on adderall for the past year (or whenever the pandemic started) and wow I can’t believe that i’m 6 weeks sober. 

1st week: 
had my first and only meeting with an addiction specialist counselor thing. It was the only meeting because I didnt have enough motivation to be committed. (Sorry for ghosting you counselor)

I was extremely tired. Slept nearly every day this week. My cravings were so strong that I started crying but my counselor brought up how your brain will trick you into *needing* adderall. My brain was telling me that I needed it because I felt lonely, pathetic, and unmotivated without it. I pushed through and randomly called my friends (they are in the dark about my addiction).

Week 2:
My personality somewhat came back. I’m genuinely laughing more. I felt emotions again a little. I also slept really early at night too

Week 3: 
I relapsed on a pill i found in my baggie stash. I absolutely hated the feeling of coming down from that one pill. I’m not going to restart my week count due to that. Honestly, i know that if i restarted the count, my motivation to quit will be gone. 

This week, sleeping is very very hard for me. I would be in bed waiting to sleep and it made me want to hit up my dealer. 
I had a shit ton of anxiety this week. I felt alone. But I knew that it was better than actually being on the short high of drugs.

Gained 15 pounds.

Week 4:
Lost my appetite. Had to force food down my throat.
More anxiety and I had intrusive thoughts. It’s also a very stressful week for me. I actually got a job after the first week of sobrietyto keep myself busy. (It’s working)

Week 5: 
SO TIRED. FATIGUE 24/7. Its so hard to do normal tasks. Didnt shower for. 1 1/2 weeks. Barely brushed my teeth. Room is covered with trash and plates. 

I kept a jug of water in my room, kept trash bags EVERYWHERE so I wont throw my used tissues on the ground.

Week 6:
No motivation to do schoolwork. Forcing myself to do anything. I’ve been restless.

Got CBD gummies to help with anxiety so I can sleep at night. Its meh. I woke up dehydrated for several nights and would only give me 4 hours of sleep before I woke up randomly.

Lost 10 pounds.

Overall:
Despite every negative thing, I would take it over a short lived high with major consequences ANY DAY. I slipped up week 3, but it doest take away from the progress i’ve made as long as I know that I will continue to do better and be better. It took a lot of me forgiving myself from the guilt and hurt that ive had, and im definitely still working on it. 6 weeks doesnt seem long, but compared to my  past usage, im proud as hell",26,{'pandemic': 1},"{'label': 'negative', 'score': 0.685184}"
2021-10-12 23:24:18,https://www.reddit.com/r/StopSpeeding/comments/q72hno/weirdly_jealoustriggered_by_people_starting/,Weirdly jealous/triggered by people starting Adderall “journeys”,"This is a total vent so sorry.


I’m just over 14 months clean from a decade-long Adderall addiction and I can’t begin to describe how much it has improved my life.


However, things aren’t perfect (obviously) and I still find myself craving it from time to time. Especially whenever I gain weight, which is probably my biggest trigger because it took me so long to lose the weight I put on from quitting.


Also when things are tough at work, or if I’m going out to a party. I imagine myself going to the pharmacy and getting my last refill just to take a few. It’s hard but I get over cravings pretty fast and then of course am happy I didn’t give in.


Anyway the past few weeks I have noticed people in my life getting prescribed Adderall for the first time. And being really vocal and happy about it.


It drives me craaaazy because the first year on it was SO fucking crazy and fun and I was skinny and wild and I do get pangs of nostalgia for that time. Like it sounds weird but I miss trying to take a bite of food, getting full in 20 seconds, and going straight for a cigarette instead. I would sit in the library for hours listening to classical music and acing calculus homework, or chain smoke while translating Italian poetry. I really romanticize that period of my addiction (the rest was utter fucking shit).


Anyway idk ugh I just needed to rant I guess. Like I don’t want to read long-winded texts from my newly diagnosed sister because I can tell she’s on her meds. And it makes me jealous and annoyed and tired. And I especially don’t want to see Instagram posts of acquaintances talking about their ADHD diagnosis and every detail of what they did on their day 1 of Adderall.


Like I DONT FUCKING CARE but no clearly I do and until now I didn’t have to deal with people doing Adderall around me. I just came to this sub daily, read positive stories of quitting, and never had to hear about it in a positive light.


I mean I don’t know if everybody just got burnt out working from home and realized they have focus issues but god it is triggering as fuck.


I quit alcohol and didn’t get pissed about people drinking at parties for example. But for some reason people publicly declaring their love for Adderall fucks me up. 😤 I know it’s irrational but oh well.",68,{},"{'label': 'negative', 'score': 0.60438204}"
2021-10-12 22:09:50,https://www.reddit.com/r/StopSpeeding/comments/q718k4/advice_on_adderall_recovery/,Advice on Adderall recovery?,"After 6 months of being on medication; I recently finished my one month supply of 20mg XR, and 10mg IR in the span of 2.5 Weeks. 

After coming to the realization I was ‘out’ and reading addiction/recovery stories, I told my doctor to cut me off and invalidate any further scripts. 

I’m currently on day 2 of quiting, and feel super fatigued/brain fog. My question is when do the withdrawals quit? How do I help reduce these symptoms?",15,{},"{'label': 'negative', 'score': 0.62975526}"
2021-10-12 16:09:30,https://www.reddit.com/r/StopSpeeding/comments/q6uk3w/back_to_square_1/,back to square 1,"was clean for 7 months in 2019. Slowly started taking addy again & now I’m back to where I was before quitting in 2019. 

I’ve gone through 20 30mg addy since Sunday afternoon. I want to end the cycle. 
I’m still in college, graduate in December & don’t want to bring this habit into my career. Help",8,{},"{'label': 'negative', 'score': 0.8010157}"
2021-10-12 14:43:25,https://www.reddit.com/r/StopSpeeding/comments/q6sscq/when_will_concentration_return_or_will_it/,"When Will Concentration Return, Or Will It?","Hey all,

I started taking dextroamphetamine infrequently about 3 years ago to treat ADHD and excessive tiredness (I am narcoleptic). I was prescribed 10mg IR 4x a day. I didn't use every day only when I felt I needed to concentrate more so than normal. I started using more frequently within the following years and for the last year I started taking low doses, 5-10mg a daily which helped for a while but gradually became ineffective and detrimental to my mental health. I should also mention, I have always struggled with severe anhedonia and depression which the dextroamphetamine certainly appeared to help at first but later exacerbated. 

In two days it will be a month since I stopped taking the d-amp.  I'm not experiencing much excess tiredness but my anhedonia has peaked in severity and my concentration is absolutely horrendous. I am trying to eat well, get enough sleep (though it's poor quality), and exercise lightly. 

I know it's a long road ahead but can anybody share their experience on regaining some ability to concentrate? I know that it will take a while for my dopamine receptors to return to homeostasis but what worries me is that my concentration will, at best, return to a pre-amphetamine state which is not acceptable. 

Any suggestions on improving concentration without medication? 

Thanks so much, any help would be much appreciated!",6,{},"{'label': 'negative', 'score': 0.56013536}"
2021-10-12 14:06:18,https://www.reddit.com/r/StopSpeeding/comments/q6s17w/this_is_how_bad_it_is/,This is how bad it is....,"I'm on parole, and because of COVID drug tests have been very very sporadic. I actually haven't had one in almost a year. So of COURSE I decide I can get away with using. Well, last week I found out, WITH A WEEK'S NOTICE, that I would have a UA coming up the next week. Perfect time to stop and get cleaned out for the test. But am I stopping? No. And I feel like the dumbest most hopeless junkie around. I now have until Thursday before the hammer will fall. Even if I stop today (which I am, I threw my dope and pipe away), it's doubtful I'll be clean by Thursday. God I feel like such a lost cause. I have SO MUCH to lose if I go back to prison. So so so much. And yet still I risk it all just to feel good for 5 minutes and horrible for 12 hours.   Amy encouraging words would be great. But mainly I just needed to express my sorrow to people who would get it. Cheers, all.",23,{'covid': 1},"{'label': 'negative', 'score': 0.8629939}"
2021-10-12 06:34:40,https://www.reddit.com/r/StopSpeeding/comments/q6j8dr/7_days_clean/,7 days clean,"Back on board after a the craziness.  Thought I would just quickly update.  

Quick question too..  My drug counsellor broke confidentially and told my mother (also his client)  information from my session,  what do I do about this?  And then he lied about it when I  confronted him.",12,{},"{'label': 'negative', 'score': 0.5590331}"
2021-10-12 02:36:22,https://www.reddit.com/r/StopSpeeding/comments/q6g00u/thinking_out_loud/,Thinking out loud.,"This is mostly a reflection of a temptation I recently had. 

Everyone’s at a different stage in their addiction and everyone has different paths, triggers, thoughts, ect.

This one was really unexpected. I’m pretty comfortable with even being offered it and saying no, which happens rarely because my people know I’m clean now. I’m a firm believer in “you can’t run from your problems, because they will find you”.  When I’m comfortable knowing I’ll be around it or I know I might be offered in early stages and have no issues turning down (realistically no issues) I know I’m in a good spot. Now sometimes you might have to tear yourself away from situations to keep yourself safe and that’s perfectly fine. My tactic is don’t let the thought sit in your head at all. 

The classic going through stuff and I come across a forgotten bag. First thought, oh shit  that’s not cool to have around I better go rinse that out and trash it ( after examining it ).

That’s where I fucked up is examining it I think. I set it down on the floor where I am and finish my project. I come back to it and I consider what it would be like to do it. It won’t hurt that little bit, I’m strong willed now. I put it away and go across town and even voice to my friend later about me being tempted.

Well a week later and I just realized it’s still there. So I’m thinking why? What do I hope to get out of it? All it does it keep me from being bored and all this sober time has made me realize that being bored can be healthy. Being high all the time kept me content on just doing stupid bullshit for months on end. I get high now and I’ll keep getting high because it’s a cheap thrill to keep me busy. But not the right kind of busy. 

Since I’ve cleaned up I’ve strengthen my personal relationships ( well I didn’t purposefully mean to, it was just a positive side effect I noticed ) and I finally enrolled in college while I’ve been putting off for years. All good stuff. 

I’m just venting and maybe hoping to help another person through there struggles as well. 

Thanks for listening. 

BONUS STORY: So I went to meet up with someone that I had made a deal with while I was fucked off and I went to cash in on it. They had been avoiding me so I went to their house and surprised them. Long story short they fed me this long STUPID FARFETCHED story about why they didn’t have everything included on my item I was promised and HAD I BEEN STILL HIGH I most likely would have believed that story. 

I was just super grateful to have a sober head to be able to sort that bullshit out right away. To be fair some of it might have had true elements to it which goes with the territory but all and all….y’all fucked my shit off and you can’t convince me otherwise.",7,{},"{'label': 'neutral', 'score': 0.43938258}"
2021-10-12 01:12:34,https://www.reddit.com/r/StopSpeeding/comments/q6esh3/find_a_narcotics_anonymous_meeting_near_you/,Find a Narcotics Anonymous meeting near you!,"[https://www.na.org/meetingsearch/](https://www.na.org/meetingsearch/) <--- Find an NA meeting near you

&#x200B;

*""NA is a nonprofit fellowship or society of men and women for*

*whom drugs had become a major problem. We are recovering*

*addicts who meet regularly to help each other stay clean. This*

*is a program of complete abstinence from all drugs. There is*

*only one requirement for membership, the desire to stop using.*

&#x200B;

*We suggest that you keep an open mind and give yourself a*

*break. Our program is a set of principles written so simply that*

*we can follow them in our daily lives. The most important thing*

*about them is that they work.*

&#x200B;

*There are no strings attached to NA. We are not affiliated*

*with any other organizations. We have no initiation fees or*

*dues, no pledges to sign, no promises to make to anyone.*

*We are not connected with any political, religious, or law*

*enforcement groups, and are under no surveillance at any*

*time.*

&#x200B;

*Anyone may join us regardless of age, race, sexual*

*identity, creed, religion, or lack of religion.*

&#x200B;

*We are not interested in what or how much you used or who*

*your connections were, what you have done in the past, how*

*much or how little you have, but only in what you want to do*

*about your problem and how we can help. The newcomer is*

*the most important person at any meeting, because we can*

*only keep what we have by giving it away. We have learned*

*from our group experience that those who keep coming to our*

*meetings regularly stay clean.""*",4,{},"{'label': 'neutral', 'score': 0.6033967}"
2021-10-12 00:39:31,https://www.reddit.com/r/StopSpeeding/comments/q6e9ky/feeling_horribly_ashamed/,Feeling horribly ashamed,Relapsed and made awful decisions and sent horrible texts that were embarrassingly tweaky to all the wrong people. Mixed up conversations and just really messed things up for myself. I’m falling asleep tonight like devastated with what happened and dreading the repercussions. I guess I deserve it.,7,{},"{'label': 'negative', 'score': 0.9672397}"
2021-10-12 00:23:40,https://www.reddit.com/r/StopSpeeding/comments/q6e02d/day_7/,Day 7,"Im feeling alot more calm, no weird feelings something is constantly wrong, i hated that.
Im sleeping well, eating well.
I have some hope.
My emotions are still a bit flat but i guess that will take more time. Im kind of enjoying it as my emotions were way too much before my 1.5 years of using.
Im less reactive.
I did my banking today, a bit freaked out because how the fuck did i survive off my head and spending all my cash on drugs. Wow.
Like wow wow.
Any how.
Only positive to report. Look forward to posting a day 14.",8,{},"{'label': 'positive', 'score': 0.5869582}"
2021-10-11 23:18:43,https://www.reddit.com/gallery/q6cvb0,"First 2 me now, last 2 in mid meth addiction nearly 4 years ago. #WeDoRecover",,42,{},"{'label': 'neutral', 'score': 0.7193551}"
2021-10-11 20:21:31,https://www.reddit.com/r/StopSpeeding/comments/q69p65/back_from_inpatient_update/,back from inpatient update,"I posted about going to a residential for 3 weeks and spending my 17th bday there a little while ago. I’m here to update because i said I would so. I ended up going to a “behavioral facility”(aka a psych ward lol) for 11 days and I just got back now. my bday is in 9 days holy shit. anyway I will be 2 weeks sober from adderall tomorrow and i honestly never thought i would get there. it’s so hard to imagine ur life without whatever drug your on and that is so so scary but it’s not impossible. i have long ways to go so i am still going to go to a residential for 3 weeks if they accept me. 

in the beginning when i went to the ER and was told i was admitted to inpatient i was already planning my relapse. 11 days later and I am so ready to get better and start a new chapter. it feels so good. to anyone struggling i know how scary it can be but you can fucking do it. and fuck when people say you have to want to be better to get better. i believe there’s truth to that but you have to start somewhere. baby steps. i believe in all of you<3",12,{},"{'label': 'positive', 'score': 0.6289541}"
