Date,URL,Title,Body,Score,COVID-19 Mentions,Sentiment
2020-04-09 02:56:23,https://www.youtube.com/watch?v=axriLcsVOYQ,Results of 4 Years Amphetamine Use | “What Is Truly Worth It?”,,13,{},"{'label': 'POSITIVE', 'score': 0.9738498330116272}"
2020-04-09 00:39:56,https://www.reddit.com/r/StopSpeeding/comments/fxlyfs/welbutrin/,Welbutrin,Have any of you who successfully quit using methamphetamine used wellbutrin to combat cravings? Did it help?,2,{},"{'label': 'NEGATIVE', 'score': 0.9985122084617615}"
2020-04-08 19:06:40,https://www.reddit.com/r/StopSpeeding/comments/fxgzqx/advice_on_quitting_adderall_with_back_story_for/,advice on quitting adderall... with back story for context lol,"Okay so I got prescribed adderall when I was a little girl took it up until middle school then stopped taking it because I had the memory of a gold fish and it was a low dosage so I wasn't completely dependent on it. In the time I didn't take it I was a full time competitive cheerleader practicing 5 days a week hours on end training and conditioning. I had well enough energy for me and never thought about the drug.

I am 20 years old will be 21 in September (:

While in high school I heard one of my friends talking about how they got prescribed and it was the best thing ever and I remember asking myself ""I wonder why I stopped taking my prescription?"" . Probably not long after that I started my prescription back up at a 20mg dosage and felt like a whole new productive me. I lost weight and felt like I was on top of the world but never really correlated the adderall and my productiveness, I was a dumb high schooler I know. But after my body started getting used to my 20 mg dosage I soon realized I hadn't been doing the same in sports or school and decided maybe I need to up my dosage so now I have been taking a 30 mg dosage ever since. 

I developed an eating disorder while in the mists of starting taking it again and went from 175 to about 110. I don't think the eating disorder stemmed from the adderall, just a toxic high school relationship, but I defiantly used it to stop my appetite. Thankfully my eating disorder has gotten better and I'm doing good with that, but as any person that has had a ED I'm so scared to give into the craving that my stopping adderall makes me have and completely hating myself:(

I am wanting to enlist into the military and have to stop taking it...

To be quite frank I'm scared shitless, because after switching to the 30 mg dosage I started to depend on adderall more and more. Say I accidentally forgot to take it one day or my pharmacy didn't fill my prescription in time I will break down in a anxiety attack because the effects of not taking it after taking it for so long are ruthless and just didn't want to have to go through it. The complete lack of energy I have and the appetite of 4 grown men really do a toll on me. I never really thought anything of it and didn't take it seriously, I just thought that it was me being lazy.

I don't know the clear defining of being addicted or being dependent on the drug I just know when I wake up I just have a routine of waking up taking my adderall having a coffee and some breakfast then after it would start to kick in I would proceed to do what I had to do that day.

I have tried not to take it weeks at a time, not stopping all together, every once and awhile because I didn't think the adderall was the thing making me, me. I would eventually gain weight from the constant eating, and then proceed to sleep and sleep and sleep. Eventually ending up taking it again thinking I didn't take it for a week and didn't like the person I was and just thought that was my personality.

SOOOO with all that said I don't even know where to start. I don't think slowly reducing my dosage will work, I feel FOR ME, I just have to stop taking it all together. I'm hoping there are people who have gone through similar situation or just even quitting the drug like I am attempting to do.

Tomorrow I am not going to take my adderall and need advice on what to do to help the crash of the drug. I am desperate for any tips because I am so scared of the physical and mental exhaustion from stopping.

xoxo

Thanks in advance to anyone reading all of my blabbering",6,{},"{'label': 'NEGATIVE', 'score': 0.929856538772583}"
2020-04-08 18:29:08,https://www.reddit.com/r/StopSpeeding/comments/fxgdc8/about_to_stop_meth_day_1_need_your_guys_support/,"About to stop meth, day 1! Need your guys support :)","Not the first time, failed without no one giving support & maybe i should try reddit. Wish me luck!",18,{},"{'label': 'NEGATIVE', 'score': 0.9955523610115051}"
2020-04-08 12:18:41,https://www.reddit.com/r/StopSpeeding/comments/fx9f4f/addicted_to_focalin/,Addicted to Focalin,I'm the classic ADHD meds kid. Started abusing them late in middle school and have only ramped up use since then and its starting to just fuck my life over before i can start it properly i just want to stop,6,{},"{'label': 'NEGATIVE', 'score': 0.9994561076164246}"
2020-04-08 10:39:44,https://www.reddit.com/r/StopSpeeding/comments/fx7lyq/ive_had_enough/,I've had enough,"So i've been addicted to street speed, taking up to 1g a day. I spent all of my money for this week to get them, but my dealer just disappeared and i won't get any of ones I ordered. I've had enough of the fact that my life is so fucking depended on amphetamines and spinning around them, I really want to stop and live a life, so tomorrow's going to be a day 1. It's going to be hellish difficult, but I think it's time to move forward to sobriety",3,{},"{'label': 'NEGATIVE', 'score': 0.9996848106384277}"
2020-04-08 08:53:03,https://www.reddit.com/r/StopSpeeding/comments/fx5y01/could_i_have_a_slight_problem_with_dependency_and/,Could I have a slight 'problem' with dependency and my ADHD meds?,"I think calling it addiction would be silly, but I've described my feelings to some and they've found it a little concerning. I take 40mg Vyvanse everyday, that's my prescription and I stick to it, nothing more. Though I confess I've been tempted to take more, reason being that I don't feel like I really take it to be productive anymore. In fact, I'm not productive on it at all, really. I spend the whole day in a tunnel vision on things that dont matter, scrolling through my phone, video games, literally just wanking off for hours, bad habits galore. More importantly, it makes me feel so happy, like everything's gonna be fine. I don't get the 'motor' anymore like when I first took it, that's gone now, but the way it makes me feel happy and good about myself is enough. However, when I don't take it, I feel *awful*. So tired, miserable, my self-esteem tanks beyond repair, I eat and eat and I hate how fat I feel afterwards, I can't do anything at all and I feel like an utter waste of space. Its only when I take the meds once again that I finally feel normal.

I don't think this is any sort of 'addiction' because it's just a prescription ADHD drug. But I do sort of feel like my life revolves around it, I pretty much wake up everyday looking forward to taking it. Any similar experiences?",13,{},"{'label': 'NEGATIVE', 'score': 0.9908450245857239}"
2020-04-08 02:52:21,https://www.reddit.com/r/StopSpeeding/comments/fx1k39/well_here_we_go/,Well here we go....,"currently on 120 MG IR adderall.... tomorrow? I don’t want to be on ANYTHING. I really don’t know what to say or where to begin.... I just want to put my message out there so when I stay clean I can come back and see how I was at my lowest. nobody knows about my substance abuse, my girlfriend knows I take adderall but not 100-200mg a day. I’ve been doing this dosage for a solid month and was doing semi normal (30-45mg) dosage prior for about 12-14 months and yes I know that is not along time compared to some of you but for me it seems like it’s been forever since I was sober.  I have come to the conclusion to quit cold turkey and yes I know this is going to be a struggle but im just going to keep telling my self it’s mind over matter. I cannot take/deal with the effects it’s having on me... I can barely even socialize anymore without seeming like a freak. I am a male in my 20’s which is why I want to stop cause I’m young and don’t want to live like this. I am VERY scared of what tomorrow is going to bring.... and WAY more scared of what’s to come this upcoming week.  My emotions are all wacked right now just thinking about what is to come. I always tell my girlfriend the only thing I’m addicted to is weed and I could quit taking addys at any given time.... I say it as a joke normally cause weed isn’t harmful(I got my green card xD) so I really am hoping and wishing that is the truth right now. If you read this far I already appreciate you more then you know 🧡 sorry for being all over the place And so long 



Here’s to murdering this horrible habit🍻(no I don’t drink)🙁",6,{},"{'label': 'NEGATIVE', 'score': 0.996840238571167}"
2020-04-07 20:00:06,https://www.reddit.com/r/StopSpeeding/comments/fwvqmw/quitting_meth/,Quitting meth,"So I don’t know if anyone has tried to orhas quit using meth but I’ve got an “issue” that is currently causing me to worry more then be relieved. I’ve only been using for about 3 months, but right from the start I’ve been doing about 1/2 gram a day, both smoking and sniffing it. I have been taking decent care of myself as far as I bath and brush my teeth regularly, sleep almost every night, I stay hydrated, the only thing I lack is eating enough food. I eat regularly, but with my job and the drug, I burn about 4000 calories a day, almost every day. All this I suppose is besides the point. I recently decided to “try” to quit. I say “try” because after all the research I’ve done, everyone and everything said that while no physically hard, it was extremely difficult mentally. The problem I’m having, is it’s been 4 days, and I have had absolutely no withdrawals. No fatigue, sleeping more, no depression, no anxiety, mood swings, cravings, about the only “withdrawals” I’ve encountered is the munchies. Does anyone here know if it can take this long for withdrawals to start, and if so, does this mean they they may be even worse than normal? Or am I someone some weird outlier who’s for some reason lucky enough to not suffer any symptoms? Long winded and I apologize, but any feedback would be greatly appreciated.",15,{},"{'label': 'NEGATIVE', 'score': 0.9956691265106201}"
2020-04-07 12:24:52,https://www.reddit.com/r/StopSpeeding/comments/fwngc9/i_think_i_am_an_attention_whore/,I think I am an attention who're.,Daddy never l9ved me much. So I 8 3 more.,0,{},"{'label': 'NEGATIVE', 'score': 0.9866211414337158}"
2020-04-06 20:06:28,https://www.reddit.com/r/StopSpeeding/comments/fwa3hx/this_post_is_my_official_commitment_to_finally/,This post is my official commitment to finally and permanently quit Adderall,"Since I started taking Adderall in February/March of 2018, I've ""quit"" several times. I never took it on the weekends, went off for extended periods multiple times during the year (e.g. spring break, summer, etc.), and never abused it.

I took it today, yesterday, and the day before yesterday after I had gone on a 19-day break without it. Today and yesterday, I wasn't able to focus like I was before. I kept getting distracted when I was trying to study for one of my certifications. And if it no longer helps me, why take it at all?

I keep getting trapped in a cycle where my work-related anxieties and desire to be perfect push me into taking Adderall, only to have anxiety over the effects the drug is having on my brain push me into going off it again.

I'm afraid of going off. I'm afraid I won't be able to do my job well (it's a very analytical job). When I don't take it, I'm way more impulsive than I used to be without Adderall. Before I ever took this drug, I was very disciplined in various ways. I procrastinated, but that was really the only thing I wasn't good at. When I *needed* to study, I could, and there were times I was able to shut myself in the library for a full ten hours. Will I ever be able to get back to that? I'm afraid that I won't be. I was only just learning to be disciplined like that right before I got put on the medication.

I'm definitely not the worst case on here, but if I'm going to kill the habit, I want to kill it as early as I can before more damage is done. I threw away whatever Adderall and Vyvanse I had left today, and then I took the trash out to the dumpster to make sure I wouldn't go rooting through my trash to pull the pills back out (which I've done once before when I was trying to quit). These pills have destroyed whatever little confidence I had in myself to perform without the drug, so this is the only way I can make sure I don't take them again.

I still haven't messaged my doctor to tell them not to prescribe psychostimulants for ADHD ever again. I guess part of me still wants the lifeline of being able to go back if I get too afraid of continuing. I also don't want to cause a scene since my case really isn't even that bad, *and* I *did* move out of state since my last refill, so that also creates a barrier.

Anyway, I'm sorry that this post is so disorganized.

Do any of you have alternative strategies for improving concentration or willpower that have worked well for you?",18,{},"{'label': 'NEGATIVE', 'score': 0.9969852566719055}"
2020-04-06 19:56:47,https://i.redd.it/kv27jd4p8ar41.jpg,8 months and 13 days clean and sober off IV METH USE! 💪🏼 #257dayssober,,130,{},"{'label': 'NEGATIVE', 'score': 0.9863945245742798}"
2020-04-06 17:31:12,https://www.reddit.com/r/StopSpeeding/comments/fw7h7x/quitting_again/,Quitting again,It's so fucking hard to stop using speed.  It's not even fun anymore.  My tolerance is too high and all it does is keep me awake without the euphoria and energy.  Now i have to deal with the come down.  It's fucking rough on me mentally.  I'm hoping someone here can give me advice on successfully quitting this drug without committing suicide.,8,{},"{'label': 'NEGATIVE', 'score': 0.9842414259910583}"
2020-04-06 17:14:42,https://www.reddit.com/r/StopSpeeding/comments/fw76tx/second_time_going_behind_my_now_fiances_back/,Second time going behind my now fiance's back after we both agreed no more.,"The first time I came right out and told her because I was ashamed. She gave me a slap across the cheek and we had to leave for work. Which honestly I cant be mad at her response. I was just hoping for some understanding. It was a short sighted, ""oh its right in front of me"", poor impulse control moment, after 3 weeks cold turkey. We later talked about it and she apologized for the cheek slap but she was just mad and disappointed which I get. I was too at myself the second I railed the line.


Fast forward 2 weeks (to 2 days ago), out of nowhere one of my plugs comes into my place of work out of pure chance to get some food. He asks if I wanted to pick up, and at that moment i was pretty down do to a lot of added stress the past week. I had made decent tips and I thought fuck it, I'm I've concealed myself decently before. Was kinda careless, did enough to give enough hints that I was high. Pretty sure my girl new because she made meth related remarks and jokes a handful of times throughout the day. And during a conversation, she told me that she wants to go back to how it was before where whenever I did it, I did it at home, around her so she can keep an eye on me, and it would only be once in a while, instead of going behind her back (she never directly called me out however) That arrangement came to a halt when I had gone overboard, without her realizing, and had a nonstop 2 week binge. I wanted to never touch this shit again, but I guess that would be kind of a lie. I guess I now realize the truth of only buy what you plan on using, nothing more.


I think it's pretty safe to say that she knew I was high. Maybe she didn't directly call me out to give me a room to come clean about it myself? Either way I'm conflicted, because I went behind her back a second time. And now she moved the goal post to accommodate, which just doesn't sit right with me, but the outcome is still mutually preferred.

I'm torn between telling her, and admitting again that I'm weak and did something this disrespectful again, or just letting it be, and go back to using on her terms again.",7,{},"{'label': 'NEGATIVE', 'score': 0.9992561936378479}"
2020-04-06 15:32:59,https://www.reddit.com/r/StopSpeeding/comments/fw5aal/day_7_of_cold_turkey_adderall/,Day 7 of cold turkey Adderall..,"Decided to put this quarantine to good use. I went Cold turkey after 10 years of 60mg IR. I’m pretty depressed today. Tired, lethargic and blah... I feel like a zombie. It’s a weird state of being somewhere in between being awake and sleeping. Almost like I’m in my body but I’m not. Real foggy. I have a hard time making this post flow lol.

Please tell me it gets better soon?

# I decided to update this thread with my timeline journey..

EDIT: Day 12... and feeling like crap still. No energy and decent amount of depression with mood swings. Hard time staying focused and I feel tired all the time. Hard to leave my room to do anything. Brain is still foggy.  I'm taking 1000mg of l-tyrosine and 400mg of magnesium supplements. hoping these help.",29,{'quarantine': 1},"{'label': 'NEGATIVE', 'score': 0.9995918869972229}"
2020-04-06 10:32:14,https://www.reddit.com/r/StopSpeeding/comments/fvzr7m/cocaine_craving_tips/,Cocaine Craving Tips,"My IV coke cravings are out of this world right now. I'm 5 weeks clean and everyday I seem to be getting worse and worse and closer and closer to using and not sure what to do about it. I've been pretty sick all night after something set me off thinking about shooting coke and I haven't really been able to calm my body/mind down ever since. The craving messes up my whole body, makes my heart POUND, gives me a headrush and headache and immediately gives me diarrhea. Just trying to paint a picture that my cravings feel very very extreme and overwhelming. 

Because of this, I am losing hope in myself and the possibility of recovery. I have abstained so far, but it seems harder and harder to fight every time these come. I am also only 5 weeks off a high dose of daily suboxone, so I think that is compounding my depression/anxiety/craving problem.

My question is, what do I do about this? Are there any medications that can help with cocaine craving? I'm not on any medication right now. I am doing daily physical exercise, meditating, eating healthy, not smoking, and engaging in several different types of therapy at the moment.",13,{},"{'label': 'NEGATIVE', 'score': 0.998826801776886}"
2020-04-06 00:33:52,https://www.reddit.com/r/StopSpeeding/comments/fvs7kk/how_i_got_back_on_track_with_adderall/,How I got back on track with Adderall,"How I got back on track with Adderall

I’ve been taking 2x my dosage everyday for the last 3+ years. I run out of my script 2 weeks early every month and go into a huge sleep / food induced withdrawal. I can’t concentrate, I’m extremely emotional and agitated. After two weeks of turmoil I get my script back, stay up all night cleaning the messes I made the weeks prior and pop the rest like candy until it’s gone. 

Every month I tell myself the same lie: “This month will be different, I won’t run out!” And by the end of the two weeks I’m disappointed in myself and my anxiety sky rockets. It’s embarrassing and I’m ashamed. 

I didn’t have the willpower or self control to limit my consumption. I became a slave to the vicious cycle. 

With all of this being said, I FOUND A WAY to get back on track. 
I had to put aside my pride, relinquish control and hand the bottle over to my fiancé. Every night he gives me my dosage for the next day. It took a few days of adjusting and reprogramming my brain to work with the dosage I had. After the first week, I felt better than ever before. I’ve even taken LESS than my daily dosage because I try to stretch the pills out longer——and what do you know? It works better. It works how it’s suppose to. I feel so relieved. 

I know not everyone has someone they trust to do this for them— but I just wanted to share my experience in hopes that it resonates with someone who needs to hear it. I went through years of painful, excessive binges and I didn’t see any way out.....but it’s possible. 
Xo",25,{},"{'label': 'NEGATIVE', 'score': 0.9877222776412964}"
2020-04-05 03:22:23,https://www.reddit.com/r/StopSpeeding/comments/fv9uwy/need_advice_about_microdosing_mushrooms_to_ease/,Need advice about microdosing mushrooms to ease MA withdrawal..,"Does anyone have any experience MD psilocybin through meth withdrawal? I am wondering if it will help lessen the physical and psychological crash that comes a few days after last use. If so, what was your protocol/dose, etc? Any advice is greatly appreciated.",4,{},"{'label': 'POSITIVE', 'score': 0.9798515439033508}"
2020-04-05 03:12:46,https://www.reddit.com/r/StopSpeeding/comments/fv9rem/_/,:(,"So about a month ago I overdosed. I had a really awful bender that resulted in me doing about 30 lines in a short period of time and I almost died and it was a really scary horrible experience. But ever since I’ve felt so strange. I’ve only used once since but I feel so awful and paranoid all the time now and I’m so afraid it will never go away, like I permanently fucked up my brain from it. I feel like I’m in a movie and a dream and dead all at once. Will this last forever? Am I going absolutely fucking insane? Is it always gonna be like this?",24,{},"{'label': 'NEGATIVE', 'score': 0.9978682994842529}"
2020-04-04 23:04:51,https://www.reddit.com/r/StopSpeeding/comments/fv6s02/i_will_stop_smoking_meth_if_i_can_just_get_some/,I WILL STOP SMOKING METH IF I CAN JUST GET SOME FUCKING PUSSY!,"The actual title of this post is:

What was/is instrumental to your sobriety?

I keep going back to meth because my life is boring (before Corona). It's because my dopamine is fried right now so my usual interests don't fulfill my need for leisure. That could be manageable if I had some female companionship but women don't even really consider me anymore. Queue porn binge.

I WILL STOP SMOKING METH IF I CAN JUST GET SOME FUCKING PUSSY!

At 27 in 2020, appearance and money are the most important things to women. I'm not trying to generalize anyone. First impressions are everything and money and appearance do that. I digress though I came for tips on sobriety not dating.",1,{'rona': 1},"{'label': 'NEGATIVE', 'score': 0.9993904829025269}"
2020-04-04 21:00:25,https://www.reddit.com/r/StopSpeeding/comments/fv50mg/feeling_dead_when_sober/,"Feeling ""dead"" when sober.","I'm exhausted right now so sorry if this isn't grammatically correct. 

One of the worst feelings about the lack of stimulation is the depression. It can feel like you're in some zombie induced daydream for months and sometimes even years depending on how much you used and what led up to it. Like you're not exactly dead, but not exactly living either. I'm not saying this to scare anyone because you can and will recover from this. But depression can make it hard to focus, exercise, talk, and even remember things. 

Sometimes I honestly don't even remember the days or the people in it. I just always find myself lying in bed thinking back on all this guilt, embarrassment, and fear. I want to feel alive again. I want to have motivation to find passion in things, to love to read again, and even play video games. I can barely even find the energy to cook a meal after work. Sometimes I wonder why I'm even trying.

But even though this might be a sob story, I'm at least hopeful. Any form of true drug abuse is a dead-end road. There's no happy ending to it. But with sobriety I have my family again, I have trust again, and I can finally sleep at night knowing I'm at least trying. There's light at the end of the tunnel, but fuck is gonna take a while.",12,{},"{'label': 'NEGATIVE', 'score': 0.9929019808769226}"
2020-04-04 18:21:43,https://www.reddit.com/r/StopSpeeding/comments/fv2kpv/who_do_you_look_up_to_stay_soberpositive/,Who do you look up to stay sober/positive?,I personally love posts from Russell Brand and his advice on life and being clean. I’m interested in other people that provide a similar outlook and provide advice. My father is another person that I look up to as he is an addict and is going through a detox successfully. Just curious of who and why you look at for reminders of how being sober is the best way to go about your life.,7,{},"{'label': 'POSITIVE', 'score': 0.9988405108451843}"
2020-04-04 12:01:52,https://www.reddit.com/r/StopSpeeding/comments/fuw4ex/what_are_the_most_common_stop_speeding_tracking/,"What are the most common ""stop speeding"" tracking apps?",,1,{},"{'label': 'NEGATIVE', 'score': 0.997688889503479}"
2020-04-04 11:08:45,https://i.redd.it/1be3ey07htq41.jpg,Damn...feels good,,101,{},"{'label': 'POSITIVE', 'score': 0.9998705387115479}"
2020-04-04 05:41:13,https://www.reddit.com/r/StopSpeeding/comments/fuqvx4/comedy_is_tragedy_plus_time_what_is_the_longest/,Comedy is tragedy plus time. What is the longest amount of time you have spent doing the dumbest shit ever?,The best that I can recall is staying up all night to fix a lighter that was out of fuel. Could have spent less than a dollar for a new one. Lots of movement but so much caution to not make a sound. God I’m glad this is a distant memory,19,{},"{'label': 'NEGATIVE', 'score': 0.998399555683136}"
