Date,URL,Title,Body,Score
2021-06-21 04:57:40,https://www.reddit.com/r/stopsmoking/comments/o4qwnr/today_is_the_day_i_am_going_to_quit_smoking_after/,Today is the day - I am going to quit smoking after having stopped for 2.5 years and started again in January.,"Today is the day I am going to quit. I have one more cigarette in my pack, and that's going to be the last one ever. The last time I quit it worked using three  things: 

\- Alan Carr's book helped me remind myself that this is merely an addiction to nicotine and as soon as that is out of my bloodstream, I'll be fine.

\- The smoke-free app helped me be accountable to myself and motivate me

\- Saving the money I would have used for tobacco every day. Last time I was aiming to buy a really nice watch (which ironically became an engagement ring) so this time a watch it is, to remind me that I did it

I am going to do exactly this again. I am really looking forward to being on the other side, but I know the first couple of days are going to suck. I am smoking so much (sometimes up to 40 a day), it disgusts me. Letting that go will be a major relief and boost to my confidence.",7
2021-06-21 04:45:58,https://i.redd.it/eis40iup0l671.jpg,This is my longest streak without smoking in 6 years! Onwards and upwards!!,,29
2021-06-21 04:11:24,https://i.redd.it/lk9opwnjuk671.png,Day 16 Done!,,6
2021-06-21 04:00:28,https://www.reddit.com/r/stopsmoking/comments/o4q3x6/tool_for_seeing_the_effects_of_tobacco_use_broken/,Tool for seeing the effects of tobacco use broken down by methods and frequency?,"Hello all. I'm trying to find accurate information about smoking dangers beyond ""all is bad"".  For example, how does one cigar a week compare with a cigarette per day? Or what's worse for you, bimonthly hookah or weekly spliffs?  Thanks",1
2021-06-21 03:48:53,https://www.reddit.com/r/stopsmoking/comments/o4py0h/on_the_way_2_months/,On the way 2 months,"This is exiting, I know it is only 2 months but I hope not gonna take cig again.

If I can, you should can.",13
2021-06-21 03:48:21,https://i.redd.it/cjcq15j5qk671.png,Baby steps. One day hopefully will get to the 1 year club,,24
2021-06-21 02:55:30,https://www.reddit.com/r/stopsmoking/comments/o4p874/quitting_smoking_cold_turkey_what_is_your/,Quitting smoking cold turkey… What is your experience?,"Hey everyone! 

So I’ve been smoking for a lot of years now and I’m determined to stop. I’ve tried several times with patches, gums, sprays, even Champix … But I always end up smoking again, mostly as these methods have given me horrible side effects. 

I’ve realised that the only thing I haven’t tried is cold turkey. Starting today, I want to give it a go. If anyone has managed to quit this way, what is your experience? Do you have any tips to make it more manageable? 

Thanks!",4
2021-06-21 01:15:05,https://www.reddit.com/r/stopsmoking/comments/o4nqqb/first_day/,First day,"It’s my first hour of going smoke free. I’m mostly scared about the cravings after meals, that’s my biggest weakness. 

Good luck to everyone who is trying to quit!",9
2021-06-21 00:21:17,https://www.reddit.com/r/stopsmoking/comments/o4mwnw/god_i_hate_myself/,God i hate myself,[deleted],5
2021-06-20 22:46:47,https://www.reddit.com/r/stopsmoking/comments/o4la6n/what_was_the_event_or_thing_that_finally_made_you/,What was the event or thing that finally made you decide it was time to quit?,I want to hear your stories.,2
2021-06-20 22:28:23,https://www.reddit.com/r/stopsmoking/comments/o4kyjc/i_finally_did_it/,I finally did it,"I've been smoking for about 10 years. In 2018, I quit for a full year, cold turkey, before taking back into the terrible habit. But I finally did it. Day 1 down! Really happy to be a nonsmoker once more. Thank you, reading your stories helped a lot.",14
2021-06-20 22:13:20,https://www.reddit.com/r/stopsmoking/comments/o4kp4l/ive_only_had_two_to_four_cigarettes_for_the_past/,I’ve only had two to four cigarettes for the past two months. Now I’m quitting completely. I am happy to make this life changing decision.,"I wanted an outlet for my social anxiety as a young person. As a sixteen year old many many years ago, when I had my first cigarette, I wanted to look “more mature.” “Cool.” “Bad ass.”

*You know what’s bad-ass and mature, sixteen year old Trip?*


Taking care of yourself.


I stopped consuming alcohol too as I embrace some Buddhist precepts. 

I don’t need any alcohol or cigarettes to make me look a certain way. My attitude is the baddest thing on me.

Stay cig free Redditors and thanks for this support group.",6
2021-06-20 21:47:42,https://www.reddit.com/r/stopsmoking/comments/o4k8wr/just_came_back_to_this_sub_after_i_saw_it/,"Just came back to this sub after I saw it mentioned in the wild. It works, and it works so well I forgot about it.","Over 3,000 days. Going on 9 years. I smoked a pack a day for almost 10 years. I will soon have quit longer ago than I smoked. When I was trying (succeeding) in quitting, those were some long days. Now I forget. I started forgetting I used to smoke years ago.

I'm here to tell you there is a **very** bright light at the end of the tunnel. I came back to give you all words of encouragement! *It IS better*.

This subreddit helps. The apps help. Accountability helps. The Easyway *really* helped me.

Just take it in 3s. Go 3 hours without. It'll get a little easier. Go 3 days without. It'll get a little easier. Go 3 weeks without. It'll get a little easier. Go 3 months without. It'll get a little easier. Go 3 years without. You're done.

I can go in smokey bars no problem. Have been able to for 5+ years. I have friends who smoke and they have to plan around having a smoke. I remember that. Life is so much easier when you're not constantly looking for the next smoke break, worried about a long flight, having to make sure you have enough smokes for the night, smelling like shit, etc.

I wish you all the best. I'm here to hopefully help someone, because so many of us who have broken free never look back. I remember how hard it was, but I'm also here to report that it's worth doing.

I hope you all get your star flair and turn around to help others at some point too. Let me know if I can help. Fuck nicotine! 🚭",38
2021-06-20 21:29:32,https://i.redd.it/935c8sauui671.jpg,i feel better and bad in the same time .. but ill keep pushing ❤️,,11
2021-06-20 21:05:06,https://www.reddit.com/r/stopsmoking/comments/o4jjco/just_a_rant/,Just a rant,[deleted],2
2021-06-20 20:39:07,https://www.reddit.com/r/stopsmoking/comments/o4j395/ive_now_been_smoke_free_for_4_months_smoked_from/,"I've now been smoke free for 4 months (smoked from 14-25), and as I've regained my sense of smell and taste I have to ask...",[deleted],0
2021-06-20 19:58:29,https://www.reddit.com/r/stopsmoking/comments/o4id9k/withdrawal_after_nicotine_patches/,Withdrawal after nicotine patches,"Ive been smoke free for 81 days (smoked 15-20 per day for 15 years). I quit using nicotine patches - followed the schedule, gradually reducing doses from 21mg to 14mg to 7mg. I finished using the patch about two weeks ago, and have been craving cigarretes worse than before, feeling irritable and depressed, and wondering when im going to stop feeling shitty ... Had anyone had this experience of feeling really shit after finishing with the patch? And if so, how long did it last? Im starting to lose my motivation and wondering whether its worth it.",3
2021-06-20 19:49:26,https://www.reddit.com/r/stopsmoking/comments/o4i7pk/how_to_handle_these_3_triggers/,How to handle these 3 triggers?,"Tomorrow is day 1. Here are the 3 biggest triggers for me: 

1. First cig of the day with coffee. I will miss this cig the most.
2. After a fight or high-stress situation. Smoking was a way for me to escape; to calm down.
3. Being drunk. 

What has everyone else done to avoid smoking during these times? 

Sarah

Edit: don’t say “don’t drink” for #3 lol. Trying to handle one vice at a time.",2
2021-06-20 19:08:09,https://www.reddit.com/r/stopsmoking/comments/o4hgo6/i_hate_smoking_i_cant_bear_smoking_i_am_lazy_to/,"I hate smoking. I can't bear smoking. I am lazy to smoke. The feeling of your throat and lungs heating as you push is horrible, it feels like death.","For the past week I've been staying up all night.  
For two nights I managed to stay 5/6 hours abstained.  
From 1am to 7am.  
To be able to abstain myself I'll drink either strong coffee or tea.  
They stimulate my brain and keep me satisfied.  
But every day as I wake up, I can't help myself but to smoke.  
Urge's strong.  
By this time it's totally chemical, not psychological.  
It's difficult because my father's a smoker and even though he wants to stop, he buys 2 packs every day and we both smoke from these 2 packs.  
I smoke 20 cigarettes a day, he smokes 15.  
Perhaps for I am younger, a dreamer, and more compulsive than him.  
I have no depression, just anxiety.  
I love Life, Music, Languages, History.  
No depression indeed.  
Any advice is welcome.  
Share your stories too!",3
2021-06-20 18:53:17,https://www.reddit.com/r/stopsmoking/comments/o4h6pv/my_journey_so_far/,My journey so far,[deleted],1
2021-06-20 17:57:27,https://www.reddit.com/r/stopsmoking/comments/o4g49i/21062021/,21.06.2021,[deleted],3
2021-06-20 16:15:17,https://www.reddit.com/r/stopsmoking/comments/o4e11i/is_this_a_new_method_to_quit_smoking/,Is this a new method to quit smoking?,[removed],0
2021-06-20 16:08:17,https://www.reddit.com/r/stopsmoking/comments/o4dvrn/14_days_this_feels_great/,14 days… This feels great!,"The only thing I really need to remember is: Never light up again.

I’ve been here before: All is going well. Quitting is so easy. What harm would another one do?

So here’s a reminder to myself: Remember all the reasons why you always want to quit after starting again. Remember that feeling in the morning when the nicotine kicks in and your energy drains out of your body. The gross smell. The coughing and sputtering.

But also remember: All those moments that were supposed to be so great because you took time to stop and have a smoke… They were never great _because_ of smoking but great _in spite_ of smoking. How much better would they have been without?

It turns out I know the answer now. Again. Those moments are all here for the taking. Just go and sit on your balcony and breathe in the morning air and sip your tiny espresso and smile and be. That’s all that was ever great. The rest was just ball and chains!",31
2021-06-20 16:05:00,https://www.reddit.com/r/stopsmoking/comments/o4dtc4/ironic_rebound_effect/,Ironic Rebound Effect,"Too often do I see people telling themselves to “not think about it” or trying to shut down a craving as soon as it comes up.  That’s just not how it works(generally speaking) This knowledge has helped me overcome my cravings and I am hoping that it may help others as well.

I will post a link to a scientific journal about this subject for anyone who is interested at the bottom.

This psychological phenomenon or theory if you will, elaborates on the concept of thought suppression.  Often times when people are trying to suppress a thought, craving, compulsion, they will experience these more frequently and the intensity in which they experience them will increase as well.  When you tell yourself to not think about smoking, you are telling your subconscious to look for triggers and things that are related to smoking in an attempt to avoid the thoughts or urges from entering your conscious mind.  This has the opposite effect, in doing so you are going to be reminded of smoking more frequently and generally with a greater intensity.  You will experience cravings, you will want to give up.  Accept these thoughts, give them the attention and respect they deserve but do not allow them to take over.  This is essentially the practice of mindfulness.  You can not stop cravings from happening, accept them as cravings, and move on.  You are not a slave to these cravings, best of luck everyone.

[Ironic Rebound Effect](http://www.sicotests.com/psyarticle.asp?id=133)",7
2021-06-20 16:04:52,https://www.reddit.com/r/stopsmoking/comments/o4dt8z/lost_count_of_how_many_attempts/,Lost count of how many attempts,"But it’s time to quit again! Smoked my last cigarette at 19:20 so early early steps. Determined to succeed this time, I’m moving house at the end of the month and want to move in as someone who doesn’t smoke. Wish me luck!",3
2021-06-20 15:46:06,https://www.reddit.com/r/stopsmoking/comments/o4df7h/1_year_smoke_free_no_one_cares_lol/,"1 year smoke free, no one cares lol","Hi folks! I needed to party after being a 25 year smoker who finally made it a year without a cigarette. I had many quit attempts and what finally worked was wellbutrin (which made me manic-I have schizoaffective bipolar type) followed by 4 mg cherry nicotine lozenges which I still enjoy to this day because hell, I like them. Cigarette smoke disgusts me now & I can't imagine smoking anything anymore.

I also quit alcohol 2 months before I quit smoking and I am working on conquering my sweet tooth but I haven't gained any substantial weight as I am on a med for binge eating disorder. I replaced smoking with cardio (indoor cycling) and baths. This sounds simpler than I mean it to but I'm nervous. 

Good luck to all of you here *hugs* Every failure is just practice toward success.

Edit: Thanks everyone for partying with me! 😀",355
2021-06-20 15:05:19,https://www.reddit.com/r/stopsmoking/comments/o4ckni/nifty_visual_aid_ideas_sticker_charts_etc/,Nifty visual aid ideas? - sticker charts etc,"Hello all :) 

I am planning to stop smoking/vaping on the 1st of July (for the final time!) And wondered if anybody had any ideas for visual trackers, I've found sticker charts quite effective in the past as the novelty really gets me past that first difficult part! 

Digital trackers don't really do it for me, I'd like something on the wall/mantelpiece with a daily ritual of completing. 

My best idea so far is having a marble jar to fill with one marble a day for not indulging, and all removed any day I stray. Reward at 30 marbles. 

Anybody found anything better?",4
2021-06-20 14:33:50,https://i.redd.it/wovvnjuosg671.jpg,Wish me luck! 🙌💪,,33
2021-06-20 14:15:20,https://www.reddit.com/r/stopsmoking/comments/o4bjqb/how_bad_is_emphysema/,How bad is emphysema?,"I just got diagnosed with **Chronic obstructive pulmonary disease.** Now that it's on my mind, I noticed that my breath is really shallow. I'm 25 years old and I've stopped smoking for a week. There's nothing else the doctor said other than ""Quit smoking ASAP"". Judging by the tone of his voice, it sounded pretty serious. I asked him again if it's a serious condition, he replied ""Just quit smoking"".",8
2021-06-20 14:01:17,https://i.redd.it/p0t3jdwvmg671.png,Another milestone!,,17
2021-06-20 13:14:38,https://www.reddit.com/r/stopsmoking/comments/o4aaxg/cough_immediately_after_quitting/,Cough immediately after quitting?,"Hey guys. I quit smoking on the 12th in the middle of the day, middle of a cigarette. The following morning, I woke up with a scratchy throat, no urge to cough unless I’d do a single cough to clear my throat, coughing up phlegm. My sinuses seem to be a little messed up too, but have improved. 

I know coughing is common BUT mine started.. 12 hours after quitting and 8 days later, still present. I initially thought I was getting sick, so I went to the dr, negative covid test and a clear x-ray later, here I am. Besides the phlegm and sinuses, I feel great. I don’t feel sick, and all these things make me think it is all due to quitting. The only thing that makes me think it isn’t is due to how FAST it came on. Has anyone else been hit with this immediately after quitting?

History: smoker for 15-16 years, anywhere from half pack to 1+ pack per day over the years (1+ over the past year or so), quit a few times for a few months at a time, never experienced this before.

Edit: I was also smoking a vape pen daily (thc) and have also quit that (just sticking to edibles for now), if this has anything to do with it. I wasn’t planning on stopping the vape but with how yucky my lungs are feeling, I feel it’s best I give them a break.",2
2021-06-20 12:11:52,https://www.reddit.com/r/stopsmoking/comments/o490fp/that_annoying_twat_in_your_head_always_urging_you/,That annoying twat in your head always urging you to have just one.,"How do you deal with him? I'm day 4 completely cold turkey and I keep getting:
""Go on, the dopamine rush will be so much better because you haven't had a cigarette in ages.""",10
2021-06-20 11:33:36,https://www.reddit.com/r/stopsmoking/comments/o487m0/damn/,Damn,Did quit for 2 months and smoked and bought a pack… so stupid I not really want to be addicted again can anyone help me don’t know what to do,2
2021-06-20 10:16:56,https://www.reddit.com/r/stopsmoking/comments/o46njo/i_quit_2_hours_ago_already_craving_a_ciggarette/,I quit 2 hours ago. Already craving a ciggarette,Posting here because I don’t wanna fail,18
2021-06-20 09:55:21,https://discord.gg/tz5FSYNn8U#iy,😘Naughty💔Server Code,,0
2021-06-20 08:31:00,https://www.reddit.com/r/stopsmoking/comments/o44p5l/the_first_hour_of_quitting_nicotine/,The first hour of quitting nicotine,Hopefully I can make it through the day without another cigarette,13
2021-06-20 08:28:19,https://discord.gg/2xaPmEh7CW#qJ,🖤💖🥰 Lewd Groupchat,,0
2021-06-20 07:08:46,https://i.redd.it/jgz2wf1ale671.jpg,"Day 3 of quitting, just leaving the gym, figured I’d challenge myself to 30 days of workout every morning while quitting and let y’all keep me honest! Feel free to join the challenge! The money you save from smoking can afford a gym membership, no excuses!",,58
2021-06-20 06:11:00,https://i.redd.it/vigk9xbzae671.png,So proud!,,7
2021-06-20 05:58:12,https://discord.gg/gPRtaVjUKD#Lz,💝 Lewd ❤️ Chat ❤️‍,,0
2021-06-20 04:48:59,https://www.reddit.com/r/stopsmoking/comments/o41ahe/help_throat_problems/,Help 🆘 throat problems.,"I hope I'm not bothering anyone with so many questions and so many updates on my situation.

I feel like there's something stuck in the back of my throat and I've had this feeling since last night. There's literally nothing it's just very dry and scratchy and feels like a lump. But there's no coughing though. 

There was a huge urge to smoke last night but I didn't do it. And the entire night my throat has been scratchy and just terrible.

I just had some tea with honey this morning. If anyone has any advice or any knowledge about this please let me know. 

I'm on day 6 of quitting so there shouldn't be any coughing today in fact there hasn't been any coughing at all throughout my entire quitting situation. So I don't know what's going on.",5
2021-06-20 04:26:41,https://i.redd.it/xk10qq7dsd671.jpg,The ceiling tiles in the Da Nang airport smoking section vs the non-smoking section,,251
2021-06-20 04:24:37,https://discord.gg/TB2S5gydW3#FL,🥰Nudes💌Groupchat,,1
2021-06-20 04:12:20,https://i.redd.it/qqdz2gtspd671.png,Day 15 Done!,,13
2021-06-20 03:51:06,https://www.reddit.com/r/stopsmoking/comments/o40dkv/just_a_message/,Just a message,"Hey y'all  just wanna say, I know alot of folks in this sub are all about the cold turkey life but if NRT is your thing, do what works for you. I've personally been taking chantix and it's working wonders for me. I get maybe 1 craving a day and I just tell myself to shut up and it stops lol. It's made things so much more manageable for me.",14
2021-06-20 03:17:43,https://i.redd.it/nmzu9gt1pa671.jpg,Thought this good for the sub,[deleted],21
2021-06-20 02:47:53,https://www.reddit.com/r/stopsmoking/comments/o3ziel/question/,Question,"People who live in areas with distinct seasons- have you found quitting is easier during a certain one? I’m just not ready to quit yet for a few reasons (excuses maybe, but I acknowledge this). Perhaps during the winter when outside isn’t as accessible, it may be a smoother transition because of physically smoking LESS already. But I also experience more bouts of depression so I’m worried about my mental health/anxiety. Any thoughts?",3
2021-06-20 02:20:00,https://www.reddit.com/r/stopsmoking/comments/o3z5yj/well_todays_the_day/,Well today's the day.,[deleted],5
2021-06-20 02:19:11,https://i.imgur.com/aPMzVOZ.png,Sex Server ❤️ 💓,,1
2021-06-20 02:05:40,https://i.imgur.com/PqQiE8v.png,Fucking flirt,,0
2021-06-20 00:14:21,https://www.reddit.com/r/stopsmoking/comments/o3xcd7/i_thought_i_could_be_a_social_smoker/,I thought I could be a social smoker,"With the pandemic happening I haven't been around with a lot of smokers so I haven't craved smoking as much, but since now we're aloud to have small gatherings I've been seeing some friends who don't smoke, but the problem is when I drink I really crave a cigarette.

So what I do is that when I go out to meet some friends I would buy a pack of cigarettes. And the big problem is that I obviously don’t finish the pack in that same night so I smoke it through out the week and my body feels awful after I do but I still do it just because they're there! So tonight I broke all my cigarettes because I  realized I can't just have some when I go out. 

  

https://preview.redd.it/u4epdbgbjc671.jpg?width=1536&format=pjpg&auto=webp&s=7a4ac26dd00bf768c6433800d37616f1c72d8c5a",10
2021-06-20 00:05:08,https://www.reddit.com/r/stopsmoking/comments/o3x77t/deleted_by_user/,[deleted by user],[removed],5
2021-06-19 23:41:24,https://i.imgur.com/7KRbCHJ.png,💙😘😍 Sex Server,,1
2021-06-19 23:39:42,https://i.redd.it/rezmdz26dc671.jpg,Called it quits.. after 15 years! Wish me luck!😄,,166
2021-06-19 21:37:11,https://www.reddit.com/r/stopsmoking/comments/o3uqfq/people_who_have_quit_for_over_a_year_how/,People who have quit for over a year... HOW?,,5
2021-06-19 20:15:46,https://www.reddit.com/r/stopsmoking/comments/o3tdg8/quit_smoking_with_vaping_the_easier_way_to_stop/,Quit Smoking with Vaping - The Easier Way To Stop Smoking,"Have you, a friend, or loved one tried to stop smoking multiple times using conventional quit smoking methods like going cold turkey, behavioral therapy, NRTs, or medication with no success?

Perhaps it’s time to try the easier way to stop smoking.

eBook:

Amazon Kindle - https://www.amazon.com/dp/B094CWPMT1

Google Play - https://play.google.com/store/books/details?id=g8QsEAAAQBAJ

We Vape Mods - https://wevapemods.com/product/quit-smoking-with-vaping-ebook/

Audiobook:

Audible - https://www.audible.com/pd/Quit-Smoking-with-Vaping-Audiobook/B096Y23T2P

Google Play - https://play.google.com/store/audiobooks/details/Adam_Fury_Quit_Smoking_with_Vaping?",0
2021-06-19 19:56:41,https://i.redd.it/n7fc7qnd9b671.jpg,"After lurking for a year or more, I’m far enough in now that I’m comfortable with sharing my progress!!",,27
2021-06-19 19:47:00,https://i.redd.it/h0se65in7b671.jpg,1 month off a lifetime to goo boyys,,1
2021-06-19 19:44:41,https://www.reddit.com/r/stopsmoking/comments/o3stj1/3_weeks_cold_turkey_cravings_still_strong_would_a/,3 weeks cold turkey - cravings still strong - would a patch relieve some of the stress ?,"Smoker of 25 years, I went the cold turkey route because I have gastritis : smoke and nicotine are really bad for my condition, so this is a very strong motivation.

But this is really not easy. I thought after 3 weeks I'll be fine, but I'm really depressed and anxious. My life is shit right now which doesn't help. I had to get back to antidepressant because I had suicidal thoughts.

Do you think a 7mg patch would soften the next few weeks ?

Or is it just psychological at this stage ? (22 days without any nicotine).

I don't want to ""waste"" those 21 days of withdrawal...

&#x200B;

Edit :  Thank you all, I didn't caved in and am now 40 days free from nicotine. I would say that my brain cells returned to 90% normal, meaning the cravings are max 10% of what they were the first 4 weeks. It is really a wonderfull feeling. Be patient, it'll come to you too !",8
