Date,URL,Title,Body,Score
2021-06-08 03:54:04,https://www.reddit.com/r/stopsmoking/comments/nuzf39/dealing_with_the_fact_that_i_still_enjoy_a/,Dealing with the fact that I still enjoy a cigarette,"Hey guys, hope everybody is doing well in their journey of quitting.

I am after some advice on how to deal with certain cravings. I had just made it to the 7 day mark cold turkey when I finally caved in and bought another packet. While disappointed, I’m pretty proud of myself for making it as far as I did and look forward to giving it another go as soon as I can. 

While my mindset behind smoking have changed a lot recently, I still enjoy it as if it were a hobby. I end up hating it  again as I am smoking the 2nd, 3rd, 4th cigarette of the day ect but always look forward and really enjoy the 1st. 

I caved in because I convinced myself that enjoying 1 cigarette would do me no harm. Obviously this is ridiculous as I’ll always end up smoking more than 1 a day. 

Is there something in particular that you have told yourself that has stopped you from buying that packet? I have read and practised a lot of the tips I have found online but have really struggled with the idea that depriving myself of that 1 cigarette that I enjoy so much isn’t actually worth it. 

I hope this makes sense hahaha. Thanks!",7
2021-06-08 03:53:37,https://i.redd.it/3ucdnhzizz371.png,"Day 3 Done! Started experiencing persistent cravings, irritability. Can't do anything have to go through this. Not a single puff no matter what!",,26
2021-06-08 02:50:48,https://www.reddit.com/r/stopsmoking/comments/nuyhtx/decided_to_stop_under_quarantine/,Decided to stop under quarantine,"Today is my second day of quitting smoking. I have tried to quit multiple times in the past year but somehow always found an excuse not to. I told myself I would quit once I moved abroad and now I'm actually doing it while under quarantine. 

       The lack of access to smokes rn or even a smoking area has made it difficult to come up with excuses for myself to smoke again (ie: it's harmless, no big deal u will stop later) I started smoking to cope with anxiety but let's be honest, smoking doesn't help with it for longer than a few minutes before I need another. I just wish my body would understand that as well. Last night, I even dreamt that I stole cigarettes from people and then got angry at them when I got caught. I also refused to share their own cigs with them haha.

        Anyway, I just wanted to share my journey so far and I wish whoever is reading GoodLuck on their own respective journey as well. I personally spent a few weeks subscribed to this sub, reading other ppls stories and it made my struggle feel less alone. Wish me luck and please feel free to share any tips that helped you stay away from relapsing!",4
2021-06-08 01:45:47,https://www.reddit.com/r/stopsmoking/comments/nuxj4g/i_need_help/,I need help,"I cannot fathom how to go cold turkey, I am so stuck in my routine at the moment of wake up, coffee and cigarette, I've tried NRT doesn't work, Champix makes me feel schizophrenic, and everyone I basically know either at home or in my workplace smoke cigarettes and it is hard to get away from. I know I sound like a fucking bitch but please, I need to know what helped you or is currently helping you? I'm tired of stinking, spending a fuck load of money, taking 5-7 minutes out of my DAY to smoke this shit, I want to run again and smell good and not stink like rotten chemicals.",7
2021-06-08 01:04:39,https://www.reddit.com/r/stopsmoking/comments/nuwvta/second_day_of_nonsmoking_it_is_great_but_need_a/,"Second day of non-smoking - it is great, but! Need a bit of help. :)","I am ok with not smoking when I am home. I am social smoker and I don't care if the company I am with smokers or not (I leave for my cig, realize I smell to them, but don't care).  And I am dreading my first time around people, because my brain is super addicted (and I never smoked too much, just got from cancer few months ago, well...) and keeps telling me that ""once in a time won't hurt me in any way"". It will! Perhaps not physiologicaly but def. mentaly and you know, it is neve one cig, more like one packet...   
So... Help please? :) How to deal with it? How to stimulate the brain parts that wants cigarets? I know how it works and why the brain keeps telling me ""it is ok, just get one it will be great"", but I have not much of idea how to resist (thought knowledge that it is addiction talking, helps). I am also cutting on alcohol (for month completly then never get drunk way, just one beer or glass of whisky for taste), so that could be easier, but even sober and home I just ""don´t want to"".",2
2021-06-08 00:54:30,https://www.reddit.com/r/stopsmoking/comments/nuwpr8/made_it_to_10_days/,Made it to 10 days,"I almost gave up on the weekend. Couldn't resist the cravings. I drove down to the nearest smoke shop and it was shut. Then I went to the bar, they sell cigarettes too, went in and asked and they had run out of cigarettes. I took that as a sign and went back home and had a cold glass of water. Phew close shave. 

Since then I haven't gotten such intense cravings. 

Made it to 10 days, longest quit in 12 years of smoking.",135
2021-06-08 00:04:37,https://www.reddit.com/r/stopsmoking/comments/nuvw3e/day_6_done/,Day 6 done,"Onward to day 7!!!  Today was a little frustrating w the cravings- I wouldn’t even call them cravings- I was just in a sort of foul mood all day- yelling at people driving like idiots and driving too slow.  Basically it was one of those days where I just tried to avoid as many people as possible, because I may have done or said something I’d regret.",5
2021-06-07 23:31:59,https://www.reddit.com/r/stopsmoking/comments/nuvb3b/15_days_and_counting/,15 days and counting,"It's been 15 days since I did quit smoking. Just to give you guys a background, I have been smoking for 8 years and many times planned to quit but always came back to it. But this time I feel confident and this is the first time I have been away from it for so long. I don't feel the necessity nor the craving for nicotine or cigarettes anymore.

For all those people who want to quit, I will say this to you, it's just about control and keeping urself busy for the first few days, and later on, it will be of less priority.",10
2021-06-07 19:26:51,https://www.reddit.com/r/stopsmoking/comments/nuqp2u/day_1_again/,"Day 1, again","I smoked my last cigarette 30 minutes ago then went to bed.

I am full o f fear of tomorrow and I don't why. I keep reading and educating myself about my addiction but it seems that I forget all about it once I crave a cigarette.

Everytime on day 1 I rationalize that this isn't the time to quit and go and buy a pack, I'm afraid that this will happen again.",2
2021-06-07 19:15:05,https://www.reddit.com/r/stopsmoking/comments/nuqgjl/day_35_tightish_chest_and_shortness_of_breath/,"Day 35, Tightish chest and shortness of breath?","Hey all! I quit smoking after 5-6 years of half a pack a day using the Nicoderm three step patch deal and now I'm on step 3 at day 35.

Today at work my chest felt a little tight and my breathing felt labored. Not to the point where I was gasping for air, but I had to concentrate on taking deep breaths and didn't feel like I was getting enough air. I am a slight hypochondriac with an anxiety problem so came here to see if anyone has had a similar experience. Like if it's a normal part of the quitting process and what you did to combat it and if it went away or if its a cause for concern.

&#x200B;

Thanks in advance!",1
2021-06-07 18:40:50,https://www.reddit.com/r/stopsmoking/comments/nupquo/first_day/,First day..,"I’ve tried multiple times during lockdown but i’m sick of it and want to change. I heard the first week is the hardest and i’ll try my hardest not to give in. Seeing the posts on here have been encouraging.

Wish me luck!",42
2021-06-07 18:16:26,https://www.reddit.com/r/stopsmoking/comments/nup809/critique_ofthoughts_on_my_plan_please/,Critique of/thoughts on my plan please?,"So I used to be a 1ppd smoker for about 13 years (started late, at age 29) and successfully quit for about a year and a half using the patch with lozenges for cravings (which I ultimately gave up fairly easily). The process was unpleasant, but not as awful as I'd feared.

Cue a life stressor and I was back to the 1ppd habit. Then COVID hit, I started working from home, had some health issues, stress through the roof. My 1ppd habit started creeping up and I'm now close to 2ppd, sometimes I even crack a 3rd if it's been a rough day.

I want to quit. I hate smoking. I don't want to use two 21mg patches, and 1 patch is inadequate (I tried).

This week, I'm in the office (I rotate in and out every 4th week). On these weeks, I use lozenges at work and only smoke in the morning before I leave and after I get home. My plan is to limit myself to 1ppd this week with lozenge use at work, then slap on the patch Saturday. Theoretically at that point, it should cover me, with the use of lozenges for cravings.

Then, I'll follow the normal plan for patches/lozenges like I did last time. Does this seem reasonable?

I'm not willing to cold turkey for a number of reasons, one of which being I absolutely cannot add feeling miserable and sick to already feeling miserable and sick (with other health issues), and I successfully used this combo in the past feeling a little uncomfortable, but it was mostly drama free so I feel confident I can do it again.",3
2021-06-07 18:15:53,https://www.reddit.com/r/stopsmoking/comments/nup7kk/the_easy_way_by_allen_carr/,"""The Easy Way"" by Allen Carr","A friend and former smoker suggested I check out this book, while he did not quit with this method, he mentioned that this sub was pretty high on it. As I near 31 years old and have now been a smoker for half of my life, I've had my share of attempts, obviously failures. I'm on chapter 33 of this book, and I'm struggling to understand this method, like it's supposed to be easy and enjoyable to just say ""I am never going to smoke again"". I have plenty of book left and the thought of even saying this gives me anxiety. Just curious how this has worked for others and maybe I'm not fully understanding this book? I've cut back drastically, about half a pack a day, and I eat healthy, workout, and bike 10-20 miles a day, all with seemingly no good results because I just can't quit smoking. Please comment advice/suggestions/information only if you have read this book. 

TIA 😌",3
2021-06-07 18:12:35,https://www.reddit.com/r/stopsmoking/comments/nup4u5/this_time_not_again/,This time not again,"Three weeks completed without a single puff. I congratulate myself  and thankx this platform for always guiding me through my difficult time.

Getting inspirations from the post of quitters here. Tried quitting many times but now not again ""No Matter whats"".",18
2021-06-07 17:13:48,https://www.reddit.com/r/stopsmoking/comments/nunrww/my_intuition_knows_better/,My intuition knows better,"I used to be so against smoking! I was the kid that asked for a puff and then stamped it out. Smoking weed with tobacco got me addicted. But I don't smoke nearly as much weed as I used to, these days when I do though I get very clear intuition I should NOT be smoking, like a very intense gut feeling it's going to end badly for me. That's scary. I never smoked that much till I met my partner, who would always have smokes on him, now its me who buys the smokes. I vape aswell as smoke which I've heard is THE WORST thing you can do. Time to quit! I hope my party lifestyle can withstand not having a drag on someone's cig!  Just got to get in the mindset I had as a child/teenager! Yuck!",1
2021-06-07 16:41:36,https://tremendous.blog/2021/01/07/how-i-quit-smoking/,How I Quit Smoking,,3
2021-06-07 16:01:48,https://www.reddit.com/r/stopsmoking/comments/num1mc/postsmoking_and_running/,Post-smoking and running,"Hey fam. Hope you're good.  


I started running a few years ago. When I say running, I am describing my beginners habit of 2-3 times a week, running maybe 2-3 miles per. At the time I was amazed with myself for being able to accomplish that kind of milage and the ability to develop the aerobic ability to run continuously *as a smoker*. That was the prize of it all of me: that this was something I could do and still smoke a pack a day. For whatever reason I really took some pride in that. I think I know why now- this was somehow reassuring me that it wasn't quite time to ""get around to quitting"", after all: what kind of person ran for fun? Clearly not people with debilitating habits like smoking too much for too long.

Fast forward a couple years and I've been smoke-free for about 6 months. 

The difference? Aside from the quality of sleep, the smell, my skin, the money, the shame?   
The biggest difference is that I am quite literally running 4 times that a week. When I quit I wanted to challenge myself with this running thing and signed up for a marathon. Nowadays I can run double digit miles without feeling it and can keep going if I want to; this was not a thing as a smoker. After a couple miles, you feel it and it's significantly harder to keep your breathing under control. Once you lose pace of your breathing, it's reeeeally difficult to get it back under control and it can kill your momentum immediately. Post-smoking, I am a very different person, and my new ability to run for long distance is one of the more fulfilling results.

While reading an essay in a run journal, I came across something that knocked me out cold- the writer describes their commitment to running every day and how it's benefitted him in the long term, not just with his fitness goals but with a healthy mindset overall. Many people would marvel at his steadfast approach and how disciplined he seemed to be (a common wonder of people who do not run who cannot possibly comprehend why someone would do that on purpose- I get it; I was one of those people!) His response was that there was no supreme super power, no stoic sworn oath to strict code, nothing extraordinary about this feat of physical exertion. **His magic gift was simply having his health and taking advantage of it.** 

As a former smoker himself, he made the point of identifying the advantage he had in front of him- removing cigarettes from his life- and taking advantage of this low-hanging fruit for better health, as something he had a choice to make, unlike almost any other debilitating health concern. Removing cigarettes and nicotine from your life is not born from some sort of magical ability- it's a tangible removal of something that does not make sense for your health. Yes, smoking cigarettes is a hard habit to break- no shit. But big picture: it is one of the only preventable health issue that we *do* have control over and can, should we desire, remove from our lives to be better in all ways. 

Not smoking cigarettes was the no-brainer and helped facilitate the writer with the *super powers*  everyone insisted he possessed. It starts with not smoking cigarettes and later unfolds into other habits we begin to develop over that time. Of course his habit of running so consistently is not just attributed to his smoking-cessation but you have to wonder how much easier things like this become when you break it down and work on the tangibles first. 

I hope I do not come off as trying to brag about this strange health habit I have further developed, as I am hardly remarkable in that there are many people better at this ridiculous activity than I am. But all things considered it makes me very happy and gives me hope in a lot of different ways, and it serves as a profound meditation on why I hope I will never fall for the trap of smoking cigarettes willingly ever again.

Hope my running people here in r/stopsmoking can share some of their impressions of before and after, too. Thank you for reading this far if you've made it. I'm proud of you for doing this difficult thing  of trying to remove cigarettes from your life, and am always here in DM if ya need someone to spill. <3",87
2021-06-07 15:59:58,https://www.reddit.com/r/stopsmoking/comments/nulzs0/2nd_day/,2nd day,am starting to crave tobacco but it's not as bad as i thought. Will it continue to get worse for me?,3
2021-06-07 15:23:16,https://www.reddit.com/r/stopsmoking/comments/nul32m/how_i_quit_smoking_using_this_simple/,How I quit smoking using this simple psychological trick,"Quitting smoking is one of the most difficult things you'll ever have to do. But if I can do it, anyone can. 

  
https://medium.com/invisible-illness/how-i-quit-smoking-using-this-one-simple-trick-2b63fc52340f",0
2021-06-07 14:28:24,https://www.reddit.com/r/stopsmoking/comments/nujopr/my_addiction_i_buy_a_pack_or_two_every_day_and/,My addiction (I buy a pack or two every day and smoke two or three then throw the rest away),"Hey I wanted to write down my addiction and thought this might be a good way to accept my problem before finding ways to deal with it. 

I have never been a heavy smoker, but I started at the age of 24 socially smoking, just a couple on a night. This built up to having a few in the evening with my house mate to ""take the edge off"" the evening sober. Probably the most standard start to smoking out there! 

Fast forward to 32 and I now now have a habbit where I smoke on my own in the evenings or at lunch time in an effort to feel less lonely. I managed to stop the desire to smoke when I'm drunk, that side doesn't really bother me becasue I don't want to be seen as a smoker and I don't like smoking around people. 

To give you an idea about my addition, this weekend I had quite a boozy Saturday but didn't smoke. Today though, at lunch I popped out and bought a pack smoked two then threw the pack out. Then after work I went and bought another pack, smoked two and chucked the pack out. This isn't a one-off, I regularly buy a pack to only smoke 2 or 3. But I do this most days. Almost like I'm kidding myself that I will finally quit. This is a very typical weekend. 

Does anyone have any advice? I think I need to find a way to be ok with spending time alone and this is definitley part of the addiciton. 

Thanks for reading!",9
2021-06-07 14:26:08,https://www.reddit.com/r/stopsmoking/comments/nujmog/1_month_3_weeks_3_days/,"1 month, 3 weeks, 3 days","I just checked the app how long it has been. It was very hard for me in the first few weeks, now I hardly ever think about it anymore. Also I realised lately that I cough/clear my throat way less now (this is/was a big source of self-consciousness for me). I know everyone's situation is different, but I thought this might inspire some of you to keep going!",8
2021-06-07 14:19:14,https://www.reddit.com/r/stopsmoking/comments/nujgo0/has_anyone_had_success_with_wellbutrin/,Has anyone had success with wellbutrin?,"It's been 6 Days! I've been smoking since I was 18. I'm 33 now, and I've only quit once previously (for about 6 months). I've wanted to quit for a while...but drinking would always be my trigger. So I started off cold turkey this time, but then I was prescribed Wellbutrin from my doctor for anxiety (not smoking, I'm not honest about my smoking with my doctor). Anyone try Wellbutrin? The cravings are so mild. Even when drinking or (not and) driving. I feel proud of myself the longer I go.",6
2021-06-07 12:22:46,https://www.reddit.com/r/stopsmoking/comments/nugmjp/help_me_pleasei_am_not_addicted_to_nicotinedont/,"Help me, please...I am not addicted to nicotine...don't know why I smoke.","Hello, I have been diagnosed with multiple mental health disorders ocd, bpd and bipolar. I never liked smoking. I was a social smoker. I still dont like it, I hate it. I am insensitive to nicotine. I don't feel good...there is no dopamine release, no reward...only disgust and regret. It's hard to categorize it as an addiction because it doesn't fit the criteria...I think, its part of my illness...I don't understand, why I get the urge to smoke...it's making me miserable, because I can't figure out what it is...so, I can't treat it...Any help would be appreciated. Thanks",1
2021-06-07 11:45:49,https://www.reddit.com/r/stopsmoking/comments/nufpk3/can_breathing_in_someone_elses_second_hand_smoke/,"Can breathing in someone elses second hand smoke on the street, ruin your quiting since nicotine might have gone in and now you're back to the start? Is that how it works?",[deleted],1
2021-06-07 11:23:30,https://www.reddit.com/r/stopsmoking/comments/nuf667/7_days_and_back_to_square_1_whats_your_excuse/,7 days and back to square 1! What's your excuse?,"I made it a whole week! Then I had a bad day, just so much crying and anxiety, so i bought a new pack ""just in case i can't sleep tonight"" and of course i convinced myself i couldn't, and had 1 at bedtime... 

I need to stop thinking bad days earn me the right to smoke! 
 What are your excuses?",3
2021-06-07 10:13:14,https://www.reddit.com/r/stopsmoking/comments/nudjf6/is_transitioning_to_vaping_really_a_good_way_to/,Is transitioning to vaping really a good way to stop smoking?,[deleted],7
2021-06-07 10:08:10,https://www.reddit.com/r/stopsmoking/comments/nudf97/i_was_wondering_which_one_people_found_more/,"I was wondering which one people found more helpful, lozenges or the patch?",I'm just curious as to which one people have had more success with. I've tried both in the past but never when I was real serious about quitting so I'm not sure how good either did for me at the time. Any thoughts on this would be greatly appreciated!,6
2021-06-07 10:03:04,https://www.reddit.com/r/stopsmoking/comments/nudb3j/emotional_6_weeks_in/,Emotional 6 weeks in,"I quit 6 weeks ago and it has been an absolute breeze tbh. Withdrawal symptoms and cravings were minimal, and I feel super motivated and proud of myself

The only very difficult part has come up later in my quit than I expected. I’m finding negative emotions really intense and hard to deal with, even minor issues like a slight disagreement with a friend.

As well as this, I have always been more emotionally volatile when I drank. Now when I’m drinking and something upsets me, I feel absolutely hysterical. Because of this, I’ve been finding alcohol a lot worse for my mental health than before I quit. At first I thought it was simply a negative change in my relationship with alcohol.

Now I’m staring to think that I still haven’t gotten used to dealing with uncomfortable emotions without smoking (and when I’m drinking I’m naturally more emotional anyway).

Has anyone else experienced this relatively late into their quit when they otherwise feel quite settled?",8
2021-06-07 09:50:52,https://www.reddit.com/r/stopsmoking/comments/nud150/i_dont_know_what_to_do_anymore/,I don't know what to do anymore,"I (23M) have been a smoker for 8 years. I had lots of problems with my family and school. I was bullied constantly. My parents broke up while I was in high school. I tried to to stay strong and set bunch of goals to myself achieved none of them. When I turn back and look behind I see they my last accomplisment was getting in to a good high school. I always turned to smoking when stressed, happy, sad doesn't matter. I now understand that it was my couping mechanism with everything and I feel incomplete without it. 

I tried to quit for 3 years. Sometimes I failed on the same day, some days I made it to a month. Last time I tried I made to 28 days and I was so motivated to quit that after smoking the last one I put it down on my forearm and took an oath. Today I look that scar with a ciggarette in hand. I don't know what to do anymore. I just forget everything and justify it just to get that dopamine hit. I have tried so many times that I think it is my curse and when I successfully quit all my problems will gone but I cant do it. I am stuck.",7
2021-06-07 09:48:56,https://i.redd.it/td6jpv8wvz271.jpg,"Guys, finally decided to quit smoking. Any advice on how to go about it.",,1
2021-06-07 09:48:31,https://www.reddit.com/r/stopsmoking/comments/nucza1/2_months_already/,2 months already!,"Yesterday marked my second entire month smoke free. This past month I have had to overcome some obstacles like reuniting with friends in a city where I used to live and having them smoke beside me. It's always hard when you meet up with people who you used to smoke with. Also with covid restrictions being lifted in Europe there are more opportunities for beers and wines and other social activities which used to involve heavy smoking for me. But I've done it and it has been easier than I was expecting if I'm completely honest.

I will try not to let my guard down but it I can feel this is it. I'm never smoking again

https://preview.redd.it/ziy1cpltku371.png?width=750&format=png&auto=webp&s=e8d8d82326c045e7b9d22b881c95e59846a9442a",3
