Date,URL,Title,Body,Score
2022-01-07 10:18:55,https://www.reddit.com/r/stopsmoking/comments/ry9qpc/today_is_3_years_for_me_without_a_cigarette/,Today is 3 years for me without a cigarette,"I’d quit for periods in the past but this time it’s for good. I tried nicotine gum, patches and briefly tried vaping. I had a dartboard in my backyard and I got some cinnamon gum, no nicotine. When I felt like I needed a smoke, I’d get a piece of gum and go outside to throw some darts. That got me over the hump. Hope this helps someone that is struggling.",178
2022-01-07 09:37:56,https://www.reddit.com/r/stopsmoking/comments/ry8taa/mantra_stay_strong_breathe_easy/,"Mantra: ‘stay strong, breathe easy’","TL;DR – see the post title.

I’ve tried quitting a couple of times, but usually relapsed. This time I’ve incorporated my motivations into a mantra, and I wanted to share it with you all because it has helped me through the last 7 days. Basically it encourages you to grit your teeth and stay strong through the cravings (stay strong) while also reminding you of the health and wellbeing benefits of not smoking (breathe easy). So whenever I think about smoking, I repeat the mantra ‘stay strong, breathe easy’ and I remember exactly why I stopped and it gets me through. Keep it up everyone, you’ve got this! Stay strong, breathe easy.",16
2022-01-07 09:14:42,https://www.reddit.com/r/stopsmoking/comments/ry8b61/i_almost_dont_wanna_eat_because_of_the_cravings/,I almost don’t wanna eat because of the cravings afterwards,"So far I’ve been going really strong and I’m so proud of myself. I know I only quit once, I don’t want to go back at all. However, after I eat the cravings are close to unbearable. I have to take a nap just to avoid them, as nothing else I’ve tried helps. 
The worst part is that the cravings last for up to an hour or so after a meal....",3
2022-01-07 09:08:49,https://imgur.com/w7u96WW,2 years of not smoking today!,,100
2022-01-07 08:36:17,https://i.redd.it/1g4ewpmtq9a81.jpg,"More than 1 f month clean, self-esteem is higher up. Keep pushing your boundaries guys!",,16
2022-01-07 08:26:34,https://www.reddit.com/r/stopsmoking/comments/ry7btw/48_hours_smokefree/,48 hours smoke-free,"Fuck ciggs. Fuck nicotine. Wish I never tried it! I'm 26 years old and I want to kick the habit for good. I've quit before but only got to 3 months clean, now i'll hold the line for good. Wish me luck brothers and sisters!",22
2022-01-07 07:26:45,https://www.reddit.com/r/stopsmoking/comments/ry6ap2/does_anybody_else_love_the_patches_side_effects/,Does anybody else love the patches side effects?,"Like I replace them in the morning but I wear it when I sleep and these super vivid dreams are amazing. Like somebody said to me don’t sleep with it on or you’ll have nightmares but na.

Tonight’s dream

I was at a restaurant with my sister’s family and I left the table to go smoke, the place was like a hamster fortress of tubes. And in another dome I saw Jim Carey smoking but in the the tubes leading to there was a door and on my side there was puppies and when I opened the door they flooded thru and on the other side of the door with Carey I guess there were baby ducks that got infected by the puppies that got infected by the ducks because I wanted a cigarette. Anyway I got woke by Carey yelling at me for (infecting the babies) wanting a cigarette. He was in character from series of unfortunate events",7
2022-01-07 07:20:34,https://www.reddit.com/r/stopsmoking/comments/ry66zd/14_hours_in_what_to_eat/,14 hours in. What to eat?,"I am craving for some fastfood, even though I have not eaten mc donalds for months. Will it backfire? 

What did you eat the fiest days when quitting?",6
2022-01-07 07:09:29,https://www.reddit.com/r/stopsmoking/comments/ry60pl/7_months_smoke_free_but_lately_i_think_about/,7 months smoke free but lately I think about smoking every day,"I am really struggling not to smoke at the moment. I did hypnosis to stop smoking and it worked amazingly, I didn’t want to smoke again. But since December I keep thinking about smoking. I have to remind myself of how tough it was to quit in the first place but every day I crave a cigarette and think about buying some. It’s hard! Any thoughts or advice?",12
2022-01-07 07:03:53,https://www.reddit.com/r/stopsmoking/comments/ry5xjo/my_addiction/,My addiction,[deleted],8
2022-01-07 05:16:17,https://www.reddit.com/r/stopsmoking/comments/ry4a8s/do_light_smokers_have_lesser_withdrawals_i_used/,Do light smokers have lesser withdrawals ? I used to smoke 10 but now I smoke 4. How bad will the withdrawals be ?,,2
2022-01-07 05:12:06,https://www.reddit.com/r/stopsmoking/comments/ry4821/i_smoke_46_cigarettes_a_day_when_i_stop_on_what/,I smoke 4-6 cigarettes a day. When I stop on what day will I get insomnia and how long will it be before my sleep cycle resume to normal? I’m thinking of getting melatonin and Benadryl to help me stay asleep. Does it help ? When you quit smoking how long did you have sleep disturbances for ?,,5
2022-01-07 04:48:03,https://www.reddit.com/r/stopsmoking/comments/ry3uza/in_dire_need_of_advice_from_people_whove_already/,In dire need of advice from people who’ve already stopped smoking !,"So I’ve been wanting to quit smoking! It’s all that’s been on mind! I’m constantly ruminating about it and in my free time I’m always on the internet trying to find answers for my concerns but I couldn’t find  answers for some of the questions I had that’s why I came to you. I’ve got a couple of questions. I’m in dire need of advice and would thoroughly appreciate it. (I feel like I’m going crazy)

1) What I’m most scared of is the insomnia. What if it stays ? I’ve got three antipsychotic pills and I’ve been thinking of taking it when the insomnia gets really bad. In the past I’ve actually managed to quit smoking before (I relapsed on the second week. )I had insomnia but it only lasted for two days. Will it be the same this time too? And after quitting on what day do you get insomnia ? I think I had insomnia on the fourth day. What was your experience? And how long was it before your sleep cycle resumed to normal ? 

2- Since I’m obsessing about trying to quit smoking, (it’s my first waking thought and it’s all I think about) I’ve gotten a lot of pre-anxiety. I’m scared of the withdrawals so much so, I haven’t even quit but I puked last night because of the anxiety. I’m really scared of the withdrawals and insomnia. Imagine actually quitting and having my anxiety heightened by multiple folds. What can help me stop obsessing about quitting and getting so much pre-anxiety?

3- I’ve been trying to reduce the number of cigarettes I smoke. It’s really hard. I keep cheating myself and breaking promises to myself. But I’ve successfully gone from 10 to roughly 4 a day. My question is, would my withdrawal symptoms and insomnia be less severe if I’m a light smoker ? (My plan is to cut down to 2 per day for a month and then quit for good)


Edit ! 

I managed to quit and got the answers for these myself. 

1) In my case the insomnia lasted a good one week but I went to see a psychiatrist and he gave me some benzos for a week which helped me regulate my sleep and now I’m back to sleeping like I used to, if not more. And no just one week of benzos wasn’t enough to create dependence and besides I only used it a couple of times. On the fourth day I didn’t need it. 

2) There’s no two ways around it ! I just had to do it. I was in  the contemplation stage and from there I had to go to the  action stage.  The first day wasn’t bad. The second day was the worst.  The third day. I felt it getting easier. And on the fourth day my mental state was back to normal. I had a lot of anxiety and an impending sense of doom. I don’t know if this was the best method but I had a lot of beers to ease the symptoms. It really helped. Honestly it was all much easier than I had made it to be in my head.

3-  I didn’t have a really challenging time and my withdrawals were over within three days (although cravings last for weeks) and I think I owe it to the fact that I didn’t smoke as much. So cutting down before quitting definitely helps. 

The takeaway: The physical withdrawals are hard (anxiety, insomnia etc) but still , I’d say it was much easier than I had expected. It can be done. It’s true what they say. Quitting isn’t hard, staying quit is.",2
2022-01-07 04:27:45,https://www.reddit.com/r/stopsmoking/comments/ry3k00/stopped_smoking_for_2_months_and_started_at/,Stopped smoking for 2 months and started at christmas again :( stopping again today!!,[deleted],6
2022-01-07 03:41:25,https://i.redd.it/wwmb5gsv98a81.jpg,"Flexus Q,10 minutes quick charge",,3
2022-01-07 02:59:29,https://www.reddit.com/r/stopsmoking/comments/ry28ew/quitting_for_good/,Quitting For Good !,I started quitting journey yesterday and it's been 24 hours. Feel Good This time I have tried quitting before but this time it looks hopeful.,9
2022-01-07 02:54:48,https://www.reddit.com/r/stopsmoking/comments/ry261w/need_ideas_for_daily_drawing/,Need ideas for daily drawing,[deleted],1
2022-01-07 00:53:12,https://www.reddit.com/r/stopsmoking/comments/ry07jf/boyfriend_and_i_just_broke_up_and_im_drunk_how_do/,Boyfriend and I just broke up and I’m drunk... how DO I NOT SMOKE. is this worth it?? So sad so sad,,1
2022-01-07 00:52:51,https://www.reddit.com/r/stopsmoking/comments/ry07bf/i_will_not_smoke_with_you_today_daily_checkin/,I will not smoke with you today - daily check-in (JANUARY 7),"Never quit quitting smoking. If you smoke just relax, come back and quit. If you wonder whether to smoke or not - quit and join us today. Happy non-smoking friday everybody! Congratulations, there were some heavy cravings this week and we made it 😂💪",148
2022-01-07 00:20:30,https://www.reddit.com/r/stopsmoking/comments/rxzm2j/not_sure_how_long_but_i_know_im_over_a_month/,"Not sure how long, but I know I’m over a month.","No cravings over the holidays, and I’ve started more activities that are life passions. Like riding my bike up steep hills.",3
2022-01-06 23:25:10,https://www.reddit.com/r/stopsmoking/comments/rxyjji/30_days_in_still_hopeless/,"30 days in, still hopeless","I haven’t smoked in 30 days. I still puke from withdrawal. I’m still frustrated. Mostly I’m just sad. I’m sad about everything all the time. I’m on antidepressants and ketamine therapy. I can’t smoke but I can’t be this depressed all the time. I know I should reach out to my mental healthcare team but it would be $1000 to meet with my whole care team to go over not smoking. Accessing healthcare is a nightmare as a student. I’d have to take days off school right at the start of semester. Where did I go wrong? Everyone said you feel better after a week. Where do I go from here? I’m autistic and I get very lost in how to access and receive help from others. I will not smoke ever again, but I still struggle to cope without.",4
2022-01-06 22:58:00,https://www.reddit.com/r/stopsmoking/comments/rxy01f/quit_6_months_ago_life_feels_great/,"Quit 6 months ago, life feels great!","Last summer my gf and I were traveling to France to meet her family (a first for me, we had gone official only a few months before). Her father, her mother and her three brothers smoke (my gf doesn't). Of course, I cheerfully joined my in-laws and smoked industrial amounts of tobacco for about a week. After that my gf started refusing my kisses because of my breath. Not sure why, but to me it was a major wake-up call. I quit on the spot.

The firsts weeks were hell, especially because we were meeting all of her old friends (and a couple of her exes) and I just.could.not.emotionally.handle it with all the mental and physical strain of the nicotine withdrawal. Nevertheless, and all credit's due to her, she hanged though and helped me through the process.

Almost 6 months later,  I don't see why I'd ever start smoking again. I feel great. After the summer we moved in together and, funnily enough, it was now her that smoked a cigarette or two at parties. Well she won't anymore, at least not for the next 9 months *wink wink* (we haven't told anyone irl, so keep it hush-hush reddit).

TL;DR: Used to smoke a lot. Quit smoking because of gf. Now gf (only a social smoker) won't be smoking either for the next 9 months, because of baby reasons.",32
2022-01-06 22:46:25,https://i.redd.it/lj6v3izkt6a81.jpg,Day 3 - Who is not going to smoke with me ?,,23
2022-01-06 22:22:28,https://www.reddit.com/r/stopsmoking/comments/rxx9pq/i_need_some_motivation/,i need some motivation,What's the easiest way to quit smoking? I feel like my urges can last up to 15 minutes sometimes and i get really irritable,4
2022-01-06 22:07:16,https://i.redd.it/3uyks1qlm6a81.jpg,"After 25 years of smoking, I finally know that I am a non-smoker now.",,54
2022-01-06 20:42:05,https://www.reddit.com/r/stopsmoking/comments/rxv5k0/quitting_chewing_tobacco/,Quitting chewing tobacco,"Hey all, I know this isn't quitting smoking, so feel free to direct me someplace else if appropriate.

Does anyone have experience quitting chewing tobacco? I want to quit - I'm at the point where it doesn't even do anything for me, it's just sheer habit, and it literally hurts my gums to put in a dip but I keep doing it anyway. I quit cold turkey for about a month last year but picked it back up when someone offered me a dip. The longest I've been able to go recently is about 24 hours.

Is the quitting process pretty much the same as that for quitting smoking?

Appreciate any help you can provide, and good luck to everyone.",8
2022-01-06 19:54:24,https://www.reddit.com/r/stopsmoking/comments/rxu40r/bad_dreams/,Bad dreams.,"I have stopped for five days. I have really weird and vivid dreams about an old friend I haven’t seen since I was ten, whom I know has passed away. It has been pretty scary as my dream depicted us still being best friends now 30 years later, and I’m scared to go to sleep in case I have another dream like that. I’m not scared in my dream, I just miss her terribly and my heart hurts",3
2022-01-06 19:37:05,https://www.reddit.com/r/stopsmoking/comments/rxtq49/im_on_90_days_of_quitting/,I'm on 90 days of quitting,But for some reason I still feel fatigued or brain fog some days is that normal or no?,59
2022-01-06 19:35:29,https://www.reddit.com/r/stopsmoking/comments/rxtowm/i_will_not_buy_another_pack_of_cigarettes_just/,I will not buy another pack of cigarettes just out of spite.,[deleted],53
2022-01-06 19:32:55,https://www.reddit.com/r/stopsmoking/comments/rxtmvk/i_dont_want_to_hang_up_my_party_shoes/,I don’t want to hang up my party shoes!,[deleted],2
2022-01-06 18:57:26,https://www.reddit.com/r/stopsmoking/comments/rxsttw/had_to_share/,Had to share,"A full six days and counting, and I finally had a day with no cravings! I was on the edge after last day (almost begged some shady stranger to please pass me a cigarette), so having a day like this is absolute heaven!

We can all do this guys, just hold out for days like these, they are in reach for everyone here!",7
2022-01-06 18:57:26,https://www.reddit.com/r/stopsmoking/comments/rxstsg/had_to_share/,Had to share,"A full six days and counting, and I finally had a day with no cravings! I was on the edge after last day (almost begged some shady stranger to please pass me a cigarette), so having a day like this is absolute heaven!

We can all do this guys, just hold out for days like these, they are in reach for everyone here!",1
2022-01-06 18:52:38,https://www.reddit.com/r/stopsmoking/comments/rxspys/please_remind_me_why_smoking_is_the_worst_thing/,Please remind me why Smoking is the worst thing ever.,,23
2022-01-06 18:34:25,https://www.reddit.com/r/stopsmoking/comments/rxsbbb/i_think_im_ready_to_quit_smoking/,I think I'm ready to quit smoking,"I quit alcohol and caffeine about a month and a half ago. I'm giving them up permanently this time. I finally accepted that I am not the type of person who can have either one once in a while without it turning back into a full blown addiction.

I am slowly accepting that the same thing applies to cigarettes for me.

My past quit smoking attempts have all eventually been self-sabotaged with the thought of having ""just one"" smoke. Or thoughts of just smoking on the weekend etc.

I also hit the point where, after 16 years of smoking, my morning smoke doesn't even give me a buzz anymore. So they don't get me ""high"" anymore and I just ""need"" them in order to feel sane because I go crazy without them. I even abstained for a full day just for the first smoke to do virtually nothing for me.

So I guess that's it. I'm starting a new job in a few days so I'm not going to quit yet because I know it's going to be stressful adapting to the new job.

But, once I've settled in, I'm going to quit.

And this time, unlike the previous times, I will accept that I can never take another puff.",11
2022-01-06 18:15:50,https://www.reddit.com/r/stopsmoking/comments/rxrw9k/i_failed/,I failed...,[deleted],3
2022-01-06 18:06:33,https://www.reddit.com/r/stopsmoking/comments/rxrotd/varenicline_availability/,Varenicline availability,[deleted],1
2022-01-06 17:49:37,https://www.reddit.com/r/stopsmoking/comments/rxraxx/anger_stage/,Anger Stage,I seem to be in this anger stage of quitting. Even the quit app annoyed me with its suggestions. Who gets mad at a bot? I also want to pick fights with my partner which is far from helpful as it will give me the perfect excuse to go buy a pack. Any words of encouragement will help!,11
2022-01-06 16:56:40,https://www.reddit.com/r/stopsmoking/comments/rxq3mp/help/,Help!,"I quit for almost a month, didn’t even vape over Christmas. I had a bad moment last weekend and picked up a vape and now I’m having the hardest time quitting again!!! I feel like I cannot go through the withdrawals again and I’ve lost all motivation, but I’m dying to be free again. Needing some words of wisdom here please!!",3
2022-01-06 16:14:17,https://www.reddit.com/r/stopsmoking/comments/rxp5gl/hi_folks_just_wanted_to_share_that_i_have_stopped/,"hi folks, just wanted to share that i have stopped smoking even you guys stop as well. I haven't smoked anything this year. God be with me and you all !",,47
2022-01-06 15:01:50,https://www.reddit.com/r/stopsmoking/comments/rxnips/8_days_i_am_so_dizzy_i_am_going_to_faint/,8 days. I am so dizzy I am going to faint,,5
2022-01-06 14:26:16,https://i.redd.it/nxv0u7ycc4a81.jpg,"About 1:00 AM, tonight, is exactly one year since my fiancée and I stepped out for our last cigarette—you guys got this, too!",,82
2022-01-06 14:26:07,https://www.reddit.com/r/stopsmoking/comments/rxmoih/recovering_addict_i_started_the_year_off_high_and/,"Recovering addict, I started the year off high and feel really ashamed, how can I turn things around?","I've had a history of issues with substance abuse, and have been in and out of recovery for it. This is a really important year for me career wise and I had a really successful end of the year, but once winter break hit and I didn't have that structure in place, I completely went on a tail spin. I really wanted to be productive but I just went back to my old ways pretty quickly. New Years eve I had therapy, went high to a meeting, then immediately went and picked up weed. I went into the new year high and have smoked every day since. I go back to work in a few days. I am like numb Im so upset with myself and ashamed. and scared. how can I turn this around? I'm not super religious or superstitious but I feel like the fact that I started the year off like this is really scary. I'm just super disappointed in myself and feel scared about this being the beginning of the year. any help, thoughts, etc would be very appreciated.",3
2022-01-06 12:59:25,https://www.reddit.com/r/stopsmoking/comments/rxkndk/day_548/,Day 548,"Yup.  Feeling proud.  I check my quit date counter ocassionaly on a phone app whenever life gets a bit stressful.

Proud of myself.  This is my 2nd time quitting as a 20 year smoker.

My first time was 3 years.  I know i can slip up easy.

Best to everyone struggling.  Patches, willpower, and a support network were key to my success.",23
2022-01-06 12:03:55,https://www.reddit.com/r/stopsmoking/comments/rxjd4v/im_hopeless_i_was_nicotine_free_for_16_days_but/,"Im hopeless, I was nicotine free for 16 days but since Monday I started to smoke a few every day :(","This will probably be long story so appreciate anyone who reads it.

So Im 30 but I never told my parents I smoke and I always managed to keep it secret because I just dont smoke whenever Im at home even if its two weeks and Im completely fine somehow, dont really miss it when Im at my parents.

So basically everytime I visit them, Im nicotine free and now that I work from home I usually stay for extended periods, especially during Christmas its almost 3 weeks. So last year I also used that time to quit but as soon as I came back to my place I broke down on my first day back and started smoking, if you check my post history I posted last year around the same time. So then I tried again on Easter when I stayed with them for like a week. Again failed after I came back and told myself I cant quit now that weather is becoming nice and I will quit in winter when it gets cold.

Of course I continued smoking even when it was already freezing so then I told myself I will quit when I go home. So I didnt smoke from 16th of December til 3rd of January. It seemed to be going better than last year cause I didnt break down on my first day back working this Monday, but I had some errands to run downtown and of course I bought a pack, smoked three and threw away the rest.

I also bought 4 mini cigars for big cravings and have just one left.

Then on Tuesday I had to go somewhere as well and again bought a pack, smoked a few but this time I also took 3 with me and threw away the pack. And today and yesterday I just couldnt handle it, the mornings are so hard for me so both days I drove to a gas station to buy cofee, cigs, smoked a few with the coffee , took three with me and threw away the pack.

I just dont fucking understand how my brain works. Whenever I go to my parents I am fine, I do have some headaches on first days and some brain fog but nothing too bad.

Then when I return to my place its like day one again even though I was smoke free for almost 3 weeks :(

I already tried patches, non-nicotine vape, read Allan Carr book twice, I also have the illustrated version which I read like three times, I keep reading whyquit.com and there are moments when Im like fuck yeah, Im gonna beat it, I dont need it, but then I wake up in the morning craving like hell :(

And the worst part is that for me its really not just a 10 min craving, for me it feels like Im craving 24/7, I lose all motivation for everything. I tell myself I will just do squats whenever I have a craving but when it hits me I just cant get myself to exercise Im like completely frozen and just cant do it, my brain just dreams about cigs constantly.

I otherwise exercise every day and cigs are holding me back, I would love be able to run 10km anytime , but because of cigs my max is 8km which I did only once and of course it was when I didnt smoke last year around Christmas when I was with my parents so I know I could be doing much better if I could quit.

But whenever I dont smoke I dont even wanna exercise :( 

I just dont know what else to do, I also have a pack of nicotine gums but for some reason dont use them when I have a craving I just go to the gas station to smoke a few and then In kinda fine for the rest of the day but those mornings are killing me.

I feel like there is no hope for me but as they say never give up. But I feel so depressed I dont want to live in this hell , but I also dont want to shorten my life because of cigs.

My brain constantly comes up with excuses how Im still young and maybe I can smoke another year and then quit but we all know thats bullshit.

I feel tired as fuck when trying to quit but I cant sleep. I wish I could just sleep it off for a week but even though I feel like Im barely keeping my eyes open, whenever I try to take a nap or just sleep at night I cant fall asleep.

I hate this and dont know what else to do :(",5
2022-01-06 11:31:24,https://www.reddit.com/r/stopsmoking/comments/rximko/working_out_and_smoking_help/,Working out and smoking? Help,"Hello! 
I am 17yo and a heavy smoker. I have tried quitting twice(once for a whole year and the 2nd time few weeks). I find it hard to quit due to my mental health issues and social smoking- events such as parties and concerts.
But I really want to quit, badly, because I love working out and had to quit martial arts because of my addiction. Is anybody here a doctor or has suggestions on workouts for smokers? Can I workout at all while smoking? What Is a recommended type of exercise? Any kind of help Is appreciated 
Sincerely,
Thanks in advance",1
2022-01-06 11:23:51,https://www.reddit.com/r/stopsmoking/comments/rxigle/whats_the_best_or_easiest_or_whatever_worked_to/,"What’s the best, or easiest or whatever worked, to stop smoking.",,1
