,Date,URL,Title,Body,Score,COVID-19 Mentions
540,2021-11-07 16:19:48,https://www.reddit.com/r/stopsmoking/comments/qoy42y/what_is_the_general_views_on_vaping_from_this_sub/,"What is the general views on vaping from this sub? Is it cheating, or is it a good tool?","I am 20 weeks smoke-free, but I have been vaping daily since quitting smoking. I honestly wouldn't be able to stay off the cigarettes without vaping. I have tried to quit many times before but never lasted more than a few days before buying a pack. 

With vaping, I have been able to stay off the smokes and have even gone out drinking with friends at the pub (all smoke) which is something I thought would be impossible for me to do without having a cigarette. 

Let me know your thoughts :)",3,0
541,2021-11-07 15:36:54,https://www.reddit.com/r/stopsmoking/comments/qox8fu/i_admired_smoking_when_i_was_5_started_smoking/,I admired smoking when I was 5. Started smoking extensively 2 years back. Need to stop smoking. Any help or advice appreciated.,"I lived in a neighbourhood where when I walk to school, I would pass teenagers and mid aged men smoke. At an age of 10 or 11 it was attractive to me as you look up to anyone elder in that age. I remember smoking my first cigarette when I was 12 with one of my friend just to see how it feels. I liked it and have done the same maybe thrice after that until I was 14. Until I was 22 I did not smoke or drink or have any kind of habits as none of my close friends or my family did so.  
But I always admired smoking, it felt like an awesome thing to do. I even remember asking my roommate to gimme company to get a smoke, but we ended up not doing it even after we bought one. 

Later after college I had a relationship at work which was my second serious relationship. It came at a time when I had zero trust in love/relationship etc and claimed that every thing is a situation-ship. I saw the girl as a trophy wife and even stood up to my parents for marrying her. She dumped me in the end when we were about to part ways for our masters degrees, reason being we are from different religion.

I started smoking regularly then, and it has been 2 years now. On an average I smoke 6 cigarettes per day! I was drinking extensively throughout my first two terms of my masters. I felt disgusted about drinking at a point and was able to stop it. I was NOT addicted to drinking!
But now I feel disgusted by my smoking habit, but having a hard time quitting. I am not able to make any solid effort. 
My reasoning for justifying my habit was that, I was doing the right thing always! Still couldn’t get to be with my girl whom I loved! Let me just smoke, the one thing i always wanted to.
But now I want to stop it but not able to. Any suggestions?",3,0
542,2021-11-07 15:11:09,https://www.reddit.com/r/stopsmoking/comments/qowpn8/just_relapsed_work_stress_is_to_much/,"Just relapsed, work stress is to much","So I just relapsed after a week off , this is my first time quitting while holding a job and I've gotten into 3 verbal altercations since quitting. Today was the worst and nearly resulted in a fight in front of my boss , I don't think I can safely quit while working as my temper isn't the greatest as is , did anyone else have similar issues and how did you get through it ? I work in food production in a small shed and it's very crowded to the point you don't have much space to move at times and they like to hire people straight of centerlink . Idunno 😪",1,0
543,2021-11-07 14:29:13,https://www.reddit.com/r/stopsmoking/comments/pqvsyo/i_am_struggling/?utm_source=share&utm_medium=ios_app&utm_name=iossmf,I DID IT! 🙏,,4,0
544,2021-11-07 14:16:38,https://i.redd.it/blwjn2hx38y71.jpg,Day 1,,43,0
545,2021-11-07 14:13:13,https://i.redd.it/zen71w1c38y71.jpg,"One year! Anyone being at the start of their quitting journey, it’s possible! It took me several attempts, but I never quit quitting and here I am, being very happy to be free of this disgusting addiction!",,49,0
546,2021-11-07 13:58:09,https://i.redd.it/fpx00a9n08y71.png,Cold turkey. It's been tough but I'm proud 💪,,79,0
547,2021-11-07 13:53:23,https://www.reddit.com/r/stopsmoking/comments/qov36p/31_days_smoke_free_question/,31 days smoke free question?,"Hi guys and girls, I have been smoke free for 31 days but have recently began to cough and wheeze more than in the first 2 weeks. I cough up mucus and i am still shortbreathed when doing fast sports like sprinting. Is this normal and how long for it to go away should i expect? Smoked for about 3 years on and off, averaging around 5 cigaretes a day for background info, 25 years old. Thanks!",12,0
548,2021-11-07 13:09:37,https://www.reddit.com/r/stopsmoking/comments/qou6c0/ton_of_energy_after_quitting/,Ton of energy after quitting?,"Seems like whenever I quit, I get so much energy, so much focus, it's enjoyable but at the same time a bit stressful

anyone gets a super charge of energy when quitting?",25,0
549,2021-11-07 11:13:32,https://www.reddit.com/r/stopsmoking/comments/qoroqh/resisted_the_urge_to_buy_a_smoke_for_the_first/,Resisted the urge to buy a smoke for the first time in 5 years.,"Ive been trying to quit smoking for a few years. Every time i give in to the urge to smoke after a month of trying. Today, for the first time in 5 years, I was able to resist the urge to buy a smoke. I had walked to a cigarette shop. All the while i wanted to turn back but my mind was trying to convince me to smoke. 
I had to actively think about my life without cigs and how i would feel after smoking to stop myself from buying a smoke. 
It took about 30 mins of aimless wandering to convince myself to not buy a smoke. I'm quite proud of myself as of now. Ive never been able to do this before. I imagine it might be a lot easier for some but to me this is a huge accomplishment. 
Sharing my progress here as i have no one else to share this with.",66,0
550,2021-11-07 10:59:07,https://www.reddit.com/r/stopsmoking/comments/qordmj/allen_carrs_easyway_worked_a_treat_the_1st_time_i/,"Allen Carr's Easyway worked a treat the 1st time, I gave up completely for the 1st time ever in nearly 30 years for much of the year. However, I have relapsed, and on my 2nd read - any tips on a 2nd attempt / other resources that are useful?","Smoker since I was 16, gave up aged 43! I didn't smoke a thing for months which felt amazing, then the occasional bit of tobacco in a social spliff, but I would go weeks without in the middle, but it escalated and now I'm full blown relapsed smoking. I have faith in the book it worked before.. but a slight niggle is knowing, well it didn't really work, even though it's totally on me for dropping my guard. Also deep down I know I kind of want to be able to have the occasional social spliff (with tobacco) so that's undermining what I'm reading.  (I did try for months smoking green without tobacco, using all kinds of methods, but ultimately it's how I like it best!) I guess I can't have my cake and eat it :(",7,0
551,2021-11-07 10:56:55,https://www.reddit.com/r/stopsmoking/comments/qorc2s/7_and_a_half_months_almost_slipped_up_today/,7 and a half months.. almost slipped up today,"Honestly I’ve had no cravings since I’ve quit but today I just really wanted a damn cigarette for some reason so I convinced myself one packet can’t hurt. I’ll just have one pack and then I’ll be fine. I got in my car, drove to the store, and on my way to the counter, it was like a wave hit me asking if I’m really going to undo all this hard work.. because deep down I know it wouldn’t stop at just one pack. 

So I got back in my car and went home. Idk how I found the strength to do so but I’m glad I did. Reading all of your journeys on here helped me too, so thank you.",119,0
552,2021-11-07 01:45:26,https://www.reddit.com/r/stopsmoking/comments/qoi8gl/hey_everyone_me_and_my_bf_have_a_great_way_to/,Hey Everyone me and my BF have a great way to help stop for any info dm me THX!!!,,0,0
553,2021-11-07 01:40:43,https://www.reddit.com/r/stopsmoking/comments/qoi66l/its_extremely_hard_for_everyone_me_and_my/,Its Extremely Hard for everyone!!! Me and my boyfriend understand that I have a Link We'd like to share (if allowed) that helped us https://tinyurl.com/y4r7ajxw (Take out the space)lol,,0,0
554,2021-11-07 01:17:55,https://i.redd.it/ocz2onuay3y71.png,"Relapsed again, Starting Quitting again. And this time I feel like I am done with cigarettes for good!",,5,0
555,2021-11-07 00:59:40,https://www.reddit.com/r/stopsmoking/comments/qohl33/effects_of_quitting_nicotine_after_one_year/,Effects of quitting nicotine after one year,"I started vaping when I was 16 years old. I quit when I was 18 after I had problems breathing at night when trying to go to bed. It's now been 1 year after I've quit... I'm 19 and nothing feels the same anymore. My creativity, motivation, memory, focus... it's all been garbage since I've quit. Has anyone else had issues like this? Am I the only one? It makes me want to pick it back up again simply because this isn't enjoyable for me living like this. Or does anyone have any ideas what I could do?",5,0
556,2021-11-06 22:04:14,https://www.reddit.com/r/stopsmoking/comments/qoerye/i_wanna_quit_smoking/,I wanna quit smoking.,Im 20. I ve been smoking for 3 years and i ve decided to quit. Is there someone who wanna quit too so we can do it together and keep ourselves updated every now and then?,13,0
557,2021-11-06 20:15:15,https://i.redd.it/huwxy44bg2y71.jpg,"One year and 39 seconds. Thank you guys, for helping me through this ❤️",,1,0
558,2021-11-06 19:38:45,https://i.redd.it/c2fdoaps92y71.jpg,5 1/2 years. No looking back. Feel so much better. 😃,,32,0
559,2021-11-06 16:43:37,https://i.redd.it/cid59zoje1y71.jpg,My little brag. 600 days in! Thanks for your support! You can do it too:),,25,0
560,2021-11-06 16:34:21,https://www.reddit.com/r/stopsmoking/comments/qo8nyb/25_years_since_my_last_cigarette_if_i_can_do_it/,"25 Years Since My Last Cigarette. If I Can Do It, So Can You","25 years ago today, I had my last smoke. I'd tried quitting a couple of times before, but this time I crushed out my half-smoked cigarette and went straight to the drugstore for the nicotine patch. 

Somehow, and against all odds, I made it through that first day. Then I made it through that first week. And first month. And first year. And first decade. And now, here I am 25 years later and feeling great. 

When I say ""If I can do it, so can you"", I mean it. I'm not someone with great willpower. Or much of any willpower, to be honest. I'm not very disciplined, either. Not the right mix for battling an addiction like nicotine. Yet, with a lot of support from an online community kind of like this one, I was able to kick the habit once and for all. 

For all those in the early days of your quit, I believe in you. You can do it.",219,0
561,2021-11-06 16:15:07,https://www.reddit.com/r/stopsmoking/comments/qo8ajs/spontaneously_decided_to_quit_please_keep_me/,Spontaneously decided to quit; please keep me accountable,"A few hours ago, I realised I was out of cigarettes and would need to go out to get some more. I felt lazy and kept waiting and waiting until the shop closed; I thought ""that's the perfect occasion for me to finally quit"". I would love to talk to someone who's also going through the same process at the moment.

Maybe we can keep ourselves motivated and encourage each other! Good luck everyone x",40,0
562,2021-11-06 16:11:12,https://www.reddit.com/r/stopsmoking/comments/qo87ue/im_looking_for_a_partner_to_quit_smoking/,I'M LOOKING FOR A PARTNER TO QUIT SMOKING,"My name is Amal. I've been smoking for almost 3 years. Tried to quit hundreds of times but eventually i failed. Longest I've been nicotine free is 6 months.

So i suggest do it together, it'll be easier for both of us
My Instagram: amal_rahmatov",2,0
563,2021-11-06 15:22:40,https://www.reddit.com/r/stopsmoking/comments/qo7a48/coming_up_on_3_months_weed_tobacco_free_how_long/,Coming up on 3 months weed & tobacco free! how long did you keep coughing tar?,"Life has been great, I honestly have no idea how I fucked myself up for so many years. Im sorry to my past gfs who expressed concern as I took massive bong rips all weekend and everyday after work, I dont know how I did it myself.. The one thing thats continued to remind me to stay on point is the specks of tar I cough up every morning. My buddy who smoked ciggarettes nearly 10 years said it took him a solid year before he stopped coughing up tar. Is this normal? I see conflicting information online however it makes sense if my lungs are coated like a bong and the cillia is working to remove it that it would be a long process.",10,0
564,2021-11-06 14:16:40,https://www.reddit.com/r/stopsmoking/comments/qo5z5f/convince_me_not_to_smoke_my_first_cigarette/,Convince me not to smoke my first cigarette.,"I’m about to turn 18 and I now have access to buying all things I wouldn’t be able to. I wouldn’t drink but I am interested in smoking. I want to least try a pack and then buy a vape. 

I’ve been struggling with nicotine addiction since since I was 13. I got influenced by media and my friends stole vapes from their parents. We vaped a lot. I was stupid and I have cravings now like caffeine. It makes me relieved that I could buy cigarettes or vapes on my own accord but sad because I don’t want to think about it at all.",0,0
565,2021-11-06 13:17:12,https://www.reddit.com/r/stopsmoking/comments/qo4sao/yah_for_all_of_you_here/,Yah for all of you here!,A minute. A day. A week. A month. A year. Congrats to you!!! For all of it!! The hardest and best thing you’ll ever do! Keep going! You got this! Be proud of yourself! Just wanted to give a shout out. I’m going thru it too and support is everything. 😊,17,0
566,2021-11-06 11:28:17,https://www.reddit.com/r/stopsmoking/comments/qo2lr3/yesterday_was_2500_days_smoke_free/,"Yesterday was 2,500 days smoke free","I stopped smoking on 02 January, 2015.

At about an average of about 10 a day, that is 25,000 cigarettes not smoked.

At an average of about $10 / pack, that is $12,500 not spent.

I finally quit after reading about Allan Carr's Easyway book here on r/stopsmoking. That book helped me think differently about my reasons for wanting to smoke. Once I was able to short-circuit those desires quitting was much more successful.

It was not my first time trying to quit. So if you've tried in the past, but failed - fear not! It usually takes a few attempts. Don't get down on yourself or think it is hopeless. My greatest failing was always thinking I could have 'just one.' Months of hard work would, literally, go up in a puff of smoke.

I admire all of you here taking those necessary steps to a smoke-free life. Keep at it. You can do it. And before you know it you'll be back here on r/stopsmoking offering encouragement and support to those thinking about it or taking those first few steps.",35,0
567,2021-11-06 11:20:40,https://www.reddit.com/r/stopsmoking/comments/qo2gm2/just_hit_seven_years/,Just hit seven years...,...it can be done my friends...  Some of the cravings never go away but I quit cold turkey and never smoked another...  :),53,0
568,2021-11-06 10:34:31,https://i.redd.it/uvs39u4pkzx71.png,"Really proud of my first week without smoking in over 15 years. It's only a first small step on a potentially bumpy road, but I am finally willing to stay motivated, put in some work and change up my routines. It's almost impossible to believe how much better I generally feel everyday.",,25,0
569,2021-11-06 10:03:06,https://www.reddit.com/r/stopsmoking/comments/qo0wb5/trying_again_just_focusing_on_making_it_24_hours/,Trying again. Just focusing on making it 24 hours. Wish me luck.,,9,0
570,2021-11-06 08:24:24,https://www.reddit.com/r/stopsmoking/comments/qnz60k/its_finally_my_turn_its_been_one_year_since_i/,ITS FINALLY MY TURN!! Its been one year since I last smoked a cigarette :D,"I've thought about this day for years. Seems like a good occasion for self-indulgent reflection on my experience, why it took so long, and what helped.

I'm one of those people who ""tried to quit"" a thousand times over the past ... 15 years?? It all seems so insane to me now - going that long desperately wanting to stop smoking, spending so much time mentally and physically suffering. If you're one of those people who have tried to quit too many times to count, but still find yourself smoking - take me as an example that it IS possible to free yourself from the addiction. Don't ever stop trying.

When I think back to the things that made it hard to quit, some that stick out are: 

\- Hormonal fluctuations. As a woman with pretty intense PMS, I'd go on a health kick and feel powerful and on top of the world for about two and a half weeks during which quitting smoking would feel natural and easy. Then after ovulation my hormone levels would tank and I'd lose steam. Then PMS would hit and I'd feel like a chaotic, over-whelmed mess, give up, and go back to smoking. I'd recover from the chaos during my period (though still feeling drained physically), then a few days after my period I'd be back to a daily gym routine, quit smoking, and feel like ""THIS time I've got it"". I repeated that cycle literally every months for years.

\- Alcohol, caffeine, and other drugs. Every weekend, I was living on a rollercoaster of stimulants and depressants. When drinking, there was always a point in the evening when a switch flipped in my brain and all of a sudden the goal was to smoke as many cigarettes as possible. ""Party drugs"" like cocaine and mdma (of which I was only an occasional user, but still) had the same effect, but hugely amplified. I felt like I could eat cigarettes when I was high. Even caffeine, which put me in a good mood, would also make me over-stimulated / anxious in a way that made me want to smoke. 

\- General life-dissatisfaction and a lack of self-awareness. There were a lot of things I just didn't understand about my own psychology that made it hard for me to make good decisions for my health and well-being. I didn't like where I was in life and I didn't feel good, but didn't really understand why and wasn't doing much to figure it out. Instead, I was trying to band-aid over the issues with hedonism and distraction.

\- Dating someone who smoked. We'd try to quit together, but in doing so we just doubled of our chances for failure - if one person gave in, the other did, too

Okay, on to the things that helped:

\- Developing a ""toolkit"" of defence tactics to use when faced with triggers (nicotine cravings in the first few days / weeks and occasional ""nicotine nostalgia"" as I like to call it during the first few months). This toolkit included some motivating phrases I had saved in my phone (e.g. ""Everyone who smokes deep down wants to quit. No one who quits ever regrets doing so""). There were a few key memories I'd think back to (e.g. I remember seeing someone outside of a bar late at night looking longingly at people smoking. I offered her one and I saw her take a long look at it then she said ""no, I can't go back to smoking"" and it just struck me as a powerful moment and I thought ""yes - that's what I need to learn how to do""). Then there was the tried and true method of ""just go home and go to bed"" if I felt like I couldn't stay in the environment I was in without smoking.

\- Learning to track the symptoms of my hormone fluctuations. Once I could actually predict what I would feel and when and why, I was MUCH better at coping. I also found some supplements that have helped with the symptoms (e.g. vitamin B6, magnesium, and anti-histamines).

\- Sorting out my life dissatisfaction and mental health. I went to therapy, started journalling, got out of a romantic relationship that wasn't working for me, moved, changed jobs, got really into learning about psychology through podcasts and books. This was all over a few years. It helped so much to make some progress on figuring myself out, learning what I need to have a good life, and actively making those things happen for myself.

\- Getting free from other addictions. This time around I actually stopped smoking before I stopped drinking, but I had also had a few trial runs of sobriety (6 - 8 month stretches) not long before that. I knew that not drinking made it easier to stick to the decision to not smoke, but the main reasons I quit drinking were the myriad of other benefits (shoutout to /r/stopdrinking). I didn't make a conscious effort to quit party drugs as I had only been an occasional user. They just kind of naturally stopped being part of my lifestyle. Giving up caffeine was a hard one, but ultimately made me a much more calm and level person. Being free from the ups and downs of addiction life-style helped me fully understand that doing whatever I need to to stay free from addictions (including not giving in to smoking cravings or smoking nostalgia) are extremely important to me. Freedom from addictions is life on easy mode!

\- Getting physically healthy. I discovered along the way that I'm a person who needs to move to feel good. It helps as a motivator to quit smoking (for lung performance) and decreases the anxiety that pushed me to smoke, it makes me sleep so much better, improves my mental health, makes my skin and body look great, increases my energy through the day. Just all around life improvement. I do Essentrics exercise videos, run, cycle, dance, and occasionally do yoga and other activities.

\- Allen Carr's book helped me at one point, but I found the effects wore off as soon as I gave in the first time after it helped me quit for a few months. It was like the spell was broken and I couldn't really get the magic back. Still a helpful insight into the workings of addiction though.

Okay, time to get on with the rest of my day. I wish you all the best and hope some of this has resonated with or inspired some of you!",223,0
571,2021-11-06 08:08:56,https://www.reddit.com/r/stopsmoking/comments/qnyxid/just_realized_i_hit_30_days_but_i_dont_feel_like/,Just realized I hit 30 days but I don’t feel like I really earned it. Looking to take the next step…,"I stopped smoking cigs/vapes 30 days ago. I still smoke cannabis frequently. Not any more frequent than before when I was smoking cigs, that’s just another discussion for another day. 

I have been using these little nicotine pouches over the past 3 weeks, and haven’t even came close to buying a pack of cigs. These seem to take any nicotine addictive edge off smoking cessation. I am worried though as I look ahead and would like to ween off nicotine completely, that I am going to cycle back into my old habits. 

Are they any tips or words of advice any of you would like to share? I am always impressed by the positivity and support I see with this community. Hoping I can Bogarde some life experience from you beautiful people 🤙🏻🤙🏻",9,0
572,2021-11-06 06:52:41,https://i.redd.it/3uw87clugyx71.jpg,Have a great weekend! This is not the time to give up 👊🏼 We are thinking hard about those who no longer smoke and those who want to stop 🚬🚫,,6,0
573,2021-11-06 06:46:47,https://www.reddit.com/r/stopsmoking/comments/qnxs47/what_is_the_best_e_cigarette_out_there_top_seller/,What is the best e cigarette out there top seller post yours,,0,0
