Date,URL,Title,Body,Score
2021-06-29 22:59:27,https://i.redd.it/nz70fvo3jb871.jpg,"WOOHOO!!! made it to 60x days no nicotine 💪🔥⭐ first time ever in 44yrs !! OHH Y E A H !! ... let pride override (badge not updating though, still saying 47d damn it)",,31
2021-06-29 21:42:32,https://www.reddit.com/r/stopsmoking/comments/oamowo/milestone/,Milestone!,"I finally made it to my 1 week! I've never been this long without. I'm hella proud of the progress. The worst so far is the cough. I'm hoping for that to chill soon. It's my understanding that it can go on for several weeks.   


https://preview.redd.it/4wpzje8d5b871.jpg?width=1080&format=pjpg&auto=webp&s=71f620422d821f4480123f72c8cc1a5a6966f2b3",9
2021-06-29 21:05:11,https://v.redd.it/2x9nky7se6871,My eating habits the first week of cessation,,148
2021-06-29 20:52:14,https://www.reddit.com/r/stopsmoking/comments/oalsow/deleted_by_user/,[deleted by user],[removed],3
2021-06-29 20:39:34,https://i.redd.it/w1xb21c5ua871.jpg,I've made it almost a year and a half. I do still get cravings but the smell of smoke actually makes me feel sick now,,36
2021-06-29 18:38:10,https://www.reddit.com/r/stopsmoking/comments/oajasz/im_on_day_5_now_and_uh_besides_the_cost_i_dont/,"I’m on day 5 now and uh, besides the cost I don’t really see the point in quitting anymore?",[deleted],0
2021-06-29 17:52:48,https://i.redd.it/zj7zd28e0a871.jpg,"Gave up smoking, saved 420. 🙄😆 ….. if you can’t laugh eh?",,12
2021-06-29 17:33:12,https://www.reddit.com/r/stopsmoking/comments/oai057/chest_pain_during_exercise/,Chest pain during exercise,"I've made it 12 days as of today, I've been feeling great! I get very frustrated and upset at stupid things, but overall things are going well. One issue that I'm having is that I'm getting alot of chest pain when I workout, I still rode my bike 10-20 miles a day as a smoker, but now I get chest pain towards the tail end of the exercise. Is this normal lung recovery? How long will this feeling last because I'm so ready to ramp up my exercises!!!",2
2021-06-29 17:15:39,https://i.redd.it/3ejan8lrt9871.jpg,This morning I hit the biggie I’ve been waiting for!! Feeling a great sense of achievement!,,59
2021-06-29 16:18:13,https://www.reddit.com/r/stopsmoking/comments/oagdr5/having_a_hard_time_with_the_first_day/,Having a hard time with the first day.,So typically I can't fully get through my first day of not smoking. Does anyone have any tips on getting through the first day or even first 3 days/week?,4
2021-06-29 16:14:21,https://www.reddit.com/r/stopsmoking/comments/oagacu/quitting_is_easier_than_this_subreddit_might/,Quitting is easier than this Subreddit might suggest,[deleted],2
2021-06-29 15:43:41,https://www.reddit.com/r/stopsmoking/comments/oafql3/age_and_addiction/,Age and addiction.,"Hi all. I will make this post short to avoid dragging out details.
I go on and off on benzos and opiates. Harder drugs and on benzo withdrawal you can risk a seizure on some stairs even deaths from opiate wd are known, none NONE on nicotine.
Point being while i never had a problem giving up for some time those, i mean always taper, calculate doses etc, i get hit by insane desperation if i not have nicotine for a day. I always make sure i have some even when i try to quit.
I kept thinking about this and the only difference is that i started smoking at 14.
Point of the post is that i am curious how many of you that are desperate to quit, or managed hard to quit, started smoking at very young ages.",1
2021-06-29 15:34:32,https://www.reddit.com/r/stopsmoking/comments/oafjur/experience_with_tobacco_cessation_drugs_chantix/,Experience with tobacco cessation drugs (Chantix),"Hello all, first post here. I’m 21 years old and I have been debating taking chantix for the past couple months now that I have insurance that will cover the cost. Pros seem to be saving an extra $200 a month not buying juul pods, I get $50 off my insurance every month if I stop smoking, and of course the benefits of not smoking. Is it worth it? Are there any terrible side effects I should be scared of?",1
2021-06-29 15:04:08,https://www.reddit.com/user/Fadajo/comments/oaeop5/celebrate_our_independence_with_family_fun_so_put/,"Celebrate our Independence with Family Fun! So, put on your red, white and blue,light some sparklers, and get ready to “Ooh!” and “Ahh!”as you enjoy some patriotic fun with your family this 4th of July! Be safe and have fun! With Funny Fireworks T-shirt On Amazon.",,1
2021-06-29 14:47:55,https://i.redd.it/3hsa8jje39871.png,4 Days Completed! I just want to get out of this withdrawal as soon as possible. Anxiety and restlessness are worst things. I will not give up.,,10
2021-06-29 14:10:59,https://www.reddit.com/r/stopsmoking/comments/oaduv1/today/,Today,"Day 9 over and done with...

We got a problem well a couple actually.

1. Exercise won't happen today, I actually couldn't sleep last night. I don't think I fell asleep until around 7am??? Just got up around 12-12:30ish because of someone at the door.  
2. I got a HORRIBLE HORRRRRRRRRIBLE sore throats. The kinds were it even hurts to just clear my throat.  Mix that with the annoyance of the ""tickle"".......when really it isn't a tickle we all know this.

Good news

1. Feeling like I was getting bit last night in bed, we've had the nightmare of bedbugs before but not at this place. We've been bug free for 6 or 7 years? The pest control did a heat treatment but they are EXPENSIVE (1500 dollars) for 1 treatment.  I was kinda panicy, stressed, if you've ever had these things and then get bit at night again you do! Well a pest control expert came out and said he does not see any signs of bedbugs but with our cats it might be fleas.   I'm actually grateful for this! It's not bedbugs! Give me anything else just not bedbugs!
2. I get paid tomorrow! Isn't that always a good thing? Actually the husband does but what his is mine too right? We might get some fireworks, small amount, and enjoy. I already got popcorn here.  The best part, to watch city fireworks we never have to leave our yard.  If we go out in the backyard we can see them pretty clear and beautiful so we get popcorn and our chairs.",2
2021-06-29 12:42:57,https://i.redd.it/md5urx14h8871.jpg,Finally joined the 3 month club,,49
2021-06-29 12:42:02,https://www.reddit.com/r/stopsmoking/comments/oac1wh/been_waiting_to_post_this_here/,Been waiting to post this here,[deleted],1
2021-06-29 11:07:39,https://www.reddit.com/r/stopsmoking/comments/oaa5r2/quitting_now/,Quitting now.,"I am quitting nicotine pouches, hope you guys don't mind I came here. I was unable to find better sub and I want to share with someone.

Was doing one can (24 pouches) of velo X-Freeze a day (one pouch equals 16mg of nicotine). I am 24 years old.

What should I look forward to? Insomnia? Depression? Anxiety? Is there someone who quit similar dose and was with just mild withdrawals (was able to sleep and wasn't too much anxious?).",8
2021-06-29 10:59:46,https://www.reddit.com/r/stopsmoking/comments/oa9zuf/the_anxiety_is_real/,The anxiety is real.,"Hello there, smoker....or ex smoker of 20 years here. Smoked a pack a day no problem.

I'm on day 8 of no nicotine, actually by 1pm today it'll be 8 days officially and I feel awful.
The good news is I don't want to have another cigarette. The bad news is I've been waking up feeling anxious right when I wake up and randomly throughout the day.

Also about 4 days after quitting I started to have heart palpitations and they haven't fully gone away yet. This happened to me last year when I traded cigarettes for vape for about 6 months and then stopped vaping.  It took a couple of weeks for the palpitations to finally stop(I was vaping at least 2 Juul pods a day, doctors told me nothing was wrong and it was most likely from nicotine withdrawals) no tightness of breathe and no pain. 

Anyway I'm here mostly because it's supposed to help my anxiety by talking about it, also I've never had anxiety before until the past year and a half. I'm sure I'm leaving out details to my story since I'm having difficulty focusing at the moment so I apologize if my post seems like it's all over the place.

I'm just trying to find some sort of answer for how long are these withdrawals going to last, to how long until this anxiety goes away?

Thank you all for reading this. I really appreciate any and all help.

Take care

Update: went to an Urgent Care for heart palpitations. They took blood, x-rays, EKG. They said even though I'm having irregularly irregular palpitations my heart is fine and it should go away on its own. It brought be some relief but of course one can't help but to panic a bit when they become lost in their own thoughts.  I have noticed though that as long as I'm not focused on it, whether it's by watching a move or playing video games, then I actually feel normal until I realize I feel normal and then I start to feel the palpitations more and more ......what a vicious cycle. Anyway I have an appointment with my primary doctor in 3 days to see what she says in regard to my heart and this new found anxiety I have. Boy oh boy what a ride this has been.",9
2021-06-29 10:38:46,https://www.reddit.com/r/stopsmoking/comments/oa9l4o/vaping_less_harmfull_than_just_smoking/,vaping less harmfull than just smoking?,Should a person stop vaping? Why? Is vaping less harmfull than just smoking? Is there any evidence of this?,3
2021-06-29 09:37:44,https://www.reddit.com/r/stopsmoking/comments/oa8g9j/day_10_insomnia_is_unreal/,Day 10. Insomnia is unreal.,I've been awake 26 hours in about 20 minutes and at this rate I think it's more likely i stay awake for another 24 hours than sleep anytime soon. I'm not even fucking craving smokes i just cant sleep how long does this last?????????? I workout 6 days a week and cut out caffeine. Not helping. It started around day 4 and has gotten MUCH worse since then,7
2021-06-29 09:18:52,https://www.reddit.com/r/stopsmoking/comments/oa84ew/day_3_and_resisted_cravings_what_finally_worked/,Day 3 and Resisted Cravings - What Finally worked," I had a 2 hour window of free time last night when my kids were at the movies. I nearly pulled into the local corner market and bought some, thinking how nice it would be to ‘relax’ for a few hours while they were away (they don’t know I smoke). I shifted my focus to how much I would regret it - having to start my count over, failing yet again, feeling like shit in the morning, and the self loathing, etc, etc. Now feeling good and proud of myself
This morning and think I’ll take a run. Anyone else around the 3 day mark that wants to support each other on here? Keep going everyone we can do this!",16
2021-06-29 08:53:48,https://www.reddit.com/r/stopsmoking/comments/oa7ot5/bad_cravings_and_withdrawal_symptoms/,Bad cravings and withdrawal symptoms,"20 hours. This is yet another attempt of mine to quit smoking (the most serious one to date) and I figured I might get some help from you guys. 

It’s only been 20 hours without smoking and I’m already constantly thinking about it. 
I have a brainfog and am unable to concentrate. Besides, I have some physical symptoms as well: dizziness, headache, fatigue. 
I also have an upcoming exam in university in two days, yet I can’t get myself to study as I should. I went to the gym, I ran, I ate, I chewed gum and did pretty much everything I could think of to help me not smoke. I feel absolutely terrible.

I feel maybe it was not the best decision to try and quit three days before an exam, knowing I would feel like this both physically and mentally. 

Has anyone had to deal with serious withdrawal symptoms and/or brainfog and found a way to make it go away faster?",4
2021-06-29 08:17:37,https://www.reddit.com/r/stopsmoking/comments/oa73qj/day_1_today/,Day 1 today!,[deleted],3
2021-06-29 07:57:47,https://www.reddit.com/r/stopsmoking/comments/oa6seq/21_days_clean_the_easy_way_is_really_something/,21 days clean. The Easy Way is really something,"Finally read The Easy Way and after that managed to pull three weeks.  
Before I managed only a week at best. Last two weeks I didn't even think about cigs, the only reason I know I hit 21 days is because of the automatic habit tracker I got.",14
2021-06-29 07:44:20,https://i.redd.it/gxbjjf4uz6871.jpg,"I used to be jealous of all these picture's, but today I celebrate a month! I'm part of the quit club, you can do it too!",,191
2021-06-29 06:22:37,https://www.reddit.com/r/stopsmoking/comments/oa5h1b/i_am_literally_debilitated_by_cravings_right_now/,I am literally debilitated by cravings right now and I need to vent.,[deleted],71
2021-06-29 02:51:29,https://www.reddit.com/r/stopsmoking/comments/oa2xmh/4_days_and_struggling_tbh/,4 days and struggling tbh,"Hello everyone!

I've been 4 days free of tobacco, and I stopped it cold turkey. I'm finding it hard because I grew up with it, I started when I was 14-15, and now I'm nearly 19, and I'm finding it hard. 

I'm struggling with four things:

1) I didn't usually get mad before, but now for some reason, I'm finding hard to keep anger in me. Even emotions, like I would always smoke when I was pissed at something, and now I don't know what to do without it. 

2) Is normal to forget things way more then usual, like I literally don't remember any details from the past week, it's like I'm struggling to remember things. Yesterday I was really sick, I was extremely lost, but didn't give in. 

3) You know like when you had nothing to do, you would usually be like ""let me smoke"". Now I'm struggling to fill this ""moment"" in, my subconscious kicks in saying go smoke, but then I say no, but I don't know what to replace it with. I tried ignoring it, but I spotted the urge just gets stronger. 

4) Is it me or does time pass by differently. Time is flying by really fast, and I'm not noticing it.

Any advice would be appreciated tbh

Thanks!",12
2021-06-29 02:05:53,https://www.reddit.com/r/stopsmoking/comments/oa2cn3/smoking_is_the_reason_of_sweating/,Smoking is the reason of sweating?,"I sweat alot and I thing this is due to smoking, any ex smoker noticed change in sweating after quitting?",2
2021-06-29 01:31:18,https://www.reddit.com/r/stopsmoking/comments/oa1vga/ulcerative_colitis_and_smoking/,Ulcerative Colitis and Smoking,"I have UC and it seems as though every time I try to quit smoking my UC flares up. I've gone 5 years without having issues and now that I'm just hitting my 2 week smoke free mark, I'm getting symptoms of a flare. Its frustrating as hell and I don't know what to do to control my UC naturally without smoking. I'm chewing nicotine gum and I believe that's the only thing preventing a full on flare up right now. Anyone else have this issue?",2
2021-06-29 00:32:39,https://www.reddit.com/r/stopsmoking/comments/oa11h7/finally_ready_to_quitagain_im_ready_for_life/,Finally ready to quit....again. I'm ready for life without this.,[deleted],26
2021-06-28 22:35:38,https://www.reddit.com/r/stopsmoking/comments/o9z7dx/just_now_threw_my_vape_away/,Just Now. Threw my vape away.,I decided I’m going to go cold turkey and just stop. The useless habit that gives me nothing back. First step is to force myself to not dig it outve the garbage tomorrow morning before work. Wish me luck. Any support or similar experiences are welcome and appreciated.,15
2021-06-28 22:09:54,https://i.redd.it/d3f4hioc54871.png,"Finally! Made it, gotta keep going.",,16
2021-06-28 22:01:55,https://i.redd.it/t6emhgex34871.png,I'm a little late but guys ... I made it to one year. Every single one of you is capable of doing it! Never look back.,,75
2021-06-28 21:55:24,https://www.reddit.com/r/stopsmoking/comments/o9yjbf/why_is_it_always_like_this/,Why is it always like this?,"I quit smoking. I was three months without a cigarette. I got a job and almost immediately picked it back up. Small at first, only one to get me through the stressful time and then bam I'm back to smoking half a pack a day after a month. 

I really hate smoking. Its expensive, its vile, its killing me and making other people not want to be around me. Yet for some reason I still crave it even after prolonged periods of avoiding it. I just want to stop.",15
2021-06-28 21:20:32,https://www.reddit.com/r/stopsmoking/comments/o9xyxv/its_hot_im_sweating_and_my_patch_keeps_falling_off/,"It's hot, I'm sweating and my patch keeps falling off.","It's crazy hot right now, but I still need to spend time outdoors. My sweat seems to just wash away my patch patch as well as the medical tape I've tried using to secure it in place. Any suggestions for how to keep that thing on? I also worry a bit that even if the patch is in place, but the adhesive isn't sticking, I'm not getting transdermal dosage I need. Today is my first day with the patch and I can't tell if my cravings are being blunted by a functional patch.",2
2021-06-28 20:58:22,https://www.reddit.com/r/stopsmoking/comments/o9xlm5/i_relapsed_a_few_times/,I relapsed... A few times,"WHY is it so hard to quit this poison? It’s becoming more difficult as the years go by. Does anyone have any tips that helped you quit for good?

Starting fresh tomorrow *sigh*",4
2021-06-28 19:47:18,https://www.reddit.com/r/stopsmoking/comments/o9weyr/cant_stop_smoking_socially_i_was_sick_and_went/,Can’t stop smoking socially :( I was sick and went out and still smoked cigs and now my throat hurts and I feel like a loser,Just needed to vent a little… also If anyone has any advice on how to not smoke when all your friends do (All The Time) please let me know!,3
2021-06-28 18:21:18,https://www.reddit.com/r/stopsmoking/comments/o9uusu/96_hours_aka_4_days/,96 hours aka 4 days.,"I've quit before for long enough to have stayed quit, many months, sometime years, and I just didn't stay quitified so here we are 4 days in uhhhhhhhgain.  I totally got this.  I just need to remember a year from now ""aw, just one won't be a problem!""  (Narrator:  Yes, yes it will be, lol)

When I quit I thought ""This is gonna suck for a spell"" and it did.  Does, even, but the brain fog, the thing I hate the most, is starting to lift a little.

As I've posted a million times here in the past 4 days the thing that gets me through is I know the cravings are BECAUSE of my friend Nicky O'Tine, and having a smoke is NOT the solution to them.  The only way these cravings go away is by never feeding them again.

Get that mindset and it is a lot easier to get through a bad craving.  And maybe giving it a name helps, beats me.  Just had a helluva craving and thought, verbatim, ""Oh fuck off, Nicky"" and boom, the desire to smoke was instantly gone and the craving passed really easily.

Also bear in mind your brain will do all SORTS of things to rationalize smoking again.  Don't trust it.  No, your stress levels are not too high.  No, you do not ""love to smoke"" no matter how much you think you do.  Your addiction is just playing your brain like a fiddle and it is your enemy - treat it like one.

I reckon I'll post again at 1 week.

Feel free to join me in saluting Nicky:

....................../´¯/)

....................,/¯../

.................../..../

............./´¯/'...'/´¯¯\`·¸

........../'/.../..../......./¨¯\\

........('(...´...´.... ¯\~/'...')

.........\\.................'...../

..........''...\\.......... \_.·´

............\\..............(

..............\\.............\\...

&#x200B;

<edit:  Some spelling and other dumbassery>",13
2021-06-28 18:13:27,https://www.reddit.com/r/stopsmoking/comments/o9upja/difficult_night_ahead/,Difficult night ahead,"Hi folks, I'm 10 days in now without a smoke or any nicotine aids. 
Working nightshift at the moment and there's not much to do which is not helping.
This is the first time I've tried to stop without using nicotine patches. Finding it quite difficult at times depending on how much chocolate I dare to eat 😁.
Anyway peace people 👊",1
2021-06-28 18:08:16,https://www.reddit.com/r/stopsmoking/comments/o9um22/here_we_go/,Here we go,"Today is the day. Quitting for good. It's been about 12 hours.

Smoked almost a pack a day for 3 years, vaped for another 3. I've quit once before but caved at the 6 month marker and was vaping almost a pod a day for another year. I'm really scared of those challenges coming up in a few months, when it just becomes boring, regular life and the realization that I'll never smoke again sets in. 

Hopefully this community can provide some insight and positive reinforcement because it's tough, man.",9
2021-06-28 17:08:35,https://www.reddit.com/r/stopsmoking/comments/o9ths4/what_made_it_easier_for_you/,What made it easier for you?,"I have a question that may help me and/or many others. 
To all successful quitters: What was the ONE thing, that made quitting easier for you? Thanks!",1
2021-06-28 16:03:43,https://i.redd.it/3v3o5go0c2871.jpg,2 Months 7 Days.,,12
2021-06-28 15:58:23,https://www.reddit.com/r/stopsmoking/comments/o9s36h/10_days_smoke_free_this_is_the_longest_ive_gone/,10 days smoke free! This is the longest ive gone without tobacco since I was a teen.,"Ive been trying to quit for years now. Ive been using lozenges and gum for years which curbed my pack a day habit to just 3 or 4 smokes a day. I went camping last week and didnt bring anything with me except lozenges and have kept it going now for 10 days! I know its not much, but I just wanted to share, as this is the longest ive gone without tobacco since I started chewing as a teenager.",44
2021-06-28 15:13:42,https://www.reddit.com/r/stopsmoking/comments/o9r78d/8_days_down/,8 days down,"8 days down and I feel better today. It's more normal and I haven't thought much about cigs. I'm sure I will again.
Our little rescue kitten we've decided to keep. He's a little ball full of energy. 
It almost feels like fall here or as close to fall as I can get in June. 83 high. So I lit some fall candles and have a fall scent in wax just burning along. 
Also rearranged the living room but it will take men to change the furniture. It's too heavy unless you are a bodybuilder!
I'm pretty happy for another reason too.
Before I quit 172lbs at the doctor.
Now 168 in 8 days!

Thank you low carb diet not keto. Keto is too extreme and too much fat for me. Exercise helps. I have insulin resistance it's slower to loose weight but it fills you up like today.

1 tub cottage cheese -540 cals, 30 carbs and only 6 grams of sugar in that whole thing. I'm not even hungry now and probably won't until 7 or 8. 

Cheat days is once every 2 weeks. For a reset and sanity!
I might do a carb MEAL not cheat days on the 4th. 

My husband smokes but if you have a little humor we will all be smoking on the 4th 😂 if you think about the firework smoke and bbq smoke in the air. It doesn't bother me to see him smoke at least not yet. I haven't been in the car yet with him while we are driving somewhere. I am trying not to do that just yet.",10
2021-06-28 13:54:29,https://www.reddit.com/r/stopsmoking/comments/o9pllg/irony_pfizer_halts_distribution_on_chantix_due_to/,Irony: Pfizer halts distribution on Chantix due to carcinogens,"[https://www.reuters.com/business/healthcare-pharmaceuticals/pfizer-halts-distribution-anti-smoking-drug-after-finding-carcinogen-2021-06-24/](https://www.reuters.com/business/healthcare-pharmaceuticals/pfizer-halts-distribution-anti-smoking-drug-after-finding-carcinogen-2021-06-24/)

I'm a cynical bastid so this made me chuckle.",4
2021-06-28 13:39:31,https://www.reddit.com/r/stopsmoking/comments/o9pb25/smokes_became_my_crutch_through_all_stress_and/,"Smokes became my crutch through all stress and grief the last few years. I've tried to quit many times. After almost a decade of smoking, I'm about 3 days without nicotine.",Holy shit my head is killing me.,179
2021-06-28 13:06:34,https://www.reddit.com/r/stopsmoking/comments/o9omp2/i_quit_6_days_ago_and_cant_do_anything/,I quit 6 days ago and can’t do anything.,"I need some motivation I can’t do anything I just lay in bed all day. If I do anything productive I feel the urge to smoke. I used to smoke and work on my project car, but now that I quit I feel I wouldn’t be able to work on my car for a long time.

Every hobby I ever did was while smoking. It’s super tough right now. Anyone have any suggestions how to get through this? Do I wait it out in bed all day eating chips? I feel like I’m wasting time.",17
2021-06-28 12:23:29,https://www.reddit.com/r/stopsmoking/comments/o9nqfn/24_days/,24 days!,[deleted],3
2021-06-28 12:17:49,https://i.redd.it/sb90emwp71871.jpg,One month no nicotine or tobacco 🎉,,132
2021-06-28 10:49:58,https://www.reddit.com/r/stopsmoking/comments/o9lsfg/hi_guys_im_not_really_sure_how_this_works_but_ive/,hi guys i’m not really sure how this works but i’ve recently started trying to quit smoking and any advice/motivation would just really help please leave something if you can i would really appreciate it,[deleted],6
2021-06-28 10:08:39,https://i.imgur.com/QGCgv9H.jpg,One month today!! Never thought I’d be able to say that!,,29
2021-06-28 09:38:42,https://www.reddit.com/r/stopsmoking/comments/o9kg5h/deleted_by_user/,[deleted by user],[removed],9
