Date,URL,Title,Body,Score
2021-06-14 08:58:39,https://www.reddit.com/r/stopsmoking/comments/nzm7cm/can_someone_give_post_quitting_lung_and_throat/,Can someone give post quitting lung and throat health advice? Quit a week ago. Been smoking for 3 years.,I quit a week ago. And I understand it'll take time for my insides to get better. But I have been having some issues with my throat and lungs (mostly sputum and chronic cough). I was wondering if anyone had any tips to make the transition much faster and just in general Healthcare advice.,11
2021-06-14 07:11:12,https://www.reddit.com/r/stopsmoking/comments/nzke1k/ready_to_give_quitting_a_go_we_might_be_able_to/,Ready to give quitting a go? We might be able to support you!,[removed],1
2021-06-14 05:05:20,https://i.redd.it/a3q7obes57571.png,Day 9 Done!,,26
2021-06-14 04:55:00,https://www.reddit.com/r/stopsmoking/comments/nzif8k/6_days_no_smoke/,6 Days No Smoke!,"I think I'm joining this sub for accountability. I have quit before, and have failed. I've usually quit because someone else wanted me to -- often times my ex-wife --- but this time I'm doing it for me.

I'm now six days into my new life as a non-smoker! I read the Allen Carr Easyway book, which finally gelled in my head after many readthroughs, and I have not missed smoking. I'm 43, and I had my first cigarette at 15.

My lungs feel better, my nose and throat feel better, and my heart feels better. My 9 year old was mentioning my smoking (outside, not inside, but she saw it). I'm so glad she won't see that anymore. 

I kept the '1 or 2 ciggies a day' rule for a long time, but the last day I smoked, I think it was three packs. I'm done paying $600/month to kill myself slowly. I smoked my way through a traumatic divorce  (separated a year ago) and restraining order event last June, but I realized, I'm just kept pushing my quit date into the future. Well, it's here, and in the past week, I've saved $123, and I don't sound like someone with emphysema. Crazy how quickly my croupy cough went away, but I'm never going back to that.

Proud to join this sub, and proud of everyone who's persevering!",51
2021-06-14 01:59:05,https://www.reddit.com/r/stopsmoking/comments/nzg0og/is_there_an_app_to_help_you_quit_smoking/,Is there an app to help you quit smoking,I need to stay motivated.,2
2021-06-14 01:17:59,https://www.reddit.com/r/stopsmoking/comments/nzfdnf/hello_guys_i_need_some_help_when_i_go_out_side_i/,"Hello guys i need some help, when i go out side i feel like i should be doing something with my hand since i used to smoke all the time while Im out , i need something to keep my hand busy any ideas ?",,5
2021-06-14 00:07:10,https://www.reddit.com/r/stopsmoking/comments/nze739/6_months_smoking_2_hours_stopped_3rd_attempt_at/,6 Months Smoking - 2 Hours Stopped - 3rd Attempt at quitting,I just want something now immediately. What do I do? Is there a WhatsApp group for support?,3
2021-06-13 21:31:21,https://www.reddit.com/r/stopsmoking/comments/nzbd67/has_anyone_else_quit_smoking_on_their_first/,Has anyone else quit smoking on their first attempt?,"I smoked for 15 years - more recently, a pack a day! 

Back in January I had a health scare and I said “that’s it, I’m done” and the craziest thing happened…. I was actually done!

I had thought about quitting prior to this, but I never made any attempts. Based upon the posts, it’s rare to have the first time stick so I’m feeling pretty thankful!",10
2021-06-13 20:49:45,https://www.reddit.com/r/stopsmoking/comments/nzakiz/heres_some_motivation/,Here’s some motivation :)),"Hey guys! 1 week without puff bars (nicotine vape) first week withdrawals were bad, only thing that was intense for me was my panic attacks, anxiety and sleepless nights. But wow does it get better I PROMISE. Here’s how my days went. Everyday i woke up sweaty and had lack of sleep till this day. But, 

Day 1. Cravings but i was okay mentally physically 

Day 2. Got really irritated by small things, would panic over small problems (when they weren’t even problems 😂)

Day 3. HORRIBLE  (for me) didn’t even wanna think about nicotine i freaking hate it cause i got intense body ache, intense anxiety i couldn’t control it unless i went for a walk or did the worlds amount of errands until i was so tired i wouldn’t feel pain

Day 4. Woke up sweaty but same feeling as day 3
Day 5. Woke up sweaty but same feeling as day 3
Day 6. Anxiety got alittle bad again, took anti anxiety to help my chest pressure and pain from the anxiety at that point i couldn’t take it i started to cry

NOW week 1. I woke up sweaty, took sleeping medication cause I’ve had sleepless nights this whole week. BUT my anxiety is gone I FEEL HAPPY.

If any one needs advice, help, motivation etc reach out. (:",7
2021-06-13 20:41:28,https://www.reddit.com/r/stopsmoking/comments/nzaewd/day_12_holy_cow_what_a_pain/,"Day 12- holy cow, what a pain","I was doing really good today until about an hour ago.  All of a sudden I am craving like a junkie.  I’m getting warm and fidgety.  I was going to go out for a few beers tonight- thankfully I didn’t because I would not have had the willpower to not “bum” a smoke from a buddy- and we all now what happens after that one.  Playing a video game just to pass the time till I can go to bed.
Edit- my mom called and the dog attacked the cat- broke her back; on the way to the animal hospital.",4
2021-06-13 20:22:46,https://www.reddit.com/r/stopsmoking/comments/nza1u9/round_2/,Round 2,"I was smoke free for one and half years, until upto 4 months ago. I went for one smoke to see what it feels like, and that was it. Went upto a pack a day in no time. I need to restart the quit process. Yesterday was the best time to do it, right now is the second best. 

Starting the journey all over again. Wish me luck.",16
2021-06-13 20:00:46,https://www.reddit.com/r/stopsmoking/comments/nz9mb6/quitting_today_second_time_quitting_question_will/,Quitting today. Second time quitting. Question - will the risk of lung cancer ever reduce to that of a non smoker?,,2
2021-06-13 19:58:23,https://i.redd.it/spqpm7q7g4571.jpg,🙂🙂🙂🙂,,6
2021-06-13 18:54:28,https://www.reddit.com/r/stopsmoking/comments/nz8aca/50_hours_ouch_fuck_ouch_stop_it_ouch_ow_fuck/,~50 hours. Ouch fuck ouch stop it ouch ow fuck,[deleted],1
2021-06-13 17:55:43,https://www.reddit.com/r/stopsmoking/comments/nz71py/i_ran_out_of_my_juul_pods_so_i_guess_im_going_to/,I ran out of my juul pods.. so I guess I’m going to try quitting now.,"I’ve been vaping since sophomore year of college (so about 3.5 years now) going through at least a 4 pack a week. 

I get so irritable when I am withdrawing & need advice on how to curb that. I get irrationally angry at the smallest things. 

So nervous to even drive somewhere because I’m tempted to pull over & buy a pack.

Any advice? I quit once before but it only lasted about a week and a half before I caved.",5
2021-06-13 17:04:39,https://www.reddit.com/r/stopsmoking/comments/nz5yo9/582_days/,582 Days,"582 Days. It is a long time. Nowadays I see someone smoking and think how happy I am that I don't have to do this shit anymore. And in very rare moments, I still think that I would enjoy rolling a cigarette.

Not really to smoke it. I would just enjoy the process of rolling it. And I think that this was mostly what I liked back when I used to smoke too. It gives your hands something to do, and once you are done, you get to smoke the cigarette you just rolled for yourself. Little things are as simple as this in life, and have that instant gratification for you.

Thank you all, this is a great community, and your help has been a large part in being able to quit. I'll have a look around in the future more often again, to hopefully give the same help to someone else.",5
2021-06-13 17:02:43,https://i.redd.it/x7mcb00vk3571.jpg,month 1 done,,8
2021-06-13 16:39:56,https://www.reddit.com/r/stopsmoking/comments/nz5fey/need_advice/,Need advice!,[deleted],1
2021-06-13 16:17:17,https://www.reddit.com/r/stopsmoking/comments/nz4y51/a_vicious_cycle/,A vicious cycle,"Every time I light a smoke, I feel like absolute shit. like my life literally accounts to nothing other than these shitty habits. I want to quit that very second. I want to throw that smoke out of my hands. But I don’t. I finish it. I think to myself that one day I’m going to quit this filthy habit. I don’t like the lingering smoke smell on my lips, so I wash it off and get to work. But then I start, and after a few hours I want to light another smoke. 
Why am I so eager to light something I thoroughly despise? 
It makes me question my inner beliefs..",3
2021-06-13 16:02:28,https://www.reddit.com/r/stopsmoking/comments/nz4mdh/week_7/,Week 7,"I am now into week 7 nicotine free. I am still dealing with constant brain fog, and an overall feeling of dullness, or numbness. It's been tough because I actually have a lot going for myself right now but it is hard to appreciate that fact and fully enjoy it. Week over week, things have been improving, but I'm still not 100% and it's just frustrating. I have read that it can take up to 3 months for things to re-calibrate after nicotine cessation, so I am holding out until then for some good signs. I am also committing to no alcohol for the next month to try to get over the line. Penny for your thoughts, or words of encouragement.",5
2021-06-13 15:59:43,https://link.smokefreeapp.com/install,My update,,3
2021-06-13 15:58:17,https://i.redd.it/ls0ri3ad93571.jpg,"It’s been exactly one year since I smoked my last cig. Not smoking 4 packs a week changed so much, yet so little. I’m at a loss for words but I’m incredibly proud that I was able to quit despite my mental illnesses and abusive relationship. I did it. I made it. If I can, you can. You can AMA.",,433
2021-06-13 15:32:44,https://www.reddit.com/r/stopsmoking/comments/nz3yqt/8_years_smoking_2_weeks_stopped/,8 years smoking ~ 2 weeks stopped!,"I finally managed to syke myself out enough to make the switch. Im using a vape which honestly probably has more nicotine than I used to intake but I feel like its still a step in the right direction to not be burning my lungs, yellowing my teeth and damaging my skin.

In a couple more weeks I'll attempt to wean, but for now I'm just happy to say ""I don't smoke""!",16
2021-06-13 15:30:58,https://www.reddit.com/r/stopsmoking/comments/nz3xdo/quitting_help/,Quitting help,"If any of you are looking for an alternative and it's just impossible to quit smoking, zyn nicotine pouches are a complete life saver! I've tried vaping and dipping both with failed attempts at quitting but Zyn is a life changer!",3
2021-06-13 15:26:47,https://www.reddit.com/r/stopsmoking/comments/nz3u9d/first_day_again/,First day! AGAIN 🙄,Bazillonth attempt! 17hrs 28min! I am no longer a smoker! One day at a time 😁,19
2021-06-13 14:39:03,https://www.reddit.com/r/stopsmoking/comments/nz2u5i/worst_year_of_my_life_so_far_7_days_ago_i_quit/,Worst year of my life so far... 7 days ago I quit cigs and I'm finally feeling free.,[deleted],3
2021-06-13 14:36:58,https://www.reddit.com/r/stopsmoking/comments/nz2slc/17_days_17_hours/,17 days 17 hours,"If you’re just starting or still struggling please hold on!


I couldn’t care less for tobacco 😃 I picked up my brothers dried tobacco leaf today and just laughed out loud. I can’t believe such a pitiful substance had me in its clutches. My breathes are deeper, mouth is cleaner and I smell better than I ever have, not to mention all the extra energy and clairvoyance I have, I love it and wouldn’t trade it for disgusting stinky, harmful tobacco.",5
2021-06-13 14:04:17,https://www.reddit.com/r/stopsmoking/comments/nz24ul/2_½_days_in_trying_to_curb_cravings/,"2 ½ days in, trying to curb cravings","When do the cravings stop? I’m on 2 ½ days in, cold turkey since the stupid patches keep falling off. Yesterday was kinda easy, but today is throwing me for a loop. It’s all I can seem to think about. What are some tips for being strong? Because I can’t give back into that nasty habit. I just watched my mother die a terrible death from lung cancer 3 months ago. I can’t let the same thing happen to me. Help please!",2
2021-06-13 14:02:25,https://www.reddit.com/r/stopsmoking/comments/nz23e3/quit_smoking_last_february_when_i_found_out_i_was/,Quit smoking last February when I found out I was pregnant but am really struggling to stay smoke free,"So much stress. I'm a critical care veterinarian who owns my own clinic. I have to deal with my high stress work, managing my business, on top of being a new mom. I got a call this morning from work about a really stupid incident that happened overnight that was resolved but could have severely damaged my reputation if not resolved. In the past I'd just light a cig but I don't know how to handle the high stress stuff. Gahhhhh.",6
2021-06-13 13:34:17,https://i.redd.it/3mzt1knoj2571.jpg,"453 Days. You guys have made it easier. If You need any advice, i am at your service. Life is more enjoyable without this garbage!",,43
2021-06-13 13:26:20,https://i.redd.it/l3hiolk9i2571.jpg,"Hey guys! day 94, I lost count actually, I only remeber the day if I open the app.",[deleted],24
2021-06-13 12:26:48,https://www.reddit.com/r/stopsmoking/comments/nz0199/day_14_morning_woods_returns/,Day 14 - Morning woods returns!,[removed],1
2021-06-13 12:03:08,https://www.reddit.com/r/stopsmoking/comments/nyziq1/15_days/,15 days,Over the 2 week hump! Here's to the rest of my life !,19
2021-06-13 12:01:37,https://i.redd.it/ik3j9kk532571.jpg,"Quitting today, how to resist cravings and how long do they last?",,6
2021-06-13 11:53:52,https://www.reddit.com/r/stopsmoking/comments/nyzavi/i_need_help/,I need help.,I can't quit smoking for even a day. Do you guys have any tips that could help?,4
2021-06-13 11:50:12,https://www.reddit.com/r/stopsmoking/comments/nyz80t/quiting_cigeretts_but_i_like_to_smoke_weed/,Quiting cigeretts. But I like to smoke weed,"It's been 6 days now . Nicotine free I feel better  and everything.  Right now I'm far away from my friends.  But I know that when I'll get back . We'll be smoking weed casually. 
The way we smoke it in our country . Is mixing the weed with tobacco.  That's the only way. 

I Dont know if I'm ready to stop getting high .. but I am over smoking cigeretts I think",3
2021-06-13 11:26:15,https://www.reddit.com/r/stopsmoking/comments/nyyp6x/4_days_down_still_going_strong_thanks_to_everyone/,"4 days down! Still going strong thanks to everyone here! You guys honestly make me feel less alone in what I’m trying to do. Just about to start my first CODA meeting, normally in a situation like this I would be chain smoking for my ‘nerves’ but I feel pretty calm and ready for what’s in store!",,12
2021-06-13 11:06:53,https://www.reddit.com/r/stopsmoking/comments/nyya5w/day_23_dreams_of_smoking/,Day 23 - dreams of smoking?,"Hi Everyone! First off thank you all for your posts and comments. It’s a great feeling knowing I’m not alone in this journey and that everyone goes through this process differently. 

I quit cold turkey and last night was my first smoking dream since I quit. I was back visiting people in my home town (haven’t been back since 2019 due to COVID but will be headed back next month for a visit) and was smoking!!

Even in my dream I know it was weird and woke up and my mouth felt kinda yucky so I brushed my teeth and went back to bed. So happy it wasn’t true. 

I am worried going back to where I identify as a smoker may be triggering - any advice?

Thank you!",1
2021-06-13 10:58:04,https://www.reddit.com/r/stopsmoking/comments/nyy35m/100th_day_without_nicotine_im_so_fucking_proud_of/,100th day without nicotine!!!! I'm so fucking proud of myself,"If you're thinking of quitting, DO IT and don't look back. It's the best decision I've ever made for myself. My depression has reduced dramatically. When I was using nicotine I would have depressive episodes that would last for a whole month. Now I rarely have any, and if I do they will last a week max. I am able to pull myself out of them much easier. My anxiety has also reduced dramatically. These results aren't solely because of the absence of nicotine as I have been doing a lot of other work on myself, but it's definitely a huge factor because I am no longer dependent on the drug to help regulate my emotions. Looking back, I can definitely see how nicotine numbed my emotional awareness and stunted my emotional growth.

 I can't wait to make 6 months!! Good luck to everyone on their quitting journey! 💓",281
2021-06-13 10:39:28,https://www.reddit.com/r/stopsmoking/comments/nyxpea/going_cold_turkey/,Going cold turkey.,[deleted],24
2021-06-13 09:59:38,https://www.reddit.com/r/stopsmoking/comments/nywxm8/what_are_some_little_things_you_do_so_you_have/,What are some little things you do so you have something to look forward to throughout the day?,[deleted],2
2021-06-13 09:44:26,https://www.reddit.com/r/stopsmoking/comments/nywmwn/hyperactive_colon_when_quitting/,Hyperactive colon when quitting,"Hello people I've been smoking for about one year, and quit about 7 years ago started smoking during covid due to stress. I don't really have cigarette cravings or an addictive personality. I was on day 4 of no cigarettes and my large intestine becomes overactive. I get extremely bloated, I have diarrhea about every 30mins to an hour. I already have underlying stomach issues such as IBS the spastic colon gets so bad I almost shit my self onto work  and literally couldn't be outside  unless a bathroom was close by. I can't lower my cigarette usage I'm an all or nothing kind of person if I have one cigarette I have to keep smoking throughout the day. I smoke about 10 cigarettes a day.  I wanted to know if anyone had any experiences or remedies for the upset gut during the withdrawal period.  I've quit for up to 3 weeks and my symptoms haven't subsided until I smoke a few cigarettes",2
2021-06-13 08:16:10,https://www.reddit.com/r/stopsmoking/comments/nyv1sv/1_month_no_nicotine_cravings_are_gone_life_is/,"1 month No nicotine, cravings are gone, life is looking up :)","Quit smoking 3 years ago, quit NRT gum that I was chewing like candy a month ago. Shout out to everyone on this forum, all the up voters, and in particular: @u/ibwk
u/Magrathea65
u/Rhymynshmymyn
u/Jiyankee2
u/Vadimevelson

Its been hard and I've had to take a good long look in the mirror and confront my demons. Nicotine helped suppress them and my anxieties and giving it up, I almost lost touch with reality a couple of times as they threatened to overwhelm me and I felt very depressed.  I realised I don't want to take a substance to make myself feel calm or to avoid having confront my problems anymore and live with myself, and as a result I've had several epitomes. I catch myself consciously doing things I've subconsciously been aware of... And I've had several 'hang on why the fuck am I thinking like that /doing that?? That's not helping! That's not productive or constructive and it ain't gonna help at all! ""

I feel stronger and I can hang out with smokers without wanting a cig. I feel calmer in myself and my mind isn't so up and down. By confronting my problems and worries I'm actually dealing with them and realising they don't eclipse everything. I'm not in emergency mode anymore and can actually enjoy time off.

Will continue to post here, as this forum is a lifeline. If you're thinking of stopping smoking, give it up and do your best. Use NRT if you want to but don't feel you're a lesser person because of that. If it's right for you, leave that crutch behind just like you left cigarettes.

Give it your all, break the hold on you, give up the crutch you don't need.

Take care all.",30
2021-06-13 07:21:28,https://www.reddit.com/r/stopsmoking/comments/nyu857/what_kind_of_timeline_happens_on_the_patch/,What kind of timeline happens on the patch?,"I’m on the 14mg patch 1 day and 7 hours in and I’ve downloaded a quit smoking app that marks key points like taste and smell come back. Well if I’m on the patch do any of these milestones apply since I’m still getting nicotine? Do these things like energy levels, circulation, etc just remain the same until I’m completely nicotine free? Also, am I just going to encounter withdrawal once I remove the patch for good? I tried to search for these answers but couldn’t find anything. Also, I’ve been smoking for almost 16 years half a pack a day but for a few years in my 20s I would smoke a whole pack. But it’s usually always (usually always doesn’t sound right) been a half pack or less.",2
2021-06-13 05:29:55,https://i.redd.it/8y5h02i950571.png,Day 8 Done!,,20
2021-06-13 04:47:32,https://www.reddit.com/r/stopsmoking/comments/nys5si/the_grump/,The grump!!!,Omg the anger and frustration and stress and grumpiness of quitting !!!! 😫😫 The worst. My flatmate has friends over and normally I would enjoy hanging out with them and tonight I just want to kill them all haha ugggghhh . This too shall pass .... right???,5
2021-06-13 04:39:42,https://www.reddit.com/r/stopsmoking/comments/nys23u/how_do_i_break_a_bad_habit/,How do I break a bad habit?,"  

**How do I break a bad habit?** 

**What is a bad habit?**  

Let’s understand this with the simple human behavior that the things we love the most we try to stay with them and the things we hate the most we try to stay away from them. A habit is our love and temptation for something, which could be food, alcohol, smoking, gaming, and so on. Sometimes, it becomes a part of our lives that we are compelled by our brains to do it, even if we try to resist it.

So, when you are trying to resist, but you are compelled by your brain after doing that thing, if you feel angry or unhappy about it, you may simply call it a bad habit. You get into a vicious circle & keep trying to break that habit, the more you try to break it, the more compulsive it becomes to you.

You may continue to stay engaged in bad habits for a long time, and it continues to make you less confident. The repercussions are not just limits to making you less confident, but it also leaves a negative impact on your personality, and there are many more negative aspects to this. 

Bad habits make you susceptible to a variety of diseases. Sometimes your family life also gets disturbed by your bad habits. Your outlook on life becomes negative, and your efforts to achieve something are futile.

**How does a habit start?** 

Let’s understand this basic concept of how a habit is formed. The first time you drink, smoke, or play a game that makes you feel happy from the inside, or you may feel good about it. That creates a certain impact on your brain, and the urge comes to do it again. The next time the urge to do it will not be that compelling, but a continuous engagement in a bad habit puts you into a vicious circle.

I began smoking because ""a cigarette in my hand was like feeling like a man” and alcohol gave me a similar feeling. I used to smoke about two packets of cigarettes a day and about half a bottle of whiskey.

The intention behind drinking alcohol was to entertain or reward myself and to feel relaxed, but it quickly became a solid, bad habit for me.

I continued doing that for almost 15 years, but I always wanted to break the vicious circle. I searched the internet & found a few ideas like ""Stay Away from Temptations that Help Feed Your Addiction or Bad Habits.”. The problem is that if you try to stay away from it, it becomes more tempting and compelling to you.

**One day, I finally got a trick to quit my bad habits. The idea came to me in a simple way that if you start hating something, you will automatically get rid of it through the brain**, but it will still compel you to continue doing that. The habit was never formed in a day, and you also cannot get rid of it in a day. 

So I didn't quit smoking in a single day; it took continuous effort to break the vicious circle. Whenever I felt the urge to smoke, I would smoke, but instead of smoking the entire cigarette, I would take one or two puffs and then throw away the cigarette with hatred. Within a month’s time the habit came down to six cigarettes a day. In two months, the urge came down to one cigarette a day. Finally, two cigarettes a week and then one cigarette a week, and now there was no urge to smoke left.

Eventually, I was able to break the vicious circle. The urge for alcohol was also reduced during this period. I still drink about two to three pegs of 60 ml of alcohol twice a week, and it’s not compelling. I do it by choice now. Also, sometimes I don’t drink for 10 to 15 days. 

Break the vicious circle and start loving your life.",9
2021-06-13 04:23:48,https://www.reddit.com/r/stopsmoking/comments/nyrujz/deleted_by_user/,[deleted by user],[removed],24
2021-06-13 04:08:15,https://www.reddit.com/r/stopsmoking/comments/nyrnec/just_completed_my_third_day/,Just completed my third day.,"I quit June 10th. I'm using the 21mg patch and an occasional nicotine lozenge. So far everything tastes and smells funny and my head feels like it's in a swimming pool. I've brushed my teeth three times a day trying to get rid of the nasty smoke taste. I've only had one super strong episode where I wanted a cigarette so bad that I almost caved. I need help finding a new coping skill. Don Johnson used a toothbrush, Matt Damon used hypnosis, Jennifer Aniston used yoga. I need something with my hands and mouth, but my imagination is limited. Anyone have ideas or suggestions?",14
2021-06-13 04:03:57,https://i.redd.it/89we7ikxpz471.png,C'Mon!,,15
