Date,URL,Title,Body,Score
2022-01-16 14:17:02,https://www.reddit.com/r/stopsmoking/comments/s5j4nm/fell_sick/,fell sick,"i have smoked an average of 6 cigarettes a day since i was 19. apart from a heavy/dry feeling in the chest in the mornings and an occasional blocked nose,  ive never felt affected by the habit until last week.  
Last week i caught a viral infection from a friend, i even managed to give it to my brother before i realised i had it/symptoms started showing. this wasn't covid. god forbid i ever catch that.   
id like to think i am a person with decent immunity and stamina and even pride myself for it. ive refrained taking medicine , not even a Calpol since i can remember. But this bug had me beat. Even as the people around me recovered, i felt really really sick and reckoned it was the daily smoking for the past 10 years that had me this crushed.  
my being sick has come as a blessing in disguise really, as cigarettes taste really bad now that i have infected sinuses. i have discarded my ashtrays and lighters for good measure.   
the withdrawals aren't significant but lessons are being learnt. my weakness for the craving was obvious. but im learning/managing ways on how to overcome the craving and my weaknesses thereof. 

i sometimes satiate my ache for a drag by pretending to draw smoke from an  imaginary cigarette between my fingers. 

im glad for this forum and the people on it. thanks",9
2022-01-16 14:10:17,https://www.reddit.com/r/stopsmoking/comments/s5iywv/after_2_weeks_of_not_smoking_i_took_a_drag_and/,"After 2 weeks of not smoking, I took a drag and felt disgusting.",[deleted],12
2022-01-16 14:04:25,https://www.reddit.com/r/stopsmoking/comments/s5iu2n/finished_my_second_day/,Finished my second day.,At the end of my second day was a little hard...I had a good fight with my boyfriend...I wa thinking a lot about smoking...let's go to the third day.Hope I will make it.,14
2022-01-16 14:03:29,https://i.redd.it/wuj0kdpel3c81.jpg,"6 years today, smoke free!!",,153
2022-01-16 12:38:17,https://www.reddit.com/r/stopsmoking/comments/s5gxgu/i_quit_smoking_but_not_before_quitting_coffee/,"I quit smoking, but not before quitting coffee.","As the title suggest these two had to be dealt with together. As silly as this sounds. When I would smoke I would do so with my coffee, and this went on for years. I had attempted to quit several times only to get major cravings when i drank coffee, rightfully so. The day came when I realized that both the coffee and smoking occupied a place in my mind and were triggering me. 

When l finally ended both. The following happened. On February 3rd, after 32 years of smoking, I began to exercise -walking, taste food, breathe easier, sleep deeper, dreams returned, circulation improved, stronger and longer wood (oh wife definitely noticed), lost weight, looking younger, no more pausing and delaying others - get up and go, accomplishing more, enjoying life more. 

Do I get the urge to smoke here and there you betcha’! I accepted the terms and conditions that it’s okay to feel this way, in fact I expected as a normal part of ending smoking. 

Your bodies are very dynamic and it will heal. Life is better on the other side. Health is wealth. As hard as it may seem, and it will be challenging at first, you can do it! I have every bit of faith and confidence in you. Grab the bull by the horns and stick it into the ground. Look forward to your success stories.",19
2022-01-16 12:05:43,https://www.reddit.com/r/stopsmoking/comments/s5g7bu/after_two_weeks_i_had_one_last_night/,After two weeks I had one last night,[deleted],5
2022-01-16 11:08:14,https://www.reddit.com/r/stopsmoking/comments/s5eygy/i_got_back_up/,I Got Back Up!!!,"At the time I was 11 days in and on day two of a craving that wouldn't quit. I looked for any excuse to light up and then I did. I felt instant regret and when my husband said ""I won't tell if you don't"" I felt shame. I honestly thought about lying to myself and acting like that had never happened but then what would I say about the ones that followed during day?

I held myself accountable and reset my clock and now I am three days into another attempt. Hopefully there won't be any more relapsing but if there is I won't let it stop me from getting back up and trying again. 

Stay strong my fellow quitters!",11
2022-01-16 10:14:23,https://www.reddit.com/gallery/s5duy0,Found these 5 cigs laying on the ground with a lighter 3 weeks ago. Flushed them out in the toilet today. Did not have any urges for a year before I brought those home. Glad I am still 1.3 years smokefree. Damn today was hard though.,,67
2022-01-16 09:39:21,https://www.reddit.com/r/stopsmoking/comments/s5d6qj/so_ive_finally_decided_to_quit/,So I've finally decided to quit,My mom found out that I was smoking daily  and really gave me an earful to say the least. My friend I smoke with also decided to quit with me. I haven't smoked since day before yesterday. How do I keep my dopamine levels up?  I've been binge watching stuff for the past 2 days and I haven't got any cravings yet. Yet I can feel that my body is missing something but I can handle that sensation. I'm thinking of playing videogames to keep me occupied. I am kinda afraid to go out of the house tbh. I am very weak willed and that might be a problem. However I assure you all and myself that I'll try my best this time. Best I've done so far was three months back when Covid began.,13
2022-01-16 09:38:29,https://www.reddit.com/r/stopsmoking/comments/s5d67c/stopping_smoking_was_easy_its_maintaining_it/,Stopping smoking was easy - it's maintaining it that's hard!,"Haven't smoked in 47 hours, which is just insane for me. Had a revelation two days ago after months of deliberations and just did it. First 24 hours weren't even the hardest- it's now! Broke the habit, but the thought processes are creeping back. 

I'm nearly three months off the drink with no relapses and thought stopping smoking would be a breeze in comparison - it's not. Probably because there's absolutely no point to smoking, it's not like it gets you drunk or makes you unable to function. 

What are everyone's tips for times like this when that voice is saying ""just one won't hurt - no one will know"". How do you keep busy? How do you distract yourself?

I've thrown out my tobacco, skins and filters, trying to keep busy/ take it 10 mins at a time/ reassuring the counter-voice that's saying ""there's no point"" and ""you've gotten this far"". 

Coming onto this sub and reading everything from all of you is an absolute godsend, so I wanted to thank you all for creating and maintaining this community",36
2022-01-16 08:58:48,https://www.reddit.com/r/stopsmoking/comments/s5cev9/i_miss_smoking_sort_of/,"I miss smoking, sort of.","Hi everyone!

I've been smoke free for 15 days and 12 hours, the longest time since I started smoking in summer of 2016. I've been 14 at the time and so smoking became intertwined with my ""grown-up"" social life - parties, going out etc. And honestly, I just miss it. I miss having a cigarette in a cafe in the city center on a summer morning. I miss going out for a smoke after taking a first shot at a party. I miss smoking while chatting with my friends. I also miss stopping on a roadtrip to smoke one, or while being on a walk. I miss the thrill of getting them while being underage. I miss making new friends while going out for a smoke at a party or in a new environment. I miss having one while coming back home after a long night out.

I actually don't miss smoking cigarettes at home that much - I can totally live without it. I spend less money and don't smell like an ashtray. But boy oh boy do I miss the social aspect of them. Having great memories that include smoking and nostalgia kicking in doesn't help a bit.

Sorry for my little rant I wanted to share it with somebody.",37
2022-01-16 08:40:14,https://www.reddit.com/r/stopsmoking/comments/s5c32m/quitting_today_discord_group/,Quitting today: discord group?,Last time I attempted a quit someone on here suggested a discord chat with others that were quitting around the same time and I found it really helpful to be able to check in and chat with others! Was wondering if anyone would be interested in that if I set one up?,2
2022-01-16 05:03:58,https://www.reddit.com/r/stopsmoking/comments/s58qnz/how_do_you_deal_with_smoking_neighbors_who_dont/,how do you deal with smoking neighbors who don't listen?,[removed],0
2022-01-16 04:56:11,https://www.reddit.com/r/stopsmoking/comments/s58mfr/its_been_5_days/,It’s been 5 days.,"Made it up to 5 days. I beat it finally. I’m done with it I don’t have any urges neither I miss anything I’m good mentally, physically and emotionally as well. I completely forgot how it feels. 

Funny thing is just this subreddits keeps mentioning me. whenever I scroll and saw some post in this sub I remember whoa I don’t smoke now. Otherwise its just like normal days.",8
2022-01-16 04:43:34,https://www.reddit.com/r/stopsmoking/comments/s58g94/i_reached_45_days/,I reached 45 days,[removed],1
2022-01-16 04:12:02,https://vm.tiktok.com/TTPdr6AVSm/,A reminder for tomorrow when I’m sober 🤨 sober me gonna be mad 😂,[deleted],1
2022-01-16 03:24:27,https://www.reddit.com/r/stopsmoking/comments/s57bp8/quit_smoking_today/,Quit smoking today,I’ve been trying to quit for the last 2 years I managed one year after going cold turkey and then ended up smoking again after a few parties. I’m determined that this time will be the last time I ever smoke I’ve decided to go for patches to help me through the first weeks in the hope my mood swings will be better. Good luck to everyone quitting today!,11
2022-01-16 03:21:02,https://www.reddit.com/r/stopsmoking/comments/s579wm/relapse/,Relapse,[deleted],1
2022-01-16 03:07:11,https://www.reddit.com/r/stopsmoking/comments/s572p1/daily_checkin_16_jan_22_no_smoking_today_pledge/,"DAILY CHECK-IN (16 JAN 22) ""NO SMOKING TODAY"" PLEDGE",Lets pledge to not smoke today i.e.next 24hrs or till next check-in. We can do it.,67
2022-01-16 01:30:15,https://www.reddit.com/r/stopsmoking/comments/s55li3/experiencing_painful_marijuana_withdrawals_hunger/,"Experiencing painful marijuana withdrawals. Hunger pain, diarrhea & nausea for the last 1-2 weeks.",[deleted],1
2022-01-15 23:13:18,https://www.reddit.com/r/stopsmoking/comments/s536ip/i_had_16_days_and_then_bought_a_pack_after_a/,I had 16 days and then bought a pack after a devastating marriage counseling session where we decided to divorce. It was the longest I had quit since being pregnant!,[deleted],24
2022-01-15 21:33:55,https://i.redd.it/31nszdwuoyb81.jpg,Lets Go ! thoroughly determined,,20
2022-01-15 21:29:50,https://i.redd.it/jpg62nh4oyb81.jpg,officially 1 week free of cigarettes!!! the longest I've gone in over 4 years 💪🏻,,125
2022-01-15 21:22:49,https://www.reddit.com/r/stopsmoking/comments/s51162/any_long_time_nrt_users/,Any long time NRT users?,"For all you guys doing cold turkey, good for you, keep up with it. I don't need to hear rn how it is the best thing ever.

I have been on transdermal patches for about three months now. Started with 21mg 3 weeks, 14mg 6 weeks, 7mg 6 weeks and now I have a stash of about 5 more weeks of 7mg, currently on them. I think I am probably gonna get a different brand that offers cuttable and go to 4mg from there. I also have a bunch of gum but I take a 1mg gum maybe every third day or so. 

My psychiatrist was the one who advised prolonging nrt, that is why step 2 was 6 weeks from the start. After having these three months smoke free I can see myself just being on the patch forever. I have had a crazy amount of stress. I am about to pass the first semester of my masters in a field that is new to me, in my second foreign language. I've managed to reframe my thinking in other areas too. I took a fake sick leave for a week first time in my life (I am in Europe) and just studied and applied for other jobs. I got an easier better paid one and I passed that exam. I am going to therapy too, first time ever I can afford it (it is online with someone from my home country). So many intensive positive or negative, but all of those experiences without a cigarette. Husband supports me 100% but a lot of people are like you do cold turkey or nothing, you are just gonna start doing it again, you are just lying to yourself. Etc

I have been trying to quit constantly every few months i think about 4 years now. I hate myself when I smoke. Hell, I hate myself even with no nicotine cravings pretty often too, but I am still here.",6
2022-01-15 21:15:07,https://www.reddit.com/r/stopsmoking/comments/s50voy/i_dont_want_to_alienate_the_dudes_here_but_good/,"I don't want to alienate the dudes here but good God! My first period of my quit and I could scream. In fact, I did a little. Hanging tough. 1 week 5 days, I will not crack!",,90
2022-01-15 19:36:07,https://www.reddit.com/r/stopsmoking/comments/s4yvyw/i_threw_my_vape_pen_and_75_full_30mg_salt_nic/,I threw my vape pen and 75% full 30mg salt nic bottle away.,[deleted],5
2022-01-15 18:25:50,https://www.reddit.com/r/stopsmoking/comments/s4xe7i/day_one/,Day one. 🙏,"I would like to say that I am committed to the decision to stop smoking. Today, January 15th, I will smoke my last cigarette. I am a 27 years old(m) and I have smoked an average of two packs of cigarettes a day since I was fifteen years old. I've tried to quit before, but I couldn't go more than a fifteen days without smoking, this time I made a list of what I did wrong in this periods of abstinence and what I can do to be successful. Everyone knows the harmful effects of cigarettes, which are many. I can't find any benefits other than the false sense of cure for anxiety. I'm on my fifteenth day without drinking, I have problems with alcohol too and that was getting in the way when I tried to quit smoking in the last attempts, after a while I felt confident and went out to drink, I always ended up buying a pack and going back to smoking. I won't make the same mistake again. I would like to say that I set my quitting date for two hours from now, which is the time I go to sleep, tomorrow when I wake up I will be 8 hours without smoking. Wish me strength, I don't want anything else with this damn addiction, I want it out of my life now.",22
2022-01-15 18:24:29,https://www.reddit.com/r/stopsmoking/comments/s4xd5v/relapse/,Relapse,"Got to week 3, was feeling depressed and rather than reaching out to people in my life I justified smoking ""just one"" so I could wallow outside like I used to alone with my thoughts. Ended up chain smoking 6 in quick succession before I threw out the pack.  Didn't improve my mood, if anything just added some guilt into the mix and a sore throat.  

Owned up to the people in my life and they helped me realize smoking more isn't going to make me feel any better, and they'll support me, even with this slip up. My mistake was not talking to them before I smoked, or posting here for help.  

So, I'm feeling like a bit of an idiot, but I'm resetting my timer so I don't attempt to justify more slips, or postpone quitting.  Hopefully won't experience all the withdrawal symptoms again.  

Day 1. I will not smoke with you today.",16
2022-01-15 17:44:37,https://www.reddit.com/r/stopsmoking/comments/s4whfs/what_can_help_me_want_to_stop_again/,What can help me “want” to stop again?,"I tried quitting too many times and I my best steak is something around 3 months.
4 months ago I quit for a whole month and couple of days..
I can happily say that I learned a lot from every reset, and my main conclusion was of course, -Never smoke the only one after you quit thing-

Unfortunately I’m now at a point that I’m actually finding myself “love” to smoke and really find it a kind of “great” thing to wake up for..

I’m really into gym and sport now and I even lost some pounds!

1) I’m afraid that it will make me gain weight (I know it’s dumb?)

2) I tried quitting talking Wellbutrine AKA Zyban - and it did help me hate the taste of the cigs but I wanted to keep enjoy so I stopped talking it. (Another dumb thing to do I know)

3) Please let me know what helped you break the habit even though you still liked it.. because In the last time I stopped it was mainly because I didn’t enjoy it anymore..

Thanks a lot for reading and helping guys ❤️",5
2022-01-15 17:41:10,https://www.reddit.com/r/stopsmoking/comments/s4weq3/i_was_prepared_for_cravings_i_was_not_prepared/,"I was prepared for cravings, I was not prepared for this mental game","So I tried to do it right this time, set a date & made a plan. I read of ton of information about the quit period, made lists of distraction tasks, rewards, etc. Got really good and ready yesterday, wrote out a whole new morning routine, got rid of all my smokes, and ""quit"" before bed last night so I would wake up already with 8+ hours under my belt this morning. 

I knew skipping the first smoke would be hard. I expected cravings, mood swings, headaches, whatever. 

But I expected that cravings would be identifiable as cravings? Like all of the advice I've read is that a craving will pass after some time, you just gotta get through it. I was ready for that, but it didn't happen. 

What did happen was that I couldn't think about anything else. At all. I wasn't prepared for the constant, unending mental current of wanting a smoke. I didn't have cravings that passed, physical urges, any of that. Just an unrelenting stream of thinking about smoking. Going through my distractions list was no different than just sitting and staring at the wall - it never went away. Even when I grabbed an old vape out of frustration and got a nicotine fix, it barely helped, which seemed counterintuitive to me. 

I caved at around 5. I'm calling it a lapse and still considering this day 1 of my quit and not beating myself up over it, though I am of course disappointed. 

Any advice for me for tomorrow? Did anyone else experience a 24/7 ""craving"" for the first day, or first few days, and how did you get through it? 

I'm still considering this a win, I was one of those smokers who lit up within 5 minutes of waking up, so making it a full 19h without a smoke is am accomplishment as far as I'm concerned. But I could use some advice for tomorrow.",38
2022-01-15 16:58:22,https://i.redd.it/gm3g8iyobxb81.jpg,Whoop🤗🤗🤗so happy I did it.Never thought I can do it.,,24
2022-01-15 16:47:55,https://www.reddit.com/r/stopsmoking/comments/s4v73k/libido_changes/,Libido Changes,"Hi all, I am a 17 year old male. For a few months I semi-regularly vaped (around friends/gf/multiple times a week) and I noticed it really destroyed my libido. I quit a little over a week ago and I still have absolutely 0 sex drive. I went from masturbating 2-3 times a day to maybe 1 time every 10 days. I only get an erection with stimulation and I have no desire. Is this normal, and roughly how long does it take to return? I’ve seen people saying theirs returned in 2-3 days but I haven’t had that experience sadly. It’s made me feel like I am asexual or something and I hate it.",3
2022-01-15 16:31:45,https://www.reddit.com/r/stopsmoking/comments/s4uubc/nicolette_quickmist/,Nicolette quickmist,,0
2022-01-15 16:09:24,https://www.reddit.com/r/stopsmoking/comments/s4ucc4/quit_6_months_ago/,Quit 6 months ago,"Hi guys! I quit 6 months ago today, after 10+ years of smoking so I thought I'd share my thoughts with you, fellow quitters. There are still some difficult days, but it was sooo worth it! My favorite part of not smoking: I don't have to spend time in the lines of tobacco shops every time I head somewhere, like partying or meeting up with friends anymore. I'm also very proud of all of you and this group still helps me a lot :) Keep up the good work! (+ Greetings from Hungary!)",36
2022-01-15 15:21:40,https://www.reddit.com/r/stopsmoking/comments/s4t9dk/dry_eyes/,Dry Eyes?,"On Day 16 of no smoking, and I get its winter but I have never in my life suffered from this dryness feeling! I wear contacts and literally my eyes feel so tired and dry even in the morning. Does anyone else have this issue? I find it difficult to believe smoking “helped” me have moisturized eyes lol, but this is one of the adverse side effects since I stopped I can’t explain. I feel like my vision is slightly blurred too. Maybe it’s part of the “brain fog” I hear everywhere talk about, but the eye dryness has gone on at least 8 days now. Thanks for any feedback!",3
2022-01-15 15:03:14,https://www.reddit.com/r/stopsmoking/comments/s4supp/mouth_ulcers/,Mouth ulcers,"It's been about 3 weeks since I quit and I don't seem to have any physical or mental cravings. 
However, everytime I quit, around the 2 week mark, I get these painful ulcers in my mouth. I find these to be the hardest to ignore. They constantly remind me that just one cigarette will make all this pain go away. 
I've slipped here many times in the past. Hopefully, I'll get past this hurdle this time.",3
2022-01-15 14:40:37,https://www.reddit.com/r/stopsmoking/comments/s4sc3b/changing_my_environment_saved_me/,Changing my environment saved me,[deleted],12
2022-01-15 14:23:33,https://www.reddit.com/r/stopsmoking/comments/s4rygk/why_do_i_get_the_hiccups_when_i_take_a_drag_of_a/,Why do I get the hiccups when I take a drag of a cigarette?,"It mostly happens when I smoke outside in the cold, so I'm thinking it might be a muscle spasm because of temperature difference?",3
2022-01-15 13:14:59,https://www.reddit.com/r/stopsmoking/comments/s4qeiu/day_13_no_craving_to_smoke_when_i_first_woke_up/,Day 13 : No craving to smoke when I first woke up.,"Took a couple of hours, woo hoo! What small victory are you celebrating today?",62
2022-01-15 12:24:11,https://www.reddit.com/r/stopsmoking/comments/s4p8zh/close_to_3_months/,Close to 3 Months!!!!!!,Hey guys I'm somewhere around like 2 1/2 months now and feel so great. It's honestly funny thinking back to how bizarre I felt during the 1-2 month. Just goes to show how crazy this drug is. Never picking up cigs or vapes again. Potentially cigars for celebratory occasions but thats it. If I did it y'all can too!!!! keep going!!,24
2022-01-15 11:48:55,https://www.reddit.com/r/stopsmoking/comments/s4ofy0/sovereign_dual_uk_hollowed_filter_tips_and_other/,Sovereign Dual (UK) hollowed filter tips -and other dirty marketing tricks,[deleted],0
2022-01-15 10:51:28,https://www.reddit.com/r/stopsmoking/comments/s4n6cy/first_day_completed/,First day completed,First was ok only when I wake up I was looking like crazy for cigarettes.Lets see what is coming in the second day smoke free.,2
2022-01-15 09:33:59,https://www.reddit.com/r/stopsmoking/comments/s4lko2/dumped_after_quitting/,Dumped after quitting,"I was dumped pretty brutally and out of the blue about a month after quitting smoking. Don’t know how I’ve made it this far but I still have not smoked. How can I get through this without my vice? Never had a drinking problem, but I can’t even really go out because any social drinking would lead to smoking.

So far it’s been three months since I quit. The relationship was 5 years. Ironically, he never liked smoking so dumping me when I finally quit is the icing on the cake.

I’m done with the guy, but how do I move forward with my life without anything to look forward to in a day? Covid has made life even more miserable than necessary, at least it was something to do.",24
2022-01-15 08:30:17,https://www.reddit.com/r/stopsmoking/comments/s4kczn/freedom/,Freedom,[deleted],16
2022-01-15 08:17:30,https://www.reddit.com/r/stopsmoking/comments/s4k4x7/cravings_are_so_awful_today/,Cravings are so awful today!,"So I’m at my mums house for the weekend, and she and my step father smoke. I thought “if I can go over there and not smoke, it’ll be a huge triumphant success for me!” And the first day here, the craving for it wasn’t bad, my parents always made sure I wasn’t near when they lit one up etc. But I’m finding myself wandering and standing near the cigarettes and the back door, just craving them. I’m restless and irritable. It’s getting to the point where I’m about to throw a literal hissy fit like a 5 year old because I can’t have one lmao! 
Long story short, I’ve decided to remove myself from the situation and go back home today so the temptation isn’t there anymore, and have decided to pick up a no nicotine disposable vape to help with the “hand to mouth” action that I’m very much missing! Anyway, this was just a little rant about my craving and moodiness, and to let everyone know that you can keep pushing through no matter what!",11
2022-01-15 06:35:38,https://www.reddit.com/r/stopsmoking/comments/s4ii8o/daily_checkin_15_jan_22_no_smoking_today_pledge/,"DAILY CHECK-IN (15 JAN 22) ""NO SMOKING TODAY"" PLEDGE",Lets pledge to not smoke today i.e.next 24hrs or till next check-in. We can do it.,55
