,Date,URL,Title,Body,Score,COVID-19 Mentions
323,2021-11-15 11:38:43,https://www.reddit.com/r/stopsmoking/comments/qukhg8/a_week_complete/,A Week Complete!,"Hey everyone. I made it 7 whole days with no nicotine whatsoever. It was very difficult and I made an ass out of myself more than a few times last week, but I am going to continue nicotine free for as long as I can. I would like to never use it again the rest of my life and I plan not to.

This community was a HUGE support over the last week and will continue to be as I experience cravings. I believe I am over the worst of the withdrawal now. To anyone in their first few days, **JUST STICK IT OUT NO MATTER WHAT!!!** it DOES eventually get better I promise.

Thanks so much to everyone who helped me and I hope to give back to this community as I learn more about nicotine addiction recovery.

Much love",42,0
324,2021-11-15 10:44:40,https://www.reddit.com/r/stopsmoking/comments/quj9ze/quitting_tomorrow/,Quitting tomorrow!,"I'm quitting smoking tomorrow, cold turkey. I'm planning on posting a daily update but I don't wanna spam the sub, so I might slap some of it in the comments here. It's a big challenge since i'm a bartender and honestly a lot of people smoke. But I know I can do this, I'm getting older and if I can celebrate being a month off the smokes on my birthday i'll be so happy.",14,0
325,2021-11-15 10:39:16,https://www.reddit.com/r/stopsmoking/comments/quj5uk/quit_day_is_tomorrow/,Quit Day is tomorrow,"Hey everyone! My quit day is set for tomorrow. Posting it here might make me more accountable. Been smoking 17 years, in that time I quit for 7 months early last year. Looking to make that permanent now. Anyone else quitting tomorrow too?  


Wish me luck!",5,0
326,2021-11-15 10:27:48,https://www.reddit.com/r/stopsmoking/comments/quix02/currently_17_and_struggling_heavily_with_nicotine/,Currently 17 and struggling heavily with nicotine.,"I've not even been smoking for a year and this shit is hard to quit.

Each time I try to quit I get extremely stressed and easily agitated, no other symptoms just those ones and that makes it really difficult to quit because I hate being easily agitated or stressed. I feel like I'm in the deep end, all my friends are telling me that I should just accept being a smoker and apparently if you quit cold turkey it can be bad for your health as some of my friends put it. Obviously I've done enough research to know that's complete shit.

Is there anyway at all to deal with the agitation and stress? Like if I could negate those two things from quitting or at least lessen them I reckon I could quit.

Any advice is welcomed and appreciated, have a good day :)",5,0
327,2021-11-15 10:15:59,https://www.reddit.com/r/stopsmoking/comments/quinz0/answering_to_my_younger_self_6_years_ago/,Answering to my younger self 6 years ago!,"6 Years ago:  
""r/stopsmoking•Enviado poru/Gabiruuu [há 6 anos](https://www.reddit.com/r/stopsmoking/comments/3ui0kl/12_days_and_going_out/) \*\*12 days and going out...\*\*

It has been 12 days without smoking. It has been ok. But last days I have been willing to go out for a drink with friends, and I always imagine myself asking a cigarette to someone, and have pleasure smoking it... Will I always be afraid to go out and drink alcohol? Will these wishes go away? I would really love to continue not smoking, but I really would love as well to go out and have fun as I used to.""

Present:

Dear Gabriel,

I can't tell you how proud I am of your 12 days achievement and I cannot thank you enough for your brave decision that affects me too. I feel it on my body and soul!

Let me tell you, 6 years after your 12 days’ post, quit smoking was the best decision you ever made! Answering to your post, nowadays, in the present, you drink alcohol with friends without thinking of going back to smoke, because you have realized that the fun you have with friends does not come from smoking or alcohol, but it comes from friendship. So, keep strong no matter what. And if you fell like crying sometime, do it. It's ok. You can't image how proud you will feel about yourself in 6 years.

6 F\*\*KING YEARS NOT SMOKING!!!! 😃

Thank you for your brave decision, my younger self ❤️",58,0
328,2021-11-15 08:26:25,https://www.reddit.com/r/stopsmoking/comments/qugekf/smoked_since_a_young_teen_want_to_be_done_with_it/,"Smoked since a young teen, want to be done with it before my 20th","Hi guys,

I've been smoking since I was 13, since then, I've smoked cigarettes, used vapours and nicotine pouches in conjunction. Recently I've been cutting down the cigarettes however I'm still using the nicotine pouches and a fair lot of them. 

Long story short I'm hooked, line and sinker, I've not been nicotine free throughout puberty and it's a hardwired habit.

To quit smoking completely (weed too) I've quit my job to allow for the sleep fuckery over the weeks I'm withdrawing from nicotine and look to move to a new town completely free of dependancies.

Any advice for the cold turkey journey? I've tried cutting down and NRTs and it doesn't work at all for me, this is a last option. Any habits I should develop? How do I handle the cravings in a way that doesn't make me want to punch walls 🤣

Thank you,",3,0
329,2021-11-15 07:38:49,https://www.reddit.com/r/stopsmoking/comments/qufi7j/stop_date_101521/,Stop date 10/15/21,"Still doing well. Stumbled on a cig yesterday in a warm jacket I pulled out to wear. Surprised myself by crumpling it up. I did, however, contemplate firing it up.",15,0
330,2021-11-15 06:52:57,https://www.reddit.com/r/stopsmoking/comments/queq9v/quitting_for_animal_welfare/,Quitting for Animal Welfare,"Hi, I'm new to this community.

Maybe the title is misleading or wrong, sorry English is not my first language.

I've been smoking since 2013. I tried quitting a couple months ago but relapsed after 10days. My excuse was stress. My stress management is very poor lately due to the whole covid-19 thing going on. Mandates and everything. I had been diagnosed with GAD before so last 2 years hasn't been very well for me. 

I don't know how I never knew and thought about this before but today I learnt that tobacco products are being tested on animals. I'm a vegetarian trying to go vegan and I rescue animals too, I have cats who are also second hand smokers because of me. 
This information gave me another motivation to quit. At least to try again. I quit meat cold turkey years ago, now I'm hoping to do the same with cigarettes because obviously I care more about animals. For sure this is going to be harder. 

I don't know if this sounds stupid but yes, that's my actual motivation right now.

Do you have any advice? Because the first time I quit cold turkey and couldn't manage.

Thank you!",26,1
331,2021-11-15 06:52:12,https://i.redd.it/eysqojzxzqz71.jpg,I‘m in. Let’s go 😱 First seven hours and I don’t feel like missing something. 👍🏼,,5,0
332,2021-11-15 06:15:13,https://i.redd.it/pdql52ectqz71.jpg,The cravings I'm feeling right now are honestly much more than I felt in the first few days please help I think without it might relapse,,43,0
333,2021-11-15 06:14:25,https://www.reddit.com/r/stopsmoking/comments/que5et/back_to_the_beginning/,Back to the Beginning…,"So I fell off the wagon. Last night I learned that I can’t be in a bar for a few drinks and be strong enough to resist temptation. I’ve reset my quit date and starting afresh today. 

How long did you all avoid trigger situations before it no longer bothered you?

Any words of encouragement or motivation?",1,0
334,2021-11-15 03:22:41,https://www.reddit.com/r/stopsmoking/comments/qubpbe/day_18/,Day 18,"I was out yesterday at one party. I didn’t smoked but so many people at close distance did, that I inhaled massive amounts of passive smoke… It felt very uncomfortable",1,0
335,2021-11-15 02:39:42,https://i.redd.it/4ses4w4wqpz71.jpg,Thanks to this fantastic community,,42,0
336,2021-11-15 02:30:29,https://i.redd.it/n6rcae09ppz71.jpg,2nd attempt this year and feeling great and more confident this time!,,18,0
337,2021-11-15 00:54:38,https://www.reddit.com/r/stopsmoking/comments/qu9glj/alternative_patches/,Alternative Patches,"I am desperate to stop smoking, I've had hypnotherapy and tried the patches. I know I could do it with the patches, the major problem was they made my skin red, inflamed and actually slightly bleeding. Is there an alternative patch for people that experience this reaction to normal patches? I'm 41 with a young family and quitting smoking would change my life in every way, I would get back to training and be more fun with my kids and obviously have so much more spare money. Please,please can someone point me in the direction of patches that wouldn't react with my skin in this way or any other solution?! Please guys, I'm desperate here. BTW seeing all of you that have quit and kept going is absolutely amazing, I want to be part of that experience. I absolutely hate smoking now, I wish they would just ban cigarettes altogether (know it's not going to happen,just an after thought) a big Thank You to anyone who answers this and points me in the right direction,as I've said I'm desperate here guys, I want to see my kids grow up and be healthy while doing so. Thank You for your time.",2,0
338,2021-11-14 23:46:17,https://www.reddit.com/r/stopsmoking/comments/qu8cab/23_h_no_nicotine_bed_time_and_waking_up_are_my/,23 h no nicotine.... bed time and waking up are my too triggers. Really want one.,I guess being down to one a day - (I haven't had any in 23 hours) is ok?  but really trying to just kill the big monster and little monster and Not one more puff....   God it was easier to quit drinking a few years ago than this. ( it's 11:46p in my time zone ),14,0
339,2021-11-14 23:17:05,https://www.reddit.com/r/stopsmoking/comments/qu7u2q/its_been_7_years/,It’s been 7 years.,"7 years since I’ve quit. I walked by someone smoking today and wanted to puke at the smell. I can’t believe I used to smoke so much, and I’m proud of myself for where I’m at. Anyone here who is struggling, you can do this. I believe in you! One day you will walk by someone smoking and have the same thought! If you need to talk, please message me!",27,0
340,2021-11-14 23:14:05,https://www.reddit.com/r/stopsmoking/comments/qu7s3h/i_chipped_week_1_i_blame_it_on_the_drink/,I chipped week 1. I blame it on the drink,"I got to day 8 and knew i was in for a rough one. Been smoking 20 years half pack a day. In my last 30's and finally ready to stop. The first few days were so hard.   
Got invited to a concert, drank to much, smoked.   
Plain and simple. Sat at the counter at the gas station for an uncomfortable amount of time. Then caved.   
I just had 1 and the last 2 days iv been clean.   


My chest hurts. I dont like the feeling anymore but the sad part is no one cares. I just cant go out and drink for a while but who knows when I will finally be ready to enjoy alcohol without smoking.",2,0
341,2021-11-14 20:36:03,https://www.reddit.com/r/stopsmoking/comments/qu4v75/what_do_you_do_to_nurture_your_body_during_your/,What do you do to nurture your body during your healing?,"I plan on working out, having lots of hot tea and snuggles with my sweet little kiddos, healthy crunchy fruit and veggie snacks and anti-inflammatory comfort foods, indulging in sleeping in and maintaining a better skincare routine, maybe a hot bath or two somewhere in there. I have my new multi-vitamins and probiotics ready to go, going to incorporate some hot bone broth, cozy socks and some walks out in the sunshine and fresh air before the weather gets too cold. And a *NAP*. I always use my kids nap time for a smoke even though I could really use a rest myself. I’d really like to finish a book for the first time in ages. 

It’s so nice to give myself permission to do this for myself, I’ve been so ready for so long and I’m taking the leap tomorrow.

What do you do to care for yourself in this journey, especially if you struggle with physical symptoms?",32,0
342,2021-11-14 18:04:40,https://www.reddit.com/r/stopsmoking/comments/qu1ypt/okayim_done/,Okay…I’m done.,"Been smoking since I was 15, now I’m 27 and holy shit I just realized how long it’s been. Last night I smoked two cigarettes back to back, as I usually do and my lungs still feel like someone is sitting on my chest. So fuck it, I’m done. I’m done just slowly killing myself and paying to do so.",7,0
343,2021-11-14 16:33:30,https://i.redd.it/xtktaemqqmz71.png,6 months quit thanks to this sub,,1,0
344,2021-11-14 16:15:44,https://www.reddit.com/r/stopsmoking/comments/qtzo0c/quitting_advice_for_a_new_smoker/,Quitting advice for a new smoker,"Hi everyone, so it's been a month since i started smoking due to boredom and I'm noticing some health issues and I wish to quit soon. I'm not a heavy smoker, my daily average is around 7 cigarettes, but i never exceed 10 cigarettes. Since I'm not that heavy of a smoker, how hard will I experience withdrawal symptoms? That's what I fear most. Thank you.",3,0
345,2021-11-14 16:06:14,https://www.reddit.com/r/stopsmoking/comments/qtzgqx/smoked_hookah_did_i_just_broke_streak_no/,Smoked hookah did I just broke streak? No cigarettes 3 days cold turkey,,4,0
346,2021-11-14 16:02:00,https://www.reddit.com/r/stopsmoking/comments/qtzdh8/any_psychological_benefits_from_quitting/,Any psychological benefits from quitting?,"I struggle with lots of mental issues and I started smoking at 15 to calm me down, I don't smoke that much as I used to, 7 cigarettes TOP if I go out at night, but still. I'm 20 now and I since I'm currently in a very complicated emotional state due to my mental health and the recent loss of a relative due to cancer which made me start thinking about the health part of this issue even tho I don't smoke that much, I'm starting to thinking about quitting. The question is, has anyone here felt some tangible improvement in their mental health since quitting? I'm almost at rock bottom and that's like the last time I haven't tried yet. I've been smoke free for like 2 weeks, 3 months, days, I can do that easily, but I don't remember any positive change caused by it",7,0
347,2021-11-14 15:45:43,https://www.reddit.com/r/stopsmoking/comments/qtz0gu/back_again/,Back again.,Had a horribly depressing weekend where I ended up smoking so much that my chest hurts a great deal today. I'm so sick of this shit. I quit.,17,0
348,2021-11-14 15:05:15,https://www.reddit.com/r/stopsmoking/comments/qty4y3/does_or_has_anyone_else_have_dreams_about_it/,Does or has anyone else have dreams about it?,"I’m at just over a month (10/9/21) clear and the dreams about it are just now slowing down.

The first one I can remember was I went to the store to get a pack, the cashier handed me an arm full of packs and I pushed then back…back and forth then I woke up and searched my house to ensure I didn’t buy anything.

The one this Wednes I went to my car to get something and on the way there one kept showing up lit in my hand. I threw it down, I look back at my hand and there’s another. When it finally stopped, I grabbed something out of my car and on the way back inside another showed up in my hand then I woke up.

I was telling a friend about this and they were basically saying that shows how much of a grip it had/how addictive. Has anyone else had any dreams about it after they quit?",7,0
349,2021-11-14 15:00:58,https://www.reddit.com/r/stopsmoking/comments/qty1cx/does_the_craving_ever_go_away/,Does the craving ever go away?,"I've smoked cigarettes for 10 Years, starting at age 14. So far so bad. Back in 2017, I've managed to stop for 5-ish months before lying to myself ""I can smoke one now, it's been 5 months"" 

This year, I've moved to a different city and started a new job in a completely different field so I thought it would be a chance to try quitting again.

It's 4,5 months now and every evening I'm sitting in my bed arguing and reasoning with myself why it's a bad idea to run to the cigarette machine down the road to get a pack of Pall Malls. 

Does it ever stop? This time I'm aware that ""just one"" is Step 1 and ""20 a day"" is the next Step which will inevitably happen so that's been my ""big argument"" (with myself) not to go out. It's just driving me nuts so much that I  wish to start smoking again just for this constant f**king nagging  to stop.


I really need advice :(",7,0
350,2021-11-14 11:31:54,https://www.reddit.com/r/stopsmoking/comments/qttglg/day_2_cold_turkey_feeling_depressed/,Day 2 cold turkey feeling depressed,Laying on bed and feeling very low is this normal ? I hope  these  withdrawal symptoms will go away soon,13,0
351,2021-11-14 11:22:49,https://www.reddit.com/r/stopsmoking/comments/qtt9iq/quitters_flu_after_two_weeks/,Quitters flu after two weeks?,"I'm at day 15, and woke up sneezing and my nose won't stop running. Otherwise I feel fine.

Can this be the quitters flu even though I'm already 15 days free? Or did I just catch a cold?",6,0
352,2021-11-14 11:12:42,https://www.reddit.com/r/stopsmoking/comments/qtt1u8/prescription_drugs_as_cessation_tools/,Prescription drugs as cessation tools,"I just got to 72 hours!!! Well, actually 73, but who's counting... I quit for a couple of months about 5 years ago with Chantix, so when I decided it was time to try again, I went to the doctor and requested a prescription for Chantix, only to learn that it had been recalled for whatever reason and they couldn't prescribe it anymore. My doctor did recommend Wellbutrin, and so I started that on 10-7. I was under the impression that Wellbutrin was an antidepressant, but apparently it works for this also? Anyway, I guess what I'm wondering is do you think it's possible that depression makes it harder to quit because of constantly telling yourself you're a piece of shit and trying to quit would be a waste of time because you're just going to fail anyway? I think that's been my experience historically. Obviously I'm not a doctor, but I think it's probably worth your time to talk to your doctor about depression if your internal monologue is a verbally abusive asshole. I'm having a bit of a chicken/egg situation with the quitting smoking and hating myself less. Anyway, good luck to all of you and you can do it!!",3,0
353,2021-11-14 11:03:03,https://www.reddit.com/r/stopsmoking/comments/qtsuj4/starting_today_wish_me_luck/,Starting today wish me luck,"I’m currently in the military and find myself extremely stressed and turned to smoking to help focus on the day to day. I’ve tried to quit smoking in the past and I was only able to make it a month before I found myself getting any nicotine fix I could find. So far I know for me I feel extremely agitated and anxious and find it hard to focus. I’ve tried gum, sunflower seeds, rubber bands (snapping them on my wrist when I get the urge) and nothing seems to work; I’m open to suggestions in anyway, but desperately need help!",5,0
354,2021-11-14 11:01:56,https://www.reddit.com/r/stopsmoking/comments/qtstof/day_1_done/,Day 1 done ✅,"Completed my first day with ease had a mild urge  to smok,e but didn't let my mind win . Hopefully will quit this this time.",7,0
355,2021-11-14 11:01:43,https://www.reddit.com/r/stopsmoking/comments/qtsti5/quitting_smoking_through_cessation_advice/,"Quitting smoking through cessation advice, experience of other with medication.","I have been unsuccessfully trying to won't smoking for over a year now. My doctor put me on Wellbutrin last month and the side effects were absolutely horrible I had to stop taking it, sad thing being it was making me not want to smoke. Now my doctor prescribed me Champex but it's been over a week and I haven't taken it. I need reassurance that it won't he as bad as wellbutrin like my doctor said. With studies right now I can't deal with the same kind of side effects I had from Wellbutrin.",1,0
356,2021-11-14 08:21:22,https://i.redd.it/94ekn9yxakz71.jpg,"One day shy of 6 months. It’s really such a disgusting, scary habit. Especially in the time of corona!",,33,1
357,2021-11-14 08:02:34,https://i.redd.it/02wgs27l7kz71.png,Finally 3 Weeks since I quit smoking cold Turkey. Last 2 Days were the Worst. My Nose is swollen due to the Runny Cough. But Feeling Much Better.,,1,0
358,2021-11-14 07:49:01,https://www.reddit.com/r/stopsmoking/comments/qtp5k5/is_it_recommended_not_to_quit_cold_turkey_after/,Is it recommended not to quit cold turkey after 25 years of smoking?,"My mother who is a long-term smoker wanted to quit cold turkey like I did. I was a 4 year smoker though and cold turkey helped way better. Doctor told her not to quit right away, gave her some antibiotics pills for now and smokes like 2-3 cigarettes a day. 

Obviously it's different for her to my case. I'm not a doctor either. Anyone who has been a long-term smoker heard this?",6,0
359,2021-11-14 07:13:13,https://i.redd.it/d76cnt8syjz71.png,Alittle over one year ago I was smoking 2 packs a day and had completely lost the idea that quitting would ever even be an option. My girlfriend really helped me and quit with me. I never would have done it with out her. So stoked I can finally say it's been a year!,,121,0
360,2021-11-14 06:08:58,https://www.reddit.com/r/stopsmoking/comments/qtno2s/so_no_nicotine_ever_even_years_down_the_road/,"so no nicotine ever, even years down the road?","if i say smoke a cigar or take a dip, basically anything besides cigarettes, would nicotine reasonably drive me back to cigarettes, or pick me up and put me back where i was addiction-wise?",13,0
361,2021-11-14 01:46:42,https://www.reddit.com/r/stopsmoking/comments/qtk2ur/may_this_be_the_last_last/,"May this be the last, last.","Occasions come and go, there's never a good time to  start I know. The withdrawals are rough but the personality reboot is incredibly more so. Ive been trynna quit for the last three years but have never made a quit post. I camt tell my friends and family again because I've failed so many times i don't feel like I can ask for support anymore. Not that support helps much - the vapid reassurances only make me want to smoke more because they don't understand the pain being either non or casual smokers. Smokes got me through some rough phases for sure but perhaps if I'd suffered through them I'd be better equipped to deal with tough situations now. I have a week to spend alone with my cats. From our cocoon may some clean lungs and healthy habits emerge.

Thank you all for your stories and advice.",4,0
362,2021-11-13 22:43:21,https://www.reddit.com/r/stopsmoking/comments/qth8ua/alright_lets_go_next_quit_attempt/,alright lets go next quit attempt,relapsed pretty hard and started smoking up to a pack a day after a month and half no smoking but I'm out of cigs and out of patience for the bullshit it causes me.  going on a brief vacation and i am out of cigs.  not going to bring or buy anymore while I'm away.  I'm sick of counting down the hours till work ends so I can get out and smoke and not being able to see my girlfriend because she cant smell cig smoke and worrying about money because I didn't budget for cigs.  i can do this as long as I never quit quitting.,11,0
363,2021-11-13 22:19:30,https://www.reddit.com/r/stopsmoking/comments/qtguse/tomorrow_is_the_day_i_stop_tw_for_mental/,Tomorrow is the day I stop (TW for mental illness/self harm),"I've tried to quit smoking two or three times this year already and failed each time. I started smoking to deal with my suicidal thoughts and anxiety. In a lot of ways it took the place of cutting and felt like a compromise to the suicidal idealization. When my marriage was falling apart I began to smoke every day to deal with it all. 

My divorce is finalized now though. I've been on my medication consistently for about a year and a half. I'm in therapy weekly. And I think it's time to finally confront this. Knowing I've failed repeatedly feels very disheartening and makes me feel a little defeated before even beginning. When I'm having intrusive thoughts, smoking gave me the ability to navigate. But it also took away a lot of my power for managing things myself. So I need to let go of this crutch and work on accepting my mental illness and using techniques from therapy without relying on addiction. I am more then this. 

I'm writing this to all of you because you're where I am or where I want to be. I'm writing this to remind myself I can do it. It's time. I've downloaded a quit smoking app. And I'm scared. Leaving my marriage was hard. I think this will be harder if I'm being honest. But it's time. So tomorrow I'm going to try again and keep trying until I succeed.",6,0
364,2021-11-13 20:53:05,https://www.reddit.com/r/stopsmoking/comments/qtfdg7/day_2_of_no_cigarettes/,Day 2 of no cigarettes!,"Longest I’ve gone in a while.

I’m actually sick and have a really bad congestion and sore throat. 

I’ve been thinking of quitting for a while now and haven’t had the balls to start. This was my perfect opportunity.

I smoked 10 cigarettes this past week which is still crazy low cause I average a pack a day, and my throat wasn’t getting any better. I said fuck it and tossed the pack. Haven’t smoked all day yesterday and all day today. 

This is my chance to ditch this awful addiction. I’m only 23 and have been smoking almost 10 years. Wish me luck!!!",80,0
365,2021-11-13 20:51:44,https://www.reddit.com/r/stopsmoking/comments/qtfcne/zyban/,Zyban,"I’ve been a smoker for 20 yrs and have tried everything from cold turkey to hypnosis, acupuncture, Alan cars quit book,champix - I’m about to start zyban- can anyone give me their experiences?",4,0
