Date,URL,Title,Body,Score
2022-01-24 13:48:00,https://www.reddit.com/r/stopsmoking/comments/sbta6r/day_1/,Day 1,"Hello! I have been vaping nonstop for about 5 years. I recently decided to quit to just overall improve my mental & physical health. Yesterday I only used my vape a few times early in the day and by night time I did not sleep at all, sweated an ungodly amount and was super shaky. Is this normal? I have never tried quitting so I have no clue what withdrawals are like or if I should quit cold turkey or try nicotine gum or something.",2
2022-01-24 13:24:32,https://i.redd.it/c5hvq22rhod81.jpg,Almost 4 full days! Craving are still there and i’m a bit sad that i won’t ever smoke again but this time is for good!,,15
2022-01-24 12:59:05,https://i.imgur.com/fAiYZWs.jpeg,My husband had to stop smoking for 14 days so we're both quitting. Here's hoping it sticks!,,14
2022-01-24 12:35:27,https://i.redd.it/q4q5f3kz8od81.png,"Started smoking a pack a day when I was 20, always thought that when I quit I at least have to not smoke for the same period of time that I smoked. Gonna be 24 soon, let's see if I can keep this up till I'm 28.",[deleted],3
2022-01-24 12:05:12,https://www.reddit.com/r/stopsmoking/comments/sbqvyw/daily_checkin_24_jan_22_no_smoking_today_pledge/,"DAILY CHECK-IN (24 JAN 22) ""NO SMOKING TODAY"" PLEDGE","Lets pledge to not smoke today i.e.next 24hrs or till next check-in. We can do it.

P.S. Sorry for delay.",45
2022-01-24 11:56:39,https://i.redd.it/lcy8hum22od81.jpg,One week down!,,47
2022-01-24 11:52:05,https://i.redd.it/9iuqwy691od81.jpg,"Missed the mark about 6 days.. well, here we go…",,48
2022-01-24 11:35:15,https://www.reddit.com/r/stopsmoking/comments/sbq721/39_days_away/,39 days away,From 1 year without a cigarette!!!,5
2022-01-24 11:28:32,https://www.reddit.com/r/stopsmoking/comments/sbq1os/day_six/,Day Six,"I made it through yesterday without smoking!!! Thank you to everyone who responded to my post and everyone’s else post - it really helped me through!!!!

I am not smoking today. I don’t want to do this again… and that’s what I said last year when I stopped smoking for after a year. But I’m hard headed and like to learn stuff twice I guess. I am going to try and take some peoples advice and try not to use the NRT mints today and see if that actually helps decrease my cravings.

Who else is not going to smoke with me today?!??!",5
2022-01-24 11:03:07,https://www.reddit.com/r/stopsmoking/comments/sbph2g/anyone_get_sick_after_quitting/,Anyone get sick after quitting?,"I’ve been feeling off for a few weeks which is why i quit. The smokers cough was gross and I started experiencing some hypochondria. Hypochondriacs should not be smokers. That said, I’m on day 8 now. I haven’t had cravings as bad as I thought I would. I’m feeling better over all, like my sense of smell and taste is coming back, I can breathe easier, I have notably more energy, but I was having a burning and inflamed sensation in my chest, throat and back of nose all last week; and today I feel like I got hit with the flu. Exhausted, chest is tight, slight fever, my nose was stuffy yesterday. Did a saline netti pot flush which helped clear it this morning, but just feeling gross. Anyone else get sick after their quit? On the bright side, the symptoms are making it a lot easier to not think about smoking",14
2022-01-24 10:11:03,https://www.reddit.com/r/stopsmoking/comments/sboc5a/one_year_i_almost_missed_it/,One year! I almost missed it.,"I just reached one year of smokefreeness (this is a word now) today. Honestly, i almost missed it. It feels like less of an archivement than day 10 or day 100 because i almost never think about smoking for a while now. 

Back at day 10 or even at day 100 I was constantly thinking about it. 

Sure, if i drink with friends and some smoke i get a small urge but not even those moments bring me anywhere close to giving in anymore - they used to do for months. 

20 years of smoking, thousand of Euros and tens of thousands of cigarettes. What a waste. I'm glad im done with it. 

I'm looking forward to entirely forgetting about the 2 year mark.",20
2022-01-24 09:55:34,https://www.reddit.com/r/stopsmoking/comments/sbo075/i_declare_peace_on_my_body/,I declare peace on my body,"I have been a regular smoker for around 3 years now. Two years since I fully enjoyed smoking. Ever since I get health anxiety, I'm 27 I should be at my physical peak but I'm not. I have terrible health anxiety. Everytime I'm short of breath or feel my blood pressure rise I think ""now you've done it, you fucked yourself. 

I started smoking due to my ex being a smoker. She left a pack at my house and I decided to have one on my own for the first time. Followed by buying my own pack for the first time and that soon followed to me being dependant on this shit. I miss feeling good.

I was at a low point back then but I'm at a good point in my life right now except for smoking. I had a lung check recently and Doctor said I'm fine and I instantly started weeping. I'm done being at war with myself. I fucking hate cigarretes and if quitting is hell then I got hell to pay. 

Have a blessed day everyone",16
2022-01-24 08:52:37,https://youtu.be/co-B-5zJx4U,"Watch ""Rodneys Beats"" on YouTube",,1
2022-01-24 08:33:59,https://i.redd.it/q31q0iww1nd81.jpg,Day 1 - again... posting for accountability,,129
2022-01-24 07:48:08,https://www.reddit.com/r/stopsmoking/comments/sblgzt/why_i_always_want_to_chew_gum_or_suck_candy_i/,Why i always want to chew gum or suck candy? i stopped smoking 42 days ago,,3
2022-01-24 07:37:35,https://www.reddit.com/r/stopsmoking/comments/sblaaz/respect_to_everyone_whos_currently_trying_to_quit/,"Respect to everyone who's currently trying to quit, and the people who have quit. Also need advice, again.","I keep making posts here but I'm currently on about day 3 of nicotine withdrawals, they seem to get worse my anxiety is through the roof and I keep getting health anxiety about my heart. I'm constantly tired, and honestly I can't imagine how much worse these symptoms would be if I had smoked for longer. I haven't even smoked for a year and my anxiety is just horrible.

Did anyone else get heart palps, or a fast heart after quitting nicotine. Also could quitting nicotine potentially damage my heart?

Thanks to everyone for all the support! I hope everyone has a successful journey in quitting smoking. This subreddit has seriously benefited me and I hope everyone is doing well!",27
2022-01-24 06:17:22,https://www.reddit.com/r/stopsmoking/comments/sbjx8i/im_done/,I’m done..,"Since November 21 shits been going the wrong way. 
Here to make it work again 💪🏻
CF Open is around the corner & I wont be in the best shape. Still gon work my ass off tho! 
Then see where we can get to if we actually train/ eat & not smoke & drink for a year. The past 10years ive never gone more than 4mnths smokfree. Lets go!

-the part which fucked with my head the most was me thinking about not participating because i started smoking again - even tho im excited for this for close to a year now. I really need to get my priorities straight. Fuck this stinking ass nicotine devil!",2
2022-01-24 06:15:06,https://www.reddit.com/r/stopsmoking/comments/sbjvyp/today_is_the_5th_day/,Today is the 5th day,"Yesterday I was so fond of cigars but I never put that into my mouth.  
all good headache and stomach pain vanished.",10
2022-01-24 05:46:06,https://www.reddit.com/r/stopsmoking/comments/sbjfkl/drinking_and_smoking/,Drinking and smoking,"Having a few drinks really exacerbates my nicotine cravings. But I am stronger than any dumb desire to vape/smoke no matter what and will stay strong. I’ve been avoiding alcohol since NYE to help my quit and now after two beers I’m really feeling the craving to vape. It ain’t gonna happen though. I’m a runner, I’m healthy and strong and I’m not a vaper/smoker anymore!",3
2022-01-24 05:13:49,https://www.reddit.com/r/stopsmoking/comments/sbixw3/blocked_nose/,Blocked nose?,Ive been smoke free for 24 days now and have noticed my right nostril blocks up constantly..is that normal? My nose isnt running or anything just blocked. Was wondering if anyone has experienced the same,6
2022-01-24 03:53:15,https://i.redd.it/orvkfattnld81.jpg,"After many attempts to try and quit in the past, this time I’m doing it for good. Exactly 4 weeks since I’ve had a cigarette.",,66
2022-01-24 03:39:44,https://www.reddit.com/r/stopsmoking/comments/sbhj31/heart_beating_fast/,Heart beating fast,I woke up at night with my heart beating really fast. After 40 min i was able to calm down and slept. Im really scared. Is it normal? Im scared to go to sleep. My heart sometimes beating faster since i quit but not sure why. Im really anxious most of the time.,4
2022-01-24 03:21:30,https://www.reddit.com/r/stopsmoking/comments/sbh9nm/almost_there/,Almost there,"After smoking at least 20 a day for 30 years and trying every trick in the book to give up countless times with hypnosis, Alan Carrr, patches, pills, potions, detox and cold turkey nothing worked for more than three months. In Australia a pkt of cigarettes cost roughly $27 for 20 and with COVID-19 and hardly any income I went cold turkey without much fanfare and quit on the 29th of March 2020. It was rough at times but a lot easier than any other time I've stopped so that was odd but feeling good even at work I'm not bothered. I still get the odd craving but nearly a year smoke free vs 30 years smoking I shouldn't expect anything less and cravings disappear quickly. Long story short keep trying you will get there. [10 months ](https://i.imgur.com/wV0YRBa.jpg)",9
2022-01-24 03:11:47,https://i.imgur.com/W0brqiZ.jpg,Almost there,[deleted],1
2022-01-24 03:11:27,https://www.reddit.com/r/stopsmoking/comments/sbh43p/6_months_quit_and_wanting_to_smoke_a_joint/,6 months quit and wanting to smoke a joint,"So basically I used to be a huge high-functioning stoner (8 months ago). I am also 6 months quit with nicotine completely. 

My sister is bringing us a joint tomorrow, so it'll be a one-off thing. Obviously I would love to smoke since it's been so long, but there's also a part of me that's worried ill get reeled back in. 

Has anybody done this before and how did you feel after it? This doesn't really affect my quit either, right?",4
2022-01-24 01:59:14,https://www.reddit.com/r/stopsmoking/comments/sbfyo9/am_i_onto_something_here_alan_carr/,Am I onto something here? (Alan Carr),"I found an article on using  cold showers to overcome fear and procrastination.

It sounded a bit too familiar when it visualised fear as a monster that can be overcome.

That got me thinking about Alan Carr. I actually imagine the little and big monsters working as a team, the little one dead and the big one permanently locked in a cage, unable to summon the little monster because it's dead.

If I ever get a smoking thought, I imagine a bit of fluff on my shoulder and physically brush it off. It works 99% of the time. If it doesn't I move onto the monster scene.

Clearly what Carr has discovered is the amazing power of our imagination to influence our mind. I also feel that his talks on brain washing have unlocked something. A new way of perceiving advertising and snake oil type sales.

So my question is, could the Alan Carr method be adapted to overcome fear and procrastination?

If smoking cravings (just a powerful as fear) are just a thought that can easily be overcome, then why not fear or any other emotional state?

Shower article: 
https://impossiblehq.com/cold-shower-therapy/

Tl;dr: using Alan Carr method for fear and procrastination",2
2022-01-24 01:02:04,https://www.reddit.com/r/stopsmoking/comments/sbezfm/in_need_of_help_quitting/,In need of help quitting,"I have been smoking for about 10 years. I am 29 years old. Started when I was 19. The past couple years I have experienced shortness of breath and chest pains, I believe it’s due to smoking but I have EKGS stating it just anxiety. I have told myself before 30 I will be cigarette free. I have attempted to quit but I always gave in. I need to quit for my health, for my sanity and also for myself. how can I do this. how can I quit!",10
2022-01-24 00:06:29,https://www.reddit.com/r/stopsmoking/comments/sbdz9j/i_smoked_one_cigarette_2_days_ago_on_day_10_hated/,"I smoked one cigarette 2 days ago on day 10 & hated it, does do I start my count over again?",,20
2022-01-23 22:48:19,https://www.reddit.com/r/stopsmoking/comments/sbcia0/today_is_so_hard/,Today is so hard!!!!,"Posting again because I’m struggling I’ve done walks hikes yoga and breathing. I’ve had so many nictine mints my stomach hurts. I think this is a mind thing. Help! 

I really don’t want to smoke I really don’t want to do this again.",7
2022-01-23 22:34:34,https://www.reddit.com/r/stopsmoking/comments/sbc8es/no_going_back_its_just_not_the_same/,No going back it's just not the same,It's to the point now where im only happy if im sobber. Every time I light up a cig it's like my mind just tells me over and over your doing the wrong thing. I couldn't even enjoy a cig buzz if I wanted to now a days. I guess im just over it. The days im not smoking just feels right like im doing the right thing. I remember back in the day smoking with friends socially talking not even thinking twice about it now it just feels dirty like I know im destroying myself with every puff.,4
2022-01-23 21:50:13,https://www.reddit.com/r/stopsmoking/comments/sbbc00/first_step/,First step,"I would really like to leave nicotine behind and never go back to it. This would be a wonderful gift to myself. ""No more nicotine for the rest of your life"" sounds amazing. And I will do whatever it takes to make it so.

I will take on daily ""no smoking today"" pledges, meditation, sports and reading information about nicotine addiction

I want to make the start public in order to make the attempt official and thereby increase the chances of success

01/24/2022 08:50, I start the fight for my life and health. I pledge to not consume nicotine for at least 24 ours, and hope to not do it ever again

How tired I am from unsuccessful attempts to quit and from all the abominations associated with nicotine. I'm talking to myself from the future - PLEASE DO NOT RETURN TO NICOTINE! I BEG YOU. IT WON'T GIVE YOU PLEASURE, JUST MAKE YOU MISERABLE AND UNHAPPY",8
2022-01-23 21:25:14,https://www.reddit.com/r/stopsmoking/comments/sbauu5/insomnia_is_terrible/,Insomnia is terrible!,"So I’m now 17 days in, I’m doing great if I do say so myself! No cravings, no real bad side effects initially apart from a little added anxiety on top of my already existing anxiety. 
Until it gets to the evening/bed time. 
Oh. My. God. I can’t sleep for the life of me. Does anybody else have bad trouble sleeping? I sometimes get night sweats and anxiety, congestion when I lay down, and just can’t sleep in general! Is this a side effect from stopping? It’s driving me nuts.",7
2022-01-23 20:36:34,https://www.reddit.com/r/stopsmoking/comments/sb9v5x/pulled_an_allnighter_still_not_smoking_32_hours/,"Pulled an all-nighter, still not smoking (32 hours so far)","7 AM here in India. Have an exam at 11 and I'm not gonna allow myself to give blowjobs to death sticks despite the stress and lack of sleep.

Wish me luck, lads and lasses and those that lie betwixt.",6
2022-01-23 19:08:03,https://www.reddit.com/r/stopsmoking/comments/sb80s9/support_group/,Support group,[removed],1
2022-01-23 18:48:31,https://i.redd.it/lcagl56nyid81.jpg,Can’t believe I’m finally here! Those who are struggling: my cravings even after drinking are so much more manageable. You can do this!,,35
2022-01-23 18:45:04,https://www.reddit.com/r/stopsmoking/comments/sb7j48/day_1_did_something_ive_never_done_before/,Day 1: Did something I've never done before,"I've always gone out on my balcony at sunset to have a smoke (usually about my 7th or 8th of the day) and watch the sky turn.

This evening I went out to see it, knowing I wouldn't be having a smoke. I got inspired to take a walk around my neighborhood - something I've \*never\* done in the few years I've been here. I put on a jacket and went out, walking and admiring the smoldering dusk, the air chilly and crisp.

Walked for about half an hour.

When I got back home, I was feeling kinda energized, so I got some cleaning done.

All because I didn't have my sunset smoke.",93
2022-01-23 18:30:15,https://i.redd.it/ihw2qrmdvid81.png,Some people have to quit 1000 times to get it right. At least it feels that way. After smoking for 10 years I never thought I would see 2 years smoke free. I'm rooting for all of you on here every day!,,48
2022-01-23 18:06:28,https://i.redd.it/91wmawy4rid81.jpg,Never thought I'd make it in a Month smoke free. There may be still challenges along this journey. But F*ck it let's go!,,69
2022-01-23 17:57:04,https://www.reddit.com/r/stopsmoking/comments/sb6gzx/its_been_the_loneliest_5_months_of_my_life/,it's been the loneliest 5 months of my life.,[deleted],18
2022-01-23 16:57:28,https://www.reddit.com/r/stopsmoking/comments/sb539p/two_months/,Two months,Not much else to say. Stay strong everybody,17
2022-01-23 16:38:11,https://www.reddit.com/r/stopsmoking/comments/sb4ms5/day_five/,Day Five,"I am having trouble today, I feel anxieties stepping in and want to control things outside of myself. I’m really craving a cigarette and the mints are not helping (or maybe they are and I would have caved already.) I know smoking will make my anxiety worse and I also will feel like I messed up which won’t help!",8
2022-01-23 16:32:42,https://www.reddit.com/r/stopsmoking/comments/sb4ia3/day_1_again/,Day 1 again,After a really bad panic attack (I get them frequently) I stopped smoking. I was only a social smoker but the next day even from smoking 4 or 5 so I quit I was doing great for 5 months. Had this real motivation. Just started screwing up and smoking again. Anxiety got worse I just don't have that fire in my belly I had.,6
2022-01-23 16:25:37,https://www.reddit.com/r/stopsmoking/comments/sb4c8o/ive_tried_and_failed_multiple_timesneed_help/,I've tried and failed multiple times/NEED HELP,"So it's not cigarettes per say, it's the tobacco and weed combo with also having nothing to do or anyone to hang with that's making it hard to keep from coming back to smoking",7
2022-01-23 16:24:50,https://www.reddit.com/r/stopsmoking/comments/sb4bl6/today_will_be_the_last_day_i_use_nicotine/,Today will be the last day I use nicotine.,"I have finally decided to stop vaping. I’m giving myself until tomorrow, and quitting cold turkey.

I started when I was 14, in a bathroom at my high school when a junior offered me her vape. My friend was with me and hit it first, and I just wanted to fit in. No, there was no peer pressure, just me pressuring myself. It went downhill from there, befriending those of legal age and paying them to buy me stuff to fuel this habit.

I’ve been wanting to quit ever since I turned 18. I lowered the percentage I was using a few months back, but now I’m running through pod packs every two days.

With 19 only a few months away, I want to be completely rid of it and give myself a chance to live healthier. I’ve been using it as a crutch to cope with my mental health issues. Not anymore. I am stronger than this. I don’t need it, I don’t need it, I don’t need it.

Any advice, support, and motivation are entirely welcome. I certainly need it.",14
2022-01-23 16:07:57,https://www.reddit.com/r/stopsmoking/comments/sb3x5e/almost_28_hours_since_my_last_ciggy_how_long/,Almost 28 hours since my last ciggy. How long before it gets worse?,"I'm doing alright now but I'm expecting the cravings to get stronger. 

Those of you who quit, when did the cravings get the worst for you?",31
2022-01-23 15:49:04,https://www.reddit.com/r/stopsmoking/comments/sb3h6j/today_is_hard_but_if_i_dont_give_in_i_will_never/,"Today is hard, but if I don't give in I will never have to go through this day again!","I tell myself this frequently. If I relapse, I will have to go through all this misery over again. On the other hand, if I stay clean, every day I make it through is a day of suffering I will never have to live again!",41
2022-01-23 13:51:19,https://www.reddit.com/r/stopsmoking/comments/sb0r8l/starting_day_45_without_nicotine_thoughts/,Starting day 45 without nicotine.. thoughts & ramblings,"It feels good to know I've finally went over a month without smoking for the first time in 5 years. I've tried to quit so many times since then I lost count. Along time ago, I didn't want to identify as an addict, or even have that line of thought. I honestly believed I loved the way smoking made me feel, even though it wasn't an optional activity, even though I would quickly grow anxious, unfocused, miserable, restless, and everything else imaginable, without it. Even though I couldn't take a ""break"" from smoking tobacco without putting myself through hell. Shit, if I ever tried to stop smoking with just the mindset to ""take a break"" and let my lungs ""heal a bit"", I would just be back smoking the next day or hours later. It seemed like all I ever was looking forward to was the next smoke, every day, all day, year after year, nothing seeming better, and even then, for years, I didn't want to call myself a drug addict.

And now where I'm at, I'm fully aware if I take just one hit for any reason, it's all over. And I relapsed enough times to know it's never just one hit anyways. There's never been a single time out of the 50 times I've relapsed where I was like okay, that's enough, I had one hit. I just go into machine mode and it's all over.

For the first month or so I kept having some sort of feeling in my head that I feel could only be relieved by having a smoke, it's like some sort of mental craving where my head feels a bit fuzzy and unfocused and I think I need more tobacco. Hard to describe, but now that I think about it, it hasn't happened in a while.

I think at this point it's been an on-and-off depression thing for me. Some days I get real down, and think well, life is so miserable, I don't know if I want to go on, why not just smoke to at least enjoy something? And then I remember, yeah, it didn't work like that at all. Smoking didn't solve my problems. Smoking was always an escape for me, and it was becoming a very regretful and unreliable one at that. It wasn't always a ""pleasure"".. that was becoming the out-liar experience if anything. Most of time they tasted nasty, I didn't want to smoke them but needed them, and I'd be left with a burning chest and struggling to breath, which was only magnified since I usually just felt like that normally as an active smoker. And that was my day-to-day existence. Yeah, calling that a ""pleasure"" was far from the truth. I keep in mind now that I have to be a full-fledged drug addict if I want to derive pleasure from tobacco, and that means living like a ticking time-bomb, every day, waiting to see what physical disaster awaits me next.

Being an active smoker means dealing with consequences and things getting worse with every passing month & year. It was all very easy to ignore my first 6 years of smoking I'd say (I've smoked for 11-12 years). The only thing that bothered me then was the insane urges to smoke and the withdrawals when I didn't have it. Then I started having problems breathing, doing basic things like walking, talking, dealing with serious tooth decay.

I'm done rambling now. Good luck to all you trying to quit. And to anyone who hasn't read this, Joel has always been my go-to guy when I need a reminder of the harsh reality that is this addiction. [https://whyquit.com/joel/ntap.pdf](https://whyquit.com/joel/ntap.pdf)",44
2022-01-23 13:20:20,https://www.reddit.com/r/stopsmoking/comments/sb00fx/i_think_this_is_the_end_of_the_road_for_me_guys/,I think this is the end of the road for me guys,[deleted],4
2022-01-23 13:14:11,https://www.reddit.com/r/stopsmoking/comments/sazv8e/cigarettes_have_become_my_way_of_measuring_time/,Cigarettes have become my way of measuring time.,"I've just realized now that I haven't smoked for a couple of days, that the days sort of become a blur and day and night easily get turned upside down. Have any of you successfully substituted the ""time based"" (morning cigarette, night smoke etc) with other habits?",23
2022-01-23 12:07:40,https://www.reddit.com/r/stopsmoking/comments/sayab3/my_boyfriend_left_me_after_stopped_smoking/,My boyfriend left me after stopped smoking,Hello! I just finished my 6 day no smoking but my boyfriend left me because he couldn't stand that I was angry all these days.i am very sad.,64
2022-01-23 11:22:31,https://www.reddit.com/r/stopsmoking/comments/sax920/day_2/,Day 2,"Started good spent time with the fam . Went for a walk Day 3 is were i struggle a lot don't know what will happen . Anxious .

PS : Anyone who had to deal with porn addiction or weed addiction the same time with smoking .pls dm or cmnt or just leave a cmnt what helped you.Thanks in Advance",3
2022-01-23 10:52:27,https://www.reddit.com/r/stopsmoking/comments/sawkjq/how_are_your_new_years_resolutions_going/,How are your New Years Resolutions going?,[removed],1
2022-01-23 10:44:14,https://www.reddit.com/r/stopsmoking/comments/sawe6d/post_quit_question/,Post Quit Question,[deleted],1
