,Date,URL,Title,Body,Score,COVID-19 Mentions
0,2021-11-29 21:30:38,https://www.reddit.com/r/stopsmoking/comments/r5cenh/i_am_looking_to_buy_a_vape_or_a_cbd_vape_to_quit/,I am looking to buy a vape or a CBD vape to quit smoking tobacco. Any advice on where to start? I want something small and not disposable.,,1,0
1,2021-11-29 20:38:42,https://www.reddit.com/r/stopsmoking/comments/r5bdmk/approx_day_59_of_no_smoking_and_finally_health/,Approx day 59 of no smoking and finally health benes are kickin in,"Now i admit i smoked for an awful long time, Yep hammered the heck out of my lungs for around 35 years averaging a pack a day. Quit cold turkey at the first sign of shortness of breath, So yea the shortness of breath never really happened again since i tossed the last butt about 59 days ago. I am guessing because i didnt mark the day on my calender and for the first few days of no smokin i was so out of it that i had no idea what day, Month or year it was. I t was hell of the highest levels or lowest level whichever is worse.. This thanksgiving i could taste stuff and smell aromas for my first non smoking thanksgivin in my adult life. My kin actually complimented me on puttin on some weight on my face and i dont look like a dryin up raisan anymore. I can walk easier and breathe easier. Though i am coughin up some slimmy mucus at regulr timely intervals like once every 4 hours or so. It does not bother me. I still get a bit of dizziness every now and then some weird shootin pains here and there that pass quickly. I am finally starting to sleep thru the night and the tarnation of constipation is almost a thing of the past. Generally i am feeling so much better..Cravings still come and hang around every day once or twice..They are getting less. I can do it so can you and if ya got any questions about my specific withdrawal syptoms (I had 'em all) or their timeline feel free to ask",81,0
2,2021-11-29 16:01:16,https://www.reddit.com/r/stopsmoking/comments/r55k8v/establishing_the_effectiveness_of_publicly/,Establishing the effectiveness of publicly available smoking cessation resource,"Need a distraction not to light up? Our program sends you ideas for activities to do that will get your mind off of smoking.  

Adult smokers are needed to help evaluate a quit smoking text messaging program. Participants receive up to $100 during this 6-month study (UVA IRB-SBS #3928): [https://virginiahsd.co1.qualtrics.com/jfe/form/SV\_6FIlkhRBssDaGdo](https://virginiahsd.co1.qualtrics.com/jfe/form/SV_6FIlkhRBssDaGdo)",0,0
3,2021-11-29 15:30:31,https://www.reddit.com/r/stopsmoking/comments/r54vn5/nictoine_gum_anxiety/,Nictoine gum anxiety?,"I have mostly quit smoking (only smoked twice this year when very drunk).

What has helped is switching over to nictoine gum (2mg), which really helps with the cravings. I probably have a lot, say 10/12 a day.

But i have been using for over a year now, and noticed i have developed anxiety and panic attacks?

I know nicotine gum should be a short term solution. Was wondering if anyone else every experienced this too?",8,0
4,2021-11-29 15:24:52,https://www.reddit.com/r/stopsmoking/comments/r54r1y/105/,105,"105 days free from nicotine/tobacco. 
I never thought I'd be able to say that. 

It's been a WILD ride, but it can be done!",26,0
5,2021-11-29 14:40:30,https://www.reddit.com/r/stopsmoking/comments/r53rb0/i_just_cant_catch_a_break_and_nrt_doesnt_seem_to/,I just can’t catch a break and NRT doesn’t seem to be helping anymore.,"I wake up calm, with a plan for my day, in a fairly good mood…. I begin carrying out my plans when -without fail- something totally derails every task I had set out to accomplish that day and I end up a ranting, raving, shouting lunatic. This has been happening every day for the past week. I’m on day 13 of my quit and I simply can not handle even minor stressors anymore. I feel like I’m about to fucking snap and I don’t know if I’m strong enough to do this. The patch was helping, but I feel like it’s just not doing it for me anymore. 

Has anyone else had similar problems? How do you cope? I really need advice here.",4,0
6,2021-11-29 12:57:40,https://www.reddit.com/r/stopsmoking/comments/r51hi5/zero_nicotine_for_3_months_and_i_still_get/,zero nicotine for 3 months and I still get crippling cigarette cravings that last about an hour.,"Zero nicotine for over 3 months and I still get crippling cigarette cravings that last about an hour. I usually have 2 one hour cravings a day. More if stressed. 

Anyone know how long this is going to be an issue? Right now I just rock in a chair or pace the room while chewing spearmint gum. 

All the information I've read says cravings by now should be infrequent and last minutes. I know everyone is different so I'm reaching out to see if anyone else has had this issue, and or any insight. I'm glad I quit but this is driving me nuts. 

Not sure if relevant but 37 years old and smoked for 20 years.",20,0
7,2021-11-29 12:00:40,https://www.reddit.com/r/stopsmoking/comments/r508ml/95_months_free_from_the_bondage_of_smoking_and/,9.5 Months FREE from the bondage of smoking and nicotine and happy as a clam!! :),"Do I miss it? No, not at all.  For those just beginning their journey in quitting, trust me the freedom from cigs is worth it :)",118,0
8,2021-11-29 11:02:05,https://www.reddit.com/r/stopsmoking/comments/r4yxw9/sharing_my_experience_with_some_tips/,Sharing my experience with some tips,"So it's been 4 months since I smoked my last cigarette and i wanted to share my experience now that i'm well past cravings. For some context i smoked for 7 years, one pack a day.

So my decision wasn't premeditated it was on a whim after i thought the cig i was smoking that day (after a weekend of partying and drinking) tasted really bad.

After that it became a personal challenge for me and i already told all my friends and family that i stopped for good to give me more incentive. The cravings came fast and while i was living them it felt as though stopping didn't make any sense and i had to get my fix. But i quickly noticed that the feeling went away on it's own and i was beck to being normal after half an hour tops. The second week was the worst for me, cravings came hard like 4 times a day but learned to live with them and not to fight them knowing well the feeling won't last forever. I had some nights of insomnia but melatonin helped a lot. It helped having supportive friends (who smoked nonetheless) who reminded my of what a great feat i was doing every time i felt weak. Now what really bothered me was that 2 weeks in i couldn't enjoy alcohol anymore cause when the craving hit when i was drinking it was on a different level and the fun was over for me. But to my surprise one night out i had fun for the first time without feeling the need to smoke. After 3 weeks it became a piece of cake and i don't get any sort of craving at this point even though all my friends and co-workers are smokers.

TLDR: Most important thing when quitting is to understand the structure of the craving, knowing that it won't last more than 45 mins, no more than 3 times a day. After it's over you will feel like you got your nicotine fix (In other words you will be back to normal) While pushing through a craving you will question yourself and the decision to stop as if you became a different person. It helps having supportive friends to get in touch with if you feel this way, and always remember that the feeling will pass on it's own and every time you beat it you will feel good about yourself, even more than the feeling of smoking itself. The minute you accept the cravings and learn how to deal with them mentally ( not with substitutes) you've basically won.",31,0
9,2021-11-29 09:43:36,https://www.reddit.com/r/stopsmoking/comments/r4xb9y/can_someone_help/,Can someone help?,"I'm using Reddit on Android and I've just made a text post on r/stopsmoking. I cannot find it. Can someone direct message me to tell which where my message is, please?",6,0
10,2021-11-29 09:38:26,https://www.reddit.com/r/stopsmoking/comments/r4x7hv/im_asking_what_people_think/,I'm asking what people think,"I even asked my ""enemy"" at the garage what he thought about my 30 hour vaping journey. I'm getting good results. People are being honest with their answers and saying brilliant. I wanted to know what people thought on here. Thanks. Kevin.",1,0
11,2021-11-29 09:23:13,https://i.redd.it/sngeh9ennj281.jpg,90 Days! Haven’t got this far in 4 years and couldn’t have done it without the sun 🙏🏾,,23,0
12,2021-11-29 08:36:24,https://www.reddit.com/r/stopsmoking/comments/r4vzs4/over_the_1st_week/,Over the 1st week!,"I have to say it went really slowly. But then I've smashed the weekend easily. So now at nearly 10 days! 

I've stopped smoking cigarettes and because one leads to the other I've stopped drinking alcohol (which I had a problem with). By proxy then I've also stopped drinking fizzy drinks, and started eating healthier - because my metabolism will slow and I'm HUNGRY all the time. 

Aim is to drop from 100kg to 80kg over the coming months whilst continuing to be alcohol and cigarrette free. 

This cheesy thing in my quit app actually made me smile though. CHEESY. 

Paraphrased - your mission for the day is to sit down, alone, scroll through your non smoking stats and just smile about what you have achieved. 

Good luck to all of you struggling. I am a smoker, I will always be a smoker, it's just going to be forever until I smoke my next one.",16,0
13,2021-11-29 07:36:54,https://www.reddit.com/r/stopsmoking/comments/r4uxk4/day_3_on_the_patch/,Day 3 on The Patch,"First of all, I am new to this sub and have just been scrolling through all of the posts from all of you trying to quit. It's really crazy how many of us feel the same way.

I am on day 3 of the 21mg patch and I am usually over a pack a day of smoking. In the past 3 days I have smoked a total of 11 cigarettes, and for me that is a big accomplishment. Been smoking heavily since I was 14 and I hate how much this addiction weighs me down in my life. I have had one smoke this morning and I am hoping to go the rest of the day without one. I am going to try to keep my mind occupied with work, but does anyone have any advice for when that urge creeps up? Usually I give in but I am going to try even harder not to.",13,0
14,2021-11-29 07:01:40,https://www.reddit.com/r/stopsmoking/comments/r4ucwa/aiming_for_at_least_one_week_smoke_free/,Aiming for at least one week smoke free,"Third day now, it's very tough momentarily. My cravings are making me aggressive, anxious and restless, but I'm trying to wait them out, and so far it has worked. I've promised myself to be smoke free for at least one week, and I am going to stick to it even if it means I'll lose my sanity. I'm hoping that being smoke free one week will inspire me to quit completely.
I'm so tired of being out of breath, having cold feet and hands, smelling terrible, not being able to take deep breaths etc. Now, after just three days, I've already noticed that it's a bit easier to breathe. Gives me more  motivation.
Just felt like I needed to share this

EDIT: Thank you all for your support, it has helped more than you can imagine!
Today I'm facing day 6, among with other major issues, and despite getting this far, the stress and the issues have made me want to smoke more than before. Does anyone have any tips for what to do? I'm desperate. I'm in a situation right now, that I can't do much more than listen to music and drinking water. All help appreciated dearly!",70,0
15,2021-11-29 04:49:59,https://www.reddit.com/r/stopsmoking/comments/r4sfiv/afraid_to_fail/,Afraid to fail,"Hello everyone! So I am a 24-year-old girl who has finally decided to quit smoking. I am over 2 days smoke-free after around 4 years of smoking. But today is really difficult. I am angry, constantly hungry, and every minute I am thinking about cigarettes. 
Right now I have some issues at work and I am scared that this will push me over the edge. 
Any tips or advice?",9,0
16,2021-11-29 04:45:07,https://www.reddit.com/r/stopsmoking/comments/r4sd5x/eyeopening_epiphany_quitting_take_1000/,Eye-opening Epiphany- Quitting Take 1000,"March 2020 was my first big quit because I was able to work from home. That lasted until I went back to work. 

April 2021 I quit again. That lasted until the first few weeks at work after vacation. 

This time, I didn't wait I just kept trying to quit making it 72 hours then relapsing. I developed a really bad ear problem that came back every first day of quitting. 

The last time I quit, I had spoken to my therapists who after a year suggested medicine. 
The first day of my last quit, my ear became so infected I couldn't move my jaw. I went to the doctor and released my entire struggle. First, she treated the ear where she couldn't see my ear drum and I had two follow up appointments and three prescriptions before my ear was better. Second, she prescribed me an antidepressant medicine to help me quit. 

What a world of change. 
I had been self medicating for 10 years. I indeed had a mental health imbalance. I have never felt better. I barely have any cravings and I don't binge eat anymore. Don't get me wrong, I'm not numb or emotionless but I am able to handle things in a healthier way. If anyone keeps relapsing and is afraid to go to the doctor, don't be. Go. It changed my world and now I am able to confront past traumas that I think I was numb too before starting the medicine.",8,1
17,2021-11-29 03:16:51,https://i.redd.it/xyim9w4auh281.jpg,"400 days, ¥150,000 saved and 6,000 cigarettes not smoked. Whoop whoop!",,90,0
18,2021-11-29 01:36:51,https://www.reddit.com/r/stopsmoking/comments/r4pll6/want_to_quit_sooner_new_smoker/,"Want to quit sooner, new smoker","I've just started smoking 3 months ago. 1 cig per day, then 2 then 3 and now i smoke over 7 per day. I really want to quit sooner before they get more addictive.",10,0
19,2021-11-29 00:57:20,https://www.reddit.com/r/stopsmoking/comments/r4oyht/how_do_single_non_smokers_deal_with_life/,How do single non smokers deal with life?,"Any ideas, hobbies?",2,0
20,2021-11-29 00:34:36,https://www.reddit.com/r/stopsmoking/comments/r4okuh/ive_posted_similarly_here_before_but_this_time/,"I've posted similarly here before, but this time it's gonna stick","I have 4 cigarettes left in my pack, and I'm finishing them tonight and that's going to be it. 

I am heading into probably one of the most stressful weeks that I've had in a while, but I've been using that as an easy excuse for a while, too. If I hit a breaking point, I have some nicotine lozenges, but I hope to keep away from those as well. 

Wish me luck! I'll probably be back when I need to be talked down!",8,0
21,2021-11-28 21:38:14,https://www.reddit.com/r/stopsmoking/comments/r4l9z7/update_43_days_cig_free/,*Update* 43 days cig free,Feels amazing! started on the 7mg nicotine patches today. I’ll be completely off the patches 2 weeks from today. I’ll post updates! Stay strong everyone!,24,0
22,2021-11-28 21:14:08,https://www.reddit.com/r/stopsmoking/comments/r4kt6l/hey_so_im_a_14_yr_old_guy_and_recently_tried/,"hey so i’m a 14 yr old guy and recently tried vaping. i took about 20 hits total. if i take no more hits from now, will my body be unharmed? this is really short, but i just can’t stop worrying about it lmao.",,3,0
23,2021-11-28 20:34:50,https://www.reddit.com/r/stopsmoking/comments/r4k1dx/how_long_is_too_long/,How long is too long?,How long would someone have to smoke for it to be pointless to quit? I'm 36 started smoking when I was 8. If I quit now would it be worth it?,7,0
24,2021-11-28 19:27:32,https://www.reddit.com/r/stopsmoking/comments/r4ioz8/if_i_relapsed_after_12_days_will_i_go_through_the/,If I relapsed after 12 days will I go through the same withdrawal the first three days of this quit?,,9,0
25,2021-11-28 16:49:36,https://www.reddit.com/r/stopsmoking/comments/r4fciv/nothing_seems_to_be_cooperating_today/,Nothing seems to be cooperating today.,"I’ve tried to sink myself into some of my hobbies to take my mind off quitting. My brewing equipment needs to be used outside and there’s some major rain and wind interfering, my 3D printer decided to fail 3 prints in a row, my favorite video game is glitching out in infuriating ways and, though I’ve detailed my kitchen spotlessly, I’m nauseated by the thought of food. 

And the dogs won’t shut the fuck up……

At least my wife is always available to give me a hug when I’m near the breaking point.",9,0
26,2021-11-28 15:56:39,https://www.reddit.com/r/stopsmoking/comments/r4e5pn/withdrawal_anxiety_help/,"Withdrawal anxiety, help!","Hey all, so I quit vaping about 3 weeks ago. Only ever vaped, and for about 5 years. About a month ago I got very sick and decided that because I was already miserable that now would be a good time to quit, so I did. Been 3 weeks and some change and my cravings have mostly subsided, my appetite has more or less stabilized and the brain fog has seemingly lifted. What is getting me and is making it really hard to stay the course, despite barely even wanting to smoke anymore, is the anxiety. Every day is spent at about a 4/10, with nearly hourly spikes. All the articles I've read say that anxiety problems are only made better after quitting and that even if you experience anxiety, it's generally just during the rough first 3 days and will often times have subsided after 2 weeks. I just want to know if this is a normal experience or something I should see someone about.",5,0
27,2021-11-28 12:57:31,https://www.reddit.com/r/stopsmoking/comments/r4a3wv/any_good_tips/,Any good tips?,"Hi everyone 

So I have decided to stop smoking, and I want to do it from one day to another 'cause al of that smoking less and less isn't for me. 

I'm just curious if you have any good ideas or tips for when the craving for a cigarette becomes almost to much and all you can think about is that cigarette?",8,0
28,2021-11-28 11:38:20,https://www.reddit.com/r/stopsmoking/comments/r48bws/i_think_im_relapsing/,I think I’m relapsing :(,"I am 24f. I’ve been smoking on and off since I was 19. I stopped smoking I thought for good in August 2020. During the time I stopped smoking I was already highly anxious and quitting made me feel so depressed. It was extremely difficult. I also stopped drinking alcohol completely due to anxiety. 

This summer I made some friends at my job - I work in a pub - and as is quite typical everyone smokes and drinks. I started off having a few cigarettes on a night out. Then I would buy a pack and smoke them when I was going out and only allowed myself to smoke when I was drinking. My boss pointed out that this was a bad idea because it would encourage me to drink more. Two weeks ago one night at work I had a sober cigarette as I was very stressed and when I get angry or very upset the first thing I think to do is have a cigarette. I would have one in the evening when I left work. Then I began having 3 in the evening and today for the first time I’ve felt cravings. I know I’m doing something bad and I feel terrible about it; I really don’t want to become a smoker again. 

I just need some encouragement. Christmas is a very stressful time at my job and a cigarette outside means I get a small break. I don’t know if it’ll be easy to stop again and I’m starting to panic.

TL;DR stopped smoking last summer and have slowly started relapsing in the last couple of weeks",2,0
29,2021-11-28 10:14:47,https://www.reddit.com/r/stopsmoking/comments/r46gvk/how_do_you_actually_stop_once_and_for_all/,How do you *actually* stop once and for all? Struggling a lot.,"Hey guys. I've been a smoker on and off, with 3 months being the longest period of time without a smoke. Now I switched to vaping but I do realise the best thing would be to give up on it as well. I just cannot stop. It tastes so good. I even tried the Alen Carr book and it didn't work. I feel like I'm walking in circles. How do you actually stop it? Is it even possible?",4,0
30,2021-11-28 10:07:11,https://whyquit.com/ffn/11l-crave-coping-techniques.html,"For those who are trying to cope with cravings, here's a good article...",,8,0
31,2021-11-28 08:15:03,https://www.reddit.com/r/stopsmoking/comments/r442ph/1_year_7_months_today/,1 year 7 months today,"Everyone here keep going. If anyone ever told you that quitting smoking was harder than { x } don’t believe it. It’s only as hard as you make it for yourself. Keep plugging away day by day. Treat each craving like a 911 call, it’s life and death. Eventually they go away. Strength and positivity to everyone here.",107,0
32,2021-11-28 02:24:52,https://www.reddit.com/r/stopsmoking/comments/r3yp3a/1_year_4_months_since_i_quit_smoking_but_still/,1 year & 4 months since I quit smoking but still have health problems,"It’s been one year and 4 months since I quit smoking weed mixed with tobacco (blunts and Grabba) and I thought I was getting better but this passed week my breathing got worse , my throat is really tight all the time and I’m just having the most trouble with breathing …

I was diagnosed with hyperthyroidism recently and have been treating that for 2 months I don’t know if that has anything to do with smoking which was weird that I got it after I quit smoking but whatever , my main concern right Now is the breathing issues : 

- my sinuses are completely blocked , I can’t breath through my nose so I don’t know if that’s the reason my throat is tight 

-I get chest tightness again and I use an inhaler plus a steroid inhaler to try to calm it down but sometimes it doesn’t help as much as I want it too.
(Btw I haven’t been diagnosed asthma when I went to a lung specialist, they said everything looks good with my lungs and he couldn’t find a reason why I had breathing problems which confuses me to why after 1 year and 4 months my breathing is still not good. 

Any thoughts or experiences ? I would love to hear them all thank you",4,0
33,2021-11-28 01:58:23,https://www.reddit.com/r/stopsmoking/comments/r3ya9w/a_month_free/,A month free,"Hi everyone! I'm 31 days free and this is what I learned so far.

1. Yes you can manage stress without a smoke. Yeah you will get a craving because your brain circuits tell you that that is an occasion that you usually smoked. It's a circuit that is reprogramming. I have my midterms now and so far so good. Just had my accounting 101 exam, did pretty well.

2. Yeah you will avoid people and places where people smoke. I'm just a month in so that might change.

3. My alcohol consumption is down. Another perk. I just go out for drinks waaaay less. Extra money is amazing too.

4. Let the success of you not smoking propel you upwards. I'm much more motivated to lose weight or invest in myself now when at least one part of my self destructive nature is no longer here.

Yeah it's not all peaches when you quit but it's much easier than I thought.",46,0
34,2021-11-28 01:27:03,https://www.reddit.com/r/stopsmoking/comments/r3xs3m/is_4mg_really_as_high_as_lozenges_go_i_realize_im/,Is 4mg really as high as lozenges go? I realize I'm trying to quit but shouldn't there be a lozenges with the equivalent nicotine found in a cigarette to start on.,"I've tried quitting so many times and I've just started using lozenges which are ""working ok"" I'm just curious if there is a higher mg of lozenge.",2,0
35,2021-11-28 01:11:49,https://www.reddit.com/r/stopsmoking/comments/r3xje7/2_weeks_pain_depression/,2 weeks. Pain. Depression,"Feeling happy and depressed. 2 weeks as a newly non-smoker. Thankful.
The sharp pain I felt last, however, night alarmed me fiercely. It was so startling it snatched me out of my sleep. My heart was beating hard as well. Chest has not felt truly peaceful since. Going to sleep tonight seems daunting.

Is this normal? Is this part of it? Growing pains of being a non smoker? Or, at 36, have I walked into angina territory? Im depressed at 1am, as I am feeling tightness, pressure, and pain in my chest that leads into my throat a little.

The random shocks/zaps/pains/twitches that have become a nightly thing. GOD have mercy. How could I do this to myself..

Asking for comfort. I do not want to type that I am scared..but I will type that I ask for encouragement and folks to be there with me through this. Fighting back tears..",1,0
36,2021-11-28 01:09:51,https://www.reddit.com/r/stopsmoking/comments/r3xi8i/i_quit/,I quit!,"I quit Juul last Sunday and haven’t used since, I’m fo happy I finally quit but why I’m writing this is because I got a sore throat on Wednesday so 4 days after I quit is this normal?",6,0
