Date,URL,Title,Body,Score
2022-01-30 23:57:30,https://www.reddit.com/r/stopsmoking/comments/sgstg5/smoking_sux/,Smoking sux,"I'm a quitter. I smoked for 23 years, since I was 16. I""ve quit maybe 3 times. I'm a month and 8 days into this round. I hope it's for good. I'm breathing better and proud that I dont stink like smoke...even washing your hands after a cig you still stink!! I'm also proud that my son sees that I've stopped. I dont want him thinking it's okay to smoke. I learned from my pack of day parents. I'm trying to look at my quitting as breaking a cycle and strength over my weaker dependent self. Here's to all the quitters out there! Stay strong and get through today!",14
2022-01-30 22:33:27,https://www.reddit.com/r/stopsmoking/comments/sgr6d9/last_cig/,Last cig!,Smoking my last cig of my pack right now. Blessing in disguise but I don’t get paid for another week so it looks like my quit will start tonight. I’m nervous and excited at the same time. I know it’s what I need to do since I’ve been smoking for 10 years. I can do this!!,31
2022-01-30 21:43:40,https://www.reddit.com/r/stopsmoking/comments/sgq5s6/i_drank_and_didnt_smoke/,I drank and didn't smoke,It was really hard I almost caved in but didn't. 4 days strong💪,143
2022-01-30 21:16:59,https://www.reddit.com/r/stopsmoking/comments/sgpm76/so_fcking_hard_to_stop/,So f*cking hard to stop,"I tried to stop smoking this year. I kind did it,  but only for two weeks because I got covid lol

I really want to stop, but I can't help myself when I got out to drink a beer, I need to have a cigar. Specially now that I brokeup with my gf and I'm even more stressed out.",3
2022-01-30 20:48:12,https://www.reddit.com/r/stopsmoking/comments/sgp0ri/help/,Help,I stopped vaping last august after 20 years of either smoking or vaping. I did it to start planning to get pregnant which hasn’t been successful and the whole process has been very stressful. I bought a pack of cigarettes today and had a couple. I want to give up but my husband would be crushed. Any words of encouragement would be really appreciated. Thanks Reddit 🥺,2
2022-01-30 20:27:40,https://imgur.com/qUMbtOp.jpg,8 years of smoking ~1.5 packs a day to nothing,[deleted],1
2022-01-30 20:18:47,https://www.reddit.com/r/stopsmoking/comments/sgof8e/100_days_nicotine_free/,100 DAYS NICOTINE FREE!,"Hi everyone ☺️

So I did it! I finally reached the 100 days mark. It was a rough beginning with lots of frustration, anger and cravings. As the days passed, I learnt to identify my triggers and actively work through them instead of smoking cigarettes and avoiding my feelings. 
It got easier and easier to resist the temptation. This has been the longest time I’ve quit, I had tried many times unsuccessfully. I’m so proud of myself and of all of you too! YOU’VE GOT THIS! 🤍✨ I believe in you and I’m sending you all the very best of luck ✨🤍.",27
2022-01-30 20:00:30,https://www.reddit.com/r/stopsmoking/comments/sgo1dc/football/,Football?,"Who else is watching these football games and trying not to smoke? 

I got super drunk on Friday and had zero cravings but something about watching this football, drinking and just getting hype makes me crave. 

What are ya all doing to avoid??? I'm currently munching on some delicious local tunnel grown strawberries.... that I paid excessively for. 

I just gotta get thru the next 3 days and I'll have FOUR months smoke free!",1
2022-01-30 19:50:35,https://www.reddit.com/r/stopsmoking/comments/sgnu0m/19m_so_ive_been_trying_to_quit_for_some_time_now/,[19M] So I’ve been trying to quit for some time now. I’m addicted to nicotine for almost two years.,"I’m writing this while smoking what will hopefully be my last smoke for some time. I smoke and use nicopods/snus and I’ve even been few days clean during January. My goal is to stop at least for February and see from there. 

It’s much harder than I thought and I’m looking for any help or support. I know I can make and I’ve written the reasons why I want to stop on a paper and in my notes. I feel like the cravings are a thing I can live through but it’s really hard to give up the habit. 

What seems to help me is nostalgia and remembering all the great moments not so long ago when I was clean and “innocent”. I’ve stopped for some time before, with motivation from my ex-gf, but now only motivation is me and that’s the other hard part, battleing with myself. 

I hope I came to the right place, all help is greatly appriciated. Thanks

E: And another sucky thing, maybe a but cultural as I’m European, but there are just some aspects I would still like to enjoy in the future, like having a cig with a great beer, or a long passionate conversation with my friends while smoking a cigar or just getting that high from a strong snus. I know it’s not possible from where I am right now, but if possible I’d like to get back to that beginning where I could occasionally have some without getting too attached. Do any of you have an experience with that? My ex-smoker mom tells me, it’s not possible.",2
2022-01-30 19:42:39,https://i.redd.it/66xz0hho6xe81.png,The change has built some positive momentum in multiple aspects of my life. I don't miss it one bit!,,33
2022-01-30 18:58:32,https://www.reddit.com/r/stopsmoking/comments/sgmpp0/how_am_i_ever_going_to_stop/,How am i ever going to stop?,The possibility or will just doesn't exist in my mind at all. I find smokes so pleasant and dont know what could make me want to quit. Thoughts?,1
2022-01-30 18:33:07,https://www.reddit.com/r/stopsmoking/comments/sgm6fw/chest_pains_on_day_27/,Chest pains on day 27,"I am on day 27 of quitting. Smoked for 21 years. I generally feel great physically (still a bit of a mental battle at times), but I have been waking up with chest pains for the past few days. When I breathe deeply some mornings upon waking up it feels as if my lungs hurt, as if I had smoked a whole pack the night before. Anyone else had experiences like this?",3
2022-01-30 18:19:12,https://i.redd.it/x8mdkeisrwe81.jpg,Never ever did I think,,71
2022-01-30 18:17:17,https://www.reddit.com/r/stopsmoking/comments/sglul8/day_15/,day 15,"finally!!!!!!

this is the first time in a long time that i managed to go beyond the 14th and i'm very proud of myself :))

cutting out coffee has helped me a lot to avoid anxiety and negative thoughts, and i'm seriously considering quitting coffee for good",11
2022-01-30 18:02:23,https://www.reddit.com/r/stopsmoking/comments/sgljqo/first_day_back_at_work/,First Day Back At Work!,I'm a high school teacher. I haven't had a cigarette for a month. I'm back at work today. The students come tomorrow. Am feeling a bit vulnerable to my addiction. Any words of encouragement or inspiration to get me through the first week back would be greatly appreciated. I know I need to change my routines during breaks. Luckily nobody in the staffroom smokes.,3
2022-01-30 17:50:51,https://www.reddit.com/r/stopsmoking/comments/sglauu/mental_health/,mental health,"I’m roughly 30 days into quitting smoking. I quit because I started getting weird feelings of anxiety. I felt better for the first day or two after quitting but ever since, my mental health just feels off. Brain fog, racing thoughts, panic. Feels like chaos in my brain. 

Some days I spend all day just analyzing how much I’m thinking, which makes it worse.

Have you guys experienced this? When will it get better?",10
2022-01-30 17:08:43,https://www.reddit.com/r/stopsmoking/comments/sgke4p/i_want_to_stop/,i want to stop,"wow. never thought that i would say this. i _always_ said that i dont want to quit and really meant it. i smoke since im 16 (so nearly 4 years) and there were times where i wouldnt smoke for 2/3 days but never longer than that. in the last few weeks i noticed that cigs dont taste ""good"" anymore, sometimes im even kinda disgusted. and then i smoke the next one lololol. yeah ... i also have such a fucking bad condition. like i cant walk up one floor without feeling like im dying. thats not okay for a 19 years old. and sometimes (like right now) i have this weird chest pain after smoking, as if something heavy would lay on me. 

i think it really would be the best to quit

but now the problem: im not even that scared to stop smoking as such, im scared of having problems to socialize in the future. i met all my friends trough smoking. ""have a lighter?"" nice, now we have a conversation. somehow smokers always meet new people. i know thats a shitty reason for not wanting to quit. but idk :(",3
2022-01-30 16:43:53,https://www.reddit.com/r/stopsmoking/comments/sgjtj9/11_days_smoke_free_and_now_quitting_weed_too/,11 days smoke free and now quitting weed too,[deleted],26
2022-01-30 16:41:42,https://www.reddit.com/r/stopsmoking/comments/sgjrsc/this_is_incredible/,This is incredible,"I was a 30 a day smoker, for 12 years (I am 22F!!!) 

I did not think I could ever live without cigarettes. 

I smoked my last cigarette on 22nd October 2021.

Thursday I went to an award ceremony for work and I was surrounded by friends I have not seen in a very long time. All of whom smoke, A LOT. 

I was in the smoking area, I was up until 10am doing god knows what with god knows who but I DID NOT SMOKE. 

I didn’t smoke. 

I didn’t even crave a cigarette. 

I knew I was free before but this, this is a whole new level of powerful. 

If I can do it, I promise you can too.",39
2022-01-30 16:08:56,https://www.reddit.com/r/stopsmoking/comments/sgj0qf/constantly_failing/,Constantly failing,"So I have been a heavy smoker for roughly 8 years. I have smoked roughly 1-2 packs daily depending on the life circumstances. This past year I have tried to actively quit. I have tried every strategy that is recommended but I always fail. I always cave. I have tried to use fear of health, brute will power, lowering doses and so much more, but I always break before the 3 day mark. 

I get way to irritated, way to groggy and extremely tired. My mind is cloudy and with one thought, the sweet rush of the first cigarette after a while. Once I break, I come back to smoking and I beat myself over the head for it. The negativity makes me afraid to do it and so I wait for a couple of weeks before I have enough courage to do try and quit again.

Recently I tried taking it as a game of sorts, to see how long I could last. Started off decent and then automatic complacency returned me to square one.
I tried various nicotine substitutes, never helped me, never felt them. E cigs are a temporary thing and a gateway. Hookah was the best strategy, lasted a week before I caved under pressure.  

In some way I have entered the right headspace, at least that's what I think. Take it as a challenge/puzzle I have to solve but I feel my strategies are not fruitful. How and what can I do to be functional in some capacity and how do I combat this craving that overrides my thinking to just seek out a pack and a lighter?",1
2022-01-30 15:48:51,https://i.redd.it/dadschsy0we81.jpg,"Had some periods of stress, some lows and some highs, but still going strong 💪🏽💪🏽",,16
2022-01-30 14:18:18,https://www.reddit.com/r/stopsmoking/comments/sggi16/how_do_you_turn_on_the_counter/,How do you turn on the counter?,,1
2022-01-30 12:50:00,https://www.reddit.com/r/stopsmoking/comments/sgej90/day_2_complete/,Day 2 Complete!,Day 3 is very very important!,17
2022-01-30 12:45:04,https://www.reddit.com/r/stopsmoking/comments/sgefby/day_21_does_the_taste_and_smell_of_smoke/,Day 21: does the taste and smell of smoke disappear/diminish from the lungs?,"~16 year smoker for reference.

Every breath through either my mouth or nose carries the essence of tar, and while it isn't triggering to relapse it is a minor annoyance to be aware of my lungs' damaged state. 

Are there expectorants recommended to expedite the removal of tar from lungs; or is chewing minty gum the best option to mask the stench?",5
2022-01-30 12:18:44,https://www.reddit.com/r/stopsmoking/comments/sgdupg/always_failing/,Always failing,[deleted],4
2022-01-30 11:57:58,https://www.reddit.com/r/stopsmoking/comments/sgde8r/does_it_count_if_i_will_be_switching_to_low_3mg/,Does it count if i will be switching to low 3mg vape for a while,[deleted],1
2022-01-30 11:50:55,https://www.reddit.com/r/stopsmoking/comments/sgd900/advice_for_leaving_smoking_permanently/,Advice for leaving smoking permanently?,"TL;DL: 11 year chain smoker, didn't smoke for 7 days. Now the cravings are getting to me everyday. What do I do?  


After 11 years of smoking, my brother finally got me some nicotine gum and nicotine spray. Told me to try it to quit smoking. I've been using them for at least a month now. The excessive cravings are gone. But I still had some, so I had 1 cigarette a day, or maybe 2-3 during occasions. But recently, I was tested COVID-19 positive and had to quarantine myself from my family for 7 days. I took it upon myself to solely use gums and spray during this time and didn't buy cigarettes at all. But I've been subconsciously going to my window and getting the urge to smoke daily and I feel like it's just getting stronger. I finally got negative tonight and from tomorrow, I will be getting out. I want to know what you guys did to discipline yourself with.",2
2022-01-30 11:41:08,https://www.reddit.com/r/stopsmoking/comments/sgd1od/day_1/,Day 1,"So I’m here again on a fresh quit attempt. Sick of this endless loop of hating smoking, giving up, “missing” smoking, starting again, instantly hating my first cigarette.

The brain is a strange thing and even stranger how it can convince you that you miss something you despise because of the addiction.

I feel equipped knowing this though and determined to fight through it this time.",9
2022-01-30 11:39:39,https://www.reddit.com/r/stopsmoking/comments/sgd0k3/happy_sunday/,Happy Sunday!,"Hi all, 195 days and going strong. For anyone reading this and getting ready to quit, go for it. No need to fear the process. Yes, it is hard. The things that are hard are also often the most rewarding. There is joy in the process as well, like after successfully fighting off the agony of a craving and feeling the urge to smoke dissipate. Like eventually waking up with a coffee in the morning not smoking, and not craving!  A sense of accomplishment is a wonderful thing. 

I still crave, and I expect to for a while more, but my urge to smoke is easily dismissed, it isn’t anything at all like the first few months. And the opposite of these and just as daily-occasional is this phenomenon where I feel dopamine spikes coming from moments in life that normally wouldn’t move me. Like my brain is really trying to help me recover. 

I love this sub, I read a bit of it everyday. Thanks to all for sharing their journey. Every post and every comment helps.",14
2022-01-30 10:43:40,https://www.reddit.com/r/stopsmoking/comments/sgbu9h/day_14/,Day 14!,[deleted],14
2022-01-30 10:38:31,https://www.reddit.com/r/stopsmoking/comments/sgbqku/day_4/,Day 4,[deleted],9
2022-01-30 10:29:53,https://www.reddit.com/r/stopsmoking/comments/sgbkan/i_need_help/,I need help…,"I have been addicted to nicotine for the last 5-6 years. It started in high school with vaping and cigarettes here and there. Now I am in university and have a heinous addiction to vaping. Ik this is a stop smoking sub but I rlly don’t know where else to ask. I was wondering, those who quit nicotine, how did you guys do it and do you have any general tips for me? I’m worried for my health, both mental and physical. I’ve had terrible withdrawals in the past and end up relapsing into the comfort of nic. Any help is appreciated.",2
2022-01-30 09:49:30,https://www.reddit.com/r/stopsmoking/comments/sgapvy/30_days_today/,30 days today !,"It’s been a wild month, but today marks 30 days no smoking. The cravings themselves are getting less frequent (only really one this week), although the irritability still comes and goes. Some notes/tips from what I’ve noticed so far in case it helps anyone:

1. I’m currently not drinking either, which is hugely helpful. I’m not sure I would have made it this far if I experienced a craving while drinking.

2. Green tea in the morning has replaced coffee, and has been really helpful. It immediately reduces stress, which has always been my trigger.

3. When I do experience stress or a craving, I try to go for a walk or write down what I’m feeling. It’s not the same obviously, but it helps me get through my hardest moments.

Keep it up everyone - I will not smoke today !",20
2022-01-30 09:46:54,https://www.reddit.com/r/stopsmoking/comments/sgao4c/day_5_is_killing_me/,Day 5 is killing me.,"At the risk of sounding dramatic, THIS IS KILLING ME AND IM DYING

Cravings have been coming and going but my current craving has been constant for two hours. As a bonus, I have been nauseous since yesterday afternoon. I keep looking in the fridge but everything in it makes me want to hurl. I ate a single raspberry this morning. I know I am starving because I can feel it. I also feel starved for nicotine. The pain in my chest won't go away because I won't smoke. The pain in my stomach won't go away because I can't eat.

I live alone and just went through a breakup so no support here. Please can someone just say something encouraging I am gonna lose it",7
2022-01-30 09:45:25,https://www.reddit.com/r/stopsmoking/comments/sgan5j/dreaming_about_smoking/,Dreaming about smoking,"I am smoke free over 3 months and rarely think about smoking anymore but for the past week on and off I have dreams that I'm smoking.

It's really weird and I'm wondering if I subconsciously want a cigarette.

Has anyone else had this?",7
2022-01-30 09:43:54,https://i.redd.it/s8p7c7wu7ue81.jpg,Day 7 - Posting for accountability,,15
2022-01-30 09:37:34,https://i.redd.it/3pa16uvg1se81.jpg,The lung of a man who died at the age of 52 after smoking a pack of cigarettes every day for 30 years.,[deleted],2
2022-01-30 09:18:11,https://i.redd.it/g9zdrpp93ue81.jpg,Totally forgot about this app.. can’t believe I made it this far.,,1
2022-01-30 09:01:51,https://i.redd.it/mw4cwnmc0ue81.jpg,I posted one year ago and I’m posting again for my 2nd year smoke free. Thanks guys!,,60
2022-01-30 08:45:55,https://www.reddit.com/r/stopsmoking/comments/sg9hzk/i_havent_been_counting_the_days_but_i_havent_had/,"I haven't been counting the days, but I haven't had a cigarette in almost 4 months now","And I haven't had any form of nicotine in about a month. Still got a very, very low dosage (3mg) vape for emergencies, though.",36
2022-01-30 08:36:30,https://www.reddit.com/r/stopsmoking/comments/sg9c08/daily_checkin30th_jan_22_no_smoking_today_pledge/,"DAILY CHECK-IN(30th JAN '22) ""NO SMOKING TODAY"" PLEDGE","2nd day of no smoking I feel ok, no bad cravings or slip ups, so far so good",6
2022-01-30 08:31:54,https://i.redd.it/39w3au70vte81.png,"15 yrs smoker, quit for 1 year few years back but relapsed. Trying again.",[deleted],14
2022-01-30 08:01:19,https://i.redd.it/rccp3mxjpte81.jpg,when im about to step outside...,,300
2022-01-30 07:54:33,https://www.reddit.com/r/stopsmoking/comments/sg8llz/really_sore_throat_after_quitting/,Really sore throat after quitting,I quit around a week ago and on side of my throat is really sore. Hurts to swallow and it feels like my lymph nodes might be swollen. Is this normal?,4
2022-01-30 07:53:30,https://www.reddit.com/r/stopsmoking/comments/sg8l13/second_hand_smoke/,Second hand smoke,"Hey I am new!

I quit smoking almost 2 years ago and don't look back.  I actually developed a strong hatred for cigarettes.

I am wondering what second hand smoke does to me? My friends smoke insider their apartments and I hate it (but it's their choice). They also don't like to open windows because they are afraid of noise complaints (we live in a city). 

Bonus question: Sometimes I hit a special cigarette which contains tobacco (only with friends). Does this ""reset"" all the benefits of quitting? I am talking about those timelines e.g. ""After 1 year: Heart disease risk is cut in half""?

Thank you!",1
2022-01-30 07:43:24,https://www.reddit.com/r/stopsmoking/comments/sg8ffx/i_refuse/,I refuse!,"I've been smoking (vaping) for two years and have tried to quit several times. I've only been able to make it 3 days. I've been 3 days smoke free so. many. times. 

But now I'm on Day 5. I do not like the way I feel this morning. On day 3 and 4 I practically woke up smiling because I didn't wake up craving. This morning, I woke up with the heaviest most intense craving. But I refuse to buy. I refuse to give any more money to the companies that got kids hooked on nicotine. Without their help, I wouldn't have lost a tooth to gum disease at 23. It really hurts but it's going to hurt more if I keep smoking. 

I refuse.",4
2022-01-30 07:25:12,https://www.reddit.com/r/stopsmoking/comments/sg85l2/relapsed_for_the_past_3_days_just_thrown_my/,Relapsed for the past 3 days. Just thrown my cigarettes away. Am I back to square one in terms of cravings?,"I went 28 days, was going fine, then had an intense craving and caved. Now I've been smoking again for the past 3 days and I've decided to give it another shot. Will the next 3-7 days be just as tough as it was the first time round? Just the thought of having to go through that again is a bit exhausting and depressing (nonetheless, even if the answer is yes it needs to happen)",8
2022-01-30 07:22:28,https://i.redd.it/cas7plemite81.jpg,Breaking my streak today,,78
2022-01-30 07:20:08,https://www.reddit.com/r/stopsmoking/comments/sg82rn/need_help_to_quit_smoking/,Need Help to quit smoking,"Guys I plan to quit smoking as soon as possible. Would appreciate some help. I currently smoke anywhere from 3-5 cigarettes a day when I am alone and around half a pack when I am with my friends who smoke.
Can any of you give me some good tips to quit for good ?",1
2022-01-30 07:11:55,https://i.redd.it/3pa16uvg1se81.jpg,"We all have our own reasons to be here, but here's some extra motivation.",,27
2022-01-30 07:08:22,https://i.redd.it/5tk9bcq3gte81.png,"Today was a close call! I almost went out to purchase cigarettes cause a meeting didn't go my way! But eventually I got another call and things went back to normal. Monday will be my real test, a test of my calibre, a test of my willpower! Test-test-test and a long day- energy levels will be high",,8
2022-01-30 06:43:46,https://www.reddit.com/r/stopsmoking/comments/sg7iyk/day_five_the_sad_vibes_hit_hard/,Day five … the sad vibes hit hard,"Cold Turkey quit from heavy nicotine salt vaping. Day 1 was shock and awe but so bad it was at least focusing for the mind. Day 2-4 physical withdrawal, tightness in chest, overall anxious “somethings missing” thoughts coming over in waves. But today, day 5, physical withdrawal weakened and craving was a little muted, but pow: some really sad melancholy hit. Was surprised by this. Like I’m grieving a lost love. 

Still mentally foggy. Physical balance less bad. 

Nicotine man: this drug don’t play.",5
2022-01-30 04:21:44,https://www.reddit.com/r/stopsmoking/comments/sg5fsp/im_failing_constantly_while_im_drunk/,I'm failing constantly while I'm drunk.,"So I've been clean for like a year, nicotine free. Now I'm on a vacation with my friends and everytime I'm getting drunk, I'm smoking. This has gone on for too long to ignore. It's getting more frequent and it's really worrying me.

I know I'm totally at fault here, not blaming anyone but me for this. But I need help. I do not want to do this ever again and this is what I say to myself when I'm sober but I don't know what happens when I'm drunk. I totally lose my mind and give in to smoking.",2
2022-01-30 04:09:19,https://www.reddit.com/r/stopsmoking/comments/sg59oc/dayily_checkin_january_30_no_smoking_today/,DAYILY CHECKIN (JANUARY 30)- NO SMOKING TODAY,Let's support each other :) Everybody is welcome,41
2022-01-30 03:04:58,https://www.reddit.com/r/stopsmoking/comments/sg4bzw/1_month_smoke_free_after_16_years/,1 month smoke free after 16 years,It's the second time I've stopped. I have literally  no cravings for one week now. The only thing I'm scared is what will happen when I drink again. What do you do when you drink?,20
2022-01-30 01:36:18,https://www.reddit.com/r/stopsmoking/comments/sg2yxu/how_to_help_a_friend_whos_gone_back_to_nicotine/,How to help a friend who's gone back to nicotine?,[deleted],4
2022-01-30 00:32:34,https://www.reddit.com/r/stopsmoking/comments/sg1wf1/day_11_and_it_feels_wonderful/,Day 11 ... And it feels wonderful.,"And nutty. Wow, there is a lot of time in the day when not chain smoking...

I've started making run-on narrative games for myself as a distraction: ""...Walking briskly three times on this walkway equals three miles which makes up for the metabolism lag from the loss of cigs which equals 11$ not spent which equals, so far, 121$ which equals in this same amount of time doubled 242$ which equals the cost of car work I need done but also two massages so by fixing my car I am in the luxurious position of turning down massages which is basically class jumping, which means congratulations you are a self made millionaire...""",5
2022-01-29 20:51:20,https://www.reddit.com/r/stopsmoking/comments/sfxqos/5_days_in_rash_took_me_by_surprise/,5 days in. Rash took me by surprise.,"10-11 years pack/day smoking history. I'm 29. Quit on the 25th simply because I have a massive ego and absolutely refuse being manipulated and coerced into stuff. 

But what the fuck is this? My whole face is covered in a bright-red blotchy rash, as well as my neck. Never had this problem at any point in my life before.

Did this happen to you too? I've not read anything about this being a side-effect of quitting smoking before.
If it is a common thing, then why the fuck isn't this mentioned lmao?!

TL;DR: Face/neck rash from quitting. Just venting.",3
