Date,URL,Title,Body,Score
2020-08-26 06:00:57,https://www.reddit.com/r/alcoholism/comments/igw3iu/how_can_i_help_my_mom/,How can I help my Mom?,"If this is the wrong subreddit, please let me know, I'll post elsewhere then. 

&#x200B;

I'm basically looking for help on how to help my mom, who's usually very kind and understanding, but also an alcoholic. We are from Germany so beer consumption is probably higher on average than in the US or other countries, but she is drinking way too much. Every once in a while she has a week where she drinks up to 3 crates of beer (that's roughly 60 bottles, 0,5 liters each) which is way too much. My dad also drinks, and surely he could drink less, but I feel like he is in control, composed and constantly drinking. Another thing is that my mom eats very little, so the alcohol that's consumed on an empty stomach hits even harder. Her drinking habits often lead to fights within the family, be it at the dinner-table or when I come home after being at a friend's place. She is often really aggressive, trying to start a fight (not physically, at least not yet). She often comes to me when I'm back in my room after a fight, sometimes to apologize and to say she doesn't want to fight, sometimes just to continue arguing. 

&#x200B;

Here's some background on my mom, I don't know what's relevant, but maybe something helps: My mom has a really hard time saying ""no"". She also doesn't have any vacation, because she works at small companies and is the only one doing certain tasks. Because of that she can never have a week or so off, because the work would pile up etc. She also can't say ""Screw it, I'll take a week off, every company has to continue working, even if the office lady isn't there. So the comapny I'm working at will have to do the same for a week"". At home she cleans very very much, my father and I do very little to no cleaning around the house, partly because in our eyes there is nothing to clean and because we can't clean well enough for the standards of my mum. We live in a pretty big house, so there's lots of cleaning work to be done, but cleaning such a big house excessively is an incredible amount of work and takes very long. Just to reiterate how clean our place is: the glass is always in perfect condition, no smear, dirt, or dust, just perfectly clear and I honestly wouldn't mind eating of the floor, simply because it is that clean. 

&#x200B;

Now I'm hoping I can get some help from this community. What can me and my dad do? I was mainly raised by my mom as she spent way more time with me, than my dad who has an odd working schedule. As a kid I always thought my mom is the one of my parents who's right and my dad isn't handling things well, growing up I realised it's the other way around. I'm 21 now and never spent too much time with my dad, but hearing his side of the past and also observing the situation at home myself and not going blindly by what my mom says, I can really tell she is addicted and that addiction is the reason for so many problems in our family. My dad went to see a psychiatrist when he had some mental issues and looking back, I think that helped him immensely. My mother doesn't think the professional help helped my dad at all and even made things worse. She sometimes has a know-it-all-attitide, thoroughly believing that psychiatrist are often giving bad advice and don't actually know anything. So for tight now, suggesting professional help isn't a good idea in my opinion. When steps in the right direction have been made and her views change, professional help is absolutely advisable though. When you talk to her about her drinking habits, she often says it's not that bad, my dad drinks just as much (which is not true), denies it in other ways or shifts blame on others. How should me and my dad act and how can we help her?",4
2020-08-26 05:44:13,https://www.reddit.com/r/alcoholism/comments/igvwvc/my_dad_might_be_suicidal_with_his_drinking_what/,My dad might be suicidal with his drinking. What do i do?,"As the title says my dads drinking has got way out of hand, i’m talking mixing spirits and bourbons with his beers. He will drink a case of six desperados a day without fail since Jan 2020, as some of you may know desperados is one of the higher ABV beers at about 6% per bottle. When i say “day” i mean within the span of around 5 hours (after work till bedtime). For the past month he’s been mixing his beers with very high ABV drinks like vodka, jack daniels and the one i’m most worried about, wray & nephew (63% Alc Jamaican Rum).

I’m yet to reach the worst of it.

He has successfully gone sober for many small periods of times, the longest i recall was the whole year of 2017. Everyone in my family (Mother Brother and Myself) recognises his drinking as a problem, we have confronted him about it multiple times but he always blows it off as a joke or something novel. I know for a fact he has recognised his drinking as a problem because he slyly tries to spread his empty bottles between normal bin and recycling (where all bottles go), my mum asked him “why are you throwing so many bottles in the bin and not the recycling”, his reply: “i don’t want the neighbours seeing how much i drink everyday”, followed by a laugh and a rapid change of topic.

Now that you know the attributes to his Alcoholism...

This is the part that truly wrenches our hearts, he has been diagnosed with dangerously high blood pressure (HBP), where his doctor has prescribed double the recommended dose of HBP tablets (which he fails to take a lot of the time, says he “forgets”), his mother, my grandmother died last year and i still catch him crying late at night in the downstairs toilet, he’s very proud and i can’t build up courage to confront him about being suicidal, when i say suicidal i mean the neglect for his own life, not necessarily the textbook meaning, he is blind in one eye, he’s at risk of glaucoma which plays a huge roll in his HBP, he’s been told numerous times not to consume alcohol by his doctor, he lies to his doctors about drinking and smoking (smoking started around May 2020 and he hasn’t smoked since 2009). He is fully aware of the dangers of HBP, heart attack, stroke and death.

He’s not abusive, if anything it’s small amounts of verbal abuse, when sober he’s fun, nice, caring, fair, level headed. Substance abuse runs in our family, his father drank himself to death in 1989, his sister and her husband are heroin addicts, his youngest brother is on the very severe side of the alcoholic spectrum to the point where everyone has given up on him including his mental health counsellor and doctors, his other sister suffers from similar alcoholism as he does but she’s in pubs everyday so it’s just that little bit worse.

I believe i have a role to play in his alcoholism, i was kicked out of my house early this year and went homeless for about 3 weeks, i’m sure he was worried sick, both my parents were too strict with me (i’ll be 19 in a month), they wouldn’t allow me to leave my house if i haven’t told them: who i’m going with, where i’m going, what time i’ll be back, what i’ll be doing there and worst of all i tell them a time and they’ll change it to an earlier one. I had to break free of that, i believe he was very surprised even disappointed when i came home from homelessness happy and joyful, to him it seemed like i didn’t need parents anymore (which is not the case).

I feel trapped in this feeling of care, that i really really do want to help in any way but somethings also telling me to stay out of his way and try to have the least interactions with him as possible. It’s very confusing.",4
2020-08-26 04:10:21,https://www.reddit.com/r/alcoholism/comments/iguxd8/5_days_sober/,5 Days sober,5TH DAY SOBER SINCE 4 YEARS ATIVAN IS REALLY HELPING MY EXTREME ANXIETY GO DOWN I HAD TO STOP IT OR ELSE IT KILL ME EVENTUALLY,9
2020-08-26 01:44:42,https://www.reddit.com/r/alcoholism/comments/igt9dc/i_may_be_an_alcoholic/,I may be an alcoholic...,"Hi everyone. I need some opinions and advice. Here is my situation:

I currently drink about 1.5 liters of liquor per week. I mostly drink on the weekends to the point that I’m drunk 2-3 nights a week (I have a 4 day work week). I typically don’t drink during the week, except for a beer after work 1-2 nights per week. Maybe once per month or less I do get drunk on a work night. 

This pattern started the summer of 2019. It was the end of spring semester, and I decided to stay in my college town instead of going home with my friends. I think that I was lonely and I filled the emptiness with liquor. 

Can anyone offer me any anecdotes, advice or help based on my situation? I come from a long line of addicts in one form or another, and I don’t want to ruin my life if this pattern gets worse. 

Thank you all!!",1
2020-08-26 01:30:42,https://www.reddit.com/r/alcoholism/comments/igt305/poster_visit_payment_options_were_doing_okay/,"Post-ER Visit, Payment Options, We're doing okay finally <33","This probably doesn't need to be a throwaway but here we are.

Ever since the pandemic hit america, my partner (we are both F25 currently) has been affected by it. She was firstly furloughed, and then later fully fired. Luckily, she has computer skills which are coveted by many, so she found a new job a month after she was officially fired. (I am currently doing housewife work, but I hope to find a job by the end of the year.)

Problem is. We've been drinking every day pretty much all year long because of the bullshit in life happening this year. We realized that, ""hey this is probably not good at all, we should do something about this,"" a couple weeks into july -- she started her new job at the beginning of july. 

Long story short, she had auditory hallucinations, and then had two seizures from alcohol withdrawal. The second seizure I flipped out and called 911 (I wasn't really there for the first one, so she convinced me I was seeing things. Not her fault. She had had a seizure. She didn't know what was happening.) (Tbh I've been drinking a lot less than her, but 3 drinks a day every day is still a lot, I know.) 

So now I/we have multiple issues/problems. We now have a a 2.7$k deductible we owe, from a 12k bill from her ER visit last week. If anyone has any help to make that not so absurd, I would love your input. I figure we can create a payment plan, but I'm very confused as to how insurance plays into affect here, since the bill is so large and it seems like no matter what we'll have to pay the entire deductible for this one night.

I hope to get her to an actual specialist therapist by the end of fall, but she's been doing good ever since the ER visit. 

We haven't actually received a bill from the hospital, as far as I can tell, this is the EOB from her insurance, although I'm quite confused as to when or if I will receive something from the hospital themselves.

Any suggestions or helpful thoughs or words? I would really appreciate it.",2
2020-08-25 22:59:08,https://www.reddit.com/r/alcoholism/comments/igqz9g/is_14_beer_cans_in_5_hours_alot_whats_a_factor/,Is 14 beer cans in 5 hours alot? What's a factor for drinking more than usual?,"My moms boyfriend has been drinking for years (thats what he says) anyway within this past week he's been drinking more. Like today is it normal to drink 14 beers cans in 5 hours? Why would this be?

 He has nothing to stress about my mom lets him go to work, come home drink beer and play video games till bedtime. She doesn't expect him to clean or have any responsibilities. He pays $500 to my mom a month while he works full time (40hrs) and she works part time. He doesn't give a shit about giving my mom more money either a month, he'll complain if she ever asked.

My sister thinks he's doing this so people at work can tell he is, so he can get fired. As he complains all the time about how his work is boring. 

So is 14 cans of beer accepted in 5 hours? Why would someone start drinking more all of a sudden?",3
2020-08-25 20:31:34,https://www.reddit.com/r/alcoholism/comments/igoo74/am_i_an_alcoholic/,Am i an alcoholic?,"This is probably asked a million times but i don't know myself, people around me say i'm an alcoholic (idk if they're kidding or not), i drinkk 8 beer a days avg (35cl 5%) every day,. I want to drink every day after my girlfriend left (6 months ago). I don't know myself anymore and i don't know whether or not i am one. Can someone please with experience make it clear for me? I'm only 19 years old, i've lost myself after she left. Make it clear for me.",2
2020-08-25 19:52:55,https://www.reddit.com/r/alcoholism/comments/igo1oc/i_dont_know_where_else_to_go_or_what_to_do/,I don't know where else to go or what to do...,"I did a brief look for the rules, found what I believe to be the rules, they are brief as well. If I am in the wrong place, please point me to where I should go. I'm feeling pretty desperate.

I'm not sure what's relevant or not for me to explain this, however, I'm 29yo f, in usa, rust belt region. Have had some awesome experiences, many of which included a lot of drinking, but not overly in excess. On average I've had at least one beer every night for the past err 7 years? Not to the point where I'm blacking out, but like beer after work thing, but it's gotten to the point that I would if I could drink a six pack a night and I wake up early too! Like 530 am est. I've been in a committed relationship for 10 years and my partner likes drinking too, but he can stop himself much easier than i can. He wants to help and doesn't know what to do without upsetting me, I know what the fuck to do but I don't do it. Like I have -15 willpower or some dnd shit. 

I prolly left a lot out, I'm kinda nervous and this is half journal entry half cry for help. If you took the time to read all of this I greatly truly appreciate it and any advice is also appreciated.",2
2020-08-25 17:59:09,https://v.redd.it/2fa26o2o08j51,"Video I made on Monday celebrating my first year, proudest day of my life.",,177
2020-08-25 16:25:20,https://www.reddit.com/r/alcoholism/comments/igkb7v/day_3_of_sobriety_no_focus_and_lots_of_brain_fog/,"Day 3 of sobriety, no focus and lots of brain fog during work","My main question, is it normal that during the first few days of being sober, I can't seem to stay focused on work tasks at all? I'll write a section in a powerpoint or write an email and then feel this anxiety to get up and pace around for a few minutes. It even feels worse than when I was drinking sometimes. Brain feels so slow in addition to this.

Is there something I could do to help aid the rehab process? Or supplements maybe?

But to preface, my drinking was pretty heavy. Typically a 1.75 of vodka every weekend, and 12-15 drinks a day for many months. In fact, I've had on-and-off phases of this for multiple years. Really wanting to stay clean for good this time as it's bothering me how much drinking is affecting my work ability.

Edit: 26M",1
2020-08-25 15:18:11,https://v.redd.it/2ljcmrs8m4j51,Thought I'd share cross-post,,170
2020-08-25 14:48:45,https://www.reddit.com/r/alcoholism/comments/igiepz/what_will_withdrawal_be_like/,What will withdrawal be like?,"Hi everyone, first time poster here. I’m female, 24yo, and I’m an alcoholic. I’ve been drinking since I was 12yo, but my drinking really escalated in the past few years. For at least two years now, I’ve drank at least one bottle (750ml) of vodka per day. Some days I start early but some days I can hold off till 5/6pm (either way, it’s a bottle minimum). 

This is my first attempt at quitting- I want to eventually be able to drink a few drinks without downing an entire bottle (idk if that’s even possible for me), but for now I know I have to go cold turkey. I’m also aware that there are some risks associated with going cold turkey but I know that I cannot monitor my drinking so as to slowly reduce my intake- I can’t stop once I start. 

Can anyone tell me what withdrawal will be like, and how to help the cravings? I’m using Naltrexone right now to help on the side, but I know that won’t help with the withdrawal symptoms. Any advice or tips would be greatly appreciated- thank you!",1
2020-08-25 12:14:38,https://www.reddit.com/r/alcoholism/comments/igf8ly/anyone_been_diagnosed_alcohol_intolerant_or_have/,Anyone been diagnosed alcohol intolerant or have any experience in this?,"I wonder if any other drinkers have experienced this? Over the last two years I've developed a issue when drinking. I will wake up in the middle of the night and vomit, sometimes even after two drinks. I also often get a skin rash or flushing the next day. My doctor said I may have ALDH2 deficiency. Around the same time I developed these system I also developed anxiety which was triggered when I felt very full after eating (so also related to my stomach and digestion). That may be completely coincidental but I thought I'd raise it in case anyone has seen this before.

Has anyone else developed similar symptoms? I think I will need to just try and stop drinking all together.",3
2020-08-25 05:17:47,https://www.healthline.com/health/alcoholism/ketoacidosis,What is alcoholic ketoacidosis?,,3
2020-08-24 23:31:26,https://www.reddit.com/r/alcoholism/comments/ig4gry/alcoholic_neuropathy/,Alcoholic Neuropathy,"Has anyone experienced alcoholic neuropathy? 

I went into recovery a little over two months ago after eight years of one to three bottles of wine a day. I’ve been able to abstain completely and am feeling well. Sobriety is wonderful!

However, I realize the current tingling and “electric surges” in my feet are probably symptoms of neuropathy.

Have you had these symptoms and had them go away or fade? My symptoms are far from debilitating but they are certainly irritating.",9
2020-08-24 22:27:39,https://www.reddit.com/r/alcoholism/comments/ig3gf3/what_constitutes_alcoholism_and_am_i_in_withdrawal/,What constitutes alcoholism and am I in withdrawal?,"I (27f) have been drinking about 750ml of gin a day for the last week or so. Before that, I had been sober for a few months. Now I’m trying to stop, haven’t had a drink since this morning, and am having what I’m assuming might be withdrawal symptoms - shakes, anxiety, feeling like my heart is pounding, inability to sleep. I’m not sure this is true withdrawal, though, because I’ve been having pretty major anxiety due to hormone issues. So first... what constitutes true alcoholism? And second, could I be having withdrawal? Does anyone have tips for managing withdrawal symptoms?",7
2020-08-24 22:01:04,https://www.reddit.com/r/alcoholism/comments/ig3110/vyvanse_turned_me_into_an_alcoholic/,Vyvanse turned me into an alcoholic,"I’ve been on vyvanse (40mgs) for almost 6 years now. My first few years of college I barely drank while taking vyvanse. My last year of college was when it started getting really bad. I’ve been drinking excessively every other day since my last year of college. I take vyvanse, go to work, and drink at the end of the day. I’m not talking about 1 or 2 drinks, more like 10+. The day after taking vyvanse/binge drinking I’m too hungover/anxious to even take my vyvanse so I just suffer through work with a severe hangover and take my anxiety meds. And then the next day I do it all over again- vyvanse, binge drink. I’ve talked to my psychiatrist about this and he doesn’t think it’s the vyvanse that’s causing my urge to drink because I’ve been taking it for so long and I never had this issue when I first started taking vyvanse. I went to AA meetings, was prescribed a “recovery” med, etc. Neither of those things worked. 

Here’s the thing, the days I don’t take vyvanse, I literally have zero urge to drink. I’m usually hungover on the days I don’t take vyvanse but I’ve tested this- I’ve gone days without taking vyvanse and I don’t have a single sip of alcohol, I just don’t have that urge/need to. This is why I feel like vyvanse/ADHD medication is the direct cause of my alcoholism. I’ve tried other ADHD meds and I still binge drink every other day. I just want to know if anyone else has dealt with this toxic cycle. I need to take vyvanse because it acts as an antidepressant for me. I’ve tried a few different antidepressants but had to stop taking them because they weren’t helping me. 
I just want to know if anyone else has dealt with this because it’s become a massive burden on my life.",1
2020-08-24 21:30:09,https://www.reddit.com/r/alcoholism/comments/ig2jid/not_sure_if_im_an_alcoholic_or_just_crazy/,Not sure if I’m an alcoholic or just crazy,I drink everyday. 2 24 ounce twisted teas after work everyday. About 3 to 4 on the weekend. I don’t get drunk. I hate the feeling of being drunk. I just sip my teas until I feel a slight buzz once I feel the buzz slipping I sip some more. Alcohol has never interfered in my day to day life however I always feel the need to have my drinks after work. When I try not to I feel off. Not like sick but something missing and it’s twisted tea in my stomach that I’m missing. I don’t like the taste of beer or liquor. My friends say I’m not an alcoholic bc I don’t get drunk. I’m concerned bc even though it doesn’t interfere with anything I hate the feeling that I need it. I also have been told I’m crazy and just overthinking it.,2
2020-08-24 17:11:43,https://www.youtube.com/watch?v=96ip-8pTznY&feature=share,WHY ADDICTION SUCKS (AND SOBRIETY DOESN'T),,2
2020-08-24 14:59:53,https://www.reddit.com/r/alcoholism/comments/ifvc1x/do_i_count_cw_suicide/,Do I count? (Cw suicide),"Hi I never thought I'd be making a post like that but yeah here I am

I'm 20 years old and I've been sober for a year, two if you don't count a suicide attempt last summer

I started drinking at maybe 15? I'm not totally sure, 14-18 are a complete blur for many reasons, used to be that I'd go with friends, I was never much of a party person but I guess things just progressed that way

When I was 17 I moved to my dad's place away from an abusive mother and met great new people and we'd also go out to drink except they'd get a bottle of beer and I'd get a bottle of vodka, you know the cheap ones behind the counter at most supermarkets

It progressed to a point where I started to want to drink alone especially if I was depressed, which was most of the time back then and I was lucky I didn't have alcohol in the house

Decided to stop when I was 18 and quit cold turkey but I still get the taste of vodka or cheap whiskey in the back of my throat on particularly bad days

Today I'm still not really able to be responsible around a crowd of drinkers and I always sorta ruin the mood when I tell new people I don't drink

I'm not totally sure where I'm going with this, I was never a particularly heavy drinker and my tolerance is pretty high apparently

Is that alcoholism? Is it something else? I really don't know what to say or call myself, I usually just say I've had issues with the stuff and leave it at that

Anyway thanks for reading all of that, I'd appreciate any advice",7
2020-08-24 12:55:42,https://www.reddit.com/r/alcoholism/comments/ifsu2s/acamprosate_campari_dosing/,Acamprosate (Campari) Dosing,"Been given a prescription for acamprosate. 2 x 333mg / day. It hasn’t been working and I’m basically just white-knuckling at the moment. I’ve been doing some research about why this may be and the dose seems so extremely low that it is basically unheard of- not even in patients with kidney disease. Has anyone else been prescribed such a low dose?

edit: Whoops can’t change the title but it’s supposed to say ‘Campral’ in parentheses. Bloody autocorrect. How insanely inappropriate on an alcoholism forum.",10
2020-08-24 12:38:01,https://www.reddit.com/r/alcoholism/comments/ifsgta/what_alcohol_has_done_to_my_health/,What alcohol has done to my health,"So I started drinking vodka almost daily a few years ago due to chronic pain. At first alcohol was like the best drug ever, it took the pain away

As time went on my tolerance increased so of course I drank more

So about 18 months ago I started getting bad abdominal lower abdomen pain. Started out as constipation, followed by rectal pain and dreaded swollen tissue.

Doc sent me for colonscope which didn’t show anything wrong. Was told I had IBS

One day I realized that damn all this pain started following a long course of antibiotics and the beginning of drinking

Anyways recent blood tests show high liver markers and I’ve got pain under my right rib

I had an ultrasound 2 weeks ago

No comment from doctor on blood test or ultrasound....not sure why...

Bottom line the toll of alcohol goes far beyond being drunk and disappointment in yourself

I feel like I’ve destroyed my GI tract and it’s going to take serious lifestyle changes to turn this all around

I’m scared shitless but am attempting cold turkey...I have some meds on hand to help withdrawal 

Listen to your body I ignored it far too long.",6
2020-08-24 11:11:27,https://www.reddit.com/r/alcoholism/comments/ifqtbt/hell_is_real/,Hell is real,"It’s not other people, as Sartre said, it’s this damn disease.",34
2020-08-23 22:41:34,https://www.reddit.com/r/alcoholism/comments/ifgrza/how_do_i_stop_drinking/,How do I stop drinking?,"Throwaway for shame. In short, I want to stop drinking. I’m a mid-20s man and I’ve had a harmful relationship with alcohol since I was 15 — I’ve driven drunk, groped women, gotten into fistfights, and been arrested. I’ve  tried setting limits, but haven’t followed them. I have decided it needs to stop. 

I’m asking for tips, support, anything you can give to help me in this journey, Reddit. It’s going to be a hard road, but I WILL do it. 

So, r/alcoholism, how do I stop drinking?",6
