Date,URL,Title,Body,Score
2020-08-30 23:13:34,https://www.reddit.com/r/alcoholism/comments/ijqg9d/one_week_sober/,one week sober!,"i dont really have much to say but i wanted to share that after months of trying and failing to go more than a couple days sober, i am one week sober! im having minimal withdrawal symptoms, surprisingly.",104
2020-08-30 22:14:27,https://www.reddit.com/r/alcoholism/comments/ijpjxs/has_anyone_hurt_someone_they_care_about/,Has anyone hurt someone they care about (emotionally) while drinking?,"I feel as though I burned a bridge with someone I care so deeply about that it is not salvageable. I am on day 3 of being sober and feel so motivated to heal. Has anyone ever had someone come back after hurting someone seemingly beyond repair when they got sober, healed and turned their life around? Please share your stories.",6
2020-08-30 20:20:39,https://www.reddit.com/r/alcoholism/comments/ijnult/alcoholic_husband_suicidal_today/,Alcoholic husband suicidal today,"So my husband (early 30s) is an alcoholic beer drinker. 
Lately we’ve been fighting more then usual due to his drinking and me feeling like I get no help. 

Today I got home and he was about to go drive while drunk. I said no legs eat and hang out and he broke down crying. 
He said he feels broken and useless and I can do better. That he has no purpose and I don’t need him so why should he live. 
I got him calm after a few hours and he’s been sleeping since but I’m so scared. I don’t want him to harm himself. 
I love him so much why can’t he see how much I do need him",3
2020-08-30 19:30:40,https://www.reddit.com/r/alcoholism/comments/ijn324/alcohol_halucinosis_vs_dts/,Alcohol Halucinosis vs DTs,"Hello sorry if this is the wrong place to post this. My brother is an alcoholic. The last time he quit drinking he was having halucinations, hearing things like repetive voices and seeing things briefly. He is back to drinking and i am worried he will have dts? What is the progression to dts from these hallucinations or are they same thing? I hear each time you quit the withdrawals are worse. Is this true? I am quite worried. Sorry if wrong place and thanks for any help or knowledge. 

Thank you.",4
2020-08-30 18:11:16,https://www.reddit.com/r/alcoholism/comments/ijlrbd/anyone_on_here_ever_successfully_quit_alcohol_and/,Anyone on here ever successfully quit alcohol? and how?,"So there was a time in my life a few months ago, where I actually gave up alcohol, and my personality was in such a state at that time that I didn't even enjoy it. It was very surreal, and it felt like I was possessed by angels or something. But recently I got back into it and my personality changed so much, I'm less sociable, because I'm craving and thinking of the alcohol, and not other people. I'd like to quit that again tho, and was wondering if you guys have any advice. I think it may have something to do with the law of attraction, your thinking of the alcohol, and not productive things in your life. Does anyone know any science behind how it changes you? and the changes you should make in order to stop?",2
2020-08-30 17:27:12,https://www.reddit.com/r/alcoholism/comments/ijky3u/6_years_of_drinking/,6 years of drinking,"I'm 25 and drink a 42oz of crappy Old English a day, sometimes 2. I throw up once and a while and my kidney always hurt. When I don't drink I feel depressed and bored, even when I do stuff I still want to drink because it makes it more fun. I have no friends or social life, and I think this is what fuels my habbit. I want to quit, but I feel there's no point because I don't like the world I live in. I want to find happiness, but I don't have the energy to look so I just drink to numb everything.",1
2020-08-30 16:56:22,https://www.reddit.com/r/alcoholism/comments/ijkcj2/is_it_normal_to_feel_depressed_in_early_sobriety/,Is it normal to feel depressed in early sobriety?,"Hello, I’m on day 3 of being sober. I’m having a lot of struggles with depression. Is this part of anyone else’s experience when first starting out sober. I’ve been working out to help, but if anyone else has tips I’d love to know. 

Thanks",3
2020-08-30 13:32:17,https://www.reddit.com/r/alcoholism/comments/ijgob4/drank_everyday_for_5_years/,Drank everyday for 5+ years...,"When I stopped drinking I IMMEDIATELY felt MASSIVELY better (after i got through the first two sleepless nights).

I still drink a bit every now and then, but I almost never get hammered anymore and don’t drink at all 85% of days/nights.  I didn’t know what life was like sober and how focused and productive and happy I could be without it.

Mostly making this post just to say the benefits were IMMEDIATE and HUGE.  Like I just didn’t think I could feel in control of my life so quickly.

And MY SLEEP 😍!!!!!!!! My god I love mornings now!!!",3
2020-08-30 10:13:03,https://www.reddit.com/r/alcoholism/comments/ijdad1/its_not_a_lot_compared_to_some_others_battling/,It's not a lot compared to some others battling this out here but today I'm 3 days sober!,"Crossed the 3-day mark with minimal withdrawal symptoms. I can't believe I really went a whole 72 hours without a drop of alcohol. The alcohol store is right by my house and it's tough driving by without dropping in but Im doing it! I don't want to die young, I don't want to feel numb, I don't want to be weak anymore.",129
2020-08-30 04:37:42,https://www.reddit.com/r/alcoholism/comments/ij9ktr/when_to_seek_medical_attention/,When to seek medical attention?,"Binge drinker here... never been the hair of the dog kind of guy, and yeah, I know binging is far worse for your brain. And I've binged straight for the past... shit, two years with a day or two off here and there , maybe longer. I'm at the point that 16, 17 beers barely gets me to the point I want to be at.
I guess my reply question is, should I seek medical help in quitting?",5
2020-08-29 22:53:38,https://www.reddit.com/r/alcoholism/comments/ij5i6h/helpless/,Helpless,"I am stuck. So stuck that really the only thing I have to do with my days is drink. I have absolutely no motivation for anything else(also unemployed). My boyfriend (of 2 years) and I always fight about my drinking, because I get very.....rowdy/“crazy”? I think this last fight was really it, it’s been 2 days since we’ve spoken. Last fight we went 8 days without communicating at all. I know I have a problem, and right now everything is a million times worse because my partner isn’t here. So I had my first drink when I woke up at 11, and who knows about tomorrow. I don’t see a light at the end of the tunnel.",5
2020-08-29 22:46:05,https://www.reddit.com/r/alcoholism/comments/ij5e1t/drank_3_bottles_of_cologne_now_i_feel_constant/,Drank 3 bottles of cologne now I feel constant upper stomach pain.,"I’m an idiot and I needed to get a fix, so I drank 3 bottles of cologne. I now have upper stomach pain. I got a blood test and my ALT is 140 and my AST is 91. I’m getting a sonogram tomorrow. Should I be worried about permanent liver damage? The pain scares me let me know.",1
2020-08-29 13:44:50,https://www.reddit.com/r/alcoholism/comments/iiwpob/screwed_up/,Screwed up,"I quit shooting meth and heroin and drinking, cold turkey, with  no help, almost 5 years ago. Today, I fucked up and got drunk and honestly, I don't feel bad about it. It's my first relapse since getting clean and at least it was just alcohol. I normally would feel guilty as hell but this has probably been the worst week of my life. This week my best friend of 14 years died, my cousin was paralyzed while serving in the military, I lost my job due to COVID-19, my wallet got stolen with absolutely everything I need in it, my medication specialist quit and didn't refill any of my 3 psychiatric medications so I'm going through withdrawal and experiencing psychosis, my brother got physical and screamed that he's a cannibal and I'm lucky that he hates eating tattooed people, my fiance dumped me because of my unemployment and so, I also became homeless. I don't think I'm a weak person for breaking right now. I'm not going back to my old ways. I just need to feel like messing up at this moment is okay and forgivable and I don't think anyone in my real life can understand.",2
2020-08-29 13:24:21,https://i.redd.it/32stzwvd7zj51.jpg,Quit drinking you will thank yourself for it.,,352
2020-08-29 11:57:54,https://www.reddit.com/r/alcoholism/comments/iiusn8/how_it_ended_14_years_ago_today/,How it ended- 14 years ago today,"14 years ago on this date I took my last drink of alcohol.

The weekend started innocently enough, with drinks for a co-worker's birthday on a Friday afternoon. FFWD to the following Tuesday, when it ended. One drink turned into hundreds, one night turned into 4, and I awoke in some sleazy motel alone and bewildered. How the fuck did I get here?

College educated, good job, nice house, wife, nice car, etc. I couldn't be an out of control alcoholic. No way. But there I was, alone, felt like shit, spent a ton of money on activities I'd never engage in if not drinking, we all know how it goes. The self-loathing was at an all-time high.

Home I went. I unbuckled the seatbelt and ran the speedometer up...I was going to swerve into one of the concrete barriers, and be done with everything. But I couldn't do it.

I called a friend who I knew was battling alcoholism. I asked for help. I became willing to do whatever it took to not feel this way ever again. If those who had recovered said to do it, I checked the manual and assuming their advice was mostly outlined in the text, I did it. No argument, I just fully surrendered. 

Not here to boast about my accomplishment to date, only to tell those who are struggling with what they think might be a problem: there are others that will help you, and you can do it. I could not have done it alone, I tried a bunch of times on my own- everything. Beer only, never before 5PM, only on weekends, setting limits. Didn't work. Until I got the support and guidance from others who had been there and done that.

So....if I can make it through today, I'll have 14 years off the alcohol. Life does get better, but it doesn't get perfect. To anyone struggling: if I can do it, you can too. Ask for help, become willing, and do the daily work. 

Have a great, alcohol-free weekend everyone. I'm going to try not to drink today, then consider doing it again tomorrow if I make it through today. That's how it works.

With gratitude...",82
2020-08-29 11:54:40,https://www.reddit.com/r/alcoholism/comments/iiuqn2/my_cousin_is_killing_himself_need_advice/,"My cousin is killing himself, need advice.","I’m looking for help on how to approach and talk to my cousin. He’s only 32 and was just in the hospital for the 3rd time for pancreatitis. He hasn’t even been out a week and his girlfriend claims he’s drinking again, she’s not the most reliable source but is about the only one there is. His parents are in complete denial about it despite being hospitalized 3 times in the last few years. They make any excuse to what it could be other than his drinking. My buddy and I want to do something, we know ultimately it’s his decision to make but would like to at least reach out since all other attempts by others have fallen on deaf ears. Just looking to get any kind of advice on the best possible ways to approach the situation. Thanks.",4
2020-08-29 09:28:42,https://www.reddit.com/r/alcoholism/comments/iisdpz/i_cant_even_get_off_to_porn_anymore/,I can’t even get off to porn anymore,"If you think life is bad now.... imagine needing a drink just to not shake. Imagine your dick never working... imagine having no money, EVER.

Alcohol is hell. I can’t even afford rehab.",1
2020-08-29 09:15:32,https://www.reddit.com/r/alcoholism/comments/iis728/did_i_just_experience_the_effects_of_an_alcoholic/,Did I just experience the effects of an alcoholic in my life?,"So my ex and i were together a year and a half. He had issues with drinking last summer, would get really emotional and break up with me, try to make reckless decisions. It was hell. Eventually it all came to a head when he blacked out and punched a hole in my wall and got arrested. I was devastated and the court ordered him not to drink and gave him a SCRAM to breathe into 3x a day. When this happened, we talked about it a lot and he said he was fine without alcohol, that he saw this as a good thing, he would never drink again bc alcohol has never done anything good for him. But he would still be able to be around it, encouraged me to still have a drink to wind down, would go out with our friends and stick to Gingerale. So he had me convinced he wasn’t an alcoholic because I thought if he was one, he wouldn’t be able to stay off it.

Fast forward to present day, he broke up with me randomly early Wednesday morning after showing up to my house after drinking. It was the first time I’d seen him drunk since last September. I knew he’d had a sip or two here and there, but he hadn’t been drunk, and he had committed out of his own willpower to continue not drinking when he no longer had the SCRAM. He told me he only had two glasses of wine, but he was slurring and falling over and was clearly extremely irritated, so me addressing his state only served to rile him up more. I feel so stupid because this is exactly what used to happen last summer when he would drink and explode on me. 

I just feel like, was I that blind? Was I dating an alcoholic this whole time? I’ve never had anyone close to me in my life who had major problems with alcohol so I feel like I may have just been blind to it. I’m heartbroken over the loss of my relationship and now on top of that I feel so confused just regarding what even just happened to me.",4
2020-08-29 07:01:05,https://www.reddit.com/r/alcoholism/comments/iiqkdy/alcoholism_and_cancer_risk/,Alcoholism and cancer risk,"I've been having anxiety over the risk of developing some alcohol related illness, even decades after I quit. I did some research. Hardly scientific but thought I'd share what I found. Using the information on this page https://www.cancer.gov/about-cancer/causes-prevention/risk/alcohol/alcohol-fact-sheet  
and incidence rates off Wikipedia. It's reassuring that I don't have like a 50% chance of getting cancer like I was imagining, or something, so I don't have to stress over it to much (which is also a cause of cancer apparently)  
The odds  of developing cancer in heavy drinkers over a span of 55 years for a male (the risk is generally lower for females, except for breast cancer), ignoring all other risk factors, appears to be:  
oral - 5x increased risk. general incidence 6.3/100,000 per year -> 1.7% chance  
larynx - 2.6x increased risk. general incidence 5/100,000 per year -> 0.72% chance  
Esophageal - 5x increased risk. general incidence 5.2/100,000 per year -> 1.43% chance  
liver - 2x increased risk. general incidence 7.2/100,000 per year -> 0.79% chance  
breast - 1.6x general incidence in men extremely rare  
colorectal (bowel) - 1.5x increased risk. general incidence 1 in 19 by age of 75. 1/3 death rate. ->7.9% chance.

Once again, this ignores all other risk factors, including age, and probably isn't terribly accurate. 

In addition, quitting lowers your odds over time, however it can take some time to see the benefits. I can't remember where I read this, but even 16 years after quitting you are still at an increased risk.

Light drinking gives a modest increase in risk. Some have talked about possible health benefits of light drinking, for example drinking red wine, however the negative impacts of doing so outweigh the benefits.",1
2020-08-29 06:08:08,https://www.reddit.com/r/alcoholism/comments/iiq15i/quiet/,Quiet,"A calm mind is all I ever wanted!  When I was drinking I always had a group of screaming advisors in my head! Each suggestion always led me back to selflessness and ego driven decisions that ended up in the same puddle of self pitty! Sober and clear, the advisors are still present...but they only chime in when I ask for help, they are not voices...they are people in my life and who offer clarity when I am unsure! I am a greatful recovering Alcoholic.",2
2020-08-29 05:41:21,http://www.deepsober.com,Deep Sober,,2
2020-08-29 02:41:35,https://www.reddit.com/r/alcoholism/comments/iinw0f/i_am_going_clean/,I am going clean,"Alcohol has caused many problems including skin breakouts, digestive issues, and the inability to sleep without it. I have been naive to the fact alcohol is behind all my issues. Today August 29th I will be going clean from alcohol!",2
2020-08-28 23:47:46,https://www.reddit.com/r/alcoholism/comments/iils5r/drank_3_bottles_of_cologne_now_i_feel_constant/,Drank 3 bottles of Cologne now I feel constant upper stomach pain.,I’m an idiot and needed to get a fix so I drank 3 bottles of cologne. I now have upper stomach pain. I got a blood test and my ALT is 140 and my AST is 91. I’m getting a sonogram on Sunday. Should I be worried about permanent liver damage? The pain scares me. Let me know.,2
2020-08-28 23:41:03,https://www.reddit.com/r/alcoholism/comments/iilox2/how_do_you_deal_with_boredom/,How do you deal with boredom?,I’m sure I’m not the only one who drank when they were bored. Sitting at home all day has been awful. Thankfully I have a few good people for support but it’s been rough. What do you do when you’re bored and the only thing you can think of doing is getting drunk?,6
2020-08-28 23:30:35,https://www.reddit.com/r/alcoholism/comments/iiljp2/waiting_waiting/,"Waiting, waiting","Guys, I'm a fucking drunk, I'm an 'alcoholic' (I still have a problem with that word) I'm currently waiting for a medical detox but with fucking covid it's shut at the moment. I'm so desperate, I'm waiting and holding on, but it's so hard you know? What do I d9 to stay strong?",1
2020-08-28 22:40:53,https://www.reddit.com/r/alcoholism/comments/iikuki/brother_is_an_alcoholic_severely/,"Brother is an alcoholic, severely","I’m shaking while writing this so please bear with any typos or grammatical errors —
Brother (34) has been an alcoholic for a few years now. He’s hit rock bottom: no job, new gf almost every couple of months, health issues, lives at home with parents, no goals or future, and two DUIs (luckily no license now and parents are holding onto his keys). He drinks hard alcohol throughout the day and I honestly can’t remember a time he was sober.

We’ve had a few “interventions” and have tried to offer any support we can but nothing has changed.. it’s gotten significantly worse. I’m to the point where I’ve become so resentful because my parents are older and the stress of my brother is taking a toll on them too.

I know it’s not my brothers intention to hurt them but his refusal to seek help is weighing down on everyone.

How can we help? I have no clue what to do. We can’t keep going on like this... any thoughts? Can you admit a family into a care center without their consent? Is it frowned upon?",5
2020-08-28 21:55:15,https://www.reddit.com/r/alcoholism/comments/iik6od/if_you_were_to_have_a_drink_after_going_through/,"If you were to have a drink after going through detox and withdrawal, what would happen?","Besides the whole relapse thing, obviously. Like if you were to have a drink after going through detox and withdrawal, what would happen? Would you then experience withdrawal symptoms again?",5
2020-08-28 20:42:22,https://i.redd.it/v8vfheem8uj51.jpg,Sobriety Tattoo.,,131
2020-08-28 16:44:52,https://www.reddit.com/r/alcoholism/comments/iif5h2/want_help_but_dont_know_if_aa_is_the_right_move/,Want help but don’t know if AA is the right move,"I’m 20 and from Ireland. I’ve been suffering from alcoholism since I was 16 and for the past two years I’ve been up and down. Sober then relapsing then trying to have control over my drinking and relapsing again etc. My psych and one of my therapists both suggested AA and I went to a rehab for minors when I was 17 but from what I can gather about AA is that their soul goal is sober and considering the drinking culture is so strong where I’m from and I’m so young I don’t really want to give it up completely, I want to just have control over it. Is that wishful thinking? Is that something that is just never going to happen? I’m starting to feel that way but I was hoping maybe someone more experienced could tell me if the only way to over come this is really just to get sober or if it’s possible to manage",5
2020-08-28 16:18:36,https://www.reddit.com/r/alcoholism/comments/iiensa/is_there_any_connection_with_alcohol_and_neck/,Is there any connection with alcohol and neck problems ? Like cervical pain or anything similar ?,,3
2020-08-28 15:56:43,https://www.reddit.com/r/alcoholism/comments/iie8ug/a_bottle_of_good_bourbon_for_11_a_30_pack_case/,"A bottle of good bourbon for $11, a 30 pack case for $21.. what are they trying to kill us?","I get it. With GMO and production efficiency they are lowering the cost and passing it down to the consumers. I saw a cheap bottle of vodka for $5 at a local discount liquor store a few weeks back. With alcohol getting cheaper and more available, it's an uphill fight for most of us here. With the pandemic, people are drinking more at home and local government is allowing alcohol to be delivered to your front door to ""save the restaurant industry."" So, literally drunken people don't even have to get off their couch anymore when they want to get more drink. 

Cheaper and more readily available. Very decent Kentucky bourbon aged for 8 years for $11 dollars when you buy two. 30 pack case of beer for $21. Looks like I might have to go off the grid just to stay sober and away from all the temptations.",8
