Date,URL,Title,Body,Score
2020-08-15 21:18:21,https://www.reddit.com/r/alcoholism/comments/iajk63/grief_inception_antidepressants_cigarettes_and/,"Grief, 'Inception', antidepressants, cigarettes and alcoholism","&#x200B;

It's been an intense few weeks.

Stopped taking Citalopram. Mood swings, brain zaps, nausea, vivid dreams, agitation. Pleasure, memory, anger, frustration, despair, ecstasy.

I don't think the  words exist to truly capture it. Rapturous catharsis. It's like meeting myself all over again. Parts of me that existed in feelings and thoughts that were so far away away, so utterly inaccessible, that I forgot they existed entirely.

I'm still me, but more me. Me but more nuanced. I can go deeper. Resonation doesn't just hit my chest, it pours down my body and ping pongs off my toes and comes shooting back out my mouth. Completely different but utterly the same.

I saw *Inception* in the cinema. Tenth anniversary thing. I hadn't been to the cinema since they started reopening - *Jojo Rabbit* was the last thing I saw, I think. Never got around to catching *Parasite* before the world ended. Anyway, *Inception* hit me like a freight train. I could hardly stop crying. It welled up in me in waves, but as the movie went on I caught the themes that passed me by as a teenager. Legacy, losing a parent, regret, catharsis, transformation, inspiration and change.

I needed one more conversation with my father before he died. He never got my postcard. It arrived the morning of his funeral. He wanted to speak to me - there was a reminder in his phone. But he died. I didn't go to see his body. I wish I had.

None of that can ever change, and you know what that is? A fucking tragedy. A full on, Greek-style tragedy. I'm never going to know what he wanted to say. I'm never going to know what exactly happened the night he died. Or what he thought and felt.

But I do know he suffered. Technically he died of a heart attack, but really he died of a myriad of physical problems caused by his alcoholism. And his alcoholism was caused by pain. Excruciating pain he could not live with, pain which he drowned out with alcohol, causing himself more suffering in the process. He killed himself slowly over more that 30 years.

Pain like that can never truly go away. He finally stopped feeling it after breathing his last breath, but it's not gone. It didn't go away when his body was burnt to ashes or when we buried those ashes and planted an oak tree over them.

I truly don't believe there is any escaping your parents. Nothing can ever change anything that which happened before. I'm obviously terrified of living my father's story out myself. I'm definitely dependant on alcohol. It's a fundamental part of how I engage with my life. I have not gone a week without drinking without very actively choosing to do so in more than 9 years. My hangovers are more or less a weekly ritual and they're getting worse. My body does not feel good. I feel it in my thumping heart, my dry mouth, my throat and lungs aching from all the cigarettes. I struggle to think and smile. I am hurting myself, inside and out. I am afraid that I'm already walking down the path of slow, painful suicide. I don't want it, but I think part of me feels that I deserve it. And that it's inevitable.

After the cinema I cried to my friend. I explained that I wasn't prepared for what it would bring up in me. She was understanding. I asked her not to be alarmed and we both agreed that grief come in different forms, in different stages, at different times. I turned down her offer to talk about it more. We were in public and I literally physically couldn't talk about it more - I would have just kept crying uncontrollably.

We made small talk about face masks and had a cigarette and then I went home. I cried on the way to the bus, on the bus, on the walk home and in my room. I am so glad we didn't go for a drink because I would have gotten drunk. I wouldn't have stopped until my body stopped.

When I got home I cried more. I made the bed and I cried. I crouched on the floor crying. I listened to some music and had a cigarette out the window. Then I meditated for the first time since I started taking antidepressants more than two years ago. I picked up a book - because I wanted to, not because I felt like I should - Haruki Murakami. His words feel like home.",5
2020-08-15 20:50:55,https://www.reddit.com/r/alcoholism/comments/iaj4x6/whats_the_best_way_to_get_treatment/,What's the best way to get treatment?,My mother is an alcoholic & I have no idea how to help her. What's the best treatment approach? She really needs help and before talking to her about it I would like to be able to explain to her some good options,2
2020-08-15 16:08:13,https://www.reddit.com/r/alcoholism/comments/iaeg13/childhood_abuse_disclosure_leading_to_relapse/,Childhood abuse disclosure leading to relapse,"Trigger warning for sex abuse. Not sure if this is allowed here, but...






My 13 year old niece that I am close to came toward last week that my stepfather has been molesting her for awhile. My sister is doing everything right getting her to the children’s hospital, she’s filed charges and for a protective order, and she’s already had her first therapy session. 

But I am struggling right now. I’m working on getting counseling for myself to also process the grief/pain/betrayal/anger that this brings up, but I want to drink very badly. I was emotionally and physically abused as a child, and it’s hard to accept that we couldn’t protect my niece from experiencing abuse as a child too. I realized I don’t even know how to process things in a normal, healthy way because I’ve turned to drinking for so long when something painful was happening in my life. I feel like my coping mechanism has been stripped from me when I’m experiencing such a negative life altering situation. I’m so fatigued mentally and physically from fighting both issues, but I haven’t slept or eaten in almost 2 days. I have been sober the past few days...but wine—as a sleep inducer—is whispering sweet lullabies to me. I’m trying to push forward without it.",13
2020-08-15 14:01:59,https://www.reddit.com/r/alcoholism/comments/iac4cc/please_anyone/,Please anyone,"I might get drunk today, and I'm scared of that.i just want to be a loving person. I just dont want booze near me and it's hard to say no. So I'm crying instead of drinking",20
2020-08-15 01:52:17,https://www.reddit.com/r/alcoholism/comments/ia26ac/do_i_drink_to_much/,Do I drink to much?,"I drink about 2 half gallons of Jim Beam per week. Most common things bore the shit out of me like mowing and common household stuff. I work 40+ hours a week no problem. I just seem to hammer down when I get home. I am married with 2 kids at home. Maybe I am just a functional alcoholic???? My wife says she is fine with my drinking,  but I can see she looks at me differently now.",3
2020-08-15 00:42:00,https://www.reddit.com/r/alcoholism/comments/ia1bya/sick/,Sick,"Woke up in my bathroom puking on myself, not in the toilet. Don’t know how I even made it to the bathroom. When I garnered the strength to stand up, found puke all over my face and in my hair. Took shirt off, lightly rinsed head in sink then made way to couch to go back to sleep. 

After waking up in the morning, starved & dehydrated, I found I had puked on 2 spots on a rug I really liked, on 2 pairs of good shoes, and on the pillow I slept on. Things were knocked over and strewn about. Don’t know how many beers I had but had drank ~700 ml of the 750 ml ole smokey moonshine jar. Definitely don’t remember drinking all that. 

Took several hours to conjure the energy to shower, roll up the rug (haven’t decided whether to replace it or get it cleaned—each option is about $100), make coffee. As for productivity, I haven’t done anything important today. 

I’ve had a very sore throat ever since I was gargling my own vomit and wonder if I picked up the covid at the liquor store yesterday or if it’s just a day long side effect of my bender/dehydration/snoring. Have a sore spot on my back and wonder if I fell over backwards during any of that. 

I’m 37 and live alone in this misery. When I go back to work Monday, they’re going to ask me how I spent my extra day off and I’m going to lie and say I did something interesting.",30
2020-08-15 00:18:38,https://www.reddit.com/r/alcoholism/comments/ia11ir/i_have_5_days_sober/,I have 5 days sober.,"I grew up with addict parents, watched them go through recovery. Now by the age of 25 I am a full blown, drinking every day alcoholic.

I started writing how i was feeling when getting the strong urge to go buy a beer and it turned into something i was kinda proud of so i thought id share it here.

one thought at a time is more like it...

&#x200B;

 

It's funny how much i didn't pay attention to when i was drinking every single day. Theres just overwhelming need to get the fuck away from being completely conscious and mindful of the world around me. Of my own thoughts, about myself, about my peers. The worst part was the willful and ignorant disregard towards my son.

I just really need to ignore those thoughts that i'll live with for the rest of my life thoughts “hey bud. It won't hurt any. Just go get you some and cut loose” “How much money do we have? Shit that's totally enough” “Look at them, they're doing it!!”

God i wish you would just shut up, and leave me the fuck alone. I have the ability to actually accomplish all the things in my life that i want and the only way i'm going to do that is get off my ass and do them. I just made the mistake of inviting you along with me. If i have to spend the rest of my life with you in my head then i want you to spend the rest of my life suffering and losing. You were the worst mistake I've made in my life so far and this is where I make the choice. The choice to better myself, to do the things that aren't exciting or curious but the things that will keep me healthy so i can achieve all the things that i was meant for. I will hold my head high above a crowd and the people will cheer my name.

Are you a blessing or a curse? I've always said that the reason I seem so grounded is because of the shitty state of my upbringing and the garbage setting that it took place in. id go so far as to say that you are ever worse than those circumstances, making them seem pleasant in comparison… So in that respect, are you the catalyst that pushes me across the threshold? Are you the driving force that is the make or break of me? If I succumb you don't necessarily win. If I die then you die. So do you take the guise of a demon but maintain the intention of the righteous? The further you push me to destroy myself, depending on the choices I make, can inspire me to spring my gifts and my mind onto the people in this world that I could inspire, the people that can relate to me. The ones that need to see that it's not impossible to stand up to you. To make you suffer as we have suffered.

You posses the rivers of my mind

You creep through every rock of sanity

You tarnish every leaf of prosperity

The stench you bear clouds my judgement

I want to rid myself of your noxious torment

That it seems, is impossible.

So i'll use your possessive nature to my advantage

And my mind will be a spring

You'll creep through and find the bedrock of my strength 

Leaving my sanity intact

The leaves you've left tarnished will stay by the new

Flourishing and prosperous with change

Your foul odor will linger no longer

By the refreshing wind of clear judgement

I'm glad that you're here

Because of you, I will do the impossible.",5
2020-08-14 19:01:38,https://www.reddit.com/r/alcoholism/comments/i9wd20/i_fell_of_the_wagon/,I fell of the wagon,"Yeah, I caved in yesterday after it got home from work. It’s been a stressful couple weeks and had been successful until last night. I was kinda in a dark place and said screw it. I Feel bad about it and am trying to make it through today. About to grab some topochico or something. 

I Kept busy and helped some family around the house to do something productive and keep my mind off of how I royal screwed up the night before. Here’s to making it to day 2",9
2020-08-14 14:57:08,https://www.reddit.com/r/alcoholism/comments/i9rxym/on_taper_and_questions_about_it/,On Taper and Questions about it.,"posted this and ill post every day. I'm coming from 20+ drinks a day for over a year and half. Two months ago I've had it. My body couldn't take it. I started getting sick in the mornings. 29m 160lbs and 5'11. Active.

I started a taper schedule and got down to 10 a night. a month ago. It was toughhhhhhhhh. I was laid up next to my partner wanting to live and wanting to die.

I'm at the 10 count and now I have very bad dry-heaving nausea and vomit past few weeks. I was missing work, and class.

My aunt went through the same thing we've had a horrible death in the family. She was able to get down to 4 beers a day.

Her routine was: Wake up have a few sips if you feel sick in the morning then maybe through out the day and continue with your count at night removing 1 drink every few days.

I drank half a unit while I felt the dry-heaving puking coming along and it vanished. However is this a safe way to taper? I've read the HAMS. I just want to do the right thing. DETOX IS CLOSED IN MY AREA DUE TO COVID19. Unless you have some deep pockets. Edit: Hospitals full as well. Location HTX",3
2020-08-14 11:24:55,https://www.reddit.com/r/alcoholism/comments/i9nyci/blood_test_done_not_good/,blood test done not good,"I have 2 liver markers very high in my blood

I’ve been having bad abdominal pain for a while

Doctor sent me for bloodwork and I’m awaiting an ultrasound 

I guess this is my wake up call.",41
2020-08-14 10:53:08,https://www.reddit.com/r/alcoholism/comments/i9ndqi/i_was_an_alcoholic_and_now_i_am_not_sure_need_an/,I was an alcoholic and now I am not sure. Need an unbiased perspective,"Dear reddit community,

I am 19 and have struggled with substance abuse in the past drinking anywhere from 10-20 shots a day while also taking xanax and cocaine. Over the course of a year I was taking xanax and drinking this much nearly everyday without break despite my consequences. I wanted to stop but I could not. Because of my inability to stop I checked myself into rehab for 3 months and dealt with my real underlying issues such as my depression. Over the course of this year since I have been out of rehab I have been drinking casually, maybe 3-5 beers every other week, and have no cravings and feel no compulsion to drink during the day. Is this denial or is it really possible that I may be able to drink in moderation now. I am not depressed anymore so I feel no real urges and often am more than willing to DD my friends. I have been living a happy life and am fully pursuing my passions. I also have not taken any drugs other than alcohol and occasionally nicotine since rehab.

&#x200B;

Thank you",3
2020-08-14 10:15:09,https://www.reddit.com/r/alcoholism/comments/i9mq9y/dehydration_as_a_trigger/,Dehydration as a trigger?,"Does this happen to lots of people? I'm finding its so much worse when I just needed to chug some water, bit by the time I realise I already feel like I've committed to drinking and I find it also impossible to talk myself out of it. It also ends in a daily cycle that takes me about 4/5 days to get out of.


I couldn't find anything on Google about it though.  


I'm on day 2 right now, sitting in the bath trying not to go out and get some wine for a Friday night in. Just rying to analyse what sets me off. (Boredom, stress, anxiety, sunny weather, very cold weather, dehydration)",2
2020-08-14 10:02:17,https://www.reddit.com/r/alcoholism/comments/i9miag/3_years_on_from_alcoholic_mums_death_life_is/,"3 years on from alcoholic mum's death. Life is happier without her, so why am I crying?","Today is the 3rd anniversary of my alcoholic mother's death. Since then no-one has screamed in my face, called me names or generally made my life miserable and difficult.

My life is easier now, happier even. Then why do I hurt so much? 

No one questions my sadness  because any normal person would be sad on the anniversary of their mum's death, but they don't seem to understand and they look at me shocked when I tell him I don't miss her. I just miss the idea of her, the idea of having a mum. But the reality is I didn't really have a mum. My sisters looked after me till I was 8 then they went to University and then I was left to my own devises after that. 

I think that while she was alive I could keep hoping that one day if I tried hard enough I would be able to help her to stop drinking and I would get a normal mum. But when she died the fantasy died with her.  I will never be able to help her to recovery. I feel useless because of it, like I failed. 

I feel guilty for being happier now, I feel guilty because I gave up on her. She was depressed and I turned my back on her and now I can't forgive myself. 

People just keep saying I hurt because I lost my mum, but I think it's because of much more selfish reasons that that. I just want to feel like I did my best, but I don't know how.",7
2020-08-14 09:37:50,https://www.reddit.com/r/alcoholism/comments/i9m3wu/alcohol_and_health_problems/,Alcohol and health problems,"Lately I had a substance abuse councilor and a psycharist ask about any health problems I have had from my previous drinking history. I am 16 month sober now but have had CFS(chronic fatigue symdrome) for about 4 years now. It got me thinking that CFS is a diagnosis of exclusion and maybe there was something they missed.

So I was wondering is there any health problems that I could have caused from previous drinking history that still would be a problem after 16 month sober? Or any health problems at all, that could have lead to the CFS?",3
2020-08-14 01:01:11,https://www.reddit.com/r/alcoholism/comments/i9fu5z/sleep_walkinghallucination_while_drunk/,Sleep walking/hallucination while drunk,Hey reddit folks. I recentley stopped drinking alcohol but have been a heavy drinker my entire life ( though I am a very functional person otherwise) but anyhow that not my question. So sometimes when i get very drunk i hallucinate where I am. All my surrounding change and its very very wierd. Like if im sitting in a room ill all the sudden be outside ir in some weird place ive never been ( again i have to be really messed up for this to happen but its happened) has this happened to other people? Now that im not drinking and thinking about it its pretty scary. So another thing. I have slept walked 3 times in my life (all after falling asleep drunk). The last time I guess I got out of bed and went to my garage and slept on the chair in there. One time i crawled out of a window and then kinda came to and went back in (i was sleeping naked so im really really glad noone saw me) i thought it was a dream buy my partner woke up when i came back in and confirmed later it was not. Has THAT ever happened to you before? Both of these things are pretty freaky thinking back and i cant find much online so just curios. Thanks.,1
2020-08-14 00:54:19,https://www.reddit.com/r/alcoholism/comments/i9fqzu/my_side/,My side,"It's hard to not let my ego ""drive the train""! When I hold on to a resentment, it's really like holding on to a hand grenade with the pin pulled! Someone told me ""Resentment is like drinking alcohol and expecting the other person to get sick!"". Well, that's truth, which is why I need to deal with a resentment that I've been holding on to for about 6 months.  Have a great day people!",2
2020-08-13 21:11:49,https://www.reddit.com/r/alcoholism/comments/i9chqv/i_think_i_need_help/,I think I need help,"I have no self control, I go out for a liquid lunch with my friends and everyone leaves after a couple of beers and I always stay till the early hours. I can’t stop myself till I’m sitting in my own vomit again.

How do I drink socially without going too far",1
2020-08-13 18:58:56,https://www.reddit.com/r/alcoholism/comments/i9abyo/dont_believe_i_can_do_it/,Don't believe i can do it,"I have tried so many times to get sober, but i always end up getting wasted again :( I have no belief in myself that i can get sober, and have low confidence because of my relapses into alcoholism. I've had the skakes, organ damage, probably brain damage, so i wanna quit so fucking bad. Do you have any advice for me in trying to stay sober.",13
2020-08-13 18:18:24,https://www.reddit.com/r/alcoholism/comments/i99m70/19/,19,in the past couple years  i’ve developed what’s a problem with drinking now. i’ve been in the mental unit twice now already from alcohol related shit. i know it’s not too late to try and cut back. it’s getting hard though. what would advice would you have gave your 19 year old self in terms of booze?,2
2020-08-13 17:28:09,https://www.reddit.com/r/alcoholism/comments/i98pm5/how_do_you_stay_sober/,How do you stay sober?,"I(22F) drink all through the week, most of the week. I don't want to anymore. I go through almost 2liters of liquor per week. (For over a year)

Starting today I want to stop that, but I dont feel like I know how? Anytime I would get bored or any minor life inconvience, I would grab a drink. So I guess really HOW do I stop that? Like it sounds easy but at times I just crave it and its like I cant stop myself?

When you're craving what do you do? How do you deal with it? Any resources I should look into? Please help. I'm open and willing to listen, I just feel like I cant do this to my husband, friends, or family any more.",3
2020-08-13 15:02:10,https://www.reddit.com/r/alcoholism/comments/i95zo6/encephalopathy_and_end_stage_liver_disease/,Encephalopathy and end stage liver disease,"So my dad died in June from multiple organ failure ultimately due to his alcoholism.

His doctor said he had encephalopathy, now that I've done more reading I see there are different kinds. He never said what kind, how can I know?

I'm also curious because I read that it's reversible, but the hospitalist told us it wouldn't be. He said that my dad's liver was failing and the only option was liver transplant and they refused to give him any more life sustaining medication. They said none of the medication they gave him was working because of his liver. But the Ativan worked. Later at Hospice, the morphine and the Oxy worked... why didn't any of the life sustaining medications work but these medications did?

I just feel like they didn't do all they could have. It's hard to know because when he was in the hospital we couldn't see him until they decided they to stop giving him meds. They kept him sedated, even if he wasn't sedated he wouldn't have been able to call us because he was basically out of his mind. Then we were added to a short list of visitors allowed on the hospital. When we saw him it was obvious they had been neglecting him.",6
2020-08-13 12:27:12,https://i.redd.it/532sev59qsg51.jpg,"I started a new job designing apparel for a sober living clothing company. I've never been addicted to substances like my bosses have, but I've recovered from other things in life and really like the message they are trying to send.",,100
