Date,URL,Title,Body,Score
2020-08-06 15:11:37,https://www.reddit.com/r/alcoholism/comments/i4y31h/my_lack_of_self_control_scares_me/,My lack of self control scares me,"I was drunk last night, called in sick this morning because I had alcohol related anxiety.
I’m scared of all the money I’m wasting what if I can’t pay my bills next month?
I hate my body. The only time I seem to be in a good mood is really early in the morning, drinking coffee. I hate my job too.

It’s not the job it’s being around people.
So I was listening to my favourite musician on a twitch stream this morning, tried to write some progressions and melodies of my own. Now after I ate a bunch of food to try get rid of the hangover it’s not even 1pm and I want to start drinking just because I keep getting this sinking feeling.

I keep feeling like every day is a waste of time, waiting for payments, waiting for bills, waiting for my diet to pay off, waiting for my doctors appointments, just waiting.
I took a break from trying to write music for only a few minutes and now I think I should drink. Just to get rid of the weird sinking feeling. The logical response would be to not drink so that I don’t have to feel like this tomorrow.

Before last weekend I was 3 weeks sober, then I drank for two days. Then I got another bottle maybe days later. Logical response would be to just ignore it but it just keeps getting more difficult by the hour. 
I don’t want to get wasted I just want to stop feeling so depressed and anxious but I always end up getting wasted. I don’t want to become an alcoholic, no one seems to be concerned about the amount I drink but I also am 23F and live alone.
I felt ok this morning, but by noon I feel like crap, usually every day is like this. I want to write more music with the computer, but I want to drink a bit first so I don’t feel depressed and I can go back to feeling at least ok.

My life has always been like this.. I haven’t been able to consistently attend school because of anxiety and depression, now as an adult I can’t consistently attend work for the same reason. Now there’s alcohol added into the mix... I’m eventually going to be deemed disabled and have what little freedom I have as an adult taken away from me. My mother believes I am autistic despite me never getting the diagnosis and I’m bipolar with possible ptsd.

I don’t know what it is, it’s just a feeling of dread that fills me on most days where I have nothing to do and everything seems like a waste of time. So I’m probably going to drink a bit and go back to what I was doing.
I’m worried about the hangover for tomorrow, I’m worried about the anxiety tomorrow, I’m worried about the potential weight gain because I have body dysmorphia. I honestly never want to leave the apartment again.

The irony is that I only feel motivated, happy and ready to seriously take my health and sobriety seriously is once I’m drunk instead of depressed and anxious. 
I’m not going to AA and I’m not going back to the therapists/psychologists either.",2
2020-08-06 14:13:41,https://i.redd.it/sbjp8gw7bff51.jpg,"My dad lost his battle with alcoholism after 20 years, at the young age of 42 in November. It was brutal, gruesome, and devastating. For anyone struggling with sobriety, stay strong! You can do this! You are loved and I am proud of you!",,339
2020-08-06 13:09:57,https://www.reddit.com/r/alcoholism/comments/i4vqb8/im_working_on_my_4th_day/,I’m working on my 4th day,"Does anyone have that feeling of depression, spiraling negative thoughts and self loathing that comes out of nowhere?

It’s like the dark cloud hovering over me",1
2020-08-06 09:30:16,https://i.redd.it/tbd06ojnwdf51.jpg,"1 month AF, 🥳 🎉 :) Feeling 100% better in every ways. My life still sucks, but at least I am not poisoning my body and mind anymore. I feel a lot balanced, not depressed, and just good.",,271
2020-08-06 07:56:21,https://teespring.com/fr/stoned-6527?pid=369&cid=6514,STONED,,1
2020-08-06 06:37:09,https://www.reddit.com/r/alcoholism/comments/i4pf6f/sore_throat/,Sore Throat,"I've had a chronic sore throat for as long as I can remember. It usually happens due to alcohol. I generally drink straight from the bottle and as a result my throat gets burnt and ends up feeling raw.

I quit daily drinking a year back and then felt strong enough to try controlled social drinking like I used to in school, which I failed at. First few months I would drink on the weekend and my throat would get worse. Then after being sober during the week it would get better. Once lockdown started and days started merging this went out the window and I started drinking daily again.

It has now been 2 weeks since I realised I was out of control and decided to quit altogether again, however my throat has only shown minor improvement. Anyone else have experience with this?
PS - (I've had this sore throat for 4-6 weeks now and no other covid symptoms incase anyone else is thinking this)",3
2020-08-06 04:16:38,https://i.redd.it/o0j7069pccf51.jpg,"Finally over a month again. The ""total savings"" is all added up over the past few years between the numerous resets I had.",,1
2020-08-06 04:08:54,https://www.reddit.com/r/alcoholism/comments/i4nr7m/what_if_i_dont_want_to_be_completely_sober/,What if I don't want to be COMPLETELY sober?,"I just want to drink less. 6 beers instead of 30,,, maybe I still want to drink every other day, instead of every single day?
I would still be very happy if I could do that! 

But of course,, damn good to those of you who have stopped drinking! I know some people don't have a choice. It's either drinking or nothing..",2
2020-08-05 19:48:07,https://i.redd.it/lo5uqe9zt9f51.jpg,3 days down. Tying to hang in there guys 🤘🏾,,169
2020-08-05 16:54:18,https://www.reddit.com/r/alcoholism/comments/i4dnbf/94_days_sober_and_happy/,94 days sober and happy,"
23 years old was following down the wrong path and had been drinking heavy to cover up my depression instead of facing it. I wouldn’t attend my classes because I was already shit faced at 1030 am. And it was a very sad road. Today I’m healthier, on track to graduate college in May 2021, getting As in all of my classes, and moved out of my mothers house(we don’t talk anymore due to my sobriety Nd speaking up on how I feel about my childhood), I’ve grown close with the people I truly love. And couldn’t ask for more! I love my life and sobriety 🙌🏽",13
2020-08-05 14:25:48,https://www.reddit.com/r/alcoholism/comments/i4ar88/messed_up_priorities/,Messed up priorities,I will debate for 20 minutes on whether or not I actually need to buy a pair of shorts even though I don't have a decent pair that fits me yet I will happily fork away that same $20 on alcohol or nicotine. So that's where my priorities are at right now,2
2020-08-05 13:53:30,https://www.reddit.com/r/alcoholism/comments/i4a4zq/day_4_intense_anxiety_and_heart_palpitations/,Day 4: intense anxiety and heart palpitations,"Can anyone relate to this? I’m on day four of sobriety and I swear it sometimes feel like my heart is fluttering . I feel tense and like I just weigh a thousand pounds. Beyond that, I’m just feeling in a bit of a fog; I feel like this morning was about ten years ago. 

Also, the muscle twitches are WEIRD. I know it’s likely withdrawal, on the count of my hands are definitely tremor-y. 

But Jesus fuck is it uncomfortable. I’ve never had it be THIS uncomfortable. Kind of weird how, all of a sudden it just ramps up. By day four, id typically feel pretty fine. Not this time.",8
2020-08-05 10:41:09,https://www.reddit.com/r/alcoholism/comments/i46j0h/needing_some_tips_to_help_boyfriend_who_recently/,Needing some tips to help boyfriend who recently admitted he thinks he has a problem drinking,"Hello! My (33F) boyfriend (35M) told me last night he believes he has a problem with drinking and wants help to stop. We have not been dating long but everything seems to be heading towards a serious LTR. I care about him a lot and want to do the best thing I can for him to help him. He is constantly surrounded with alcohol, his dad all his uncles are long term alcoholics. He travels for work a lot and most of the guys he work with drink after work. He got a DUI in 2018 and is still dealing with that. He doesn’t drink everyday, but when he does drink it’s not just one or two he has to get super drunk. He said he doesn’t want to get out of control with his drinking he wants to be better and doesn’t want to ruin his life. 

My question is what can I do to support him in his choices and what support can I give him that wouldn’t be smothering or controlling.",5
2020-08-05 10:40:25,https://i.redd.it/p1ippcc947f51.png,Over a day and a half! Haven't been this sober really in months. Been looking into local AA meetings and i think i found one i want to try.,,111
2020-08-05 08:08:53,https://youtu.be/k4GZBS4XvS4,Wine Consumption Ranking | TOP 10 Country from 1961 to 2011,,1
2020-08-05 02:05:50,https://www.reddit.com/r/alcoholism/comments/i3zyyu/bummed/,Bummed,"Was doing so well for so long and can’t explain it. It’s been two months real heavy, but functional. Can’t go to meetings any more due to bs. Wtf ya know",3
2020-08-05 01:22:02,https://www.reddit.com/r/alcoholism/comments/i3zgbv/get_out_of_your_head/,Get out of your head!,"When I tried to control my drinking on my own I failed,  when I listened only to the people in my head I failed, when I thought I knew best..Guess what,  I failed at getting sober! It wasn't until I started listening to those who have gained a new beginning in sobriety and those who found joy without alcohol or drugs that I began to understand that a better way of living was possible and something I could have as well! Who are you listening to?! My head as an Alcoholic is dangerous and alcohol is cunning, baffling, and powerful..so,  when I get lost in my thoughts I bounce them off of a sober friend!",9
2020-08-04 21:12:07,https://www.reddit.com/r/alcoholism/comments/i3vxuz/new_here_looking_to_moderate_better/,New Here - Looking to moderate better,"I’m absolutely an alcoholic. I’d consider myself pretty functional but man has my body paid for it. I used to be in such good shape. I really don’t want to quit, but am more curious if any of you have been able to practice moderation. Once a week, month, quarter, or anything in between. If so how did you do it?  

Context: I was well into alcoholism before, but my mom committed suicide a couple months ago. That’s a lot to digest so I’m sorry for making it heavy, but I really haven’t been able to cope with the night time since. I have a really stressful job which has rollercoastered my 20’s. I know I need to change. I’m 28 now and have been drinking 4 to 7 days a week since about 22.",1
2020-08-04 19:44:49,https://www.reddit.com/r/alcoholism/comments/i3ul3c/brother_alcoholic_needs_iop_family_cant_afford/,"Brother (alcoholic) needs IOP, family can't afford one. Dad has Alzheimer's. HELP!","Good evening all. 

My brother is an alcoholic and he is struggling. He resides in Denver but has moved back home to TN for a DUI court date, which is in 18 days. He can't keep water, or food down and he is currently drinking about a pint of vodka a day. He used to drink a handle a day. He doesn't have insurance. Not even medicaid. We have desperately tried to get him set up with a temporary state ID here in TN for medicaid but things have been difficult. He failed his eye test fo me a drivers license. So we resulted to a temporary ID which he needs the original copy of his SS card. Which is back in storage in Denver. So we are currently seeking a replacement card through the SS website. 

He doesn't want to get anything done. There are days he wants to help himself, but others where it's just beating around the bush of bullshit. It's taken a toll on both parents and myself. Both parents are on social security and barley receive enough to get by on their own, now they have a 26 year old son living with them. Dad has Alzheimer's so thats enough stress as is. I barley make enough to support myself and student loans. 

 Do you think if we were to go to the courthouse and spoke to someone, hopefully close to the judge, could we ask for an EARLY court appointed IOP (intensive outpatient program) so he wouldn’t have to pay? His court date isn’t for 18 days but if he says he needs help, do you see them offering anything? 

Please help. We have tried everything. I don’t know what to do. He pretty much sleeps all day. I don’t want him to drink himself to death. So here I turn to reddit. If you have any advice. it would be appreciated!",5
2020-08-04 18:27:25,https://www.reddit.com/r/alcoholism/comments/i3tai2/3_months_sober/,3 months sober 🙏🏽,Iwndwyt,124
2020-08-04 17:30:04,https://www.reddit.com/r/alcoholism/comments/i3s9dx/should_i_outright_avoid_alcohol_if_i_dont_want_to/,Should I outright avoid alcohol if I don't want to be an alcoholic?,"My mom has been an alcoholic for more than half my life (I see her drunk more than I see her sober), and it really pisses me off and makes me depressed, though when she's drunk she mostly doesn't do much, watches TV, go on Facebook, talks about family and friends that make her mad, and never hits me or anything. This has pretty much scarred me from drinking alcohol and I'm dead set (at least for now, as a 20 year old) on never drinking out of my own will. I was once even at a party where everyone else was drunk except for me, so I'm not interested in doing it for social/party reasons. I know it will be pleasurable and that's exactly why I don't want to start, because I'm part Native American (on my mom's side) so I have a genetic predisposition to be addicted (though both of my brothers can hold their drink pretty well). Should I just keep holding my ground whenever I'm offered alcohol or should I just crumble to the social pressure? My mom said it suddenly hit her when she was 40 and I feel like something like that might happen to me where I suddenly have the urge to drink and then I can't stop.",3
2020-08-04 17:23:40,https://www.reddit.com/r/alcoholism/comments/i3s57m/help_lost_on_how_to_help_bf/,Help? Lost on how to help bf 😔,"Hi, and thank you for reading this.   I (42f) have been dating a guy (40m) for a year and a half.  He has serious mental health issues, as do I (we met in group therapy, lol). His issues are much more severe, however, and have kept him from having much human interaction and leaving the house for things other than doctor's appointments for 20 years.  When we got together, I knew he had the mental issues he has, but what I didn't realize was how much he was using alcohol to cope.  I was under the impression that for the first couple of months we were seeing each other he didn't drink, he corrected me on this this weekend and said he did the whole time.  He wouldn't have been able to interact with me otherwise.  When I did start to see how much he drank, I wasn't overly concerned because he is never mean, or abusive when he drinks.  He is usually just relaxed and pretty ""normal"".  He has blood tests he has to take every few months because of a medical issue and the results came back that his kidney function is off and he has low potassium.   He believes the drinking is the culprit and is trying to cut down.  I am 100% behind him and will do whatever he needs me to do to help.  Here is the problem...my bf's mental health is so bad that none of the pills he has ever been prescribed work.  The only thing he has ever used that helped him is alcohol, which he never touched until he was 38 (2 years ago). Since beginning to drink, he has done so many things he has never done before like dating me, going to the movies, going hiking, staying away from home for extended periods of time, going in stores etc. He told me this weekend he can't do any of those things without alcohol.  He is extremely depressed without it and in a constant state of panic.  He said he can't interact with me sober (which I don't believe to be true,  but it is what he thinks ) and he doesn't know how that will effect our relationship.  I am left here reeling from the news.  I feel like he is saying that we need to go to a fwb situation, and I can't do that.  I don't want him to hurt his body further by drinking, but it helps his mind so much.   I feel selfish wanting him to continue drinking, but I am scared to death I am going to lose him without it.  Overall, I care enough about him to support him if he decides to cut back significantly or to quit, regardless of the outcome for me.  But, I am confused and scared at the moment.  I am wondering if anyone has known someone like my boyfriend?  If anyone has been in a similar situation?  Or if anyone with experience with alcoholism and mental health has any opinions.  I welcome any and all feedback (except nasty comments). For the record, we do drink together on the weekends quite often, but I only drink with him and don't have a problem going without it.  It is more social for me than anything.  

(If you read this far, thank you😊)",1
2020-08-04 14:20:10,https://www.reddit.com/r/alcoholism/comments/i3om71/2_years_sober_an_words_of_wisdom_to_not_full_off/,"2 years sober, an words of wisdom to not full off the wagon?","Hi

Long story, won’t get into the details. Was drinking heavily 2 years ago because I was going through a rough patch until I was hospitalized with acute hepatitis. Stopped after that. Feeling down now and very tempted to drink my sorrows. Thankfully no alcohol in my apartment.

Any words of wisdom to help me maintain my sobriety?

Thanks in advance",7
2020-08-04 14:19:10,https://www.reddit.com/r/alcoholism/comments/i3olia/adventures_and_alcohol_go_hand_in_hand/,Adventures and alcohol go hand in hand...,"Adventures and alcohol go hand in hand. I mean, who doesn’t enjoy a celebratory summit soda, or apre gnar fest drink of some joy juice with your buddies to celebrate an epic day in the mountains? I mean come on, you earned it. {continue reading below image}

&#x200B;

&#x200B;

https://preview.redd.it/zq6q5tlj21f51.png?width=1080&format=png&auto=webp&s=a166add588b27bb020aabcc896a2f4aa479621ef

Right?

It’s so refreshing and the light buzz brings you into a euphoric high when the endorphins in your system collide with the alcohol. Too often this makes us want more, until we find ourselves hammered on another Saturday night, only to wake up the next morning wishing we had tapped the breaks a bit last night.

For many of us, when we get honest with ourselves, it is not the celebratory drink that is a problem in our lives, it is the drink that took a drink, then the drink that took a piece of our lives.

What do I mean here?

I’ve been through the cycle that you may be experiencing now. It is impossible to have “just one”, because “just one” more often than not, leads to “I’ll just have one more” and then, before you know it, it’s the next day and once again, you wish you did not have one too many last night. This same pattern may go on for years.

You go through constant cycles of swearing alcohol off completely, taking long breaks, feeling better, but inevitably, the day comes where you are back on the slosh wagon, waking up with a pounding headache from a glass too many last night, wishing that you kept the plug in the jug, and likely regretting what you did.

I know this internal battle intimately.

Years ago I was high functioning adventurous professional with a full time career I had a drinking problem that helped cover up how I felt about things going on in life at the time. And, when I talk about high functioning…… I had an external life that was perceptually perfect… some of my greatest accomplishments were sprinkled in throughout my drinking; marathons, mountain climbs, and even a college degree… my career was thriving and stable… my economic life was not in total ruins… I enjoyed skiing (when I was not hungover)… I managed to never grow a giant booze belly

I was not your stereotypical under the bridge alcoholic.

But, under this external image of perfection there was an insecure, imperfect, hurting little boy, who really wanted to have a different life, free from the grips of alcohol.

But I was afraid…

… what would my friends think?… am I an alcoholic?… I am not an alcoholic, there is no way I am going to take on this label, no fucking way.… how will I have any fun ever without alcohol? I don’t want to become jaded and straight edged.… who will I be without alcohol?

With time, simple answers came to all these fear based questions that I had. And, today, I live an alcohol free life that is beyond dreamy.

Gratefully, I’ve found that there is a solution to this madness of being a weekly drunkard, that myself and millions of others have discovered. Actually, not drinking for me, has become pretty freaking awesome… but I resisted that this was even possible for years.

It starts with acknowledging that it is not your fault. Alcohol is addictive as hell and media programs our subconscious mind to believe that it will help bring us everything we dream of when in reality it brings us the opposite effects.

Reprogramming of our beliefs around alcohol must happen at the subconscious level and this requires acknowledging the fact that what we believe to be true in thought may not match our years of false programming around alcohol.

Because for many of us, we have never really experienced life without alcohol it is hard to imagine what life could be without it. Exploring this new world alone can be scary, paralyzing in fact, but it is well worth the adventure.

I’ve been free from the magical and destructive potion of alcohol for over 3 years and I’d love for you to get to experience the richness of life and relationships without booze.

If you’re ready to break free, hit me up. Shoot me a short message and let’s have an open honest chat.",3
2020-08-04 13:07:24,https://www.reddit.com/r/alcoholism/comments/i3n88p/solo_intervention/,Solo Intervention,"I'm 8 days sober today.  I cannot remember the last time I went a day without drinking before the past few days.  I would classify myself as a functioning alcoholic, although no one else around me would.  I can get up, go to work, and manage my family but when 3pm hits I crave a drink.  Sometimes it's wine, sometimes it's vodka.  I tell myself I'm only going to have 2- tops.  I end up having 3 or 4 every day.  I did the calculations, I was drinking an average of 24 oz of vodka and 10-15oz of wine per week.  When I told my husband I was worried that I was becoming an alcoholic he said you're not.  I said why do you think that? He said ""you don't get the shakes, you still work and go about your day.""  I said ""I may not get the shakes but I get the craving.""  He doesn't understand.  I'm not like him, I can't stop after 1 drink and then not drink for days.  I told him ""Do you really think it's normal that I drink and at least 2 nights a week I don't remember much the next day? Or that my emotions are a rollercoaster some nights?""  He's like ""I believe in you- you can stop when you want to and just have that 1 drink"".  My friends feel the same way and have told me the same things as he has.  I feel like I'm performing my own intervention on myself.  Am I imagining my problem? Am I making something out of nothing?  I don't think so.",4
2020-08-04 07:49:34,https://www.reddit.com/r/alcoholism/comments/i3hw79/ive_been_hitting_quite_a_lot_of_nonalcoholic_beer/,I've been hitting quite a lot of non-alcoholic beer lately and it got me wondering if it's a wrong thing to do,"Well title pretty much says it all. I don't really feel the urge to drink that non-alcoholic beer, but sometimes when I meet with my friends and they wanna have a drink I substitute with non-alcoholic beer and it works - I feel great even binging that beer haha, absolutely sober, judgement is not being clouded and no hangover whatsoever. So I just wanna know if it's a okay thing or maybe I should cut it out too?",3
2020-08-04 01:25:40,https://www.reddit.com/r/alcoholism/comments/i3dhio/not_sure_if_im_enough_of_an_alcoholic_but_have_a/,"Not sure if I'm ""enough"" of an alcoholic but have a feeling there might be a problem","I either drink a bottle of cheap wine (usually \~10% or so) or 2-4 drinks (hard mixed, or beer) daily, usually in the span of a few hours in the afternoon. I live alone with no friends or anyone in town, so I just sit in my room alone all day. Life has been a bit rough on me (who HAS it been kind to?) so I've taken to drinking. 

I've been doing this for the past three years or so. I used to be a heavy, hardcore alcoholic (8+ shots of straight vodka a night), and since then I've learned to stop doing hard shots and switch to nice-tasting things. I thought this was all good and fine until I thought....huh...I don't even LIKE the beer I drink, I just crave being the constant buzz from it in order to function through my day. 

This is more of the ""dads in king of the hill"" kinda alcohol dependency than ""man convulsing in an alleyway"" so I don't see myself as like, valid in need of help, but I worry this'll get out of hand again fast. I'm not sure what to do.",3
