Date,URL,Title,Body,Score
2021-02-24 09:13:36,https://www.reddit.com/r/benzorecovery/comments/lrdtqu/short_term_addiction_to_benzo/,Short term addiction to benzo?,"I’ve never been a fan of benzos in general, but recently decided to pick up 9 G3722’s off the street advertised as Alprazolam. I’ve taken half (1mg) every day for a week. I noticed yesterday if I didn’t take it or in the morning I feel absolutely awful. And I constantly think about taking them when im laying in bed at night. I’m very worried i’m starting to get withdrawal symptoms. I have about 6 bars left. ANY information would be gladly appreciated. Is it possible if I stopped suddenly i’d get a seizure? I really want to get off these.",0
2021-02-24 07:57:26,https://www.reddit.com/r/benzorecovery/comments/lrc9jn/wow_i_went_to_my_ayurvedic_doctor_and_the/,Wow. I went to my Ayurvedic Doctor and the supplement she prescribed me right now is helping me in Withdrawal Symptoms caused by clonazepam.,"I went to an Ayurvedic doctor and discussed about the Benzo i was taking and what withdrawal symptoms i had. She prescribed me ""Brahmi Churna"" - 1/2 teaspoon 2 times a day and ""Ashwagandha 450 mg capsules"" 2 times a day. And i swear i have taken the ""Brahmi Churna"" right now and the anxiety caused by withdrawal went away. It seem to improve my serotonin and GABA levels instantly.! and It's day 1 I swear. Ayurvedic medicines are the best ever. No side effects, no damage! I blame myself for taking clonazepam for more than 2 years, i would've rather gone to an Ayurvedic doctor and discussed about my problem. Anyways, I'm 1 week off from clonazepam. 10/10 Ayurveda. You guys can absolutely take these supplements without any side effects, I promise it will help. Wishing you all best of luck with the recovery and i hope the same from you guys in return. Love you guys, you all are warriors. ❤️",6
2021-02-24 07:53:48,https://www.reddit.com/r/benzorecovery/comments/lrc6qv/ltheanine_and_gabaa_upregulation/,L'theanine and GABAa up-regulation?,"Any supplements to help benzo withdrawal? Tapered to 2mg daily but looking for additional help, I know alcohol isn't viable as it works on the same receptors.

I've heard Niacin is good. Help please?",2
2021-02-23 23:23:39,https://www.reddit.com/r/benzorecovery/comments/lr3kag/benzo_withdrawal_is_just_cruel/,Benzo withdrawal is just cruel,"Obviously goes without saying. But I'm just sitting here in my room, probably the safest place I could possibly be, but to my benzo-deprived brain, I'm in a life threatening situation and everything is falling apart. Can't go out and do anything because of how bad the anxiety is. Even an anxious thought that would normally illicit no reaction can induce a panic attack. Everything you know is seems unfamiliar and dangerous. Fuck this man.",85
2021-02-23 21:51:28,https://www.reddit.com/r/benzorecovery/comments/lr1sp4/relapsed_at_the_end_of_my_taper_after_not_being/,Relapsed at the end of my taper after not being able to take the wds anymore...,My friend is getting her valium script in a month and is willing to trade some for the bars I have so I’m gonna go on one last binge and get off for good this time and stick to it my mother’s getting tired of my shit lmao,0
2021-02-23 21:48:52,https://www.reddit.com/r/benzorecovery/comments/lr1qyb/so_i_was_6_months_completely_clean_off_xanaxkpins/,"So I was 6 months completely clean off xanax/kpins. But ilI started using it once a month. No more, no less. I know its a dumb decision and everyone is going to tell me it is and im not encouraging it at all. But its been working for me.","I can take it only once a month and NOT crave more. At the most 1.5mg of Alp. I just wanted to see if anybody else had a similiar experience or if anybody else quit and now only uses from time to time. I DO get rebound anxiety and its pretty intense, but nothing like PAWS after quitting using for a year straight. Not the best decision I've made but I think WD scared me so much to not go overboard and realize its not worth it. Once a month and im sticking to it. Just wanted to let that out. (please dont tell me its a good idea because i already know, i just needed to vent). Similiar situation anybody?",0
2021-02-23 19:50:32,https://www.reddit.com/r/benzorecovery/comments/lqyq0m/need_to_begin_taper_soon_so_it_wont_be_worse_than/,"Need to begin taper soon, so it won’t be worse than it already is getting to be. Need schedule length advice.","I was prescribed alprazolam for about 5 years as needed to help with side effects of Parkinson’s meds, which included insomnia. So there’s that. I no longer take those meds, and my motor functions are under control. 

For this goal I will separate these issues - benzodiazepine dependence and Parkinson’s. They are different chemical messengers (though GABA and dopamine do have interaction.)

So “As needed” became almost daily within the last year or so due to a few issues but never more than .50-.75mg, as prescribed. 

In early October I began feeling very sick and didn’t know what was happening. Neither did my GP, Neurologist, or the Neuro-Psychiatrist they referred me to. In hindsight I eventually had nearly every Benzo PAWS symptom imaginable and did not sleep for days on end....even though I hadn’t stopped taking it - and didn’t yet know about tapering...still just same “small” doses.

So what caused this absolutely horrific, debilitating agony? Tolerance build up? Sudden inter-dose dependency? Not sure.

Anyway I eventually realized what was happening after reading [ Wikipedia ](https://www.wikihow.com/Withdraw-from-Alprazolam)and this sub. 

My discovery was still met with skepticism by the Drs. Only after a few more months of pure hell while they tried a litany of antidepressants because “we need to control your anxiety and depression.” I was of course super anxious, very sick and depressed about it, I thought I was dying! I eventually got agreement from the Neurologist’s office and from there the psychiatrist Office as well. “Certainly looks like that is what’s happening “. But nobody really wants to help me taper. GP says see your Neurologist, Neurologist says see the Psychiatrist. Psychiatrist says see my assistant once a month for 20 mins via zoom. And she they has different ideas about tapering, wants  me to “stabilize” for a few months on 1mg clonazepam ....so they switched me off alprazolam to .5mg clonazepam twice daily “as needed for sleep/anxiety” which I try to limit to 1 x .5mg tablet before bed so I can sleep. And that’s where I’ve been for about 45 days. I’m truly afraid the longer I’m on these things the longer/harder it will be to taper off. I’ve already seen hell and am scared to go back. 

But I guess this is a step in right direction? Only because thankfully I CAN sleep now, and do feel a bit better than the agony I was dealing with. but it’s super far from “normal”.  Terrible brain fog and cognitive slowness. It’s all there still I feel, but it’s waiting to heal. 

Probably some of it can be attributed to Parkinson’s (yes, it’s complicated) but most is certainly Benzo related. At any rate it is having a clear impact on my job, family & friends. I’m not as communicable, or personable. I’ve always been a very outgoing person. My quality of life is severely diminished because of this poison.

Long story longer, I’m really wanting/needing to taper before it gets harder to do so, if that’s possible! I’m not yet 59 and think i still have some quality years left if I can get my psych or another benzo savvy Dr. to work with me on a slow taper that includes introducing less potent diazepam. (Ashton) Not sure how long to draw out my “plan” for though...I know everyone is different. From what I read slow is very important...6 months? 1 year? 

I am convinced, as are most of us, that this is the next health crisis - possibly worse than the opiate crisis. God help us all.",1
2021-02-23 19:24:25,https://www.reddit.com/r/benzorecovery/comments/lqxzva/dr_attempted_taper_using_librium/,Dr attempted taper using Librium,I have been tapering down from 1 k dr wants to taper switching to 25mg Librium tapering off 5mg every two weeks going from 25 to 20 to 15 t 10 to 5 to 0 it seems like this is very rapid and from what I see 1 k is 50 Librium not 25 anyone have experience with this,1
2021-02-23 17:21:42,https://www.reddit.com/r/benzorecovery/comments/lquriz/fatigue_brain/,Fatigue brain??,"1 week without clonazepam. And my brain nerves are so fatigue and weak, i feel numbness in my head, scalp and face. Does anyone else also feel the same as if the brain has become so much fatigue during the withdrawal process or is it me?",2
2021-02-23 16:49:08,https://www.reddit.com/r/benzorecovery/comments/lqu174/does_clonidine_make_things_worse/,Does Clonidine make things worse?,My doctor prescribed me clonidine to help with withdrawal symptoms but now I just want to claw my way out of my own skin. My anxiety is crazy high. Did I just get unlucky and symptoms where going to get bad anyway or has anyone else had this reaction?,2
2021-02-23 15:45:16,https://www.reddit.com/r/benzorecovery/comments/lqskem/i_havent_taken_any_xanax_since_sunday/,I haven't taken any Xanax since Sunday!,"I feel like it's a huge step for me.. the last time when I didn't take any for two days in a row was in 2018. 

I've been taking it since about 2015 (0,75mg max), so I'm not sure how many weeks I'll need to pass to be completely clean of it.",2
2021-02-23 15:08:47,https://www.reddit.com/r/benzorecovery/comments/lqrprw/has_anyone_elses_sleeping_become_normal_yet_im/,Has anyone else's sleeping become normal yet? I'm still waking up at 3am every night (to urinate) and I can't really get back to sleep..,Is anyone else's sleeping still effected after coming off?,1
2021-02-23 14:24:27,https://www.reddit.com/r/benzorecovery/comments/lqqo6t/ive_been_sober_for_2_months/,I've been sober for 2 months,"2 months today. Thought I'd share it with someone since I don't really have any friends and my family doesn't know about my addiction. 


Took me 1 year of true dedication and a very good facility to get it done. Went from 20-25mg xanax a day and 6mg klonopins to 0. Hoorayyy!",17
2021-02-23 13:38:00,https://www.reddit.com/r/benzorecovery/comments/lqpjkg/rebound_insomnia_and_how_to_deal_with_it/,Rebound insomnia and how to deal with it,"not withdrawing but whenever i use benzos 3 nights in a row i get rebound insomnia. I sometimes stay up for days depending how long ive depended on benzos for sleep(longest record was 5 days from 2-3 weeks of nightly etizolam). Right now im on day two with no sleep from dosing probably 5 nights in a row. I feel like complete shit without sleep but right now i have gabapentin to help me get through it. my question is should i take the gabapentin today and maybe take a small dose of benzo at night to taper and hopefully get some sleep? Or should i wait until tomorrow to try this? (doubting i will get no sleep again without any assistance except alcohol)

edit: got drunk last night took .25mg kpin and 100mg dph. got very tired but no sleep",0
2021-02-23 10:30:45,https://www.reddit.com/r/benzorecovery/comments/lql1i3/im_finally_clean/,I'm finally clean!,"I successfully tapered off xanax! I jumped off after 3 weeks of taking .125mg and I don't feel any withdrawals! No headache, anxiety, or insomnia. I've been taking trazadone for my insomnia and I sleep very well, and I try to work out everyday to exhaust myself. 
For once in a very long time, I'm completely sober. 

It is possible to recover from benzodiazepines. You need to take your time. I dropped doses every 2-3 weeks.",50
2021-02-23 10:08:35,https://www.reddit.com/r/benzorecovery/comments/lqkjd9/the_ashton_manual/,The Ashton manual,"I found this while reading the experience of someone who quit benzos.   
You may be aware of its existence, but for me it's the first time I read it.

It might be useful for you. So here you go: [https://www.benzo.org.uk/manual/bzcha02.htm#3](https://www.benzo.org.uk/manual/bzcha02.htm#3)",5
2021-02-23 09:10:02,https://www.reddit.com/r/benzorecovery/comments/lqj8zu/tapering_question/,Tapering Question,"So I’ve been tapering Clonazepam - I’m at 1mg/day now. Been on 1mg/day for roughly a week. I’m feeling like shit. Puking in the mornings, zero energy, bad sleep, heightened anxiety. I know this is part of the withdrawal. 

Should I wait another week or two before cutting down again? Can I expect to feel a little better if I just wait longer on my taper? I mean I expect to feel worse when I cut down and idk how I’m going to handle that. 

Was taking upwards of 4mg maybe 3 or 4 times a week back in January - I built up to that over a few years. Just can’t seem to stabilize myself.",2
2021-02-23 08:24:52,https://www.reddit.com/r/benzorecovery/comments/lqickd/zoloft_to_help_with_depression_and_anxiety/,Zoloft to help with depression and anxiety,"For a little bit of backing:
I abused diazapam heavily for 3-4 months and got myself up to about 100mg per day (not relising just how evil benzos are) and have been tapering for probably around 6 months (with a couple relapses here and there). Im about to make my next dosage drop to 16mg.

 These last couple weeks have not been fun and iv really been struggling with the depression and anxiety. Im looking to go back to therapy this week which i hope will help.

This morning i was speaking with my dr and she suggested she might try perscribing me zoloft to help with this side of the withdrawl. She suggested i do a bit of research myself on zoloft and see how i feel about it.

Collectively you guys seem to be the most helpfull for any advice on benzowithdrawls. So here i am, asking for your help/advice. Anybody have any experience using ssri's (specificly zoloft if possibke) to help with this side of the withdrawals?",1
2021-02-23 08:20:52,https://www.reddit.com/r/benzorecovery/comments/lqi9qf/withdrawal_flashbacks_from_alcohol/,Withdrawal Flashbacks From Alcohol?,"Been off for about a month now ( been totally fine for past 3 weeks ). 

The othernight thought id enjoy some whiskey (I didn't) and had a few drinks. 

When I woke up a couple hours after falling asleep I was sweating profusely and kept falling to a vivid nightmare much like how it was when I tried quitting cold turkey. 

Is this to be expected because alcohol also works the GABA part of the brain? And if so how long does it take before I could drink again ( not that I want to)? 

I was on 10-20mg xanax for about 5 months and then tapered off over 3 months. So not that long.",1
2021-02-23 07:41:46,https://www.reddit.com/r/benzorecovery/comments/lqhjp3/some_reassurance_please/,Some reassurance please!!!!,"Hi, I’m a 20 F who was put on lorazapam in December because I was having severe withdrawals and anxiety from coming off Effexor or Venlafaxine. I took about 0.5mg or lorazepam for about 6 weeks and have now transitioned to taking about 2.5mg of Valium a day. I know this is very low compared to some people but I am absolutely scared shitless to come off it. I had such bad withdrawals from coming off Effexor (which took me around 7 months) and I just can’t bare to go through it again. It traumatised me so badly that I now suffer from dpdr, I had to quit my job, and I hate leaving the house. Will coming off 2.5mg of Valium be really hard? What should I expect. Any advice would be really appreciated. Thank you!",3
2021-02-23 06:53:38,https://youtu.be/_Z-ZQnz3wn8,"My bad addiction, and my sprial out of control. Story Time🔫🗣🗣 Should I quit?",,0
2021-02-23 04:18:47,https://www.reddit.com/r/benzorecovery/comments/lqe7gt/body_overheating_freaking_me_out/,Body overheating?? Freaking me out??,"Friday I had severe withdrawals. I must have cut down too quickly so to compensate, I took a little extra on Friday. Saturday I still felt extremely on edge and Sunday I felt extremely on edge. Today, I felt like I was having withdrawals again. Usually I get hot flashes. This time though, it has lasted for hours (not just a flash, but more like I am constantly hot). On top of bad anxiety. So I took a little extra klonopin again but it does not seem to be helping?! Do I not have enough in my system? I thought since I took a little extra on Friday I would be good, so idk why I am feeling this way. 

So my questions are:

Should I take some more to stabilize? And has anyone else had overheating during withdrawals? It is 50 degrees in my room currently and I have an ice pack on me.",6
2021-02-22 22:27:19,https://www.reddit.com/r/benzorecovery/comments/lq7zrw/bpc_157/,BPC 157,Has anyone tried it? There’s a lot of buzz on the benzo forums but I’m not sure if it’s just a crutch and might be hell to get off of after the taper. Is it a bandaid or does it really heal your receptors. I’m an extremely kindled case and having a hell of a time coming off Valium. Any info would be appreciated. Thank you!,0
2021-02-22 19:11:03,https://www.reddit.com/r/benzorecovery/comments/lq447y/paws_i_really_need_validation_and_support/,PAWS - I really need validation and support,"Hey guys,

I’m a little over 90 days sober from benzos and heroin. Benzos were more my problem. I didn’t take them at super high doses, but I was def physically dependent on them, I took them from age 9-21. (BTW I have severe OCD that revolves around physical health/fear of dying, mentioning this because that’s the reason what’s going on is freaking me out so much)

Since I got sober, my body temperature regulation has just been absolutely fucked. I am overheated 90% of the time, even when I stand outside in the 30 degree F weather. Today I had an especially bad episode of it. I was walking in the grocery store, t shirt and light windbreaker on, completely fine mentally. I started sweating, felt weak and got a little pale. Eventually it just stopped, but I had a panic attack over it. Physical symptoms like that trigger my OCD. 

BTW i’ve been to the ER twice in the last few weeks and all my blood tests and EKGs come back normal. Doctors don’t seem concerned but I am freaking the fuck out. My sober friends keep telling me it’s PAWS, but I’m just so convinced something is deadly wrong with me. 

Has anyone else experienced any symptoms like these or PAWS?",2
2021-02-22 19:06:31,https://www.reddit.com/r/benzorecovery/comments/lq40ns/how_bad_or_not_bad_is_this_going_to_mess_my/,How bad or not bad is this going to mess my withdrawal up?,"On Day 10 Benzo or GABAergic free in months, and I’d fought to get here - my Doctor is prescribing and advising me to take 1 5mg Diazepam before a procedure. An outpatient one. 

Anyone know how this may play out, or otherwise how I should be alright? Unfortunately I can’t cancel the procedure.",1
2021-02-22 18:25:22,https://www.reddit.com/r/benzorecovery/comments/lq35bl/entering_rehab/,Entering rehab,The thing that worries the most is they don't taper you down. Part of me feels like im gonna be wasting my time because I know the withdrawals are gonna be worse then anything I could ever imagine.. and long term..I think these facilities should taper you properly . 7 days of librum is nothing. The withdrawls dont start for 7 days approximately cus of the long half life. Am I making a mistake going inpatient then doing it myself?,2
2021-02-22 18:10:50,https://www.reddit.com/r/benzorecovery/comments/lq2tz7/taper_from_1_mg_klonopin_after_about_3_weeks/,Taper from 1 mg klonopin after about 3 weeks,"Greetings. I've used Klonopin twice in the past, once long-term, although I got off without serious side effects after a very slow taper. Been using it for a few weeks again (.25 twice daily and .5  at night) because of a few gnarly panic attacks and sleep difficulties. I do not want to be back on it again long term even on a lower dose. Any suggestions on how to taper? I don't want to pull it immediately and have rebound insomnia or panic and wonder if I'm more sensitive given past usage. But I also don't want any more than a few months on this given what's been learned about cognition, etc. since I last used the medication regularly a decade ago. I wish I had considered other options than benzos but I tried Remeron for sleep and it made me feel like I was crawling out of my skin. I talk to my doctor tomorrow. Thanks for any insight.",1
2021-02-22 17:36:03,https://www.reddit.com/r/benzorecovery/comments/lq221n/are_there_supplements_that_can_help_even_a_little/,Are there supplements that can help even a little bit?,"Down from 3-4mg Clonazepam four times a week for a couple years to 1mg/day so far. Needless to say it’s been very tough.

Is there anything that has helped you guys? Apart from the simple things like drinking enough fluids. I didn’t realize how much I’ve been urinating during this whole process. Wonder if the constant adrenaline rush has to do with me needing to pee all the damn time? It’s probably dehydrating me - so yeah I go through a lot of water & sports drinks. 

To sleep I use melatonin & L-Theanine. I take a multivitamin that contains magnesium & other things. I’ve never tried CBD and THC is a no go for work purposes.",3
2021-02-22 17:27:38,/r/benzodiazepines/comments/lq0yox/day_1_of_taper_starting_today/,My taper starting today!! After a month of daily use.,,2
2021-02-22 15:05:06,https://www.reddit.com/r/benzorecovery/comments/lpycnb/45_days/,45 days,"45 days benzo free after .5mg clonazepam daily use at night for seven years. I was honestly convinced I'd be taking these pills for the rest of my life. This process has been one of the most difficult things I've ever gone through, but also one of the best decisions I've ever made.",21
2021-02-22 14:15:17,https://www.reddit.com/r/benzorecovery/comments/lpx2y5/benzos_long_term/,Benzos long term,Hello all in a difficult spot.  I have an epileptic type disorder effecting my vision and giving me suicidal head pressure. The only thing that helps is klonapin. I feel I have no choice but to take it.  How long will it last that it keeps working.  I see some people get lucky and can be on it for life.   Just don’t know what to do as it’s the only med that works for my cindition.,1
2021-02-22 12:24:40,https://www.reddit.com/r/benzorecovery/comments/lpu6tj/experience_with_vortioxetine_brintellixtrintellix/,Experience with Vortioxetine (Brintellix/Trintellix) during Clonazepam taper?,"I'm down from 3mg Clonazepam to 0.75mg (to be 0.5mg in a couple days) in 3 months, coming from a 6 month Clonazolam 1.2mg habit and 3 years of on-off use and abuse.

I'm currently on 300mg Pregabalin and 100mg Quetiapine for sleep as well, and she is suggesting starting Vortioxetine for my anxious-depression and possibly switching from Quetiapine to Mirtazapine for sleep.

Does anyone have experiences with Vortioxetine? Apparently it also has some kind of cognitive enhancement separate from its antidepressant effects, with less side-effects than other SSRI/SNRIs.

Also, my psych evaluation showed that my memory is at an ""exceptionally high"" level which I found extremely odd, but I was able to remember 10 numbers and repeat them in reverse multiple times.",2
2021-02-22 11:38:44,https://www.reddit.com/r/benzorecovery/comments/lpsypc/anyone_else_experience_serious_mood_swings/,Anyone else experience serious mood swings?,"Like, i almost think that i'm bipolar or something my mood and anxiety swings like craazy. One second i'm fine and almost normal, the other second i hate everything and everyone. I'm 25 days without klonopin which i took x3 times a week for a year. Well maybe not every second but you get it.

Anyone else?",2
2021-02-22 10:57:28,https://www.reddit.com/r/benzorecovery/comments/lprwch/went_from_56mg_xanax_a_day_to_30mg_diazepam_a_day/,went from 5-6mg xanax a day to 30mg diazepam a day and i feel like shit help,im trying to switch to diazepam and cut down slowly but this got me feeling like shit ive been at it for a few days completely fucking suffering do i up the dose or will i get better,1
2021-02-22 07:51:27,https://www.reddit.com/r/benzorecovery/comments/lpn9yp/quitting_clonazepam/,Quitting Clonazepam,"Hey it's been 5 days and I'm off from clonazepam. And I'm having withdrawal symptoms, but bearable. I was taking clonazepam since more than 2 years. My dose was mostly 0.25 mg or 0.5 mg to be max. Since 1 year i was on 0.25 mg of clonazepam. And i decided to quit it cuz i don't feel well with it too, like i don't enjoy things like i used to before being on clonazepam. So i went to my doctor and asked if we can quit. 

PS. I am on my antidepressant too. It's 5 mg Escitalopram now. 

So my doctor told me it's the minimal dose, you can quit it already. When i tried to quit clonazepam 0.25 mg, i had weird withdrawal symptoms, Metallic taste in my tounge, brain zaps, numbness in head, and tingling in scalp, head, and face. So i took 0.125 mg for a week and then decided to take 0.125 mg at alternative days to minimize my withdrawal symptoms on my own. My doctor said it was psychological, anyways... So now it's been 5 days I'm completely off from clonazepam. And I'm having a feeling like my brain is undergoing a lot a lotttttt changes. Like sometimes i feel my emotions are coming back to normal and sometimes it's like I'm completely fucked up. My short term memory is getting cloudy as fuck ( brain fog ) maybe. And also i got chronic sinusitis all of a sudden, pain in my face and tingling. Head congestion and somewhat I'm experiencing cognitive issues. So is it normal to experience all these kinda symptoms when you're quitting a certain drug after 2 years? Will i be normal in few days or a month? I only took 0.25 mg or 0.5 mg to be max.

PS. My doctor also recently prescribed me Etilaam 1.5 CR because of tapering down the Escitalopram 7.5 mg to 5 mg. 

Any positive reply would be greatly appreciated.",2
