Date,URL,Title,Body,Score,COVID-19 Mentions,Sentiment
2020-04-14 02:06:28,https://www.reddit.com/r/benzorecovery/comments/g103ka/just_discovered_my_moms_dependency_after_she/,Just discovered my mom's dependency after she fractured her leg Friday.,"My elderly mom slipped and broke her tibula this last Friday. After a quick visit to the emergency room, xrays were taken and an aircast applied. The hospital and pharmacies are the last place anyone wants to be right now.  After this mishap,  I have my mom Staying at my house where my gf and I can take care of her full time.  We are now realizing that we are dealing with much more than a fractured leg. The doctors prescribed oxycodone for pain management. This is a dangerous mix with her regular intake of larazepam (which she takes for anxiety). She has been extremely restless, highly emotional and showing  abnormal signs of dimentia. After spending the last 48hours with her, I feel the larazepam is a detriment to her quality of life. She has serious withdrawals when she does not have it regularly.  I have no idea how much she consumed before she hurt herself. But she hid her problems well when I would visit. She's been taking this drug for years 

I want to decrease her dosage or have her stop cold turkey. I read that reduced dosage of this can be very dangerous. I would love to find a holistic substitute for this drug. I have thought about giving her microdoses of the larazepam to ween her off gradually. I also thought about giving her edible cannibus to help with anxiety as a substitute.  Currently it's been a nightmare trying to manage her anxiety (all day and night) .  This is my first time seeing my mom like this. I feel horrible about not realizing her dependency before.

I don't trust many doctors and I feel optimistic about there being natural alternatives to her coping with anxiety. I feel that the larazepam is causing her more damage than good.

I would greatly appreciate any feedback from anyone who has experienced a simmilar experience.

Edit : please note that my mom's prescribed medication has not been reduced. She has been requesting higher dosages more frequently which her doctor advises against.

I also wanted to note that after some initial research into larazepan, it seems as though that it's not to be taken for an extended period of time. Not continuously for years.

I sincerely appreciate your feedback.",0,{},"{'label': 'negative', 'score': 0.7317595}"
2020-04-13 22:51:51,https://www.reddit.com/r/benzorecovery/comments/g0xg0m/help_from_doctor/,Help from doctor,"Will family doctors help you taper off benzos if they weren't originally prescribed to you, or is rehab my only option? I'm having trouble tapering off and I really need help",5,{},"{'label': 'negative', 'score': 0.68899006}"
2020-04-13 19:50:03,https://www.reddit.com/r/benzorecovery/comments/g0ukqu/failed_by_the_medical_community/,Failed by the medical community.," No Ashton Method for me. Tried multiple doctors none even admit this type of thing exists. Being tapered with Librium. Was on Ativan 5 years. Switched to Librium will be off in 5 months max by forcing my doctor with notes. Doctor tried giving me a anti-psychotic today saying my symptoms weren’t withdrawl but a “pre-existing” condition brought to the surface. My support from my family is minimal. I’m supposed to keep working. Fuck it. Fuck this and most importantly fuck the ignorant and arrogant so called “professionals.” I just turned 26 and truly just feel condemned. I know many others here feel that way too. I need to figure out a way to keep going. Meditation, supplements, other drugs, nutrition, exercise and distraction. What works for you? Again i don’t have the luxury to not work or I’d go to a beach somewhere and just sit there until the nightmare be over. Best wishes to you all, and for those who believe in a higher power may God bless and have mercy on us all.",10,{},"{'label': 'negative', 'score': 0.9110511}"
2020-04-13 17:34:12,https://www.reddit.com/r/benzorecovery/comments/g0s5vm/ama_im_in_rehab_for_125mg_clonazolam_daily_1050mg/,"AMA I’m in rehab for 12,5mg clonazolam daily (1050mg diazepam).",,10,{},"{'label': 'neutral', 'score': 0.7391112}"
2020-04-13 11:03:22,https://www.reddit.com/r/benzorecovery/comments/g0kmhc/anyone_experienced_a_lag_in_their_vision/,Anyone experienced a lag in their vision?,"Similar to that of a computer lagging, except it is in my vision. Happened about 4 times in the past minute. Thankfully I was lying down or I might very well have fallen down. Very strange.

I'm coming off of Diazepam.

I'm also noticing bursts or explosions of what appear to be floaters with a glimmer in my eyes at least once a day. 

Fuck this medication.",20,{},"{'label': 'negative', 'score': 0.7194411}"
2020-04-12 19:34:18,https://www.reddit.com/r/benzorecovery/comments/g07axn/trying_to_get_off_clonazepam_and_lyrica_any/,Trying to get off clonazepam and Lyrica. Any advice? I just want to be free.,"Hey guys,

TLDR: Taking .5mg clonazepam 5-6 days/week for 3 years and 300 mg/Lyrica for 3 months. Want to get off both of these with minimal withdrawal. What's the best approach? Doctor and psychiatrist weren't very helpful with a taper plan. Just gave me a depakote prescription in case I have a seizure.

I'm struggling to quit benzos and was hoping someone here could offer some advice. Here's a little backstory:

I developed a problem with alcohol a few years ago to the point that I had to do a medical detox. The detox was done with a rapid clonazepam taper. After about a week, I was sent home with a gabapentin prescription. I took it for about about a month until I started to realize that I was starting to get dependent on that.

When I stopped taking gabapentin I started to use small doses of clonazepam to help with my anxiety that wasn't being medicated by alcohol at this point. This was about 3 years ago and I'm still taking .5mg of clonazepam almost every day.

A few months ago I told my general doctor that I was taking them (they're not prescribed to me) and wanted to quit and I asked her for Lyrica because I heard it was a better version of gabapentin which helped me in the past. She prescribed it to me and confirmed that it wasn't addictive, which obviously isn't the case. I also went to a psychiatrist who prescribed me depakote to prevent seizures when I stopped taking the clonazepam (I haven't taken that yet). Neither doctor gave me any actual taper plan or anything, they basically just told me that I could stop since it's a low dose.

The problem is it's hard for me to just stop. I'm now still taking the .5mg of clonazepam almost every day while ALSO taking 300mg of Lyrica almost every day (I usually don't take them both on the same day). The Lyrica is actually helping a lot with anxiety and mood and I'm starting to crave it on off days which is making me nervous. I REALLY don't wanna get addicted to Lyrica as I hear the withdrawal could be worse than benzos. I've been taking it for about 3 months now, about 4-5 days/week but for the last couple weeks it's been pretty much every day. I already notice a tolerance developing and have a really bad feeling about continuing this drug despite the benefits I'm seeing from it.

Now the question is what do you guys think is the best approach for stopping both of these drugs? Should I taper both at the same time or one at a time? Which one would you do first?

If anyone has had a similar experience and can offer some advice, it would be GREATLY appreciated! I just wanna be free.",1,{},"{'label': 'negative', 'score': 0.45471233}"
2020-04-12 15:21:38,https://www.reddit.com/r/benzorecovery/comments/g02x9d/new_set_of_symptoms/,New set of symptoms,"Has anyone had a combination of labored breathing, sweating(for me it’s my forehead and back) and loud kinda fast heart? This all came at the same time. It’s a little scary but I’ve dealt with worse.",6,{},"{'label': 'negative', 'score': 0.88812286}"
2020-04-12 12:20:50,https://www.reddit.com/r/benzorecovery/comments/fzzmdv/on_ativanlorazepam_25mg_when_do_i_fully_stop/,"On Ativan/lorazepam .25mg, when do I fully stop?","I’ve been trying to find an answer to this for ages. Got started on ativan daily by my PCP ~9 years ago and was on Librax for a year or two before that. Initially for stomach issues (didn’t know then that I can’t tolerate dairy), and then ativan came in during a time of extreme stress with chronic pain. Doctor was “old school” about it. New doctors a few years ago who are super understanding and supportive while still encouraging me to get off of daily use. Which brings me to the question...

When do I just quit? The daily dose has been .5 mg since almost the beginning, I got down to .25 after taking half a pill every other day then dropping down to .25 everyday once irritability/insomnia went away. Withdrawal symptoms have always been very mild, just a little irritability and a harder time falling asleep, for a week or so.

I’ve been on .25 for a few months now and lately have noticed if I miss a day, nothing much really happens. Am I good to just stop? Or go down to every other day? My biggest concern is seizures, but I have a feeling that’s just anxiety brain talking at this point. Definitely ready to be done painstakingly cutting the tiny .5 mg pills in half lol and super ready to be done worrying about getting refills. 

Thanks!!",2,{},"{'label': 'neutral', 'score': 0.50533396}"
2020-04-11 20:07:06,https://www.ctvnews.ca/health/coronavirus/people-needing-addiction-services-feeling-abandoned-during-pandemic-1.4889514,"No telling how many people will develop a benzo dependency b/c of this virus, not to mention those in recovery will relapse. Say a prayer for them.",,41,{'virus': 1},"{'label': 'negative', 'score': 0.7247582}"
2020-04-11 18:02:15,https://www.reddit.com/r/benzorecovery/comments/fzk2ny/is_cbd_oil_a_safe_option_to_try_while_taperingon/,Is CBD oil a safe option to try while tapering/on WD?,"I wonder if one can develop dependency on this, or if it can trigger a paradoxical anxiety effect.",4,{},"{'label': 'negative', 'score': 0.5236885}"
2020-04-11 18:00:15,https://www.reddit.com/r/benzorecovery/comments/fzk1gd/benzo_tapering_and_gastritis_with_h_pylori_is/,Benzo tapering and gastritis with h. pylori: is keto diet a good idea?,"A doctor suggested CBD oil plus a more rigid diet, suggesting something keto-like, this during my WD, keeping the tapering.

I am skeptical with this as all the times I go hungry I start to become stressed and my anxiety increases a lot with unproductive overthinking.

Does anyone here had success with a keto diet? Is this a bad idea considering my scenario (gastritis and h. pylori)?",2,{},"{'label': 'negative', 'score': 0.7308713}"
2020-04-11 15:45:42,https://www.reddit.com/r/benzorecovery/comments/fzgg5a/tell_me_your_experience/,Tell me your experience,"I was taking 1mg for about two and half years and also a SSRI and I couldn’t pay for the SSRI anymore so I had to stop cold turkey and had a rapid detox of Klonopin of 5 days using Librium in a medical facility. That was a month ago and I feel like I’m losing it. I could list off numerous amounts of things going on but I can barely type this out. The reason I’m putting this up is because I feel like my family is just unconcerned. Based on what it says online about withdrawals I don’t blame them because it’s completely and utterly wrong which doesn’t make sense, but when I go and tell them they act like I’m just saying excuses or trying to make them feel bad when I’m just asking for help. I am going through absolute torture and my family just does not believe me. Could you please write out your experience so I could have something to show them ? I really need your help here. Thank you",3,{},"{'label': 'negative', 'score': 0.91961986}"
2020-04-11 12:58:52,https://www.reddit.com/r/benzorecovery/comments/fz9k2l/alternative_taper_reducing_frequency_of_use/,Alternative taper: reducing frequency of use instead of amount of dosage? I’m on a small amount.,"I’ve been using 1mg a day for 6+ months now. It really helped me out in the past 1/2 year, but I’m looking at ceasing daily use while quarantined. most people with serious etiz abuse problems (5+ mg a day) would definitely be better served to taper, but since I’ve kept my prolonged use relatively low I’m wondering if I can just move to dosing less frequently versus less of a amount daily amount. 

Any insight? Basically instead of taking .5mg daily I’d take 1 mg every other day and then add another buffer day in when I’m comfortable up until I’m at once a week and Pretty much off daily use. maybe take a couple months off at that point. 

I’m considering this because I feel like it’ll be easier for me personally to just have on and off days versus reducing my dosage daily.",2,{'quarantine': 1},"{'label': 'positive', 'score': 0.5010396}"
2020-04-11 12:39:45,https://www.reddit.com/r/benzorecovery/comments/fz91u5/deja_vu_and_headaches/,Deja Vu and headaches.,"i am ~5 months sober from valium, cold turkey and then tapered after the symptoms hit. i feel like my symptoms were a lot better for about 3 weeks but now all of a sudden i am having anxiety again as well as really bad headaches and deja vu accompanied by feelings of fear. anybody else going through this or has been through this? i think it would just really help to know i’m not alone. 

love u guys.",15,{},"{'label': 'positive', 'score': 0.7238577}"
2020-04-10 22:28:42,https://www.reddit.com/r/benzorecovery/comments/fyum07/klonapin_withdrawal/,Klonapin withdrawal,"Hey guys. So I have been taking 1 mg of klonapin for about 3 years and its been about a month being off of them and I still feel absolutely terrible. I detoxed quickly at a detox center and they put me on Librium the whole time, but felt the withdrawals a day after I left. I can barely type this out. My mind is so scattered and I can’t think, talk, or read right at all. How long will this last ? Or what are your experiences with this ? I am all alone quarantined and it’s been hell. I feel like I’m losing it.",6,{'quarantine': 1},"{'label': 'negative', 'score': 0.9177321}"
2020-04-10 19:29:44,https://www.reddit.com/r/benzorecovery/comments/fyrkud/taperdoc_question/,Taper/Doc question,"So before shelter in place I had talked to my p-doc about tapering. He seems to think that after 10 years of use I can taper down to .25 of alprazolam from 3mg per day and then just jump off.

I can’t. I tried and got muscle twitches, heart palpitations, and horrible insomnia.

I want to do the Ashton manual method. I haven’t talked to him about it but I’m afraid he might not agree.
I don’t have insurance.

If he says no and I have to find a new doc to help, do I tell them I’m medically addicted and the current doc won’t help? I have my medical records (as of 2 years ago) and can prove he’s kept me on it. I was never told the dangers.
I’m afraid I’ll be seen as a drug seeker and will have to go cold turkey. 
Anyone have any advice on broaching that topic with a new doc?
(I plan on doing some CBT as well.)
Thank you!",3,{},"{'label': 'negative', 'score': 0.77207595}"
2020-04-10 17:08:18,https://www.reddit.com/r/benzorecovery/comments/fyou2z/tapering_off_klonopin_with_gabapentin/,Tapering off Klonopin with Gabapentin,"I’m on day 6 of no benzo use. I was taking Gabapentin along with Klonopin and then I upped the dosage of Gabapentin at the end of my Klonopin taper. Now I am taking 600mg of Gabapentin 3 times a day. I was only on Klonopin for about 5 months, and Gabapentin for about 3 months. I know I am using Gabapentin as a crutch to stop taking Klonopin. I feel like I would be more comfortable taking 800mg of Gabapentin 3 times a day (the maximum dosage), but at the same time I don’t want to become more dependent on it. I want to eventually stop taking it. Has anyone else done something similar to this? How long should I wait to try and taper off Gabapentin?",6,{},"{'label': 'neutral', 'score': 0.60407186}"
2020-04-10 17:03:25,https://www.reddit.com/r/benzorecovery/comments/fyoqig/sick_of_this_shit/,Sick of this shit,"Jumped from nearly 3 year valium taper 2 months ago. Ok most of the time but have ridiculous fatigue from early am till after lunch if I'm lucky. Caffeine was working for a while, then stopped, so I tried some Modafinil with success, though I'm not mad about the wired feeling
Anyone else used this?
I was hoping the exhaustion would just disappear..as if",1,{},"{'label': 'negative', 'score': 0.7109721}"
2020-04-10 16:20:02,https://www.reddit.com/r/benzorecovery/comments/fynva1/2_weeks_and_im_off_this_poison/,2 weeks and im off this poison,Can anyone give me some tips once i jump to stay off? I worked on this taper for a year and i dont ever want to go back. Prayers to everyone trying to rid this poison out of their lives.,2,{},"{'label': 'negative', 'score': 0.80859685}"
2020-04-10 16:14:01,https://www.reddit.com/r/benzorecovery/comments/fynqxf/just_finished_detox/,Just finished detox,"I finished a 4 day detox where I had no klonopin for 6 days straight. It was hard because I went there for opiates and benzo abuse isn’t really a problem with me. However, I’ve noticed that my head feels clearer than it has in a while and I’m not sure I wanna go back on them. I got a refill bc my doc thinks I should be on them bc he wants my klonopin levels to be consistent all day in my blood but that was before detox where I was somewhat forced to not take them.",3,{},"{'label': 'neutral', 'score': 0.5235856}"
2020-04-10 09:15:15,https://www.reddit.com/r/benzorecovery/comments/fyfnlu/question_and_answer/,Question and answer,"How long after finishing your taper were you able to drink alcohol without extreme anxiety/depression on rebound? 

Add your usage and length of if possible :)",2,{},"{'label': 'neutral', 'score': 0.7146563}"
2020-04-10 06:08:58,https://www.reddit.com/r/benzorecovery/comments/fyd6cq/anyone_has_music_stuck_playing_in_their_head/,Anyone has music stuck playing in their head almost always,Couple people said to me earworms are a part of PAWS im 8 month clean btw. music keeps playing on my head and its so frustrating. especially after i wake up i have a complete random song playing and it keeps me from being grounded to the world and instead stuck in my head.,15,{},"{'label': 'negative', 'score': 0.9420815}"
2020-04-10 05:14:38,https://www.reddit.com/r/benzorecovery/comments/fycfir/nicotinamide_and_inositol_doses_or_experiences/,NIcotinamide and Inositol doses or experiences with withdrawal symptoms,"Hey jus bought some NIcotinamide and Inositol powder was wondering what the optimal dose will be.

Was thinking of NIcotinamide perhaps 1500mg a day (split into 3 doses)

Inositol 3g (split into 3 doses) - I read reports of higher doses but am a little skeptical

Appreciate any advice",2,{},"{'label': 'neutral', 'score': 0.61274}"
2020-04-10 02:51:31,https://www.reddit.com/r/benzorecovery/comments/fyaerw/9_months_out_brain_still_sensitive/,9 months out brain still sensitive?,"This happened twice: once after i took amino acids while working out and once after I took a melatonin with some amino acid sleep aid.
 both sent me into a temporary depression similar to what i experienced during withdrawal.
Coincidence or is my brain still not stable?
Thanks in advance for any thoughts..",5,{},"{'label': 'negative', 'score': 0.6249625}"
2020-04-10 01:51:40,https://www.reddit.com/r/benzorecovery/comments/fy9lq2/what_has_been_your_most_absurd_side_effectsymptom/,What has been your most absurd side effect/symptom of withdrawal?,"I feel like over my taper, I have experienced insane and unbelievable symptoms that are hilarious, terrifying or just plain odd. I’m curious what other people have experienced and if things have been as insane for them as me.",9,{},"{'label': 'negative', 'score': 0.6324158}"
2020-04-09 17:57:08,https://www.reddit.com/r/benzorecovery/comments/fy1kq6/does_valium_mitigate_paws_by_prolonging_and/,"Does Valium mitigate PAWS by prolonging and reducing its intensity, or is this generally only the case for acute withdrawal?","Hi, I’m not a benzo addict, but I do a lot personal studying of the brain and withdrawal in particular. I’ve noticed some discontinuity among the posts I find here, and I wanted to attempt to clear something up for myself, so that I may share with patients struggling. 

I’m reading a lot of conflicting information about using Valium to taper. My understanding is that due to its long half-life and larger dose equivalencies, Valium  reduces the intensity of symptoms during the acute withdrawal process by allowing for a slower titration process.

I could agree that would extend the withdrawal process a bit, but I’m reading reports of people saying they are 12-20 months off of Valium and still dealing with some level of symptoms. Isn’t the point of a Valium taper to reduce or in some cases eliminate PAWS?  

Any input is appreciated. From my experience, everyone is different, but what is the trend you have guys have seen or experienced?",9,{},"{'label': 'neutral', 'score': 0.64403325}"
2020-04-09 17:18:16,https://www.reddit.com/r/benzorecovery/comments/fy0w5t/is_it_possible_to_feel_worse_after_you_take_your/,Is it possible to feel worse after you take your dose?,Im on 10mg librium daily and almost done with my taper but ive noticed that after i take my dose i kind of feel worse. Does that make sense or am i just overthinking it?,3,{},"{'label': 'negative', 'score': 0.8392123}"
2020-04-09 15:39:56,https://www.reddit.com/r/benzorecovery/comments/fxz46n/burning_eyes/,Burning eyes,"Hey everyone. This is my first day of feeling mentally much better. My main issue today is my eyes. I have no idea if it’s withdrawal related but it started happening when I moved which is the same time I was taking my dose on and off and at lower doses. Anyway my tears are burning my eyes. When I yawn or laugh and my eyes tear it burns really badly. I’ve tried drops, omega 3’s, drinking tons of water, everything I can think of. It’s pretty debilitating as I can’t enjoy simple things like watching tv. Has anyone had something similar clear up for them? Thanks",1,{},"{'label': 'negative', 'score': 0.8640103}"
2020-04-09 14:43:28,https://www.reddit.com/r/benzorecovery/comments/fxy1fd/kicking_20mg_valium_advice_needed/,Kicking 20mg valium - advice needed.,"I've been addicted to prescrb drugs for way too long and it's gotten to the point that I'm taking them just to feel normal for SOME part of the day. Mornings are usually living hell. That's gotta stop.

So basically I ran out of valium early and seriously considering just kicking it cold turkey. In the past I've seriously abused xanax to the point of taking 20-30mg a day. Considering that 20mg valium is close to like 1mg xanax it's not THAT much, right?",2,{},"{'label': 'negative', 'score': 0.7994641}"
2020-04-09 14:32:28,https://www.reddit.com/r/benzorecovery/comments/fxxu4z/terrifying_nightmares_sleep_paralysis_help/,Terrifying nightmares + sleep paralysis help,"I’ve had about 4-6mg xanax a day for 7 days (I know a lot). This is my first night without one. I fall asleep fine but the nightmares and vivid dreams are absolutely surreal. 

I dreamt a bomb went off, and it sounded so real I got up and looked out my window. I thought the world was ending. I had another right after where someone had snuck into our house and hid in my cupboard. When me and my family found them they set explosives off on themselves, but it turned out to be “just a prank.”

When they ran away I chased them but they had a larger gang who through rocks at me and tried hunting me. I was terrified. 

It was SO REAL not like anything else.

I then had sleep paralysis, where I was laying in my bed and COULD NOT MOVE. No matter how hard I tried. My brother was playing minecraft on my pc next to me. I could see what he was building and he was talking to someone online. Then, he stood over me with a knife and called me terrible names and cursed me then proceeded to stab me several times with a knife. I couldn’t move I kept trying to move I was so scared. I was solid glued to the bed, I just couldn’t move. 

I eventually started moving and shook up with him and said “ we g?” I kept dipping out of dreaming about random shit then waking up in my room with my brother playing pc where I thought that was my reality. Until now. 

I’m here now ok. Everything is fine it’s just those dreams were SO terrifying. I don’t wanna sleep. 

Please help.",3,{},"{'label': 'negative', 'score': 0.7802194}"
2020-04-09 12:02:06,https://www.reddit.com/r/benzorecovery/comments/fxv0h6/how_long_does_xanax_wd_last/,How long does Xanax wd last?,So right now I’m being tapered off Xanax. This started when I was 18. Got a script for 90 bars a month. I’m now 25. I’m down to half of a .25mg 3x a day. When should I make the jump? And how long should I expect it to last?,3,{},"{'label': 'neutral', 'score': 0.6362395}"
2020-04-09 08:46:09,https://www.reddit.com/r/benzorecovery/comments/fxrsdx/benzo_recovery_after_3_months/,benzo recovery after 3 months,"So after 1 year of rather small amount of daily xannax dosage(1 to 2mg), I went cold turkey and had little to no problem except the brutal withdrawal symptom. I am 3 months clean now but my social anxiety has skyrocketed and with nothing to cope I end up spending all day in my room hating myself for being a piece of shit. I am stuck guys what should I do this has been going on for a long time now and is getting out of hand.",11,{},"{'label': 'negative', 'score': 0.9190504}"
