Date,URL,Title,Body,Score,COVID-19 Mentions,Sentiment
2020-09-29 23:04:00,https://www.reddit.com/r/benzorecovery/comments/j2e4em/which_day_is_the_worst_once_you_completely_stop/,Which day is the worst once you completely stop your taper?,I’ve heard the third day is the worst. Is this true for those who tapered off?,6,{},"{'label': 'negative', 'score': 0.87275356}"
2020-09-29 21:45:30,https://www.reddit.com/r/benzorecovery/comments/j2cx2i/is_anybody_just_constantly_irritated_during_taper/,Is anybody just constantly irritated during taper? How long does this last?,"Alright so I may be jumping the gun, but it’s been 2 days, I’m halfway through my taper—and all of a sudden EVERYTHING is annoying to me. My SO is just like, “what is wrong, why are you being a brat” and I’m like, speechless bc EVERYTHING is wrong when NOTHING is wrong at the same time. My brain is driving me up the wall and I just want it to chill the fuck out.. has anyone ever experienced this while tapering or experiencing this rn? I’m doing a fast taper so it just feels like I’m WD/stabilizing/WD/stable...not interested in slowing the taper down either...I don’t think 😬 I don’t want my SO to feel bad bc I feel bad, that’s not cool—but it’s like I seriously couldn’t control the brat-like being that was coming out of me, so weird. Can I attribute this behavior to coming off benzos rn?",30,{},"{'label': 'negative', 'score': 0.95358396}"
2020-09-29 20:30:30,https://www.reddit.com/r/benzorecovery/comments/j2bs2i/been_tapering_for_months_been_on_25_for_a_while/,Been tapering for months been on .25 for a while but this past week I’ve cracked. I’ve been taking more than my taper dose daily and now I think I Fkn ruined months of work. The anxiety has just been so severe I couldn’t take it.,My mental dependence on these pills is rly insane. I was doing good only cheating here and there now this past week I’ve taken more than my taper dose of .25 a day everyday like around one mg and feel like I’ve totally fucked it all up. Months of work down the drain.,2,{},"{'label': 'negative', 'score': 0.9368778}"
2020-09-29 18:57:59,https://www.reddit.com/r/benzorecovery/comments/j2a8of/severe_headache_after_overthinking_while_mentally/,Severe headache after overthinking while mentally exhausted,"Hi all,

I don't know what to do.

I am currently at .50mg of V, (cut from .6mg a week ago) and today something happened.

I work with technical/analytical stuff and today after working a bit, overthinking and insisting on doing it while already feeling mentally exhausted I entered ""overheat mode"" with a part of my brain next to my right temple feeling like it's in flames. I wouldn't describe exactly as pain, but is very intense and debilitating. I had to stop working like 3 hours ago and I am still feeling bad with the same part of my head still feeling like with high pressure from the inside and hot and aching.

Last time something similar happened to me, I tried to sleep and the following day I woke up with my hand and my foot persistently tingling even after minutes from waking up.

I am scared and the right side of my head still feels like is burning inside, I don't know if it's ""normal"" benzowise or if I passed the point of no return. Should I go to the ER?

Blood pressure and pulse are almost normal, but in the worst part of this experience I was avoiding any social contact even at home as even formulating phrases or listening made me feel even worse as if I was processing tons of information after 'overheating'.

Any help on this would be very much appreciated.",3,{},"{'label': 'negative', 'score': 0.9160226}"
2020-09-29 18:49:36,https://www.reddit.com/r/benzorecovery/comments/j2a3h7/do_ssris_like_sertraline_help_through_benzo/,Do SSRIs like Sertraline help through Benzo tapering?,,1,{},"{'label': 'neutral', 'score': 0.91014355}"
2020-09-29 16:42:24,https://www.reddit.com/r/benzorecovery/comments/j27rgz/vote_me_down_if_you_want/,Vote me down if you want,"But after being COMPLETELY sober for 9 month the improvement is so minor, that it is just not worth it.
Everyday I want to kill myself and on top of that Im so ill that I cant even work. 
This is absolute hell. 
Before anyone makes assumptions. I‘m 21 years old and my physical health is excellent(if you dont count the brain, lel). 
Even while being fucked up on benzos, I could at least sleep and work.",9,{},"{'label': 'negative', 'score': 0.76580185}"
2020-09-29 16:42:03,https://www.reddit.com/r/benzorecovery/comments/j27r8c/tapering_ativan/,Tapering Ativan,Well I was gonna switch to valuim to try my taper I did and didn't like the way it made me feel. Been taking  .5 mg once a day on and off for 3 months  the first  2 months was on and off till I started noticing some interdose withdrawal symptoms feeling a bit crappy. So ive been doing the .5 every day for about 2 weeks every day. Im cutting to .25  I have 16 1 mg ativan left so I think ill do .25 for 2 or 3 weeks and then .125 to finish it off wish me luck everyone.,1,{},"{'label': 'negative', 'score': 0.47819448}"
2020-09-29 15:04:51,https://www.reddit.com/r/benzorecovery/comments/j25voa/down_to_6mgs_of_valium_feel_pretty_brain_dead/,Down to 6mgs of Valium. Feel pretty brain dead.,I mean it’s great not to be spazzing out with anxiety but I’m super disassociated and blank minded. Like talking to people in person is a challenge because i cognitively process everything very very slow. I’m in some kind of weird ass fog and derealization phase. I worried psychosis. But realized there’s a huge difference clinically.,3,{},"{'label': 'negative', 'score': 0.6197787}"
2020-09-29 14:35:32,https://www.reddit.com/r/benzorecovery/comments/j25a3i/5mg_clonazepam/,.5mg clonazepam,Hello! I’ve Been on .5mg of clonazepam daily for several years. I was wondering what the best taper would be for this dose? I’m ready to be done. Going to see my doctor this week.,3,{},"{'label': 'neutral', 'score': 0.63420534}"
2020-09-29 13:14:08,https://www.reddit.com/r/benzorecovery/comments/j23lhw/starting_a_taper/,Starting a taper,Had a habit of taking 2mg every few days ( usually off for two full days and then taking the third) from about the last week of July until now. Moved down after 3 days to 1mg for the first time today. Plan on doing this for about two weeks and moving to .5. Wish me luck!,3,{},"{'label': 'positive', 'score': 0.5912333}"
2020-09-29 08:46:21,https://www.reddit.com/r/benzorecovery/comments/j1yii8/having_a_a_multi_day_long_anxiety_attack_advice/,"Having a a multi day long anxiety attack, advice on how to cope?","So this has only happened once before, right before I started Benzos around two year's ago.

I've been off 15ish months without one of these, but I'm currently locked in one. Can't sleep, too jittery and uncomfortable.",1,{},"{'label': 'negative', 'score': 0.8669629}"
2020-09-29 00:58:29,https://www.reddit.com/r/benzorecovery/comments/j1srj3/paws_at_seven_months_out/,PAWS at seven months out?,"Hey everyone - I’m a little over seven months of no klonopin after 17 years of 2mg/day prescribed.

Has anyone felt lingering symptoms of hopelessness/anxiety/depression at this point? I recently moved across the country and have been struggling. I don’t want to point fingers at benzos, but I can’t help but feel it’s playing some role..TIA",2,{},"{'label': 'negative', 'score': 0.6478928}"
2020-09-29 00:31:14,https://www.reddit.com/r/benzorecovery/comments/j1setg/klonopin_and_etizolam/,Klonopin and Etizolam,"I have been using Klonopin (0.25mg) and Etizolam (0.5mg) on and off for a total of about 3 months. Used to take take them in 15 day period regularly then stop for a while and the resume. Currently I am off klonopin (CT) for about 2 weeks. I am experiencing serious muscle aches, and weakness along with unbearable tension in my neck and chest. And this weird insanely uncoordinated feeling, like each pat of my body moves of it's own discretion. My sleep is mildly fucked. How much longer can I expect the withdrawals to persist?",2,{},"{'label': 'negative', 'score': 0.88762414}"
2020-09-29 00:27:21,https://www.reddit.com/r/benzorecovery/comments/j1sd05/im_at_the_end_of_my_taper_and_im_scared_of/,I’m at the end of my taper and I’m scared of jumping off. How do you cope with this?,Any advice? Anyone else go through this? I’m down to .1 of Ativan.,7,{},"{'label': 'negative', 'score': 0.6978659}"
2020-09-28 17:43:30,https://www.reddit.com/r/benzorecovery/comments/j1lngp/looking_for_advice/,Looking for advice,"Hello everyone. I am at a point in my life where I am feeling very unsure of what to do to feel better. I have been on Xanax for 6 years now. I have been on .5mg for probably around 3 years. My doctor upped my dose to 1mg a couple years back, but I have almost always taken half of my pill, unless I was feeling especially anxious-then I would take a whole one. But generally I only take .5mg every day or every other day. I have been feeling irritable pretty regularly for the past 2 years. I couldn’t figure out why I was angry all of the time, and would come up with other reasons not related to Xanax. As I’ve lurked on this subreddit and read your guys experiences I’m starting to think maybe I’ve been putting myself in withdrawals because I haven’t upped my dose in years. The frustration I’ve been feeling is ridiculous, my brain doesn’t feel the same, it’s hard to form complete sentences sometimes, it’s hard to leave the house most of the time. I don’t want to take more Xanax because that’s more that I’ll have to taper off of once I finally feel ready. But I’m also sick of feeling so frustrated all the time, and I’m really starting to believe it’s because I’m not taking enough Xanax for my tolerance. I hate being so dependent on a pill. It never feels like the right time to start a taper, especially now with a 1 year old, an 8 year old, and this epidemic. I guess I’m just looking for people who understand what I’m going through. Should I take more Xanax and feel better in my day to day, and pay for it later? Is it really that big of a difference to taper off .5mg vs 1mg? Thank you for reading my post",3,{'epidemic': 1},"{'label': 'negative', 'score': 0.85240626}"
2020-09-28 17:06:42,https://www.reddit.com/r/benzorecovery/comments/j1kxwm/withdrawals/,Withdrawals?,"Hi I’ve ONLY been using Xanax for two weeks and right now I feel like complete shit. I’m anxious, have a massive headache, nauseous, cold, sweating???
It’s been two days since last time and I took about 3 mg.  To be fair I felt like shit yersterday too but I ended up sleeping from 13-21 and then smoking weed and sleeping again. I don’t know why I’m sleeping so much but at least I don’t feel as depressed.

Is it possible I’m having withdrawals? Maybe my stuff was laced? Or is it not Xanax at all? Any response would be helpful",1,{},"{'label': 'negative', 'score': 0.82407784}"
2020-09-28 16:50:48,https://www.reddit.com/r/benzorecovery/comments/j1kmnf/better_base_oil_than_pg_for_tobacco_compunding/,Better base oil than PG for tobacco compunding please,"I have used base oil as propylene glycol , along with fragnence, menthol .
But PG has disappointed me as i feel PG is hot/heat in nature so it is changing the property of my other agents which are part of my compound.

Kindly suggest a better base oil to hold fragnence and to give a kick when put in mouth.",0,{},"{'label': 'negative', 'score': 0.6668809}"
2020-09-28 13:22:43,https://www.reddit.com/r/benzorecovery/comments/j1gcpj/16_hours_waiting_at_the_hospital/,16 hours... waiting at the hospital,I've been taking 2-10 bars a day for over four months and 10-20 pills of fentanyl for a year and a half.... Wish me luck that I don't have a seizure... I've thrown up twice and want to leave... I don't think I can take it anymore... I just want to take an uber and grab then go to a real rehab.... Wish me luck,6,{},"{'label': 'negative', 'score': 0.8836528}"
2020-09-28 09:57:53,https://www.reddit.com/r/benzorecovery/comments/j1cgz3/day_24_some_advice_needed/,"Day 24, some advice needed","This will be a bit of a ramble lol 
I’m in my late 30s always abused Benzos to some extent, my sheer anxiety would never let me get too bad and I would taper myself and never felt any withdrawals beyond tossing and turning for 2 nights....would take 2 sticks a day and smoke massive amounts of weed...I would also get prescribed 60 1milligram lorazepam a month, I would use those within a week and then grab sticks to hold me over 

I stopped taking the sticks  for a good 2 years and would only use the 60 lorazepam , but abuse them, take 10 at a time first 4 nights  ( I think 4 equal a stick and they don’t hit me as hard ) and then 8,6,4,3,3,2,2 and stop for the next 2-3 weeks and not skip a beat, usually smoke more pot those last weeks but never any withdrawal and mood stayed pretty stable 

Quarantine hits and I’m working from home, smoking more pot with the extra time and then eventually getting the urge for some sticks since it’s been so long ...

quarantine agave me an unbelievable amount of free time and I started playing poker on the internet like I use to do in college and had some success , so one week I win 10k and decide it’s gonna be a party and grabbed 100 sticks ( no one sells a handful anymore , tough to get and only thing available) thankfully my friend came over saw the sticks , took 80 and only let me keep 20 lol anyway I took 2 a day at night to relax like I use to all the time, and then I started a quick taper by taking  1 stick and then a half to taper but for the first time ever I got withdrawal symptoms , shortness of breath mostly and crazy anxiety ..very scary but subsided within a day or two 

Now I’m back to the usually 60 a month, which I thought I could always handle by abusing and having fun with 40 of them , quick taper and a few weeks without but I’m finally sick of even that , so last taper I kept going and never filled script 

I’m on day 24 no Benzos , I’m smoking a lot of pot but noticed the depression sucks lol and I have no desire to work out, eat healthy , be productive ( all things I have been doing well with the 60 lorazepam in my system ) 

My questions have to deal with the timeline...so I think I can will myself to start working out again and also eat healthy but right now I legit do nothing but smoke pot and take edibles and wait for it to get dark to go to sleep , bored all day long once work is over...I enjoy reading but can’t concentrate long enough to read more than 5 pages, same with playing poker online, don’t even have the will to start playing ...when will the concentration improve ? Does it lol God, I hope so 

My memory has always been good even with all the pot, but that ship has sailed lately lol I’m a burn out and forget a lot of things, Will this improve with time ? 

My last question is sex drive, I barely have one but will still watch porn at night to help with the sleep lol 
Anyway , the first 2-3 days without the lorazepam my sex drive is high and I might reach out to an old girlfriend or acquaintance to fulfill that need but once that is over I instantly regret it , like a bad one night stand , then I still have to talk to this person etc and I remember why we stopped seeing each other in the first place lol so when I’m on the lorazepam, I don’t really care about sex, I would choose 10 lorazepam, pot and food over hanging out with a girl and sex and obv that isn’t normal lol will I ever get a normal sex drive off these things ?",0,{'quarantine': 2},"{'label': 'neutral', 'score': 0.4926082}"
2020-09-28 09:25:08,https://www.reddit.com/r/benzorecovery/comments/j1bxkw/tinnitus/,Tinnitus,"For anyone who got tinnitus in benzo withdrawal - did it ever go away? And if so, after how many months?",6,{},"{'label': 'neutral', 'score': 0.6607016}"
2020-09-28 02:29:26,https://www.reddit.com/r/benzorecovery/comments/j170d9/i_really_need_some_successful_stories_right_now/,I really need some successful stories right now guys. I’m feeling absolutely hopeless. I just want to be myself again but it seems impossible. Will I ever really recover from this?,Please guys I just want to know all of this is worth it.,2,{},"{'label': 'negative', 'score': 0.49912652}"
2020-09-27 23:02:26,https://i.redd.it/ygecdjiy0tp51.jpg,Still struggling with opiates but after multiple years of abuse this is huge for me,,97,{},"{'label': 'negative', 'score': 0.542496}"
2020-09-27 21:17:43,https://www.reddit.com/r/benzorecovery/comments/j12tlq/75_days_ago_i_jumped_and_i_couldnt_be_happier/,75 days ago I jumped and I couldn't be happier.,"I've finally ended my decade plus affair with benzodiazepine. It's day 75 of a cold turkey jump from multiple milligrams of Klonopin I can't be happier than where I'm at now. I am now having zero to very little WD symptoms. I barely even want to call them waves as they barely last and they're very weak. My muscles being sore and weak are like the only things left.  But I'm so glad I didn't prolong healing and taper. I feel like in hindsight it would of prolonged suffering. I'm not sure but what I did was right for me. We are all different. I also took some medicine for seizures when I did jump. Anyways, don't doom yourself. There's no guarantee you're going to be suffering for ages. WD definitely sucked. It was not close to easy. My symptoms were super bad so I wasn't getting off barely touched like some luckily do. I'm just saying for anyone new to recovery or considering jumping, give your body time. Try and see the light at the end of the tunnel. Just wait for your emotions and feelings to return and know life will be better off benzos.",38,{},"{'label': 'neutral', 'score': 0.42459643}"
2020-09-27 18:40:42,https://www.reddit.com/r/benzorecovery/comments/j10g5r/2_months_clean_off_xanax/,2 months clean off Xanax,"Did a 4 week long taper, at my worst I was taking like 7-8 bars every day
Still can’t sleep, anxiety is bad, but it gets better, and recovery is pretty cool",12,{},"{'label': 'positive', 'score': 0.70984966}"
2020-09-27 17:52:17,https://www.reddit.com/r/benzorecovery/comments/j0znro/anyone_know_the_difference_between_the_different/,Anyone know the difference between the different types of magnesium?,,1,{},"{'label': 'neutral', 'score': 0.86353666}"
2020-09-27 15:54:29,https://www.youtube.com/watch?v=leJGFhaZcuE&lc=UgwP8DyV_yDmAvRRpA54AaABAg,i been creating music to cope on withdrawals,,35,{},"{'label': 'neutral', 'score': 0.818253}"
2020-09-27 14:36:37,https://www.reddit.com/r/benzorecovery/comments/j0w909/drinking_alcohol_on_a_tapered_benzo_withdrawal/,Drinking alcohol on a tapered benzo withdrawal,"I hate alcohol but my tapered reduction through my doctor is so severe that I’m having to substitute benzo’s with alcohol because I can’t cope with how fast the taper is going as I’ve been on the benzo’s 15 years . I’m tapering off 6mg of clonazepam. I can’t leave the house without alcohol on my dose. I could before, I feel like I’m substituting 1 evil with another but the doctor or nobody else understands",4,{},"{'label': 'negative', 'score': 0.9185711}"
2020-09-27 10:16:47,https://www.reddit.com/r/benzorecovery/comments/j0rtej/why_some_people_do_a_10_month_taper_for_a_12/,Why some people do a 10 month taper for a 1-2 months use? Don’t they further damage theirselves?,,5,{},"{'label': 'negative', 'score': 0.88777083}"
2020-09-27 10:15:44,https://www.reddit.com/r/benzorecovery/comments/j0rss5/recover_clinic_in_europe_asia_or_south_america/,"Recover clinic in Europe, Asia or South America?",I live in Ireland but I am from Uruguay. I have been looking for an affordable place that let me detox with some support but at a slow pace and I couldn’t find anything. The most affordable clinics I found were in Indonesia and one in UK but I feel that is more for addiction. In my home country I am afraid there are no clinics that provide an holistic treatment with mindfulness.,1,{},"{'label': 'negative', 'score': 0.6961926}"
2020-09-27 03:37:07,https://www.reddit.com/r/benzorecovery/comments/j0n32m/just_benzos_remaining/,Just benzos remaining,"You might have read some of my comments here, trying to support everybody struggling in here... well time to me to cut my “last drug”. 3 weeks ago I consulted with the best toxicologist of my country( Albania :( ) and we decided to cut to 0 immediately lorazepam and diazepam. So we went on and started on a “comfortable” dosage of 2x2x2 mg per day of clonazepam( it’s a shitty version of klonopin in here but that’s all you can find). A week ago i cut 1 mg from the 2mg of lunch and today we take another step by cutting the remaining 1mg. So today we are on 2x0x2 mg. From 6mg to 4mg so soon I didn’t expect. Side effects are just trouble falling asleep and trouble sleeping(panic attacks), mood swings(rarely) and some kind of a brain fog. I will keep you posted guys of the next cut. If i can do it, a person whose preferred combination was 16mg clonazepam, alcohol and a fuckton of weed daily, well everyone can do it.",5,{},"{'label': 'neutral', 'score': 0.4520242}"
2020-09-27 03:30:23,https://www.reddit.com/r/benzorecovery/comments/j0n0dp/fuck_benzos_been_sober_for_more_than_2_years_now/,Fuck benzos been sober for more than 2 years now,Just want to tell u guys it’s always possible no matter what ! I was fucked up and I made it out my life is great and I don’t feel like I need to depend on a stupid pill to live my life how I want ! I hope you guys reach your goals pills or not and always have positive vibes.,75,{},"{'label': 'positive', 'score': 0.61807144}"
2020-09-27 01:48:00,https://www.reddit.com/r/benzorecovery/comments/j0lslf/9_month_off_and_miserable/,9 month off and miserable.,"Hi, I dont want to discourage anyone from getting off of benzos, but since I‘m clean my life is a wreck. Cant sleep properly, super depressed, cant function and all around I just want to take my sleeping aid. 
Hell, maybe for some people drugs are ment to be taken? 
Please dont take this as an advice but I am just so desperate. I‘m 21 and c/t 9 month ago from 3 years of use and I just want to off myself sometimes. 
I thought after all this time I could function but I am unemployed because my lack of sleep wont let me do basic tasks(I exercise regularly, I meditate, and eat healthy) 
I wont to take part in a stressfull career and maybe this is the price one has to pay, taking aids to hepl you cope? 
Like a Bodybuilder taking testosterone? 
........",1,{},"{'label': 'negative', 'score': 0.93492377}"
2020-09-27 01:09:52,https://www.reddit.com/r/benzorecovery/comments/j0lb37/what_would_you_do_diazepam_taper/,What would you do? Diazepam taper,I have stabilised on 8mg of Diazapam after trying to reduce it too fast (from 10mg). I have only been on Diazepam for under 2 months. If you were me would you reduce by 1mg per week or 1mg per fortnight?,2,{},"{'label': 'neutral', 'score': 0.7711236}"
2020-09-26 20:05:50,https://www.reddit.com/r/benzorecovery/comments/j0gvcr/i_dont_wanna_get_addicted/,I don’t wanna get addicted...,"Hey. I’ve always liked benzos, they make it feel nice and are life saver when I have to wake up early but can’t fall asleep. 
I’ve been suffering from nerve pain for over a year and I don’t take meds for it. It often keeps me awake at night it’s horrible.
Weirdly I’ve found that valium and Xanax tremendously helps with the pain to the point where I can actually sleep, although it is never (that I know of) prescribed by doctors for that matter. They’ll usually give you something like Gabapentin or Lyrica which I’ve heard isn’t that great and doesn’t always work. 
Anyway. I used to take benzo mostly at night when I’m felling anxious, sad and if I can’t sleep and have stuff to do the next day. 
But recently my pain has been SO BAD that I litteraly end up taking benzos for the pain, in order to sleep. 
I managed to get a (fake) prescription for 0.5mg of Xanax. I used to take it once a while, then once a week, then every 2 days, now it’s like everyday... id take between 0.25 and 0.5, never more. 
I’m scared of becoming addicted to it, and I feel like my tolerence is building up as a half used to be enough but now I take a whole 0.5mg.
I don’t want to get into this vicious circle, but I litteraly cannot bare the pain at night and that’s the only that helps.
Im going to try to quit ASAP, I’ve ordered some CBD buds (they help a bit) and a strong (and expensive) antioxidants well known to treat neuropathic pain.
Should I expect any withdrawal? What would they be? How can I behave myself into not taking it? Any advices please? Thank you",2,{},"{'label': 'negative', 'score': 0.6581458}"
2020-09-26 16:10:18,https://www.reddit.com/r/benzorecovery/comments/j0cwg7/its_been_getting_real_bad/,Its been getting real bad,"Haven't recovered since my last taper, every day is getting worse, my brain burns and my cognition is gone, extreme agitation, racing and cant think. Last night I ended going the hospital, was given valium, but it wasn't a substation for a current dose. Haven't had a meal in four days. Pacing and panic.  The valium made it worse im sure.",2,{},"{'label': 'negative', 'score': 0.96437997}"
