,Date,URL,Title,Body,Score,COVID-19 Mentions
106,2021-05-23 16:07:56,https://www.reddit.com/r/benzorecovery/comments/njfyjo/my_spirit_is_strong/,My Spirit is Strong,"—First, My background— 

5 years ativan use plus many unwitting gaba-ergic mistakes along the last several years that have done far more nervous system damage (I’m now super sensitive to tapering). 

Headaches, burning nerves, fatigue, back and neck muscle cramps bad enough to have me curled in a ball pulling at my hair, jaw clenching/pain, tinnitus that never ends, many digestive issues, stomach cramps like a charlie horse that last lasts hours, skin rashes that have spread to much of my body, unable to eat 90% of the food I used to due to unreal food sensitivities. 

Then there’s the typical symptoms: depression, anxiety, negative thought rumination, extreme irritability, memory and cognitive issues, and long periods of inability to experience joy or pleasure no matter what activity I do (anhedonia). 

All of this culminating in an unavoidable feeling of hopelessness, of permanent brokenness. 

I’m doing the Ashton Method. Gone from 1.5mg ativan to .22mg ativan + 13mg diazepam over about 6 months. It has been incredibly difficult just to get this far. This last reduction from 0.25mg to 0.22mg ativan has ripped through me like a freight train. 

— This morning —

I woke this morning with such bad muscle pain and weakness I almost fell flat on my face reaching for my robe. 

Took my am doses and ate breakfast. Couldn’t wait to get into a hot shower to ease my aching muscles. 

For some reason, especially in the shower I get into obsessive negative arguments with imaginary people I will meet, or people from my past. 

This morning I decided i’m going to use my time differently. 

If my mind was going to ruminate, I wanted to exert some control over what I was ruminating about.  I would say a phrase repeatedly, in order to short circuit the negative thinking. 

After trying several different phrases, I settled on “my spirit is strong”

So I said it... “my spirit is strong”about 20 times in a row. During... thoughts crept in like “this isn’t going to help you... you’re far too broken for words to have any effect, this is a sad joke”

But I kept repeating
“my spirit is strong” 
over and over. 2, 3 minutes passed. 

I kept noticing the negative thoughts trying to get in... but as the words “my spirit is strong” started to sound more like a heartbeat or a softly beating drum, the negative thoughts became much more quiet, until they weren’t there at all. 

After 100’s of repetitions, the words started to sound weird, like a strange collection of vowels, consonants, rhythms and notes that had no meaning.  

“my spirit is strong”
“my spirit is strong”
“myspyretesstrong”
“meispyrotesstrung”

more time passed 

The rhythm became the only thing in my focus. 

buh-duhduh-duh-duh
buh-duhduh-duh-duh

I became aware of how the tones of my voice were reverberating in my chest and head. It became my only focus. 

all at once I exploded in sobbing, weeping... still repeating “my spirit is strong!”... but my voice now in a crackling high pitched whining cry, short convulsions between each word “MY - - SPI — ret IS STRO-ONG”. The water from the shower hiding my streaming tears. 

Then quickly my emotions cut out and I was numb again. still repeating “my spirit is strong”.  Now the words were softer, my breathing was more labored, the words still coming out, sounding exhausted, but still persistent. 

I said the words several more times, then stopped. 

My mind was quiet. My body was sore, but calm. 

It had been two hours since taking my am dose, so that’s a factor. but my mind was ... unusually quiet. 

i’m writing this to you, sitting with the towel wrapped around me in the bathroom.  I’m looking at the various things in the bathroom. the sink.  The faucets. The decorations and various items on the counter. 

I’m able to just witness them. My mind quiet. at least for now. 

I wonder what will happen if I do this regularly. 

I just thought I’d share.",24,0
107,2021-05-23 15:21:17,https://www.reddit.com/r/benzorecovery/comments/njeygv/mental_health_and_benzodiazepine_use_and/,Mental health and benzodiazepine use and withdrawal,"I am just curious about how many people dealt with new onset mental health symptoms during both their use of benzodiazepines and during withdrawal. I know that many people are put on these meds due to mental health issues, but not everyone is. I joined this subreddit to try to understand what my husband is going through in his withdrawal from clonazepam. He was put on for insomnia that he developed after the death of our son. He had absolutely no history of mental illness. But now his pretty unstable mentally. He did cold turkey off clonazepam last July after 3.5 years of use. 

So I guess my question is:

For those with no prior history of mental illness, did you develop any mental illness symptoms (mood swings, depression, paranoia, delusions, etc.) while on benzos? Or did you just deal with some of that while in withdrawal? How long did those symptoms take to resolve after coming off? Is anyone left with actual mental illness years after coming off?",7,0
108,2021-05-23 14:48:32,https://www.reddit.com/r/benzorecovery/comments/nje91h/first_drink_questionpotentially_helpful_feedback/,First Drink question...potentially helpful feedback for all?,"I had some of the worst symptoms you could imagine in December 2019 after just taking Ativan for 2-3 weeks. I finally feel back to normal. I know that because I closed a deal that’s never been done in history at my company, and people are like “holy %*%! you’re back!”...many thinking I’ve been out of it due to some other circumstances etc. 

Anyways...in my mind I kept an idea that I’d drink again in December 2021 (2 years later). 

Let’s say I wanted to just try to drink ok July 4th with family...am I taking a serious risk? Would the extra 5 months make a big difference?

I doubt I’d go crazy but maybe 2-3 drinks...

The feedback part is that I’d like to provide full details of how it went. I see many post thins without much followup. In a sense I’m semi ok with being a “beta tester”. I don’t mind some adverse effects, but is it possible to fully reset all my back to normal healing?

One part of me doesn’t think so, as even in the Ashton Guide she mentions it a few wouldn’t hurt. 

Thoughts? 

Try on 7/4 (1.5 year+ after withdrawal effects from 3 weeks of ativan)

Try on 12/31 (2 full years after...)

Am I overthinking it? I just hear horror stories from other posts, and I’ve also read posts of it helping.",1,0
109,2021-05-23 14:44:21,https://www.reddit.com/r/benzorecovery/comments/nje5u1/completed_1_month_of_successful_taper_felling_on/,"Completed 1 month of successful taper; felling on the edge, afraid of relapsing","One month ago I was taking between 10mg-14mg of xanax daily. My heavy usage began last year (I was using 6mg to 8mg everyday until march 2021). But I've been using xanax for 4 years now. Started with a 1mg prescription for anxiety treatment. 


My taper started with 4mg xanax a day + 15mg of imovane 
Seconde week 4mg xanax + 7.5mg imovane 
Then 3.5mg xanax + 25mg seroquil (not ideal but I'm out of imovane)
Now I'm taking 3mg xanax + 25mg seroquil 

Tomorrow I have an psychiatrist appointment; this doctor is the one that gave me seroquil and I hate it. Imovane is good but too expensive I was thinking about asking for zolpidem. She might as well refuse and the constant sleeping this method of taper provides is the only thing that is making this attempt successful  (I've been trying tapering and failing since november of last year I can't handle the withdrawal otherwise).

Side effects so far: my memory is horrible, I have terrible dreams, I forget words when I'm speaking so I feel really dumb and people around me think I'm still using more drugs than less because of how stupid I sound.",3,0
110,2021-05-23 14:34:45,https://www.reddit.com/r/benzorecovery/comments/njdybn/still_having_crippling_anxiety/,Still having crippling anxiety,Why am I still having crippling anxiety even after restarting my benzo?? Mabye I need a new antidepressant to control my anxiety alone.,3,0
111,2021-05-23 12:25:27,https://www.reddit.com/r/benzorecovery/comments/njb6wj/reading_the_ashton_manual_and_confused/,Reading the Ashton manual and confused....,"Hi. I just finally read some parts of this manual. I used to just look at tapering schedules and could not find it useful since I do want a crossover to valium just want to get off the K as I am down pretty much.this manual lists several things to avoid including magnesium. Yet I take this and it helps my sleep.

This entire ordeal, for me, has become one big pain in the ass with ever changing opinions and advice and I'm ready to just say fuck it. The one group online has people saying they're falling apart with symptoms after 2 years of recovery-and people arguing it's nutritional or something. I mean what to do? This is truly a case of having the best intentions and highest hopes and having these hopes continually doubted and I really cannot take it.I also see mixed results of people tapering quickly, getting the worst WD symptoms vs people dragging it out for YEARS!  Slow & steady does not always appear to be the best based on the testimonials and crap I am reading. listening to my body would be akin to taking directions from the enemy right now so that's out.

Honestly-please-what is everyone's thoughts, experiences, input on this> I know I threw a jumble of stuff out here but I need some clarity man.",9,0
112,2021-05-23 07:25:42,https://www.reddit.com/r/benzorecovery/comments/nj5uvy/equivalency_discrepancieswhat_to_believe/,Equivalency discrepancies...what to believe?,"I'm about to embark on tapering my alprazolam 0.5 three times a day, slowly and carefully. I'm also taking 15mg temazepam at night (all prescribed).

I'm planning to leave the temazepam alone while I work my way off the alprazolam, but I was doing some looking around to see what the temazepam/alprazolam dose equivalent is so that I have an idea of what I'm in for when the time comes to get off the temazepam.

Most of the calculators give an equivalency range, and man I've seen wild ranges, as low as 15mg temazepam = 0.5mg alprazolam up to 15mg temazepam = 3mg alprazolam.

Obviously, to think I am dependent on (in a relative/equivalency sense) 2mg alprazolam is bad enough...but the idea that the temazepam could make that actually closer to 4.5mg alprazolam is just mind blowing and totally disheartening, and will mean I have SO MUCH FARTHER TO GO after I get off the alprazolam.

Does anyone know what to make of these ranges and what to believe?",2,0
113,2021-05-23 03:51:28,https://www.reddit.com/r/benzorecovery/comments/nj2w9d/please_could_someone_provide_a_link_to_the_graph/,Please could someone provide a link to the graph that shows the nonlinear track of Valium WD?,The thing that shows the week 3 wave. I can’t find it anywhere. Thanks!,3,0
114,2021-05-23 03:02:00,https://www.reddit.com/r/benzorecovery/comments/nj281r/one_of_the_hardest_things/,One of the hardest things,"about benzo withdrawals is the isolation.  I do have friends, and I talk to them, but only when i’m in a window, which isn’t that often. When i’m not I don’t answer calls, or just respond to texts with “not feeling well”.  My few close friends understand what that means. 

When i’m anxious or depressed or just trapped in a void of feelingless-ness or in physical pain, I can’t relate to anyone. I can’t feel happy for them for the good things that are happening to them. I don’t care about whats happening with their kids, or what fun they and their friends had when they hung out together. 

I know that this is not who I am, but being a person who loves to be around people, my soul is starving for human connection - even though most of the time i’m incapable of enjoying or reciprocating it. 

I’m such a deeply emotional person and I miss sharing that part of myself with the people I love.  I miss me. 

I do believe i’ll heal someday, but the road there is so long, lonely and grey. 

Just needed to vent to a group of people who can understand. 

Thanks for reading.",50,0
115,2021-05-22 23:51:32,https://www.reddit.com/r/benzorecovery/comments/nizdr8/i_cant_cry/,I can’t cry,"I can't shed any tears, I feel empty no emotions
I'm so uncomfortably numb",6,0
116,2021-05-22 23:13:07,https://www.researchgate.net/publication/266418102_Chronic_effect_of_olive_oil_on_some_neurotransmitter_contents_in_different_brain_regions_and_physiological_histological_structure_of_liver_and_kidney_of_male_albino_rats,"The chronic administration of olive oil (7.5 mg/kg body wt.) caused a significant increase in norepinephrine (NE), dopamine (DA) , serotonin (5-HT) and gamm-aminobutyric acid (GABA) con-tent in different brain regions, thoughts?",,5,0
117,2021-05-22 21:54:36,https://www.reddit.com/r/benzorecovery/comments/nixhjm/withdrawal_after_a_3_to_4_day_binge/,Withdrawal after a 3 to 4 day binge?,"Hey guys....I HAD been in recovery for over 4 years from substances, until last week.  
Just to preface- I've only been prescribed benzos once before for an alcohol taper, so I literally have no idea if this is even possible.
I had access to 30 1mg ativans which I binged over the span of 3 or 4 days (I honestly can't remember) 
I am a few days out of my last dose and I feel like TRASH.
Can I be experiencing nasty withdrawal symptoms from this few day ativan frenzy?",3,0
118,2021-05-22 20:52:41,https://www.reddit.com/r/benzorecovery/comments/niwfia/rehab_finally/,Rehab finally.,"I completed a 30 day rehab program after years of being told it was the only thing that would help. I was originally prescribed clonazepam 6mg for about 8 years. I was on heavy opiates that whole time too. The first time I quit I went to the hospital and was pure hell. I managed to stay clean for about 8 months and relapsed after going out and getting a job. I stayed on whatever I could find for like a year and ended up getting a DUI a few months ago... I finally decided I need to go to rehab to deal with all this court stuff.
  Rehab was pretty hard. I got like a 5 day librium taper which I felt was really too short. I couldn't get my thoughts together the whole time and having bad shakes and tremors. It was hard being around all these other addicts who seemed to be getting better and looking forward to their futures when I knew I would still be feeling completely out of it for months to years. But am glad I did it as now places that didn't want to see me again have agreed to give me help. 
  I can't really do anything in this state. Just sit in my room watching TV or playing video games. I really appreciate this group for hearing that im not the only one going through this. I'd like to thank all of you. Seriously, benzo withdraw according to health care providers is like a couple weeks and you should be feeling better which is definitely not true for me. I see people post they can't go outside or function really. I thought some of these symptoms were just me going crazy. 
  So pretty much all I can say is benzo withdraw is in a league of its own. We should all get temporary disability but almost impossible to explain this. I just am having a much harder time knowing I have to deal with a DUI case. I don't know how im going to pay my fines and do all the other things that go with it.",33,0
119,2021-05-22 19:14:23,https://www.reddit.com/r/benzorecovery/comments/niumwi/been_taking_152mg_of_xanax_a_night_for_3_weeks_a/,Been taking 1.5-2mg of Xanax a night for 3 weeks a month. How fast should i taper?," I also was taking .5mg kpin in the morning but i already tapered down to .025 and im gonna jump off that tomorrow finally. How fast should i taper off the xanax to avoid seizures? Had a benzo habit , went to detox was clean for 6 months than started dabbling again and ended up taking them for 3 weeks-a month.

Can somebody give me a good taper routine for the 1.5 Xanax thats fast and safe ? and to avoid seizures. Appreciate all of you so much. Lmk!",5,0
120,2021-05-22 17:12:25,https://www.reddit.com/r/benzorecovery/comments/nis8oj/ok_unfortunate_but_im_nixing_the_taper_proposed/,"OK... unfortunate, but I'm nixing the taper proposed by my new psychiatrist. Help and advice needed please.","As usual, long story, but the taper proposed by my new psychiatrist, although slow, is going to be out.

After talking with someone in the benzo community who is very knowledgeable, it seems the updosing/downdosing nature of it is likely to just kindle me more, and I'm not super stable atm. 

I'm going to talk to him (new psychiatrist), but I'm worried he's not going to budge on how he wants this to go. So I'm back to planning my own taper in anticipation of being on my own again. No access to valium or a longer acting benzo. I'm taking alprazolam 0.5mg three times a day and 15mg temazepam at night. Planning to leave temazepam alone for now and work on the alprazolam first.

Preliminary plan is to cut alprazolam 10% every two weeks and take temazepam at night as per usual.

My *biggest fear of all fears* is a seizure. I've seen some reports of seizure coming off of very low doses, as well as the more common high dose/cold turkey situation.

My concern is the short half life of alprazolam. Is there any chance that as I start to cut, the length of time between my 3 doses (roughly 7 hours between each dose) could precipitate a seizure?",3,0
121,2021-05-22 16:26:45,https://www.reddit.com/r/benzorecovery/comments/niray0/seeking_advice_had_a_13_minute_grand_mal_seizure/,"Seeking Advice: Had a 13 minute grand mal seizure trying to jump off, now I’m unsure what to do?","Hey, thanks for taking the time to check my question out.

I recently have been motivated to stop a 5 year benzo binge. I was prescribed Xanax for PTSD and all the underlying disorders that come with it. GAD, MDD, SAD. The list goes on.

Anyways, my doctor kept on upping the Xanax and as you would expect... it eventually stopped working due to the tolerance I had built while I was taking the 8mg a day that was prescribed to me. 

Living in a benzo haze and with crippling anxiety, worse than I had when I was prescribed, I seeked out stronger stuff. Clonozalam, flualp, etizolam and random pressed bars. Things got really ugly. My highest dose was probably around 60-80mg a day of flualp.

This brings me to last month. I pretty much hit rock bottom and started to taper myself off as my doctor seemed content keeping me on pills till I die. I worked my way from about 50mg of etizolam to 2mg of my prescribed Xanax. From 2mg I went to about 1mg a day in a month. Then the worst came.

I was taking .5mg of Xanax a day and thought I was in the clear. Man was I wrong. On day 3 I had a 13 minute seizure. I smashed my head, bit off about an inch of my tongue and really hurt my back. I guess my lips turned a greyish blue and my wife thought I was going to die. She called 911 and I had the paramedics take me to the hospital.

I explained to the doctor who saw my the whole shpiel that has been my life with benzo usage and that I had tried jumping off. The doctor gave me Valium IV, about 2.5mg and a prescription for 7 days of valuim.

Here is my question cause the doctor didn’t seem sure. If I take the valuim as prescribed and stop benzo usage again; how likely will it be that I have another seizure? I’m really afraid of having one and it’s making things rather hellish as I’m always thinking of having to put my wife through another one or if I die in her arms.

Does anyone have advice on how best I can navigate things from here? The doctor as mentioned didn’t seem certain but just told me to come back if I have another seizure. Ugh. I can stop at anytime, I’ve been through hell and back reducing this far but I just don’t wanna seize up again.

Thanks for reading and any suggestions you might have for me.",3,0
122,2021-05-22 15:08:54,https://www.reddit.com/r/benzorecovery/comments/nippen/coming_clean/,Coming clean,"So I have been taking Xanax and RC benzos daily for about a year and a half now. At the height of my addiction I was blacking out on weekday nights. I have a doctor because I also had/have an opiate problem so he prescribes me suboxone. I haven’t told him about the benzo use but I plan to come clean in my next appointment on Monday. I am done with the benzos. 

My question is, what is the best benzo wd kit? I have a job so I have to be able to function. I have access to weed but what else? I’m sure my doctor will prescribe clonidine but is there anything else I should ask him for? in the case that he doesn’t already mention it? Should I try to push for gabapentin? Do you need an rx for gabapentin? I have seen plenty of doctors about my opiate problem but never about my benzo problem so idk what to expect. I know these withdrawals are gonna be hell regardless but I want to make it as bearable as possible. Thanks for any help!",2,0
123,2021-05-22 14:40:07,https://www.reddit.com/r/benzorecovery/comments/nip3ev/benzo_withdrawal_after_2xweek_use_and_delusions/,Benzo withdrawal after 2x/week use? And delusions?,"Can bentos cause withdrawals after using them 2x/week for say 6 months? I'm no stranger to bentos or their withdrawal, but for the past 6ish months I had been using them differently than normal. I was taking them 2x/week and it was clonazepam (my benzo was mainly Etizolam until I got ahold of clonazepam 6 months ago). 

Anyways, I have some really weird things going on and it's not like my other few withdrawals from Etizolam. I have strange delusional thoughts almost leading to psychosis. And throughout the day I am randomly hit with periods of intense terror, which is what leads to these thoughts. These periods can happen a couple times a day, especially when I'm trying to go to bed at night. 

Any thoughts?",2,0
124,2021-05-22 13:52:37,https://www.reddit.com/r/benzorecovery/comments/nio3cv/been_on_propanol_for_a_month_told_my_doctor_it/,"Been on propanol for a month, told my doctor it wasn’t working as well, so they prescribed the extended release","Phew. I legitimately haven’t been that tired and out of it for a long time. She did tell me it would get less intense, but I really think this drug was the key to me gettin clean.",11,0
125,2021-05-22 13:04:36,https://www.reddit.com/r/benzorecovery/comments/nin3bv/i_really_need_some_advice_to_quit/,i really need some advice to quit,"i've been taking xanax for about a year and two months but it's gotten out of hand and to date i'm on about 3 to 4 mg a day plus 40mg or 80 mg of gerodorm (it's one or two pills a day, for insomnia, it's a strong benzo mostly found in eastern europe). I tried to pause a day or two at a time but the withdrawals feel like hell. I started to believe that my body can't really function without the medication. My psychiatrist only prescribes me about 30 mg of alprazolam a month because i haven't told him the actual dose that i'm taking and i only went to him just to play my little charade to get some extra pills. But right now it's really gotten out of control. The extra pills that i'm buying off the streets cost me most of my money and it's really hard to find them because where i live there's very few people in town using or selling benzodiazepines and at the moment i've ran out of plugs. I really think about getting off them or at least i want to lower my daily dose without having withdrawals. I feel good taking them but i realize that this is just an artificial happiness that it gives my mind. And I really worry because if I run out of pills I might go cold turkey without my will and i would be stuck in a dark hole until i get my next fix. Addict life really sucks.
Any advice on what can I do? I'd really appreciate it.",4,0
126,2021-05-22 10:59:37,https://www.reddit.com/r/benzorecovery/comments/nikfvb/taking_niacin_to_flush_out_benzo_withdrawl_faster/,Taking niacin to flush out benzo withdrawl faster but also taking gabapentin will thus effect the gabapentin?,,3,0
127,2021-05-22 05:26:50,https://i.redd.it/rwy1ewzn4n071.jpg,"I feel like the best version of myself at the minute. Keeps getting better every single day, this walk through hell has been so worth it to me.",,11,0
128,2021-05-21 22:40:10,https://www.reddit.com/r/benzorecovery/comments/ni8xy9/kinda_sad_i_get_more_support_from_people_on_this/,Kinda sad I get more support from people on this sub then in real life :/,Idk why this is a lot of people in my life know about my problems...,10,0
129,2021-05-21 18:20:18,https://v.redd.it/piwhc8xwqj071,How I got off a 13 year high dose benzodiazepine dependence.,,123,0
130,2021-05-21 17:37:16,https://www.reddit.com/r/benzorecovery/comments/ni3jo9/how_has_the_gym_helped_you_guys_during_paws/,How has the gym helped you guys during paws ?,,4,0
