,Date,URL,Title,Body,Score,COVID-19 Mentions
0,2021-05-30 23:31:08,https://www.reddit.com/r/benzorecovery/comments/nos5m9/my_partner_relapsed/,My partner relapsed,He’s been clean for about a month and he relapsed this week. We got into a car accident a week ago and I think he used right after that and then this weekend he went on a binge. I’m heartbroken.,6,0
1,2021-05-30 22:54:50,https://www.reddit.com/r/benzorecovery/comments/nor5yl/long_night_and_back_on_xanax_again/,Long night and back on xanax again,"Nearly 4am now.. Wide awake and taken 5 - 1mg alprazolam (ksalol/bensedin) so far today. Disappointing considering a few weeks ago I was down to 5mg diazepam a day. Feel like a temazepam now the birds are singing but that’s just going to be worse tomorrow. Blue cookies instead. For now, that’s bank holiday gone👎Everyone have a good one though!",1,0
2,2021-05-30 21:25:45,https://www.reddit.com/r/benzorecovery/comments/nopai9/i_need_anything_right_now_situation_is_dire_pure/,"I need anything right now, situation is dire, pure hell.","I had been doing so well with my methadone taper, started at 100mgs, and have tapered to 26mg. Have been stuck at 26mgs since October, that's when benzos got out of control. I needed 3mg xanax just to stop major symptoms. Months later got a doctor who would help me and she gave me clonazepam. I abused it, and now my tolerance is fucked. Also, it didn't last me 24 hours. So now I'm in the process of transferring everything to Valium. This is what I take now, 2.5(3)mg klon, 2mg xan, 20(30)mg val. Parentheses are for what I actually take, I take an extra .5 clon and extra 10mg val from my prescriptions because my doctor won't let me be comfortable. Ya, it's all a lot of benzo, 13 pills and it's not enough. I've only managed to replace a single Xanax pill in like a month with 2 valium pills, is it supposed to take this long? and with twice the dose? I tried going down half a Xanax today, feel terrible. 

I don't stand a chance in hell getting off methadone this year, much less next even if my doc is going to give me an extra klon and an extra val. It's extremely important to me to get off of methadone because the side effects are ruining my life and they are untreatable. I don't know what to do. I take a ton of Gabapentin every night, without that I'd be in gabapentin wd, but that is sustainable and I'm not planning on ever really getting off of it. It like maybe helps with 10% of the wds, but it's great for methadone wds, Clonidine is fantastic for benzo wds, I'm using it for sleep though if I don't use that all at night, I won't be able to sleep. Maybe I could find a replacement, but I don't know, I hate all the side effects from all the other sleeping meds, save maybe Trazadone. 

I'm in dire straights, Opiate withdrawal AND benzo withdrawal every single morning I wake up, the two withdrawals are VERY similar, the starting symptoms are almost identical, and because of that they feedback on one another making them worse than the sum of their parts, thus my withdrawals are worse than they really should be. I have to take care of one before the other, but who would ever prescribe me like +15 pills worth of benzo... There are fucking methadone clinics that give you HUGE amounts of opiates, why the FUCK isn't there anything similar for benzos??????????? FUCK. I've never wanted to murder myself more, and trust me that's no idle threat.

Clonidine works so well, but it lowers the fuck out of my blood pressure and I'm always fainting. I'm at .7-.8mg with that. I don't think I'd be able to get propranalol becase of that low blood pressure. Someone please tell me there is another drug out there that will make my benzo wds not hell.",1,0
3,2021-05-30 18:40:46,https://www.reddit.com/r/benzorecovery/comments/nomhk5/having_a_really_hard_day/,Having a really hard day,"Just a rant:

I’m stuck in my cave suffering horrible anxiety. 

The house next door is having a party enjoying their lives. Music is blaring (sunday afternoon), bass is shaking my house. 

They have every right to party and have fun. but i’m so over sensitized. I asked if they would turn down their music a little.  They were nice about it (but didn’t turn it down). 

I came back to my house and sobbed. I hate being this way. My nervous system is sensitized to withdrawals than anyone i’ve ever heard of. I’m so anxious and every pump of the bass coming through the walls is like a punch in the stomach. 

This is 8 days straight of withdrawals just dropping from .25mg to .22mg ativan. I’m so hopeless that i’ll ever get better. 

Thanks for listening.",21,0
4,2021-05-30 18:39:11,https://www.reddit.com/r/benzorecovery/comments/nomghn/those_with_ovaries/,Those with ovaries...,Is it benzo WD or something like this bc my ovaries are in pain on my right side and nobody can find a thing wrong with  me. It comes and goes,3,0
5,2021-05-30 18:28:54,https://www.reddit.com/r/benzorecovery/comments/nom9gf/dependent_after_only_a_month/,Dependent after only a month?,"I guess my real question is how fast would I start withdrawals with temazepam. I’ve been taking it at night as prescribed for a month and four days ago I had the kind of panic attack that I should have gone to the hospital for (I have too many responsibilities and it was a very inopportune time and called the hotline instead). Since then I’ve been not able to eat, nauseous, headachey, constipated, and dizzy on and off. The worst of it is the anxiety and derealization though, I seriously feel sometimes as though this is all a dream and I’m going crazy. 

Despite all this, at night I take my temazepam and sleep like a rock. Usually anxiety has me up every few hours and I have trouble sleeping, but not since I started taking this. But every morning, all the anxiety and other symptoms come back. Would I start withdrawing that soon though?",2,0
6,2021-05-30 16:10:10,https://www.reddit.com/r/benzorecovery/comments/nojez4/yawning_a_lot_while_holding_valium/,Yawning a lot while holding Valium,"Should I be concerned? I stopped tapering for a while (holding for 3 months) and I am taking 2.5mg of Valium daily.

I yawn a lot even sleeping well by the night.

Oh, and I have also this burning brain symptom with my right temple feeling like it's overheating. Could be related I guess.",1,0
7,2021-05-30 15:23:07,https://www.reddit.com/r/benzorecovery/comments/noif1d/can_you_use_gabapentin_to_taper_off_of/,Can you use Gabapentin to taper off of benzodiazepines or their derivatives (such as Etizolam)?,"Currently trying to taper and detox after having used benzodiazepines and their derivatives for self medication for around a year and a half now, and found a script for 100mg Gabapentin. Would this be helpful or useful for dealing with WD’s from benzodiazepines or their derivatives? Currently I take Etizolam and have been trying my best to taper; although I’m currently going to run out soon.
I am aware of the bioavailability of Gabapentin and how it needs to be staggered in larger doses for full availability.",3,0
8,2021-05-30 14:19:38,https://www.reddit.com/r/benzorecovery/comments/noh2fc/i_realize_that_i_never_dreamed_during_my_usage/,I realize that I never dreamed during my usage years.,"Tapering line opened the door to me dreaming again. Not that it’s a good thing, my dreams are negative and downright scary now. But at least I’m dreaming again.",9,0
9,2021-05-30 14:02:48,https://www.reddit.com/r/benzorecovery/comments/nogp9p/just_gotta_vent_some/,Just gotta vent some,"The past 3 days I've only gotten around 3-4 hours of sleep. Fuck these waves and windows. I usually get a good 6-7 but then symptoms will unexplainably get worse for no reason out of nowhere and it's stupid. Anxiety has been so bad the past few days I cannot sleep at night. But it's more body anxiety than actual anxiety. Palpitations, strange thoughts, etc. Fuck these drugs",18,0
10,2021-05-30 09:08:43,https://www.reddit.com/r/benzorecovery/comments/noav7m/etizolam_taper_progress_down_from_5mg_to_15/,"Etizolam taper progress, down from 5mg to 1.5","Tapering began April 22. I was taking 5mg (sometimes more tbf), once nightly for quite some time. 

April 22 I began tapering. At first I tried skipping a night and felt horrible, shaky and disoriented. So I settled on a reduction to 4mg. I held steady at 4mg for only a couple days before dropping to 3mg. Within the first 9 days, I had reduced from 5mg to 3. I know, probably too fast but what's done is done. 

That was about 4 weeks ago and things have been slower from there. I made a reduction from 3mg to 2.5 and held that for a week. Then I dropped from 2.5 to 2 and held that for two weeks. About 1 week ago I dropped from 2 to 1.5 and I plan to stay here for at least another week. My cuts will get smaller as my overall dose does. I really base it on how I feel as the week ends. I don't make a jump unless I'm feeling pretty good. 

Etizolam has been.. interesting.. to taper with. Blister packs or not, you're never 100% sure about the chemical structure or strength. Over the years, I definitely felt different results from one brand to another. While on the 1.5mg dose (and stable) I decided to switch from 2mg pills, to using 1mg pills. (I have more of the 1mg tablets and would need to switch to them at some point, anyways, to complete tapering). They're different, y'all. I was stable and am now experiencing the withdrawal symptoms that I typically get a few days after a cut. Aching jaw, pounding chest in the morning, irritability. You know. Nothing unmanageable but I can't deny that there is something different from brand to brand. 

Anyways, just wanted to give an update. I'm still alive, haven't given up yet and I'm not going to! I know a lot of people are facing a similar situation right now since the etizolam import/ export ban but it IS possible to taper off this junk. I can feel my brain starting to fire up again, like a rusty old engine sometimes but I know I'll get it back. And so will you. We, collectively, have got this ;)",22,0
11,2021-05-30 08:43:43,https://www.reddit.com/r/benzorecovery/comments/noafn8/clonazepam_withdrawal_exhaustion/,Clonazepam Withdrawal Exhaustion,"I am a 51 year old male who was prescribed 1mg Clonazepam to help with sleep at night. I was not informed of the danger nor did I know the dos and donts of this medication. I took it nightly to help with sleep. Two weeks later, I began to feel waves of exhaustion during the work day. Doctor said that exhaustion should subside and to keep taking it. A month and a half later, after speaking with my cardiologist and the family doctor nurse, I stopped Clonazepam cold turkey three nights ago. Yesterday I had high BP, extreme exhaustion and felt flush in the face for an hour. I called the on call doctor who advised me to break my 1mg tablet in half and take that amount for a few days. After finding this thread, I think my exhaustion was caused by a combination of Clonazepam and daily intake of caffeine (coffee, preworkout, monster). Since I’ve only been on the med for a month and a half, am I safe to drop from 1mg to .5 for a few days/week before cutting back to .25? And how long before I can go back to my daily caffeine routine?",7,0
12,2021-05-30 01:33:49,https://www.reddit.com/r/benzorecovery/comments/no4cn2/am_i_addicted_to_xanax_after_1_week/,Am i addicted to xanax after 1 week ?,"Hello, 1 week ago i bought 105X1 mg galenika alprazolam pills, now after exactly 8 days i took the last 3 mg and i have been takling large doses everyday. What Can i experience now when the xanax leaves the body ?",4,0
13,2021-05-30 00:49:19,https://www.reddit.com/r/benzorecovery/comments/no3pud/clonazolam/,Clonazolam.,I’m looking to get into sober living. By next week. I’m 100% dedicated this time. I’ve been doing good. But I did use it today. I was wondering on if anyone had experience as to how long it would take to get out of my urine? Since it is a designer drug. I want to get in. But I haven’t been using everyday. But wondered if anyone had experience with something like this.,1,0
14,2021-05-29 23:25:36,https://www.reddit.com/r/benzorecovery/comments/no2h0e/supplements_to_help_benzo_withdrawal/,Supplements to help benzo withdrawal,"More so to help the cognitive impairment from benzo withdrawal. Like the brain fog, memory, mix matching words and sentences, tip of the tongue words etc.",2,0
15,2021-05-29 22:30:33,https://www.reddit.com/r/benzorecovery/comments/no1oaj/help/,??? help,i keep seeing people saying they taper of K by doing multiple steps buy adding and tapering off of valium. how do you go about this? do i tell my dr this is something i wanna do? or will he cut me cold turkey? i’m scared he’ll just not help out at all. any advice or success stories pls :(,3,0
16,2021-05-29 19:49:33,https://www.reddit.com/r/benzorecovery/comments/nnz5za/daily_reminder_this_is_temporary/,Daily Reminder: This is temporary,"When I'm feeling the negative effects of dropping my dose whether it be the dark thoughts, brain fog, ADD, body aches etc, Its easy to convince myself that I'll be stuck in this reality forever. Then after a few days or week or however long it takes, it lifts enough to remember that it does get better. I try and remind myself daily that THIS IS TEMPORARY. I will be free from this substance one day and I am healing. We are all healing slowly and we will recover.",55,0
17,2021-05-29 16:01:31,https://www.reddit.com/r/benzorecovery/comments/nnv5o3/when_did_you_know_im_tapering_today/,When did you know I'm tapering today.,"When did you know this is day I'm going to taper off (insert benzo here)? I say this because I'm somewhat stable on my combo of klonopin .5 a day,my AD 5mg a day, and CBT therapy once a week. I've taken Klonopin for 17 years (that was at .25) isn't that enough of a reason just to taper off and deal with the withdrawals and anxiety in therapy? Also my doctor won't prescribe it forever. I'm probably so far into dependency it's probably not really ""helping"" anymore.",4,0
18,2021-05-29 14:14:46,https://www.reddit.com/r/benzorecovery/comments/nnt47v/officially_3_days_clean_from_5_months_of_using/,Officially 3 days clean from 5 months of using xanax,Does anyone know how long the most lethal/ overall worst symptoms of xanax withdrawal last?,5,0
19,2021-05-29 13:37:12,https://www.reddit.com/r/benzorecovery/comments/nnscxl/any_rapid_taper_success_stories/,Any rapid taper success stories?,"I am looking for people who had to taper off benzos rapidly and succeeded. Not everyone has the luxury to go through a super slow taper. I would love to hear from people who made it anyway. 

Please leave a comment if you fit the description.",8,0
20,2021-05-29 13:18:48,https://www.reddit.com/r/benzorecovery/comments/nnrzp2/crude_explanation_but_it_will_help_you_understand/,"Crude explanation, but it will help you understand.","Glutamate and GABA are the brain’s major “workhorse” neurotransmitters.

Over half of all brain synapses release Glutamate, and 30-40% of all brain synapses release GABA.

GABA and Glutamate regulate action potential traffic.

GABA, an inhibitory neurotransmitter, stops action potentials.

Glutamate, an excitatory neurotransmitter, starts action potentials or keeps them going.

Since GABA is inhibitory and Glutamate is excitatory, both neurotransmitters work together to control many processes, including the brain and body's overall level of excitation.

Tranquilizers (Benzodiazepines), Alcohol and Z-drugs like Ambien increase GABA activity. (Calming the CNS)

Alcohol increases GABA activity. (short lived and does not bind as tight or as long as benzos)

Alcohol decreases Glutamate activity but it spikes back higher when the alcohol wears off (hangover, anxiety and tremors the next day).

Caffeine increases Glutamate activity. Caffeine inhibits GABA release. ---> (You feel anxious, wired, wide awake)

Benzodiazepines (as well as alcohol and Z-drugs) effect GABA by unnaturally boosting it's release and keeping it attached to the cell's GABA attachment sites (resulting in sedative, hypnotic, anxiolytic (anti-anxiety), anticonvulsant, and muscle relaxant properties. Conversely the body produces more Glutamate to compensate for the now elevated levels of GABA being utilized and being kept bound to the cells. The body demands to stay in balance in a homeostatic state.

However, Benzodiazepine use over time down-regulate your cell's GABA receptor attachment sites since the body doesn't need to work as hard to utilize it's own organically produced GABA. (The receptor sites become clogged, start to malfunction, or are reabsorbed by the body due to GABA/Benzo redundancy and over sedation)

When Benzodiazepine Tolerance hits (the medication starts to fail) your GABA utilization slows down and it’s like you’re slowly letting off the brakes on the now elevated Glutamate system. This causes Interdose Withdrawal symptoms, anxiety, panic, etc. (even though you are taking your medication as prescribed). Doctors will prescribe more of the Benzodiazepine to compensate for this event (Up- Dosing), or prescribe an SSRI Anti-Depressant or SNRI but your body will soon hit tolerance once more and the Interdose Withdrawal is back. This is an endless cycle which must be avoided.

If you Cold Turkey (abruptly quit taking) your Benzodiazepine, Glutamate levels spike (no brakes) and the excitatory neurotransmitters go nuts causing insomnia, anxiety, panic, muscle tightness, elevated heart rate, muscle twitches and many other horrible side effects. This could also lead to fatal seizures. Do. Not. Do. This!!

Your cell's GABA receptors, now damaged, malfunctioning or missing due to benzo use must ""Up-Regulate"" (heal or repopulate) back to their original, natural, non-medicated state before they can once again function properly balancing out GABA and Glutamate utilization in your body. Only time and patience can heal/regrow GABA receptors once the medication is completely out of your system. Your body replaces approx 40 billion cells a day, but the over all system the benzos damaged is approx 100 trillion cells.  This is why recovery takes time.

Slowly tapering off of your Benzodiazepine over a long period of time is the only safe, logical and bearable method to rid yourself of Benzodiazepines and restore your health/homeostasis.

For most of us it took years to get into this mess and it's going to take time, patience, self- loving, gentleness, understanding and determination to get out of it. Slow and steady wins the race. Try not to fear what side effects might occur as you taper off. Everybody is different therefore the experience of withdrawal, for you, will be different as well. Just take it a day at a time.

P.S. .5mgs of Klonopin, or .5mgs of Xanax, or 1mg of Ativan are not low doses.. they all equate to 10mgs of Va|ium.. If you have been taking any of these medications for more then 3 weeks you are already physically dependent and cannot just stop. The record for physical dependency is 9 days. Additionally, some people take years to reach tolerance, some over a decade, while others can hit tolerance in a matter of weeks or less. If you require more and more of the medication to experience a therapeutic effect, you are already in tolerance. Slowly tapering off is your only option. Look up Liquid Titration of Benzo, or Dry Cutting Benzo to start your education. Do not taper faster than 5 - 10% of the dose per month.

Lastly, what is tolerance?!  Simply put, in part, when you started benzos, (or alcohol, Z-drugs) all of the GABA attachments sites on all of your cells worked.  Constant use of Benzos, (just like constant use of alcohol) started to burn out/clog up the receptor sites on a majority of your cells.  The body, to combat the constant onslaught of a GABAergic substance, i.e. benzos, alcohol, z-drugs, etc., signaled itself to produce new replacement cells with these GABA receptor sites being less plentiful or shut off, as a means of protecting itself, mainly from respiratory arrest and to maintain a working Flight Or Flight System.  How fast a person's body starts to augment (absorb) the receptor site population, or to shut the receptor sites down, is genetic and why every single person hits tolerance at a different rate, some taking years.  As mentioned above the body replaces approx 40 billion cells a day.  The entire body contains approx 100 trillion cells.  When the population of cells with damaged, malfunctioning, or shut off GABA receptor cites reached about 1/4th your body started to experience interdose withdrawal.  When this population hits over 50% or so, tolerance is achieved.  The same thing happens with alcoholics.  We’ve all known those persons who can drink huge amounts of alcohol and still functions with little interruption.  That is tolerance to a GABAergic substance.  It’s not that the substance isn’t there. It is the person’s cells no longer have the ability to utilize that substance and so it’s like it doesn't exist. Make sense?  

Recovery is the body once again producing replacement cells with functioning GABA-A attachment sites and the body returning to normal operation, or homeostasis.  This can only happen once substance use is stopped and enough time passes for the body to replace enough of the damaged cells for the entire system to start working again.  This. Takes. Time. Do the math.  Approx 40 billion cells a day are replaced.  Population of cells impacted which needs to be repaired or adjusted approx 100 trillion.  This cannot be rushed.  There is no magic bullet, or trick, or life hack.  This has to happen organically.

I hope this helps.",66,0
21,2021-05-29 12:53:13,https://www.reddit.com/r/benzorecovery/comments/nnrhju/sickflu_ish_every_day_9_months_out/,sick/flu ish every day 9 months out,"Hi all,

Really curious to know if there are more people who are off the benzo’s for months already but do experience a sick feeling daily? I am. I have had 3/4 days without feeling sick in 9 months since I’ve quit. The bloodwork etc doesn’t show anything but I do feel sick every day. Generally unwell and sometimes shivering as well. 

I cannot find anything about this as a protracted symptom.",6,0
22,2021-05-29 12:18:20,https://www.reddit.com/r/benzorecovery/comments/nnqshs/is_this_burnout_or_something_else/,Is this burnout or something else?,"Hey all,

I am tapering Valium for some time and now I am holding at 2.5mg to stabilize.

The major thing is, I arrived at a point in my taper that I have little mental stamina, I am mentally fatigued.

Doing stuff with too much stimuli makes my right temple feels like it's burning... it's as if someone was putting acid inside my brain.

I can barely play chill videogames like Stardew Valley, I can't watch TV for too long. I am only productive for like 4 hours of my whole day, and the time I take Valium it kinda mitigates a bit this overheating feeling.

I ask this because Idk if I should treat like burnout and stop everything and maybe even quit my work (I work as an statistician... lots of programming and design of experiments). By the end of the day I feel slammed.

I even asked to work only part time but I wonder if this will be enough.

Is this burnout syndrome? Your views would be very welcomed.

EDIT:

Forgot about something curious:

After these ""overheating"" episodes, I yawn a lot!",2,0
23,2021-05-29 12:03:38,https://www.reddit.com/r/benzorecovery/comments/nnqhjy/slow_or_fast_taper_i_really_really_need_advice/,Slow or fast taper? I really really need advice,"I only started taking Xanax in November of last year. Started tapering down in February, and was at 2mg a day when I switched to Valium (30mg a day). I had planned to do a 10 percent drop every week, but my friend (and my own mind) have convinced me this is ridiculous. That I’m only going to be more damaged in the long run by prolonging my taper so much after what was originally just four months of use. 

Wouldn’t it be better if I just did a quick four or five week taper , cutting a quarter of a pill off a week? I’m just super scared that if I do the long taper, once I finally jump off it’ll be over a year of taking these things and I’ll be in more of a world of hell than if I just bit the bullet. Please help me decide …",1,0
24,2021-05-29 11:02:49,https://www.reddit.com/r/benzorecovery/comments/nnpa33/35_months_off_the_pills_today/,35 months off the pills today,"35 months off the pills today after a 44 month taper, 95%+ recovered..  You do get yourself back, keep going..  (Prescribed 1.5mgs of K for 20 years before tapering directly off the K using a compounding pharmacy.)",76,0
25,2021-05-29 09:33:52,https://www.reddit.com/r/benzorecovery/comments/nnnl4v/22_months_off/,22 Months off,"That's it! I waited way to long...I'm drinking beer. I have been healed now for 16 months. Waiting another 2 months to say I waited 2 years is asinine. 2 years of waiting to drink covers all cases including high dose cold Turkey,  kindling,  being on other medications and all other extreme cases. I think I'm good to go. One of the reasons I got off the shit was to be able to drink without worrying about benzodiazepines interactions with beer. I'm done, I'm free, thank this community.",6,0
