Date,URL,Title,Body,Score,COVID-19 Mentions,Sentiment
2020-04-06 12:52:34,https://www.reddit.com/r/benzorecovery/comments/fw28z7/120_days_out_from_cold_turkeyquestion_need/,"120 DAYS OUT FROM COLD TURKEY/QUESTION, NEED ENCOURAGEMENT","So I‘m 4 month out but, I still feel very crappy.
I basically experience no deep sleep and am looking (pale, bad skin) and feeling extremely fatigued, does this hell ever vanish? I just feel like I‘m out of ammo. This is so fucked up! (used for 3 years/ 30mg Diazepam/day)",14,{},"{'label': 'negative', 'score': 0.97498226}"
2020-04-06 12:27:47,https://www.reddit.com/r/benzorecovery/comments/fw1sar/did_i_screw_up_my_tapertolerance/,Did I screw up my taper/tolerance?,"I’ve been tapering my Ativan for monthssss. I was down to .125 mg and finally jumped off last week. I went 7 days without taking it. Well, I ended up drinking a lot of alcohol last week. I woke up throwing up this morning. I took .25 mg because I was having a panic attack. Any thoughts or opinions are appreciated. Thank you. :(",3,{},"{'label': 'negative', 'score': 0.48040047}"
2020-04-06 08:24:34,https://www.reddit.com/r/benzorecovery/comments/fvxt7s/not_an_addict_but_have_definitely_taken_enough/,Not an addict but have definitely taken enough over the years to the point where my baseline anxiety is noticeably increased. Heres the stack i will be doing in the future.,"So today i realised just how much my baseline anxiety increased ever since i started taking benzos (at one point i even had such a huge tolerance where i could take 150mg of diazepam and feel nothing, 100mg ambien and feel nothing,7.5mg xanax and get only moderately high. With that said ive never actually gotten addicted) So once my paycheck arrives (coronas kinda fucking this part up) i will be doing this stack:

1. 100mg fasoracetam daily all at once for up to 30days although it will probably end up being just a week or two cuz im not rich
2. 2g uridine a day for 1-2weeks
3. 2-2.5g Citicoline a day
4. megadose of fish oil daily (i found a cheap actual oil bottle of fish oil that has like 2g dha and 2g epa if not more of both per serving)
5. 5-20mg memantine a day
6. 50mg 1or 2x a day of nsi 189
7. 3g lions mane a day.

So what do you guys think of this stack. Im hoping to be maybe even eradicate my anxiety to an absolute minimum.

PS: Forgot to mention that along with all of the supps/noots i will also be doing multiple workouts per day and meditating for 30mins to 1h daily.",2,{'rona': 1},"{'label': 'neutral', 'score': 0.46391436}"
2020-04-06 05:02:52,https://www.reddit.com/r/benzorecovery/comments/fvveyn/want_to_start_tapering_need_help/,Want to start tapering need help,"Hello, I’ve been on Alprazolam since january 2019. I started with about 0.5mg/day and gradually increased to now about 4mg+/day. I never take whole bars at once, I take quarters throughout the day. I really hate the fact that Im this deep in, I just turned 18 and want to get my life on track. How should I go about tapering? How do I start? I am also prescribed Adderall for my ADHD, which has really helped. Can I taper while still taking my adderall? Please help me someone, thank you.",3,{},"{'label': 'negative', 'score': 0.44178954}"
2020-04-06 01:36:46,https://www.reddit.com/r/benzorecovery/comments/fvszq7/nicotine_for_benzo_withdrawals/,Nicotine for benzo withdrawals,"Hi guys,

I was wondering if anyone has tried using nicotine e.g. lozenge or transdermal (not smoking) to assist in their physical symptoms of benzo withdrawals?

I am aware of some drug-drug interactions between nicotine and benzos so would like some advice. 

Thanks",0,{},"{'label': 'neutral', 'score': 0.67648506}"
2020-04-05 19:45:30,https://www.reddit.com/r/benzorecovery/comments/fvo1qr/one_month_benzofree_todayfeel_worse_than_i_did/,One Month Benzo-free Today...Feel WORSE than I did two weeks ago,"Hi everyone, 

I haven’t posted in a while because I was actually doing fairly well - until about three days ago, or maybe two - who knows what day it is anymore? Before then, I had a few minor annoyances, like not being able to work out as hard as I used to when taking Klonopin which was frustrating because fitness really helps with my serotonin levels, and having hallucinations (which are actually more entertaining than anything), But during the past three days, I’ve woken up with chest pain which seems to last on and off throughout the day, heart palpitations (same), renewed night sweats, and a sense of paranoia that I’m going to die, among other things. I find it difficult to believe that this could possibly only be rebound panic - the original reason I was put on the drug - and not a heart problem. I would go to my doctor to get more thorough cardiac tests done - but that’s kinda difficult at the moment. Last EKG, approx 1 month ago, was negative for anything unusual. 

I was wondering if anyone else has had their recovery stumble or go in the opposite direction at around the one month mark? 

The only medication I have for panic at all right now is Propranolol and I’m only taking up to 20mgs/day. 

Any insight greatly appreciated! I’m pretty terrified. 😱😢



If it’s useful to know, I was taking the prescribed amount of Klonopin (2-3mgs) per day for about 7 years before rapidly tapering off using Valium (2 week taper).",13,{},"{'label': 'negative', 'score': 0.6574006}"
2020-04-05 13:45:22,https://www.reddit.com/r/benzorecovery/comments/fvhtw5/one_week_no_benzos/,"One week, no benzos.",Hopefully I’ve past the mark where I can’t die from withdrawal? That would take away a lot of anxiety for me,27,{},"{'label': 'positive', 'score': 0.49665955}"
2020-04-05 10:38:40,https://www.reddit.com/r/benzorecovery/comments/fvemc3/songs_about_benzo_addiction/,Songs about benzo addiction?,I’m a musician and I need a song to express myself. Does anyone know any songs about benzo addiction or just addiction in general?,7,{},"{'label': 'neutral', 'score': 0.80406505}"
2020-04-05 08:16:47,https://www.reddit.com/r/benzorecovery/comments/fvcwwy/posting_here/,Posting Here,"Cause it’s a fking start, trying to self taper for my mental health during this quarantine and it has been going fking awfully, can’t seem to stay more then 24 hrs without serious stomach problems, my brain spazzing on me and feeling so weak I have to ask my girl to crack a bottle.

I fucking hate benzos. Why did I even start? Fuck my life.",5,{'quarantine': 1},"{'label': 'negative', 'score': 0.9788125}"
2020-04-05 08:12:26,https://www.reddit.com/r/benzorecovery/comments/fvcv7g/struggling/,Struggling,"Hey guys, so I like I've posted before I'm now a little bit more than 3 months off benzos after quiting ct. 
My physical symptoms are now almost gone and I feel better in many ways, but I'm starting to struggle with anxiety and its hard for me to accomplish everyday things or focusing. 

I can't concentrate or pay attention to things like TV or videos on YouTube and it's really hard for me right now, especially due to the coronavirus quarantine, I'm almost the whole day alone at home dealing with anxiety and really absurd paranoid thoughts.

Sometimes my mind wanders and I doubt my choice to quit the benzos. I know how bad benzos are, but than I have thoughts that life is short and meaningless, so why should I deal with anxiety if there are benzos which can make my life more easier to deal with. 
I'm also kinda depressed right now, because I'm in an unstable environment and dont really have any hopes for my future. The urgue to take benzos, alcohol or other anxiety relieving drugs is incredibly huge, it's more psychological than physical. 
I remember how good it was not to have anxiety and how reliefing it was to take the drugs. 

I was always a lonely guy and my brain was my most precious thing, I loved to think about stuff, writing, reading and now I can't do things and am in this miserable anxious state and don't know how to deal with these huge emotions, fears and self doubt that emerged after quiting benzos. 
Unpleasant memories are also coming back. 

I want to change my life, I'm ready to undergo therapy, but it's extremly hard for me right now due to the huge quarantine in my country and everyday anxiety about job, my future and life. 

Prior to the quarantin I saw my psychiatrist and he suggested me to try Zoloft, I want to try it but I'm also kinda scared of the side effects. 

I'm trying to eat really healthy right now and also try to go for a walk in the evenings, but my anxiety is really huge right now and I don't have any healthy coping mechanisms. 
Sometimes I even think that I cant live and function without drugs.",10,"{'rona': 1, 'virus': 1, 'quarantine': 2}","{'label': 'negative', 'score': 0.71270514}"
2020-04-05 04:58:07,https://www.reddit.com/r/benzorecovery/comments/fvatww/falling_back_into_the_benzo_trap_after_a_year_how/,Falling back into the benzo trap after a year... how do i stop?,"Ive been clean off drugs for a year (March 2019), mainly due to suboxone. I know people will say ""youre not 100% clean"" but its helped me so much, to be functional, have a job and live a normal life.

Anyway, the combination of a new stressful job, switching antidepressants and severe panic attacks has made me use valium 20mg five times the past few weeks.

Im starting to feel those cravings again and I fucking hate it. Im out of my supply now, what should I do so I dont go seeking another prescription? I know the next week will be tough. The suboxone isnt helping the benzo cravings.",3,{},"{'label': 'negative', 'score': 0.7298899}"
2020-04-04 22:19:39,https://www.reddit.com/r/benzorecovery/comments/fv65ja/is_it_possible_for_benzo_withdrawal_to_only/,Is it possible for Benzo withdrawal to only include muscle cramps?,"I was on valium for a month and quit cold turkey and for a few weeks now I've only ever felt muscle cramps and MAYBE nerve pain in my left foot but tbh I can't tell the difference between nerve and muscle pain.

I feel like my symptoms are coming to end but I never felt any rebound anxiety or insomnia, is that weird? or possible?

I was never mentally dependant on benzos, I don't find them addictive so I guess my dependence was all physical?",2,{},"{'label': 'negative', 'score': 0.5249192}"
2020-04-04 21:51:04,https://www.reddit.com/r/benzorecovery/comments/fv5qwt/jumped_off_at_a_quarter_mg_no_withdrawals_is_that/,"Jumped off at a quarter MG, no withdrawals. Is that possible?","I've been taking Xanax daily at night for sleep purposes. I've ranged from 0.25 to 1mg every day for the last 7 months. The only reason why I thought it would be a good idea to stop is I noticed sexual side effects, so I figured it was the Xans. 


Anyways. Two Sundays ago I decided to have a little fun and did a few MG throughout the day. Then I dropped down to 0.25 for the remainder of the week and took my last pill one week ago. Over the last week I did not experience any side effects. I'm not an anxious person, so there was no rebound anxiety or anything like that...it was really just like it had never happened.


Before I quit I posted on here and I really thought I was in for it by the replies I received. But thankfully that was not the case. Maybe it was because I never took it during the day or to treat any other issue than sleep. I'm not sure. I'm still taking Tylenol PM for sleep but I plan to quit that next week once I'm sure the Xanax is completely out of my system.",5,{},"{'label': 'neutral', 'score': 0.5047806}"
2020-04-04 19:47:06,https://www.reddit.com/r/benzorecovery/comments/fv3x9j/anyone_giving_up_tapering_or_stopping_because_of/,Anyone giving up tapering or stopping because of COVID-19?,"I’m stuck at home, and about to apply for unemployment since I was self-employed and all three of my industries are shut down, adding to my financial anxieties. It ideally seems like an opportune time to taper, but the paranoia of getting it or anyone in my family or friends dying from it keeps me very tense and anxious. What gets me the most is I used to hit the gym 6 days a week and that was helping. Also the uncertainty and they keep extending the lockdown. First it was till March 31st, now it’s April 30, and I’ve seen some experts predict this will last through the summer in the US, and maybe even 18 months total. I’m gonna go insane... I wish I could use this time to be productive, but I haven’t been able to cut my nightly dose of 6mg of diclaz, and unfortunately I ordered a bottle of Clonazolam. After I ordered a bottle of Flualprazolam. I feel like a failure because I had given up SA benzos and was stabilizing my Diclaz dose. I’ve also been drinking more than usual. Anyone else in a similar situation?

Also just ordered another bottle of Diclaz, Flu, and cLam. Fuck...

&#x200B;

TL;DR? Self-employed person out of work and depression and anxiety prone. Started taking benzos to get off daily kratom in October. I was able to maintain a cycle of using benzos only 3-4 days a week and didn't seem to have much withdrawal. Sometime in December I got hooked because I was depressed and getting over a broken heart.. Then found Flu and loved it even more. I was about to taper. But now I feel powerless. And some days I'm even upping my Diclaz dose to 8mg.",5,"{'covid': 1, 'lockdown': 1}","{'label': 'negative', 'score': 0.72168815}"
2020-04-04 19:18:20,https://www.reddit.com/r/benzorecovery/comments/fv3hj6/could_somebody_simplify_the_ashton_manual_for/,Could somebody simplify the ashton manual for me/help me with my taper?,"I'm on an RC benzo called pyrazolam (It's similar to alprazolam and most selective for alpha 2 and alpha 3 subunits of the GABA-A receptor). 

I have it in a solution (2mg/ml). The ashton manual seems to mainly focuss on more common benzos, so I'm a bit confused as to how to taper.

2-3mg of pyrazolam should be roughly equal to about 0.5-1.0mg of clonazepam. If 20 drops are 1ml (2mg), then one drop should approximately be about 100 micrograms.

So I could taper in 100 microgram increments, but I don't know how to do it exactly. Can anyone help me create a taper plan? That would be greatly appreciated.",5,{},"{'label': 'neutral', 'score': 0.5196748}"
2020-04-04 18:28:31,https://www.reddit.com/r/benzorecovery/comments/fv2os5/help_me_please/,Help me please,So i m in day 7 of getting of xanax and i m currently experiencing so much anxiety and cant really sleep so i have some ambien left do you guys know it will interferences with my withdrawal?,2,{},"{'label': 'negative', 'score': 0.8448698}"
2020-04-04 17:19:26,https://www.reddit.com/r/benzorecovery/comments/fv1jyk/caffeine_and_nicotine/,Caffeine and nicotine,"Bizarre I’ve had periods where I can drink coffee and smoke just fine, then a wave will randomly hit and It’s just gasoline on a fire...This shit makes legit no sense. I think I just need to white knuckle it and switch to decaf and come off the smokes. Anyone else noticed any difference from this?",3,{},"{'label': 'negative', 'score': 0.7654879}"
2020-04-04 14:58:29,https://www.reddit.com/r/benzorecovery/comments/fuz6pl/klonopin_or_valium_which_is_the_better_benzo_for/,Klonopin or Valium which is the better benzo for tapering?,,2,{},"{'label': 'neutral', 'score': 0.8676976}"
2020-04-04 14:57:39,https://www.reddit.com/r/benzorecovery/comments/fuz67z/how_many_hours_a_day_do_you_get_muscle_cramps/,How many hours a day do you get muscle cramps?,,5,{},"{'label': 'neutral', 'score': 0.5662227}"
2020-04-04 11:33:05,https://www.reddit.com/r/benzorecovery/comments/fuvn3e/cant_remember_my_time_on_benzos/,can’t remember my time on benzos.,"anybody else dealing with this? i want to know a little bit more about it, what it is called, will it go away and all of that. so i was on valium for 4 years, and i can only remember a few key points, where i was living, a couple movies i watched, and some food that i would make but that’s it. this might be tmi but last month as i was “waking up” a lot more so to speak i freaked out because i couldn’t remember the last time i had my period. i’m sure i had one i just couldn’t remember. there’s a ton of little things like that. i can tell that my memory is definitely better since finishing my taper but i also wonder if it will ever be 100% recovered. if anybody else is dealing with this feel free to share your story below, i’d love to hear it. 

much love",6,{},"{'label': 'positive', 'score': 0.5537002}"
2020-04-04 11:04:13,https://www.reddit.com/r/benzorecovery/comments/fuv5y2/help_preparing_for_medical_detox_using_librium/,Help preparing for medical detox using Librium,"Hi everyone. I’ve been tapering down from Suboxone using Klonopin under the guidance of my doctor. I am finally going to be finishing my sub taper this month (holy shit). What has really kept my guilt and shame at bay has been the fact that he promised he would put me on a Librium detox to get off of the klonopin once my sub taper is finished. Today I’m at .75mg of subs. Huge victory for me.

So assuming he puts me on a Librium taper this next month (I’ve been taking ~2mg/day of kpin), what should I be expecting?

How does it feel? Is it relatively painless (I’m not a baby, but I’ve been tapering from subs for almost a year and I’m EXHAUSTED).

He was proposing starting at 25mg Librium 2x a day. Has anyone had experience with this detox? What does it feel like? Can I feel safe and secure knowing I have a way out? 

Also, since librium is a benzo, don’t u just end up cross addicted and still end up with benzo withdrawal in the end anyway?

Words of honesty and wisdom are much appreciated...",1,{},"{'label': 'positive', 'score': 0.42625797}"
2020-04-04 09:58:38,https://www.reddit.com/r/benzorecovery/comments/fuu587/the_sky_doesnt_look_flat_anymore/,The sky doesn’t look flat anymore.,I’m 3 weeks out of a 4 month taper. Woke up feeling different. Went on my morning walk and realized the sky looked normal. It doesn’t feel close and flat. I don’t feel dead and off. I think the derealization is finally waving goodbye to me! Had more energy as well. Made small talk with some neighbors and didn’t feel weird fear jolts in my body. Best I have felt in a while. Looking forward to more healing!,52,{},"{'label': 'positive', 'score': 0.9160741}"
2020-04-04 09:00:44,https://www.reddit.com/r/benzorecovery/comments/futbjj/day_6/,Day 6,This shit sucks. I feel like I’m a schizophrenic with the amount of activity in my brain. Quarantine isn’t helping either..,4,{'quarantine': 1},"{'label': 'negative', 'score': 0.97379726}"
2020-04-03 23:32:59,https://www.reddit.com/r/benzorecovery/comments/fummls/i_fucked_up_my_benzo_taper_can_i_get_some_advice/,I fucked up my benzo taper can I get some advice please?,"So basically I ended up relapsing on my xanax for 2 days in a row. I was at 1mg of xanax and .75 of klonopin a day, but I ended up taking 4 mg of xanax yesterday and 8 mg today. Am i gonna be in a predicament if i go back to 1 mg of klonopin in the day tomorrow and 1 mg of xanax at night? any advice would be very much appreciated.",3,{},"{'label': 'negative', 'score': 0.7475817}"
2020-04-03 19:16:59,https://www.reddit.com/r/benzorecovery/comments/fuis7q/this_is_where_im_at/,This is where I'm at,"I wanted to share my personal experience with benzodiazepines and get some advice. 

I was always a very anxious person - it always felt like my fight or flight response was activated for no reason. When I was young this led to irrational phobias, severe social anxiety and a hard time functioning. I found various ways of relief - acting out, being a comedian, being destructive, drinking, but the internal problem never went away. I ended up addicted to opioids for a few years, got clean at 22. A year later, I still had that nagging, horrible anxiety.

I got on klonopin. 1mg a day. Stayed on for 2 years. Had a brief relapse with the opioids, and quit the klonopin along with them. This time I made it 3 years stone cold sober, no benzos. Until I went through some problems in life, and I became a wreck, and got back on them. 1mg a day again (eventually pushed up to 1.5)

I was on it for another 3 years, and quit one year ago. I just didn't want to be dependent on something. However, the anxiety is back and worse than ever. After a year, it never got any better. I feel that so much of my brain is consumed by it that it is difficult to function. 

This week, I caved and called my doc. Im back on .5 a day. Immediate relief. I feel like a human.

Is it worth it? Are my receptors just fried? Will I need it for life?",1,{},"{'label': 'negative', 'score': 0.71635413}"
2020-04-03 16:07:29,https://www.reddit.com/r/benzorecovery/comments/fufgeg/er_prescribed_me_taper_does_this_sound_right/,ER prescribed me taper. Does this sound right?,"So, some background. 2.5 days ago I finished 
an alcohol detox inpatient program and I felt great until this morning. I was incorrectly prescribed 1 mg Lorazepam/Ativan every day a few years back, and have taken it every day since.

Ativan is part of what they used to help me get through alcohol withdrawals. I told the nurses about how I was on an incorrectly prescribed dosage, but I guess they were just focused on the alcohol detox. They increased how much I took and then decreased it until I was off, cold turkey.

Two days later, after not being able to sleep well, I am having terrible wave after wave of panic attacks where I feel like I could die, and I go to the ER, terrified I have to check back in to inpatient care. Instead, the doc says she can send me home with a taper prescription. It is as follows: 1 mg, twice a day as needed for a week. Then 1 mg once a day for a week. Then .5 mg for a week.

It seemed weird that she would want me to increase my dose before decreasing it, but she seemed pretty sure. Then I found this subreddit and I see people dividing 1 mg super tiny instead? With all of my anxiety, I am worried about what I was prescribed. I just don’t want to be in another bad situation after an entire month of medical problems. Thanks so much for your time if you read this. I’m really scared.",3,{},"{'label': 'negative', 'score': 0.806471}"
2020-04-03 15:15:37,https://www.reddit.com/r/benzorecovery/comments/fueisk/32519_was_the_last_time_i_consumed_any/,3/25/19 was the last time I consumed any benzodiazepines,"I was a cautious user for 20 years. I never tried to abuse them and could always take breaks. Anyways it started to get the best of me and finally figured it out after tracking my usage for 6+ months. I had withdrawals but it wasn’t as severe as some are going through. 

I have also been without any alcohol for about 16 months. 

Being this long do you think it would be ok to have the occasional drink?

Also anyone going through this stuff just hang in there. Over the last 8 months or so I have done some things I never would have thought possible without benzos.",7,{},"{'label': 'neutral', 'score': 0.50819016}"
