Date,URL,Title,Body,Score,COVID-19 Mentions,Sentiment
2020-09-07 22:20:53,https://www.reddit.com/r/benzorecovery/comments/iolaj5/do_taurine_or_theanine_help_magnesium_glycinate/,Do taurine or theanine help? Magnesium glycinate?,"Hi, I've been using Traxène (clorazepate) for +10 years and have already tapered down to 3x 5mg per day. My main problems during recovery are trembling, feeling unstable, sensory overload. Do any of those supplements help (or make it worse) or which other ones?

Has anybody tried taurine or theanine? What about magnesium glycinate? Which ones have (not) helped you during benzo recovery and how? Also, which dosages (and brand) of each did you use which also matters ofcourse?

Hope some people here can give some good advice concerning the above supplements and others. Thanks very much.",1,{},"{'label': 'neutral', 'score': 0.50371516}"
2020-09-07 21:47:38,https://www.reddit.com/r/benzorecovery/comments/ioksax/2nd_time_around/,2nd time around,I got 100% off of benzodiazepines about 3 years ago (taking up to 20 bars of Xanax a day then ctd) and maintained that for over a year no sides except 3-4 weeks of pure hell. About a year ago I had a massive panic attack that felt like a heart attack and went to the ER was given 2mg ativan and was good. Later I talked to psych and was prescribed kpins 1 mg up to x2 daily started to feel on edge more and more got massive insomnia and looked to research chems almost a year later I take .75 Conazolam at night to sleep and 1mg kpin every few days. Doses have stayed consistent but am afraid to stop CT bc I have a wife and full time job that I need to be stable for. I know that tapering is my best option and have tried it in the past but if my Conazolam dose drops below .5mg I sleep like 2hrs and am on edge all day. I am switching over to diclazepam slowly for taper but am still worried about everything. Anyone have experience with going through wtds the second time and have suggestions to help me through this.,1,{},"{'label': 'neutral', 'score': 0.4461923}"
2020-09-07 21:22:26,https://www.reddit.com/r/benzorecovery/comments/ioke1q/had_my_first_flight_during_benzo_withdrawl/,Had my first flight during benzo withdrawl,"What’s up guys? Just wanted to say I had my first flight during my benzo withdrawl.  I wasn’t anxious as some other people who were with me on the trip. I don’t know what it is. Am I cured. I was cool and I really thought I might be anxious on the flight, but I was relaxed as can be. 

I’m close to 2 months cold turkey from a very small dose I took for 6-8 weeks. 

Tomorrow I’m going to attempt to workout, I’ve been getting brain zap or brain fog when I over exert my self.  

I can say my nerves and muscles issues have improved and my eye lid twitching is minimizing. It was severe a few days ago. 


I was also out it 110 degree weather and I noticed that can have an effect on me, and I did much better than I once did when I was on Ativan. 



I guess I really am improving, and I wanted to let everyone know. But the brain fog is my most annoying symptom. I’d take anything over brain fog. I literally feel slow sometimes. I hope that improves soon. 

Just wanted to let you guys know it’s been slightly improve. But the brain issues scare me the most now. Tomorrow I will attempt to work out. Wish me luck.",4,{},"{'label': 'positive', 'score': 0.61308277}"
2020-09-07 19:55:39,https://www.reddit.com/r/benzorecovery/comments/ioj1ae/anyone_experiencing_hair_loss_during_withdrawals/,anyone experiencing hair loss during withdrawals?...,"I am on day 9 of being off of Klonopin. For context I was on it 8 years and I was taking 1mg. Since my last dose of .25mg over a week ago, I’ve been seeing a lot of hair lost in the shower, my head is always itchy etc. I’m taking a lot of hair each day. Is this a thing?",6,{},"{'label': 'negative', 'score': 0.68036044}"
2020-09-07 18:12:46,https://www.reddit.com/r/benzorecovery/comments/iohd2f/any_success_stories_or_warnings_about_using/,Any success stories or warnings about using Norflurazapam to get your life back?,"Hi everyone, I’ve posted in a couple subs about this but can’t seem to get much response. 

I underwent an extremely rapid Clonopin taper a few weeks ago and of course was left with the postacute hypervigilance, insomnia, and rebound anxiety.

I have slipped a couple times since. I then heard people singing praises about Norflurazapam because of its long half-life and it being volumetrically tapered. 

I took one single-dose of the Norf about a week ago and it honestly was the first time I felt normal in ages. I either haven’t really started coming down yet from it and am only experiencing some mild discomfort... I know the half-life is like 200 hours so I’m trying to wait and find out if I am going to experience a withdrawal from it....  if something has a really long half-life does that make it more likely to experience a withdrawal from a single use? Granted, I wasn’t off the klonopin for long beforehand.

I am wondering if there’s anyone here who has had success using the strategy to get back to baseline. I was wondering if my logic with sound by taking it in Post-acute in hopes of having a softer landing. For all I know, I undid all
My healing and I’m in for CT wd all
Over again.

If you did experience success, what was your taper schedule like? How often did you drop and what was your dosage like?

If you experienced failure, please share your warnings. I know it acts on gaba-b which can produce horrific terror withdrawals so I’m wary of that.

Any help you can offer would be very much appreciated.",1,{},"{'label': 'neutral', 'score': 0.46825942}"
2020-09-07 17:26:07,https://www.reddit.com/r/benzorecovery/comments/iogj8n/night_3_after_making_the_jump/,Night 3 after making the jump,3 nights ago Made the jump off a good years worth of daily 4mg etizolam habit.. tapered for 2.5 months last dose was .83mg.. I’ve been through this once before 5 years ago and it’s all rushing back to me the struggles to sleep the first week or so... what helps With sleep during the early wd? The brain fog is getting so real now hard to think straight through it 😣,3,{},"{'label': 'negative', 'score': 0.5069033}"
2020-09-07 14:16:44,https://www.reddit.com/r/benzorecovery/comments/iocsti/is_this_withdrawal_or_am_i_crazy/,Is this withdrawal or am I crazy?!,"Is this withdrawal or am I crazy?!

Is this withdrawal or am I just feeling sorry for myself??

I’ve been on 1 mg of Klonopin for the last 8 years and I have been completely off of it for one week now. For context, I tapered over the span of about a month and a half. My last dose was .25 mg. I’m feeling absolutely miserable and extremely depressed. I’ve had 2 panic big panic attacks since (I have panic disorder) and my anxiety is excruciating. I have also been having some feelings of detachment which I think is derealization. Like I’m in a foggy state and everything feels not quite real. I can’t sleep, I can’t have a conversation without crying, I can’t laugh or smile hardly. Is there an end in sight? Is this actually withdrawal or is there something else going on?",26,{},"{'label': 'negative', 'score': 0.9329085}"
2020-09-07 03:11:58,https://www.reddit.com/r/benzorecovery/comments/io2xjt/should_i_be_concerned/,Should I be concerned?,I have only seen this psychiatrist twice and since the second appointment when I tell him that any thing makes me moody or anxious he says “take the klonopin”. I tell him I’m depressed because I’m on medication for someone with bipolar disorder when I’m just depressed “take the klonopin”. I feel anxious “take the klonopin” I can’t sleep at night “take the klonopin”,1,{},"{'label': 'negative', 'score': 0.80278224}"
2020-09-07 03:11:29,https://www.reddit.com/r/benzorecovery/comments/io2xcl/withdrawals/,Withdrawals,"I was addicted to benzodiazepines from the age of 16-24 well leading up to my 24th birthday I decided I didn’t want to be addicted anymore and leaned off of them slowly. I was also an alcoholic. I mixed both of them really rough from 19-24. My question is were my withdrawals more deadly because I was also withdrawing from alcohol? 
I lost control of my muscles, I couldn’t walk (I would stand up and immediately fall) use a phone, open a door, or a water bottle or barely hold a spoon. I couldn’t shower myself without falling down, I had vivid hallucinations, my mind would hallucinate for so long... I wanted to blow my brains out. To add things worse, I couldn’t control my pee or poop either. I eventually went to the hospital right when I hallucinated I was drowning and my mother called 911, I couldn’t get up and physically walk. I thought it was because of my mental health and the doctors did too until I told the doctors I was withdrawing from alcohol and Xanax.
Has anyone else experienced these symptoms?",2,{},"{'label': 'negative', 'score': 0.90074706}"
2020-09-06 23:33:50,https://www.reddit.com/r/benzorecovery/comments/io0435/40_days_off_a_year_of_daily_use_1mg_klonapin/,40 days off a year of daily use 1mg klonapin,"For me day 40 feels pretty similar to day 20ish, I’m definitely in a wave right now so take what I’m saying with a grain of salt, legit tomorrow i could have an awesome day just wanted to check in lol",4,{},"{'label': 'positive', 'score': 0.91212714}"
2020-09-06 22:44:46,https://www.reddit.com/r/benzorecovery/comments/inzd9n/weening_off_to_a_really_hard/,Weening off to a really hard,"It’s agonizing. I feel the constant need to vent about it yet also know I’m burdening others with my problems. I just feel so irritated, on edge, and like something is trying to rip it’s way out of my soul. It’s affecting work too. That’s the worst part I’m my opinion. My boss thought very highly of me until I started tapering. How are you supposed to function in the normal world without some kind of big break. Just venting",1,{},"{'label': 'negative', 'score': 0.8914545}"
2020-09-06 21:34:50,https://www.reddit.com/r/benzorecovery/comments/inydq5/tapering/,Tapering,Anyone ever taper faster than 10% bi weekly with success?,1,{},"{'label': 'neutral', 'score': 0.8864385}"
2020-09-06 20:24:33,https://www.reddit.com/r/benzorecovery/comments/inxcmg/tell_me_about_my_moms_benzo_usage/,Tell me about my Mom's Benzo usage,"I am the current power of attorney for my mom who has what I consider a Benzo addiction.  She started using Clonazapam about 4 years ago while having a career, and her usage has increased ever since.  She is currently taking 8 mg of Alprazolam XR per day with Clonazapam on top of it as needed.  Due to her doctors deeming it necessary (and a sketchy diagnosis of fibromyalgia), she also takes 5 hydocodone/acetomenaphine daily, 3 methocarbomol muscle relaxer daily, one fluvoxamine daily, one desvenlafaxine daily, in addition to several other drugs that treat stomach problems, reflux, etc.  She has become unable to be employed, she has developed agoraphobia, she loses 2-3 days at a time.  She is unsteady on her feet, and cannot perform complex tasks of daily living such as cooking for herself, I have to provide her with easy meals that she can simply microwave.  Her appetite is lessening as time goes on.  I do not think this regiment can be sustained.  She refuses to even consider reducing xanax usage due to her severe anxiety.  SO my question is this:  What can I expect in the future?  How long is this sustainable?  Any information would be appreciated.  Thank you.",9,{},"{'label': 'negative', 'score': 0.7559191}"
2020-09-06 20:12:59,https://www.reddit.com/r/benzorecovery/comments/inx66k/the_depression_and_strange_thoughts_i_just_want/,"The depression and strange thoughts I just want this to end. Will it get better? I know it will, I think it will. I just want it to get better. (Vent/Support post)"," I just can’t wait for the depression and strange thoughts to end haha.. that’s the worst part of it right now. I lowered again 3 days ago I’m only on .5mg Xanax and 20 mg valium a day. If you go through my back posts you can see my journey of what I started on and where I am now. I just sometimes fear what if it’s like this, is this who I am? Tired, lacking motivation, crying out of nowhere because of a memory or song or overly taking people’s actions personally every second, even just a certain look..?!! always on guard and mistrusting of everyone, can’t handle emotional situations and everything makes me feel depressed or angry? I just want this part to end. I’m used to the physical pain at this point. It’s been 3 constant months of tapering. I just want someone to tell me it’ll get better. Or tell me the truth if it doesn’t. But I feel it will. 

  If you wanna know what I was on just go to my page and read the titles it explains my journey. I can’t wait for my cognitive abilities to come back too. And the mini seizures to go away. I am tired.. I will mention I’ve been a daily benzo user for close to 9 months now. I was on up to 12mg flualp a day just 5ish months ago, then got to 8mg and now I’m finally at script .5mg and 20mg valium a day. Next step is letting go of the .5mg Xanax and tapering off just valium from there. Yes I’m working with a great psych doctor. 

  It is what is is I guess right now haha.. I feel like everyone hates me. Even though I know that’s not true and the people around me love me. Everything around me overwhelms me and I feel so self absorbed in my own self. Constantly breaking down. I’m tired of being helped too I feel guilty. Everyone having to remind me to eat and cooking my meals and driving me places when I’m not having a ‘good day’ in the taper. They’re all bad days with a few good moments but constant physical pain and tension. Used to the pain and tension. The emotional kills me though.

  Everyone says I’m not a burden. I can’t wait for this to be over. I’ve lost 8-10lbs since I started tapering 3 months ago thankfully I’ve gained half of it back. I was only 102lbs to begin with. I’ve almost died during this process. Sometimes I feel barely alive I’m surprised my body can handle this. Sometimes it feels it’s just gonna give out.

  I’m an artist full time and I can’t even paint and cognitively I’m not as good now because of how my brain is all mushy and forgetting stuff. I wanna paint and go outside and do stuff it’s so hard to get up I feel I’m gonna faint.

  I just want it to end. I have a bit of a ways to go though. Benzos are the devil I want my life back :( or what I hope is a life after this I don’t even know. I’m so sad I did this. But I had a nervous breakdown after I left my abusive ex who also put my dog down and moved in a new girlfriend and all her animals within 3 weeks of meeting her. And they both harrasaed me and threw out all my stuff. I could barely function after all the physical and emotional abuse. And that’s how benzos started for me. Anyways that’s my vent. Looking for support, or ask questions if you want. I’m sitting here trying to make sense of my mind but honestly that makes it worse. Just gotta let the madness go mad inside and just let it be, stop trying to control it, cuz that makes it worse. Just let myself feel like absolute shit. 

  I feel so much internal pressure to be able to be working and capable human again and live life. That pressure hurts a lot.",4,{},"{'label': 'negative', 'score': 0.703494}"
2020-09-06 18:04:41,https://www.reddit.com/r/benzorecovery/comments/inv04i/taking_clonazepam_between_1mg_and_4mg_a_day_for/,Taking clonazepam between 1mg and 4mg a day for two months. Advice for tapering,As my title says I've been taking between 1-4mg a day for like two months straight. I already feel the withdrawal when I don't take at least half a MG. Should I just keep stabilizing on a lower dose and keep going? Should I go to a doctor and get on Valium? Or is it possible to decently taper with klonipin? Just looking for some support and some info.,1,{},"{'label': 'neutral', 'score': 0.66987485}"
2020-09-06 17:58:52,https://www.reddit.com/r/benzorecovery/comments/inuwnt/what_saved_me/,What saved me,"Here’s what helped me push through benzo WD- 
Complete abstinence (don’t cold turkey if it’s not sensible for you situation, but when you get to the point of quitting, don’t come back, if you slip up have no judgement, continue back to your abstinence 
A strong desire to stop (you should create this) 
Walking bare foot 
Cardio 
Meditation
Wim hof
Yoga 

If you only",2,{},"{'label': 'positive', 'score': 0.5218676}"
2020-09-06 17:51:16,https://www.reddit.com/r/benzorecovery/comments/inus9j/how_does_the_withdrawal_timeline_work/,How does the withdrawal timeline work?,"I'm on prescription clonz for PTSD and saw an withdrawal infograph that I had trouble making sense of. It said that initial symptoms started during the 1st day and peaked at week 2 before subsiding. My doc never told me about this, of course... 

I have chronic pain and the clonz help me space out my pain med doses a bit. Was wondering if I took between 12-18mg of clonz a day for 3 days each, would taking a 7 day break give me enough time to get it out of my system, or will I have to wait 2-3 weeks according to the graphic? I'm not sure if the withdrawals are reflective of the stuff still being in your system and whether taking anything during those 2-3 weeks will put me back on day 1 of the withdrawals. I haven't found any info on this and the benzo subreddit was of no help and some of those people kept assuming things about me that weren't true for some strange reason... Could really use some advice. I've done this successfully for some weeks, but took a 3 week long break just in case after doing this 3 times and waiting a week before doing the 3 days again. 

It seems to work for me and I've never been an addict, but I'm just looking for some more advice that's helpful and not random assumptions. I'm desperate to lower my tolerance to my pain meds and the clonz seem to be the only thing that help me a little. How long of a break would I need, ideally, to remove or minimize withdrawals while still getting the benefit I desperately need. I'm so exhausted with my horrible back pain and I don't know what to do. I've dried physical therapy and all that, but I know I should still keep trying regardless of whether I'm getting any results for now",1,{},"{'label': 'negative', 'score': 0.56855327}"
2020-09-06 14:54:19,https://www.reddit.com/r/benzorecovery/comments/inrn98/when_to_see_a_doctor_or_go_to_hospital/,When to see a doctor or go to hospital?,"Been tapering off Valium and tramadol for 3 years of course with the occasional relapse.

Covid and staying home is making me take this serious once and for all to stop all of it for good.

Been tapering Valium from 100 plus mg down to 5mg to 10mg and tramadol 1500mg down to zero but substitute kratom. Can't manage without the kratom tbh. 

So I'm waking up every day in pain and naseua for over 2 years. Stomach or headache or neck stiff. Can't function unless I take kratom. 1 teaspoon gets me somewhat functional.

So when do I know it's just withdrawal symptoms perpetuating over and over that are keeping me in bed and not a serious other medical problem. Am I just being a hypochondriac and just push through? Like do I have cancer or something? Wtf? 

3 years of not being able to function. I'm at my ropes end here. Any opinions appreciated.",5,{'covid': 1},"{'label': 'negative', 'score': 0.7345902}"
2020-09-06 08:12:39,https://www.reddit.com/r/benzorecovery/comments/inl051/34_years_benzo_free/,3.4 years benzo free,"I’m new to this site. But this site topic appeared in my junk email this morning. I’m nearly 66 years old and was on klonopin for 20 yrs. when I weaned myself off, an 8 month process, I never went back. I suffered through most of what Dr. Ashton, https://www.benzofree.org/info/ashton/, wrote about, as far as possible side effects go. But I stayed with it because I’m older and had discovered the studies that linked benzo use to dementia. I’m not here to argue if those studies hold water or not. I’m old and the thought of dementia or Alzheimer’s scares me. I’ve seen it in my volunteer work and friends. Its not a journey I want to take as I continue to age. The w/d suffering was intense, like experiencing a fatal disease intense. I prayed for death at times. I did the struggle alone and with prayer. No one, but other sufferers, can ever comprehend what happens as our brains heal from the benzo use.  It had affected the connection between brain and nervous system dramatically for me, affecting my whole body. All but one issue has fully recovered. I’m grateful I’m stubborn and didn’t  want something I put in my mouth controlling me anymore.  It became the finest struggle I’ve ever embarked on. I rediscovered me. The me I was prior to the benzo. My mind is alive. My creativity is back. My thirst for life is back. I could go on and on, but I’m more alive now and I couldn’t be more grateful. I’d walk that ferocious hell again because I know the reward is worth it. My diet is all natural. I discovered herbs, yoga, breathing. So many gifts have become a part of my daily life, too many to count. I just want someone, anyone to know what a wonderful thing it is to finally have back control of my brain. To no longer be dulled out, dumbed down by some horrible chemical. The freedom is tremendous. I hope everyone engaged in this struggle gets to have this.",137,{},"{'label': 'positive', 'score': 0.43479812}"
2020-09-06 06:08:54,https://www.reddit.com/r/benzorecovery/comments/injm2b/im_28_days_clean_from_xanax_i_was_taking_8mg_a/,"I'm 28 days clean from Xanax. I was taking 8mg a day and the universe caused me to stop Cold Turkey. This week I've been craving really hard, as I can't control the anxiety that lead me to use in the first place. I really want to take a quarter, but nervous I'll ruin everything I've done.","I really just want to calm down my mind from overthinking, and have a good sleep, I'm emotionally blunt and can't enjoy anything. I want to see the doctor and see if he can prescribe me something that's not a narcotic. But will a quarter, 0.25mg be really that bad for me right now? Everyday is a new day, It will make tomorrow so much better, and functional. I feel like I shouldn't take it. But I'm not happy, I just want to feel happy for just a few hours. :(",1,{},"{'label': 'negative', 'score': 0.4726756}"
2020-09-06 00:03:40,https://www.reddit.com/r/benzorecovery/comments/infg3f/ms_or_withdrawal/,MS or withdrawal?,Has anyone ever convinced themselves they had MS during withdrawal or tolerance withdrawal? I’ve had chronic pain since I was 7 but when the mental health symptoms get bad the pain is on another level. Also one of my legs has been slightly numb for about 13 months (been tapering for 3years). It’s becoming unbearable.,3,{},"{'label': 'negative', 'score': 0.9417015}"
2020-09-05 21:43:33,https://www.reddit.com/r/benzorecovery/comments/indhqx/update_now_45_days_xanaxfree/,Update! Now 45 days xanax-free!,"This sub has been my honest to god go-to since the very day I quit Xanax CT (unfortunately not by choice; it was a tolerance thing.) I am very happy to say that I have gained a good bit of weight back, have been back to tidying up the house and sleeping normally, and the only WD symptoms left are the anxiety (which has been present my entire life), occasional migraines, and the breathing problems— all of which have become a sort of new normal for me. I feel so much better, so much more optimistic, and i am SUPER open with my experiences so I’m more than willing to explain what these 45 days have been like.

First and foremost, I went into it as the 20 year old, naïve female I still am, at a hearty 5’6” and 130 pounds. For around eight months I was taking AT LEAST 6mg pressies a day. I went through eight solid days of delirium and hallucinations (in which I had been r*ped, shot multiple times, trafficked, burned alive, and abandoned (all of which felt extremely real to me at the time)); inability to eat, swallow, sleep, communicate properly and decipher reality from my hallucinations. When I finally pulled myself out of that state, I was a sunken, hollow shell of who I was. I was 118 pounds, visibly sick, and only able to force small bites down my throat at a time. Now, after tuckering through a grueling month, I’m currently 135 pounds and I eat so much food during the day that it’s astounding. I’m not the same person at all— I am better than I have ever been and I am now aware that it only goes up from here!

To anyone out there who feels like it will never end, I promise you that it does, and you WILL recover. You’ll find yourself starting to appreciate the amazing gift that is life and the world so much when you beat this thing. You are never alone, you are never far from recovery— simply beginning a new journey that will absolutely pay off in the long run. Feel free to use this thread or even message me if you ever need anyone to talk to vent to or ask advice from! You are so much stronger than you realize ❤️",45,{},"{'label': 'positive', 'score': 0.8696352}"
