,Date,URL,Title,Body,Score,COVID-19 Mentions
213,2021-05-15 20:54:37,https://www.reddit.com/r/benzorecovery/comments/ndcvmm/memory_issues/,Memory Issues,"Just as a reference the my medication history started with I believe 2mg Ativan for a month switched to 2mg Xanax for 3 months Klonopin 4mg for 5 years the tapered with Valium for the final 6 months. since I made the jump about 14 months ago my short term memory feels like it has been seriously affected. Is this possibly an effect from long term use of my medication. I have heard it can and was curious if anyone here has had similar issues. I do not know how much OTC supplements can help but if anyone has had success with it making even a slight improvement thoughts and recommendations would be appreciated thanks..

&#x200B;

Edit: I should add before starting benzos i took SSRI's  for 10 years prior, Latuda 60mg during for 6 years Seroquel and Adderall 30mg 2xdaily after for about 6 months I now only take the Adderall 30mg 2xdaily did not know if these medications or the combos could have made a difference in my memory issues. ",3,0
214,2021-05-15 18:44:20,https://www.reddit.com/r/benzorecovery/comments/ndagp5/etizolam_cold_turkey_after_1_12_months_of_usage/,Etizolam cold turkey after 1 1/2 months of usage,"Hey everybody. I got careless about doing etizolam and have been using it for 1 and a half month. Was using about 1-2mg a day for the first 2-3 weeks I believe until I went down to 0.5mg without any issue. So my dose is stable at that, 0.5mg.

From what I hear, it shouldn't be too rough to jump off at that dose? Important to note, I've recently had the same issue from October to March. Used etizolam, klonopin and finally valium daily during that time period. Got down to 5mg valium before I jumped off and had no withdrawals, not that I noticed anyway.",1,0
215,2021-05-15 18:13:57,https://www.reddit.com/r/benzorecovery/comments/nd9usc/a_positive_update_for_those_that_are_struggling/,A positive update for those that are struggling.,"hello all.

it has been almost 2 years since i posted here regarding my wife and her struggle to kick a 12mg per day ativan habit along with a morphine addiction.

the update is as follows: she is doing AMAZING.

she has completely and fully kicked the addiction, and now 2 years later i can clearly see no noticeable residual effects from her struggle.

it has not been easy, but with a combination of in patient detox, gabapentin, exercise and a healthy diet, the future looks brighter than ever.

if anyone has specific questions about how it got to this point, i would be happy to provide what insight i have gained over the last 2 years.

thanks again to all here for the support through tough times, and may all of you that are struggling know  that time and patience heals all.",60,0
216,2021-05-15 17:23:53,https://www.reddit.com/r/benzorecovery/comments/nd8uyz/ativan_taper/,Ativan taper,If you tapered off Ativan how long was your taper?,1,0
217,2021-05-15 17:14:58,https://www.reddit.com/r/benzorecovery/comments/nd8o9w/thinking_of_taking_mdma_to_help_with_damage/,Thinking of taking MDMA to help with damage caused by my detox at rehab,"I’ve posted my story here previously but will quickly recap. I went to rehab (foolish I know) for my 20 year use of klonopin. I went in on a prescribed dose of 3mg a day. After 23 days, 3 trips to the ER, seizures, delirium, hallucinations and a host of other trauma I left. I reinstated back into 2 mg a day. I am still experiencing terrible withdrawals and/or kindling. It’s so bad, I think of suicide daily just to stop the pain. 
I am thinking of trying mdma to try to help repair some of the despair I feel daily. I know, it’s another drug but I’m at my wits end. I’ve done micro-dosing previously for my ptsd and depression and it has helped. 
Has anyone else tried this? What was your experience.",2,0
218,2021-05-15 12:53:46,https://www.reddit.com/r/benzorecovery/comments/nd38ak/saw_new_psychiatrist_who_proposed_a_very_slow_but/,"Saw new psychiatrist, who proposed a very slow but novel/unconventional taper plan. Going to try it but scared AF.","Long story short, tried tapering myself recently and couldn't do it, not just because of withdrawal effects, but other health issues I'm also trying to manage. I'm currently prescribed 1.5mg alprazolam (three .5 doses/day) and 15mg temazepam for sleep.

Saw a new psychiatrist yesterday and told him I wanted off these godforsaken benzos. For now, he wants me to leave the temazepam alone and just tackle the alprazolam.

He's proposed a taper that will take roughly 3 years just to get rid of the xanax, and (hopefully) keep me functional. No crossover to a longer acting benzo, just staying on the xanax for the whole taper. 

It's complicated, tbh, but I'm going to be basically taking my regular dosing schedule and then at increasingly shorter intervals I'll be cutting .25 from one dose on ONLY that one particular day. Each step is held for roughly 3 weeks. So at that rate, I'll be down .25 approximately every 6 months. He had a good rationale for doing it this way although I've never heard of a taper like this, and he is open to the potential of prescribing some support meds if needed.

Today is day 1 of making a .25 cut to my afternoon dose and as noted, I'm scared AF. Please wish me luck.",12,0
219,2021-05-15 12:39:59,https://www.reddit.com/r/benzorecovery/comments/nd2xnd/my_doctor_tried_to_kill_me/,My doctor tried to kill me.,"A bit of a rant, but I'm still pissed.

Been off benzos for over a year now since my psychiatrist cut me off my 8 year Xanax perscription (Which I was taking as perscribed and not abusing, I actually asked for a lower dose at one point).

She did this because I was lying to her for 3 months by smoking weed and hiding that from her. When I admitted it, she just cut me off Xanax with no taper. No help. Nothing. After 8 years of taking a perscribed dose of Xanax, not abusing it. She just said I was an addict and cut me off.

So in complete panic of not wanting to have horrible withdrawal and possibly die from seizures, since I did not have enough left to taper properly, I ordered Etizolam online since it was legal to do. I only planned to take it like I was taking my perscription (which, again, I was not abusing at all, I only abused weed) and eventually taper with it. But when I took that first Etizolam pill, it set me off into a manic state. It was so strong for some reason unlike the Xanax, it felt like I was on some stimulant. I couldnt resist taking more, I was taking them like candy, around 10mg per day (when I was only taking 1-2mg of Xanax per day).

I'm just so frustrated at the state of psychiatry. What happened to ""Do no harm?"" How can a doctor that was perscribing me Xanax for 8 years, I never asked for more, I asked to lower the dose in the past, think cutting me off a medication I was dependent on which has potentially fatal withdrawal, is in any way ethical? Just because I was smoking weed for 3 months and didn't tell her?

I did some crazy shit on the Etizolam and ruined my life. I wasn't myself at all. I ended up in the ER trying to get help to taper off it, and finally got a doc to perscribe Xanax again for me to taper. I wish I never took Etizolam but it seemed to make sense at the time when the doctor left me in a position that I could literally have died from Xanax withdrawal.

Sorry this is so rambling, just so angry.",45,0
220,2021-05-15 12:07:01,https://www.reddit.com/r/benzorecovery/comments/nd282p/where_im_atinput_appreciated/,Where I’m at-input appreciated,"I was going to post this on the NA sub but there are 3 X the people here so this will do just fine.

I have posted before and as I look back it’s pretty clear I have a problem. Long story short I’ve had access to clonazapam for about 3 years. I get a moderate 14 mgs prescribed each month. At first I could take one or two mgs on a prn basis and the 14 mg would last most of a month. In the last year it’s turned into a fucked up situation where I get the pills, take a few mg and lose all control, eating most or all of the 14 mg in a night. The last time I just remember sitting there groggy and thinking “why the eff am I doing this.” 

This was 3 weeks ago and for a couple days I would say I was edgy but have felt 100 percent for about 2.5 weeks since. My life is good, job, house, wife, kid, so I have nothing I need to escape from.

I have an appointment in the next couple weeks and I know my psych will issue me the benzos again without a thought. Part of me knows I should be done with them and part says “well what if you need them”. I realize this is fucked and am writing out this short story as a reminder to myself of this fact.

Also I am a recovering alcoholic of 6 years, however I notice after a benzo binge for a couple days I start thinking about alcohol again, so I’m guessing benzos and booze are somehow related.

Anyway feedback appreciated even just letting me know what I need to hear. With Covid dying down in my state there is every reason to be happy but my mind/conscience is wrestling with this predicament I find myself in.

Love y’all 

—T",0,1
221,2021-05-15 11:58:42,https://www.reddit.com/r/benzorecovery/comments/nd21fy/frustrated/,Frustrated,"Hey everyone. I need to vent. Im so frustrated with the process. From being lied to by the doctors down to my own brain not working with me. Im off Ativan for 13 days and yes, im proud of myself. However, im not happy and am tired of the anxiety. I was taking Gabapentin to help, but hated the way it made me feel. Plus that also has addiction qualities and you have to keep popping them. CBD hasn't helped either. I have so much to do this week and a big tripped plan. I cant keep putting off things because of chronic fear. I may have to take a damn Ativan. I hate to, I really do. I just need one day of a relaxed mind and nothing else is helping. 
Everyone says it will get better and im hoping so. I just know I never repaired my anxiety issue, I just took a pill. Until I do, its going to linger. I have a bunch of therapy scheduled and im wondering if I jumped ship too soon. That I should have waited until I had the therapy to stop.",7,0
222,2021-05-15 10:06:00,https://www.reddit.com/r/benzorecovery/comments/nczn4b/i_think_i_fucked_myself/,I think I fucked myself,"I really feel like I’ve fucked myself beyond repair

So I was just 50 days clean but got my script filled and filled double at that yesterday. 2mg Xanax a day. Before those 50 clean days I was getting 1mg Xanax and 1mg clonazepam a month for a few months then before for that 2mg Xanax a day. I abused the fuck out pressies before that and continued to do so with my script and here’s why... for the 3 years I’ve been getting these prescriptions haven’t not once lasted longer than 2 days. 


I’ve had 5 grand mal seizures and the last like 3 my doctors told me I shouldn’t have made it. I like benzos too much though. I literally cannot quit. 


Since I’ve put myself though withdrawals literally 15 probably more times, how’s that’s going to effect my healing process? I have zero attention span and feel stupid. I was smart before I starting taking insane doses and now I can’t even read a page from a book and remember what it was about. I’m on 12mg of breck footballs and don’t even feel a buzz. I ate 30 mg the other week and was so disappointed I stayed up for 24 hours playing Far Cry. 


I really feel there’s no hope for me. During my withdrawals I could get out of bed to take a piss and that was about it. To anxious to answer my moms calls who just wants to say hi and ask if I need anything. Too anxious to get out of bed to make food. Sometimes even turn on the fucking tv. I find happiness in nothing. Sorry for the depression post I just hope no ones taking Xanax like I have so they don’t have to experience these kind of withdrawals. I could write 10,000 pages about my withdrawals symptoms. I feel like going cold turkey so many times from such high doses really hurts my brain. Even when I don’t have a seizure or even 2 back to back. Seizures are so ducking shitty. Broke my back and currently need to have surgery on both of my shoulders now. Stay safe benzo fam.",2,0
223,2021-05-15 09:22:29,https://www.reddit.com/r/benzorecovery/comments/ncys35/suggestions/,Suggestions?,"So I went to a new doctor in December of last year (struggling working from home, sleeping, yadda yadda). Anyway I was shocked when he gave me a script for 60 1mg xans and 60 2mg klons. I've been trying to use them sparingly, but its to the point that I've been using them every day.

I have anti seizure meds, im just looking for any suggestions about how to get off of BOTH of these substances. I've only taken maybe 1.5 bottles of the xans and .5 of the klons, so its not the worst habit in the world, but its also the only thing getting me to sleep at night and its slowly getting worse, like where I only needed half a xan to sleep, now I need 2.

If anyone has any suggestions, should I drop them both at the same time? Should I stop 1 before the other? Taper or CT? 

Thanks in advance.",1,0
224,2021-05-15 08:50:55,https://www.reddit.com/r/benzorecovery/comments/ncy6s4/used_for_4_months_will_i_get_withdrawal/,"Used for 4 months, will i get withdrawal?",Used valium 4 Months. About 10 to 20mg a night. Will i get WD?,1,0
225,2021-05-15 03:52:00,https://www.reddit.com/r/benzorecovery/comments/nctim0/waking_up_at_4am_every_night_during_xanax_taper/,Waking up at 4am every night during Xanax taper,"It’s a nightmare, I rarely get back to sleep and if I do i wake up every 30 minutes nonstop, sometimes heart racing. I just ordered cbd oil for the first time ever , I’m not a weed smoker, always hated it. Can someone give me some hope and tell me their success with cbd oil and tapering? Does it help with sleep? Thank you in advance",5,0
226,2021-05-15 00:59:30,https://www.reddit.com/r/benzorecovery/comments/ncr649/quitting_valium/,Quitting valium,"Hey everyone, i have been taking valium for only about 16 days, some days i took as much as 70mg and had a break for a few days and then took 10 or 20 mg, averaging at about 16mg per day.

I realized that i was starting to get addicted so i decided to quit.

Should i taper down or just quit right now? i havent taken valium in 3 days and i feel decent-ish but feeling some craving. I just read about the seizures and got worried. Are they a concern for me since i only took them for 16 days and have been off for 3 days with no big issues?

Probably a silly question but i'd appreciate some insight.",1,0
227,2021-05-14 23:30:12,https://www.reddit.com/r/benzorecovery/comments/ncpvcz/weird_bodyjoint_aches_one_week_after_quitting/,Weird body/joint aches one week after quitting daily use .25mg Xanax?,"I've always believed that stopping at .25mg wouldn't cause any withdrawal symptoms, but my experience seems to disagree..

I got prescribed 0.5mg about 2.5 months ago to deal with intense CHS anxiety after quitting weed. Was only supposed to be short term, but after 2-3 weeks I lowered my dose to .25mg before bed as it helped me sleep.

Months have gone by and I want to get off of it. 8 days ago I stopped taking .25mg, 3 days in I started having sleep issues, and now starting yesterday morning I'm having a horrible aching in my elbows/arms/knees/legs. Barely want to do anything because of it. Causing so much anxiety.

I tried quitting a few weeks ago and I'm pretty sure I was getting these aches then too. Failed because there was way too much going on, but I remember the night I started again I was like ""fuck this, i can't sleep with this elbow aching"". Haven't had it since. Surely it's related?

I guess it makes sense since I was taking it for so long, like I said it was supposed to be short term. And everyone's experience can be different. But something in me worries it's something worse than withdrawal. Fuckin' hell.",1,0
228,2021-05-14 23:28:04,https://www.reddit.com/r/benzorecovery/comments/ncpu84/feeling_like_theres_no_way_out/,Feeling like there’s no way out,"I’ve been taking 3mg clonazepam and 2-3mg xanax daily for the past 6 months or so as prescribed, in addition to zopiclone 7.5-15mg per night which I’ve taken (prescribed) for multiple years. I’ve attempted to stop taking the zopiclone unsuccessfully many times due to the horrific withdrawals and resulting rebound insomnia. I was originally put on xanax due to developing a nasty Valium tolerance after 6+ years of needing increasingly higher doses. 

After this clonazepam was introduced to wean me off Xanax but due to side effects of various med changes I was put back on it. Now that I’m taking both regularly and my tolerance to Valium is so high, how on earth am I supposed to get off these drugs? I wouldn’t be overly concerned if it weren’t for the fact that the clonazepam and Xanax are no longer helping my anxiety, and Xanax has always made me feel noticeably more depressed than usual. 

I will add that I’m also on a mood stabiliser (lamictal 150mg), SSRI (Prozac 40mg), high dose stimulants (vyvanse max dose twice daily), propranolol (20mg twice daily for anxiety) and extended release melatonin.",8,0
229,2021-05-14 23:03:47,https://www.reddit.com/r/benzorecovery/comments/ncpgn8/anyone_else_not_enjoy_hardly_anything_they_use_to/,Anyone else not enjoy hardly anything they use to?,"I used to be big into sports. I can barely watch a game anymore.  I follow it very passively now. I used to have all these Netflix/TV shows I'd follow, I barely watch TV these days. I use to collect cool action figures. I find myself selling them now. I don't want to call what I have anhedonia, because I do feel pleasure. I felt pleasure and despair watching my Packers and Boilers lose this past season. I felt pleasure watching Mando. I feel all my previous interests were of someone that's not here anymore. I've got into men's haircare products and a few others things here recently.  That's another reason I'm hesitant to say this is anhedonia.  

Then again maybe I'm wrong and I have a major case of it still.",11,0
230,2021-05-14 22:17:24,https://www.reddit.com/r/benzorecovery/comments/ncoq44/ativanlorazepam/,Ativan/lorazepam,I am tapering Ativan. I have been tapering for 2 weeks. I am down from 1.75mg to .25mg. Curious if you tapered what was your final dose you jumped from? Also how long did you stay on that final dose?,3,0
231,2021-05-14 21:29:10,https://www.reddit.com/r/benzorecovery/comments/ncnxz8/things_to_heal_cognitive_and_motor_skill_damage/,Things to heal cognitive and motor skill damage from benzos?,"Was just wondering if anyone used any supplements, medications, natural remedies, etc to heal their lost cognitive abilities, memories, and motor skills. I’m only 25 and have significant loss in all 3 after 11 years of benzos use daily.",12,0
232,2021-05-14 21:13:28,https://www.reddit.com/r/benzorecovery/comments/ncnojr/can_i_drink_a_beer/,Can i drink a beer?,"I've been in a detox/tapering treatment for a month. Have been prescribed lamictal, buspirone and at the moment i'm at 2.5 mg of clonazepam. have been feeling great. i've been clean from all other drugs since starting the treatment, would alcohol set me back? I'm not planning on getting drunk, just having a couple of beers or so. Should i wait for the treatment to be over?",1,0
233,2021-05-14 19:57:05,https://www.reddit.com/r/benzorecovery/comments/ncmdc9/gaps_diet_has_greatly_helped_me_with_benzo/,GAPS diet has greatly helped me with benzo withdrawal,"I am 7 months off benzos after nearly 10 yrs on.  In the last two weeks I started a diet to repair my gut microbiome, as it may have been disrupted by benzos. I felt great progress. I am following the guidelines of  Dr. Natasha Campbell-McBride. Link to her book here:

[https://www.miraculoss.co.nz/wp-content/uploads/2018/10/Gaps-book-1.pdf](https://www.miraculoss.co.nz/wp-content/uploads/2018/10/Gaps-book-1.pdf)

Hope someone else benefits from it!",3,0
234,2021-05-14 18:11:36,https://www.reddit.com/r/benzorecovery/comments/nckehd/gabapentin/,Gabapentin?,Anyone successfully used gabapentin to help with taper withdrawal?,1,0
235,2021-05-14 17:09:42,https://www.reddit.com/r/benzorecovery/comments/ncj3de/ativan_taper_help/,Ativan taper help,It’s been almost 2 weeks since I made my last cut of .125 (which would be about a 5% cut). I’m not stabilizing at all. I’m in constant horrible withdrawal mode. What do I do? Just wait longer until I stabilize? What if nothing changes? Then what?,2,0
236,2021-05-14 16:27:36,https://www.reddit.com/r/benzorecovery/comments/nci59j/taper_question/,Taper question,"I’ve been on 6mg-10mg a day of Xanax of a month sometimes less then that like 1mg-2mg a day. I only have a week to taper, what is the safest way to taper down in a week without having a seizure. (I know it won’t be comfortable but my main goal is to get off them without having a seizure) I also take 100mg x3 a day of gabapentin.",2,0
237,2021-05-14 15:18:31,https://www.reddit.com/r/benzorecovery/comments/ncgllg/any_successful_klonopin_withdrawls_stories/,Any successful klonopin withdrawls stories???,Need of hope,7,0
238,2021-05-14 14:06:30,https://www.reddit.com/r/benzorecovery/comments/nceyn7/its_good_that_i_stopped_taking_xans/,It's good that I stopped taking xans,"Now that I'm too scared to make new friends, talk to women, go on dates, or socialize in general, I can play a lot more fortnite! I love not being able to sleep, or being able to relax even though I just worked out, or get the munchies even though I should probably be hungry right now. I love feeling like my brain is spasming, and that I might have a seziure any second, even though I know I've never had one and it's been four months since I popped any benzos. I love having a panic attack with absolutely nothing to make it feel better other than breathing exercises and laying down. I love not being able to talk to my co-workers where I just wear headphones all day while time slowly seeps past. I absolutely love that I quit xans, it's made my life so much better. :)",66,0
239,2021-05-14 14:06:17,https://www.reddit.com/r/benzorecovery/comments/nceyg1/symptoms_more_prevalent_on_one_side_of_the_body/,Symptoms more prevalent on one side of the body?,"Most of my symptoms are on the LEFT side of the body. Spasms, myoclonus, muscle weakness, burning skin, coordination problems (leading to mild ataxia or disturbed gait)...all of this is on the left side of the body. Even the headaches seem to be stronger on the left side of the brain.

&#x200B;

Has anyone felt this?",3,0
240,2021-05-14 13:24:36,https://www.reddit.com/r/benzorecovery/comments/ncdzsz/tapering_help/,Tapering Help?,"CW: mention of eating disorder and Xanax usage. Okay so I am a 20 year old female, 90 pounds, and 5 feet tall. I’ve been taking probably average .75 - 1mg (Xanax)a day for a little over a week now. Im not sure if I should mention I have a mildly bad eating disorder or not but I feel it might be important to state. I already get anxious as hell and can’t function once the Xanax has ran it’s course through my body. I have a hulk and a half left, I am kinda broke at this moment but can get a few bars if I absolutely need to. Any tips or advice at all helps. Thank you guys!",1,0
241,2021-05-14 11:17:14,https://www.reddit.com/r/benzorecovery/comments/ncb19o/going_down_5_mg_every_5_days_is_my_taper_too_fast/,Going down 5 mg every 5 days - is my taper too fast?,"Hey, I hope that somebody can help me, please. 

I've been taking 40 mg Diazepam for 3 months every night. From then on I've been going down 5 mg every 5 days. This worked okay until I hit 20 mg. 

Now I've been on 15 mg for the past four days and I cannot function. My head is exploding, my chest hurts, I have a very strange and painful dry cough (?) and am nauseous. Also I feel like I am about to lose my mind like absolutely crazy mentally. 

Don't get me wrong, I have been asking two doctors which recommended an even faster taper I did not agree with.

Should I stay on 15 mg or go back up to 20 mg? Also can stimulants (like Ritalin) make the physical withdrawal symptoms worse? 

Thank you in advance and take care of yourself, you're worth it.",1,0
