Date,URL,Title,Body,Score,COVID-19 Mentions,Sentiment
2020-09-23 16:21:46,https://www.reddit.com/r/benzorecovery/comments/iyi8vd/any_expierience_of_tapering_directly_from_a/,"Any expierience of tapering directly from a relatively high dose and long period of clonazolam, only using clonazolam during the tapering period?","Hello everyone!

I have gotten myself into a bit of a pickle during quarantine.

**tl,dr** at the bottom.

Some back story, about 4 years ago I got my hands on some conazolam and ended up going on a crazy 3 month bender of god knows how many mg a day. I bought pills of 0.5mg in bags of 50 and they would be gone in no time. Anyway, don't remember much of this period. I quit after one of my best friends, a drug enthusiast himself, told me he didn't like the person I became and that was quite the wake up call for me. I managed to quit cold turkey which was agonizing, probably dangerous and cost me my job and my house. I swore never to do it again.

Fast forward to the beginning of the quarantine here in the south of Europe, and a fateful drunken night I ended up ordering 0.5g of clonazolam and diluting it in a solution of pg to 0.25mg a ml (I know, I am a fucking idiot for falling for it again, but o well). All for 30 euros. So I had this unlimited supply of the substance and started abusing it like crazy for the first 5 months. Whole conversations, days, weeks, months gone from my memory. I don't know how much I was taking but a rough guess would be 10-25mg a day.

During the last month I have been trying to taper and I have stabilized around 0.25mg 3 times a day (morning, lunch, and after work), and 2.5mg at night roughly, this because of it´s relatively short life span. I can function relatively OK and I am managed to move to a new city, get a job and hold it down so far. Though my memory is still far from good and I feel absolutely empty inside.

My main problem with this is that I will start feeling WD if I miss one or two of those doses, especially the one at night. I´ll get the whole gamut of symptoms: de-realization, de-personalization, 9/10 anxiety whole day, constant full alert, over-stimulation, really negative thoughts, I´ll feel the left side of my chest hurting as if I were to have a heart attack in the next few minutes, horrible half-sleep with nightmares where I just get out of bed at 5am because fuck it, and the worst stuttering I have ever experienced, I can not form a sentence.

Currently I am still in possession of about 375 mg of clonazolam and I could get more. I have been looking around for diclazepam for weeks now, but no one seems to have it, so I am left with two options.

Try to taper with clonazolam, or go to a psychiatrist and hopefully get a prescription for diazepam.

**tl,dr**: My question really is, has anyone here managed to taper of clonazolam directly, and if so what is the best way to go about it. I read the Ashton manual and I understand the general idea, but I would like to hear some first hand experience from you guys.

Anyway, you guys are awesome, this sucks, and let's get through it together.",1,{'quarantine': 2},"{'label': 'negative', 'score': 0.6844366}"
2020-09-23 15:49:31,http://crweworld.com/usa/trendingnow/regulatory/1701849/fda-requiring-labeling-changes-for-benzodiazepines,FDA Requiring Labeling Changes for Benzodiazepines,,30,{},"{'label': 'neutral', 'score': 0.7472186}"
2020-09-23 14:08:07,https://www.reddit.com/r/benzorecovery/comments/iyfhjs/2_weeks_off_diazepam/,2 weeks off Diazepam,"Hey guys! I’m two weeks from jumping off diazepam. I was on for 9 months daily in total, including taper. Before that I took benzos sporadically for a couple of years when I was hungover. I’d say on average twice a month. 
I have seen improvements, but Iv been suffering with palpitations they have been really bad for the past 4 days. Just flutters and skipped beats which makes me worry. Does anyone have any experience and can tell me when they improved?",3,{},"{'label': 'negative', 'score': 0.63664746}"
2020-09-23 12:27:54,https://www.reddit.com/r/benzorecovery/comments/iydftg/tolerance/,Tolerance,This may be a stupid question but I’ve been taking Xanax a bit more then I should this week and I notice my tolerance is going up. Is that one of the first signs that you may have withdrawals when you come down on it?,1,{},"{'label': 'negative', 'score': 0.5150473}"
2020-09-23 12:14:06,https://www.reddit.com/r/benzorecovery/comments/iyd623/thought_i_was_getting_better_feeling_worse_nobody/,"Thought I was getting better, feeling worse, nobody understands","It's been a little over 2 months now that I quit xanax cold turkey. 4mg+ per day. I started to feel amazing at first once it seemed the worst was over, started feeling happy again, all of that, but now it feels like everyday my panic attacks are hitting me full force. To the point it is crippling me entirely.

I have sobbed every morning for the past week. I don't know what to do. I can barely take care of my two beautiful children, and they always ask me why I am sick. It breaks my fucking heart to a million pieces. I'm trying so hard, God. Why can't this feeling just go away. My parents, wife, everyone is so caring but when I tell them I am so physically and mentally exhausted I can barely sit there in peace, they don't get it.

I don't know the point of this post. Maybe to just vent and get it off my chest. My anxiety is just so bad that I get moments where I feel like I cannot breath. I have been to the doctor numerous times thinking I am physically sick and they keep saying it's in my head.. I am at a fucking loss. It's so hard to just get out of bed.",13,{},"{'label': 'negative', 'score': 0.95733356}"
2020-09-23 11:18:16,https://www.reddit.com/r/benzorecovery/comments/iyc3d0/8_weeks_off_of_one_year_of_daily_klonapin_use/,8 weeks off of one year of daily klonapin use,"Hey so I’m 8 weeks out today After using 1 mg Klonopin for nine months then tapering down for two months . Week one was weird but not that bad, weeks two through six were pure hell. I still feel like I’m  in with drawls because I’m experiencing the windows and waves affect. But now instead of the waves being absolute hell, now I just  feel depressed and down which is a major improvement and when I feel a window I feel back to my normal self. Just wanted to update",33,{},"{'label': 'neutral', 'score': 0.43947235}"
2020-09-23 11:10:05,https://www.reddit.com/r/benzorecovery/comments/iybxs4/i_cant_do_this/,I can’t do this,"I can’t stop crying I just want to get high I want to be high all the time I don’t feel comfortable when I’m not atleast on a steady amount of Xanax . I want to die I won’t do it but I just wish I could get get not even on benzoes, on fucking dope at this point or pill opiates idc at this point I just want to feel numb. I fucking hate my life . It’s shit and I’m done with it I just want to be numb all the time.",7,{},"{'label': 'negative', 'score': 0.97142476}"
2020-09-23 04:57:51,https://www.reddit.com/r/benzorecovery/comments/iy6lf1/dont_just_down_vote_help/,Don't just down vote help,"If you have the time to down vote any other persons advice then you have the time to give advice. 

I do not pretend to know everything and if you have been through what others are going through then  help. After all were in this together so help each other please.",10,{},"{'label': 'neutral', 'score': 0.6308542}"
2020-09-23 01:49:31,https://www.reddit.com/r/benzorecovery/comments/iy4igr/i_put_myself_in_a_lessthangreat_predicament_any/,"I put myself in a less-than-great predicament. Any advice is appreciated guys, please.","I'm in my senior year of highschool. I have been taking unprescribed klonopin, around 3-4mg a day for around 2 months. I find it's helping me keep up with grades (seriously), maintain a better social life, and just generally happier the first half of the day when I can feel the effects! And then evening hits, where I'm smart enough not to pop one as I feel the drug whisper to me my tolerance is increasing! This is where I rely on kratom to not feel like an emotionless, almost-anxious, zombie. My social life, grades, and all around life will plummet when I get off of them! I fucking hate this shit. The only silver lining is that my mom knows I struggle with addiction and in liue of her disappointment in me, she will be supportive. What do I do? Would the withdraws from four to five months until christmas be significantly worse than my current two and a half? Will I be able to completely rid them in the 2 weeks given to me for Christmas? Or get off them now? I know if I told my amazing mom she would be ashamed in me, and I would feel the urgent need to get off them whenever she knows, purely based off the guilt that would eat me up inside, that's why I'm thinking of waiting to tell her my vice until Christmas?! Any help or what you would do in my situation would be helpful. Only people who have gone through this same shit respond. No haters calling me a druggy because I know!",2,{},"{'label': 'negative', 'score': 0.68446016}"
2020-09-22 22:55:27,https://www.reddit.com/r/benzorecovery/comments/iy25j9/how_to_to_taper_off_xanax/,How to to taper off xanax?,"So anyone have success of tapering off xanax without switching to a longer lasting benzo. I only have access to real pharmacy 2mg activas (school busses) I've successfully tapered to .75 (taking .25 three times a day) I have to cut a quarter of a piece in half to do this. 

Any recommendations on what u can do next, I dont think I can cut the .25 dose as its so small already. When is the right time to jump completely off. I was doing 6-8mg daily and slowly tapered the last 2-3 months. 

Thanks in advance for any useful information 🙏🙏🙏🙏",1,{},"{'label': 'positive', 'score': 0.5244324}"
2020-09-22 20:11:32,https://www.reddit.com/r/benzorecovery/comments/ixzjqi/needing_help_with_klonopin_withdrawals/,Needing help with klonopin withdrawals,"I have posted here before but need suggestions from anybody titrating from klonopin using liquid Valium.  I am 70 years old and have been on klonopin for 15+ years.  Been titrating for a year and am down to 5.5 mg, with dropping.5 every 7 to 10 days.  My withdrawals have been anxiety, spasms, and shakiness that sometimes keeps me from even leaving my house or my bed.  Anybody at low dose going thru this?  I have doctors and a psychologist I see and they say you just have to go through it.",3,{},"{'label': 'negative', 'score': 0.5487467}"
2020-09-22 18:32:22,https://www.reddit.com/r/benzorecovery/comments/ixxw1a/just_bought_ltheanine_200mg_supplement_tablets/,"Just bought L-Theanine 200mg supplement tablets, how many times you take per day?",,2,{},"{'label': 'neutral', 'score': 0.87945753}"
2020-09-22 15:35:31,https://www.reddit.com/r/benzorecovery/comments/ixujop/do_not_drink_alcohol/,Do not drink alcohol,Was feeling better. Two months since I jumped after taper. Went away for the Labor Day weekend. Drank a few nights in a row. Nothing hard. Actually felt good. Symptoms have come back. Now two weeks.  Learn from this. I did.,29,{},"{'label': 'positive', 'score': 0.8501889}"
2020-09-22 15:01:53,https://www.reddit.com/r/benzorecovery/comments/ixtvcj/tolerance_withdrawals_or_covid_anxiety/,Tolerance withdrawals or COVID anxiety?,I stared tapering three years ago from 3 mg. I am now down to .375 and have been holding for 10 months because Covid hit and summers are always terrible hard. Usually I start feeling better around now but I feel worse. I’ve been using CBD to treat withdrawals and that just isn’t working most days no matter how much I take. The anxiety and depression are so polarizing. I feel like my entire life is revolving around my mental health because I can’t fake it. I’m not sure if I should taper more now or just keep holding. I’ve always felt better after 6-8 months but not this time. I’m thinking I will probably feel this bad forever and I don’t know how to live a full life this way. Ps. I go to therapy and use coping mechanisms,2,{'covid': 2},"{'label': 'negative', 'score': 0.8234143}"
2020-09-22 14:13:27,https://www.reddit.com/r/benzorecovery/comments/ixswbp/promethazine/,Promethazine,Is it safe to take an expired promethazine tab 25mg for sleep aid?,1,{},"{'label': 'neutral', 'score': 0.72161156}"
2020-09-21 23:13:17,https://www.reddit.com/r/benzorecovery/comments/ixfizs/just_wanting_to_vent_3/,Just wanting to vent <3,"Hello everyone. Mainly I just want to vent. I would like to reach out to friends and family, but I feel like it would either 1) Just worry them too much or 2) They would think I've abused benzos and I ""need help"". I've been on benzos since my first trip to the ER back in 2010-2011. I drove myself to the ER at about 3am because I thought I was dying. It was anxiety. They prescribed me some Klonopin. Klonopin has DEFINITELY helped me throughout my struggles over the years. I've never abused it. The highest dose I have taken has probably been 1mg. Over the past 10 ish years, there have been weeks where I've gone without the benzo, maybe even months, and there have been weeks where it had been almost every day. But I know that it has definitely built itself into my life. I am currently at about a month without it. And there have been a few days that I am fairly certain I am going through withdrawals. Today I am irritable, stomach felt off, became very tired, and I felt the wanting to just take a benzo to make myself feel okay. NOPE. NOT TODAY. I want to become non-reliant of that shit. I've heard the withdrawals can be horrible. I am thankful my withdrawals are only to the degree of thinking that it is a withdrawal. It could be a lot worse. Stay strong my friends. Cheers. <3",7,{},"{'label': 'negative', 'score': 0.43436986}"
2020-09-21 21:32:42,https://www.reddit.com/r/benzorecovery/comments/ixdyu5/please_help_if_any_one_is_will_to_lend_some/,"""Please help"" if any one is will to lend some advice i would so much appreciate it. Thank you.","I'm currently in klonazapam taper, and I've started at 3mg and now I have .78mg to go.

My problem is prozac, my pharmacy switched manufacturers and I had a terrible reaction, I cold turkey prozac and went through dicontuation syndrome and rehenstatment on prozac didn't help either, didn't do anything or just made things worse and went through withdrawal anyway.  Amd now im back on a small dose.

I know getting off a ssri is bad whan in bezo tapering, but I the med stopped working and I was put back on it. Should i just stop taking it, stop the klonazapam taper get off prozac completely, or get on a different ssri?",6,{},"{'label': 'negative', 'score': 0.8267685}"
2020-09-21 20:56:35,https://www.reddit.com/r/benzorecovery/comments/ixddtw/splitting_up_clonazepam_dose_into_am_and_pm/,Splitting up clonazepam dose into AM and PM,"I've been taking .25 clonazepam at bedtime as part of my long-term taper. I'm getting ready to reduce the dose more. But first, I decided to split my dose and take .125 in the morning and .125 before bedtime. Is this a good idea and what effect does it have? I feel like I'm having some withdrawal symptoms, most notably difficulty falling asleep (I assume that's because I don't take it all right at bedtime anymore), but the total daily dosage is the same. 

I assumed it was a good idea to get the level more consistent throughout the day.",18,{},"{'label': 'neutral', 'score': 0.522652}"
2020-09-21 15:19:18,https://www.reddit.com/r/benzorecovery/comments/ix77jj/1_year_recovery_times_do_you_ever_fully_recover/,"1+ year recovery times, do you ever fully recover cognitively?","I can't respond to quick stimuli. I have no ""instinct"" or twitch reflexes left at all.

My brain constantly feels fatigued, half the time I have brain fog, and I've definitely lost intelligence. I cannot think quickly at all.

I have to make a conscious effort to not forget new information, I have to repeat it hundreds/thousands of times in my head for the day or even days.

I just want to wake up and my brai nwork the way it did pre-benzos.

I only took it 1-3 times a week for 5 months and once a day on my 6th month(1mg ativan)

I'm nearly 16 months off.",6,{},"{'label': 'negative', 'score': 0.7957489}"
2020-09-21 11:28:13,https://www.reddit.com/r/benzorecovery/comments/ix2l8r/please_reach_out_to_someone_even_if_its_me_im/,Please reach out to someone. Even if it’s me. I’m just trying to help anyone I can struggling with substance abuse.,"I’ve been struggling since about October. I’m actually finally on a path to bettering myself and been maintaining my anxiety and depression a lot more by breathing exercises. I’m on the mod team, just shoot me a DM if you’re lonely and looking for someone to talk to. I know we could all use it, I certainly can after I thought I could trust someone I called a mom figure. Thanks guys for believing in the path to a sober life and being able to enjoy our youth. Addiction eventually caught up to my grandpa and I lost not just him, but Robin Williams, and also Chester Bennington to the same substance abuse mixed with depression and anxiety. More mental health resources were made after Chester died, if you need any help or links reach out to me and I can provide you with anything. NA, AA, or if you’re just looking for a friend to talk to. Please. Reach out to somebody you love today. You never know what somebody could be going through. Especially today. Love you guys. DMs open, not trying to be on my phone as of much lately but I’m always a ear to listen. I love helping people as much as I love helping myself. Take care guys. Love one another. What linkin park taught us all to do. Reach out to anybody, if you need to vent. I have a sober life discord and snap group. Reach out to me if you want a link. No drama on my chat groups cause everyone’s trying to slow down on using something right now. No trigger mentality. WE GOT THIS FAM!!!!!",5,{},"{'label': 'positive', 'score': 0.82584375}"
2020-09-21 11:09:59,https://www.reddit.com/r/benzorecovery/comments/ix28xx/been_taking_251mg_xanax_daily_for_about_two_years/,Been taking .25-1mg xanax daily for about two years now. Haven’t taken them in 3 days out of forgetfulness. Feeling like shit.,"I’ve asked my psychiatrist about if I’m addicted before and she said that wasn’t something to worry about with such low levels of use. I usually use Xanax about 30-hour before bed to stop racing thoughts and paranoia before I fall asleep. I’m three days in and just now started feeling like shit. I’m incredibly shaky, my vision is going a little bit blurry and feel kinda sick. Mental state is maybe a bit more anxious than it would be in the past. I do have a super strong desire to take more even just a small like .25mg dose. 

Is this withdrawal? What should I do? I’ve never considered myself addicted.",6,{},"{'label': 'negative', 'score': 0.6022361}"
2020-09-21 09:28:05,https://www.reddit.com/r/benzorecovery/comments/ix0egc/i_dont_feel_like_im_am_an_addict_but_an_impostor/,I don’t feel like I’m am an addict but an impostor,"I’ve been taking a lot of benzos (2-4 g of Xanax and other stuff) regularly since February. 
I had 3 months of constant abuse of them and it fucked me up. Lied to everybody, stole, lost friends did stupid shit... I took a one month break over the summer and relapsed and I’m back on taking them/opioids on the regular now. 
Yet I don’t feel like I’m legitimate to call myself an addict I feel like an impostor. My friends think I’m exaggerating (not all of them but a lot) and so am I. 
I feel like I’m lying when I say I was/am an addict. 
I just feel like a stupid teenager. 
Do any of you ever think that way ?",2,{},"{'label': 'negative', 'score': 0.94943297}"
2020-09-21 07:20:47,https://youtu.be/tj0tmf5uRqU,A little comfort: Benzo withdrawal = Despair,,52,{},"{'label': 'neutral', 'score': 0.5408145}"
2020-09-21 04:25:12,https://www.reddit.com/r/benzorecovery/comments/iwwg10/diazepam_rapid_taper_would_like_your_opinion/,Diazepam rapid taper - would like your opinion,I have been on Diazepam for a month and a half (10mg) and started a rapid taper 8 days ago. I am dropping 2mg every 4 days. I’m now on 6mg and tomorrow I can either drop to 5mg or drop another 2mg (so will be on 4mg). What would you do?,1,{},"{'label': 'neutral', 'score': 0.83131486}"
2020-09-21 02:38:44,https://www.reddit.com/r/benzorecovery/comments/iwv6rc/daily_micro_tapering_question/,Daily Micro tapering question,"Does anyone that's gone from cut and hold to a liquid daily micro taper, using  one for these as the liquid or solvent,  plain water, or added vodka  or PG as a solvent the water, or milk, find it worked better if you crush the pill first rather than putting a whole pill to dissolve first?",2,{},"{'label': 'neutral', 'score': 0.7829591}"
2020-09-21 01:11:44,https://www.reddit.com/r/benzorecovery/comments/iwu41v/tapering_diazepam_question/,Tapering diazepam - question,I am currently tapering off 10mg diazepam only taken for 1.5 months and I’m down to 6mg. I usually take my 1st dose at 6pm (when my anxiety usually peaks) and my second dose at 9:30pm. I am currently taking 2mg at 6pm and 4mg at 9:30pm. Would it matter if I took my first dose earlier today? Or should you always keep doses at the same time?,1,{},"{'label': 'neutral', 'score': 0.73675114}"
2020-09-21 00:27:49,https://www.reddit.com/r/benzorecovery/comments/iwtijr/pvc_heart_palpitations/,PVC- heart palpitations.,Anyone had experience with these? I’m almost 4 months CT. The worst seems to be over for me except for the occasional “the world is ending” panic attacks. A few days ago I started getting PVC’s (premature ventricular contractions). Did the old ER trip and the doc said it was not life threatening. Just curious what others experiences were. Mine seem to be the worst at night when laying down. It’s a little disturbing,3,{},"{'label': 'negative', 'score': 0.7987194}"
2020-09-21 00:07:58,https://www.reddit.com/r/benzorecovery/comments/iwt87d/does_panic_attacks_have_heart_pains/,Does panic attacks have heart pains?,"4th day off of using Ativan super sporadically getting on to Lexapro. Things were going great then tonight got panicky, felt weird as hell, and then couple sharp pains. Im a fit person, and anxiety and depression is my only medical issues. This sucks.",3,{},"{'label': 'negative', 'score': 0.8348164}"
2020-09-20 23:21:16,https://www.reddit.com/r/benzorecovery/comments/iwsk7q/will_i_ever_be_able_to_tolerate_benzos_again/,Will I ever be able to tolerate benzos again?,"I have PTSD *and* I had a panic disorder *and* an anxiety disorder before the trauma. I ended up on 2mg klonopin for 3-4 years. Well, it took a long time and all my willpower, but I haven’t taken a pill in a month. I followed a 0.125 mg every 6 weeks taper; and it worked. 

This was all prescribed. I still have a ton left. My psych told me that I can use them “as needed” for anxiety. Of course, they don’t touch me anymore. It’s why I ended up on 2mg. It’s why I pushed so hard to stop taking them. Will I ever be able to use them for anxiety again? Just thinking of not having an “out” makes me near-panic. But also, I wonder if that’s even healthy.... I spent those years chained to my pill bottle, needing it on me at all times so I knew I had some. I’d rattle it for comfort. 

I can’t meditate- I just end up crying hysterically. I am wary of other medications because if It’s addictive, well. That doesn’t end so great for me. 

Idk, I guess I’m looking for some gentle support? Some advice?",11,{},"{'label': 'negative', 'score': 0.7823448}"
2020-09-20 21:48:20,https://www.reddit.com/r/benzorecovery/comments/iwr5pb/time_to_quit_it_was_good_and_maybe_fun_but_its/,"Time to quit. It was good and maybe fun, but it's time to stop. 2mg Klonopin daily for 2 years.","I'll start my taper in a few days. My doctor isn't going to use the ashton manual, I know that much. It doesn't matter how much we talk, he always says ""40mg of Diazepam is too much!!!"" He thinks I should be fine with only 1mg of Klonopin, but I know that's bullshit. I'll drop from 2 mg to 1.75 mg. Do you think this is fine? I'll get Lyrica (Prebabalin), Hidroxizine, Seroqiel (quetiapine), Trazodone, Inderal (Propanolol) and Clonidine to help me with withdrawal symptoms. Can you give me your honest opinion? I'm mostly scared of insomnia. Thanks!",5,{},"{'label': 'negative', 'score': 0.53087}"
2020-09-20 18:55:42,https://www.reddit.com/r/benzorecovery/comments/iwoa19/one_month_off_small_doses_and_its_still_hard/,One month off small doses and it's still hard.,"Just venting really.

In the first two weeks I saw *so much* improvement I really thought the withdrawal was done because I took low doses (Xanax, 1yr at 2mg/week then 5yrs at 0.5 to 1mg/week).

But no, one of the symptoms won't go away, a creepy feeling that I am not alone when I am, some kind of generalized anxiety always there with me.

I am aware my own issues won't be solved by quiting but that's a symptom I know appeared with the Xanax. As I didn't take it every day all these years, I already had an idea of the withdrawal symptoms.

Damn. I just hope it won't be too long before this one finally goes away.

Edit: spelling",3,{},"{'label': 'negative', 'score': 0.5109047}"
