Date,URL,Title,Body,Score
2021-02-08 19:39:21,https://www.reddit.com/r/benzorecovery/comments/lfqd55/need_clonazepam_advice/,Need clonazepam advice," Been taking 1mg clonazepam for 5 years. After a nearly 2 year taper im at 0.25mg. The reason the taper was so long was because I caved and upped the dose multiple times. Im having trouble getting off this last 0.25mg because im extremely sensitive to any cuts even a small reduction in dose causes me withdrawal symptoms, however tapering for so long has been a nightmare itself. I have decided to taper this last 0.25mg over the next 1 month. Is this too fast or should I slow it down a bit? My biggest concern is getting PAWS. I already suffer from PTSD so I want to be very careful and slow, but im sick of being on this poison for so long and want to start the healing proccess and reversing the damage I know I have done over the years. I know some will think its such a small dose and it may be in comparison to how much others take however this is the only medication I have taken in my life and stopping it has been a nightmare.",2
2021-02-08 19:29:50,https://www.reddit.com/r/benzorecovery/comments/lfq6ol/breakdown_today_i_had_another_breakdown_tapered/,"Breakdown. Today I had another breakdown. Tapered from 6mg xanax to 3mg and am miserable. Rage that scares me, hopeless, utterly depressed. Is this normal withdrawal? Because I don't know if I can make it.","Have lifetime anxiety under my belt, was/am on Xanax for the last 8 years, had worked up from .25 to 6mg a day under a doctor's approval. 

Last year, had enough. I tapered down to 3mg. I also quit a cushy job to become a caregiver to my mom (a total sweetheart, I have no regrets). But my life is miserable. Very small, few friends, pushing everyone away, no motivation, I'm a wreck.  

I take the 3mg Xanax solely to ward off rebound anxiety/insomnia.  That's it. To prevent from going crazy/having seizures. 

And now every day is a roller coaster. I sleep far too much, I get beyond agitated and am depressed. When it wears off, I slowly start to feel okay again. But this is all unpredictable, I don't know day to day how I'm going to respond. 

I'm just in a really dark place. I can't sleep my life away and walk around like a zombie. My doctor believes this is normal withdrawal but I'm still on 3mg.  Not feeling hopeful about getting off 3mg when it's already done such a number on me. 

Stuck. Sad. Mad. And not myself. And feeling no hope about anything. My poor mother, I'm doing my best for her while quietly falling apart. 

So there's my Xanax story.  Thanks for any advice at all.",4
2021-02-08 18:42:24,https://www.reddit.com/r/benzorecovery/comments/lfp8lu/app_5_weeks_clean_and_i_dont_have_any_more/,App 5 weeks clean and I dont have any more symptoms,"Thanks to everyone who helped me and gave me advice,Im still a little bit confused and anxious as before taking xans but at least Im not a walking zombie any more and other than that I have no more symptoms. Its over and done fuck xans.",32
2021-02-08 17:48:24,https://www.reddit.com/r/benzorecovery/comments/lfo3r4/how_is_everyone_doing_in_their_recovery/,How is everyone doing in their recovery?,"I haven't been on this sub much the last few months. The further you get away from the pain of withdrawal the more you forget. I missed my 7 months the other day. It's a chapter in my life I'll never forget but I'm ready to move on.

I never had windows and waves but I hope everyone else is having nothing but long windows and minimal waves.

You really will heal. It might takes months and seem like it will never end but it will one day and it'll be here before you know it.",9
2021-02-08 16:39:45,https://www.reddit.com/r/benzorecovery/comments/lfmm6s/running_low_on_diclazepam/,Running low on diclazepam,"Im running  low on my diclazepam. I used diclazepam to get off a 2month etizolam addiction and continued using diclazepam for 4months at 2mg. I started my taper jan 6th im now at 1mg. 

Canada post is completely backed up and im not sure if ill get my parcel in time.

How bad would it be to cold turkey from 1mg diclazepam am I at high risk for seizures?",3
2021-02-08 16:13:24,https://www.reddit.com/r/benzorecovery/comments/lfm0mr/is_this_cut_too_fast_and_if_so_whats_at_risk/,Is this cut too fast? And if so what’s at risk?,"About 90 days ago I started tapering down from 3mg of Klonopin. I was on this dose (taking all at night) for over 12 years. My main issue has been sleep maintenance insomnia after coming off suboxone 9 months ago. Seems to be the only symptom I can’t recover from. But the klonopin doesn’t really buy me any more sleep so I’ve been a little more aggressive with my taper lately.

Today is my first day going from 1.5mg to 1mg. Withdrawals in general don’t seem to be that bad...yet. My sleep gets worse overall around the 7-10 day mark and then slowly gets back to its regular shittiness after 2 weeks. 

My main question/concern is am I risking anything by trying to take bigger cuts? I’ve been on this med too long and get impatient with tapering. What do you guys think? Thank you!",2
2021-02-08 15:44:35,https://www.reddit.com/r/benzorecovery/comments/lflcoq/125_mg_of_this_and_its_sedating_as_shit_idk_how/,".125 mg of this and it’s sedating as shit, idk how people take this repeatedly at the full dose.","My doctor told me to test drive this before I use my emergency pack at the dentist on weds. 
I just took half of my .25mg and I feel numb and sedated. I don’t like the way this feels and honestly I’m just gonna half this .125 mg tablet for weds. Because I feel strange on this.",0
2021-02-08 15:33:01,https://www.reddit.com/r/benzorecovery/comments/lfl37q/for_those_missing_caffeine_dearly_green_tea/,For those missing caffeine dearly... GREEN TEA,"Evening you lovely people,

I've been missing caffeine immensely, the glorious corporate crack that makes work possible. 

Have tried drinking coffee a few times since going CT off vals at the beginning of December. Have had to pretty much peel myself off the ceiling everytime and deal with all kinds of madness for the rest of the day after. 

Green tea, on the other hand, does the business - grants a warm, gentle caffeine buzz and you feel great after for some reason. 

Apologies if I'm telling anyone how to suck eggs/stating the obvious on this matter. Anyone who hasn't been able to drink coffee and misses it in their life, might be worth a try as a substitute.

Ez",6
2021-02-08 15:16:25,https://www.reddit.com/r/benzorecovery/comments/lfkpge/pity_party/,Pity Party,"Depressing rant TW. I’m having a huge pity sesh right now, feeling like what is the point for having gotten off these? Logically i know it is good but I just feel like since I jumped everything I thought I knew has changed. 

I used to have too much fun on drinking nights (not a dependent alcoholic but would black out every time and generally be *that person* at parties/nights out), and now any drinks just make me nauseated, and not any more social/funny, which is why I drank. Now it just feels depressing and i want to go to bed, or be left alone.

I used to take adderall for ADHD/work, then discovered that having some more made gaming more interesting, allowed me to play piano for hours, perform my other hobbies with what seemed like razor sharp creative focused genius (spoiler this was not true, it made me worse at creativity). Tapering off Kpin resulted in me experiencing SEARING pain in my neck, shoulder, and jaw if I even looked at 5 mg adderall. I used to drink high caffeine Death Wish brand coffee also, but now I get the same pain and have stoped that as well. All I can tolerate is some mild English Breakfast like twice a day.

To get through the Kpin withdrawal pain I started baking to distract myself and because sugar helped with. withdrawal. Baking was keeping me mobile a little and not in bed all day with no circulation and insane neck pain. Now from having all those baked goods in the house and a habit of noming when I’m bored I’ve gained at least 40 lbs and feel like I need to stop baking and eating. Having a cookie with my afternoon tea felt like the last enjoyable thing I had left in my life, which is sad to admit.

I feel like everything I had to look forward to in a day, anything I found reliably enjoyable, is now gone. Now I’m just left with the gray monotony of a day that is broken up only by trying to wake myself up with bitter leaf water, fill myself up with carbonated tap water and bland chicken, send work emails about work emails i plan to send, mindlessly waste time grinding for ore in a game I’m not immersed in, and try to fall asleep by emptying my brain *even more* than my life is already empty, just to wake up and do it all again for literally no reason.

Needing some internet hugs if you got em, this is such a lonely soul sucking road.",8
2021-02-08 15:03:16,https://www.reddit.com/r/benzorecovery/comments/lfkek1/klon_withdrawal/,Klon withdrawal,"Just about 8 weeks off K and worst issues are memory and dpdr.
I think my short term memory is damaged. 
I can remember things but when I think about them they don’t seem familiar to me.
My doctor told me it’s possible to have permanent damage from these meds but he’s “optimistic”.
I’m still terrified after hearing that but also glad I actually got a doctor to admit the dangers of benzos.

Please tell me my memory will improve. I still cannot believe this has happened. It’s feels like a bad dream that I can’t wake up from",2
2021-02-08 14:35:25,https://i.redd.it/oo7x37gc3bg61.jpg,"Plz go share sum love an support to this guy, he needs it more than anything rn an you'd be pretty much saving a life",,9
2021-02-08 13:39:22,https://www.reddit.com/r/benzorecovery/comments/lfih5u/any_advice_for_someone_yapering_valium/,Any advice for someone yapering Valium?,"Hi

This is my first post here.  I just found this sub.  So I'm detoxing from Valium, the last bit kind of.           6 years ago I was put on 20mg/day of valium along with MS Contin after suffering extensive spinal injuries.  I've been an opiate user for a very long time before this btw, over 3 decades.  Anyhow within a few months of taking 20mg/day of Valium I found it affecting my memory and it kind of felt like I'd walked into a fog.  My drams turned into nonsense and my neat handwriting became scrawl.  In 2018 I managed to reduce to 6mg/day, which was hell.  Worse than opiate withdrawal in it's own way.  I've found the only thing that's been any help so far is magnesium citrate, 400mg/day.  I've been loosely following the 'Ashton Method'.  My doctor had prescribed me some Lyrica and said it might help but when I read about if and found it acts on the same receptors as benzos, I thought screw that, it's going to leave e with another similar addiction, or it could get out of hand and I'll be double screwed.

So I've managed on 6mg/day since the end of 2018 but I've decided that this year I want to be finally done with this shit, it's a plague, a demon.  I've been doing 0.5mg reductions since I got down to 9mg/day, the 1mg reductions were too much to cope with after I got below 10mg/day.  So far this year I did one cut to 5.5mg/day and I've just cut to 5mg/day.  My doctor has been supportive and has gven me some of the 2mg/5ml Diazepam liquid so I can do accurate 0.5mg cuts as it's hard to cut a 2mg pill  accurately into quarters. 

Is there anything other than Magnesium Citrate that I can take that might help take the edge off so to speak or do I just have to stop being a pansy and suck it up?  I've found that before I cut the dose, I spend a few days alternating between the current dose and the lowered dose, then go to the lowered dose, it's not quite as bad then but it still makes me feel like shit.   As the daily dose has got ever lower it seems to have got harder & harder to cope.  Any advice or suggestions greatly appreciated",3
2021-02-08 13:31:23,https://www.reddit.com/r/benzorecovery/comments/lfiaq5/rls_and_klonopin/,RLS and klonopin,I have RLS along with anxiety and depression and I am on 5mg escitalopram and 0.25 clonazepam daily. Whenever I stop clonazepam my RLS becomes so bad that I lose any will to live and go back to taking clonazepam again. I read in some posts that it takes 4 weeks for the withdrawal of klonopin to wear off and honestly I cannot take four weeks of RLS at all. I take take another minute of it,5
2021-02-08 13:27:10,https://www.reddit.com/r/benzorecovery/comments/lfi795/anyone_else_taken_400_bars_in_10_days/,Anyone else taken 400 bars in 10 days,"This is a throwaway account because I'm embarrassed about the number of bars I've consumed not just this year, but the last 7 too. 

I'll start off with my latest and greatest binder which happened last June. I was sober from all benzos for six months, as I got taken off due to having my 5 gran mal seizure in January. I found some pressed bars, something very strong like one or two blacked me out. 

I bought 10 bars the first day. Woke up the second day with a hundred pack. I woke up 10 days after that and could tell I went a lil too hard. I looked at my bank account and had 4 withdrawls for $450 each. I looked through my phone and immediately could tell I hadn't sold any. I ate 400 fucking bars in 10 days and who knows what else I found during that time. My friend came over later that day cause I needed some kpins cause I knew I'd seiz without them. He also confirmed I had been asleep 90% of the time but when I was awake I was getting into all sorts of dumb bullshit. I took 1mg kpin a day for a week then stopped for another 2 months. 

Before this when I was prescribed I had 60 1 mg xanax that would last me no longer than a week. Most of the time 2 or 3 days. This went on for 3 years. 

The other 4 years before I was prescribed I went a lot harder. I'd take 30 bars in two gulps and wake up 4 days later sick as fuck thinking I'd die. I went through a phase where I'd buy a hundred pack and go through them between Friday night and Monday. I always did it on those days because that's when I got paid. I did this for about 8 months and decided to stop. That's when I started slowing down. 

I just recently got a xanax script and kpin script and I'm dealing with the same problems. I black out and then I just keep munching on them not giving a single fuck. I haven't had my xans for longer than 2 days due to my tolerance being high as fuck. 

What problems am I going to face down the road health wise? Nobody else I know has ever talken close to the amount I have that I've personally known so I'm just curious. A lot of people here say they've been on them for a month and are worried about withdrawals and it makes me feel like shit. I could stop taking them in about a week completely I just don't habe any motivation whatsoever without them now. Like I won't even get up to get water or go to the bathroom I'll wait until I'm so uncomfortable it hurts. The last two days I've taken 8 mg of my klonopin and I feel better but I know if I tell my doctor about all this he won't trust me with anything else. I already can't get pain meds and I broke my back and have had 5 shoulder surgeries so they are worried I'm going to get addicted to opiotes too young since I'm 25. This is why I take as many fucking benzos I can is because I'm always in a lot of pain I just want to forget.

Edit: I took 10 350mg somas and 600mg of pregablin and I blacked out. Buddy said I was trying to walk but couldn't haha",30
2021-02-08 13:11:35,https://www.reddit.com/r/benzorecovery/comments/lfhuea/extreme_agitation/,Extreme Agitation,It’s so bad that I can’t even talk to loved ones. Exploding from skin. Pull your hair out type stuff.,6
2021-02-08 10:31:37,https://www.reddit.com/r/benzorecovery/comments/lfe8b3/i_was_put_on_3_weeks_course_of_klonopin_for/,I was put on 3 weeks course of Klonopin for anxiety. But now after quiting it 10 days ago I am getting tingling in both feet and sometimes hands. Can it be MS? I did not have these before taking Klonopin.,"My Tinnitus has also increased after quiting.

No. I don't have diabetes. My back and neck don't hurt either. So it is also not from a disc pathology.

This is clearly medical negligence. Wish my doctor told me about all the crap it can do.

My doctor played Russian roulette with me and even said do not Google about this 'medicine'. This shit cannot be called medicine.",0
2021-02-08 10:21:11,https://www.reddit.com/r/benzorecovery/comments/lfe0bk/switch/,Switch,Hey guys . Need help here. I told my doctor that the 1 mg xanax was wearing off too quick. So he switched me to 1mg ativan. Is their any difference? I havent started the ativan had like 5 xanax left . But today is my last xanax left. Ive been on them 6 weeks daily . Any advice guys? Will it work if i make the switch ? . I plan on getting off soon .,1
2021-02-07 19:17:19,https://www.reddit.com/r/benzorecovery/comments/lezi10/intradose_or_tolerance/,Intradose or tolerance,Heavy withdrawals. .25 Ativan midday and .50 at night. Going through more and more withdrawals. Tolerance or intradose. Been on Ativan 2 months.,0
2021-02-04 17:30:14,https://www.reddit.com/r/benzorecovery/comments/lcs3oo/6_months_after_jumping_and_i_feel_back_to_square/,6 months after jumping and I feel back to square one. Anyone else ?,,1
2021-02-04 16:41:49,https://www.reddit.com/r/benzorecovery/comments/lcqzop/3_week_taper_off_klonopin/,3 week taper off klonopin?,"Is 3 weeks safe enough to taper off .5mg klonopin? 

Roughly:

3 days .5

3 days .375

8 days .25

7 days .125

Then maybe day or two with .0625 if I can cut it that small",2
2021-02-04 13:00:32,https://www.reddit.com/r/benzorecovery/comments/lclo7c/cant_get_my_ativan_refilled/,Can’t get my Ativan refilled,"I know no one can help me but I need to vent and I am scared.  I was given a prescription of Ativan in December from a hospital. I wasn’t taken too much at a time. .25 to 1 at night. Well, it’s been 8 weeks now and only have 11 pills left. I don’t have mental health coverage. An online service won’t prescribe it for me because it was only be for short term.

Ugh, don’t know what to do.",2
2021-02-04 12:59:18,https://www.reddit.com/r/benzorecovery/comments/lclmyl/xanax_wisdom/,Xanax wisdom,"I’ve been cold turkey for like 5 days now bc I’m waiting for my dr to sort out a script for Valium and they are messing me about. I was using on average around 4-10mg a day for like 12 weeks, but some days I’d go extremely overboard and my last dose was like close to 100mg and I ended up in hospital, as you can imagine the withdrawal so far is horrible but I have to go at least another 7 days like this I’m just worried am I at risk of having any seizures? Or have I not been on it long enough. Any help is much appreciated",1
2021-02-04 10:47:36,https://www.reddit.com/r/benzorecovery/comments/lcii1s/18_months_off_im_resuming_life_idgaf/,"18 Months off, I'm resuming life IDGAF","18 months off a 6 month microtaper from .5 clonazepam. 
No symptoms since 5 months off. Fully healed,  in fact better...in a ton of ways. 

I have been eating whatever I want, taking vitamins, smoking weed, drinking coffee, exercising all I was told I could have setbacks from, and none ever bothered me.

However.....The last phase to officially bring closure to benzo withdrawal is resuming drinking beer.

You see, this is important to me for this specific reason: Its the reason I got off benzos in the first place!

8 years into taking clonazepam. 5 once a day, and drinking beer on it 3x a week, I decided to look up if it's ok to drink on this shit. I read bad things and decided I want to be off the benzos so I dont have to worry about it.

The bitch is that you can't drink for a while once your completely off benzos. 

The same dozen or so people in benzo withdrawal support groups tell me to wait 2 years, that it's a rule

Rule? Was a study done on this?
also why 2 years exactly,  why not 5 years?? Why not 6 months? Why not 10 years?? Why not 1 year? Who came up with this time frame? Any what where the factors of the individuals involved in these early support groups? Cold Turkey? High dose? Kindling? Other medications?



I'm also told by these same people that one who cold Turkeyed 6mg of klonopin has to wait the same two years as someone who was only one benzos at a .5 dose for 6 month? 

Wtf????

Look, I understand they are really just trying to warn everyone that a setback could occur. I don't think harm is ment. But some of these people are not realizing hundreds of thousands have come off benzos and where not in support groups to tell them you should avoid drinking for a while and major issues most likely only occur if you had real hard circumstances or drank alot at like 1 month off, then sure...you will set yourself back, I think this is common sense. 

So here I am 18 months off , no symptoms for 13 month and ready to slowly start introducing beer back into my life. Thairfore bringing final closure to my benzo chapter of my life.",2
2021-02-04 01:26:21,https://www.reddit.com/r/benzorecovery/comments/lc9hb7/feeling_like_my_brain_has_deteriorated_after_a/,Feeling like my brain has deteriorated after a year of Benzo abuse :(,"Was on a massive dosage of Xanax the whole of last year, tapered off- 2 months completely clean now but can’t help feeling like I can’t seem to comprehend or accumulate any information.. I was never the smartest cookie but now i feel like it’s amplified. i can’t seem to remember things, and it takes me so long to realise something. and the worst part is i feel like i am somehow aware of how slow and unstable my thought process is.. (i’m also a heavy thc smoker- and thinking to quit) any pointers on improvement?",1
2021-02-04 00:12:25,https://www.reddit.com/r/benzorecovery/comments/lc8a5q/i_keep_failing/,I keep failing,I have been on 2-3 mg a day for last 2+ years. Last few months I’ve managed to get down to .5 a day. The last 2 weeks have been terrible at work and what do you know I’m back to 2mg a day... I only toon 1mg today now I’m lying in bed wide awake wondering when am I going to stop doing this to myself?,2
2021-02-03 23:30:53,https://www.reddit.com/r/benzorecovery/comments/lc7j12/so_i_think_im_possibly_addicted/,So I think im possibly addicted?,"I'm honestly not entirely sure if this addiction is physical because I've felt no physical effects after taking lets say 20 days straight of half real 2mg use a night to one pressed bar, one bar and a half max even at parties. Here is the thing, I don't drink and I don't like smoking. What else am I supposed to do? Like I don't see how you could be sober for lers say 3 months at a time like that's just insane. Reality is I study so much material a day I get bored with my life because of the pandemic so why not take a bar to feel relaxed ya know? I mean this has been my stance on it so far but logically even if I have no physical withdrawal I may be inducing mental issues. Here is the other thing, my insomnia is so bad that it takes me 3 hours to go to sleep on 150mg of benydrl. I have tried to go to sleep with no medication its literslly impossible. How do I know this? I forced myself to take a 7 day break a few months ago and the first day I had issues immediately.  I took a previous 20 day break and took 2mg maybe like 3 times and stopped. Besides even before I started taking benzos I had these issues sleeping. Anyway what should be a general guide because im tired of being a fucking pill head and popping xans real shit. The other problem is im not only taking it to get the ""high"" , j only feel relaxed and at ease not necessarily high unless I add weed",1
2021-02-03 23:07:54,https://www.reddit.com/r/benzorecovery/comments/lc73wn/alprazolam_cold_turkey_quit/,Alprazolam Cold Turkey Quit,"Here it goes.

Started taking xanax 1-2mg, vicodin 30-40mg, and ambien 10mg at 18 (worked the dosaqges up) ....eventually progressed to klonopin, valium, xanax, oxycodone, percocet, vicodin lasted till about 22 when I got a new job I decided to stop taking everything ( very stupid didn't know any better ) had a seizure on the job and woke up in an ambulance. I stopped doing a majority of drugs then and didn't really fuck with pills ( except for painkillers I always enjoyed those ). At 26 I tapered off of oxycodone and stopped taking it everyday. Fast forward to now I have a very stressful job that requires me to be laser focused all day. I smoke weed everyday 3 - 4 times a day and have been taking xanax approx 1.5-2mg with ketamine .2 - .4g per day at night to sleep and drinking vodka with both at night to knock out for approx 8 months daily.

I'm going on day 8 with no xanax, ketamine, and alcohol completely cold turkey. I've been taking zinc, magnesium, bacopa extract, valerian root, ashwaganda root, and heavy doses of niacin to feel better. There are times in the day I feel like the anxiety is too much and I want to pop maybe a .25mg of xanax to just get rid of the anxiety.

Does anybody know when the withdrawal symptoms will dissipate? Any recommendations? I tried meditating and that actually helped me sleep....the sleep has been brutal sleep at 11pm wake up at 2am can't sleep again. I feel like I'm jumping out of my skin half the time and the other time I feel anxious about really nothing but my withdrawals....any advice any words of wisdom from anybody?",1
