Date,URL,Title,Body,Score
2021-02-27 20:26:22,https://www.reddit.com/r/benzorecovery/comments/lu266f/had_a_seizure_early_this_month_and_ive_been/,"Had a seizure early this month, and I've been making myself paranoid about the potential of another. Could use some reassurance.","I'm really hoping someone can help calm me down. So I had a seizure on feb 7th, approximately 36 hours after my last dose of clonazolam. I had gone through 60mg of clonazolam after receiving that amount two months prior, so I was taking 1mg per day on average.

The seizure happened just about when a 200mg caffeine pill I had taken would have been kicking in. I was playing League of Legends, and I remember having this weird visual aura for a few minutes prior to the seizure, the colors looked a bit weird and it kind of hurt my eyes when I blinked. The seizure lasted for only a few minutes. I didn't lose control of my bladder fortunately, I've heard that can be a common occurrence. As far as I remember, I was playing league of legends, and then I'm sitting in a chair outside my room and my dad is telling me I had a seizure. I was confused of course, as I had literally just been sitting at my computer playing league of legends, at least as far as my memory was concerned. It only took a few minutes for me to come to my senses and understand the situation. And once I came to my senses, I remained fully conscious, aware, and responsive during the following hours as I was taken to visit the ER. I was just a bit dazed, and my body was sore, and my tongue hurt from biting it.
From what I understand, seizures can be a lot more severe, and mine was relatively tame, is this correct? If so, does that have any relevance in regards to my risk for having more seizures? 

I met with a neurologist and was open about my benzo use, and how the time of the seizure falls in line with the time that the most severe of withdrawal symptoms from the benzo would start to be hitting me.

I'm having an MRI next week and EEG in a few weeks. Is that just to rule out any abnormalities/issues that could also have factored into the seizure?

Basically, I'm just wondering what the chances are of me having another seizure...
if the MRI/EEG don't show any issues, and I properly taper off of benzos gradually instead of stopping abruptly, I probably shouldn't be having another seizure, right?

It may be worth noting that I had quit benzos cold turkey several times prior to this, after heavy use. and while I did experience a lot of rebound anxiety/insomnia, I hadn't had any seizures.
Does that indicate that I'm not very prone to seizures to begin with?

Or does that indicate that I've made myself more prone to seizures by fucking with my brain due to years of on-and-off benzo abuse?

Was me having a seizure this time just potentially due to compounding the abrupt withdrawal with other factors like caffeine consumption and sleep deprivation, potential dehydration, etc?",8
2021-02-27 17:12:42,https://www.reddit.com/r/benzorecovery/comments/ltym0h/4mg_xanax_er_taper_questions/,4mg Xanax ER taper questions,"Went from Xanax 0.5 mg to 4mg XR in 2 months. Totally want to be off of them, Dr is being too flaky as far as consistency. Went on vacation and I was left without a refill. So in 4 days I’ve only taken 2mg. And feel a little bit off. I have an appointment in 3 days with only 2mg left. Hopefully I’ll be okay. What script should I ask for, as far as mgs..or should I ask to switch to something else like Valium or Clonopin?",1
2021-02-27 12:37:37,https://www.reddit.com/r/benzorecovery/comments/ltt37s/how_long_did_your_mood_swings_last/,How long did your mood swings last?,"I'm 30 days in completely benzofree. My anxiety is a bit up and down but definitely a lot better than a few weeks ago. Main issue right now are the mood swings, can't really socialise right now since i sway so much back and forth. How long did they last for you?",10
2021-02-27 10:46:43,https://www.reddit.com/r/benzorecovery/comments/ltqs0i/should_i_split_my_dose/,Should I split my dose,"I have been tapering for several months now. I have only took my one time dose at bedtime and that was the only time I consumed my medicine before releasing the tolerance withdrawal and decided to not go any further. Okay so every dose has been at bedtime, I've crossed tapered to valium and am now down to 7mg. My question is: Would it help soften the bumps of the half lives and keeping the drops in my levels even smaller if I split my dose, say 5mg at bedtime and 2mg 12 hrs later and continue to do that until I'm done? If so, how? I took my full 7mg last night at bedtime, if I take any today would that be ""up dosing?"" If I wait and only take 5mg tonight will that throw me into hard withdrawal before the 12 hrs to take the 2mg. Does this makes sense and if you understand what I'm trying to ask, please give me your advice ot experience.  Thanks is in advance.",1
2021-02-27 10:25:03,https://www.reddit.com/r/benzorecovery/comments/ltqc82/has_anyone_tried_ltryptophan_and_does_it_help/,Has anyone tried L-Tryptophan and does it help ?,,3
2021-02-27 08:09:54,https://www.reddit.com/r/benzorecovery/comments/ltnt9a/are_your_windows_100/,Are your windows 100%?,"I've been off over 2 months now after 3 months of total usage and how i describe my windows would be where im somewhat functional but still uncomfortable as opposed to my waves where i can sometimes be completely bedridden. 

I see people mention windows and waves a lot here and im wondering if i understand the concept correctly or if i've just not had a window yet. Are you supposed to feel completely normal during a window?",3
2021-02-27 03:40:37,https://www.reddit.com/r/benzorecovery/comments/ltjwad/how_long_did_it_take_you_to_become_dependentwd/,How long did it take you to become dependent/WD from quitting Xanax and/or Klonopin,"I am on one train that was my own fault because of Covid related circumstances, really bullshit geed and corrupt political agenda, and of course I believe that people should be free to take what they want, adults anyway.   


   


I have been a pain patient due to Chronic Disease for 30 years. Real Oxy and Fent Presses are the only things I have ever become dependent on. I took meds for years without issue, and younger I partied HARD and binged on everything that you can imagine.   


The irony is that Real Oxy is the one that works the best for my pain!  


Anyway, I was trying to get an idea of what the average time frame is for Benzos as I Have heard that the WDs are even more difficult to get thru and last way longer than Fenty presses.  


I have read that Methadone and Subs have horrific wds too..  


I will be using some Benzos to get thru the tapering and WDs of getting clear of this train.   


Thank You",5
2021-02-27 03:09:38,https://www.reddit.com/r/benzorecovery/comments/ltjhxa/what_is_the_draw_of_abusing_benzos_and_the_feeling/,What is the draw of abusing benzos and the feeling?,"Im coming off a Perc habit and taking  xanax (no more than 1 mg a day ) to ease the withdrawals. It does help a bit with the anxiety but, just makes me super tired.. Can anyone explain why people abuse xanax or what happens when you take a lot (like 8 mg). Someone told me it gives you confidence when you go out.. I cant see that and who could stay awake to even want to go out........Does it make you feel like your drunk, out of it? Sorry for being naive I just dont get why its abused...",1
2021-02-26 23:31:44,https://www.reddit.com/r/benzorecovery/comments/ltga01/how_long_should_i_wait_before_taking_benzos_again/,How long should I wait before taking benzos again?,"Was on Xanax for 11 months been off for 6 weeks, how long do I have too wait before I can take benzos again without falling back into full blown withdrawal?",1
2021-02-26 22:19:21,https://www.reddit.com/r/benzorecovery/comments/ltf0ri/conversion_calculator_which_is_most_accepted/,Conversion calculator which is most accepted,I’ve noticed some of them have different equivalence which one is considered correct,1
2021-02-26 21:42:21,https://www.reddit.com/r/benzorecovery/comments/ltectq/anyone_else_experience_a_constant_urge_to_pee/,Anyone else experience a constant urge to pee during/after benzo withdrawal?,"I successfully tapered off clonazepam/klonopin over the last few months. I was doing surprisingly fine until I suddenly developed this bladder issue where I feel a constant pressure and urge to pee, especially at night, which makes it IMPOSSIBLE to sleep. I ended up in the emergency room with heart palpitations because I didn’t sleep for a week. The bladder pressure / urgency is constant and the sleep deprivation is ruining my life. I finally had to start taking some clonazepam again because it’s the only way I could get even a little sleep, which I’m not happy about at all. Anyone else have this experience with bladder issues and urinary urgency during or after withdrawing from benzos? I’m waiting on tests to figure out if it’s a physical problem. I tested negative for UTIs. The bladder issue weirdly gets better temporarily when I’m on my period. I’m desperate for answers. I don’t want to permanently go back on benzos because of this awful new problem.",8
2021-02-26 20:48:42,https://www.reddit.com/r/benzorecovery/comments/ltddd7/i_dont_want_to_do_this_anymore/,i don’t want to do this anymore.,going back to drugs would be so much fucking easier. i can’t handle this anxiety. i feel like a broken person who wasn’t meant to be here. ever since i got sober i’ve just been so fucking unstable and just a mess. i’ve been on xanax for almost my whole life and i don’t know if i can live without it at this point.,1
2021-02-26 20:32:43,https://www.reddit.com/r/benzorecovery/comments/ltd2ya/baclofen_and_xanax_rapid_taper_help/,Baclofen and Xanax rapid taper help,"I was taking 15mg per month on random days for 2 years. I ran out of Xanax and then I used a weaker lorazepam for 3 days. Then stopped. 

I’m a week into no benzos and my chest feels so tight anxiousness and can’t socialize. I have to perform at my job and I’ve been using baclofen to help but it barely helps and then I feel worse after I’m not sure if it’s the baclofen or the withdrawals are that bad that it overpowers the baclofen. And I might be addicted to baclofen too. 

I’m not sure if I should start over and do a slow taper or just try to get through this. 
I can’t be like this everyday it will mess up my life. 

I have gabapentin, Kratom, l theanine, phenibut to use but I’m just not sure what to do. The gabapentin helps but I don’t want to take it everyday or it’s another problem. Should I cycle all those things and see if I get past the Xanax withdrawal.. no other drugs even feel good anymore. 
I was just taking too many drugs for a long time. 
Any help is appreciated. I know it’s complicated",0
2021-02-26 20:30:53,https://www.reddit.com/r/Badpill/comments/lt8hie/badpills_psych_med_resource_list/?utm_source=share&utm_medium=ios_app&utm_name=iossmf,Resources list,,2
2021-02-26 19:20:07,https://www.reddit.com/r/benzorecovery/comments/ltbryt/i_cant_fucking_do_it/,I can’t fucking do it,"

I finished my taper Wednesday and I don’t know what to even thinking my thoughts are all over the place and I don’t even know if it’s the withdrawal or if this is my baseline I’m losing it.

 I just wanna be able to live a content sober life that’s all. I don’t wanna feel like a stranger to my self and feel this hopeless everyday I was on them for 7 years running from what I think was depersonalization and I don’t even know if it’s back or if this is just me I’m so up and down. 

I just want to cry and I can’t I have nothing I feel no emotion but empty and hopelessness I thought I was getting better but now I can’t even grab on to it die some hope. I have obsessive thoughts and so much negative thinking and I don’t know if it’s my ocd of the withdrawals my brain is so scattered rn. 

To anyone out there going through this or anyone that has been suffering with mental illness I’m so sorry you have to feel like this it’s so hard to keep hope when I feel so dark. 

Sorry for the rant I have no one to talk to that gets it or whatever is going on I just want one day of peace just one day of feeling like earth is my home and I’m safe.",5
2021-02-26 18:22:33,https://www.reddit.com/r/benzorecovery/comments/ltaoo8/sleeping_during_valium_tapering/,Sleeping during Valium tapering,"Hi I am currently tapering off Valium
. I’m currently in 1 mg per day but have a lot of trouble sleeping . I will drop off but only get 3 hours before I’m awake again . Has anyone had similar issues or has overcome this . Thank you",1
2021-02-26 17:41:03,https://www.reddit.com/r/benzorecovery/comments/lt9unm/xanax_seizure/,Xanax Seizure,"I Had One Seizure From Withdraws About 2 Months Ago, Will I Have Another One If Only Take One Xanax 2Mg?",1
2021-02-26 15:06:49,https://www.reddit.com/r/benzorecovery/comments/lt6j8k/microdosing_during_recovery/,Microdosing during recovery?,"I've heard multiple different opinions on this. Some people say it makes it worse, others have said it works wonders. Just wondering what some of you guy thought about it?

Was thinking of trying to microdose some psilocybin to eventually *replace* pills that I take. But I'm wondering if it is safe to do during withdrawal? I mean the obvious answer would be no, but idk I'm curious. I know things like ayahuasca have helped people kick addictions. I used to be (still am just haven't really done a whole lot lately because of my mind) a pretty frequent user of psychedelics. I believe fully in their being potential. However, I have been off the deep end mentally lately. I'm kind of scared for a full on trip or to smoke DMT or anything like that. I might do it soon, but idk lol

But has anyone ever tried microdosing while trying to kick benzos? I'm not on that much currently (.25mg-.5mg of klonopin a day usually) and I know benzos kill the effects of psychedelics, but I feel like I might still benefit from it, but I'm a but nervous lol 

Any thoughts on this¿?",1
2021-02-26 13:41:58,https://www.reddit.com/r/benzorecovery/comments/lt4lor/what_did_you_use_for_sleep_my_insomnia_is_awful_5/,What did you use for sleep? My insomnia is awful 5 mos off.,I feel like I’m going to die. I’m not sleeping barely 2-3 hours. It’s getting worse.,2
2021-02-26 13:25:47,https://www.reddit.com/r/benzorecovery/comments/lt48h8/i_had_some_question_17th_february_i_stopped/,"I had some question. 17th February, I stopped clonazepam after 2 and a half years of 0.25 mg / 0.5 mg dose.","I'm 18 years old. 

Day 9 off from clonazepam and i feel I'll recover really soon. My question was something different. Please i would appreciate your views on that 🙏 

8th January 2021

It was when I was tapering my Escitalopram 7.5 mg to 5 mg. I had a lot of brain fog, upset stomach, and anxiety issue. So i went to my doctor because i had my school exams soon and had to do something to get stable off the withdrawal symptoms. 

I went to my doctor on exactly

30th January 2021 - 

Where he prescribed me Etilaam 1.5 mg CR which is a similar - benzo drug not completely benzodiazepine like clonazepam, To soothe the withdrawal symptoms i had from Escitalopram. 

Now it's exactly 1 month i have been taking Etilaam 1.5 mg CR and i have tapered it down to half ( Etilaam 0.75 CR ) to maintain the tolerance.

My question was..

Should i taper off this new benzo - similar drug that the doctor prescribed first? Like after getting clean from the new drug, then taper off 3/4th of 5 mg of Escitalopram then 2/4th and then 1/4th? 

or

I should cut down my Escitalopram completely nil / 0 from 5 mg and increase my Etilaam to 1.5 mg or 2 mg till the withdrawal symptoms are gone off from Escitalopram?

PS. I personally don't want this new drug to continue for longer, so i was hoping if i could cut off the new drug first.

I would really really appreciate your opinions.

Just kinda discussing cuz my doctor said you'd rather continue Escitalopram 5 mg all life or Benzodiazepine where you gotta increase the dose, as low dose won't work later. 

I said nope, none.",2
2021-02-26 12:12:46,https://www.reddit.com/r/benzorecovery/comments/lt2g97/ive_been_on_diazepam_for_about_10_weeks_now_10mg/,"I've been on diazepam for about 10 weeks now (10mg), does my doctor know what she's doing?","She's reducing my dose from 5mg twice per day, to 2mg twice per day for 1 week then 2mg every other day for 1 week then stopping, i'm worried about withdrawals, is this a good idea?",1
2021-02-26 11:53:50,https://www.reddit.com/r/benzorecovery/comments/lt1vt6/doctors_starting_to_not_prescribe_benzos/,Doctors starting to not prescribe benzos,"I went to see my primary care physician today for a regular check up. I was prescribed.5 mg Xanax for anxiety for about 2 years but I stopped taking them about 4 months ago without my doctors knowledge. Today, he asked me if I needed any medication refilled with the exception of Xanax. He proceeded saying he stopped writing benzodiazepines since last Friday for anyone. I’m glad I stopped taking this crap. I couldn’t imagine getting cut off so abruptly. I think doctors are going to be extremely strict when it comes to prescribing benzodiazepines just like opioids.",63
2021-02-26 11:52:06,https://www.reddit.com/r/benzorecovery/comments/lt1ugm/tbi_after_fall_while_on_xanax_need_help/,TBI after fall while on Xanax... Need help!!,"So, my 63 year old mom fell down the stairs and has a 4mm hematoma on her brain. It started to dissipate but it has left her jumbled, disassociated, angry and combative. She was also hallucinating. It is noteworthy that she was on 4 mg of Xanax a day for 2 years which, in my mind, is the reason for the fall. They now have her on .25mg twice a day which is an eighth of what she was taking. She was in the hospital for a week and on a short list to be transferred to a TBI facility. She was soon rejected because the PT department deemed her physically competent and apparently you have to be lacking have both physically and mentally.    

My sister lives with my mom, my brother-in-law and my 3 year old niece, while my other sister and I live out of state. My dad passed away a year ago and we don't have any family. My sister NEEDS help! I can't go up there!!! Anybody have experience with this???  Feeling desperate. 

I feel like a lot of this is coming off the heavy dose of Xanax detox... not just the head injury!!

The hospital case worker was working on some kind of ""in home"" health aid but It hasn't come to fruition. Plus, it doesn't matter when there's a 2 am freak out!!!",1
2021-02-26 08:00:28,https://www.reddit.com/r/benzorecovery/comments/lsx7x9/can_someone_tell_me_what_im_up_against_exactly_1/,Can someone tell me what I’m up against? Exactly 1 month on Xanax and Valium,"I have used benzos before but only here and there, maybe once every couple of years for up to 4 days at a time, only like 10-20mg Valium. For the past month I have used Xanax and Valium most days - Xanax 1-2mg and maybe 10mg Valium to sleep too on like half of those days. So I stopped CT and 4 days later I feel dreadful, have had no sleep at all and a bunch of the standard symptoms. Should I get back on Valium and taper, or wait it out? How long will this last? I’ve realised that I don’t have the ability to use drugs responsibly and will never take anything after this.

Edit: Thanks for all the advice. I have hit a turning point now at the end of day 4 where the symptoms are all way better and I can actually think straight and swallow food. Still don’t think I will sleep tonight though.",1
2021-02-26 07:39:00,https://www.reddit.com/r/benzorecovery/comments/lsww51/i_want_to_destroy_my_addiction/,I want to destroy my addiction,"13.11.2020-26.2.2021 
 benzos -xanax/clonazepam from 0.5 mg to 5 mg per day, do you think I can handle the discontinuation myself or is it better to visit a doctor? It really sucks me ... I won't lie ... I can only lie down, think about shits or sleep...could any of you draw up a plan for me to drop down, please? Thanks for all the advice, I'm really tired, thanks!",1
2021-02-26 04:18:50,https://www.newscientist.com/article/2230379-benzodiazepine-prescriptions-reach-disturbing-levels-in-the-us/,"“For every 100 adults that visit an office-based doctor over the course of a year, 27 visits will result in a prescription for a benzodiazepine.”",,12
2021-02-26 04:14:35,/r/Badpill/comments/l6kpc7/5_years_off_kolonopin/,5 years off kolonopin!!!,,11
2021-02-26 01:45:57,https://www.reddit.com/r/benzorecovery/comments/lsryh8/life_has_flipped_on_me_and_now_everything_feels/,life has flipped on me and now everything feels like its going south,"i want too binge drink again but now im prescribed 2mg of xanax with zopiclone 7.5mg at night with 10mg dexedrine and 40mg vyvanse, life feels like it has just been flipped on its head in the last month and everything is going to shit i dont know why i try live daily im not living im barely fucking surviving anyway",3
2021-02-26 01:11:11,https://www.reddit.com/r/benzorecovery/comments/lsrgr0/had_seizure_at_work_5_days_since_ct_clonazolam/,Had seizure at work 5 days since CT clonazolam after 2 months of daily use.,"So I’m fairly certain that I was taking around 2-4mg each day, not completely sure. Days 1 and 2 were the worst, extreme anxiety and paranoia. Day 3 was alright and by day 4 I felt completely fine. Today though I woke up feeling great although I slept kind of shitty. 

Anyways I’m a cashier at a drive thru and all of a sudden I’m listening to my coworker talk to a customer over the radio, and I’m like: “what the fuck, I’ve heard this conversation before”. Then I started smelling something that smelled extremely familiar but I didn’t know what it was. 

My heart was racing and I was basically just in a state of extreme deja vu and figured I was about to have a seizure so I sat down. Next thing I know I’m in the office and my manager is telling me to sit down because I passed out, which I later confirmed was a seizure. Went to the ER but they just gave me a cat scan and bloodwork but didn’t do anything so I discharged myself. I wasn’t going to sit there for 3 hours while they test my fucking electrolytes. I told the doctor what was going on but they didn’t prescribe me anything, not even seizure meds.

Anyways I’m not sure how much I was taking because they were pressed bars. I have the pressed ones and I also have real Mexican Xanax. I’m really not sure what I should do, if I should take a quarter of the pressed ones (.5mg clonazolam) or some real Xanax which has a much shorter half life.",5
2021-02-26 00:19:06,https://www.reddit.com/r/benzorecovery/comments/lsqo8q/for_anyone_reading_this_who_is_considering_doing/,For anyone reading this who is considering doing benzos,"I had a bag of 10 Ativan on my desk 20 minutes ago I paid quite a bit for.  Since then they were flushed, I decided I will never take a benzo, but I came real close tonight.

I ended up watching some withdrawl story vidoes and reading stories, always a thing I do when I consider experimenting.  I should have done it before paying, but it sounds like it would be worth tossing it even if I paid my entire life savings.  The risks vs reward of this drug are insanely lopsided.  take it for a couple weeks.. get crippling withdrawal for a year??  Hell no.  I'm sorry for you guys suffering, I hope the best for you.",7
2021-02-26 00:15:33,https://www.reddit.com/r/benzorecovery/comments/lsqm9o/ct_questions/,CT Questions,I was wondering... Can a cold turkey results in any chronicle disease? Or increase the chance of it?,1
2021-02-25 23:23:47,https://www.reddit.com/r/benzorecovery/comments/lsps7a/finally_recovered/,Finally recovered,"Man, I will never touch a benzo again. I can’t drink because I got a nice 30 day hospital stay from a horrid case of pancreatitis a couple of years ago. So after a rough month, I decided to go to cabo and spend a week. Bought the bottle of 90 2mg bars and about 50 10mg Valium. I had a nice relaxing week. Knocked all of em out within 3 weeks. Stopped cold Turkey when I ran out and holy sweat blankets were my last 10 days rough. I finally got sleep last night and got a nice jog in today and feel mostly back to normal. But it was hands down the worst 7-8 days I’ve ever felt. I was blacking out a few times a day, crapping myself, breathing fast and then couldn’t breath...now it’s just a very mild tremble left and minor hot and colds. Anyone else ever went through a withdrawal worse than a benzo withdrawal? I wouldn’t touch one again for anything. Only positive is I lost 14 lbs from no appetite, sweating, puking and shitting",2
2021-02-25 20:51:57,https://www.reddit.com/r/benzorecovery/comments/lsmvox/withdrawal_and_tapering/,Withdrawal and tapering,"So I got a job for the first time being a bar head at 19. I’m coming off a 3 year daily habit and it’s about at 1mgish-2. Am I able to cold turkey this out and ease it with the last 2 and a half bars I have, farmaprams. I can’t sleep like I use too, I went from like 8 bars a day to 2, and then now my usual dose. I really wanna get off them and I heard staying active helps withdrawals. Lately I can cruise on the 1mg all day but at night is where I gotta get a fix lol. Any advice is loved, and any hate is even more loved. 
Thanks In advance",1
2021-02-25 19:21:29,https://www.reddit.com/r/benzorecovery/comments/lsl56a/boaty_feeling/,Boaty feeling,"Anyone else have the feeling their on a boat and that it eventually went away? It's probably my worst symptom. I'm 3.5 weeks post taper. 

I know it's the cerebellum having issues. I hope to god it goes away eventually. Can't imagine living like this.",6
