Date,URL,Title,Body,Score,COVID-19 Mentions,Sentiment
2020-04-23 10:11:22,https://www.reddit.com/r/benzorecovery/comments/g6nbyq/today_will_be_my_last_dose_of_benzodiazepines/,Today will be my last dose of benzodiazepines,"It has been a crazy ride. I started taking 2mg of xanax in  march- april of 2019 because of stress, and didnt start tapering until september. I had gotten to 1mg of xanax on my own, tapering .1-.25 every few weeks. When i was younger i had a few month binges and cold turkeyd but it was nothing like this. I was kindled. I couldnt take it anymore because of the short half life, so i ended up going on librium 30 mg. Been decreasing 5mg every 2 weeks.

Jumping from 5mg librium which equals 2mg valium. To anyone out there struggling, i promise if you set your mind to it you can acheive it. I could not have done it without this group. Thank you so much.",22,{},"{'label': 'positive', 'score': 0.5790349}"
2020-04-23 09:35:23,https://www.reddit.com/r/benzorecovery/comments/g6mqny/im_2_days_into_withdrawals_cold_turkey_i_feel/,"i’m 2 days into withdrawals, cold turkey, i feel sick, i feel empty, i cant see more then 2 foot in front of me, i’m shaking, i cant have lights on otherwise it gives me a fucking headache, so i continue cold turkey even tho i’m 2 days in, i have enough xans to taper for a week",thanks what do i do,25,{},"{'label': 'negative', 'score': 0.9495095}"
2020-04-23 08:52:43,https://www.reddit.com/r/benzorecovery/comments/g6m37h/question_about_adjusting_from_4000mg_of/,Question about adjusting from 4000mg of gabapentin a day to a low dose of klonopin,So I’ve been taking 4000 mg of gabapentin recreationally the past month every single day and the magic is gone and its bioavailability has been too unstable for me to successfully taper down. I have a ton of 2 mg kpins and was wondering how to switch over because I’ve found tapering off of klonopin to be way smoother than off of gabapentin so far. How much should I dose and how often? I’m still having trouble finding what my baseline is with it.,2,{},"{'label': 'negative', 'score': 0.5811868}"
2020-04-23 06:38:03,https://www.reddit.com/r/benzorecovery/comments/g6kdsr/any_idea_when_this_benzo_withdraw_will_let_up_on/,Any idea when this Benzo withdraw will let up on me?! Somebody stop the damn match! BY GAWD AS GAWD IS MY WITNESS HE PUT HIM THROUGH THE DAMN TABLE!!,"This Benzo withdraw has really put me through everything I expected with a side of fart. I’m just ready for it to ease the fuck up a bit I can’t do this when will this foggy, terrible feeling go away no sleep and no food not hungry he’ll just help me if you know anything about this!!",3,{},"{'label': 'negative', 'score': 0.95098907}"
2020-04-23 01:08:34,https://www.reddit.com/r/benzorecovery/comments/g6gr6t/low_dose_benzo_prescription_to_cure_headache_from/,Low dose benzo prescription to cure headache from not tapering years ago?,"I have been prescribed a low dose benzodiazepine to help me me deal with a headache/facial pain that started 2-3 years ago when I quit benzos (multiple times) without tapering. What is the logic to this, if any? So I can taper again properly? Heal damaged GABA receptors? I am terrified to go through what I went through before but I would do anything to get rid of this pain behind the bridge of my nose. What should I do? The dosage is very small (3 times a day) and I have taken 3 doses so far. My head now does not feel good and I feel very anxious...",2,{},"{'label': 'negative', 'score': 0.76539963}"
2020-04-23 00:10:11,https://www.reddit.com/r/benzorecovery/comments/g6g0xb/anyone_have_any_alternatives_to_klonopinbenzos/,Anyone have any alternatives to Klonopin/benzos for trying to sleep?,"I'm on my 11th day of Zoloft and every time I try to go to sleep my breathing rate increases, my body senses fear and I can't fall asleep. I've been having this problem from before I started taking the medication.

Every time I try to tough it out I can't sleep all night leading to extreme stress on my body due to lack of sleep plus the added anxiety I already have.

I just recovered from a bad viral infection (probably coronavirus as I'm a NYer) but I'm having this issue.

I don't want to be taking benzos and I have no idea what to do. I ordered CBD oil but I doubt it's gonna help since you probably need sky high doses for that to work for my kind of problem which is deeply physiological.",5,"{'viral': 1, 'infect': 1, 'rona': 1, 'virus': 1}","{'label': 'negative', 'score': 0.8909198}"
2020-04-22 22:13:16,https://www.reddit.com/r/benzorecovery/comments/g6eezf/used_to_take_it_for_anxiety_in_2016_took_two/,"Used to take it for anxiety in 2016, took two doses two weeks ago?","I fed more slow, angry, and a little more anxious. I feel more depressed. Could it be because of two doses I took two weeks ago? The antibiotics I took a week ago which seem to give me depression too? Should I just shut up and stop questioning every thing happening to me??",1,{},"{'label': 'negative', 'score': 0.9281607}"
2020-04-22 19:49:29,https://www.reddit.com/r/benzorecovery/comments/g6c95k/iv_nad_treatment/,IV NAD treatment,I've been using xanax for 4 months up to 1mg a day.  A few weeks ago I missed a day and felt like absolute death and suddenly realized I was addicted....I'm now o  day 3 without a benzo..no cravings but I still feel like crap.  I'm on my way to San Diego to go thru the IV NAD treatment...although I feel ok right now I'm noticing this stuff hits In waves. I really hope i don't have to deal with PAWS after this. Those who have been taking this stuff for years at high doses I feel for you. The last 2 weeks have been hell on earth. I tapered from 1mg to .25 in about 3 weeks and now I'm off completely.,2,{},"{'label': 'negative', 'score': 0.737477}"
2020-04-22 18:03:28,https://www.reddit.com/r/benzorecovery/comments/g6agqb/tips_on_coping_with_the_anxiety/,Tips on coping with the anxiety?,"So ya we know coming off Benzos isn’t usually easy. How do you cope with the near constant anxiety? These aren’t even panic attacks it’s more of just a constant unease, tension and worry. I know I have GAD and the benzos did a good job of covering that up for years and well now that I’m tapering I’m well aware how anxious I really am. I legit spend entire days just waiting to go to sleep because I can’t escape the anxiety. I’m still working part time, but that’s about it. I realize this anxiety has to be faced head on...I just don’t know where or how to start. It’s a major wake up call. What has helped you? This community has been a blessing I might add. I’ve gotten so much support and have met so many amazing people here that it helps me keep moving forward. Everyday, Thank You...",23,{},"{'label': 'positive', 'score': 0.5023355}"
2020-04-22 16:07:23,https://www.reddit.com/r/benzorecovery/comments/g68ce1/withdrawal_from_short_term_ativan_use/,Withdrawal from short term Ativan use,"Out of desperation I used Ativan for about a week to cope with my chronic neuropathic pain.

Something like:
Day 1 - 1mg

Day 2 and 3 - 1.5 mg

Day 4 - 2 mg

Day 5 - none

Day 6 - 2.5 mg

Day 7 - 2 mg

Day 8 - none

Day 9 - 1.5 mg

Aside from that I’ve used 1 mg on about 10 separate occasions over the last 3 years and about 6 years ago I used 1 mg per day for about 30 days.

I didn’t have any withdrawal symptoms after the 30 days of use, but it was before the injury that lead to the chronic pain.

After each of the single day 1mg doses, I felt mildly worse on the following day.

I’m 4 days past the week of use described above and feeling a lot of withdrawal effects. Pain increased from my already ridiculous baseline, muscle spasms ... just a generally extremely upset nervous system.

It’s probably impossible to give a certain answer but I was just wondering if anyone might take a guess at how many days of terribleness I should expect. Thanks.",3,{},"{'label': 'negative', 'score': 0.686748}"
2020-04-22 12:28:57,https://www.reddit.com/r/benzorecovery/comments/g649xf/looking_for_a_rehab_recommendation_no_insurance/,Looking for a rehab recommendation (no insurance),Asking for a friend with a heroin addiction. He has called everywhere and nobody takes his very bad insurance. He also has no financial means to pay out of pocket. He lives in Atlanta but would likely be willing to try for anywhere in the states. Sorry not the type of addiction this sub addresses but felt it might help to ask here anyway. Any lead would be appreciated.,4,{},"{'label': 'neutral', 'score': 0.45963672}"
2020-04-22 09:30:57,https://www.reddit.com/r/benzorecovery/comments/g615en/anxiety_natural_or_from_wd/,"Anxiety ""natural"" or from WD?","I have been eating Valium for 5 years. 2,5 years 2-3 days a week and the last 2,5 years daily. I ate 30mg/day for a year but last 2 years 15-20mg/day.

I quit in a month with fast tapering and took the last 2.5mg 3 weeks ago. Been amazingly okay but I have some weird anxiety in the background that makes it hard to speak with people sometimes. Also I have gotten back OCD (Pure-o) even not so much.

I know this is impossible to answer but it is likely this anxiety comes from the post WD, or might it be my natural anxiety? Other than this I feel nothing from the WD thanks to meditation and working out.",3,{},"{'label': 'neutral', 'score': 0.50646985}"
2020-04-22 00:13:56,https://www.reddit.com/r/benzorecovery/comments/g5ufs1/anyone_else_get_the_most_symptomatic_at_night/,Anyone else get the most symptomatic at night?,"I get depressed and anxious at night like clock work, even if I had a mostly unproblematic day. Does anyone else experience this? Would be interesting to know the science of it. Never experienced this pre-benzos/pre-WD",5,{'symptomatic': 1},"{'label': 'negative', 'score': 0.6295423}"
2020-04-21 21:41:40,https://www.reddit.com/r/benzorecovery/comments/g5safz/8_months_free_of_klonopin_the_most_difficult/,8 months free of Klonopin. The most difficult thing I’ve ever gone through.,"**Sorry if this seems dramatic. I promise I am doing way better now, and I’m just sharing my experience.**

I was prescribed Klonopin when I was 17 years old (I’m now 20) for generalized anxiety, OCD related behaviors, and body image issues. Good student, scholarships to various colleges, 4.2 GPA, but mentally very unwell and no friends because I was so anxious and depressed for most of middle and high school. I took Klonopin for more than 2 years (somewhere around 1-2 mg per day, it varied), and unlike what other people say about this being a miracle drug, it never really worked for me. I was still dysfunctional. Maybe because my anxiety was usually due to maladaptive thoughts stemming from abuse rather than a physiological fight or flight response/panic attack. 

2018-2019, I was dealing with a humiliating sexual experience at home. Basically involving my mom sharing nude photos of me with other family members, and me being continually shamed, which I still am to this day even though I never sleep around. And then I was raped. Even though it wasn’t my fault technically, I could have been more careful instead of stepping out when I was dissociating and super vulnerable.

A week after the rape, in sort of a manic frenzy, I took around 20 mg of Klonopin and a bit of wine. While I did not technically overdose, I was put in a mental hospital for 10 days and told that I couldn’t take Klonopin and stopped cold turkey, which I was initially fine with because I didn’t think I was addicted. But I was clearly addicted, as is almost everyone who takes this drug daily for more than just a few months.

I was put on an anti-seizure medication/mood stabilizer Depakote, which stopped me from dying, but didn’t stop the severe suicidal depression, dissociation (literally felt like I was walking in a brightly colored nightmare), strange moments of mania, almost daily panic attacks, joint/muscle issues from constant tense muscles, shaking (I had a hard time using a fork for the first 2.5 months), extreme weight loss, and even some early symptoms of paranoia/psychosis (I thought people could read my mind and spy on me sometimes, and I got scared that I had missing organs or appendicitis). I might have gotten seizures too? But I’m not sure. All I know is that for months I was constantly shaking and felt trapped in my own body and existence.

I also developed other symptoms after I stopped Klonopin, though I’m not sure if it’s because of withdrawals. Here are some of the weirder symptoms: bad acne (it got so bad I’m now on Accutane, and my normally drier normal skin became so oily my hair would be super greasy 4 hours after a shower), decreased cognitive function (I feel dumber), low appetite, TMJ disorders, muscle pains when exercising, **horrible nightmares**(I’m shaken up the next day, it’s often violent and traumatic), night sweating/stress sweating (I normally never sweat), and really bad involuntary twitching. My body is always super tense. **Also, really bad memory and derealization for some reason. Not sure if this is just part of my anxiety, or benzo withdrawals.**

I flew to a liberal arts college to start school a month after stopping Klonopin but I had to leave in a month due to my mental state. And return back to my parents

Luckily most of these symptoms have gotten quite a bit better, but I need to seek treatment for some of these physical symptoms that seemed to be triggered. However, my family will never forgive me. They think I faked my rape and suicide for attention or something. Still shame me for the very things that made me feel bad. They don’t even comprehend that I’m going through withdrawals, and when I tell them, they ignore me or tell them that it was my choice to tell the doctors I took too much Klonopin. The reason I’m going through all of this is due to me just being depressed, and being too sensitive. I told my mom she never cares about listening to my health issues even though she gets mad at me for not sharing, and she said “well you were mean to me in the hospital, even your aunt and cousins know your true side!” The reality is yes, I told her to leave, and I was reactive instead of staying calm, but I wasn’t even yelling, and it was because she said something very mean after I shared my assault 

It sounds so selfish, but I wish someone could understand.",44,{},"{'label': 'negative', 'score': 0.68381155}"
2020-04-21 20:49:45,https://www.reddit.com/r/benzorecovery/comments/g5ripg/i_jump_friday_and_im_worried/,I jump friday and im worried.,"I jump from 5mg librium (equals 2mg of valium), and im scared. My usage was for a year. Will it be really bad? I wont be dosing anymore so i wont feel like ill have any kind of crutch. Supplements to help me with this final stage? I started my taper at the end of august from 2mg of xanax. This sub has been an extreme help to me and I cannot thank everyone enough",4,{},"{'label': 'neutral', 'score': 0.39399195}"
2020-04-21 20:22:19,https://www.reddit.com/r/benzorecovery/comments/g5r3gu/drinking/,Drinking?,"hey family!

i have been feeling the quarantine blues lately and i just really want to have a glass of wine. im 5 months sober from my valium taper but about 2 months ago i tried drinking and got really anxious while the alcohol wore off. 

i come asking this! when did y’all notice that it was ok to drink again? im sort of twiddling my thumbs over this one trying to decide if i should test the waters or just wait it out. 

thanks for reading! let me know your experiences for sure!",3,{'quarantine': 1},"{'label': 'neutral', 'score': 0.5218012}"
2020-04-21 16:03:24,https://www.reddit.com/r/benzorecovery/comments/g5midl/can_you_get_withdrawal_symptoms_after_only_two/,"Can you get withdrawal symptoms after only two weeks of use, but on a very consistent and high dosage?","Long story short: I was taken to a psych ward after developing dpdr and psychosis from a joint. I'm not sure how much xanax I was given, but I know that I got a pill with every meal and all I could do was sleep and eat. Even my evaluation was cancelled because they couldn't wake me up.
They took me off the meds cold turkey and I had all the wd symptoms in the book but I keep wondering if it was actually withdrawal or an underlying condition. After a few days it got really bad and they put me back on a benzo.
So could it have been withdrawal or did that joint break me for good?",3,{},"{'label': 'negative', 'score': 0.81550837}"
2020-04-21 14:34:12,https://www.reddit.com/r/benzorecovery/comments/g5ksgp/what_if_i_add_20/,What if I..... add 20%,So I made a solution of diclaz... super strong.. like 20mg/ml. And I used it to get off Kratom.. I know kinda fucked up. Anyway long story short I was about 3/4 done with the bottle after about 1 week so I added more pg and tiny bit of vodka. Figuring I’m diluting the solution about 20%. Anyone done this before and just keep adding to ur already dosed bottle. Granted it’ll take forever but i don’t really care.  Fwiw I’m 10 days off Kratom and still feeling those wds.,0,{},"{'label': 'negative', 'score': 0.51269746}"
2020-04-21 14:30:27,https://www.reddit.com/r/benzorecovery/comments/g5kpx0/what_have_you_used_to_taper_from_benzos_when_was/,What have YOU used to taper from Benzos & when was your last dose?,"I was hoping that everyone could post what has been most useful for aiding Benzo tapering- supplements, activities, diet etc. 

Also, I am wondering how you know when to take your last dose? I have tapered to .25 mg of klonopin once a day (which is a quarter of a pill). Is there a certain dose at which you can stop taking it? I have been on it for over 2 years. I’m down to a low dose but I don’t know if it’s low enough for me to quit all together (or if I need to keep tapering). 
Thanks guys!",2,{},"{'label': 'neutral', 'score': 0.6332506}"
2020-04-21 13:22:58,https://www.reddit.com/r/benzorecovery/comments/g5jft9/im_like_scared_to_take_valium_instead_of_my_xanax/,I’m like scared to take Valium instead of my Xanax,"I want to taper and I have a 2mg Valium but I’m like scared to take it cuz Idk how my body is going to react. I posted a few weeks ago that a friend of mine had Valium and I was going to get 1 or 2 from him and was asking if this was a smart move to taper. Basically everyone said yes, however I still have not taken it. I’ll be okay right? Lmao idk why I just feel so hesitant to take this instead my daily dose of Xanax which is about 1mg but 0.25mg 4 times a day spread out",3,{},"{'label': 'neutral', 'score': 0.49410927}"
2020-04-21 09:47:48,https://www.reddit.com/r/benzorecovery/comments/g5firc/relapsed_after_5_months_off_benzos/,Relapsed after 5 months off benzos,"Things got too much.  Last night it was either exit this world, or take a benzo to go to sleep and numb the pain,

I figure I can get off benzos again further down the line, but exiting is rather more permanent.

Felt like I had no choice.

Things already got worse today - I've been trying to do some work via video, trying my best, and someone puts in a complaint about something I said.  My business is gone, financially ruined, struggling with opiate withdrawal, world and future gone to shit and someone chooses this time to stick the knife in.

So yes, I fucking took a benzo.  I'm going to try not to go down the slippery slope but you know how it is, I just want the anguish to stop, at least going back on benzos I have a possible future.

I hope everyone else is doing better than I am!",13,{},"{'label': 'negative', 'score': 0.87125605}"
2020-04-20 21:33:59,https://www.reddit.com/r/benzorecovery/comments/g55xd5/what_was_a_day_like_at_your_worst_point_during/,What was a day like at your WORST point during withdrawals?,Be detailed,8,{},"{'label': 'neutral', 'score': 0.49148014}"
2020-04-20 11:49:07,https://www.reddit.com/r/benzorecovery/comments/g4v7xq/my_wife_is_having_a_hard_time_after_stopping/,My wife is having a hard time after stopping taking 1 mg of clonazepam for 1 month. Will Librax help with her withdrawal effects?,"Her Dr prescribed her 1mg of clonazepam 1 a day for anxiety (covid related). He gave her 45 pills and she took as prescribed.

She stopped after a month and now she’s having withdrawals and I’m afraid of her getting a seizure (if she didn’t already got some)

How can I help?

She’s 25 170lbs and 5’6

Will she be ok if she quit cold turkey?

What about Librax to help her ease the withdrawal today?",11,{'covid': 1},"{'label': 'negative', 'score': 0.5641228}"
2020-04-20 05:27:54,https://www.reddit.com/r/benzorecovery/comments/g4poze/got_some_questions_before_doing_this_long_text/,Got some Questions before doing this… (Long text) Maybe dont read if u are easily triggered. Love u guys,"Hello Guys, 
this is my third attempt to taper myself down with Diazepam. First of all i dont get my benzos from a doc. Do you guys have any experience with getting help from doctors even though you are a ""criminal"" for getting benzos illegaly? 

I am using Benzos since the october of 2018, started with alprazolam 2-3 days a week (2mg) for my social anxiety and Depression (diagnosed). At the beginning of 2019 i decided to taper myself off with Diazepam (10Mg) but some stroke of fates f***** me over and i dropped my plans. 2 damn times within 5 Months... Now i am currently at 25mg of Diazepam (tappered down from 30mg) and got like 90 Diazepam pills left, this i my final attempt because i dont want to life like this anymore, even though the meds helped me. I dont want to Play the victim here, it was absoutly foolish from me to take these medications on a daily but now i want to break free from these chains. 

Going to a Hospital or rehab is not a option because a: Covid 19 and b: my mother is financilly depended on my money and on my help becuause she got cancer and diabetes, the docs told me she wont live that long anymore...i hate myself for being such a piece of shit at the end of her lifetime. My Father died as i was 9 years old and the rest of my Family is dead or dont want to see us. Sorry for being a whiny bi*** but i think thats important to notice because i got literally no support. 

So this is my plan: I want to cut 5 mg every week, i know this could be dangerous but i got no other Options. So i am asking you guys what helped you going trough the taper phase? 
I've got Phenibut, kratom, Magnesium and some stronger benzos for hard days (Meetings, Job interviews) 

I am 21 years old (male) Living in germany and no one knows about my addiction not even my mother or best friends(I got 3 of them). My ex used to know about my addictions but i left her at end of 2019 because i dont want her to be with a useless drug addict and she deserves better, she was okay with it, also i thought its better to battling this demon alone. 

Now 4 Months later i am beginning to realize how important it is to speak about my addiction but i got no balls to open up about this. Also i am about to graduate in 2 Months (wrting my finals in 2 weeks). I want to see a therapist after i graduate. My fear is that i wont get any help with my dirty past... also my mother would be so dissapointed in me for getting addicted to those meds. She always warned me that medications are sometimes dirtier than street drugs...should have taken this advice seriously. 

So to Keep it short: 
What helped you guys the most?
Is a detox Center necessary? 
Was the anxiety/Depression more of an agony after the withdrawal? 
Is it possible for me to enjoy things again after the wd's?

Thanks for everyone who is reading this i wish you all the best.",9,{'covid': 1},"{'label': 'negative', 'score': 0.79605913}"
2020-04-19 19:22:23,https://www.reddit.com/r/benzorecovery/comments/g4hpx0/after_quitting_benzos_how_easy_is_it_to_become/,"After quitting benzos, how easy is it to become re-addicted if u take Xanax every couple days?","I kicked xanax back in July and jus recently started playing with fire again when the whole quarantine plague started.
I take about 1mg every 2-3 days. Sometimes back to back. Sometimes longer breaks. 
I noticed the other day I felt like garbage. Couldn’t sit n watch tv. Just felt anxious and weird. 
Figured I’d try n c If it was benzo wd so I took 1mg. It didn’t stop my symptoms for a good 2-3 hours. 
Was the anxiety just in my head? Or should I stop taking em every so often. 
(Once a week too much?)",2,{'quarantine': 1},"{'label': 'negative', 'score': 0.7818076}"
2020-04-19 19:04:43,https://www.reddit.com/r/benzorecovery/comments/g4hfgo/constipation_as_a_wd_symptom/,Constipation as a wd symptom?,"Has anyone else experienced this?  I feel like when I try to stop it's a real struggle for me to shit, like my muscles and body are too tense to allow it.  Then I pop 1-2mg of Xanax and it just becomes way less of a struggle to push shit out.  I can deal with most other symptoms but this really bothers me.  Any suggestions, or people experiencing the same/similar symptom?",3,{},"{'label': 'negative', 'score': 0.88389236}"
