Date,URL,Title,Body,Score
2021-02-16 04:57:21,https://www.reddit.com/r/benzorecovery/comments/ll0oz8/still_feeling_off_2_years_after_quitting_is_my/,Still feeling off 2 years after quitting... is my brain permanently fried ?,"I was addicted for 4 years (only prescription Valium).  It took me 9 months of tapering to quit and it was the hardest thing I've ever done and I'm very proud of it.

However, even if I was expecting my brain would take a few months to regen, now it's been 2 years and I'm not improving anymore.  Some of the WD things have gotten much better or completely disappeared (photophobia, brain zaps, shaking and spasms, anxiety...) but I still feel completely off, disconnected from everything.  I zone out all the time, I'm not even thinking about anything, just staring at walls or anything that happens to be in front of me.  I'm too worried about it to drive. My attention span is bad but probably not worse than anyone in the smartphone-era, been working on it by practicing full consciousness, digital minimalism and playing instruments and it's kind of working.  But none of that helps the ""off"" feeling, light depersonalisation/derealisation...

I have been completely sober for 6 months (I was mostly doing weed and the occasional psychedelic) hoping it would make things better but lockdown and homeworking just made things much much worse.  I recently moved to the countryside because people don't care about the covid hysteria here and I feel like it's much better for my mental health.  Also I can do forest biking and stuff.  I really hope it will help.

I'm not feeling depressed or anxious, but it's starting to take a toll on me and I am increasingly worried the damages might be permanent...  if it doesn't improve by the end of 2021 I might actually get depressed.  I don't ever want to see psych again, they are the ones who made me go through this.

For the ones who quit a long time ago, can it still improve after a couple of years or am I permanently fucked ?",7
2021-02-16 03:12:54,https://www.reddit.com/r/benzorecovery/comments/lkzbq4/taper/,Taper,"Hi I recently started taking 40 mg of Valium a day after a traumatic incident in my life . 3 weeks in I realized I was making matters worse and felt like  I have a dependency . Has anyone got any advice of how to taper this medication . I did jump from 40mg to 2 mg which gave me serious withdrawal symptoms. I am currently still  down to 2mg for the last 5 days 
Any advice would be gratefully received as this past week has been hell",1
2021-02-16 02:57:49,https://www.reddit.com/r/benzorecovery/comments/lkz44a/valium_tapering/,Valium tapering,"Hi I recently started taking 40 mg of Valium a day after a traumatic incident in my life . 3 weeks in I realized I was making matters worse and felt like  I have a dependency . Has anyone got any advice of how to taper this medication . I did jump from 40mg to 2 mg which gave me serious withdrawal symptoms. I am currently still  down to 2mg for the last 5 days 
Any advice would be gratefully received as this past week has been hell",1
2021-02-16 02:54:06,https://www.reddit.com/r/benzorecovery/comments/lkz2fk/hi_i_recently_started_taking_40_mg_of_valium_a/,Hi I recently started taking 40 mg of Valium a day after a traumatic incident in my life . 3 weeks in I realized I was making matters worse and felt like I have a dependency . Has anyone got any advice of how to taper this medication . I did jump from 40mg to 2 mg which gave me serious withdrawal,,2
2021-02-15 21:42:05,https://i.redd.it/ua52x1n9xnh61.jpg,Js,,86
2021-02-15 20:31:38,https://www.reddit.com/r/benzorecovery/comments/lksidt/_/,!!!,Hi guys. I was on xanax for 7 weeks (first 2 weeks 1 mg daily ) 5 weeks 2mgs . Then went to a detox to try cold turkey but they insisted i take ativan . Not until yeasterday i decided to alleviate the symptoms and  they gave me attivan 1mg. It was my 4th day in detox and 7th day of last xanax use . Today they discharged me and said i was good to go . But i didnt feel so well. So today is basically 8 days off xanax but the gave me attivan yesterday. Does that change anything ?,1
2021-02-15 17:50:31,https://www.reddit.com/r/benzorecovery/comments/lkpdop/switching_to_valium_to_taper_have_you/,"Switching to Valium to taper, have you?","My psychiatrist and I decided that I’d switch from klonopin to Valium to start my taper. I’m on 1.5mg of klonopin so whatever that is equivalent to of Valium, I do not know how much of a cut we will be making to begin with, however we discussed going as slowly as I’m comfortable with, but not painfully slow. I did want to know if anyone has had a successful taper this way. I am slightly worried my body will be all confused switching completely from klonopin to Valium. 


Thanks everyone 🙏",0
2021-02-15 16:55:42,https://www.reddit.com/r/benzorecovery/comments/lko8ah/occasional_binge_withdraw_question/,Occasional binge withdraw question,"I have written in here before, grateful for all your love and input.

Anyway I’ve been prescribed 14 mg clonazapam a month for the last year and a half or so, and I’ve been keeping a secret. I blow through the whole supply in 2 or 3 days, and do not have any more clon until the next month refil. During this time I have not had any real withdrawal symptoms but I am always afraid that “this will be the month” that withdrawals kick in.

I have decided to stop this nonsense and am wondering, should/can I expect to be okay after this latest binge? Haven’t had any clonazapam in 3 days now and feel fine. Logically I know I will be okay, as this sad pattern has repeated itself for a while and I am always fine, but I am just filled with so much guilt about it all. I’m young very active, have a good mind and a great life and have no reason to use benzos, aside from being an addict. They are just so insidious in that in a few weeks time I know my viewpoint will change. 

Any input would be appreciated. Thanks for taking time to read this. 😌",1
2021-02-15 16:37:14,https://www.reddit.com/r/benzorecovery/comments/lknu5l/taper_cycle_messed_up_by_taking_more_clonazepam/,Taper Cycle messed up by taking more clonazepam today?,"I have been tapering .25 off of my total 1mg per day prescription of clonazepam (2 x 0.5mg per day, a prescription which began in august of 2020) for the last couple of weeks and it seemed to be going okay. But today I basically took a total of 2mg over 3 or 4 hours because i was super anxious. 

To be more clear, I have been taking 0.75mg max per day instead of 1mg for the last couple of weeks, then today took 2mg. 

Did I just undo all the progress I have been making?",3
2021-02-15 15:34:10,https://www.reddit.com/r/benzorecovery/comments/lkmgwk/gait_issues/,Gait issues,Anyone else have balance or gait issues? I feel like the ground is moving beneath me. I'm wobbly and I feel everything is spinning. It comes and goes throughout the day.,1
2021-02-15 15:20:13,https://www.reddit.com/r/benzorecovery/comments/lkm5v2/you_can_get_through_this/,you can get through this.,"just a post for some positive affirmations 
remember why you started this journey
things will get better
you will heal
this will all be worth it
you can do this, i believe in you.",30
2021-02-15 14:40:43,https://www.reddit.com/r/benzorecovery/comments/lkla8u/tapering_low_dose_but_looooong_use_clonazepam/,Tapering low dose but looooong use clonazepam,"I’ve taken .5 clonazepam as needed for over 15 years. Sometimes I’ve taken it everyday for weeks at a time then not again for weeks or months. I honestly don’t know if I’ve ever experienced intra-dose withdrawal or not. Lately I’ve been taking it 3 or 4 times a week due to lockdown anxiety and other major-league anxiety inducing things. I would like to get off this stuff for good once and for all. Would Ashton be the way to go here, despite the relatively low dose? Thanks for any advice.",3
2021-02-15 12:49:08,https://www.reddit.com/r/benzorecovery/comments/lkiu0y/one_simple_trick_helped_with_insomnia/,One simple trick helped with insomnia,"Just thought I would share this here in case it’s helpful to anyone else who has the same symptoms as me waking up in agony with your muscles taut and twitching. That similar feeling you get when you wake up having missed a dose of methadone/any other opioid where you are in so much pain that you can’t sleep more than about 4 hours because the last few hours are so physically painful that they wake you up kicking and screaming.

Everyone will probably think I’m a huge idiot and wonder why I didn’t do this sooner but I switched my daily diazepam taper dose from 7pm (which I thought was late enough) to 10-11pm. 

I have an incredibly fast metabolism and drugs that are supposed to last 24 hours will last more like 12 hours in me. Just making that one small change has made so much difference to how much sleep I can get, how I feel in the morning when I wake up, how I feel for the rest of the day. I can only imagine it would be even more important with shorter half-life benzos. Noradrenaline naturally spikes in the morning so having something still in my system to cover that time of day really makes a huge difference to me.

There is such a huge night and day difference that I’m confident it’s not placebo or just a wave of less negative symptoms so I’m leaving this here in case it helps anyone else with a fast metabolism who is struggling with the same issue.",1
2021-02-15 12:29:56,https://www.reddit.com/r/benzorecovery/comments/lkif1e/tripped_up_on_my_taper/,Tripped up on my taper,"Hey guys so I was doing really good on my taper, down to .08mg of Xanax a day. But I just got started on low dose vyvanse for adhd, and I took my first dose yesterday. I literally slept maybe an hour last night (after having two nights before that with little sleep due to my Xanax dose decrease a few days prior). Anyway I felt like I needed SOME sleep to be okay so I ended up taking .5mg Xanax today. It honestly didn’t even help me sleep so was pointless. I was totally able to fall asleep while the vyvanse was in my system but once it wore off I woke up and couldn’t go back to sleep. I feel bad I’m honestly just thinking about jumping now off the Xanax since I was down to such a low dose. At least give my self several days without it and see how I feel. 🤦🏻‍♀️",0
2021-02-15 11:31:32,https://www.reddit.com/r/benzorecovery/comments/lkh5vg/how_to_curb_the_craving/,How to curb the craving?,"I’m at a point right now where I’m not physically dependent, but I’m mentally getting there. At first I was taking etizolam only once to twice a week. Now I’m getting up for 4 days a week. And then on the off days my anxiety is so strong. 

This weekend my plan was to take Friday morning and not take any the rest of the weekend until that failed yesterday and took like 8mg etizolam all through the day. 

It sucks because I’ll wake up and swear I won’t take it but then the anxiety starts getting to me and I say “ok I’ll take it now but tomorrow won’t” and so on an so forth.

Is there anyway to help with that anxiety to not take them constantly? It’s truly sad, benzos make me feel so perfect and that’s the life I want to live but I know damn well it’s also making it a very difficult life",1
2021-02-15 11:16:44,https://www.reddit.com/r/benzorecovery/comments/lkguve/doc_wont_renew_my_ativan_prescription/,Doc won’t renew my Ativan prescription,I have been on Ativan for 9 weeks. My doc won’t renew my prescription. I take .75 mg a day. I have 3 pills of 1mg left. He only gave me 8 .25mg to taper off. I don’t want to CT. Suggestions?,3
2021-02-15 09:28:28,https://www.reddit.com/r/benzorecovery/comments/lkepzg/international_directory_of_benzoaware_doctors/,International Directory of Benzo-Aware Doctors,"Hello everyone. 

I am not sure if it was on this sub or another one, but I once found a link someone posted where you could search for Dr.’s in the USA that are knowledgeable about tapering benzo usage and are willing to prescribe treatment plans to taper down. I remember you could search for doctor’s by state. Just curious, does anyone here have that resource? It would be much appreciated. Thank you 🙏",28
2021-02-15 05:28:29,https://www.reddit.com/r/benzorecovery/comments/lkazft/question_regarding_tapering_from_lorezapam/,Question regarding Tapering from lorezapam,I have been taking .5mg lorezapam for the last 3 weeks. I was taking 1mg for a week before that . What will be the best way for me to taper down and stop.,1
2021-02-15 03:36:50,https://www.reddit.com/r/benzorecovery/comments/lk9fzz/please_help_me_brothers_relapse/,Please help me brothers (relapse),"🆘Please help🆘

just a post to get some advice of my good ol fellow junkies. so to start off ive been using benzos and opiated for 5years straight. ( for the information, i just turned 18 so im pretty young )I went to a detox in last year, was there for 10weeks. My tolerance was that high that it took 8 weeks to get off benzos and opiates. After going trough that missery i said to myself: Now i am really done with it! ( yeah sure...) so full of confidience, feeling better, sitting on my pink cloud thinking i can do everything now im clean. I come up with the amazing idea that while im still in a clinic when i turn 18 i can still use that last time to close this chapter. 

Long story short got a urine screening they caught me with almost everything possible and sent me away to another rehab in africa for 2months. I am homeless, broke and broken at this point, already failed in my eyes with the relapse and this is my last change, last one to fix the trust and pain with my loved ones. Here i really try my best, follow the program, try to change my people places things and thinking patterns etc.
I attend to meeting, do my stepwork and i try to talk to people with a long clean time to see what life is like.

Okayyy, Here is the part i want advice for:

As im sitting here i am in a safehouse with screenings every week. I am on anti depressants and i start feeling better time by time. Problem is lack of motivation. im already sick and tired of life and it didnt even start yet. So i am here sober for 4months now trying to find a life worth living, and if i trust the people around me life will get better, but for me it doesnt the only thing that changed is that now i can feel things again ive always pushes away.

I gave up last night and ordered benzos, opiates and smoked some cannabis yesterday night.

i can start counting again with clean time but i feel just like giving up. Because why working for a life that i am not going to like. Please help me i am desperate and dont know what i can do.

Should I just accept what i did and use again(what i want) and try to quit when i am older or just try again and again untill i see things slightly changing and hoping that that will bring external factors in my life that will motivate me?


I really hope someone can help me or just lift me up or give advice

thanks",0
2021-02-15 01:31:01,https://www.reddit.com/r/benzorecovery/comments/lk7mvh/hydroxyzine_and_benadryl_taken_together/,Hydroxyzine and Benadryl taken together,"Hey guys, I couldn’t find another group where I thought I could get an answer to my question so I decided to come here. I’ve been off klonopin since Dec 23 and I’ve been prescribed hydroxyzine, trazodone, and melatonin so I can sleep. I haven’t been able to at all and it’s been 60 hours since I have slept. I was wondering if it would be safe for me to add Benadryl to my sleep medication cocktail?",3
2021-02-14 22:01:42,https://www.reddit.com/r/benzorecovery/comments/lk456c/benzo_tolerance/,Benzo Tolerance,"Hey all. I have been on ativan for about 14 months now. the same low consistent dose of .5-.75mg daily. it is getting to the point where the past few weeks i’ve been experiencing worse anxiety than before. its actually beginning to get in the way of my day to day life. i am wondering if this is due to building up a tolerance by now? is there any way the ativan could be making my anxiety worse at this point instead of better? is that even a thing? i don’t think my psych is keen on increasing my dose, so i may just opt to start getting off of it all together if it’s not doing anything for me anymore. any feedback?",1
2021-02-14 21:57:19,https://www.reddit.com/r/benzorecovery/comments/lk42e2/need_to_vent/,Need to vent,Hey guys. So I’m just here to vent.. I’m going on 3 months since I jumped. I jumped from 0.125mg of k and I felt pretty good the first 2-3weeks. But now it’s already 2 1/2 months and every day I wake up I just want to cry. I can literally sit and stare off into space for HOURS. I’ll stare off and then look at the oven clock and hours have pasted. I’ve gained a little of my energy back. But I always have that rock feeling in my throat like I just need to burst out into tears. (I am currently) but sometimes I don’t know what I’m crying over. Other times it’s because I’m so scared about my life making these big changes. Some days are good. I listen to music and sing out loud and dance. But they are only short lived. And then I’m right back in bed or on the couch just in silence sometimes. My decision making is so bad. I can’t even decide what I want to eat. And I’ll eventually lose my appetite. Nothing sounds appealing... idk I know I’m still healing but apart of my brain tells myself I’m going to feel this way forever... I just need to let it out I guess. Sometimes it feels good to cry.. thanks for listening guys ❤️✌🏼,9
2021-02-14 21:39:11,https://www.reddit.com/r/benzorecovery/comments/lk3qxf/recovery_and_death/,Recovery and death...,I've been clean off benzos for about 2 years now but my brother shot himself in the face and I can't take it so I'm going to get put on klonopin I honestly don't know what else to do man shit got me fucked up.,6
2021-02-14 20:48:13,https://www.reddit.com/r/benzorecovery/comments/lk2t2j/i_messed_up_my_brain/,I messed up my brain,After 10 years of abusing benzodiazepines I finally have just over a month of sobriety. I tapered too quickly in the beginning and ended up having a seizure. I lost my license and now have something called jme or Juvenile myoclonic epilepsy. They said it was expressed from the withdrawal but I can’t help but feel it’s from abusing drugs for so long. My doctors say if I relapse it could mean death from a possible seizure. I hate myself that I did this. I have neuropathy and still trying to find medication that will help it. Don’t taper too fast guys.,27
2021-02-14 11:31:37,https://www.reddit.com/r/benzorecovery/comments/ljrmam/4_months_of_klonopin_and_15_years_of_zopiclone/,4 months of klonopin and 1.5 years of zopiclone and sporadic benzo use prior to that. Need to taper with what I have left.,"Hello everyone.

For the last 4 months I have been taking klonopin, doses varying from 0.5 to 2mg every other day. Occasionally I've taken them for a week straight and then gone back to every other day usage. During these 4 months I've also consumed about 30 ambien and 50 zopiclone (when not using benzos I barely have to use z-analogues, but somehow putting general sedatives in my body ocassionally worsens my insomnia that comes and goes, not to mention that klonopin skyrocketed my tolerance to zopiclone).  
  

I have logged every single benzo intake and calculating the average, meaning: amount consumed in milligrams / days = 1.1 mg per day. Prior to this benzo binge I have been taking about 3-5 zopiclone pills a week for the last year and a half and I have no idea if this will come into play during my coming withdrawal. The last two years I have also consumed benzos every now and then. Like 20mg of xanax over the course of a few weeks. Nothing for half a year then 20mg xanax over the course of a few weeks again.  
  

I started a taper two months ago but after a sibling tried to commit suicide I went right back on the benzos, fast forward two months and I started another taper and guess what, another major traumatical incident happened. So yesterday I relapsed and  popped 30 mg of diazepam and 4 mg of klonopin. I am still  heavily feeling the effect of those so I apologize for any spelling errors and general confusion.
The decision to relapse is entirely on me and I need to find other ways to cope with life when sad things happen. Apart from general anxiety and sleeping problems I also believe another reason for me popping pills is because of loneliness.  
  

Before yesterday (relapse) my schedule looked like this:  

day 1-5: 0.25mg klonopin and 7.5mg diazepam  


day6: relapse, 4mg klonopin and 30mg diazepam  
  

All I have left now is 120mg diazepam (12*10mg)
How would I best taper with what I have left? Considering what I consumed yesterday I believe I won't have to take any diazepam for at least 2-3 days.  
  

I am also wondering about supplements, should I just ditch things like NAC, L-theanine and ashwaganda? I read mixed stories about those, for some it helps and for some it just makes things worse.
Agmatine Sulplhate is another supplement that seems very interesting that I would like to give a try.  
  

I am also interested in nootropics for restoring brain function, when should I introduce those? During my taper or after completing it? I'm talking about subtle ones, not things that get you high or have a major psychoactive effect.



Wow this text looks way more messy compared to how I structured it when I wrote it. But anyway.  
 
TLDR:  
4 months of klonopin, averaging 1.1mg a day, sporadic benzo and zopiclone use 1.5 year prior to that.
How do I taper best with the 12*10mg diazepam pills I have left?",1
2021-02-14 08:42:46,https://www.reddit.com/r/benzorecovery/comments/ljolol/30_days_taking_25mg_xanex/,30 days taking .25mg xanex,"So was recently rx’ed xanex to aid in detoxing from kratom. I’d been taking kratom for a about 2 years until I started experiencing panic attacks after dosing with kratom, so I decided to quit. I was prescribed.5 once a day for sleep and panic attacks while detoxing but felt I got great relief from just half a pill, so I’ve only been taking half once a day. I’ve even skipped a few days in the last week if I felt I could sleep without them. I’m 30 days kratom free and most wd symptoms have died down except the restlessness and insomnia at night. I’ve never been dependent on any benzos before, but my question is, will I experience withdrawal symptoms from the xanex at this point? I really just want to know what to expect. Any opinions are greatly appreciated!",0
2021-02-14 07:02:56,https://www.reddit.com/r/benzorecovery/comments/ljn78a/relapse_question_during_taper/,Relapse question during taper.,"Hi guys,

Hope everyone is good.


So basically I managed to taper over months down to 5mg of Valium, 3 times a day.  My extreme anxiety, paranoia,  depression and derealisation was pretty bad but the physical symptoms of nausea, headaches etc were slowly passing.


I was on the 5mg for a few days Then I decided to try jump down to 2.5mg and it was sheer hell. I couldn’t function at all and had extreme symptoms. 


I knew I had reduced too quickly from 10mg to 5mg to 2.5mg all in the space of about 2 weeks. I couldn’t stand it and I regrettably relapsed yesterday taking about 30-50mg and this morning 50mg. 

I’m not planning on continuing the relapse but my question is, will this relapse put me back to square one? Have I ruined the taper and need to start again? 


I’ve gotten my partner to hide the tablets and only give me them when needed but I found them yesterday which led to the relapse.


Any comments would be appreciated.",5
2021-02-14 06:59:09,https://i.redd.it/xv4htvwenfh61.jpg,CBD oil to help addiction plus more,,0
2021-02-14 06:34:30,/r/Drugs/comments/ljmtoh/is_my_friend_at_risk_of_benzoxanax/,Please help if you can,,0
