,Date,URL,Title,Body,Score,COVID-19 Mentions
326,2021-05-08 23:04:39,https://www.reddit.com/r/benzorecovery/comments/n8504r/i_told_my_psychiatrist_that_i_was_becoming/,"I told my psychiatrist that I was becoming addicted to benzos, and he suggested I take more.","I don’t know if this is an appropriate place to post this so I apologize in advance if it’s not. I was prescribed lorazepam (among others, but this was my preferred benzo) about a year ago and have only really ever taken it as needed. I know that when I take it, there’s a greater possibility that I’ll keep taking it because just one dose is enough for me to want more. I go through phases where I take regularly for periods of time, convince myself I need to stop, and so I do. 

Well, lately, it has become hard to stop. I am taking more regularly than usual, I am taking more than prescribed, because the come down is so intense that I feel absolutely compelled to take the perfect amount that will numb me and put me to sleep for a while so that the suicidal thoughts will go away. 

Anyway, I explained to my doctor that I was really concerned with what was happening to me. Addiction runs in my family, and I can feel myself becoming desperate for the next dose everyday. I told him that I’ll have an episode, pop a benzo to sleep and the next day will be a good day. Mania almost, more productive and happier than usual... until the come down. The come down takes me lower than depression ever could. I absolutely lose all stability, at the blink of an eye I go from being perfectly fine to wanting to end my life. The only relief is a benzo; the never ending cycle. 

So to put an end to this repetitive withdrawal I’ve been enduring, my doctor suggested that I just take it every single day. After explaining my fears, my reasoning for wanting to stop, he insisted that since I have some good moments on benzos then I should just take regularly instead (of as needed or coming off completely), this way I will avoid the withdrawal completely. 

Now, do I plan on following his recommendations? Not really, no. But do I have the strength to withdrawal? I’m not entirely sure but I’m afraid of what’s becoming of me and what will happen if I don’t. 

If you’ve read this far, thank you. Any advice or support is appreciated. 

TL;DR: I told my doctor that I was becoming addicted to benzos (that I was originally taking as needed) and that the come downs were causing extreme suicidal ideation (causing me to need to take more regularly because benzos are the only thing to stop the thoughts and control the emotions), and his solution was to just take it every day instead of as needed to avoid the come down. You can’t experience withdrawal symptoms if you never come off.",8,0
327,2021-05-08 21:41:19,https://i.redd.it/wor3ntgr10y61.jpg,Something helpful,,6,0
328,2021-05-08 21:24:13,https://www.reddit.com/r/benzorecovery/comments/n83b32/successful_benzo_recovery/,Successful benzo recovery???,Anyone here have any successful benzo tapers with small to no with-drawls! I really need some motivation and help Rn!,1,0
329,2021-05-08 21:05:10,https://www.reddit.com/r/benzorecovery/comments/n82zg5/ativan_taperhelp_please/,Ativan taper—HELP PLEASE,"I was originally on 4mg Ativan and tapered down to 3 during the month of April. I just started a slower taper 2 weeks ago because I was feeling tolerance withdrawal at 3mg. I went down 5% the first week and did ok overall, so I went down another 5% this week, and it has not gone so well. I was ok the first 2 days, then the rest of the week has gotten progressively worse day by day. Today I basically felt like I didn’t even take any, the withdrawals are so bad. I definitely have interdose withdrawal as well, even though I’m dosing 4 times a day. I’m starting to think my body is metabolizing it too quickly or something. So here’s my question: should I switch to a longer acting benzo? I attempted diazepam at one point, but my body metabolized it too quickly. What other longer-acting benzos can I try? I’ve heard clonazepam is the worst to come off of, so what other options do I have??",2,0
330,2021-05-08 19:24:02,https://www.reddit.com/r/benzorecovery/comments/n815ar/hope_for_those_of_you_in_the_thick_of_it/,Hope for those of you in the thick of it!,Hey all I just wanted to give y’all an update on how I’m doing and to let you know not everyone’s withdrawal is a horror story. After about a 3 month taper I’ve been off Xanax for about 2 months. I then started tapering off ambien and have been off that for almost 2 weeks. I’m still on kratom but down to 2gpd and trying to work on that. However I’m completely free from benzos and I don’t appear to have any post acute withdrawal or any negative effects whatsoever. I feel fine. The only residual symptom I have is internal shakes when the washer is running lol. But anyways y’all can do this and it’s not horrible for everyone! Stay strong!,22,0
331,2021-05-08 17:28:11,https://www.reddit.com/r/benzorecovery/comments/n7yxiw/i_am_really_considering_updosing_until_i_feel_good/,I am really considering updosing until I feel good,"And then do a slow taper like 5% to 10% each 2 weeks or more.

I've been thinking about this for a long time. I am more than 3 months holding 2.5mg of V and still get easily burnt out: not too much stimuli leads me to a sensation of overheating in my right temple, I feeling some a part frying inside. It's horrible and once it starts I have to stop working or doing anything. I have to eat and do nothing and wait a lot. Almost everyday I am laying down in my bed during more than one hour suffering.

It's bad, I can't even play chill games like Stardew Valley, even tv shows might lead me to this state. I am barely living and I am holding my V for too much time and it doesn't stabilize.

Two days ago I had this presentation on the end of the day that I kept talking and explaining stuff till the end and felt really bad after it: I am still feeling bad due to it two days later.

This makes me wonder about two things:

* I am tired of not being able to work in a job I like, I am tired of making my parents worried and I am tired of suffering almost every day. I am really considering updosing until I feel fine and leave this taper to my future self in a more conservative way. I could enjoy the youth I still have a bit more then;

* With this burnout episodes I am wondering if they are somewhat related to glutamate storm or excitotoxicity and it makes me wonder if these episodes and this stress might be more nocive than the benzos themselves. So, maybe updosing is not only good for my short term confort but also for the health of my brain in general.

I am considering trying 5mg, 7.5mg or even 10mg. I don't care, I just want to stop this horrible symptoms and make my life much more liveable.

Any success stories adopting this strategy?

One more thing: I take 125mg of sertraline daily.",2,0
332,2021-05-08 17:17:44,https://www.reddit.com/r/benzorecovery/comments/n7yq8v/flashes_of_depression_with_slow_benzo_taper/,Flashes of depression with slow benzo taper?,"I’m coming off seven years of benzodiazepines with diazepam.  My doc is cautious and willing to work with me at my pace.  I just know I want to keep going.

My problem is that the Valium is making me depressed.  I get flashes of really powerful depression that won’t go away.  I’ve tried sleeping it away, hydrating, eating differently.  Anyone else has this reaction?",4,0
333,2021-05-08 15:59:08,https://www.reddit.com/r/benzorecovery/comments/n7x6dv/so_frustrated_with_myself_could_not_make_the_jump/,"So frustrated with myself, could not make the jump because I'm a coward",Pretty much what the title states. I've already tapered off to a nonexistant dose and was planning on jumping Thursday but I couldn't. Instead I just made a huge cut. I wish I had more courage. I don't get how I made it through such awful symptoms but now have no conviction or strength left to face what will come. What is wrong with me,10,0
334,2021-05-08 14:53:36,https://www.reddit.com/r/benzorecovery/comments/n7vv0t/i_feel_so_off_when_i_wake_up/,I feel so off when I wake up,I only feel halfway normal after I take 1 mg ativan. Don't use any more the rest of the day but then get anxious and irritated in the afternoon and evening. I wish this wasn't the only thing that makes me feel back to being normal. I can't get to work and mostly not out of bed. Think my lexapro isn't working anymore and tired of not feeling like myself. Worst 2021.,3,0
335,2021-05-08 14:13:05,https://www.reddit.com/r/benzorecovery/comments/n7v0oe/relapse_withdrawal/,Relapse withdrawal.,I was on klonopin .25-.5 daily for many years.    Successful taper last summer.    Recent relapse of about 45 days same dose and now 9 days off.    Some pretty bad withdrawals this time that I didn’t expect.  Is this normal.   Body aches really bad.   Thanks,1,0
336,2021-05-08 14:05:53,https://www.reddit.com/r/benzorecovery/comments/n7uvak/best_cbd_oil_for_aiding_recovery/,Best CBD oil for aiding recovery?,"Really struggling right now, and as a non-weed smoker (THC makes me paranoid and anxious to the point I can't handle it) I have always been apprehensive about using CBD oils, but I have found a lot of people praising CBD here. 

So can anyone point me in the right direction? Best brands, dosages, whether this is the right route for me to go down, etc?

Thanks",5,0
337,2021-05-08 12:47:39,https://www.reddit.com/r/benzorecovery/comments/n7t8lv/i_recently_found_out_about_endozepines_these_are/,I recently found out about endozepines. These are the natural chemicals that fit into the slots benzos do. Gene therapy increasing natural endozepines might be the long term solution.,[endozepine](https://medical-dictionary.thefreedictionary.com/endozepine),23,0
338,2021-05-08 11:11:49,https://www.reddit.com/r/benzorecovery/comments/n7r90n/would_you_guys_advise_seeing_a_doctor_or_am_i/,would you guys advise seeing a doctor or am I overreacting? Ativan 3mg a day for 2 months (rest in desc),"I post here quite often, funny enough id thought id just be checking back on other people since its been 7 months almost now but I am still here for myself just as much as checking on others I follow. Anyways it felt like things were mildly better, all the usual dizziness, off balance feeling, high anxiety, bad memory and fog, mild muscle flutters/cramps, high heart rate, list goes on. They seemed to be down to  a more tolerable level but it seems like everyday this past week things keep feeling worse when I wake up, today I am much much more off balance then I have typically been and I feel scared to walk, my body also feels quite light and I feel stimmed out feeling has came back stronger again, and my heart rate spiked a couple times to like 150 these past few days, do you guys think this is still related to benzos or maybe something serious? I am kept calm with a lot of cbd my anxiety so im trying to not panic about this and make things worse. but its been quite hard to get out of bed I feel like im falling on my face",2,0
339,2021-05-08 10:11:03,https://www.reddit.com/r/benzorecovery/comments/n7q1i5/finally_down_to_1mg_diazepam_daily_debating/,"Finally down to 1mg diazepam daily, debating either jumping off or doing 7 days at 0.5mg and then jumping, do you think going to 0.5mg is overkill?",,19,0
340,2021-05-08 08:47:26,https://i.redd.it/esrhk4uo7wx61.jpg,Went to detox for benzodiazepines and alcohol but they didn’t realize how high my tolerance was. They were giving me the max dosage they were allowed to but it wasn’t enough. So I ended up leaving.,,4,0
341,2021-05-07 23:55:27,https://www.reddit.com/r/benzorecovery/comments/n7gpkh/when_did_people_start_being_able_to_tolerate/,When did people start being able to tolerate alcohol (in a healthy way of able),"Is this an obtainable goal for anyone post benzo withdrawal? If so, how often and at what stage in recovery?",4,0
342,2021-05-07 23:44:27,https://www.reddit.com/r/benzorecovery/comments/n7gj05/gabapentin_yes_or_no/,Gabapentin yes or no?,Jumping this weekend after 13 years of use. Been on klonopin 1 mg at night. Tapered down to .015 mg over the course of 15 months. Should I try to tough it out or use the gabapentin for the first month ? What are your experiences with it. I’m scared.,3,0
343,2021-05-07 20:46:47,https://www.reddit.com/r/benzorecovery/comments/n7dh9r/the_best_antidepressant_for_withdrawal/,the best antidepressant for withdrawal,,3,0
344,2021-05-07 20:01:08,https://www.reddit.com/r/benzorecovery/comments/n7cnnc/can_i_taper_with_clonazepam/,can i taper with clonazepam?,i cant have access to other benzo,2,0
345,2021-05-07 19:17:08,https://www.reddit.com/r/benzorecovery/comments/n7bsxv/yesterdays_10_cut_every_2_weeks_per_ashton_is/,Yesterday’s 10% cut (every 2 weeks per Ashton) is brutal.,"Am really losing it today...super bad wave of anxiety, fear, depression, severe brain fog, neck pain etc. down to about .35mg clonazepam. Feel like I need to try something anything to ease the agony. But the options left are not good ones. Already exercised today for over an hour, drank a bunch of water, etc. I need inspiration.",3,0
346,2021-05-07 17:51:18,https://www.reddit.com/r/benzorecovery/comments/n7a01k/my_taper_has_finally_ended_1053_days/,my taper has finally ended 1053 days,"I finally jumped off Klonopin, got it down to 0.010mg's  basically 1/50th of a 0.5 mg pill,  the symptoms have been rough, though better today than Wednesday , its done!!!  started June 18th 2018 , ended May 4th 2021",82,0
347,2021-05-07 17:33:11,https://www.reddit.com/r/benzorecovery/comments/n79lqv/what_do_benzos_mean_to_you/,What do benzo's mean to you?,What do we look for in benzo's we just can't get from (sober) life?,0,0
348,2021-05-07 15:45:55,https://www.reddit.com/r/benzorecovery/comments/n775j0/tapering_xanax/,Tapering xanax,"So ive been using xanax for roughly 1 month and a half, maybe a little bit more, started with 0.5mg (even though I probably needed less than that from start), went down to 0.25 for a couple weeks and then 0.125 for another week, been taking 0.0625* the last 3 days, should I just make the jump now or wait a couple more days? My main concern is dealing with insomnia ( I actually started taking xanax because I couldnt sleep during a major crisis after breaking up)",2,0
349,2021-05-07 15:07:27,https://www.reddit.com/r/benzorecovery/comments/n769ga/what_works_for_you_to_take_the_edge_off/,What works for you to take the edge off?,"So today was quite tough. No extreme symptoms but was feeling very uneasy the whole day and couldn't shake it off. Kind of like a dark cloud hovering which makes it hard to enjoy things and almost makes you hide from everyone and everything lol. 

So what works for you to relax and take that edge off?

PS. Jumped from 1mg diazepam 2 days ago.",15,0
350,2021-05-07 14:11:42,https://www.reddit.com/r/benzorecovery/comments/n74yoe/off_alprazolam_xanax/,Off Alprazolam (Xanax),"I’ve always used either alcohol or opioids to manage my anxiety. Alcohol got out of order so focused on low dose opioids (codeine at 120mgs per day) opiates worked like a dream. Then I moved and new doctor will only prescribe tiny doses of any opioid. But happily prescribes Alprazolam. Stupidly I started on 0.5mg twice per day on 2nd February. Stopped after tapering down to 0.25mg once per day on Wednesday. So, on day 3 now.",2,0
351,2021-05-07 13:19:36,https://www.reddit.com/r/benzorecovery/comments/n73r68/when_does_it_get_better/,When does it get better?,I’m trying to be as patient as I can but I need to start moving on with my life. I’m 60 days off of a cold turkey (1-2 mg klonopin for 3 years) and I still have a ringing in my ears and brain. Mostly when I go to bed and wake up in the morning. I just feel like crap in the mornings too and I am extremely moody all the time when I never have been before. Is this considered PAWS? It feels like I’m still in acute withdrawal. I thought things would be significantly better at the 60 day mark but I’m not feeling that great. Anyone cold turkey and feel back to 100%?,6,0
352,2021-05-07 12:05:45,https://youdeservetoheal.com/so-you-have-complex-ptsd-now-what-6-steps/,"So You Have Complex PTSD, Now What-6 Steps",,0,0
353,2021-05-07 10:11:04,https://www.reddit.com/r/benzorecovery/comments/n6zems/unsupportive_friends/,Unsupportive “friends”,"OK so I just have to vent and I don’t have many people to talk to about this. I’m currently with my partner who is dependent on benzos and attempting to taper off (he’s had a few relapses). He has a dependency on them and it’s been a journey understanding the specific issues and behavior changes with this drug. I grew up around alcoholics and it’s similar but different if that makes any sense. I’m also learning that addiction is never a moral failing, although it causes harm, ultimately it’s the addicts journey through what usually begins as self medicating and then goes downhill. The addiction becomes centralized and the original issue that caused a need for self medication gets pushed in the shadows. It’s just so frustrating and sad at times. It’s been a rough road but in understanding he just can’t quit cold turkey has opened me up to being more compassionate and supportive, because demanding he quit has only caused him to relapse bc he tries to taper too fast to appease me. So I had to change some things too in the process bc I don’t want him to hurt himself trying to get off them too fast and also want him to get off them successfully and heal. Obviously, my past approach of demanding he get clean this has caused major issues that just snow ball. So I am grateful for this forum bc I’m learning so much and just needed a space to vent. 

Anyways, I opened up to a friend about it because she kind of figured something was going on. He and I both went to her house and she could tell he was under the influence and so the next time I went over she asked me not to bring him. Which is understandable because she seemed somewhat triggered as she herself has had problems with opiates and benzo‘s in the past and is currently on a prescription for Klonopin although she denies abusing it I have a feeling that in the past she has. So when she asked me what was going on and I explained his situation and how he’s committed to tapering off and getting clean. She was reluctantly positive about this news (although it’s a huge step for him to commit to this process fully) and generally was pretty unsupportive of it just because she felt like I was taking on too much of his burdens and generally being mistreated by him. Which of course he has messed up and made mistakes but once I started doing my research and realize that what the benzos do and how they change someone behavior and personality. I am realizing that a lot of the behavior was because of the drugs and  not bc he’s a bad person, he really is amazing when he’s sober. When I realized that I told him I would would you be open to helping him get clean if he committed to it, which he is. Where as before I would just argue with him which is impossible when someone is high off benzos. 

Although I was honest with her about what was going on and expressed to her my own process and what I’ve learned up until now she remained unconvinced, unenthusiastic and unsupportive which I thought was just weird because she understands the withdrawls and is even scared to get off them herself for that reason. She is the only other person I know who understands the nature of this drug from her own experience., etc. I feel good about my choice in supporting someone I love but I could’ve used a friend who understands, but I also understand this reflects more on how she feels about herself. And she can only give so much space to this bc she has her own life. It’s not the first time I’ve been abandoned bc I stuck by a partner who was going through mental illness. This whole thing just sucks. I’m doing my best to stay strong.",12,0
354,2021-05-07 09:21:17,https://www.reddit.com/r/benzorecovery/comments/n6ycwz/2_months_off_need_advice/,"2 months off, need advice","*writing this on behalf of my BF who doesn't have reddit and wants some advice.*

Hello everyone, I have been stopping klonopin 2 months ago. I was taking 1mg for 8 years, tapered over a course of 15 months.

I am still feeling very dark, I feel disconnected and I depressed, cannot find myself in a large group of people.

I have been taking supplements and meditating but that's also not helping much. Also I tried kratom and atarax. 

Would you suggest any med or any sort of ssri or benzo that has no or little withdrawal effects so I can ease this deep darkness and confusion a little, so I can have some relief? I am afraid that my depression can become chronic, as a friend who works in a mental health centre said to me, if it's not treated properly.

What do you suggest? Thank you!",4,0
355,2021-05-07 08:11:48,https://www.reddit.com/r/benzorecovery/comments/n6x1ek/34_week_bromaz_taper/,3-4 Week Bromaz taper,"Going into the looney bin for a bit, have had an every day etiz/bromaz habit ranging from.25-2mg since around October of last year, was wondering what everyone’s tips on a bromazolam taper would look like for me before I check myself in so I don’t seize. I’m already at 1.5, thinking I hit 1 later this week and then .5-.25 but concerned about seizure risk while admitted. any tips would be appreciated",2,0
356,2021-05-07 06:54:22,https://www.reddit.com/r/benzorecovery/comments/n6vrhu/in_cold_turkey_from_klonopin/,In cold turkey from Klonopin...,"I've taken benzos off and on since around 2014, and the last year (with a six-month gap) I was probably on about a 1.5 of Klonopin. I was CT's last June after a short taper by my doctor and given a load of Gabapentin, which helped enormously. Cue from November of last year and I started taking it again, and until about a week ago I estimate I was probably on 1.5 mgs. I kept trying to taper but would end up watching the pills slowly disappear from the bottle. I was told by my GP that, ""You need to make these last until the cows come home."" I did not. So I am pretty sure he's done with it and so am I. So, I have Gabapentin again and am probably taking close to 700mgs per day, which is again helping. I don't feel that bad, but it's been kind of touch and go. I still haven't hit that crucial two-week mark. I've CT'd Xanax before and that withdrawal was like no other. Anyone else used strictly Gabapentin on a CT withdrawal?",6,0
357,2021-05-07 06:22:38,https://www.reddit.com/r/benzorecovery/comments/n6valt/what_i_realized_with_benzo_recovery/,What I realized with Benzo recovery.,"I’ve realized with benzo recovery that out of every substance it’s the only one I can think of to where the person taking them has the best chance of recovery if them themselves are the ones who want to get off of them. 

I went to an ask doctor anything site. My question was why are benzos so over prescribed as well as why are benzos prescribed so much for long term. 

I’m not going to set out the Doctor with his answer it was obviously his opinion. He said ( don’t quote me at all I don’t have the text right here ) he said that it is the patients receiving the medications fault for not reading about them. 

In so many words he said in my opinion that Doctors can prescribe them, but not take the time to let patience know that there body will become dependent on them. 

I couldn’t believe his response. 

On a good note I cut down from 4 to 3 of my diazepams a day and I’m thinking after 20 plus years I am going to get off of them just because of his response. 

Everyone who is struggling, keep it up! We ( you ) got this!",15,0
358,2021-05-07 04:37:12,https://www.reddit.com/r/benzorecovery/comments/n6tuje/seizures/,Seizures,"6th day off Ativan. .5 once a day for 6 months. My head is killing me right now. Its in the back of my head. Sinus area. Neck. Its throwing my anxiety like crazy. I dont want a seizure. Should I take an Ativan? I'm very scared. My doctor assured me I wasn't at risk because of my dose, but I dont trust doctors anymore. I took Gabapentin yesterday and today but only 200 mg because I don't want another dependency. Im not sure what to do. I jumped at .125.",4,0
359,2021-05-07 02:06:24,https://www.reddit.com/r/benzorecovery/comments/n6rrva/theyve_discontinued_my_meds/,They've discontinued my meds,"Hey
I've been on 15 mg of mogadon (nitrazapam) for a few years I've been stuck on 15 mg to afraid to take another drop, I'm down from taking 30 mil of Valium on top of that, but they've discontinued the mogadon what do I do now? What do I say to my doctor when I call today? How do I know what tablet to move to? I don't trust the doctor to make a safe decision for my health, should I move on to Valium (Diazapam) but how much diazepam is in a mogadon? I'm scared shitless at the moment. I've also been considering just saying fuck it and trying to cold turkey that would be the dream but I don't think I can do it
Thanks for reading",3,0
