Date,URL,Title,Body,Score,COVID-19 Mentions,Sentiment
2020-09-15 11:40:57,https://www.reddit.com/r/benzorecovery/comments/itb9dz/questions_on_taperingquitting_alprazolam_for/,Questions on tapering/quitting alprazolam for sleeping,"Hey guys. 
First post here ever, but Ive been reading along for a while. 
Heres a quick backstory of the situation: my girl and I, have been using alprazolam as sleeping meds daily for about 18 months. The reason for our insomnia, was too frequent use of GBL. 
The use of GBL continued, although not on a daily basis, it was still pretty heavy. Especially from february to august this year, where it escalated into 24/7 abusing GBL in the last 6 weeks. 
Im very happy to say that we quickly tapered down the G and today is day 24 without it. 
But as expected, the need for our daily sleeping dose of alprazolam was still needed. Even before doing G all the time, we would do 3-4 day benders, thus damaging the GABA system and therefor created the habit/need for alprazolam for getting sleep. 

Now we are trying to taper down/quit the pills as fast as possible, and Ive been researching quite a bit. 

When reading the Ashton Manual, she breaks up the daily dosage of alprazolam into x 4 doses, eventually easing into using diazepam instead. 

But how does it work for people in our situation. We do not take benzos for anxiety or anything else. ONLY sleep. 
Should we just follow the Ashton scale, but simply taking one dose before bed as we normally do? 

Also, I can see why diazepam is more useful for tapering for things like anxiety. But seing how we are not looking to feel “sedated” during the day. A thing I feel diazepam causes because of the long halflife compared to alprazolam. 
So would it make more sense to hang on to the alprazolam and simply tapering those without switching to diazepam? 
Even considering CT at this point. Sick of needing pharma to sleep. 
My current dose is 1,25 mg alprazolam. Worked my way down from 2mg during the course of a month give or take. 

So whats your opinion. We have alprazolam, diazepam, zopiclone and promethazine available. 

Thanks in advance.",2,{},"{'label': 'neutral', 'score': 0.52343804}"
2020-09-15 10:54:03,https://www.reddit.com/r/benzorecovery/comments/itabsk/ready_to_give_them_up/,Ready to give them up.,"Ive spent the last month and a half or so self medicating with xanax, im down to 2 more and cant get anymore.  i take a max a half a bar. im a little scared honestly that ill have withdrawals. im scared ill lash out at someone out of irritability. i plan on just taking  a piece until they are gone or even try to skip a day but with work its going to be tough....please help",2,{},"{'label': 'negative', 'score': 0.83730656}"
2020-09-15 10:17:36,https://www.reddit.com/r/benzorecovery/comments/it9ndn/1_month_clean/,1 month clean,"I quit drinking alcohol, it will be 1 year for me on the 31st of this month.  I had a doc that would write scripts for 8 1mg Xanax a month and 30 15mg Extended relapse adderall a month.  I would trade my friend my adderall for his Xanax.  I was taking whatever I could get my hands on for a couple months and it got really bad.  I was a depressed sluring robot.  It’s been a little over a month and I feel great.  I still miss them sometimes.  This past weekend I was thinking about school, I go back at the end of the month, and felt genuinely excited.  There is a confidence in my life that hasn’t been present in a very very long time.  Just thankful for this sub, I was reading your posts during my darkest times just waiting to contribute myself.",10,{},"{'label': 'positive', 'score': 0.84816724}"
2020-09-15 04:36:18,https://www.reddit.com/r/benzorecovery/comments/it4v6k/advice_needed_please_for_making_a_homemade/,"Advice needed please for making a ""homemade"" Diazepam Solution using PG ( Propylene glycol) to do a daily micro liquid taper (DMLT)"," I  would like to ask about advice I was given regarding using **Propylene glycol** as a solvent for Diazepam  pills and adding water to turn it into a suspension .

 Does this work, and does Does it stay in suspension ?  And has anyone successfully tapered this way? 

I tried it with Vodka, and Milk but both didn't agree with me, all it did was uptick my already severe symptoms  was unable to taper.  
 

The advice I was given is  to using my 2 mg pill,  to add  1 to 2 ml  of **Propylene glycol** per 1 mg of pill making it 2 to 4 mg **PG**  for a  2 mg pill , then add 100 ml of water which would make it a suspension . 

And that there is no need to shake it, as the Diazepam would be equally distributed throughout  just subtract small amounts with a  syringe daily.  

I was also told to minus the amount of PG from the water e.g if you use 2 mg PG then use 98 ml of water+2 mg of PG which would then=100 ml, and subtract my daily micro  cut from there",5,{},"{'label': 'neutral', 'score': 0.5838485}"
2020-09-15 03:34:48,https://www.reddit.com/r/benzorecovery/comments/it45gv/did_anyone_here_get_and_fully_recover_from/,Did anyone here get and fully recover from neuropathy during their withdrawal?,"I'm talking to a doctor soon, I'm pretty sure it's my WD as it came out of nowhere.

Google makes it seem like neuropathy is usually permanent? I dunno.",11,{},"{'label': 'neutral', 'score': 0.50488156}"
2020-09-14 23:39:25,https://www.reddit.com/r/benzorecovery/comments/it0yo9/any_taper_suggestions_for_ativan/,Any taper suggestions for Ativan?,"I started taken Ativan 1 mg as needed for 1 month on and off. My anxiety got worse and I started taking it everyday and I increased the dosis to 2 mg in the last month. So far I have been two months on Ativan. The doctor gave me Xanax during 1 week but it was hell. She told me to taper Ativan reducing 0.5 mg every 4 days. I researched about it and many people told me that was too quick. I got many suggestions from a Facebook group telling me to follow the Ashton manual and change to Valium or do the water taper. 
The water taper that the admin suggested was way too slow, it would take me about a year to taper. Does anyone has experience tapering after a few months?",2,{},"{'label': 'negative', 'score': 0.71027607}"
2020-09-14 23:15:50,https://www.reddit.com/r/benzorecovery/comments/it0l8v/talking_about_derealization/,Talking about derealization...,"Hi there I just mainly want to focus on derealization and your experiences with it during your withdrawal or taper. I took Klonopin for 8 years 1 mg and haven’t taken any in just over two weeks. Sometimes I experience a dream like state where it feels like there is a film or veil over everything and it doesn’t feel real. Or like everything is two dimensional. It’s hard to explain, but I hate it. It freaks me out and is always followed by major anxiety I’m guessing from fear of whatever that state is. Have you experienced this and how did you cope with it? Do certain things help it?

Thanks best of luck to everyone",3,{},"{'label': 'negative', 'score': 0.7706955}"
2020-09-14 20:13:13,https://www.reddit.com/r/benzorecovery/comments/isxkcr/do_facebook_groupsbenzo_buddies_make_this_worse/,Do Facebook Groups/Benzo Buddies make this worse? Even if you are going through hell?,"Now I’m guilty of using both. mainly Facebook. I usually post when I’m scared or experiencing new symptoms tapering. I’ve been dealing with mild but noticeable inner akathisia as I’m tapering. Obviously I’m in fear of this becoming worse. But I can’t help but wonder if reading about other people dealing with akathisia for years and some committing suicide a scary reality. I would never commit suicide, but I can see how somebody going through it severely for months on end easily could. Almost every benzo suicide is due to that symptom in particular. Point blank I’m 26 I want to be around. I don’t want to be driven to suicide by some torturous mental and psychical condition.",2,{},"{'label': 'negative', 'score': 0.8527038}"
2020-09-14 19:17:04,https://www.reddit.com/r/benzorecovery/comments/iswlvp/guys_if_struggling_you_have_to_read_this/,Guys if struggling you have to read this!!!,"I took LSD two days ago now bare in mind a very important thing here I didn’t have the guts to take the whole Tab so I grabbed scissors and cut about a quarter of the square off (maybe 40-50ug at max) 

I have struggled with Benzo withdrawal and I’m going to post this in the Benzo section as well, I woke up after the trip and just felt like a different man. I mean anyone who takes Xanax knows how hard it is to tell your mind I don’t need this shit. Try LSD and then tell me how you feel, you’ll look at the Xanax in disgust and start to question why you started taking it in the first place. I was already on a Dosage of 0.75mg which is hell to not take more but I honestly have never been able to go a day without taking it. LSD taken a higher dose will cure you of the dependency then it’s really up to you what to do next, I’m not going cold turkey or claiming I’m cured but I’m definitely feeling better about stopping Xanax and I promise you Molly and Shrooms don’t do that in personal experience!💙💙💙",2,{},"{'label': 'neutral', 'score': 0.4587512}"
2020-09-14 19:14:49,https://www.reddit.com/r/benzorecovery/comments/iswki3/general_advice_from_people_who_have_been_there/,General advice from people who have been there.,"I have been taking Xanax off and on for almost 20 years.   All from a doctor to treat my panic attacks and ocd.   I have gone months and years without, but have been taking it pretty regularly for about two years.  Long periods of time where i took 2 mgs every other day.   I don’t dig the high.  It makes me useless, and I prefer marijuana  but as anyone with anxiety ocd knows a good night sleep can really hit the spot when attacking the next day.  

I was ignorant to think that I would feel withdrawal symptoms within 24 hours and that never taking it two days  in a row would keep me from dependence.  I noticed that 2 mgs wasn’t packing the same punch so when I ran out I decided to take a break from it and didn’t refil my rx.  I started feeling off about a week in. Felt like I was living in a fog.  Not once did I crave another actual pill.  So two weeks in I was feeling odd and looked up Xanax withdrawal symptoms and they matched how I was feeling.   

I also started my job back up that week which is very stressful and you have no room for brain fog.   So for last month I have just been taking one mg every other night of the work week and go three nights before taking one before the start of the work week over the weekend.  So I am at around 4 mgs spread out over a week.   Things seem less instense than they did a month ago except that I know the reason I feel like shit  which makes it a bit harder not to just take a pill.  

The real question is from experience do you think that continuing to just use less and less with be helpful or do you think I should call my psychiatrist immediately.  I feel good but I am still only going three days without taking a pill.",3,{},"{'label': 'negative', 'score': 0.66154456}"
2020-09-14 17:11:11,https://www.reddit.com/r/benzorecovery/comments/isu8wf/wasnt_able_to_smoke_weed_for_almost_a_year_after/,Wasn’t able to smoke weed for almost a year after recovery...,"A couple of days ago I read a post of someone who wasn’t able to smoke weed again after stopping benzos due to panic/anxiety attacks & I I’m here to say that it eventually gets better, I’ll give some of my background: 
I started doing benzos a year and two months ago, to be more exact with dates, July 2019. I started taking klonopin every once in a while, “recreationally”, once every week, two weeks and so, until September when I started popping them on a daily basis, BIG amounts & combined with other stuff... it wasn’t until a friend of mine got into rehab the last days of October when I went off the rails and started doing them even more often and of course increasing the amounts heavily, by the end of the year I was already on around 10-12mg of klonopin ALMOST DAILY. When 2020 started I now started to take Xanax too, never went up on Xanax tho, it always remained almost the same dose (2mg, max 4) but maybe it was because I was always off klonopin, anyways it wasn’t until the last days of February when I decided that I wanted to stop doing benzos all of a sudden (never had withdrawals with any drug before), and it was a biiiiig mistake, of course I had no experience with coming off benzos since I was a practically new user, so I started to read forums and came on here to see what to expect & all that, I tried to make my own taper schedule which was a really bad idea since I was cutting my high dosage really really quick, I went through the withdrawals either way because I was just completely sure I wanted to cut them out and I wanted to do it fast and of course it didn’t work, so I decided to go to rehab to cut them out for good, and I went on March 18th, I did it cold turkey since my rehab didn’t use any meds to replace any drug usage, it was all natural, you have no idea what vitamins & minerals can really do, it was amazing, and it wasn’t really hard to be honest, I’ve been completely off them for 6 months now and I feel amazing, benzos really fucking suck. Of course I do have my hard and easy days, just like any other but Ups and Downs, what life is about. 
Anyways, now that ya’ll have my background, I’ll just go to what any of you who read the title were wondering and waiting for. 
I had been smoking weed since I was 16 on a daily basis, never had any problem with it until benzos came into my life, when I stopped taking them I couldn’t even smoke because they would just trigger and intensify my anxiety and panic attacks even worse, so I stopped smoking completely also way before I went to rehab, the first time I tried to smoke again, I got AMAZINGLY high and of course that just made me a little anxious, but nothing else, now, I don’t smoke the same quantities and I don’t push myself to smoke A LOT, I just listen to what my body can manage and I’m fine with it, I think that’s essential for people who really want to take a toke every once in a while, also be aware of what could trigger your anxiety if you’re recent to being off Benzos and if you’re recent I wouldn’t even really recommend it, I’d just wait until you’re sure you’re completely ready to take a toke so you don’t need to go through any “bad trips”, you don’t want that & less after all the hell we’ve all already been through. 
I’m all ears for anyone going through recovery or still under consumption who wants/needs to talk :)",6,{},"{'label': 'neutral', 'score': 0.41529924}"
2020-09-14 16:55:05,https://www.reddit.com/r/benzorecovery/comments/istwis/60_days_since_i_jumped/,60 days since I jumped.,"It feels so great to finally be off benzodiazepines. I never realized all the health issues it was causing and how the pills really took a toll on my emotional health as well. As far as physical symptoms go those are mostly gone. Muscles still a tad weak and I have an occasional light pressure headache. The hardcore anxiety, depression, SI have all lifted. I'm still not 100% mentally but close. It was a lot worse 3-5 weeks ago. I feel I have a new lease on life. I was on them for around a decade. 

Edit: CT off 2mg of Klonopin after being prescribed for the last 10 years.",57,{},"{'label': 'positive', 'score': 0.4038161}"
2020-09-14 15:32:46,https://www.reddit.com/r/benzorecovery/comments/iss5mi/do_waves_go_away_100_of_the_time_given_enough_time/,Do waves go away 100% of the time given enough time?,"I'm 15 months off and I have on and off severe brainfog, I'm fairly sure my cognitive abilities are permanently lowered but I just want to wake up one day knowing every day after that will be brainfog free even if I'm stupider than I was pre benzos.

It's so miserable, I get angry when my family talks to me because using the brain power to communicate frustrates me.

It feels like a 50/50 thing at this point, Honestly I had almost no brainfog pretty much from months 8-12 or so which was nice.

I also have more depersonalizationwith the brainfog.

I can live with the tinnitus and lowered IQ, I just want a stable functional mental state again one day.",4,{},"{'label': 'negative', 'score': 0.6342795}"
2020-09-14 13:56:44,https://www.reddit.com/r/benzorecovery/comments/isq535/tapering_down_from_1mg_twice_daily_to_5_twice/,Tapering down from 1mg twice daily to .5 twice daily what can I expect?,I’m kinda scarred just wanna know what I should expect,2,{},"{'label': 'negative', 'score': 0.70652264}"
2020-09-14 13:41:51,https://www.reddit.com/r/benzorecovery/comments/ispu7f/how_long_does_it_take_to_get_dependent_andor/,How long does it take to get dependent and/or addicted?,"I did the Ashton Manual method to finally get off Klonopin about 2 years ago.  I was so proud of myself.

Then I went back on Klonopin a month ago for severe panic due to withdrawal from Lexapro, then severe insomnia due to restarting Lexapro.  I felt it was my only option and my doctor agreed.

I'm trying to taper down really fast to the Valium and it's not going well.  Severe insomnia again.  Didn't sleep AT ALL last night.  


Could I really be dependent and experiencing withdrawal again after only being on Benzos for a month?

Honestly I'd feel better if you say yes because that would at least explain this horrible insomnia.    


If I need to do the whole slow taper again I will.  I just thought I wouldn't need to this time around.

Thanks for any advice.",1,{},"{'label': 'negative', 'score': 0.41858488}"
2020-09-14 11:59:10,https://www.reddit.com/r/benzorecovery/comments/isnodl/tappering_xanax/,Tappering xanax,"Hello everyone! 
I'm tappering xanax, that I have taken since aproximately 8 years.(mostly slow doses)
Since last year, I was at 0,5. And I have decided to slow down to 0,25 to hopefully, finally stop.
It was not too hard but since several days, I'm realy not feeling myself. I feel much more anxious and old feelings like guilt and fear reemerge, even toughts that are difficult to face. I'm feeling a bit discouraged...
Is this normal? Do you have similiar experiences, even after 1 month?
Thanks a lot!",5,{},"{'label': 'neutral', 'score': 0.40965384}"
2020-09-14 05:23:10,https://www.reddit.com/r/benzorecovery/comments/ishmm4/xanax_binge_for_opiate_wds/,Xanax binge for opiate w/d‘s,"Hey guys, I know might seem hilarious to some peeps here considering their problems with benzos but I’m anxious so i‘ll still ask my question.
So I kicked off a lil opiate habit by taking 1.0-2.5mg of alprazolam a day (had 2 days without the benzos after the first 2 days takin em) . Started on Friday last week, but this Saturday relapsed on a very small dose of oxy wich didn’t sent me back to my wd‘s thankfully.. Sunday last dose of 2mg, so now it’s been 9 days where I consumed approx. 13/14mg of alprazolam. I‘ll already know that I might go through some rebound anxiety and insomnia, but my main concern are seizures. Is this territory yet? I guess a taper would only prolonge the progress but i wanna be on the safe side. Would appreciate any help and wish u all a good day and luck with your recovery :)",6,{},"{'label': 'neutral', 'score': 0.42954203}"
2020-09-14 01:18:42,https://www.reddit.com/r/benzorecovery/comments/isep0n/forgetfullness/,Forget-fullness,"I need help. I am down to 7mg but I can't remember anything from 12h ago. literally, nothing. it merges into a dream like feeling. It's a little scary but mostly very, very inconvenient. I am doing a PHD and masters in chemistry but I can't remember the formulas for things, and I forget classes and sometimes even what I'm working on. Is this normal? is there a way to fix it? Please, my grades are dropping a bit which I can't tolerate. I'm desperate. Please help",4,{},"{'label': 'negative', 'score': 0.92105144}"
2020-09-13 23:38:01,https://www.reddit.com/r/benzorecovery/comments/isd8ww/my_boyfriend_might_be_addicted_and_i_need_some/,My boyfriend might be addicted and I need some advice,"Hi I’m not really sure where to post this but hoping some of you can help. I (26F) have been having problems with my (28M) boyfriend. It started a few months ago when I thought he might have an alcohol addiction. We used to go out or have a few drinks at home and he gets a really bad speech slur and looses coordination. He is not himself at all and I thought it was the alcohol but the more research I’ve been doing the more I think it might be a mixture of things. He takes Adderall, I don’t think it’s everyday but probably a few times a week. And he is also prescribed Xanax to sleep. I read online that this is a bad mixture and he also smokes weed pretty much daily. The more I get to know him the more I notice his slurred speech and loss of coordination. It’s getting to the point where I love him but I’m not sure if I can be with someone who isn’t fully there. Does anyone have a similar experience? I’m worried he might also be taking some other substances behind my back and I’m just very worried about him and don’t know how to help. We are close so I have expressed my concern over and over and he always tries to reassure me but I’m not sure I trust his denial. I just need some advice. I’m pretty straight edge, I drink occasionally but that’s it so I feel totally out of my realm on knowing what is up with him and what to do.",13,{},"{'label': 'negative', 'score': 0.61363494}"
2020-09-13 22:37:56,https://www.reddit.com/r/benzorecovery/comments/iscbpp/not_sure_how_i_am_going_to_do_this/,not sure how I am going to do this..,"I have not taken klonopin in 16 days. I was prescribed and took it for 8 years at 1 mg. I would sometimes take 2 as needed, but not often. I am so miserable I can barely function. I get out of bed to eat and that’s about it. The anxiety and suicidal ideation is the worst part and I’m not even sure if I can attribute that to WD. I have depressive episodes where I can’t stop crying. I can’t maintain friendships, certainly not conversation. My hair is falling out and breaking like crazy (is that a thing with WD)? I was depressed before this and I had to spend the summer in back East while I paid rent in CA. So maybe this isn’t WD and something bigger is going on. I feel so defeated. I just think about how relieved I would feel if I could just be gone and at peace. I don’t have many friends so not many people would be affected. 

I’m in the process of moving back east from CA. I am supposed to be packing but I can’t bring myself to do anything. I need to drive cross country. My rent is up and I can’t put it off. I don’t see an end in sight and I’m not sure how I’m going to do this. Anything helps.",1,{},"{'label': 'negative', 'score': 0.90023595}"
2020-09-13 22:11:09,https://www.reddit.com/r/benzorecovery/comments/isbwfm/klonopin_wd/,klonopin wd,"i took only .25 klonopin for 4 wks 1x a night,,, i was on klonopine for 4 months  3 yrs ago,, i am trying to wd with liquid 1.5 ml,,, and i am hurting big time ,,, why,,, can it be kindling,,, i am lost,,,",1,{},"{'label': 'negative', 'score': 0.8257228}"
2020-09-13 21:42:12,https://www.reddit.com/r/benzorecovery/comments/isbfwr/does_getting_into_an_ssri_or_other_type_of/,Does getting into an SSRI or other type of antidepressant prove beneficial when beginning your taper? Help or hinder?,"I am starting a taper right now, but even when the taper is over, my issues with MDD and GAD will still exist. Should I try to get on them while I have some benzos still available to me (for the onboarding anxiety)? 

What has been your experience? Help or hindrance?",5,{},"{'label': 'neutral', 'score': 0.5988902}"
2020-09-13 17:59:46,https://www.reddit.com/r/benzorecovery/comments/is7qyx/sciaticarls/,Sciatica/RLS,"Can withdrawl from Ativan trigger symptoms of sciatica? Which lead to symptoms of RLS?

I’ve never had lower back discomfort like I’ve been having ever. 

I used to lift weights, and train hard. I started using Ativan June and stop July 15th did about 20mg in total. Once I stopped my nerves went out of wack and once symptoms Improved my lower back would be in pain. I just had a 6 hour flight and 3 days laters my lower back and RLS started. 

I’ve also been physical doing labor work. 

I hope this shit isn’t permanent. If it doesn’t stop I might get an MRI.",1,{},"{'label': 'negative', 'score': 0.7454553}"
2020-09-13 17:17:11,https://www.reddit.com/r/benzorecovery/comments/is6z7e/has_anyone_found_that_vaping_helps_is_klonopin/,Has anyone found that vaping helps is klonopin withdrawl?,,1,{},"{'label': 'neutral', 'score': 0.7564973}"
2020-09-13 16:08:03,https://www.reddit.com/r/benzorecovery/comments/is5nbb/cbd_to_counter_klonopin_withdrawal_anxiety/,CBD to counter klonopin withdrawal anxiety,"Trying this now, bought a vape. Anyone else give this a shot?",6,{},"{'label': 'neutral', 'score': 0.78992087}"
2020-09-13 13:17:08,https://www.reddit.com/r/benzorecovery/comments/is29e1/taking_diazepam_40mg_a_day_for_3_months_with_a/,"Taking diazepam 40mg a day for 3 months, with a week of withdrawal each time before I restart.","Ive been taking these on and off for years, but never for longer than a week at a time until a few months ago. I did, however, successfully quit drinking! Silver linings and all that. What is the best advice for reducing diazepam?",1,{},"{'label': 'neutral', 'score': 0.57015604}"
