Date,URL,Title,Body,Score,COVID-19 Mentions,Sentiment
2020-04-29 09:03:37,https://www.reddit.com/r/benzorecovery/comments/ga91ye/does_cbd_oil_help_or_mess_with_the_tapering/,Does CBD oil help or mess with the tapering?,"I am not at wd yet but still tapering. I read somewhere that maybe its not a good idea to use CBD oil while tapering.

Is it worth a shot even at tapering or is it better to wait until no benzos and only wd?

I am receiving CBD oil today and don't know what to do.",1,{},"{'label': 'negative', 'score': 0.5439553}"
2020-04-29 04:09:22,https://www.reddit.com/r/benzorecovery/comments/ga5fre/sleep_erections/,Sleep erections,I’m posting again about this symptom. Basically I get super strong erections through the night that wake me up frequently. It seems now I’ll be able to sleep around 3 hours before I’m woken up. They don’t hurt anymore but I hate waking up so many times and it makes me feel like I’m not getting any sleep. I’m scared I’ll have this forever. I found a small group on FB of men who have had something similar for years. Has anyone had this symptom go away for them?,5,{},"{'label': 'negative', 'score': 0.86635953}"
2020-04-28 21:29:50,https://www.reddit.com/r/benzorecovery/comments/ga07h0/what_made_you_decide_it_was_time_to_quit/,What made you decide it was time to quit?,"I guess this is my way of dipping my toes into this subreddit lol. My apologies if this is a commonly asked question. If you’re currently on the path to recovery, sobriety... life without a dependency or however this is looking from where you’re at personally. I’d love to hear about your “I’m done with this” moment.",2,{},"{'label': 'neutral', 'score': 0.5789127}"
2020-04-28 20:00:50,https://www.reddit.com/r/benzorecovery/comments/g9yspg/can_gastric_disorders_really_contribute_provoking/,Can gastric disorders really contribute provoking anxiety and depression?,Is this really a thing? I have gastritis and also reflux. I wonder if I being rigid with a diet for my gut will improve my symptoms.,2,{},"{'label': 'negative', 'score': 0.859704}"
2020-04-28 18:16:10,https://www.reddit.com/r/benzorecovery/comments/g9wxsp/tapering_with_xanax/,Tapering with xanax,"Unfortunately my doctor refuses to switch me to from restoril to anything but xanax and I cannot change docs at the moment. So I am using the guidelines from the ashton manual, which says that 2 mg of xanax is equivalent to 40 mg of Valium.  I was on 15 mg of restoril for about 2 years. 15 mg of restoril is supposed to be equal to 7.5 mg of Valium.

So I cut the bar at the indentations, which gives me 4 each of .5 mg pieces.  I tried .5 mg, but it was a bit strong, so I went back and cut all into .25 mg pieces. I started taking .25 mg  3 times per day. That seemed to work out well and was equivalent to 15 mg of Valium.

I stayed on that schedule for 2 weeks, then reduced to roughly half, or .125 mg of xanax. That should be equal to 2.5 mg of Valium, 3 times a day. A total of 7.5 mg per day of Valium equivalency.

This feels good, and I plan on finishing by dropping .125 mg of xanax per week.  Hopefully I will be done in 3-6 weeks if my math is right.

I hope I didn't confuse anyone too much. I am doing it this way because I have no way to get valium, other than trying to buy it on the street.  Hopefully this will help you out if you also have no options.",2,{},"{'label': 'positive', 'score': 0.560962}"
2020-04-28 18:13:49,https://www.reddit.com/r/benzorecovery/comments/g9wwaf/ive_been_on_benzos_for_a_month_and_i_want_to_stop/,I’ve been on benzos for a month and I want to stop now before it gets out of control. How should I go about this?,"Backstory: long time addict here. Rehab. Sober living. The works. I’ve been on addy and benzos my whole life and I always abused them(at least the bezos) I only took the addy for work.

Finally about 7 months ago I became completely pill and alcohol free. 

I started a new job that pays a lot and I’ve been struggling to focus so I got some Ritalin off the dark web and it really helped. Then I noticed the same vendor sold bars and knpins and tramadol. I bought about 100 of each thinking I got myself under control now (yeah fucking right). 

Today is exactly one month of me taking benzos to get high. Probably up to 6-8mg a day. I can already feel myself being depressed without it. I want to stop before it’s too late. If I remember correctly, bars are the worst so my plan is to give those away to a friend immediately and use the k-pins to ween off. I haven’t touched the tramadol yet but I figured that would be good for the aches and pains of withdrawal. 

Is this a good plan or would you do something different? Thanks in advance!

EDIT: forgot to mention I still haven’t touched a drink in 7 months. If that matters. When I was off benzos I would use Kratom at the end of the day for relief from the addy.",12,{},"{'label': 'negative', 'score': 0.50311524}"
2020-04-28 16:23:18,https://www.reddit.com/r/benzorecovery/comments/g9ut15/introducing_myself/,Introducing myself,Been on and off 15 years and developed a hoarding problem once they switched me to Xanax 2 my 3xs a day from 2 mg twice a day klonopin. I have over 700 Xanax and i just want to prove a point there is so addiction. Klonopin as longer shelve life,4,{},"{'label': 'neutral', 'score': 0.45579192}"
2020-04-28 09:06:25,https://www.reddit.com/r/benzorecovery/comments/g9muc5/few_different_taper_strategies_what_do_yall_think/,Few different taper strategies what do y’all think?,"So I’ve been on daily benzos a very Fkn long time ten years, 7 years was 1-2 mg of Xanax and last three 1-2 of klonopin although I’ve been stable at 1 mg a day for a while now so that’ll be my starting point. There have been periods of abuse but not for a while and never consistently and by abuse I mean one night taking 4-6 mg instead of my usual dose but like I said only here and there never was my actual regiment. I’m sure I know which everyone is gonna say is best but I’m still wrestling with if I wanna attempt to go faster or just take it slow. I’m not gonna go slower than my slowest taper plan though I refuse to drag it out longer than that unless I’m having real problems along the way.

1. Go down .25 a month so I’d be off in three months if I could handle the big cuts since I’d be giving myself a decent amount of time to acclimate 

2. Go down .125 (can break my 1 mg in 1/8s or get the .125 prescribed) every 2 weeks. 

3. Plan 2 but go down .125 a month instead of every 2 weeks. Would take 7 months 

I think I’ll middle and go down .125 every 2 weeks",2,{},"{'label': 'neutral', 'score': 0.604491}"
2020-04-28 03:48:36,https://www.reddit.com/r/benzorecovery/comments/g9ixxm/the_happy_world_without_benzo_all_worth_it/,"The happy world without benzo, all worth it!","So I was on Valium for over 3 years daily and before that 2-4 days a week for 2-3 years. My average dose was 20mg/day. I have been struggling with depression and severe anxiety (and OCD) for many many years.

I realized something is preventing me from being happy. I could not find happiness from the small things and had to rely on external things. I realized it must be benzo that is preventing me. It was.

I decided to quit it, together with other shit like cigarettes and even social drinking. I tapered in one month and started to meditate and exercise. Also forced myself to meet people as much as possible, which turned out to be a smart move.

25 days later completely clean, and I am as good as restored. I feel it's like a new kind of life in me. It's like I am connected to a force of happiness and I can be happy for almost anything. I laugh a lot (almost never laughed before) and I find happiness in other peoples success. I find it pleasureble to hang out with people and people seem to like me so much more now than before.

I am much more creative, motivated and inspired. Almost no anxiety and I am really, really clear minded. Not depressed at all and I find joy in the small things, like the sun in the morning and the smell of flowers.

I put all my drugs in a bag this morning and will throw it away and never ever go back.

Thinking of quitting? Do it, you will never regret it!",32,{},"{'label': 'positive', 'score': 0.86085147}"
2020-04-28 02:35:10,https://www.reddit.com/r/benzorecovery/comments/g9i301/am_i_addicted/,Am I addicted?,"I’ve been on several medications. Currently I take daily
225mg EFFEXOR
60mg buspirone
.5 mg Clonazepam up to 3 times a day


I started the Clonazepam back in November when My anxiety was out of control. I have had to use it to sleep and not have panic attacks. 

Now whenever I go like 24 hours without taking it I get a headache and general feeling like shit. And I’m kind of in a brain fog daze type feeling. 

Idk what to do",1,{},"{'label': 'negative', 'score': 0.71161854}"
2020-04-28 00:25:47,https://www.reddit.com/r/benzorecovery/comments/g9giaz/had_a_tonic_clonic_seizure_how_screwed_am_i/,Had a tonic clonic seizure. How screwed am I? Hospital put me on a Librium taper for 4 days.,"Had a horrible tonic clonic seizure a few days ago that lasted over 3 minutes. Screwed up my back really bad, almost bit a hole in my tongue, and every muscle in my body, even in places I didn't know could have muscle pain were hurting for days. Today I'm finally starting to feel healed, thanks in part to going to a chiropractor a couple days ago and getting my back forced back into place.

Anyway, I was drinking quite a lot of alcohol every night for like 2 weeks and using a pretty good amount of Clonazolam (a research chemical benzo that's quite powerful, and is active in the *microgram* range) during the day. I was using like .5mg some days and an entire 1mg some days. I was actually trying to quit the alcohol and taper the Clonazolam when I had the seizure. Clonazolam is a super powerful benzo and I was stupid for using it. It was for the legality...

Anyway, I had to go to the hospital to get a CAT scan (I think that's what it was) and they put me on Librium, a benzo that has a metabolite that has a half life of up to like 200 hours.

I'm already getting brain zaps and this is my last day on it. First day was 4 doses of 25mg, second day was 3 doses of that, third was 2, and finally tonight is my last dose.

Is this long enough of a taper? Am I at risk of another seizure? I don't think my body can handle another one of those. I was having severe memory issues for a day or two afterwards. It really did a number on my body and psyche.

How screwed am I? Do you think the Librium will be enough? I'm not planning on abusing benzos or alcohol ever again, that's how bad the seizure was. Scared me out of my mind.

What would the warning signs be that I might need to go see a doctor to do a longer taper? I'm hoping I'll be fine and won't need anything. It's just... Again, I really don't want to experience anything like that again. It was so bad. I couldn't even get up off the couch by myself without help the back pain was so bad.

Anyone have experience with Librium, and is a 4 day taper enough?",1,{},"{'label': 'negative', 'score': 0.7151726}"
2020-04-27 22:56:07,https://www.reddit.com/r/benzorecovery/comments/g9f8zu/withdrawal/,withdrawal,"I’ve recently realised that I am addicted to clonazepam. I started using it only for anxiety/panic attacks about a year ago and then it progressed to recreational use sometimes. After the quarantine began I started using it way more often and I noticed that the 0,5 mg was not doing anything anymore and had to take a higher dosage for the same effects. I guess it has been specially stressful because I had to quit smoking too. So, every time I try to go without clonazepam for like a week I get really heavy withdrawal, does anybody know something that can help with that?",3,{'quarantine': 1},"{'label': 'negative', 'score': 0.66107875}"
2020-04-27 19:45:10,https://www.reddit.com/r/benzorecovery/comments/g9c9g8/is_valium_wd_that_easier_compared_to_xanax_wd/,Is valium wd that easier compared to xanax wd?,"I was taking 2 benzos until 1 month ago because I was trying to follow the Valium switch proposed on the Ashton Manual.

But as for my last dosage of Xanax (0.125mg), I decided to just stop it instead of switching. The first weeks were tough and things are still weird when I decide to take coffee. I can't work too much on my job without having extended pauses due to myself 'overheating' easily lately.

Now, I am just taking 2.5mg of Valium. I intend to wait one more week to drop this to 1.25 then wait maybe a month and stop it. I wonder if this will be harder than the Xanax wd. I wonder also if I am feeling wd effects or just tapering effects.",3,{},"{'label': 'negative', 'score': 0.5477035}"
2020-04-27 18:03:36,https://www.reddit.com/r/benzorecovery/comments/g9aiwe/well_my_doctor_has_refused_to_refill_my_klonopin/,Well... my doctor has refused to refill my Klonopin until May 1st. Not even for a taper... wish me luck yall I'm on my 2nd day of my rapid taper (half dose) and the toe-curling anxiety is setting in.,"I've been through it before and it sucks... I didn't have seizures, just head weirdness and anxiety.

But my addiction to caffeine had me popping a little more each day. half pill by half pill.

I'm not on a large dosage. I take 1mg a day. So I think I'll be safe from seizures.

I am trying to make the best of what I have to taper:

* Took last full 1mg dose on Saturday
* 0.5mg on Sunday
* 0.5mg today (Monday)
* 0.25mg tomorrow
* And then 0.25mg the day after that.

Is there really any a better way to spread that out? They say they won't refill my RX, even for a taper, to ""discourage overuse"" as per the Texas Medical Board and DEA's request. It sucks because I don't consider taking the medication for 2 1/2 years, only taking 0.5mg more ""as needed"" to be the behavior of an addict... but it is what it is.

Last time I went through withdrawal I was sent to some sort of day-therapy sessions which cost an atrocious amount of money and we never really did anything worthwhile. So this time I'm just doing it in my house.

Any tips to get by? Supplements?... last time I went cold turkey on Klonopin the symptoms peaked around 2 or 3 days and then it got better from there.",18,{},"{'label': 'negative', 'score': 0.6538803}"
2020-04-27 16:20:58,https://www.reddit.com/r/benzorecovery/comments/g98k47/100_mg_etiz_solution_in_two_days_fucked_up_royally/,100 mg etiz solution in two days (fucked up royally),"Got my psych to prescribe me klonopin to help w work and finals. My parents had to monitor the 1mg twice daily but I had a breakdown one morning, fled to another place where I have residence and friends and ended up binging 95 mg of etizolam by myself. So disappointed, I was just trying to get some sleep after taking addy but it seemed to do nothing besides get rid of anxiety with no signs of me being ""messed up"". How is it possible to take 10-15 mg of etizolam in liquid form and not at least be a bit woozy or wobbling regardless of sleep. Anyways, I am tapering off my klonopin and reconnecting with my therapist, wish me luck because this is no life to live.

EDIT: I had only been using klonopin for three days at 1.5 mg daily prior to this excessive usage and prior to that I was around 10 days clean from any benzos and 30 days clean from weed. Never used benzos for more than a week or two on then a week and a half off. Also smoked for the first time in a while yesterday, took two bong rips and literally passed out in my room alone breaking my closet, luckily there were bags of clothes on the floor to prevent any serious injury.",0,{},"{'label': 'negative', 'score': 0.5921645}"
2020-04-27 10:45:25,https://www.reddit.com/r/benzorecovery/comments/g920fs/does_reading_about_benzo_withdrawals_make_your/,Does reading about benzo withdrawals make your withdrawals experience worse?,"Hi. I’m currently trying to taper off a ~.5mg/day Xanax routine. I’m currently at about .3mg/day. 

I’m experiencing some withdrawal symptoms so I’ve been frequenting forums like this one to try to learn about what to expect and how to combat them. 

But as I’ve read about the experiences of other people, I feel like it’s actually made my withdrawals worse as I start looking out for things to expect. Like I’m almost thinking my withdrawals into existence, or at least making the ones I am experiencing worse.

I’ve found that the more I stay off the internet and try to divert my attention to other things (exercising, working, reading, etc), the better off I probably am. 

It’s not to say that forums like this serve no purpose - I know they are a godsend for some people, but has anyone else had a similar experience?",10,{},"{'label': 'negative', 'score': 0.6655989}"
2020-04-26 23:51:59,https://www.reddit.com/r/benzorecovery/comments/g8t3rn/lorazepam_long_term_use_really_long_withdrawal/,Lorazepam long term use (really long) withdrawal help needed. 4mg a day for 10+ years.,"
I’ve been taking 4mg of Lorazepam everyday for 10+ years (1mgx4). I was not aware of long term use tolerance withdrawal due to me and my Doctors collectively dropping the ball. I thought my  Chronic Fatigue Syndrome (since 1996) and Chronic Sinusitis (since 2016) were making me feel unbelievably horrible.

I told my Psychiatrist I’m gonna start to taper, this was last week. Where do I go from here? Ideally I would love to talk to a specialist to discuss what I need to do and what I need to prepare for. Someone who can help me come up with a game plan. Any help would be greatly appreciated. I know I have a long road to hoe, can’t feel much worse than I do now.",16,{},"{'label': 'negative', 'score': 0.65013963}"
2020-04-26 18:39:33,https://www.reddit.com/r/benzorecovery/comments/g8o5io/the_wonders_of_cbd/,The wonders of CBD.,So today I was in a horrible wave and had horrible chemical depression and agitation. (2 weeks tomorrow I made a 20% cut) The depression was debilitating today. I’ve been taking 500mg CBD since starting my taper and it has always helped but tonight the depression was very bad so I took two doses 1000mg and it lifted. Can anyone explain to me how is it that this works? Does it work on GABA? I’m baffled but so happy I got some relief...,3,{},"{'label': 'positive', 'score': 0.42911375}"
2020-04-26 18:31:21,https://www.reddit.com/r/benzorecovery/comments/g8o0av/how_come_i_didnt_get_any_real_wd/,How come I didn't get any real WD?,"I am lucky as hell I know. I just want to know how this is even possible...

I ate Valium daily for 3,5 years, between 15-30mg/day. I tapered in a month and now it is 26 days completely off. Two weeks in I had some anxiety, sleeping problems and muscle tensions and there are still some muscle tensions, especially connected to my speech. But that it is. I feel better now every day and in a week I am certain it will be gone completely.

I work out a lot and focus a lot on being aware with meditation and mindfulness. I can control my mind and body well so I guess a lot is because of this. Also I never freaked out and I didn't expect a WD to come. Some how I knew it wouldn't happen. But still, how is this even possible?

Edit: 4 years ago I was in a dark place and abused Ambien (60-80mg/night) for 8-9 months. I quit CT and felt nothing and I could even sleep normally after 2 nights.",2,{},"{'label': 'positive', 'score': 0.5849885}"
2020-04-26 10:08:08,https://www.reddit.com/r/benzorecovery/comments/g8ewrs/4_montha_oft_and_struggling/,4 montha oft and struggling,"I'm now almost 4 months off after CT. 

I feel now healthy, I have more energy, sleep is pretty normal, my derealization is gone and my crippling anxiety is also almost gone, but I have the strong argue to take the benzos again. 
Its more of a psychological thing, I just want to relax and forget the shit around me. Just forget everything what happened, my problems right now, my anxiety about the future.

I'm becoming the ""old me"" again which kinda sucks, I was always the quit and patient guy, did everything for others and never showed my true emotions which resulted in inner tension and anxiety. 
Benzos took that edge away, they made me feel less anxious, more like myself and relaxing. It made me forget the shit around me and everything that happened in the past and I just could relax and be in the present moment. 

Don't get me wrong, I'm very lucky that I no longer have brutal withdrawal symptoms and that I have more energy, normal sleep and feel human again, but I also don't want to be my old self again. Maybe should see a therapist, but I don't have the money. 

I still have the option to try Zoloft, my psych doc prescribed it me against the anxiety and depression and I think it's better than benzo but I still don't know if I should try it. 

I think the decision to quit the benzos was right, especially for my health, but I sometimes still want to take them. 
My life is pretty shitty right now and I don't know if I have the strength to turn everything around. 

You guys are pretty amazing here, thank you for all the support that I've received here, especially in my last post. 
I wish I could have answered to anyone, but I did not have the strength back then.",1,{},"{'label': 'neutral', 'score': 0.3853168}"
2020-04-26 01:27:09,https://www.reddit.com/r/benzorecovery/comments/g88txd/9_years_took_clonazepam_as_directed_never_abused/,"9 years, took clonazepam as directed, never abused (varied 0.5-3mg), completely ruined my life, about to end a 13 month taper and filled my last refill ever and close a terrible chapter of my life and here to help people!! AMA","More detail-  
 Started taking this as directed by a doctor DAILY <--(that's the key to all of this more later) for-Panic Disorder and GAD via the DSM and psychiatry after I got out of the Army. The military stuff is irreverent but worth mentioning for context. During my second deployment while in Iraq something happened..blah blah blah, throwing me into the wonderful world of never ending gas lighting and madness...psychiatry.     


After a myriad of psyche drugs (I think I've taking them all at this point, one time or another or so it seemed..over 30 at least) I was given a benzodiazepine. The answer to a question that didn't exist and what would later put me through a hell I didn't know existed.   


I would say with some degree of assertion that the first 2 years it helped immensely. I was living life like I used to, I was 'free' of crippling crap I hate talking about. I thought, great, a pill exists to help deal with this or almost eliminated it completely...almost. And with a price I was very very unaware of.   


Time passed as it does and I started noticing cognitive problems and anomalies. Couldn't remember very recent events, ability to retain information seem to be in decline. But more importantly in relation to the drug and what it was supposed to be helping, my anxiety and panic response started getting worse. Way worse.   


Back to the wonderful world of psychiatry, this increase of anxiety and panic was due to tolerance of the drug and more was needed to achieve the same effect and keep that stuff in check.  So I was told and believed. So I took more. I unfortunately can't recall exactly how much was or when but I know the majority was at least 1.5mg of clonazepam and at least 4 years at 3mgs. que frown face...  


My mother passed away at this time while I was at 3mg and barely recall the event (perhaps some of that was instinctive and we hide things to deal with them but a majority of the apathy was caused by floating through life on auto pilot and not accurately recording things via a drug called clonazepam). I digress. 

I have a ton more crappy stories related to what happened to me and how this actually effects people who are prescribed daily for years and decide or are forced to quit. Nothing can compare to the hell it is. Nothing. It has a place in every area of torture.  


I have a ton of stories about cold turkeying, rapid taper, slow traper, water, scales, milk, the Aston method, supplements that help (sorry but most don't), other drugs while tapering, drinking while tapering, CBD and the THC thing...I've learned WAY more than I ever wanted to about this insanity,   


With all that said, my purpose here isn't to scare people but to educate and warn them. I see people using this class of drug recreationally . Hey, to each their own. Everyone sails their own ship.   
However, using this drug recreationally falls silent on me because my idea of a party isn't going to sleep or being a completely useless zombie. At least when I drink I'm a useful zombie. When I drink too much, at least it's sometimes fun. When I took too much benzo, it was just sleepy time-which is the opposite of party time for me, but once again, to each their own.    


TLDR- Benzos suck, they make everything worse, I can't see rec value in them and....AMA!",52,{},"{'label': 'negative', 'score': 0.54660386}"
2020-04-25 19:20:40,https://www.reddit.com/r/benzorecovery/comments/g834lx/peoples_experience_of_alcohol_after_benzo/?utm_source=ifttt,Peoples experience of alcohol after benzo withdrawal,,1,{},"{'label': 'neutral', 'score': 0.77797174}"
