,Date,URL,Title,Body,Score,COVID-19 Mentions
79,2021-04-15 08:04:03,https://www.reddit.com/r/quittingphenibut/comments/mrd7ri/i_quit_phenibut_before_my_surgery/,I quit phenibut before my surgery,"Best decision I made tbh, I knew after surgery I was gonna recover for a couple weeks so I decided to quit phenibut aswell. I didn't really had to deal with any withrawals because of surgery recovery. It's been 10 days since my surgery. NEVER TAKING THAT SHIT AGAIN.",8,0
80,2021-04-15 07:39:54,https://www.reddit.com/r/quittingphenibut/comments/mrcu55/went_through_6070g_in_4_days_could_this_be/,Went through 60-70g in 4 days could this be withdrawal or a hard rebound?,"I took a 6 month break from phenibut and hit it hard the reason my dose is so high is because I occasionally would take it on a full stomach. I’m having shakes, anxiety, insomnia, diarrhea and blurred vision. Would this be withdrawal or a hard rebound?",0,0
81,2021-04-15 05:54:57,https://www.reddit.com/r/quittingphenibut/comments/mrbk02/just_some_questions_about_dosing_during_a_taper/,Just some questions about dosing during a taper,"Hey all,
Am currently about 6gpd on a painstakingly slow taper. Lately I have been having insufferable almost panic like anxiety at night into the early morning. I have the whole time I’ve been on phenibut-maybe a year and a half now dose only once per day, would it help to split up my dose between two different times of day? I’ve found myself in a vicious cycle at times dosing my regular time late morning to then get anxiety late late that night then breaking my taper and taking more to take more and calm down which of course doesn’t happen for hours. Any tips to help with this anxiety? Thanks and to all people out there trying to kick this monster keep it up you’re awesome 😃",1,0
82,2021-04-15 03:38:18,https://www.reddit.com/r/quittingphenibut/comments/mr9w1t/please_help/,Please help,"I have been on Phenibut for the past 3 years, am currently on 14gpd tapered down from 16gpd in this past week. Goal is to at least go down a gram a week until I hit about 7gpd and slow it down from there. Is there anybody in this forum that has a success story in regards to tapering and quiting from such a high dose? If so I would be beyond greatful to hear your story; as of right now my spirits are very low.",2,0
83,2021-04-09 14:02:15,https://www.reddit.com/r/quittingphenibut/comments/mnmyxe/baclofen_arrived_is_it_safe_with_kratom/,"Baclofen arrived, Is it safe with kratom?","I am on under 1gpd phenibut (700mg -1000mg) and take 30GPD kratom, And caffine and nicotine, I just got a bottle of 100 10mg baclofen, I plan on taking one to see how it feels, (I am starting with half a pill first). I am wondering if this is a safe drug combination, has anyone mixed phenibut kratom and baclofen together?",1,0
84,2021-04-08 07:46:16,https://www.reddit.com/r/quittingphenibut/comments/mmpzhw/replacement/,Replacement,"500mg Agmatine+200mg L-theanine+500mg lemon balm gives me the same anxiety reduction as 500mg phenibut.

Too high of a dose of any of the supplements mentioned just gives me a massive headache so ymmv.

I get the same mood boost, social anxiety reduction and calmness. Just without the added euphoria and disinhibition/hypomania.",5,0
85,2021-04-07 21:43:36,https://www.reddit.com/r/quittingphenibut/comments/mmh7js/cold_turkey_is_not_to_be_messed_with/,Cold turkey is not to be messed with,"I’ll attempt to keep this post brief. I started my phenibut use 2 months ago, and after that first dose I fell in love with this substance. I have a history of severe depression as well as social anxiety so this was the perfect fix etc. I had read about how addictive it can be but chose to disregard this(foolish given I’m an addict but my brain doesn’t work in my favor sometimes). Immediately after that first day I took another 1 gram dose, and within the following 2 months I managed to get up to 3gpd with 4 gram doses mixed in on the weekends. I’d say about 5 weeks in I noticed the substance lacked what it first gave me, I chose to push on still and by week 8 I was a “phen zombie”. This drug turned so fast and I felt like I was viewing life from 3rd person during this time, total brain fog, I noticed I barely talked when I’d hangout with friends and on top of this I was more depressed than when I started phenibut. 

So last Thursday I decided I was going cold turkey, I went in with a sense of optimism as I thought my usage window and dosage were low enough. The first three days were smooth sailing for the most part, I had NAC, agmatine, and kratom to help me through it. I was also lucky to have some cyclobenzaprine(muscle relaxer) which made sleeping effortless, I really felt as if I’d jumped off successfully, that was until Sunday night came. Around midnight I had a sharp stabbing chest pain right in my heart. The following hour I dealt with heart palpitations, intense tachycardia, and a shooting pain that went from my heart up to my neck. In a panic I dosed a gram of phenibut hoping it would help, but it provided no relief. I’ve had heart issues before but this was so different, I was legitimately scared for my life, something I honestly hadn’t felt this intensely before. 

I quickly made my way to the ER, and they hooked me up to an IV of something to calm me down, I didn’t even ask what. They said I had a BP of 211/110 and was lucky I came in when I did or things would’ve gotten worse. Now here’s the shitty part, I explained to them over and over what phenibut was and how I was going through a withdrawal but instead of giving me anything for the road they got my vitals to baseline, sent me home, and told me to visit my family doctor(very helpful right?) so the following day I dosed 1.5 grams(900mg morning, 600mg night) and decided I need to obviously taper. It’s now Wednesday and I’m at 900mg, i haven’t experienced any discomfort and will probably continue to drop 300mg a day until Im at 300mg, then I plan to jump off slowly to hopefully eliminate w/d. Also going to see my doc Friday about getting some baclofen or gabapentin. I can’t wait to be done with this substance. Don’t make the same mistake I did, just do a taper it’ll probably save you a lot of pain and a nice ER bill.

Update: the 300mg a day was too harsh, Wednesday night I was pretty uncomfortable. More palpitations and tachycardia, so I dosed another 300mg that night to bring me back up to 900mg for the day. It’s now Friday and I’m at 700mg for the day, so far no problems, looks like I could be off by next week if this works!",6,0
86,2021-04-07 18:18:26,https://www.reddit.com/r/quittingphenibut/comments/mmdgp4/confusion_on_withdrawal/,Confusion on Withdrawal,"I was using every 3 or 4 days for 2-3 weeks.  I used one day after the other in tbe beginnint with like 1-2 grams.  Then every third day Id take 3-4 grams.  Id use 4-6 grams in a day every 3rd or 4th day after I did this.  I did 6g, then 3 days later 4 ir 5, then 4 days later 5g.  Before I did the last dose I wasn't having any withdrawals but last night (2 days after that 5 gram dose) i was having anxiety and worries of seizures (im epileptic so my threshold is much lower).  I know the dosage I was taking was high but I was doing it pretty spaced out and I'm confused about the random effects of withdrawals.  Now I'm gonna wean myself off but I'm not sure how much to go down.  I took 3.5 grams this morning which is 1.5 less than the dose before.  I want to get out as quickly as possible without worrying about having seizures.  What taper would you guys recommend?  I'll only dose every 48 hours or so.  I know its silly to use such a high dose especially with prior health issues.  I don't want to hear about that.  Just need some help because I've already decided to stop.  As I said, I've only used it like 3 weeks.  Probably 30 grams or so total.  I don't want to deal with seizures.  It's my biggest fear.",1,0
87,2021-04-07 17:20:26,https://www.reddit.com/r/quittingphenibut/comments/mmc9u6/addicted_to_snorting_a_gram_of_phenibut_a_day/,Addicted to snorting a gram of Phenibut a day.,"Just kidding, but imagine that haha.

Edit: Glad everyone’s getting a good laugh out of this.",22,0
88,2021-04-07 17:01:43,https://www.reddit.com/r/quittingphenibut/comments/mmbvs7/please_help/,Please help,"I don’t know if this is against the rules but I have been having trouble tapering my 2gpd habit any further, wanted to look into baclofen or gabapentin/lyrica but all doctors I’ve tried refuse to prescribe anything to help. I don’t know anyone who has any or how to get any, not asking for any sources just someone to PM me and maybe show me the ropes! Please!",2,0
89,2021-04-07 16:05:26,https://www.reddit.com/r/quittingphenibut/comments/mmaoxa/stimulant_and_phenibut_combo_addiction/,Stimulant and phenibut combo addiction,"So I've been using the combo throughout the last few weeks and it tends to make me extremely euphoric, manic, and compulsively redose. The phenibut takes away all the edginess and adds this layer of euphoria that's on par with MDMA. 

It's like a never ending light roll that last forever and it tends to make the adderall 2x as long. But the only issue is that my supply for both are very strong. My connections for both substances is great and it's starting to take a toll on my mental health. I find myself going through mood swings the day after I use the combo and that'll last for like a week or so.


I notice that very small things annoy me and even with 8 hours of sleep each night, I still feel exhausted unless I dose again. Has anyone here also been through stimulant and phenibut combo addiction?

I really want to stop but the withdrawal from both and rebound from both are making it EXTREMELY difficult. I suggest anyone reading this try this combo at your own risk if you have an addictive personality. It feels amazing.",3,0
90,2021-04-07 11:36:56,https://www.reddit.com/r/quittingphenibut/comments/mm4tx1/for_those_out_of_withdrawals_but_still_feeling/,For those out of withdrawals but still feeling terrible,"As a disclaimer I'm not an expert, I've done maybe 2 hours of light, non-academic research on Gotu Kola, this is just my experience and what I've learned after looking at studies that I find linked in reddit posts and reading testimonials. I know that it's generally better to deal with symptoms rather than covering them up with another drug, but if it's between this or more Phenibut I'd say that this is a healthier alternative.

This post is premature. It's been 5 days now since my overdose of 15 grams with no tolerance and in the following days I felt anxious, sluggish, have had no appetite, no ability to do any of my school work or basic things like getting groceries. I haven't taken any more phenibut since then, and I thought it would be weeks before I could feel functional, but a package of Gotu Kola arrived yesterday and taking one 450mg pill made me feel better than my average, I finally put 2 real meals in me, cleaned a little bit, talked on the phone, and went grocery shopping, I even got a decent sleep albeit with some crazy dreams, all things that wouldn't have happened otherwise. 

Gotu Kola is a GABAergic but supposedly has no withdrawals, addiction potential or rebound anxiety, though I haven't tested that yet. It's also known to promote healthier skin, increase circulation, promote working memory, and be a mood enhancer. 

If you're occasionally taking phenibut just to feel like yourself this is probably a much healthier alternative which actually has some positive effects on ones body. 

Again, I'm not an expert on this, this is just my very short experience with Gotu Kola and an attempt to bring it to the attention of those who may not know about it.",9,0
91,2021-04-07 05:37:30,https://www.reddit.com/r/quittingphenibut/comments/mlyfld/is_anyone_experiencing_pain_in_dreams_after/,"Is anyone experiencing ""Pain"" in dreams after quitting phenibut","I didn't think it was possible, whenever an event occurred in a dream that ought to be painful it would wake me or somehow transform the dream. Now some dreams feel like torture sessions, it's quiet strange.",5,0
92,2021-04-07 02:16:32,https://www.reddit.com/r/quittingphenibut/comments/mlvt5g/oh_man_this_is_tough/,"Oh man, this is tough.","I really wish this stuff was just regulated and prescribed. I’m at 3.86g x2 a day, morning and night. My GP is thankfully awesome. She’s aware of the situation, and together her and I have tapered off a 600mg a day Lyrica addiction, (which was surprisingly effortless) and a 5mg a day Xanax habit, (this one sucked, but over time it was totally doable). I was taking all three at once, the phenibut at varying but progressive dosages. It’s funny, I started all of these drugs because I had become addicted to GHB, (I’m a depressive, it brought a lot of color, but an equal amount of destruction into my life) and after a round of barbaric detox at camh, the alleged ‘Cutting’ edge in mental health and addiction research in Toronto, I would inevitably find myself rolling in the juice usually a few weeks after getting out. 

I did some research. At the time, my old GP, who was totally unfamiliar, stigmatizing and judgemental towards drug users, suggested that I use Lyrica as an antidepressant due to my history with substance abuse, and the fact that it was non-habit forming, or a drug you could abuse. (It was sort of unknown at this point, but I quickly realized that it’s street value was insane and everyone was about it lol). It did fuck all for me, other than knock me on my ass of 72 full hours. I felt, and never did feel any positive effect from it. I know a lot of people on other feeds rave about it, but I found it to be zombifying and underwhelming at best. In fact the only positive was that it potentiated all the other drugs I was on. 

It’s main advantage I discovered was how well it worked when used in a high dose alongside phenibut to get off of GHB after a weekend bender. These little vacations would always leave me physically dependent. My Brain loved the shit and had a hard time off of it. I wrote it all down somewhere, and I’m not advocating this or saying anyone else should do it because this could be a potentially fatal withdrawal, but I found that when I took my last shot of g, if I did it with a huge dose of lyrica, and a gram of phenibut, it completely negated the ‘fear’. A term I used for the intensely dangerous, psychosis laden withdrawal off of GHB. It even made it sort of fun and trippy. Turns out Lyrica is great at protecting your neurons from the damage caused by lack of GHB, and the subsequent flood of glutamate and excitoxicity that happens during this process. So I would sort of drift off into this vaguely hallucinogenic, deepened slumber which would generally last from 12-15 hours. It was peaceful, painless and afterwards I would follow this strict regiment of taken only enough phenibut/Lyrica that I wouldn’t become addicted if I tapered down quickly. 

Until I just started to take both of those drugs daily. Which is how I ended up here. 

I find now that my GHB use is basically rendered useless. I feel like Phenibut is what methadone is to GHB’s fentanyl. I work at a a safe injection site in toronto, so I hear a lot about how methadone increases people’s tolerance to fent or other opiates, I’m not sure what the mechanism of action is there, but it sounds similar to how phenibut works. Additionally GHB/FENT=rush, super intoxicating, major CNS depressants, fast hard debilitating/potentially life threatening WD’s, (especially now with the amount of etizolam which is extremely common to find in fentanyl these days, which makes dopesickness an actual life threatening condition) vs PHENIBUT/METHADONE=mildly intoxicating, a feeling of wellness, not incredibly dangerous but obviously use some sense especially when mixing, but these two come with an even harder, more excruciating withdrawal. However methadone doesn’t put you at risk for seizures. It just sucks really bad from the multiple people thatve told me about it. 

Long story boring, people who are on a steady regiment of methadone, have to use a lot more fentanyl to feel it’s effects, and it’s not nearly as fun as just using fentanyl without the methadone. Which is the same way I feel that phenibut has taken the fun out of GHB. I literally never have flails anymore, not that these are always great, but every once in a while they can be fun. The high lasts maybe 20 minutes at most, and it’s dull and sort of pointless. 

Sorry I’m really getting off track here.. 

I now use phenibut daily still, 3.86g, with a .5 klonopin back every morning and night. 

I realize that this isn’t sustainable. I buy it in kilos, and usually stock up big time when I have to, so I don’t usually have a threat of running out, unless I’m incarcerated but usually I’m pretty good. Still something that scares the shit out of me tho. I don’t really have any reason to be arrested in general unless it’s for rallying or protesting something, but these are usually peaceful and I’m safe with what I carry/act. I hear horror stories from folks at the site who are often arrested and put into holding. Their cries for a doctor while being in a white-knuckled, pant-shitting state of opiate withdrawals are almost always purposely ignored, which i consider a heinous violation of human rights and a dehumanizing torturous experience that our corrupt brutalist prison system needs to wake the fuck up to. 

It makes me think of what would happen if it were myself in that situation. Most doctors don’t even fuckin know what phenibut is! I literally had to ask three MD’s whom all specialize in addiction medicine to finally get one that had even heard of it, and she (thankfully) took the time to get to know it and understand how it works, which she basically did by going through Reddit posts lol. (Big ups, Reddit is officially unofficial medical literature). I highly doubt tho that any prison doctor would know or even give a flying FUCK if I were to be going through a hard phenibut withdrawal. To the untrained eye the WD’s with fentanyl and phenibut are similar, sweats, profusive vomiting, chills, shakes, restlessness, insomnia. The obvious difference being the risk of a cerebral event like a seizure or the myriad of other life threatening issues a long term phenibut user could endure. 

It’s scares the shit out of me, potentially dying in a prison cell with a bunch of CO’s staring at me like I couldn’t handle being dopesick. Chuckling, “hey look at that one squirm”. 

I’m again, not at huge risk of being arrested, but still. 

Also again, sidetracked. 

I honestly just wish there was a way to have it brought into Canada and approved by health Canada to be used and distributed pharmaceutically. My quality of life has vastly increased since I’ve started using this drug. I’m happier, more engaged, motivated. I’m not the person who walks through life in a state of perpetual anhedonia anymore. I feel good, like honestly happy to be here. More so than I ever have. 

But I also realize that this is there is a lie that phenibut instills in your brain. There is a horribly dark side to it. The brain fog. The amnesiatic effect it has. Total memory lapses. The non-linear thought process and the frustration which happens as a result. The subtle anxiety. The total control it has over everything. It’s like a fucking nightmare. It’s not working for me, ive just convinced myself that everything’s the best which is unfair, and I need to stop doing this to myself. I would honestly rather feel nothing than continue living a comfortable lie, because at least I know I can work with ground zero now. 

Any suggestions? I’ve been using this drug every day for four years. I’ve considered going back down at the rate I went up. But I can’t imagine that’s sustainable. My GP had given me a script for baclofen, which I’m supposed to take while doing a 10% taper every two weeks, increasing the dosage of baclofen as needed. 

Has anyone ever done that well? 

Thanks",7,0
93,2021-04-06 18:37:59,https://www.reddit.com/r/quittingphenibut/comments/mlnu7b/how_long_to_recover_fully_from_an_overdose/,How long to recover fully from an overdose?,"For reasons I'm not going to disclose, I took roughly 15 grams of phenibut one night with a low tolerance, and was mostly fine that night. The next day, I woke up and felt ill, I was incredibly tired, I kept throwing up, I would fall asleep and had to be shaken very hard to be woken up, I had what I can only assume are micro seizures, my blood pressure fluctuated wildly, I had visual artifacts showing up, it was a very negative experience overall and I was stupid for taking that much. 

Since then, I haven't had any. I feel more anxious, empty, my appetite is diminished, and I've had a hard time sleeping well. Part of this I have to attribute to dehydration and a lack of quality food, but I think a lot of it is due to the phenibut. I've read some reports of overdoses, but haven't yet come across the specific symptoms that I'm describing, only more serious ones. 

I wasn't addicted prior to taking this dose, and I felt pretty good generally on days without it. I just want to know how long it'll take me to recover fully, if there's any likelihood I seriously damaged my organs, and if there's anything I can do to speed up my recovery and get back to how I was before. 

Thanks",3,0
94,2021-04-06 15:09:28,https://www.reddit.com/r/quittingphenibut/comments/mlj7rf/time_to_quit_i_need_some_help_from_you_guys_though/,Time to quit. I need some help from you guys though.,"So I started taking Phenibut about a year ago with no knowledge of how easily it is to get addicted to it and completely ignored the fact that I shouldn’t take it every day. So stupid, I know. I also didn’t realize how bad the physical w/d can be. I quickly got up to 3 grams per day within about a week of taking it. Then my tolerance just kept increasing and now I’m at 9 grams per day. 

I need to be done with phenibut but I don’t know exactly how to go about it. So far, I’ve just been going down by 250mg. I was at 9.25g and yesterday I was at 9 and today I’ll do 8.75. 

Any advice would be greatly appreciated. Is my taper schedule ok? Should I go quicker in the beginning? What other supplements will help me with withdrawal? 
My withdrawal symptoms mostly consist of extreme restlessness, like restless legs and arms. I didn’t notice any other ones because the RLS was so overpowering. 

So yea any advice would be amazing. I’ve been careless and reckless.",10,0
95,2021-04-06 14:19:39,https://www.reddit.com/r/quittingphenibut/comments/mli3js/time_to_quit_4gpd_for_nearly_3months/,Time to quit... 4GPD for nearly 3months,"Hey guys,

I find out about Phenibut 3momths ago and I was using since then daily... It eliminated my anxiety and made me enjoy the life again but it can't continue for too long.

After two months of using I used all phenibut and I had to order more with fast shipping because them few days I had really bad rebound anxiety and panic attacks so whenever I received my phenibut I continued using it.

So now its time to taper and I want to ask you guys for advice what can I use to help for withdrawal? I have access basically to all medicine... I heard backlofen and gabapentin should help?
I also ordered scales so I can measure correctly my dose of phenibut

Also anyone getting weird side effect that my hands are getting blue/red and my knuckles are getting purple and red

I know I did mistake by using it daily so dont need to comment that.

Thanks!",1,0
96,2021-04-06 12:24:11,https://www.reddit.com/r/quittingphenibut/comments/mlfi64/fphenibut_for_quitting/,F-Phenibut for quitting?,"I have been taking Phenibut for a few years now and it's gotten to the point of taking far too much far too often. (3+ grams every 2-3 days). This cycle has been causing me a few issues. On off days I often have these symptoms: Insomnia, irritability, horrible cravings etc. (Standard Phenibut dependance symptoms).

 I have tried to quit a couple of times but I apparently lack the willpower. I have read some content online regarding F-Phenibut and from what I've read, a lot of the negative side affects described above aren't as apparent? Less dependance, withdrawal, etc. (Feel free to clarify). I was hoping that switching over may help lead to gradually tapering off and eventually quitting.

Thanks",2,0
