,Date,URL,Title,Body,Score,COVID-19 Mentions
0,2021-04-29 20:28:46,https://www.reddit.com/r/quittingphenibut/comments/n1ib4i/does_nicotinic_acid_lower_glutamate/,Does Nicotinic acid lower glutamate ?,Does it,1,0
1,2021-04-29 17:53:15,https://www.reddit.com/r/quittingphenibut/comments/n1f8qr/my_situation_is_really_weird/,My situation is really weird.,"Does anybody know of any places in CA to detox? I’m getting prepared just incase. I got myself in a mess I was taking 40gpd i cut my dose in half with agmatine then i felt completely find on 20g the next day i cut down to 16.50g... still fine but i hadn’t slept more than 1 hour in 3 days now i’ve been on 16g for 3 days and while i still don’t feel much anxiety or depression i can’t sleep more than an hour at night! Ii don’t feel like i’m withdrawing i just can’t sleep! I have been on phenibut for 3 years. 
I thought after stabilizing at the same dose for 3 days i would get some sleep. I have no idea if i should take gram before bed and see if that works or wth to do i’ve tried melatonin the only thing that has helped is gabapentin but it helps me sleep 2 hours max honestly. Should i stick to this dose for a day or two longer? When I take it in the morning i feel less shakey so i’m guessing if i take another gram i’ll feel the “magic” more and be able to sleep but i’m just confused and trying to stay calm. If i could sleep I would continue the taper normally.

I just basically don’t want to start hallucinating i’m pretty sure the gabapentin will give me at least 2 hours sleep. And continue to try to hold steady at this dose to see if i adjust to it",2,0
2,2021-04-29 13:22:17,https://www.reddit.com/r/quittingphenibut/comments/n19clx/im_sooooo_close/,I’m sooooo close!!!,"Currently on day 5 CT off about 14 gpd for 7 days (I took around 500mg on day 2 which did literally nothing so I’m not counting it). For some background, I was a daily user dosing anywhere from 5-30gpd before tapering off with the help of benzos (which I wouldn’t recommend). Since then I end up going on little phen binges every once in a while when I’m stressed, just like I have been lately. The last 4 days have been pretty shit (high anxiety, paranoia, irritability) but knowing it’s almost over along with kratom, hydroxyzine, and seroquel has made it much more manageable. If u can help it, I wouldn’t go cold turkey during college finals like I’ve done this week. I can feel that I’m over the worst of it today, that it’s all up from here. Not sure what the point of this post is, writing on here about how I’m feeling helps my mentality a bit. Good luck to u all, if u nvr see me posting on here again that means I’ve made it and I’m off the phen.",13,0
3,2021-04-29 10:27:45,https://www.reddit.com/r/quittingphenibut/comments/n15jmo/successfully_tapering_from_3gpd/,Successfully tapering from 3gpd.,"Hey guys, I have been taking Phenibut daily for about 4 months.

Just wanted to share my experience with you guys.

My highest dose was 3grams a day.

The first 2 months I was able to consistently keep the dose at 1-1.5grams a day. Unfortunately, the stuff has so much tolerance that I started taking more to get the same effect.

I went up to 3 grams a day. The side effects became more and more. In the evening I could not sleep well, although it worked great at the beginning to sleep. I constantly had a pressure in my head and lost weight. I have always been a muscular type, so even my friends were scared when I saw them again after a long time.

From then on I knew I had to stop. Unfortunately, I made the mistake of reading all the horror stories here. What has led to the fact that I was terrified to stop. So I started with a quick taper and am now at 700mg. Every day I go down 100mg.

The worst were the withdrawal symptoms when I went down 300-400mg a day. I had bad thoughts, couldn't remember anything at work and was very depressed. The body feeling was the most disgusting at all, I was constantly under stress, especially in the evening it was always very bad and I was very scared. After 2-3 days with very little sleep I feel much better and I have absolutely no withdrawal symptoms since I slowed down with the taper.

I smoke weed in the evening to sleep better. However, I would be very careful with it. Just smoke very slowly and then wait how you feel. I'm just glad to be off this stuff soon, although it has brought me a lot, it has also set me back professionally. Since I was somehow more busy listening to music and surfing the web than doing my job.

Please be careful with phenibut and respect it. Don't get discouraged with the taper even if it gets difficult sometimes. It gets better and better.

supplements i take during tapering.

Shilajit

magnesium glycinate

creatine

NAC

excuse my english (second language)

Wish you all the best!",9,0
4,2021-04-29 07:41:38,https://www.reddit.com/r/quittingphenibut/comments/n12hf4/no_luck_getting_helper_meds_prescribed/,No luck getting helper meds prescribed,Except for gabapentin. I’ve asked for Seroquel and baclofen but no luck from my neurologist who knows actually knows about phenibut and also my GP. Gonna try to go to a clinic tomorrow does anyone have the case study i’ve seen people say to show the doc? i’m getting frustrated cuz i’m having such a hard time sleeping still.,1,0
5,2021-04-28 23:07:36,https://www.reddit.com/r/quittingphenibut/comments/n0vhv8/is_aniracetam_dangerous_while_withdrawing_phenibut/,Is Aniracetam dangerous while withdrawing phenibut?,Since it increase glutamate ? Would I have a seizure ?,2,0
6,2021-04-28 23:01:31,https://www.reddit.com/r/quittingphenibut/comments/n0ve7g/scotomas_from_phenibut_withdrawal/,Scotomas from phenibut withdrawal,"Everytime I drop my dose significantly, I experience blind spots. Like lets say I’m looking in the mirror, if i look off a few feet to the right or left my facial features become twisted and ugly. Is this normal and I’m just noticing it or is it from withdrawal? Also I have sparkles all over my visual field now",1,0
7,2021-04-28 20:47:55,https://www.reddit.com/r/quittingphenibut/comments/n0t48z/gabapentin/,Gabapentin,Does anyone in this sub have any experience using Gabapentin to either quit completely or aid in a taper? I have acquired access to 40 600mg gabapentin per month and I know they can at least be of some benefit to me attempting to eliminate my 3.7GPD habit as it is also a gabapentinoid and chemically similar.  I have already began tapering 50mg every two days and am down 3.4gpd without noticing a difference. Any insight is much appreciated!,6,0
8,2021-04-28 10:58:28,https://www.reddit.com/r/quittingphenibut/comments/n0goo5/phenibut_taper_with_baclofen_or_immediately/,Phenibut taper with Baclofen or immediately substitute in Baclofen?,"Finally deciding I've had enough. 9g user and I've been using daily at varying doses for 2 1/2 years. 

I have around 70 10mg Baclofen tablets. I can order more but I'd need to wait a month for them to arrive. 

My question is, should I immediately switch to 90mg (30mg 3x a day) and taper down or do a fast Phenibut taper with Baclofen? 

For the fast Phenibut/Baclofen taper, I was thinking that I could jump to 8g Phenibut in the morning and take 10mg later in the day. I could lower my Phenibut dose by 500mg every few days and increase my baclofen dose accordingly. Once I've jumped off Phenibut, I'd start my Baclofen taper.

Thoughts? Guidance? This shit stresses me tf out lol",8,0
9,2021-04-28 10:28:44,https://www.reddit.com/r/quittingphenibut/comments/n0g1ne/found_a_new_sleep_withdrawal_aid_combo/,found a new sleep / withdrawal aid combo,Smoking some CBD flower with .3 THC and then if you add some gabapentin on-top it’s extremely relaxing. Put me to sleep.,1,0
10,2021-04-27 20:28:37,https://www.reddit.com/r/quittingphenibut/comments/n02okw/having_a_hard_time_with_sleep_and_mild_panick/,Having a hard time with sleep and mild panick attacks.,"I know this isnt much compared to some others experiences but I'm starting to feel crazy. I was dumb and binged on phenibut for about a week, Thursday to Thursday with maybe a day off in there somewhere. Everything started on Sunday night though. 

For the last 3 nights I've been lucky to get an hour or two of sleep. It was a little better last night but still agony. I have weed but it hasn't really help me sleep, it just raises my heartrate and then the mild panick attacks start. 

I tried melatonin, gen 1 antihistamines, and weed so far. I was looking around in my medicine cabinet and came across some Benzonatate, a non-psyhoactive cough suppressant which is known to induce drowsiness. Has anyone ever had luck with Benzonatate to get them through the rebound insomnia? And how much longer is this gonna last?

Tl:dr. Will Benzonatate be strong enough to combat rebound insomnia and does anyone know how much longer till I can sleep?",1,0
11,2021-04-27 18:54:05,https://www.reddit.com/r/quittingphenibut/comments/n00wfa/didnt_think_it_would_cause_such_bad_withdrawals/,Didn’t think it would cause such bad withdrawals,"I recently tried phenibut and liked it a bit too much. I took it for about a month with the last two weeks before quitting I took it 10 or so days. It’s been 4 days since I last had any and the anxiety has been pretty bad. The tremors are the worst though. My hands are shaking so badly. How long is the withdrawal timeline?

I’m glad I through the rest of this stuff out and don’t have any intention of going back to this stuff.",2,0
12,2021-04-27 18:08:27,https://www.reddit.com/r/quittingphenibut/comments/mzzze6/this_subreddits_existence_is_harm_reduction_in/,"This subreddit's existence is harm reduction in itself, thank you.","When i first got into Phenibut, seeing this subreddit even existed was it's own warning. I fell into daily, multi-gram, months long use multiple times, but at least I knew that it was a stupid fucking idea. If I didn't know about this subreddit, I may have been even less careful. I may have quit in a much more dangerous way than I did, or maybe not have quit at all.

I'm a few weeks phenibut clean from my last relapse. I don't have money to buy more, and I hope I can keep this up when I do. I'm not sober, but nothing else I take fucks with my GABA, so I'm at least letting _that_ heal. I know this doesn't solve the core addiction problem, but phenibut is hella dangerous to take daily, and no longer doing that is a start.

Thanks y'all, hope this all makes sense, just needed to tell someone❤",21,0
13,2021-04-27 17:40:39,https://www.reddit.com/r/quittingphenibut/comments/mzzdru/does_kratom_help_delay_or_hurt_phenibut_withdrawal/,"Does kratom help, delay or hurt phenibut withdrawal?",,2,0
14,2021-04-27 12:19:40,https://www.reddit.com/r/quittingphenibut/comments/mzs5mt/so_much_of_phenibut_wd_is_mentality/,So much of phenibut WD is mentality,"Maybe this isn’t true for everyone, but for me my phen WD’s are hugely influenced by my mentality about it and what I expect from how long I’ve been using. Last time I went CT after a 7 day relapse, I expected it to be absolutely horrible and to last at least a week and that’s exactly what happened, but looking back I feel like a lot of the anxiety I had was because I was so worried about how the WD’s would be. This time, I know I’ll be able to sleep with enough seroquel, I know the dose and length of time I was using wasn’t enough to cause any major issues, and I feel better then I have in any of my CT attempts. My advice to people is avoid reading horror stories on this sub AT ALL COSTS as in my experience it will make tapering or going CT a whole lot worse.",14,0
15,2021-04-27 11:10:31,https://www.reddit.com/r/quittingphenibut/comments/mzqltu/any_long_term_users_trying_to_quit_now/,Any long term users?? trying to quit now??,"Hey,I've used phenibut for 2 years..I'm now quitting 4 grams cause it's turned on me..I believe it's cause neurological damage..I could go into symptoms but from what I get from Google it fits eosinophilia..I'm in the middle of geia bunch of tests done...but basically how long have some of you used phenibut??I should add I am going to use baclofen for a time..also already use clonazepam..I have been on them for years and will continue the as they are needed...",2,0
16,2021-04-27 10:09:40,https://www.reddit.com/r/quittingphenibut/comments/mzpa9h/45g15g27gpd/,45g-15g-27gpd,"This is a mess and i’m terrified. Ok so i just made a post earlier about not sleeping for 3 days and someone mentioned i probably cut my dose too much well the truth is i cut from 45g to 30g with agatamine and was fine and then to 15g the next day i know i’m dumb but honestly i cut my dose in half the same why last year and the magic came back and my tolerance was permanently lowered. Well didn’t happen this time now i kept adding a little more phenibut from 15g expecting the magic to come back to get some sleep.. no magic in sight... 2 more grams... nothing... 3 more.. etc now i’m at 27g and while i don’t feel in a withdrawal state i have no idea where to go i know if i go to 45 that’s where i’ll be able to sleep but it’s getting really fucking hard to afford this! i’m thinking about just saying fuck it and going to detox i can’t imagine how long tapering from 45g would take of milking my wallets. I’m going to stay at my current dose and pray i can get some sleep FUCK man

Edit: I calmed down a bit the phenibut kicked in but fingers crossed i’ll be able to sleep tonight i’m sorry for my horror story. I know there’s not much advice you guys can give me. I just don’t know who else to tell.",3,0
17,2021-04-27 07:36:11,https://www.reddit.com/r/quittingphenibut/comments/mzmgfb/i_just_want_to_sleep/,i just want to sleep,Since i started tapering 3 days ago i haven’t been able to sleep more than 2 hours for the last 3 days i’ve been on phenibut for 3 hours currently at 15g i drank chamomile tea and took melatonin every night but nothing,7,0
18,2021-04-27 00:35:56,https://www.reddit.com/r/quittingphenibut/comments/mzgjs9/low_stomach_acid_caused_my_stopping_phenibut/,Low stomach acid caused my stopping phenibut?,"Can anyone attest to getting their stomach acid tested after quitting Phenibut and if it was low or not? 

I have been symptom free except for when I eat food or when I feel gurgling in my stomach. When that happens I begin to feel a tingling in many parts of my body, burp a lot, increased heart rate, and sometimes my vision gets weird. Not blurry, just weird lol. 

I have been wondering if I was having acid reflux due to too much acid in my stomach, but recent reading has me thinking that I may have too little stomach acid... 

Does anyone know if taking Phenibut and then stopping cold turkey would cause your stomach to produce less stomach acid? 

Thanks for any help",1,0
19,2021-04-26 20:46:31,https://www.reddit.com/r/quittingphenibut/comments/mzckil/phenibut_binge_withdrawal/,phenibut binge withdrawal,"so i was an idiot and took 30 grams in 3 days, how extreme are my symptoms gonna be 29 hours in and i feel a little anxiety,
edit: so far im shivering, anxious, and muscles are sore",1,0
20,2021-04-26 19:43:14,https://www.reddit.com/r/quittingphenibut/comments/mzbcwk/forced_ct_because_of_delayed_shipment_but_this/,"Forced CT because of delayed shipment, but this time around somethings weird.. I feel completely fine","So idk why this would be the case, but I feel mostly normal currently at 52 hours since last dose. I’ve been on 6 gpd for about 5 months. Only symptoms are just being keyed up, slightly raised HR, and of course some trouble falling asleep. Weirdly enough I actually got like 5 hours of sleep from the 40 hr mark to the 45 hr mark. 

This is the third forced CT I’ve had to deal with and I was under the impression that kindling made each WD worse than the last. But other than those mild symptoms, I’ve even been able to laugh and joke with people etc. 

The only things I’ve done differently this time are working out daily for ~2 hrs, and I’ve been supplementing D1-T for a few months, a precursor to testosterone. I also had my dose of Effexor (SNRI) raised a month ago. 

I can’t tell if I just haven’t felt WD yet or if I’m feeling it now and just not really being phased by it. I definitely feel keyed up and anxious but not debilitating primal fear and hearing fucking 2000s pop songs playing in the room next to me at 5 am like the last time; or waking up gasping for air. 

Any time I’m feeling anxious this time I just immediately shut that shit down, like I just think to myself “nah, you can’t fool me, I know you’re just fucking with my perception.” It’s like my resolve has been strengthened.

Frankly it’s kind of suspicious, I’m thinking now that I haven’t REALLY felt WD yet. But at this point idc because my shipment is arriving tomorrow around 4, so I need to make it 20 more hours. We’ll see what happens I guess.

What do you guys think could be the meaning of this?",7,0
21,2021-04-26 19:42:56,https://www.reddit.com/r/quittingphenibut/comments/mzbcq3/made_it_over_96hrs_ct/,Made it over 96hrs CT,"I’d made my way up to 6gpd by the end of my 6 week long run with phenibut, but I’m done. I was one of the lucky ones, no horror story to tell. Good luck everyone. Keep fighting the good fight!",10,0
22,2021-04-26 16:49:09,https://www.reddit.com/r/quittingphenibut/comments/mz7mn3/my_ongoing_phenibut_taper_success/,My ongoing phenibut taper success,"          Background: I was a heroin addict for 15 years (with maybe 2 years of sobriety during that time due to being in rehab or jail). I took 56 grams of Fresh Psilocybe Cunbensis in 2016. I thought it would approximate a dose of 5 dried grams. It did not. It felt like 8+ dried grams. I did the Terence Mackinnon silent darkness method. It cured my addiction overnight. 
            However, I still continued to binge drink. I would drink anywhere from 1-2 gallons of 9% beer every night for a few months, taper down a little bit, grab some clonazepam in case of an emergency and suffer through the withdrawals. I would stay sober a month of two and then start the process again. I tried ordering 200 etizolam pills and that helped a lot. I luckily did not get addicted to the etizolam. 
              I continued my alcohol binge sobriety/cycle for a few years. On my 35th birthday, I was given a 30mg IR Roxi. I took a TINY sliver of the pill and overdosed 20 minutes later. You guessed it,, the pills was chock full of fentanyl. After that, I again stopped all hard drugs. That was two years ago. 
               I found Phenibut in January of 2020. I took it daily from early January to Mid March 2020. I got up to about 6gpd. When the Covid shut down happened, I did a fast taper and felt weird for about 10 days. When stores started to open back up in May 2020, I got back on Phenibut until mid-June 2020. I then did a quick taper that sucked and started to go back to drinking a lot of beer daily (1-2 gallons of 9% beer).  I continued doing this until November. I also started taking about 4gpd of Phenibut in July. 
               I decided I needed to get serious about stopping. I tapered down my drinking to a gallon per day of 9% beer by late December 2020. I also ordered 200 etizolam pills which arrived in January 2021. The pills allowed me to get down to half a gallon of 9% beer by February.
              My 5 year relationship with my girlfriend completely fell apart in late February. I had already ordered another 250 etizolam pills earlier in February and they arrived at the beginning of March. I gave away a lot of the pills and traded a lot of etizolam for real 2mg alprazolam bars and 1mg Clonazepam pills (prescriptions directly from the pharmacy).  I stopped taking all the pills by late March. However, during the last week of March, I discovered I was taking close to 12gpd of Phenibut.  Over the course of a week, I was able to cut down to 7.7gpd. It was incredibly rough and I WOULD NOT RECOMMEND IT. I would certainly never attempt it again. I was using about 4gpd of Agmatine as well.
               My last drink was on March 29th. I had an amazing high dose (1,000 micrograms over 24 hours) LSD trip where I smoked a lot of DMT at the peak. I lost my desire to drink right then and there.
                 Around mid March, I ordered again ordered AGMATINE. For me,, I think it took about two weeks of dosing 4gpd to really start having the full effects (one gram per dose of Phenibut (I break my total Phenibut daily intake into 4 doses roughly 6 hours apart)).
                  THIS IS THE PART YOU HAVE ALL BEEN WAITING FOR:
                  On April 17th, 2021, I was able to get green ""xanax"" bars. They are dark web bars. They are supposedly 2mg Alprazolam, 1mg Etizolam, and 0.5-1mg FLUALPRAZOLAM.  *I  DON'T THINK THIS IS TRUE*.  I have had extensive experience with all of the aforementioned substances. I have had years long benzo addictions (via legal prescriptions and illicit sources). The last time I tapered off of benzos was 2012-2013 under a doctor's supervision. I will spare you the details, but it was pretty awful. 
                 Anyway, I can take 1/6 of a green bar and it lasts ALL DAY. Sometimes, I will take another 1/6 of a bar about 2 hours before I go to bed. 
                  I have dropped from 7.7gpd to 5.7gpd in the last week. For example, I will take 1.5g Phenibut+1/6 flualprazolam bar+1g Agmatine....6 hours later 1.4g Phenibut+1g Agmatine....in another 6 hours I will take 1.4g Phenibut+1g Agamatine+POSSIBLY 1/6 bar Flualprazolam...in another 6 hours I will take 1.4g Phenibut+1g Agmatine+POSSIBLY 1/6 bar Flualprazolam IF I DID NOT TAKE THE 1/6 BAR OF FLUALPRAZOLAM WITH ME THIRD DOSE.
                   Just remember to GO EXTREMELY LOW ON THE DOSEAGES OF FLUALPRAZOLAM! it is VERY potent and the half life is REALLY long.
                    I hope this will help people. I am sure I will get some hate for this, but this is just my humble experience. Plus, all I saw were horror stories about Flualprazolam and people dismissing it out of hand as a way to taper off of phenibut. If you are not cool with flualprazolam, I respect that. But please try agmatine. It really does help, too.  Thanks for reading this! Good luck!",1,1
23,2021-04-26 16:21:32,https://www.reddit.com/r/quittingphenibut/comments/mz7068/pregnenolone/,Pregnenolone,"Pregnenolone, huge help! Do your own DD.",1,0
24,2021-04-26 13:09:04,https://www.reddit.com/r/quittingphenibut/comments/mz2kjo/beta_alanine_for_phenibut_withdrawals/,beta alanine for phenibut withdrawals,"Sorry me again but just wanted to know what you guy's think about this?

https://www.reddit.com/r/Nootropics/comments/2zv39x/my_effective_method_to_beat_withdrawal_from_high/",3,0
25,2021-04-26 12:41:20,https://www.reddit.com/r/quittingphenibut/comments/mz1xhg/running_out_of_phenibut/,running out of phenibut,"Ok so i am f.cked. I am running out of phenibut and already going into withdrawals for a 4gram for 5 month habbit.

Got only had 9 grams left and took 1.5g now just to let it settle.

I have got Beta-alanine and baclofen 50 10mg and 0.5mg Alprazolam and 2g Clonazepamto get me to my next shipment which i hope is friday or i am really screwed.

What do i take to help me through this and at what doses do i take phenibut to get to friday from 9 grams left on a 4gpd habbit?

Please help i ma freaking the f out!!!!",5,0
26,2021-04-26 09:20:33,https://www.reddit.com/r/quittingphenibut/comments/myxic2/am_i_going_to_have_a_problem/,Am i going to have a problem?,"I have taken phenibut before occasionally here and there. But not in probably a year. This week i took 1.5g, every other day, three times this week...i poured it all out now...how much of a problem am i going to have?",2,0
27,2021-04-26 07:55:41,https://www.reddit.com/r/quittingphenibut/comments/myvy5d/6_days_post_phenibut_78_gm_d/,6 days post phenibut 7-8 gm d !,"I took my last dose of phenibut 4/20/21.  I went through the first 4 days in misery- cold sweats, shakiness, mood swings and probably the worst parts, constant RLS and very little sleep. I also use kratom and this has definitely helped though not really with the RLS or sleep. 

When I first came across phenibut I thought maybe I could use this instead of kratom ( which I’ve used daily for @ 3 years ). I’m tired of carrying around all my little pouches of kratom, the questions and the strange looks. I’d only have to use one little jar! WRONG! 

I ended up using both. Lately I was exhausted constantly and found joy in nothing. I made the choice to stop phenibut and then work on the kratom issue. I hate having to worry about where I will be when I have to take my next “dose” or avoiding people or situations because I wouldn’t have access when it wore off. 

As I’ve gotten older I’ve become much more prone to anxiety and have used phenibut and kratom to help control this. I don’t even remember the real “me” before starting kratom. I’m trying to get back to that, whatever it may be. 

On day 6 and after a stressful work weekend of two 12 hour shifts working in the hospital- with 1 1/2 hrs drive in both directions, both days- I still made it through. No more phenibut. 

This site and reading other’s stories and struggles helped me stay strong. I would have caved during those first 4 days. Thank you to everyone who has the courage to post here and stay strong!",12,0
