,Date,URL,Title,Body,Score,COVID-19 Mentions
28,2021-04-25 21:01:25,https://www.reddit.com/r/quittingphenibut/comments/mym35w/relapsed_again/,Relapsed... again.....,"I’m 100% done with this shit. I picked up a 100g bag, used like 8-16gpd for 7 days and now I’m fresh out. The thing is I didn’t even feel that great, just tired and kind of out of it. I’m probably just going to go cold turkey, unless this sub thinks it could be dangerous. My last relapse was about 3 weeks ago, used for 7 days after about 70 days clean.",2,0
29,2021-04-25 17:48:07,https://www.reddit.com/r/quittingphenibut/comments/myiho6/will_nac_prevent_cold_turkey_permanent_brain/,Will NAC prevent cold turkey permanent brain damage ?,I’ve been taking 2 grams per day for a month and then upped it to 3 grams a day the next month. This week I took 4-5 grams of phenibut everyday. I have fasoracetam NAC and also Agmatine. I personally believe I can cold turkey at least for a week with just these substances but I just don’t want to cause much glutamate toxicity. With high doses of NAC and Agmatine can I do this ?,4,0
30,2021-04-25 12:58:54,https://www.reddit.com/r/quittingphenibut/comments/myceh0/how_do_i_stabilize_my_dose/,How do i Stabilize my dose?,Ive been taking 3-5 grams daily. My dose is starting to make me feel like shit. I think i need to lower my dose a little and stabilize. How long should it take for me to feel normal?,1,0
31,2021-04-25 08:05:35,https://www.reddit.com/r/quittingphenibut/comments/my6z3a/taurine_to_taper_phenibut/,Taurine to taper phenibut,"I found some taurine and read it helps raise gaba and could lower glutamate at the same time. 

Can one use it with phenibut? 

When does one take it before phenibut or after?

What doses and how many times a day?

Thanks in advance",6,0
32,2021-04-25 02:17:47,https://www.reddit.com/r/quittingphenibut/comments/my2cq7/has_anybody_had_any_kind_of_stomach_inflamation/,Has anybody had any kind of stomach inflamation from phenibut?,"Ok, first off. I am NOT AT ALL SAYING PHENIBUT CAUSED THIS.  Been taking it over a year now i was up to 4gpd about a month n a half ago. Im now at 2.25gpd with 10 mg of baclofen 3 times a day. Before i started tapering i started getting this really uncomfortable empty gurgly feeling in my stomach when my food digests. (Also Feels like i can feel the food going through my intestines) anyways, anytime i felt that gurgly feeling comming on, i would feel like im going through withdrawls. That wave of anxiety  will hit me the second my stomach goes off. 

Obviously, besides for the withdrawl feeling when my stomach kicks in, i know phenibut obsorbs in your intestines. Which makes me wonder if they are linked

Just to add, i am seeing a dr. Already had a camera shoved down my throat (thats how i know my tum tum is inflamed) i just want to see if anyone has delt with this.",6,0
33,2021-04-24 15:12:57,https://www.reddit.com/r/quittingphenibut/comments/mxqqgr/baclofen_after_cold_turkey_for_withdrawal_symptoms/,Baclofen After Cold Turkey For Withdrawal Symptoms,"I tapered  my phenibut consumption today is my second day not dosing anything at all. 
Insomnia is there and my withdrawals come in waves. 
Should i take a very small amount of the baclofen I was prescribed to just help with the withdrawals or will i become dependent on baclofen too and need to taper that again if i take a very small amount. 
Should I just stick it out??",1,0
34,2021-04-24 04:23:38,https://www.reddit.com/r/quittingphenibut/comments/mxfpth/baclofen_and_glutamate/,Baclofen and glutamate,"Does baclofen also give glutamate problems like glutamate surges and storms?

What i mean is does baclofen(it only last 2-4 hours) do you get glutamate problems like glutamate surges and storms after the effects wear off?",7,0
35,2021-04-23 18:24:58,https://www.reddit.com/r/quittingphenibut/comments/mx6nuh/screw_it/,Screw it,"I worked my way up to 6gpd over the course of 6 weeks. I took a total of 4g yesterday, my last dose being at 3:10pm. So, I’ve made it past the first 24 hrs. I know there’s probably going to be hell to pay in the next 2-3 days but I really want off! I’m sick to death of worrying about my usage. I have a few Ativan left. Not nearly enough, but I’m going to do my best to save them for day 3 and 4. Worse comes to worse, I’ll dose a gram or two to keep from something really bad happening. I really hope I can come back with a success story. Any tips are much appreciated. Wish me luck!",7,0
36,2021-04-23 13:54:28,https://www.reddit.com/r/quittingphenibut/comments/mx11iy/13gpd_for_8_months_ct/,1.3gpd for 8 months CT,"I’ve been taking around 1.3g to 1.6g per day for 8 months and I quit cold turkey 4 days ago

I’ve only experienced physical anxiety and was super irritable for the first two days and now I feel completely normal. 

I’m prescribed gabapentin so I have been taking around 900mg 3x to avoid withdrawals.

Am I in the clear? I thought it would be more difficult but I feel super okay

Any thoughts?",1,0
37,2021-04-23 07:58:19,https://www.reddit.com/r/quittingphenibut/comments/mwtlwq/i_took_3g_yesterday_do_i_have_to_retaper/,"I took 3g yesterday, do I have to retaper?","I ‘d tapered down to 2.3gpd from 6. I made a mistake by trying to cold turkey nicotine and ended up dosing at 3 trying to get high. I’m feeling some glutamine storms/really hot/burning sensation under my skin and vibrations and shakes when I woke up. 

The taper had been going smoothly with zero withdrawal once I got under 3gpd. Am I fucked?

I should add I went ahead and dosed at 1.8g this morning, instead of 1.3. My planned dose today was  1.3 morning, then .5 afternoon and .4 night for 2.2 as I was dropping .1 per day.",2,0
38,2021-04-23 03:12:28,https://www.reddit.com/r/quittingphenibut/comments/mwpoev/agmatine_for_people_who_have_quit/,Agmatine for people who have quit,"Hey I was wondering if Agmatine is good for trying to help my brain after quitting phenibut. I’ve been recovered for the most part but I feel a little slower, but that could be for other reasons. I’ve been clean a little over a year now.

Might I also add, I’m also wondering at what dosage too and the benefits of Agmatine. From what I remember its an NMDA receptor agonist.",3,0
39,2021-04-22 22:57:23,https://www.reddit.com/r/quittingphenibut/comments/mwlpuc/i_used_phenibut_for_2_weeks_and_need_some_advice/,I used Phenibut for 2 weeks and need some advice on how to stop.,"So about 2 weeks ago I ordered 100g of Phenibut, I tried 1g doses which I actually barely noticed and then went on to 2g. Since I wasn't feeling too much of it I got a bit reckless and often dosed 2 or even more times a day. I didn't use a specific dose every day, but from weighing the rest in the bag I could conclude that I used 54.4g over 12 days, on average 4.5g a day, I know this is a lot, I just didn't think much of it since I only got mild effects.

Then two days ago I just didn't think much of it I stopped, I also just felt really sick and weird that day, as if my body was buzzing a little. This went away but I couldn't sleep that night and the next day I felt just kinda anxious and my tinnitus seemed a bit louder then normal. Towards the night I also felt tension in and around my jaw. Even though I was 35 hours awake at this point I only felt somewhat tired but I could only fall asleep for 2 hours with a muscle relaxer. I just kept worried about things so I decided to just take 2g of Phenibut and then I could sleep another 2 hours. Now it came to me, it's phenibut withdrawal! It was a huge relieve to finally know why I felt so off.

About 4 hours later (now) I took another 1.5g and now I feel pretty normal with some odd mood swings, but I would like to know what's the best thing to do and what to expect. Should I just go cold turky, or rather taper? I still have 34g left. Since I didn't use it very long and basically just went on a reckless binge, would there be even a point to tapering? 

Thanks for any advice.",6,0
40,2021-04-22 21:41:40,https://www.reddit.com/r/quittingphenibut/comments/mwkapu/agmatine_for_tapering_high_doses_long_term/,Agmatine for tapering high doses long term,"If someone had been using gabapentinoids such as phenibut for 8-9 years at extremely high doses past 6-9g, would agmatine still be an option? 

Has anyone ever slow tried tapering high doses over a long period of time? Like close to a year? Also, since I've been using, ive always used 3x per day. Woild that mean I would use the agmatine with each 3 doses a day?

I'd love to find out more about agmatine. I post questions about it but i always have more to ask about it. Thanks",2,0
41,2021-04-22 15:16:28,https://www.reddit.com/r/quittingphenibut/comments/mwcdkp/is_muscle_tension_a_common_symptom_from_wds/,Is muscle tension a common symptom from WDs?,,2,0
42,2021-04-22 12:40:15,https://www.reddit.com/r/quittingphenibut/comments/mw8w1y/big_mistake/,Big mistake?!,"I have been using a little over a year daily but with the help of agmatine I was able to get to 600 mg per day, Finally under 1g. My mistake is/was that I ordered arginine instead of agmatine. Does anyone know if I can use it? If It could help? I will be out of agmatine tomorrow and I won't be able to get more for a week. Any and all advice would be totally appreciated.",2,0
43,2021-04-22 10:28:23,https://www.reddit.com/r/quittingphenibut/comments/mw5zjo/finally_below_1_g_scared_but_proud/,"Finally below 1 G Scared, but proud","Damn it’s been a while.

I’ve been on Phenibut daily for 5 years started out like most of us, carelessly using until it was too late and WD kicked in when you “ran out” of your first jug. 

I’ve fought down to taper with baclofen assisting me, along with NAC Agmatine and Memantine (didn’t do too much for me honestly) 

Dosages ranging from 3-4GPD to 1GPD then back up to 4-5GPD and the rollercoaster went on and on and on. I’m finally below 1GPD, still working and still not neglecting family duties. 

I realized today that the dependence is what scares me the most. Once The pattern of taking the white powder every morning is over I’m freaking out about the next step. But at the same time I’m so EXCITED about being off of this crap and want to rediscover my life Phenibut free.

After I’m 100% done with Phenibut and feel the acutes subside I’m going to tackle Kratom next, still on 20GPD but feel that’s going to be an “easier” hurdle to overcome because I’ve experienced the Kratom WD before, physical WD are easier to me than the mental glutamate-rush WD. 

So close...so close",20,0
44,2021-04-22 07:24:19,https://www.reddit.com/r/quittingphenibut/comments/mw2lmb/tolerance/,Tolerance,"hello,

How do all of you 2+ gpd users manage tolerance?

Do you use agmatine?

Thanks",1,0
45,2021-04-21 18:20:15,https://www.reddit.com/r/quittingphenibut/comments/mvqyri/successful_taper/,Successful Taper,"I used phenibut for 20 months-- from August 2019 to April 2021.

The first three months I used it on the weekend, taking Monday-Thursday off. My weekend doses climbed from 1.5gpd to 4.5gpd. Soon I was experiencing rebound anxiety during the week so I began adding 1.5gpd weekday doses. By the fourth month, I was using every day.

Before long, I became a 4-6gpd user. 

Phenibut cured my anxiety and depression, helped me get excellent grades in grad school, motivated my workouts, helped me achieve incredible relaxation and post-workout sleep, sent my sex drive thru the roof and gave me the added confidence [and impulsiveness] to have a wildly thriving sex life. It enhanced every aspect of my life.

I did experience tolerance and some diminishing returns, but I rarely ever let myself take more than 6gpd. 

I started experiencing disturbing side effects-- tinnitus (loud ringing in my ears), strange nervous system sensations, pins&needles, nerve pain in my head, night terrors-- and I had already known that phenibut couldn't really be healthy. The cons seemed to finally outweigh the pros.

September 2020 marked 12 months of phenibut dependency. I decided to cut down dramatically. I dropped 1gpd each week (from 6gpd to 5gpd to 4gpd to 3gpd) over the course of one month.

I felt WAY better using phenibut after adjusting to under 3gpd. October, November, December, i averaged between 2-3gpd. January, February, i averaged between 1-2gpd. 

The final 6 weeks, I had gotten below 1gpd, and I dropped by 20mg per day until I reached zero. Toward the end, my doses were so minuscule, they probably only had a placebo effect. 

It has been 4 days since my last tiny dose, and I  haven't experienced any withdrawal effects. My taper wasn't perfect, and I could have gotten from 3gpd to 1gpd more quickly than I did. Still, I managed to get from a serious dependency to zero phenibut, and I feel good.

I quit nicotine several months ago, during the taper, and I also stopped drinking coffee and energy drinks after noticing heightened sensitivity to caffeine. I take a couple pulls off a dispensary THC cart in the evening after dinner, and I sleep quite well. I wake up feeling good. My sex drive is normal. Music sounds great. 

I hope others can find success with a slow taper. I expected more withdrawal effects at the zero mark, but they never came. I presume I spread my withdrawal symptoms over a long enough period that they weren't noticeable.",20,0
46,2021-04-21 16:54:50,https://www.reddit.com/r/quittingphenibut/comments/mvp7lj/does_500mg_every_3_or_4_days_sound_feasible/,Does 500mg every 3 or 4 days sound feasible?,I’m on 6gpd now. I want so badly to get down to 3 so maybe I can then switch to baclofen.,3,0
47,2021-04-21 13:55:42,https://www.reddit.com/r/quittingphenibut/comments/mvlc4m/anti_social/,Anti social,"Currently on a withdrawal from phenibut. Been taking 750mg-1g for 7 months every other day. I had to quit cold turkey without tapering and now I am experiencing horrid anxiety and general anti social bahavior around people it’s like mild sociophobia?

Has anyone experienced this? Will this ever go away ?  Smoked weed but noticed that it actually aggravated anxiety . Can anyone relate?",8,0
48,2021-04-21 12:58:42,https://www.reddit.com/r/quittingphenibut/comments/mvk37i/im_stuck/,I'm Stuck,"I’m getting a little scared about my phenibut usage and I’m at a point in my life where there is a lot on my plate. I’ve got quite a bit of responsibilities that pretty much demand that I be on my A-game every day, and a slip up now could be really bad.

&#x200B;

I recently ate some special mushrooms that resulted in one of the most scary but happy experiences of my life. The result was the realization that I needed to try and  stop the vices I currently use to cope with my anxiety and depression. I honestly felt that, for once in my life, I could actually do it.

&#x200B;

I seriously underestimated how addicting phenibut is. After about two days of detoxing I managed to destroy an important relationship, land myself in hot water at work, and fall to the brink of failing 2 courses (that I literally can’t afford to fail). On top of all this, I tried picking up vices, I had previously dropped to help cope (alcohol, nicotine, weed, in significantly less amounts than I had done before, classic addict mentally in retrospect) which may have honestly made it worse.

&#x200B;

I’ve seen that people are using baclofen to taper off but I don’t think my doctor is going to go for it. He is  very old, and I really don't want him to discontinue other treatments and recommend me to an addiction rehabilitation program.

&#x200B;

I only recently escalated to daily dosages of phenibut at about 3-4 grams a day. I've occasionally gone up to 5 grams but only a handful of times.

&#x200B;

To be honest I’m not really sure where to go from here...  


edit 1:  typo",3,0
49,2021-04-21 12:00:11,https://www.reddit.com/r/quittingphenibut/comments/mvitda/is_a_super_fast_taper_a_thing_if_ive_only_been/,"Is a ""super fast"" taper a thing if I've only been taking phen for 7 days?","Hi all.So I got a bottle of phen with some other supps because I was curious about it. In the past I have taken lyrica and plenty of benzos and have always had a massive natural tolerance to GABA substances.

I took phen last monday for the first time at 1.5g and felt nothing. The next day I took 2.5 g and felt nothing until I drank and smoked weed. Third day I took 4.5 g, felt extremely nauseous if I wasn't moving (was on a bike ride) and otherwise felt very similar to a high dose of GHB. I took thursday off and felt fine. Then both Friday and Saturday I took 4 grams, before deciding that I better not play with fire, having seen the warnings on the phenibut sub and this sub.

I was hungover from drinking on saturday night, but Sunday wasnt so bad. But then Monday and yesterday absolutely destroyed me. I've never had withdrawals from a GABA substance and have done them for longer than this. I did NOT expect this after 5 days with a break in-between. I was wondering if I'd caught the 'rona, because I have a cough from smoking so much weed last week (normally weed makes me anxious but not with GABA drugs).

I was at the cottage until last night and first thing I did when I got home was take 3 grams because I felt so awful. It seemed to help but honestly I still didnt feel great (still wonder if it's 'rona). Today I took two grams, and I still feel kind of shit. But I figure that since I've taken it for so short of time, now day 7, with space days, I could probably get away with a super fast taper of like 500 mg a day. But I have also been shocked by how severe the effects were from just 5 days so I could be totally wrong - and if I feel anywhere near as bad as Sunday/Monday then it's not worth it.

My concern is that if I try to do a slow/normal taper I will actually worsen the dependance a lot - despite my feeling awful after 5 days, I have to assume that tapering for two weeks and then stopping is going to feel even worse when I stop (could be wrong tho). I also only had 180 of 250 mg capsules, so if I do a normal taper I will be cutting it close to running out (if not running out- I'll have to do the math). EDIT: did the math, I have 23.5 g left, and don't really know what dose to be tapering from - that doesnt seem like a lot though. I also live in Canada so no quick shipping.",2,2
50,2021-04-20 18:26:33,https://www.reddit.com/r/quittingphenibut/comments/mv23q3/baclofen/,Baclofen,Ive got 90 baclofen 10mg coming. I take 6 g phenibut. Is 90 enough for me to switch and taper,4,0
51,2021-04-20 13:33:54,https://www.reddit.com/r/quittingphenibut/comments/muvpq9/0102g_to_get_some_sleep/,"0,1-0,2g to get some sleep?","It's been almost 72 hours since I quit CT (4-5gpd for a few months) and I haven't slept at all. 

Would taking 0-1-0,2g before bedtime help with getting some sleep? I've also seen people mention that WD's don't even set in before 2-3 days after last dosage, which should be about now for me. Been feeling pretty damn terrible, especially due to the lack of sleep. Should I just push through at this point, or am i harming myself more due to the lack of sleep? It feels like it. Fuck, I wish I never started doing this fucking shit.",2,0
52,2021-04-19 20:01:28,https://www.reddit.com/r/quittingphenibut/comments/mue2o7/what_does_a_glutamate_storm_feel_like/,What does a glutamate storm feel like?,,10,0
53,2021-04-19 14:54:43,https://www.reddit.com/r/quittingphenibut/comments/mu7o8m/using_baclofen_to_quit_4gpd/,Using baclofen to quit 4gpd.,"I have been using phenibut for 5 months and counting now everyday and gone up now to 4gpd. Trying to taper without any substance other than NAC feels like it's made things worse cause i got scared and up the dose to not get withdrawals to 4gpd from 3gpd.

I really badly want to get off phenibut because even at these doses i still feel shit prob cause my tolerance is higher than 4gpd but i want to not go too high so i can quit. Even using it everyday it's still scary cause i feel like having the worst anxiety of my life and taking phenibut does not help.

So decided to try to taper and switching using baclofen.

So here is what i have: 30g phenibut left and 60 baclofen 10mg tabs, enough 0.5mg Alprazolam and and 15 2g Clonazepam, 30 Zolpidem, Nac, agmatine and memantine. Also, i don't want to switch addictions so need to do this as quick as possible to not get hooked on baclofen and make it as painless as possible.

This is my plan of action..

Want to start by tapering so i would take 1.5g phen in the morning and take 10mg baclofen the afternoon and 1.5g at 6pm for 2 days, then 1.2g phen in the morning then 10mg baclofen at 11am and 3pm another 10mg baclofen and 800mg phen 6pm and maybe 5-10mg baclofen before bed if need be. Then 1g phen in the morning and 10mg baclofen at 11am then 3pm 10mg baclofen and 700mg phen 6pm- before bed as soon as i need it.

Then i make the switch 15mg baclofen in the morning and 15mg afternoon as soon as i need it and 15mg at 5pm and 10mg before bed. 2nd day 15mg baclofen in the morning and 15mg afternoon as soon as i need it and 15mg at 7pm and try to skip the 10mg before bed.

3rd day i am scared of so i will take same as 1st and 2nd day and take 15mg before bed. 4th day i will take 15mg in the morning  and 10mg the afternoon 10mg the evening and if needed another 10mg. 5th day 10mg 4 times a day. 6th day 10mg 3 times a day. 7th day 5mg 4 times a day and then 5mg 3 times a day and then 10 mg 2 times a day and then 5mg 2 times a day then 5mg when i need it and so on.

I have enough 0.5mg Alprazolam and and 15 2g Clonazepam to take when needed(not to get hooked on them) and got 30 Zolpidem to sleep but also have a high tolerance to Zolpidem so battle to sleep 6 hours with 10mg as it is now but could be cause of phenibut withdrawals.

Sorry to bore you with the details but i need all the advice i can get and try to give as much info as possible to get off phenibut and get out of this hell asap and not get hooked on baclofen so looking back on my plan it seems scary and i could get in trouble with baclofen so any advice would be much appreciated. 

Thanks for reading.",3,0
54,2021-04-19 14:18:32,https://www.reddit.com/r/quittingphenibut/comments/mu6v6d/problems_ever_since_quitting_phenibut_8_months_ago/,Problems ever since quitting phenibut 8 months ago?,"So if anyone remembers me, my life has been fucked up ever since I got heavier into phenibut. I got right about 35 days after quitting, but I started using kratom again and had the worst year of my life just full of anxiety and panic. Ever since I haven’t been able to shake it. I’m much better, no true doom or real panic attacks besides almost having one after doing a fair amount of quality cocaine/alcohol then staying up till 7am smoking weed. Figured that would happen. 

If I used substances I am totally good, a small amount of a benzo and I’m solid but I’m trying to stay completely clean besides THC. I got off drug tests and unfortunately started using adderall and even got into meth for a few days unfortunately bc it helped me feel better but made it way worse after. 


This whole year has been me trying to get right, and I’m tired guys. My girl got off methadone after being on it for like 8 years, dealing with her has been rough atleast she’s finally getting right after weeks of madness. I have had these thoughts where I just want to kill myself bc I’ve never had anxiety and can’t do it. It’s ruining my life. Worse than years of opiates in my mind. 


I’m going to stay completely clean for a month, snd if I’m not right I’m going to the doctor. I can tell my blood pressure gets high, I feel it in my jugular. It gets tight, my ears and face will get hot... if I didn’t know how to deal with panic, I’d be right back to panic attacks. It feels like I’m always in fight or flight, unless I’m with friends/busy doing something I WANT. 


I feel like my phenibut fuck up warped my mind, along with abusing LSD last year and just having a trash year lead up to this. I’m talking with another guy who feels the same as I do. Phenibut may have zero roll in this and we just have anxiety symptoms.",5,0
55,2021-04-19 00:50:31,https://www.reddit.com/r/quittingphenibut/comments/mttcm2/a_question_for_people_on_considerably_high_doses/,A question for people on considerably high doses,"Have you guys noticed that after stopping, you don't even start wd'ing for a couple of days?",5,0
