,Date,URL,Title,Body,Score,COVID-19 Mentions
56,2021-04-18 12:27:50,https://www.reddit.com/r/quittingphenibut/comments/mtg361/329_days_clean_you_can_do_this/,329 days clean. You CAN do this!,"Hello! This is only my second post on this sub. I have watched and kept up with this sub for the past year. I was on phenitbut for 7 years!!! At my height I was doing anywhere for 12-16 gpd. You CAN beat this! For those of you looking for help I hope you find great comfort in this sub. There are a lot of amazing stories here. Some may seem scary but don’t let that discourage you. You’ve got this! There are many helpful tips and tricks you can find here to help ease your wd symptoms. My personal suggestions to all would be slow and steady wins the race! Never go cold turkey no matter what you hear. Please do a slow taper. It will eliminate most of the severe wd symptoms that come along with quitting phenibut. Never be afraid to ask for help! Baclofen which is usually prescribed as a muscle relaxer is actually used off label for phenibut wd. 10mg of baclofen is about equivalent to 1g of phenibut. Try not to have to much “pride” I did and that’s what kept me in a loop for 7 years! It took me a long time to ask for help. I thought I would never see this day but here I am! For those of you looking for a better idea of how to taper please view my previous post it is very detailed. Also, I am ALWAYS open to chat. If you ever feel discouraged feel free to shoot me a message. I am more than happy to help ease your anxiety about quitting or any other questions you may have! Don’t let some of the horror stories you read here scare you away from getting your life back. It is possible to quit and avoid severe withdrawal symptoms. I wish everyone in this sub the best of luck on your journey! You CAN do this!!!",48,0
57,2021-04-18 08:44:15,https://www.reddit.com/r/quittingphenibut/comments/mtc541/supplements/,Supplements?,"What supplements are you guys taking to help? I’m open to anything that might help. As of now, I have magnesium and NAC in my arsenal. Also, and tips or tricks to help increase appetite?",2,0
58,2021-04-17 23:29:58,https://www.reddit.com/r/quittingphenibut/comments/mt59cx/phenibut_psychosis/,Phenibut Psychosis,I'm wondering if auditory hallucinations and feeling like everyone is out to get you is a common withdrawal symptom. I feel like I almost have schizophrenia... anyone else have similar experiences?,11,0
59,2021-04-17 21:45:40,https://www.reddit.com/r/quittingphenibut/comments/mt3qg0/prozac_saved_me/,Prozac saved me!,"I saw a psychiatrist when I decided to quit phenibut. I was on about 2.5 Gpd. I asked the dr for baclofen but he gave me prozac, hydroxyzine and propranolol. I'm down to 250 mg a day now. I started tapering in February. I always thought you needed a gaba drug like phenibut or benzos for anxiety but ssri's work just as well. They just take time to start working.",6,0
60,2021-04-17 19:35:01,https://www.reddit.com/r/quittingphenibut/comments/mt1pba/my_story/,My story,I’m in recovery MAT and the doctor I was going to months back was giving me medicine after medicine to try that didn’t work. I ordered phenibut not even knowing about the withdrawal. It didn’t say it on the phenibut I bought. What happened I still take accountability for. I started taking a half a teaspoon 1.4g then tolerance gained j started taking that 3-7 times within a day. I took it for 5 months. I switched jobs and started a new good one but it was 2nd shift instead of day and all of a sudden I start not sleeping having crazy hallucinations after I was up for 2 weeks. I worked those 2 weeks towards the end it got bad I gave the phenibut to doctor she put me in a hospital they didn’t do anything so they send me back with my gf and here’s where shit gets crazy that I don’t remember my friend who’s a nurse recommended driving me to a different set of hospitals called Lewis gale saying they would treat me better then ballad health which was the other one my girlfriend drove me they apparently I was arguing and talking crazy shit. All of a sudden I was in this doctors place and saw a psychiatrist on a screen for quitting phenibut and there were nurses and she prescribed Valium and sent it off all off a sudden blood starts squirting out the bottom of my eye the whole time filler up the room with this weird stuff that solidated. One the doctors left the place turned into a Farris wheel where my mom was with my girlfriend at the bottom my mom was telling me the guy that owned the place would help make me a lot of money anyway he made me sit there the Farris wheel served drug my girlfriend tried to climb it and she got ripped in half and she was pregnant at the time it was like terror fueled horror. Once it ripped her in half the car I was in went into a hospital then it was a loop had another hallucination which was actually in the hospital and thought I was framed as a child molester and the nurses were gonna shoot me and they had a gun. They gave me fentanyl propophol and versed trying to know me out in icu still couldn’t I was on a ventilator they let my mom and girlfriend see me cause they thought I was gonna die I don’t remember it. I came back to the last three days I was on sleeping medicine .5mg klonopin Ativan iv gabapentin 300mg. I already take suboxone. It was weird anyways my baby’s gonna be here soon my brains still healing but my interest and feeling of enjoyment have came back well been at my job for over 3 months now have saved money I still take the klonopin and gabapentin. I’ve saved up money bought an Xbox tv and things I had 3 siezures in the hospital I have 2 bald spots from where my head layer on one side in icu I’m glad I was ok I’ve never experienced such an awful withdrawal other than heroin. Liked to here your comments and stories thanks for reading,1,1
61,2021-04-17 12:58:07,https://www.reddit.com/r/quittingphenibut/comments/msufsk/third_day_free_from_phenibut/,Third Day Free from Phenibut!,"Today is my third day free from Phenibut/baclofen.  I will never touch Phenibut again. This is not medical advice. It is simply the methodology I used to quit. 

Overview: at the height of my use (about 1 year ago), I was using about 7 gpd of phenibut. My dosage was two even amounts per day (6 am and 8 pm).  I tapered down to 1.2 gpd before I switched to baclofen to completely replace the phenibut.  When I switched to baclofen, I dosed 3 times per day. I tapered the baclofen until I stopped taking it 3 days ago. 

Phenibut Taper: My phenibut was dosed in two equal amounts per day. Once per week, I reduced each dose by 0.1 g, for a total reduction of 0.2g per week. I kept this amount constant even as the doses got lower and lower. I have a rather stressful meeting at work that takes place once per week. I did not want to be uncomfortable from withdrawals during this meeting, so I always did my taper reduction for the week after that meeting. By the time it rolled around for the next week, I was always comfortable again. I did this until I reached two doses of 0.6 g per day. 

Switch to Baclofen: I know the wisdom on here is to replace 1 g of phenibut with 10 mg of baclofen, but I wanted the switch to be painless. I switched my dose from 0.6 g of phenibut twice per day to 15 mg of baclofen 3 times per day, for a total of 45 mg of baclofen per day (dosed every 8 hours). The only trouble I had was less restful sleep the first night of the switch. It felt as if I had laid in bed all night with my eyes closed without actually falling asleep. I attribute this to my body not being put into an artificially deep sleep from phenibut. There was no increased anxiety at all. I realize I was risking setting myself back since I used more baclofen than the commonly-accepted conversion rate of 10mg of baclofen per 1 g of phenibut, but I trusted the fact that baclofen was easier to reduce. The baclofen was much easier to reduce, so the risk paid off. 

Baclofen Taper: Just like my once-per-week reduction of phenibut, I used the same method for the baclofen. After my meeting each week, I reduced each dose of baclofen by 5mg. Therefore, the first week I used 45 mg, then 30 mg, then 15 mg, then 0.   The only anxiety I experienced was for about 12 hours after each reduction. After that time period, it was almost as if the anxiety suddenly lifted (even at the new, lower dose).  The baclofen reductions were much easier to handle than the phenibut reductions.

I am so happy to be done with this! There is light at the end of the tunnel!  I welcome any questions about my experience. Otherwise, just know: you got this!",19,0
62,2021-04-17 10:16:43,https://www.reddit.com/r/quittingphenibut/comments/msrjgi/dose_of_nac/,Dose of NAC,What dose of NAC is supposed to help with withdrawel? And what symptoms is it supposed to help with? And what dose of agmatine in needed daily?,2,0
63,2021-04-17 09:17:26,https://www.reddit.com/r/quittingphenibut/comments/msqk7o/please_give_me_advice/,Please give me advice,"I’ve been on 3gpd for a few years. I’ve tried tapering down many times but I always end up relapsing. I think my problems in the past have been tapering too fast, so I have a new plan.

I take the 250mg caps, and every 5 days I’m going to drop 1 cap. So this comes down to a 50mg per day decrease. Like I said, this is a slower taper compared to what I’ve done before, but I think I’ll experience way less negative effects this way.

Do you think this is a good strategy?",2,0
64,2021-04-17 08:30:49,https://www.reddit.com/r/quittingphenibut/comments/mspuhp/thorns/,Thorns,"I was speeding down the highway on a bright red crotch rocket. I wasn’t really sure how I’d arrived here, I didn’t remember much prior. But I didn’t really dwell on it, because I felt amazing. Pushing 200 with no shirt, bobbing and weaving through traffic. I felt the sun rays warming my skin, baby blue skies with a few puffy white clouds scattered about. 

I knew the area pretty well, it was familiar. I’d grown up here, and I guess it was time to pay a visit. I’ve been gone about 5 years or so, since my parents had a nasty divorce and I’d moved off to attend college. None of that mattered, though, I was just here for the ride. 

Everything was a blur as I blasted by vehicles that seemed to be at a standstill. I could go as long as I still had road ahead of me. I passed under a bridge and noticed some blue lights flashing to my right. I just laughed as I left them in the dust.

But as I drove I felt a shift in the atmosphere, the baby blue skies swallowed up by dark, angry clouds. At once a loud crack rattled me to the core. It must of been 20 or 30 feet away... lightning.
It ripped through a tree, leaving it burned, mangled, and disfigured. 

But I rode on, through the storm. I couldn’t see more than 5 or 10 feet ahead, I felt as though the wind might lift me off the road. I’d always wanted to fly. 

It was exhilarating, and I gained speed. My survival based purely off of reaction time as cars would appear ahead of me, and....

I was flying. I guess I didn’t see him, maybe I was distracted. I moved in slow motion. I looked back, my bike burned, mangled, and disfigured. 

I hit the ground. You would think such a crash would kill you on impact. I wasn’t so lucky. My skin ripped from my arms, and I slid 25 to 30 feet into a pile of barbed wire and thorns. The barbed wire caught my legs, and slapped my torso into a bed of thorns and nails. My bones broken, but spine still intact, I felt everything. 

I tried to pull, and the barbed wire drove deeper into my skin. I screamed in agony, but I knew this was my fate. Blood started to run out of my mouth, as a metal pipe had impaled my stomach. I looked down and noticed my pants had been pulled off during the crash, and my penis was ripped in half with thorns dug into the head. I had a pistol in my pocket, and only wanted to pull it out and burn my nose off. But my arms had been shattered, like glass.

I heard a crack of lightning, and the smell of human flesh filled my nose. Burned, mangled, and disfigured, I finally found peace.

I sprung upwards in bed, shaking and covered in sweat. Man... These withdrawals are some shit.",5,0
65,2021-04-16 18:41:10,https://www.reddit.com/r/quittingphenibut/comments/msed16/forgive_my_for_posting_so_much/,Forgive my for posting so much!,I’m just so new to all of it. So I’m doing 6-7gpd for about a month now. I just got some ativan to help. That Ativan seems to talk away all the terrible Symptoms for a few hours which makes me want to space my doses out longer. Is that a bad idea? Can I do a faster taper with the Ativan?,6,0
66,2021-04-16 16:38:16,https://www.reddit.com/r/quittingphenibut/comments/msbyh8/what_are_yalls_thoughts_on_ativan_for_withdrawals/,What are y’all’s thoughts on Ativan for withdrawals?,,3,0
67,2021-04-16 11:27:14,https://www.reddit.com/r/quittingphenibut/comments/ms5j3w/how_do_i_taper_down_from_40g_doses_3_times_a_week/,How do i taper down from 40g doses - 3 times a week.,"Yeah im not gonna explain too much as it will get too long, and mine isnt as serious as others from what ive seen, but still its a pain in the ass in my life on the off days especially the rebound anxiety is just so strong and i cant do shit not even go outside. Ive done phenibut for 1.5 years now, in the 1st year i always did it 2 times a week, starting from 1g working myself upto 5g and then taking a tolerance break for 3 weeks as i wasnt occupied back then and was easily able to do it without anything i had to attend to everyday.

&#x200B;

The last few months since December though has gotten quite bad and out of control in some way, im taking it 3 times a week now but my tolerance has sky rocketed because a few times i took it 2 days in a row but only like 3 times over 5 months but yeah i ordered a 250g package 3 weeks ago i thought, but ive only had it for 2 weeks now and ive already taken it all. I really wanna get my tolerance down to 1-2g's again, but while im still able to take it so i can just feel the phenibut taking away a portion of my social anxiety, instead of me the last months chasing the same high from phenibut that gives you barely none social anxiety and euphoria in the body.

Im just tired of this, and i feel like it might be damaging my body a lot, my memory is shit like i often forget that ive already told people something and end up explaining it to them again, or they tell me stuff and i forgot it the day after. I also mostly cant really remember what i did 2-3 days ago.

&#x200B;

If im doing 40g's every time i take it, could i go down to 35g the next time, and 30g the next time, and so on since im not one that has taken it everyday, just large portions each time. I just want to know how i should do it, and how fast i should attempt to do it.

Thank you for any answers i get.  I still wanna say though, phenibut has been worth it for me with social anxiety holding me back so hard on my life these past few years, and after discovering it and lowering my anxiety, ive been able to accomplish so much more in my life, and im happier than ever besides this phenibut problem.

&#x200B;

EDIT: Just wanna say what im experiencing right now is pretty tough and i have really bad anxiety. I have my last bit of phenibut for tomorrow, after not taking it for 2 days so far, and im planning to take that and then wait till monday where i get the next 250 package. I think ill taper down 5-10g every time i take it, each day of the week where i dose. As now im thinking about it, i usually take it 4 times a week. Fuck man im feeling so shit",5,0
68,2021-04-16 08:04:26,https://www.reddit.com/r/quittingphenibut/comments/ms1pzb/pheni_and_how_it_affects_digestive_system/,"Pheni and how it affects digestive system. Tips,concerns?",,3,0
69,2021-04-16 00:11:09,https://www.reddit.com/r/quittingphenibut/comments/mrvjny/someone_tell_me_this_can_be_done/,Someone tell me this can be done.,I’m feeling so low right now. Is there life after phenibut?,5,0
70,2021-04-15 23:33:22,https://www.reddit.com/r/quittingphenibut/comments/mruz2d/amanita_muscaria_for_phenibut_dependence/,Amanita muscaria for phenibut dependence,"Guys , has any of you heard about it?

It's called fly agaric mushroom (amanita muscaria) , and i keep reading that microdosing (definetly not tripping) with it , could help to quit phenibut or benzos and mushroom by itself is quite euohoric and acts on gaba receptors.

If any of you have any expierence with it , please share.

I have some of amanita muscaria just arrived , and thinking of trying it this weekend.

I'm dependant of phenibut low doses daily (300-500mg a day) but been using like that for about 3 years. so if i stop , i definetly feel not well. also i take kratom almost the same amount of time. And i really would like to take a break from these substances because i can feel how it fucking changed me,and it seems like i've got so much more stupid in these three years.

I have some hopes with amanita muscaria. It's completely different thing from psilocybin mushrooms , you cannot trip on it (you can , but its definetly not pleasant , it is dangerous and you can die from big doses of this mushroom) but doses 0,5 - 5g should be a good tonic for life , and could be used daily with some breaks.

I just wanted to hear some expierences first hand. :)

&#x200B;

Have a nice day",4,0
71,2021-04-15 19:28:54,https://www.reddit.com/r/quittingphenibut/comments/mrqtjt/switching_to_baclofen/,Switching to baclofen,Would I be able to switch over to baclofen completely from 4gpd of phenibut? How should I do this?,1,0
72,2021-04-15 19:18:35,https://www.reddit.com/r/quittingphenibut/comments/mrqn0j/down_from_750mg_to_200mg_daily_in_1_month/,Down from 750mg to 200mg daily in 1 month,"I haven't been posting updates but I've been tapering down 50mg every few days with the goal to be off in early May. I took 250mg 3x a day for about 4-5 months straight. So far it hasn't been too, too bad. I've had some heightened anxiety/depression (maybe a return to baseline?) for sure, but nothing too crippling or overwhelming. 

There have been a few days where I thought, ""fuck it, this isn't so bad, I should just go back on my original dose to make my life better"" but luckily have not given into that thought as I know in the long-term I'm doing myself a serious favor. Sleep is definitely not good at this point, which is the worst of what I've had to deal with. I don't usually have sleep issues but tapering has caused noticeable issues (harder to fall asleep/stay asleep/poor sleep quality). I cut out my midday and nighttime doses first just because I'd rather feel better during daylight hours with compromised sleep vs. be in mild w/d feeling all day only to get relief at night. I think my taper might've went smoother had I left my nighttime dose for last though. 

Anyway, it's been a little rough, but nothing compared to faster tapers of say benzos or opiates, IME. I'm just happy I'm getting off phenibut before it can have a real chance to ruin my life in the future with addiction/side effects/etc, regardless of where that leaves me with my own mental health. I'm on the homestretch I feel, so send good vibes please! Always here to give info about my taper too, I thought it would be good to share because before I started tapering, I read so many wildly different experiential reports regarding what it would be like.",10,0
73,2021-04-15 18:25:21,https://www.reddit.com/r/quittingphenibut/comments/mrpo9r/help_with_phenibut_taperbaclofen_replacement/,Help with phenibut taper/baclofen replacement schedule,I recently spoke to a psychiatrist that is willing to prescribe me baclofen to help taper off phenibut. She left it up to me to make a taper schedule and I’m feeling lost on how I should do this. I’m currently taking 4gpd of phenibut one dose at night before bed. I know that 1g of phenibut is equivalent to 10mg baclofen. Anyone with experience willing to help would be greatly appreciated,5,0
74,2021-04-15 17:28:56,https://www.reddit.com/r/quittingphenibut/comments/mrol7i/what_kind_of_scale_should_i_get/,What kind of scale should I get?,I have no idea what I’m doing. I started taking phenibut via a proprietary blend called Fokus. I just switched over to the stuff from liftmode and I want to make sure I know how much I’m taking so I can taper.,2,0
75,2021-04-15 16:52:48,https://www.reddit.com/r/quittingphenibut/comments/mrnv46/just_realized_the_severity_of_my_dependency/,Just realized the severity of my dependency,"So I used to be good about spacing. At some point I must have made a justification to avoid spacing because of a work meeting, wanting to ensure quality sleep, going with the stress of a conflict, etc. 

I had a bit of a wake up call in the last few days when my order was not completed like I thought, so when I went looking for it I had to finish check out and didn't have Phenibut for 3 days.

I've been at 2 g a day for probably 2 years. I don't even think about phenibut, It just had become part of my daily stack of things I take. My life hasn't fallen apart and I'm relatively stable and happy - however this sort of agitation and other symptoms I experienced with increasing severity over these three days has scared the shit out of me.

I don't even know what a normal feeling is and how much I've been masking if this is what I feel like without it.

What sort of recovery time period am I looking at here If I try to taper off completely within the next 3 months? I want to know who the hell I am and how I would actually handle stress and work pressure without Phenibut. I had such a negative outlook on my work in these couple of days, and I was fine prior to this. 

What sort of cognitive damage have I done to myself at 2 g a day for 2 years?",4,1
76,2021-04-15 14:29:51,https://www.reddit.com/r/quittingphenibut/comments/mrkvhe/gabapentin_for_pheni_wdtaper_plan/,Gabapentin for Pheni WD/taper plan," 

Hello all, I am currently at 3.7g of phenibut HCL a day and have been for at least 6 months, and I have yet to be in a situation that I have had to go without and am personally unaware of how dramatic the withdrawal will be (I am making the conscious decision to get off of this substance as I have a baby on the way and he is due in late July). Pheni doesn't get me ""high"" anymore, just keeps my anxiety at bay and I once I got to my current dosage months ago I elected not to raise the dose. I can only surmise that where I am at is keeping me ""normal"" at this point.

I know cold turkey is not the way to go, I have began lowering my dosage 50mg every other day for the past week and I cannot tell a difference. I will have a source for a few dozen 600mg gabapentin on the first of next month, should I just continue this taper and use 300mg of gabapentin at a time if I experience any issues? What is my best course of action at this point? I am not going to lie, it is scary to think of getting off of this stuff.",4,0
77,2021-04-15 10:54:25,https://www.reddit.com/r/quittingphenibut/comments/mrgcct/close_call/,Close call,"Hey y’all,

                I’m usually on the r/quittingkratom sub but wanted to check in here to get y’alls thoughts. So I was at a head shop the other day and saw a supplement called addall rx. I used to have a huge adderall problem, so my curiousity was piqued. I asked what it was and he said “legal adderall”. I left without buying it, but temptation came over me today so I went back to the head shop. I talked to the show owner about it and he says it kept him up all day and night and the crash was bad, so red flags were going off. I took a photo of the back and looked up the ingredients. Low and behold one was phenibut, which of course id heard of through the boards and immediately new to stay the hell away. The other ingredients were octodrine and some other synthetic amphetamine. Did I dodge a bullet? Please tell me to stay the hell away from it. I’ve had problems with gabapentin, kratom, suboxone, and opiates, and I’m finally now clean of all of it. Just need a little reminding to stay away from this stuff, as that little bit of temptation is still there. Thx!",5,0
78,2021-04-15 09:13:48,https://www.reddit.com/r/quittingphenibut/comments/mree5w/bad_idea_to_quit_nicotine_with_phenibut/,Bad idea to quit nicotine with phenibut?,"So I tapered rather aggressively from 6gpd to 3 (.5 gram drop every two days). I’ve been stabilizing on 3g for the past 5 or so days and am finally starting to feel better.

I’ve been using two cans of 7mg nicotine salts, (20 pouches a can). Thats 40 pouches or 280mg of nicotine a day, for a year. Prior to that two cans of smokeless tobacco a day for 7 years (well, one can a day for around 5, then two for the next 2 years). My logic was and is that anything was better than putting that cancerous shit in my mouth. 

So I switched to 4mg pouches yesterday, which basically cut my dose in half (not completely). It 40 of those is 160mg.

But I feel like its amplified my phenibut withdrawal. I’ve been through nicotine withdrawal enough times to know this isn’t what nicotine withdrawal feels like; Its like I’ve skipped the nicotine withdrawal and went straight back into phenibut withdrawal. 

So I don’t know if I should just chill on my phenibut taper, stay at 3g, and take a week or so to quit nicotine then back to tapering (albiet, much slower. 3g was my original goal now I’m switching to .1g taper).

I just feel like being addicted to nicotine is the only thing left of the “old me”, which was a reckless drug addict. It just feels like the root of every new addiction I take on, which may sound stupid...",3,0
