,Date,URL,Title,Body,Score,COVID-19 Mentions
348,2021-11-08 16:55:45,https://www.reddit.com/r/addiction/comments/qpoa7a/made_a_video_about_the_top_5_worst_parts_of_being/,made a video about the top 5 worst parts of being an addict,"wasn't allowed to share links but I figured I'd share this relatable video here. hope i'm not breaking any rules. hope you all are having a nice day. 

&#x200B;

top 5 worst parts of being an addict: [https://youtu.be/Pp4TwJcgyOM](https://youtu.be/Pp4TwJcgyOM)",5,0
349,2021-11-08 14:53:15,https://www.reddit.com/r/addiction/comments/qpln0v/most_relatable_song_to_an_addict/,Most relatable song to an addict,"Out of all the songs that are related to addiction I think this one hits the most 

Juice wrld - wishing well

I showed this to my mother and it hit her like a train aswell. Yall should give it a listen I'm interested to know what you think.",3,0
350,2021-11-08 14:11:41,https://www.reddit.com/r/addiction/comments/qpkrfh/i_kiiiinda_screwed_up_not_really_but_given_the/,"I kiiiinda screwed up. Not really, but given the circumstances.","__If anyone finds this shouldn't, for whatever objective reason, be here, I'll remove it. 

So now I'm going be the asshole who talks about temptation. 
Basically today my paycheck came, and I made a budget which I'm not gonna mess with this time, and out of the extra, instead of buying grass and hookers I bought some nice clothes, a stove and oven, paid some debt, etc.
Buuut I took a freebie, enough for, at my currently 0 resistance, couple of joints. And it's laced with coke.
And I'm smoking it.
Tha caveat is I'm not gonna have money for repeats for a month, and even if I did, I had a serious psychological breakthrough, I enrolled to an introduction to web development course which starts in a week my dear peeps, and I feel strong enough not to wake and bake tomorrow. I mean I have shit to do. Aaaand also ever since I'm not punishing myself for past shit anymore, I don't feel the need. Also, the Seroquel helps. 
So with all facts given, how big of a moron am I on a scale from 1-10?  
I mean someone dear to me once told me, that once you learn to control yourself (he was talking about alcohol) its gonna be OK.",1,0
351,2021-11-08 13:39:01,https://www.reddit.com/r/addiction/comments/qpk15o/im_starting_to_not_care_if_im_addicted_to_video/,I'm starting to not care if I'm addicted to video games and internet surfing anymore,,2,0
352,2021-11-08 11:05:59,https://www.reddit.com/r/addiction/comments/qpgqgx/what_shouldshouldnt_i_tell_to_my_employer/,What should/shouldn’t I tell to my employer?,I’m currently in the hospital trying to detox and haven’t been to work in 2 days already cause of a bender. They know I have mental health issues but not the addiction part. I’m considering an inpatient  rehab I know with like FMLA you can’t legally be fired for getting medical treatment. But I worry if they know I’m an addict even if I’m getting treatment they would find some other reason to fire me if that makes any sense?,1,0
353,2021-11-08 09:47:30,https://www.reddit.com/r/addiction/comments/qpf5qe/how_addictive_is_adderall/,How addictive is adderall?,Is it worth it?,19,0
354,2021-11-08 08:56:46,https://www.reddit.com/r/addiction/comments/qpe5c7/kava_addiction/,Kava addiction,I have a kava addiction.  I can go a few days but then I'm right back at the health food store buying more.  That's the sneaky thing about this drug is that it is so readily/easily available.  I've tried going to AA since it's effects are similar to alcohol but I couldn't for the life of me get past the higher power bit.  Does anyone know or have any advice on how I can stop because it's causing problems in my marriage.  Thank you very much.,2,0
355,2021-11-08 08:43:10,https://www.reddit.com/r/addiction/comments/qpdwdr/my_father_is_an_addict_and_is_taking_the_step_to/,"my father is an addict and is taking the step to start attending NA meetings, how can I support him? (Any advice welcome)","As the title says. I (19) still live with my dad, he’s been struggling with an addiction to amphetamines since I was a young child. 


I really want to be there for him and support him in his steps to sobriety and I know (after many attempts of quitting) it can be a very tumultuous road ahead. 

Frankly, I’m out of my depth here, as a child seeing my dad In the throws of addiction really fucked me up. I know his sobriety is not my responsibility but I desperately want him to get better I just don’t really know how to approach this (especially as his daughter not as a peer or a friend or smth) 

If this isn’t the right place to post this I’m really sorry if there are any better subreddits or places for this kind of advice please let me know too",2,0
356,2021-11-08 06:43:05,https://www.reddit.com/r/addiction/comments/qpbvh7/me/,Me,"Good afternoon, 

I'm Wayne and I am an Alcoholic! I was trapped by my disease for 23 years of insatiable and tormenting alcoholism.  I have been fortunate to be living sober for almost 6 years now.  I live in Germany with my wife and son.  I am retired from the US Army and I run my YouTube channel 1Sober2Another.  I look forward to being apart of this very necessary sub. We recover together.",5,0
357,2021-11-08 06:16:16,https://www.reddit.com/r/addiction/comments/qpbhhg/how_can_i_cure_my_masturbating_addiction/,How can i cure my masturbating addiction,"I do that since 7th grade, i cant stop now and i just want to be happy and find my fiance, i started getting tired of it",2,0
358,2021-11-08 03:10:54,https://www.reddit.com/r/addiction/comments/qp93ac/anyone_ever_quit_and_get_sober_but_not_tell/,Anyone ever quit and get sober but not tell anyone because the addiction was already a secret?,"Im going to take. Break, I have to but all my vices are a secret. Who can I celebrate with for my successes?",30,0
359,2021-11-08 02:57:30,https://www.reddit.com/r/addiction/comments/qp8wt0/day_1/,Day 1,First day off the green. I hope I can make it 30 days.,3,0
360,2021-11-08 02:25:37,https://www.reddit.com/r/addiction/comments/qp8i9z/anyone_else_got_adhd_and_addicted_to_marijuana/,Anyone else got ADHD and addicted to marijuana?,"I've been pretty much smoking everyday for the past 2 years, before i knew i had ADHD i noticed that it just slowed my brain's pace down to where i could relax and not think about things as intensely, and it also made doing boring tasks more easy, but i've found myself in a bit of a rut where i feel like i can barely go a week without it, and pushing that feels almost impossible.

Does anyone else have ADHD?",3,0
361,2021-11-08 01:04:35,https://www.reddit.com/r/addiction/comments/qp7efd/methmdmaweed_addiction/,Meth/mdma/weed addiction,"I'm 21 years old and have had a horrible past few years.. coming from an abusive background I've been compelled to use since a young age.. traditional shit started off with weed at 15 moved on to your standard leg up from that being lsd, mdma and things then from there unfortunately I was introduced to meth and I ended up fucking up doing a massive amount which lead to ripping everybody off to supply my addiction..just an awful feeling became my whole life at age 17 I was living in the car for a few years, horribly suicidal.. now im here on my own and I can see the whole circle coming down again.. my mum (I have nowhere else to live besides her,due to me ripping everybody off and housing being expensive here) and she's doing the same old things to pass me off and hurt me as she did when I was a kid.. all i do is play video games I can't work due to bad schizophrenia from the drugs and I'm considering going back i should mention I'm years clean and have been home for the same amount of time clean (2yrs) but with no friends,not being able to work,having to live with mum it makes staying sober really hard.. I need someone to talk to",2,0
362,2021-11-08 01:03:59,https://www.reddit.com/r/addiction/comments/qp7e4k/i_just_found_out_my_fiancé_has_been_addicted_to/,I just found out my fiancé has been addicted to coke and has spent 15k this year on it,"Today I found out that my fiancé is addicted to coke from the help of her family doing a intervention. They have suspected this for a while now so they finally gathered enough evidence to stage this intervention. 
   As a chef I work crazy hours often up to 85 hours a week. I feel like I’m partially to blame for not being there but at the same time I’m so angry and mad. I’m still trying to process this and her family is being extremely supportive. My trust is completely shattered and I need some help and maybe a different perspective to help me shine the light on this situation.",2,0
363,2021-11-07 20:36:48,https://www.reddit.com/r/addiction/comments/qp31ee/im_trying_to_get_off_of_oxy/,I'm trying to get off of Oxy,"So basically I have gotten myself lightly addicted to oxy, I was doing 1-2 a day only at my peak and for maybe 3-4 months ish. I am not heavily addicted but I definetly am and have accepted that now. I have some questions and can really use some help from someone with knowledge so please dm me if so. I have steadily weened myself down from my use before (80-160mg) to having only been using a 20ish mg a day and have tried to just stop now but I have withdrawals. theyre not bad Its just light restless legs trouble sleeping and my body isnt the best at regulationg its temperature. none of these are very severe at all but it is still enough that I cannot manage it at the moment. I have been working to change and better my life for quite some time now and I am starting to fuck that up. sorry this is so much of a rant and a lot of unnecessary information probably but basically I just need to know how much suboxidone i should be doing to get off as I have that now",2,0
364,2021-11-07 20:19:42,https://www.reddit.com/r/addiction/comments/qp2qq7/cant_seem_to_get_clean/,Can’t seem to get clean,,17,0
365,2021-11-07 19:53:38,https://www.reddit.com/r/addiction/comments/qp29bq/i_feel_like_im_early_on_in_a_weed_addiction_and_i/,I feel like im early on in a weed addiction and i need help getting out of it,"For the past few months ive been using weed nearly every night, there have been a few times where ive gone a few days to a week without any and ive been totally fine, no cravings or withdrawals, but when im in the presence of it, i always get insane cravings for it. I usually only spend 20-30 bucks a month on weed and its been about the same amount, it doesnt deviate from that price range. I also feel like its taking a toll on me mentally, im 18 years old and i already feel like im losing my attention span, i cant remember things as well, i have trouble focusing, etc.

I need to know whether or not you all think about this, am i being crazy?",1,0
366,2021-11-07 17:42:51,https://www.reddit.com/r/addiction/comments/qoztaf/girlfriend_found_out_about_my_addiction_to_coke/,Girlfriend found out about my addiction to coke,"My girlfriend (22) and I (24) have been dating for 8 years. In the early years of our relationship I would occasionally do hard drugs and tell her about it (cocaine, Molly, mushrooms) and she would be cool with it as long as it was on occasion.

About 5 years ago I began doing cocaine more secretively. It started out ‘here and there’ when I moved away for university and then it turned into a full on weekly habit. I’m an engineer, got a 4.2 GPA in university, and have a good job so everything looked fine on the surface and she really didn’t suspect a thing. Fast forward to last night when she woke me up at 2am after a girls night and confronted me (apparently one of my friends sold me out to his girlfriend who is her best friend). I totally understand why I was told on, I was being secretive and deceptive about what I was doing (she’s asked me in the past and I denied), and when I was confronted I felt it was time to spill the beans.

She’s so hurt. I fully betrayed her trust and I sympathize with her. I never wanted it to get this out of hand but the my use spiralled out of control and before I knew it I felt I was too far gone to tell her in fear of losing her.

I’m really not sure what to do. She left our apartment and is back with her parents but I can tell she didn’t want to leave, she just felt like she had to. I’m so confused, I feel like she deserves better and her friends definitely do as well.

I don’t really have any questions to ask anyone. I just wanted to vent and have no one to go to.",6,0
367,2021-11-07 09:34:24,https://www.reddit.com/r/addiction/comments/qopqr0/im_embarrassed_and_worried/,I’m embarrassed and worried.,"I have had a coke problem and a drinking problem for the past 3 years. I never really felt like I had a drinking problem until I started using coke. Last night I went out to a bar with my boss and ended up getting kicked out. I am not sure if I’m still employed, or even really what happened. I’m disappointed in myself and highly embarrassed. I need to stop, but cannot fathom sober life. I just want someone to talk to that can relate and tell me that it gets better.",7,0
368,2021-11-07 09:09:18,https://www.reddit.com/r/addiction/comments/qop9ws/im_nearly_14_months_clean_of_all_substances_and/,I'm nearly 14 months clean of all substances and my life has been turned around. But I have one question for people...,"I'm getting checked for ADHD next week (which can be really difficult to detect in adults). It would clear up a lot about my past and my gravitating towards drugs + impulsive and avoidance behaviour. 

However, my question: 

Has anybody here with ADHD ever abused MDMA and noticed that they became more calm and lazy rather than extremely energetic and peppy? 

I've just had this curiousity lingering because I know that ADHD meds contain components similar to what's in some stimulant drugs. 

Also, I ask this question here because for some reason the uses of the word ""Molly/MDMA"" are banned in the ADHD subreddit so it's obviously something that people don't want to talk about there. 

Also also... If this is an inappropriate place to bring this up, can somebody please pop me a subreddit that would be relevant? 

Thanks and happy sobriety everyone :)",7,0
369,2021-11-07 06:02:04,https://www.reddit.com/r/addiction/comments/qomb8v/i_appreciate_all_the_support/,I appreciate all the support.,"I really like just talking here because I feel like someones really there for me and will finally help me from the hell Ive been going through. I didnt think strangers would understand me more than my own family would. Or even my friends if I can even call them that. I didnt even expect people to read my posts because I just wanted somewhere to vent. I grew up around addiction not knowing how seriously harmful it could be. In my mind, I thought that it was okay because thats how the rest of my family deals with their problems. So it was normal for me to come home from school and see my family either high or drunk. Especially my dad the most. He didnt even care if I smoked and would buy me cigarettes when I would want some to help me deal with my stress. I dont smoke anymore as I stopped smoking after I left high school. I even heard my 11 year old sister now smokes pot and thats so scary to me. I have cut off my connections with my sisters due to the fact that I dont want them to know how bad my addiction is. Pot is okay with me as I dont have a problem with it but it scares me becasue thats how I started off doing drugs. I just want her to stay as a normal kid. I really took my childhood for granted because I so badly wanted to grow up and be an adult. I felt like I never had a real childhood and I would do anything to make sure my little sister doesnt throw it all away so fast. Especially with meth. 

Its crazy how addictive it is. One time and youre hooked. Due to my autism, taste, texture, and how it reacts to my gag reflex is super important to me. I have a super sensitive gag reflex so certain things cant touch my tongue or it will reject it. Most meats and fat will do that for me. Even the taste of meth is too much for my gag reflex and well as the taste. Normally if you want to try something new like sushi for example, if you dont like it, there would be no reason to keep buying it and eating it. That is especially true in my case. But meth is so powerful that even I kept going back to it knowing I hated the taste. I would gag so hard because of the bitterness. If meth can get me hooked on it, then it can get anyone hooked regardless of how awful it is. I like sushi as an occassional treat, but not that much to where Id buy it all the time. If its able to take control of me who is super picky about even my own food, then it just proves how much more dangerous it is. Im the most picky in my family even with drugs so it really does say a lot about how addictive it is. Anyways thank you again if you took the time to read this. I appreciate every comment that people leave. You have no idea how much it makes recovery easier for me everyday. Sleep tight knowing youre helping one person out there put their mind at ease.",10,0
370,2021-11-07 02:13:48,https://www.reddit.com/r/addiction/comments/qojeud/my_dad_needs_serious_help/,My Dad needs serious help.,"I’m visiting my family over the weekend, My dad, mom and brother are recovering addicts they go to a clinic and are trying- my parents from opiates and my brother from heroine. 
I thought things were better. But as I’m here the house is a disaster- i feel terrible. They barely get up/ barely keeping the house together. Their neighbors are mad and I don’t blame them from the junk outside/ general non-up keep. Today was the worst. I had bought movie tickets for us all to see dune and my dad ends up not showing up- he wrecked the car and was on something I have no idea probably ambien from what my mom brother say. I’m so worried about them especially my dad- driving killing someone and or himself.
I don’t know what to do. I don’t know if this is an appropriate place to post this story. 
I’m just so lost and been dealing with this for quarter of my life. I have no idea what to do. I love them all with my whole heart and just want the best for them, and a more fulfilling life. 

Thanks for reading. Apologies for mistakes typing.",3,0
371,2021-11-07 01:17:18,https://www.reddit.com/r/addiction/comments/qoio98/watched_my_friend_and_10_people_binge_at_a_party/,"Watched my friend and 10+ people ❄️ binge at a party, and I feel very weird about it.","I don’t know where else to talk about this, but feel free to let me know if this is the wrong sub for it- I got back from a party this afternoon, where I stayed the night. It was about 12 people in total in this rental and an old friend who I hadn’t had the chance to catch up with since the pandemic invited me. They told me beforehand that the people there do “a little bit of snow” and I had no problem with it because, imo who am I to judge people based off their own decisions to do drugs or whatever? 

At some point I had overheard them talking about buying said snow with someone else at the party, I learned later this was because EVERYONE else at the party had been doing lines for the last hour or so, but were doing so outside and I wasn’t aware. Everyone started to come inside to partake as it got late and that party turned into a scary fucking time to say the least. 

I’ve been around people who do snow at parties plenty of times, but not anywhere near like this. I know how it makes people act, but i’ve never seen this side of it. It was all they could talk about and think about. There was a girl with a nosebleed and her friend was crying and screaming about it, convinced she was dying. Another two girls, who were notably skinny, talking and laughing about how ‘scary’ they looked and shaking. A guy zoned out watching the tv for hours with his eyebrows twitching in all directions. Every 30 minutes to an hour they’d all jump up and pull out pans on the stove and it was runny noses all around for the next few minutes. 

I felt really awkward for not talking to them, I was just drinking, watching what was going on, being on my phone in my own little world. Someone came up to me SIX TIMES to ask if I was okay because I was “being very antisocial.”

My friend came up to me and showed me they had been writing in a notebook during this all. They sat on my lap bouncing their legs a million miles an hour and I could feel their heartbeat. They were writing about how they wanted to die. How love isn’t real. How everything is pointless. And they were showing this to everyone at the party, and nobody was even a little concerned. I was scared shitless. I was already quite a few drinks in at that point and couldn’t leave the party. I eventually went upstairs to sleep and nobody noticed. The next morning all that was on my mind was “go the fuck home”  

And I did, and nobody cared. They invited MORE people to do blow, they made screwdrivers at 8am to help the crash. And honestly all I could think was “holy shit I hope my friend is okay”

I wish I could help them somehow, but I feel like it’s not my place to do so. I hadn’t talked to them in forever, but here I was, invited to watching them and their friends binge out. I had never seen a group of people get that fucked up for that long. My friend is very clearly going through some shit but I don’t feel like it would even be appropriate for me to do anything but act like nothing happened. 

I just wanted to get this off my chest, because I feel so strange after that experience. I have insane amounts of sympathy for those who are struggling with or have friends/loved ones struggling with this drug. It is definitely scary. I’ll be picking up naloxone from a pharmacy soon to bring to every party I go to from now on.",1,1
372,2021-11-07 01:29:04,https://www.reddit.com/r/addiction/comments/qoi0f4/hey/,Hey ..,"Just here to vent anonymously fr. So I’ve been clean off ❄️ for almost 3 months now. After being violently addicted for about 4 years. Addicted like, spending every dollar I could, or getting a ball every day until the money was out when I got my tax refund.
I’m proud of myself but, no one knew I was an addict. I hid it as hard as I could, I borrowed money from people . No one to celebrate or feel proud with me. 
And it’s a big accomplishment to me .",54,0
