Date,URL,Title,Body,Score,COVID-19 Mentions,Sentiment
2022-02-22 05:35:14,https://www.reddit.com/r/addiction/comments/sykgk3/need_support_i_guess/,need support I guess?," 

I'm not one to really seek out support for my problems, so this is really weird for me, and I don't even know if this is the right group I just need to know someone else in the world knows what I'm going through right now. A year ago I used to wake up, take 750 mg of phenibut and 2 g's of kratom. I'd chase them down with a few beers and smoke some weed. After I got a good buzz going I'd take some oxy and klonopin, chase down with more beer. Right before it was time to work do a couple lines of coke then pop my happy ass into work. That was my daily schedule for almost a year, up until last year I decided to quit, because I got an amazing girlfriend, who I saw myself spending the rest of my life with. We started living together, things were going good, then 8 months in she started talking to and flirting with another guy, doing who knows what else behind my back, saying I changed, and I'm not the same person I was when we started dating. Now I'm having a really shitty crisis where I'm feeling like the drugs made me who I was, made me into somebody who people liked, and I'm having serious thoughts of going back. I don't want to go back but life feels so empty now and I just want to feel normal again. I just wanted to get that out there into the open world of the internet. Thanks for reading.",2,{},"{'label': 'NEGATIVE', 'score': 0.9779278039932251}"
2022-02-22 05:33:11,https://www.reddit.com/r/addiction/comments/sykffb/can_anyone_please_help_me_find_zoom_meetings_and/,can anyone please help me find zoom meetings and online fellowships focused on substance use!!,"I really want and need to find a support system to finally get clean... My DOC is meth and im 3 months clean off fent laced heroin. I could only get clean from H by starting the suboxone program in my town. it saved my life and is a miracle. they knew i still used meth but made a deal to get me off within a couple months once im stable off heroin.

well... there amazing people and so kind theyre giving me so much slack. But i was supposed to piss clean tomorrow and i relapsed 2 days ago after 4 days sober (the longest ive had in a year). i let them know imediatly and the response wasnt great obviously. If i cant pee clean in 1 week theyll most likely kick me out. meaning suboxone withdrawals and inevitable relapse on heroin. im not near ready and havent done much work on the route casue of my use. Even those 4 days felt great for my body though. and when i relapsed ive felt disgusting ever since. this stuff is pure poison

I barely fucking use meth now. i take a few hits before my evening shift bartending just to keep away withdrawal symptoms. foggy brain exhaustion iritable etc. i dont smoke to get high i just smoke enough to function. and all of this really comes down to work. i live pay check to paycheck... i cant take a week off to kick meth. i just got promoted and was put up to full time and thats why i used 2 days ago. becasue i was fucking dead and couldnt go to work and probably would have lost my position over it.

i know its just an excuse. my life and health are more important than a job. but i literally cant eat, or pay rent if i miss a few days or more. i have to kick it and work through it all and im alone in this addiction not 1 person knows. i dont know what to do... keep using until i can take time off but probably get kicked off subs leading to relapse? or stop using and keep working, probably do an awful job in my new position, possibly having to call in sick and maybe lose my promotion and or extra days i was finally given?",1,{},"{'label': 'NEGATIVE', 'score': 0.9976100921630859}"
2022-02-22 03:25:27,https://www.reddit.com/r/addiction/comments/syig7k/venting_maybe_idk/,Venting maybe? Idk,"My brothers been shooting heroin/meth for the past 5 years, ran away to cali 3 years ago. My childhood best friend overdosed on fentanyl in October. My dad who has been on meth for as long as I can remember finally got clean in January because he got covid and basically detoxed. I’ve always been a social drinker but lately I’ve been drinking around 2 bottles of wine a night. I feel like I’m drowning & and the only way I’m happy is when I’m buzzed even though I know what road I’m heading down. My family’s health declined severely through my brothers addiction on top of my dads own drug problems. My grandma had a stroke in November and my mom has become her primary caretaker. Im in graduate school right now & trying to help as much as I can, but I’m angry that my brother left me to do this on my own. On top of that, I feel guilty for being angry. I don’t even know if this post belongs here, pls delete if not.",2,{'covid': 1},"{'label': 'NEGATIVE', 'score': 0.9994503855705261}"
2022-02-22 02:19:52,https://www.reddit.com/r/addiction/comments/syhegh/does_alcohol_increase_blood_pressure/,Does Alcohol Increase Blood Pressure?," Excessive alcohol use can cause dangerously high blood pressure. More than three drinks in one session boost your blood pressure briefly, but frequent binge drinking can lead to long-term increases. Click here to learn more about [how does alcohol affect](https://allamericandetox.wordpress.com/2022/02/21/does-alcohol-increase-blood-pressure-all-american-detox/)[ blood pressure](https://allamericandetox.wordpress.com/2022/02/21/does-alcohol-increase-blood-pressure-all-american-detox/).",3,{},"{'label': 'NEGATIVE', 'score': 0.9944889545440674}"
2022-02-21 23:59:39,https://www.reddit.com/r/addiction/comments/syewxr/looking_for_people_with_experience_using_safe/,Looking for people with experience using safe injection sites,"Hi, everyone. I'm a journalism student in Ontario, Canada. I am exploring harm reduction amidst the opioid crisis, and am currenlty working on a story on the importance of peer-assisted injection services at safe injection sites across the country. I am looking to speak with people who have experience with peer-assisted injection -- any and all experiences are welcome. Feel free to PM me with questions and I will answer them. Judgement-free, respectful zone. Thanks in advance. :)",8,{},"{'label': 'POSITIVE', 'score': 0.9936748147010803}"
2022-02-21 22:36:31,https://www.reddit.com/r/addiction/comments/sydadm/any_help_would_be_seriously_needed/,Any help would be seriously needed,"So I decided to tamper with a-pihp several weeks ago. It went rather disastrous but I was able to get my footing back on the right track. Fast forward a month of 2 and I decided I would try a-php to see what the hype was all about. 

Now I’m going into day 3 and haven’t been able to fully put it away. I have some benzos for the comedown (almost make it even more enjoyable) but I have about a gram of php and 2 grams of apihp. 

Ughh",1,{},"{'label': 'NEGATIVE', 'score': 0.9956731200218201}"
2022-02-21 21:52:35,https://www.reddit.com/r/addiction/comments/syccqd/id_pop_one_pill_after_another/,I'd pop one pill after another,"It's just 1 mg of lorazepam, I tell myself. It's just for my nerves, I tell myself. I really need it, I keep telling myself.

In the meantime, life seems to be less and less bearable without taking it.",4,{},"{'label': 'NEGATIVE', 'score': 0.9896414875984192}"
2022-02-21 21:45:36,https://www.reddit.com/r/addiction/comments/syc7fc/drunk/,Drunk,One of my addiction is SH but today I am drunk. I am a mess.,5,{},"{'label': 'NEGATIVE', 'score': 0.9996881484985352}"
2022-02-21 21:36:20,https://www.reddit.com/r/addiction/comments/syc0ah/ugh_thinking_about_using/,Ugh thinking about using,Help. I'm like 6 months clean and I want to use. This is stupid. Ugh,8,{},"{'label': 'NEGATIVE', 'score': 0.9995265007019043}"
2022-02-21 21:36:03,https://www.reddit.com/r/addiction/comments/syc02j/almost_an_hour_gorefree/,almost an hour gore-free💪,i’m new here but i’ve been viewing that type of content for a while and i’m trying to stay clean for the sake of my mental health as my intrusive thoughts have been pretty bad lately because of it. not the best but it’s a start,20,{},"{'label': 'NEGATIVE', 'score': 0.9865909814834595}"
2022-02-21 21:20:30,https://www.reddit.com/r/addiction/comments/sybobb/never_take_advice_from_someone_who_has_never/,Never take advice from someone who has never struggled with a drug addiction.,Why? Because how would they know what it’s like if they’ve never been familiar with what you are going through.,63,{},"{'label': 'NEGATIVE', 'score': 0.9945855736732483}"
2022-02-21 21:10:43,https://www.reddit.com/r/addiction/comments/sybgu1/i_am_so_completely_addicted_to_netflix_its_crazy/,I am so completely addicted to Netflix its crazy.,"I'm so utterly screwed. The problem is that I don't want to get better, because I just enjoy Netflix so much (in a very guilt ridden way.) Everything else seems so boring in comparison to Netflix shows. Core areas of my life such as my sleep and work are suffering because of this very severe addiction. I think I'm more addicted to Netflix then I could possibly be to any drug. I just sit there clicking next episode over and over again and 6 hours go by. And I hate myself for it. Every night I say I'm going to stop, every time I go out of the house I say I'm going to stop, and then I come back inside and watch the show.",1,{},"{'label': 'NEGATIVE', 'score': 0.9965049028396606}"
2022-02-21 21:00:09,https://www.reddit.com/r/addiction/comments/syb87e/i_feel_like_crying/,I feel like crying,"I don’t care how much I post on this I just don’t have anyone to talk too. As someone who suffers from depression and anxiety I feel like it’s coming all back even though I’m on antidepressants. I’ve also been getting high everyday, but I have nothing today…wel I could do cough syrup but I don’t know yet. I’m having such a shitty day and nothing even happen it’s all me feeling like shit. I literally am being a bitch. I just told one of my friends that their friend that died was a dumbass. Now I feel like a jackass. And I’ve been being a bitch all day. Just giving people dirty looks, being rude in general. I feel upset. I hate myself again",9,{},"{'label': 'NEGATIVE', 'score': 0.9992696642875671}"
2022-02-21 19:12:02,https://www.reddit.com/r/addiction/comments/sy8xbb/im_an_addict_and_i_need_help/,I’m an Addict and I need help,I’ve been doing a lot of Xanax and Valium lately like a lot and I can’t stop… I’m also on a shit ton of opiates a lot and smoke weed basicly 24/7. I’ve been on this shit for a long time and I really wanna stop but I can’t no matter how hard I try… my brother died from herion and you’d think that would be enough to scare me off of drugs forever but no it jus made me do them more cuz I want to escape. I’m only 16 and I’ve overdosed 2 times. I wanna have a good life but I can’t seem to leave the drugs behind. Any advice?,3,{},"{'label': 'NEGATIVE', 'score': 0.99160236120224}"
2022-02-21 19:09:18,https://www.reddit.com/r/addiction/comments/sy8v6t/i_really_want_to_quit_youtube_shorttiktok/,I Really want to quit YouTube short/tiktok,"I have posted this on r/addictionadvice but I'm getting desperate

YouTube short is making me so fucking depressed, unmotivated,unhappy and overall a more bitter person,it keeping me away from hobbies I really love and passionate about like computers,Linux and video games and I haven't been sleeping very well I mean last night I stay up to 2 fucking am scrolling to these god awful short the only one I like on shorts are cooking video that's it 

Fuck this algorithm fuck YouTube and TikTok",10,{},"{'label': 'NEGATIVE', 'score': 0.9954752326011658}"
2022-02-21 19:07:41,https://www.reddit.com/r/addiction/comments/sy8u0n/bro_all_i_did_was_get_high_on_edibles_for_a_month/,Bro all I did was get high on edibles for a month now I’m a mess.,"Been getting super high off high amounts of thc edibles and stuff every single day. I started off only doing it weekends but I just kept doing it. Today would be my first day not getting high…cause I started popping random pills, and yesterday I drank a bottle of cough syrup just to get High. It’s like I crave being high.  And I just feel so annoyed and I don’t really care what others think of me…I’m tired of the bs. Irritation fume",21,{},"{'label': 'NEGATIVE', 'score': 0.9995054006576538}"
2022-02-21 17:23:54,https://www.reddit.com/r/addiction/comments/sy6e2e/advice_plz_tactics_for_not_relapsing_on_nicotine/,Advice plz: Tactics for not relapsing on nicotine when getting drunk,"Age 39, smoker of 24 years. I have quit for months and years along the way. I have always had a massive association between alcohol and cigarettes. My undoing for smoking is ALWAYS when I get drunk, cos a)the mental association with alcohol just amplifies the craving b)the wall of self-discipline is weakened by alcohol and c)I'm surrounded by smokers offering me one. I haven't had a drink for 6 weeks nor any nicotine for 5 days, but I'm going to a function this weekend. I can totally see myself getting drunk and smoking AGAIN. Any helpful strategies?",1,{},"{'label': 'NEGATIVE', 'score': 0.9944281578063965}"
2022-02-21 15:55:18,https://www.reddit.com/r/addiction/comments/sy461q/soft_white_underbelly_youtube_channel/,Soft White Underbelly - Youtube Channel,"Perspective is everything. There is almost never a hole too deep to dig yourself out of.

If your feeling alone w/ your struggle I recommend checking out the youtube channel ""softwhiteunderbelly""

Link here [https://www.youtube.com/channel/UCCvcd0FYi58LwyTQP9LITpA](https://www.youtube.com/channel/UCCvcd0FYi58LwyTQP9LITpA)",9,{},"{'label': 'POSITIVE', 'score': 0.9044978618621826}"
2022-02-21 14:59:09,https://www.reddit.com/r/addiction/comments/sy2sh0/drug_testing_can_they_differentiate_tobacco/,Drug testing: Can they differentiate tobacco smoking vs gum/patches/aids,"Is there a test out there that can be used for a person that is trying to stop smoking, but is utilizing nicotine aids like patches, gum, lozenges, or whatever else is out there? So I'd imagine it would be testing for something other than nicotine since it would need to differentiate the aids from tobacco smoke.

I tried searching and couldn't find anything....hoping someone has some experience and can give me a quick and definitive answer.

Thanks in advance!",0,{},"{'label': 'NEGATIVE', 'score': 0.9949871301651001}"
2022-02-21 14:01:24,https://www.reddit.com/r/addiction/comments/sy1eqy/what_makes_a_good_detox_nurse/,What makes a good detox nurse?,"Hi all, I am an RN on an acute drug detox unit and am asking for input from others that have detoxed inpatient before. What would you qualify as a good detox nurse? What qualities would they have? What could I do as a nurse to make you more comfortable? I am also trying to think of things I can bring in for my patients to do on their downtime, when groups aren’t happening. So open to those suggestions as well. I love my patients and want them all to succeed and want to be there for them 1000%.",3,{},"{'label': 'POSITIVE', 'score': 0.9915246367454529}"
2022-02-21 12:31:53,https://www.reddit.com/r/addiction/comments/sxz75b/three_weeks_clean_from_addiction_an_opportunity/,"Three weeks ""clean"" from addiction, an opportunity to do so in a casual sense is coming up, what do I do?","I don't know how to talk around it so I'll just say it, I'm a sex addict, I've been holding off on any impulse for three weeks plus a day it's going pretty well, and I've got nobody but my girlfriend to thank for that. Well, she's been getting a bit more intimate lately, and you could cut the tension between us with a knife, and I'm honestly not sure if I should go for it

It's a nice and intimate moment between two people who have a decent trust between them, but everytime my mind wanders towards the subject of sex, I only think of it in the vein of ""aw, nice, I'm gonna get a fix"", and I feel liks that isn't the right way to go into it

I'd say it's like a food addiction, you're eating healthy, but then your best friend gets a promotion and the celebration calls for a pizza party. It wouldn't hurt to indulge, but it could be a gateway back to the problem",6,{},"{'label': 'NEGATIVE', 'score': 0.9698092937469482}"
2022-02-21 12:20:32,https://www.reddit.com/r/addiction/comments/sxyx5s/need_help_with_energy_drink_addiction/,Need help with energy drink addiction,I got addicted to Monster and Nos about two years ago when I worked the night shift for FedEx ground because it would keep me awake and able to push through loading so much shit all the time. I quit working there after a year but I've continued on drinking 2 or 3 cans a day sometimes 4 when I'm depressed. Every time I try to quit I get extremely painful headaches and a raw sensation in my gut that quickly goes away when I start drinking again. I've tried tapering off but when I drink even one I get immense cravings for another and the cycle continues. I can feel my health declining and my teeth feel weaker and weaker every day. Was wondering if anybody has had experience with this and could offer a non-typical solution that actually works. Thanks in advance.,3,{},"{'label': 'NEGATIVE', 'score': 0.994038462638855}"
2022-02-21 11:40:26,https://www.reddit.com/r/addiction/comments/sxxx8s/how_would_we_figure_out_a_weird_late_night_smell/,"How would we figure out a weird late night smell for a few hours, when landlord wouldn't offer any help?","Hear me out please, this is a bit crazy. So every night, right after my bf goes to work, I turn my lights off ( around 1 am, bf works 3rd shift), I hear a couple of people running the hallways. Shortly after, a terrible nauseating smell starts seeping through my apt door, vents in the bedroom, and living room. It keeps waking me up during the night. Right before 8:30 am when bf comes back home and landlord usually gets in his office, smell's completely gone. This has been going on for several months now. Told landlord, he came up here in the morning, and told me no smell of any sort, it could be food. I've been trying very hard to see who those people are, but it's pointless. No talking whatsoever, not a peep. I stand by the door sometimes for an hour just to see who they're and where they come from, the minute I step into my bathroom, I hear them running while I am in there. Landlord told me not to call cops, they have better things to do. 

I've asked two old ladies near me, and they told we didn't smell anything. 

Smell is not like marijuana for sure. Like burning wood when you're out camping or something like that. Could be crack? My bf did smell it once out in the hallway and told me it's not weed. 

We moved to this city from a 8 hour away town, and spent lots of money, and it's just insane to move somewhere else now. Also, bf works pretty close to here and I work from home. 

How could we figure it out? It's super quiet on my floor all day and night long. Gives me the creeps at night when I am alone.",1,{},"{'label': 'NEGATIVE', 'score': 0.9994601607322693}"
2022-02-21 11:19:47,https://www.reddit.com/r/addiction/comments/sxxf4d/any_alcoholics_successfully_learn_moderation/,Any alcoholics successfully learn moderation,"Before I start I just want to say there is no offense to the ones in the twelve step program, AA, or decide to do abstinence. I do think moderation is possible for people like me who have been diagnosed with AUD. I tried everything and none of it worked. I think the ideal of full on abstinence for the rest of my life and starting all over to day 1 stressed me out. I've managed to successfully drink once a week or every two weeks I'll go and drink. Yes I do binge drink when I do, but I was thinking about trying naltrexone when I do.  I've been doing this for a year a now and it helps me stay sober. I'm tired of feeling guilt about it though because I don't want to get judged by peers. Has this moderation thing worked for anyone for long periods or not? Please tell me your experiences.",4,{},"{'label': 'NEGATIVE', 'score': 0.9945118427276611}"
2022-02-21 09:44:38,https://www.reddit.com/r/addiction/comments/sxv5um/addicted_to_everything/,Addicted to everything…,"It seems like im addicted to everything. Like I trade habits for new ones or that I circle back to old habits when the new ones cycle out. I date women who treat me like shit. When it finally breaks me, I trade that in for drugs, when I quit drugs, I move onto food, then back to a relationship, then to alcohol. Sometimes the addictions overlap. But idk where to go. Addiction counseling here is a joke. There are no peer support counseling groups. Im an opportunist addict.",5,{},"{'label': 'NEGATIVE', 'score': 0.996702253818512}"
2022-02-21 08:41:03,https://www.reddit.com/r/addiction/comments/sxtrwm/5_months_rehab/,5 months rehab,"Just got accepted into rehab for 5 months, calling out 2 anyone who has successfully went down this path and is in healthy recovery for tips and advice
I'm cross addicted Alcohol/drugs (Heroin) I did a 28 day programme last year for the 1st time and it went well, the recovery afterwards not so well
Any tips for the 5 months and recovery after would b very appreciated
Thanks in advance",3,{},"{'label': 'POSITIVE', 'score': 0.9934158325195312}"
2022-02-21 07:54:55,https://www.reddit.com/r/addiction/comments/sxsuuf/oh_the_addict_brain_if_you_have_children_shouldnt/,"Oh, the addict brain. If you have children, shouldn't they be enough to get clean?","Hi. What started with alcohol, has been a decade of one substance after the other. I need this for energy, or I need this for depression. My kids have seen me measure my kratom and phenibut for years and I always said it was for energy or a supplement for my protein shakes. Oooooooookay.

On substances im not an introvert anymore, im not shy and insecure and anxious. Im outgoing and talkative and creative. All of these things that make me an even better mother (I tell myself) because I've never been clean longer than a couple weeks off of EVERYTHING for 8 years to even know.

I remember my creativity when my kids were 1,2,3... 

I know I don't need drugs to be that person. But I can never make it through withdrawal/ paws and be a good enough mother, so I go back or I find another ""legal"" drug. (No I have 0 help to go to treatment. None.) I've been ""sick"" SO MANY TIMES for a week or 2 on end when they've had to basically fend for themselves. That can't happen again. Ever.

This last habit cost me $20k. I panic about paying lunch money at their school but I can go pay $50 a pop for ""energy and motivation""?!?

As I popped my last handful of pills which I thought was discreet, my 8 year old in the backseat of the car coloring... ""mommy why are you taking so many pills? You don't need those mommy."" She's right.

I stopped drinking a 5th of vodka a day 5 or so years ago after I had to drink(unknowingly, or so I THOUGHT!) To be social at my kids sports game. Drove home trashed, they called the only person they knew hysterical trying to give them directions of where we were. Police came because I was in someone's front lawn - I fought them and three other people infront of my kids - woke up the next morning in my bed clueless.

I could have lost them all. Just like that. They all remember that. My 8 year old doesn't even like me to drink wine or beer, tells me I don't need it. She knows I act differently, even though in my mind I need it to get things done etc.

I could be such a better mother. 50 hour work weeks, 3 kids, school, sports, home - HOW do I convince myself I can be amazing without all of this shit thats probably killing me?! I tell myself everyday & I already know I dont need this shit and I need to stop for my kids - but its like I HAVE to always be on SOMETHING?!

God give me the strength.",26,{},"{'label': 'NEGATIVE', 'score': 0.9290161728858948}"
2022-02-21 06:05:16,https://www.reddit.com/r/addiction/comments/sxqzy3/im_done_with_my_suggar_addiction/,Im done with my suggar addiction🥳,Guys I did it! I have no carving anymore. The only addiction I still have is p0rn. Thank ya'll for the help!,10,{},"{'label': 'NEGATIVE', 'score': 0.962817370891571}"
2022-02-21 06:03:58,https://www.reddit.com/r/addiction/comments/sxqz3z/feels_like_an_onset/,Feels like an onset,"I’m 23. I have dealt with sexual abuse and cheating for many years. I didn’t really rely on substances to help me get past any of it. I tried to kill myself and when I was discovered, my parents helped me go to therapy. Discovered I have clinical depression, anxiety, and OCD. My first experience with sexual assault was the trigger for all my borderline mental issues to come to their full glory. This all happened when I was 14 and I had kind of started becoming better around 19. I just smoked cigarettes first. But then I went to postgrad at 22 and things went downhill from there. All my issues just came back and became 10 times worse. Therapy didn’t seem to be helping because my old therapist moved aboard and I didn’t have the strength to find another. Even the ones he recommended weren’t good enough. So I started weed, hash, and alcohol. It’s been about 7-8 months now but I can’t find strength without at least one of the three. I have to be drunk or high to get through my awake hours and to put me to sleep. I also smoke excessively. A pack a day. It feels so much like an onset and I hate it. But I also don’t know what to do to help myself get through each day. I’m absolutely confused and tired. Cannabis and alcohol are my only solace.",4,{},"{'label': 'NEGATIVE', 'score': 0.9994033575057983}"
