,Date,URL,Title,Body,Score,COVID-19 Mentions
233,2021-11-14 20:24:00,https://www.reddit.com/r/addiction/comments/qu4n9j/need_some_advices_for_a_friend/,Need some advices for a friend,"Hi everyone
Long story short, my 20 y.o neighbor (I’m 22) recently came at me while I was smoking outside and he told me that he’s taking benzodiazepines and cocaine, mosty alone, he didn’t specificely asked for help or anything but he seems tired and lost, how can I help him guys ? I know him for long and he’s a good guy, but a tortured one. Thx",2,0
234,2021-11-14 20:02:07,https://www.reddit.com/r/addiction/comments/qu48dm/addicted_to_coke_porn_girl_24_y_o/,Addicted to coke / porn - girl 24 y o,"24yo girl horny as hell, love taking from some of my bfs cocaine stash and getting my lil pussy soo wet before ive even touched it, that sensitive to touch way. Coke makes me feel so dirty too. Makes the cums feel so much more intense. Like chatting to dirty guys or girls online while my bf asleep or at work ;) rubbing my pussy for hours lying in my wet patches",0,0
235,2021-11-14 18:21:14,https://www.reddit.com/r/addiction/comments/qu2ag1/what_do_you_usedo_to_stop_relapse/,what do you use/do to stop relapse,when you get the urge… whaddya do,3,0
236,2021-11-14 18:02:19,https://www.reddit.com/r/addiction/comments/qu1wzu/smart_recovery_online_zoom_discussion_meeting/,SMART Recovery Online ZOOM Discussion Meeting Tonight at 9 pm CT,"I will be facilitating a SMART Recovery Online ZOOM meeting tonight (and every Sunday night) at 9 pm CT under the username SleeplessInSeattle.  It is free to attend, confidential, active participation is optional and e-mailed meeting verifications are available. SMART Recovery is for all addictive behaviors.  The meeting I facilitate last 90 and we average about 180 attendees per meeting.

To Join Tonight's 9 pm CT Meeting If You Do Not Have Your Free, Confidential SMART Recovery Online Account:
1) Go to http://smartrecovery.org
2) Click on ""Online Community""
3) Click on ""Register for SROL"" and complete your free, confidential online registration.
4) Click on ""SMART ONLINE MEETINGS"" and then ""Meeting Schedule & Event Calendar"".
5) Click on the Link Entitled:  Sunday @ 9:00 PM to 10:30 PM CT - Facilitated by SleeplessInSeattle - VERIFICATIONS PROVIDED

Want to find out more about SMART Recovery?  Join the Minnesota SMART Recovery private Facebook Group (even if you are not from Minnesota 😁):   http://www.facebook.com/groups/smartrecoverymn/",1,0
237,2021-11-14 17:33:58,https://www.reddit.com/r/addiction/comments/qu1c2w/please_help_us_help_our_veterans_in_recovery/,Please Help Us Help Our Veterans In Recovery,"https://youtu.be/fhYd72IVwiU

Please consider giving $5, $10 or $25 to the Recovery Community Network (RCN) by this Thursday (11/18/2021):  https://www.givemn.org/donate/Recovery-Community-Network

At RCN we help others in Recovery in Central Minnesota and we have special programs to help our Veterans in Recovery.  You can read more in our 2021 Annual Report:  http://tiny.one/rcnmn",5,0
238,2021-11-14 17:32:44,https://www.reddit.com/r/addiction/comments/qu1b4o/blacklisted_league_of_legends_download_page/,Blacklisted League of Legends download page forever and it cannot be undone.,This game is worse tham being burned alive and more addicting than cocaine. Im so sorry for my past self who discovered this disease and wish I never played it. It is undobtely the reason for my current shitshow of a mental state and the reason why I have no life interests anymore. I just could't take the mental abuse and the need to commit arson daily because of it. Im done.,18,0
239,2021-11-14 16:34:14,https://www.reddit.com/r/addiction/comments/qu0244/i_have_only_been_sober_for_2_months_in_the_past_3/,I have only been sober for 2 months in the past 3 years,"Smoking like a chimney every day whether its weed, nicotine, tobacco or all three, I just love to blow smoke. It doesn’t stop there though, because honestly I’m addicted to being high or atleast feeling different than sober. When I’m out of weed I’ll steal pills just to not be sober. Being high constantly has affected my relationships with people, good and bad but the bad hurts the most. The thing is, I just want to be high everyday and wouldn’t stop if there wasn’t bad side effects. Tips?",4,0
240,2021-11-14 14:28:48,https://www.reddit.com/r/addiction/comments/qtxc8b/literature_on_addiction/,literature on addiction,just read an essay 'alcohol & poetry' by lewis hyde and looking for more essays or shorter pieces of literature on addiction & related topics. a la gabor mate. book recommendations would be good too but im not looking for anything self-help directed or about recovery paths. more looking for writing about the nature of addiction. stuff similar to 'journeys into the bright world' would be appreciated too if anyones heard of anything similar.,2,0
241,2021-11-14 14:10:52,https://www.reddit.com/r/addiction/comments/qtwybx/i_cant_seem_to_quit_weed_have_chronic_pain_and/,"I can't seem to quit weed, have chronic pain and want to end it all","My name is Shane and im a 26 years old male who has been addicted to weed ever since i was
16 (great for the brain development,i know).

It started at just parties and then snowballed into making all my everyday activities ""more fun"" . As I got out of highschool it became more and more of an addiction. My motivation dropped and my weight climbed. I dropped out of college a month in, didn't have the attention span for school anymore so i decided to take a ""year off"". 

Years go by and I work about 10 different dead end jobs. Feels like nothing makes me happy. I spend the little money I do make on all consumables (alcohol,weed,food) so I work about a decade with zero savings to show for it. At this point I'm fat, single and have basically nothing to show for my life.

Then 2020 hits and on top of a global pandemic beginning, I also start to feel pain in my wrist. I begin to think its carpel tunnel so i see a doctor and take a test.They say it showed I didn't have carpel tunnel after all.

Then I begin to feel pain/stiffness in my neck and again see a doctor and do tests and they say I'm fine. This pain/stiffness then begins over time to spread to my shoulders/traps, to my back, to my knees, to my feet. You get the picture. I've seen countless doctors and specialists since then and tried stretches,lifting at the gym, swimming and more. The doctors don't know whats wrong and i keep getting worse. They suspect fibromyalgia but don't seem to be sure enough to actually diagnose it. It's been nearly 2 years of this and i feel worse than ever. 

You're probably wondering how this still also connects to my weed addiction. Throughout all of this stuff happening I've basically never stopped smoking weed besides here and there for a week or two. I don't know how to live without it.

Now I feel absolutely defeated, I had to move back in with parents because i couldn't keep my job in my amount of pain I'm in. I wake up in pain and everything is so stiff, my jaw cracks all the time now (probably something to do all the tension in my neck and shoulders) .The only money I make is using food courier apps with my mom. I can't do it alone because I don't have a drivers license yet. I feel like if i never started smoking weed,I'd have my licence, a car and a college degree by now but instead I have none of those.

I have no job,licence,vehicle,house,savings or girlfriend. 

I do however have pain,depression,anxiety,suicidal thoughts,parents for roomates and about 60 pounds I now have to lose, great.

I seriously think about jumping off the local bridge on a daily basis and have absolutely no idea how to quit weed after trying edibles, vaping and other alternatives. Quitting cold turkey seems near impossible these days as I have no job to distract me but too much pain to be useful at a job.

I just need advice on what to do as a 26 year old dude with chronic pain who wants to be productive and to be totally sober but can't seem to achieve either. Who just wants to know whats causing this physical pain and to make it stop or at least less intense. I just want a life worth living.",8,1
242,2021-11-14 13:49:41,https://www.reddit.com/r/addiction/comments/qtwhgx/hello_friends_please_help_long_island_ny/,Hello friends please help (Long Island ny),"I am trying to stage an intervention for my best friend. 
He’s essentially in full blown addiction and living in shelters.
Our friend group has had to cut him off as many of us have struggled with his DOC and can’t enable him or put ourselves at risk.
I’ve never given an intervention and don’t know if there are resources for this kind of thing where we can get a mediator or professional. 
I have modest means but this guy is a brother to me and I’d be willing to spend money to increase our chances of success.

If anyone has experience with interventions or resources to help me, please leave a comment.
I am in Long Island ny, specifically Nassau county.

Please help a desperate addict in recovery help my friend in the throes of addiction.

Thank you and bless up",2,0
243,2021-11-14 12:59:25,https://www.reddit.com/r/addiction/comments/qtvdpo/my_brain_makes_me_feel_like_a_fake/,My brain makes me feel like a fake,"I feel like I’ve been faking my problems this whole time which makes me even more reckless and has made me do more in the past few days just to prove i’m not a fake to myself which has just backfired on me instead since I feel like I haven’t done enough, especially since regardless of how much I did none of it would get me high. 

I just don’t know how to get out of this feeling; every time I try to convince myself I’m not faking my brain comes up with another reason that I am faking. This comes up a lot after I’ve been sober for a little bit too, so I doubt that it was ever that bad and that I would be perfectly fine if I went back. I don’t know what to do anymore. 

Is this a common thing for drug addicts? I feel like I’ve been lying to the one person I trust for months too due to feeling like a fake addict",8,0
244,2021-11-14 11:43:52,https://www.reddit.com/r/addiction/comments/qttpyp/notes_to_self/,Notes to self,"I am writing this down to keep track of the things I do, how I feel and how can I improve in the near future… 

This sub became sort of a journal to me. Last time I screwed up was about a month ago. Yesterday I went out with friends, had a couple of drinks and when the night was over, the girls went home. Decent time, right before midnight. 

What did I do? Went to a nearby pub. Didn’t drink much but the band was awesome, got wired. When the pub closed, around 2am, what did I do? Went to a club. 

Met a few fun people, one word and I was in the bathroom taking key bumps. I had 8 solid months clean, slipped a month ago, slipped again yesterday. 

The party at the club moved to a guys apartment nearby, there was six of us having beers, chain smoking and doing a few lines. Very few, nothing compared to the all nighters I pulled in the past, but enough to get me home at 10am. 

Fuck. It was a lot of fun. 

I am not depressed, had some sleep, didn’t feel the comedown, but I am sure later today, or maybe tomorrow, there will be some body pain. 

My damn point is: how the hell do I keep myself from doing this?? I have been keeping myself on a leash for a long time. This was the first all-nighter since July 2020… I was so proud of myself for being “normal” lately, keeping my drinking under control, away from blow… 

I want SO BAD to be the person that goes out with friends and goes home before midnight! I need to be this person, I am too damn old to be partying like a 20 something. I should quit drinking, I know. 

How do I do that when the only two or three friends I have left hang out at bars? How do I quit social life entirely? Or should I just accept that a party once in a lifetime will do no harm and it’s fine, I’ll be fine and I will not fall of the wagon, it was just one party in the entire year and I am excused? 

My therapist would tell me to chill. 

I need to see her soon. I need to chill. But I need to work on my self control. Recovery takes so long and it requires so much change… I need to actually change myself instead of just putting my urges in the back burner. 

I hope someone can relate to this so I know I am not the only one that is doing so well, but occasionally still feels like a fraud, a failure or at least, still needing some hard work in some areas. 

Have a great day!",3,0
245,2021-11-14 07:57:15,https://www.reddit.com/r/addiction/comments/qtpab9/broken/,Broken,"I feel just like the title says. I’ve posted on here once or twice before. I’m in rehab. We’re under Covid rules so in a bubble. We’re in lock down for over 23 hrs a day. I’ve been here 4 months. Meant to leave end of jan but got an extension until end of March if I want it. My closest friend in here left today and a male friend I was very close to. In fact that close we got put on a relationship ban, he’s been thrown out today. Im also unwell and the doctor thinks it maybe throat cancer, got a biopsy on wed and im scared of what this might be. Ive had a death in the family and stayed here. I feel ive still really struggled to show my emotions in front of anyone and speak about all the pain and trauma that I have. Ive not shown gratitude the last few days . Ive had that ‘ fuck it ‘ attitude. Which has got me here in the first place. Feel Ive been in self destruct mode the last few days. Today it’s all come to the surface. Ive hardly slept and not stopped crying. My peers keep telling me how strong I am but I don’t feel strong inside I feel like I’m falling apart. I’m scared, I’m fed up, I miss my daughters and sisters, I’m exhausted and just needed to rant. Sorry for the long post.",5,1
246,2021-11-14 06:54:00,https://www.reddit.com/r/addiction/comments/qtoaxe/panic_attacks_are_no_joke/,Panic attacks are no joke.,"I’m so tired of the racing thoughts, the panic attacks, the sweating and my heart always feeling it wants to jump out of my chest. I’m one week off coke, and I’m intending to stay off it, but man, these withdrawals can be a massive drag… 
For context I was doing it every weekend for about 2 months, usually 2g with mates but once or twice shared 5g with mates. 
I’m a fairly new user so I hope my recovery period won’t take long but man, this is tough. It’s like you’re fighting a constant battle within your brain with some occasional physical symptoms but, the battle in the brain is the most intense part.

Sorry for the rant, just needed to get this off my chest.",11,0
247,2021-11-14 04:31:06,https://www.reddit.com/r/addiction/comments/qtmcd5/im_feeling_like_shit_sorry/,"I'm feeling like shit, sorry","I haven't been able to stop using coke for a year and a half. It feels like the worst trip of no return of my life. I am not even able to cry right now despite the deep sadness I feel. Coke took over my life and my mind.
Hundreds of times I said broken in tears that I was going to leave this because I cannot bear the hangover and the depression that it leaves in me when everything is over.
I hate this. I hate myself for starting this. I hate not being able to stop using this.
No other drug makes me feel as good and functional as cocaine. I just can not stop. I cannot ask for help for fear of being hospitalized again.
I need someone to tell me that it is possible to stop with this after a whole year of using every 3 days.
I need hope.
But I am so destroyed that I do not see a possible way out.
Thanks for reading, I needed to vent to people who understand this horrible feeling.",8,0
248,2021-11-14 03:49:22,https://www.reddit.com/r/addiction/comments/qtlrkl/am_i_falling_into_the_addiction_hole_worried/,"Am i falling into the addiction hole? Worried about casual use going overboard and most importantly worried about ""self-destroy"" mentality","I have been into exploring drugs it's been 4 years now(23M) with my main substances being THC(4 years 1000mg THC total per day avg), Ketamine(2 years on/off 250mg per day), Nicotine(daily), Harmaline(1-month daily treatment every 6 months) & Tramadol(rarely but I still consider it as a friend) 

I am sharing this information because I am reaching a point where I am noticing that although I made sure to stay away from harmful hard drugs like cocaine(never even tried it) and other drugs that have hard-core physical addiction symptoms because I know that is a lost game. However, the substances I cherry-picked were scientifically proven to be safe(for casual use) but lately, life has been getting really really really tough.

My whole country went into an economic/energy/fuel/political/humanitarian crisis and I have been feeling an impending sense of doom that is reinforcing my drug-seeking behaviour and highlighting my cognitive disturbances. I know depression alone is worthy of causing brain fog and it's not like I am suffering mentally but I am feeling like I am operating at 50% capacity compared to how I used to before covid-19 started and things cascaded.

I know my intake is bound to affect my psychology and I am really knowledgeable of how each drug i take has the potential to hurt me in the long run. But since my need for escapism currently is fueled by valid feelings (mental illness has skyrocketed here and suicide rates as well)  and due to the fuel crisis basically, our vital space is decreased to half a mile radius, and with all the electricity cut-offs happening(6 hours blackout per day minimum) getting high is just a natural defense mechanism at this point.

I am not sure what to do because if I keep getting high the way I do I get to remain functional and remain motivated and keep on hustling to get better opportunities in life but I feel like I am burning myself doing this mentally and chemically, and worried that eventually my abuse will catch up to me and cripple my brain, especially while under the influence. Without my horribly built defense mechanisms, I am crippled and unable to provide the same performance level(which is already low). So I am stuck between feeling sorry for myself because I am high or feeling hopeless, depressed and unmotivated because I am sober and aware of the miserable situation I am stuck in.

I think this is less of an addiction and more of a therapy question but I thought I'd try my luck.",2,1
249,2021-11-14 03:14:28,https://www.reddit.com/r/addiction/comments/qtlauy/getting_covid_was_my_turning_point/,Getting Covid was my turning point,"I don't have it in me to explain too much other than, I literally picked up a bag of K even when Im already dealing with covid. Long story short, aside from the mental effects of the shame and self disgust from using when already depleted and sick, my body literally rejected the drug. Now that I have covid it literally won't accept the drug into my system without me violently throwing up. Like my standards are literally too low for a VIRUS....... 

anyway. Self esteem? On the floor. Motivation? Higher than ever. It can only be up from this point. Nights like this are hard to forget. Solidarity to anyone out there who feels like they don't even have autonomy anymore. Your body will say no eventually. It's smarter than you...",7,4
250,2021-11-14 02:54:20,https://www.reddit.com/r/addiction/comments/qtl0rf/unique_and_proven_method_for_achieving_and/,"UNIQUE AND PROVEN METHOD FOR ACHIEVING AND MAINTAINING SOBRIETY! ADVISE, SUPPORT AND PROFESSIONAL KNOWLEDGE ABOUT REVOVERY AND LIFE.","r/SoberGamer.                                                                              New Group to Reddit, Created by DriedOutDubs. Original creator of first ""gaming for sobriety "" Content and addiction support page Originally on FB. If you or a loved one need help with this heroic life change, JOIN! First hand knowledge from Gamer,  Streamer and  Addiction Advocate DriedOutDubs. 

ALL ARE WELCOME TO THIS GROUP!  WE ARE HERE TO HELP!  🙌🙂",1,0
251,2021-11-14 02:49:58,https://www.reddit.com/r/addiction/comments/qtkyk1/going_to_detox_on_monday_any_tips_on_what_to_pack/,Going to detox on Monday. Any tips on what to pack or what to expect or how to make the meet or it?,"Coming off of opioids alcohol and Xanax. My 2nd time going to rehab but first time having to actually suffer through something I imagine will be a very difficult to detox from.

Very scared. Any suggestions or support would be appreciated",4,0
252,2021-11-14 00:42:09,https://www.reddit.com/r/addiction/comments/qtj55h/using_dreams/,Using dreams,I keep dreaming of using even though I know I would not use given the opportunity for some reasony dreams don't think so,1,0
253,2021-11-13 23:03:50,https://www.reddit.com/r/addiction/comments/qthkwq/lets_do_it/,lets do it!,"Hey folks so I am tired of messing my life up. Cocaine has been in my life for the past 4 years. I 100% always have fun not going to lie. But I wake up the same every time midday the next day and realize I have spent way too much money and feeling overwhelmingly depressed. My life is so close to being great with work and home life but I destroy it on the weekends. So, lets do it folks today is day one!",8,0
254,2021-11-13 19:17:03,https://www.reddit.com/r/addiction/comments/qtdog8/one_week_coke_free/,One week coke free!,"I can do this!
I feel like crap, but I’m hoping I can get through this. My hands are a bit shaky, my head is a bit floaty and I get dizzy occasionally but I’m determined to get through this. 
I am quite irritable lately and it seems like everything annoys me! 
I’m hoping these are all normal withdrawal symptoms….
My anxiety also seems like worse, not as manageable, but I believe this is just a side effect of it…

Whoever else is going through this, we can do it!",53,0
255,2021-11-13 18:03:55,https://www.reddit.com/r/addiction/comments/qtcdjv/argument_about_addiction/,Argument About Addiction,"Hey! so me and my friend got into a discussion about addiction, we both have experience with parents who have suffered with addiction, the only difference is that i am an addict (clean 1yr now :)) she is not and has never done anything close to it. 

i was telling her to to careful about the lies we often tell while still validating that she has seen the lies, and been deceived but that it can look different from addict to addict. she went on about how shes “not stupid and knows what to look for” and that she would “never fall for it” because shes seen addiction. which i understand but still said she should be wary because you’re not immune and should be careful, just because you’ve had it happen to you doesn’t mean it never will again right?

I just want to know if i went wrong? she is offended, which i did apologize for but i also made it clear that i was speaking from an addict standpoint and how sneaky i was, i fucked over family members who also previously dealt with addiction. i was just looking out for her but i also see how i probably made her feel like she didn’t know anything. help?",2,1
256,2021-11-13 17:43:32,https://www.reddit.com/r/addiction/comments/qtbztf/my_adderall_addiction_unexpectedly_forced_me_to/,My Adderall addiction unexpectedly forced me to quit vaping,"I'm currently addicted to Adderall and trying to quit - I'm not at an extreme point yet (max 60mg within 24 hrs) but I don't want to minimize it or give myself excuses why it's ""okay because it's not even that much."" It's already caused me to get in trouble at work and I've lost 15 lb within 2 months, which means for *my specific brain chemistry* it is too much. 

A HUGE side effect for me with uppers is teeth grinding and clenching. I'll look up from 8 hours of doing ~who knows what~ and suddenly have to PAINFULLY detach my upper molars from my lower ones. My teeth ACHE and I have 12-hour headaches sometimes. So I got a cheap teeth grinding mouth guard.

A side effect of having that mouth guard in whenever I'm on Adderall? I CAN'T vape!! To my specific lizard brain, taking out my mouth guard every 15 minutes to hit my vape is way more trouble than it's worth. Funnily enough, the only time I crave nicotine is when I'm on Adderall! I'm quite pleased with this development.

Next step: finding a healthier ""addiction"" that makes Adderall too inconvenient to take! Maybe rock climbing? Adderall would make me too shaky to have grip strength...

**I named my account throwaway but I'll actually be using this account consistently to post/comment in these communities as I try to quit Adderall.",1,0
