Date,URL,Title,Body,Score,COVID-19 Mentions,Sentiment
2022-02-27 22:28:52,/r/disorders/comments/t35npw/romanticizing_mental_illnesses_is_toxic/,Romanticizing mental illnesses is toxic.,,4,{},"{'label': 'NEGATIVE', 'score': 0.9978952407836914}"
2022-02-27 21:56:12,https://www.reddit.com/r/addiction/comments/t352kz/im_gonna_cry/,i’m gonna cry,i fucking relapsed again,8,{},"{'label': 'NEGATIVE', 'score': 0.9947474598884583}"
2022-02-27 21:20:29,https://www.reddit.com/r/addiction/comments/t34d27/health_issues_from_adderall_abuse/,Health Issues From Adderall Abuse?,"Is there anyone here whose addiction included Adderall? If so, did you experience any health issues stemming from it and how long did it take for the issues to resolve after quitting?",3,{},"{'label': 'NEGATIVE', 'score': 0.9988850951194763}"
2022-02-27 19:59:58,https://www.reddit.com/r/addiction/comments/t32qfj/how_to_help_them_when_they_dont_want_help/,How to help them when they don't want help?,"Hello everyone, I guess I should clarify that I am a little naive with these things, but I am very worried about one of my cousins on my mother's side. He is 40 and hasn't improved much. 
He was an addict for years when I was between the ages of 2 to 8. That was in the early 2000's. My parents never exposed me to the perils the family went through, but my mother explained to me what was going on with simple words, so that a 7 year old would understand. He was committed a couple times but he never had the intention of staying sober. His younger brother suffered seeing that, and my aunt and uncle even more. 
It took me years to understand what went down with him, and there are so many things I still don't know. But here's the sitch: I think he's using again. Or maybe he never really stopped. My aunt is afraid of that too, and one time she broke down crying in front of my mother because he was hanging out with sketchy people and would get them in the house. 
I may be naive but I've seen people recovering from addiction when I got committed in a mental facility for my depression, and it was terrifying and heart wrenching.
He has specific patterns of behaviour: fits of violence, anger against his mother or father or anyone who tries to be in control, erratic behaviour, not wanting to go to the doctor (he didn't get vaccinated), refusing to do therapy, inability to keep a bond or romantic relationship, being unemployed his whole life, lack of interest in getting a job or studying something. 
I don't want this to end badly, are there any other specific signs of relapse? What can I do to intervene? How do you help someone who doesn't want to get help?
I apologize if I sound ignorant with my basic language. I wish all of you well 💜",1,{},"{'label': 'POSITIVE', 'score': 0.6447456479072571}"
2022-02-27 18:33:04,https://www.reddit.com/r/addiction/comments/t30zaj/sumn_i_came_up_with/,Sumn I came up with,"
Bqefore I pop a pill, I write my will 
So all my cash would get distributed like hash, around the streets of moskow 
Not fair, it’s tru but still you got u some so stick around enjoy it 
Now all my life I’ve been a fraud, a lier, an unworthy loved one
So when I die, I’ll die alone, ain’t no one here to smoke one 
It’s true I loved, the least I tried but love is truly not enough tho 
A woman can be just a hoe, a brother turnt into a foe 
The only truth, it’s all I know, it’s real and that’s only the issue
The lies, the pain, a broken nose, ain’t no one gave a tissue 
So when I die, I’ll die alone, ain’t no one here to calm me",3,{},"{'label': 'NEGATIVE', 'score': 0.9853875041007996}"
2022-02-27 18:31:38,https://www.reddit.com/r/addiction/comments/t30y9e/being_woken_up_on_my_car_from_being_drunk/,Being woken up on my car from being drunk,"Being drunk in my car makes me feel so ashamed. I hate being woken up when I have obligations to be somewhere and some stranger asks me if I’m ok. 
Just drove him crying.",2,{},"{'label': 'NEGATIVE', 'score': 0.9978653788566589}"
2022-02-27 18:29:10,https://www.reddit.com/r/addiction/comments/t30we4/went_from_2_packs_a_day_to_nothing_no_nic_for_a/,Went from 2 packs a day to nothing. No nic for a week!,"I smoked roughly two packs a day for half a year, and before that half to one for a few more years. I got nicotine poisoning and threw up for a week straight. Decided to quit after that, and it’s been a week without smoking. But honestly im craving a pack of Marlboro southern cuts. However, I refuse to start again. This is somehow my hardest addiction to kick.",7,{},"{'label': 'NEGATIVE', 'score': 0.9967238306999207}"
2022-02-27 17:40:12,https://www.reddit.com/r/addiction/comments/t2zur2/i_need_to_change/,I need to change...,"I have an unhealthy relationship with food right now. I can't stop binging & I feel awful for it. My body is not happy with me. I have a rash all over my stomach, acne on my face, I'm putting on weight which makes me incredibly miserable. I have an addictive personality. Before having my kid, I loved to party & drink. I don't do either now & it seems my new addiction is food. I am so unhappy in my skin. I'm treating my body with such disrespect...
For some odd reason this evening I felt compelled to write my thoughts down about it & maybe the powers of Reddit can help me change. 
I want to give up binging & stop eating chocolate until I feel sick. In fact, I don't want to eat it at all anymore, I don't even find much pleasure in it, so why do I do it?!",1,{},"{'label': 'NEGATIVE', 'score': 0.9991944432258606}"
2022-02-27 17:33:43,https://www.reddit.com/r/addiction/comments/t2zpyr/i_gave_in_now_i_feel_shitty/,"I gave in, now I feel shitty","I’ve been a heavy smoker for about 7 years. Was regularly 1 pack a day, I’ve gotten it down to about a pack every other day. 

I’m also an ex drug user, fentanyl and heroin had a hold on me and I’ve been sober for a couple years. 

I ran out of cigs the other day and just decided im done, cold turkey, we good. I was at my brothers house and was feeling great and distracted enough, he was a great accountability partner. 

I made it 3 days without smoking, some throat mucus nastiness and a bad cough, no sleep, bein a total bitch. I went back home today and bought a pack after being home like 30 minutes. 

I’m pissed off. If I can literally quit HEROIN why can’t I quit cigs? I’m so mad at myself. Just ranting. I’ve tried patches and gum, that never worked well for me. Same with e cigs and things alike. I just need to cold turkey it, but I feel like a sense of pressure when I’m a day or so in. So frustrating.",4,{},"{'label': 'NEGATIVE', 'score': 0.9989398121833801}"
2022-02-27 17:26:38,https://www.reddit.com/r/addiction/comments/t2zkqu/how_to_defeat_social_media_addiction/,How to defeat social media addiction?,"Recently I have quit my “video game addiction”, I wouldn’t call it an addiction. Mostly because I was able to beat it almost immediately because school was taking too much of my time away to game (during the weekdays) and also because newer games kinda suck and in totality (am I using that word right?) gaming sucks. All I did was give my PS4 to my brother; it’s in his room now. And I haven’t touched it since. That is not to say I don’t partake in gaming at all anymore but the gaming I do partake in is on my Nintendo switch. Which I don’t really touch at all unless I want to get some Tetris 99 games in. 

With that addiction beaten I have began to realize the far worse and far harder to beat and most detrimental addiction that has most harmed my life. That is social media (Twitter, YouTube, and Reddit, although Reddit not so much as before). I find myself constantly refreshing my feed to see the newest tweets, the newest Xqc react videos, and constantly flipping between those. Even when there is nothing to see. I’ll just do that. Very mind numbing. Very bad. But how do I beat it? I have books that could take up the time I waste on Twitter and YouTube, but I don’t. Honestly I feel as if playing video games would be time better spent. 

And I can’t really just do the same thing I did to the PS4 because I am very addicted. I remember when not too long ago I had no internet for like a week. I was losing my mind. I had a book I was reading as well during that time, but I had not even cracked it open once. This addiction is so bad. I could be doing my homework during this time. I lose a good 2 hours of my after school day seeing the latest tweets and newest Xqc reacts.",1,{},"{'label': 'NEGATIVE', 'score': 0.9991629123687744}"
2022-02-27 17:22:10,https://www.reddit.com/r/addiction/comments/t2zhhq/ive_been_addicted_to_gaming_are_there_any/,I've been addicted to gaming. Are there any programs that block games?," **Hey**

Around the age of 16-17, I suffered from depression. I was treated badly, my parents were always fighting, had no friends, and I was bullied for being short. During the time, I developed an addiction as gaming was the only thing that made me feel okay. 

Now, I'm going through hard times again and playing games more. **Are there any programs that block a game from running after 1 hour or maybe after a match? How did you all fight your gaming addiction?**",1,{},"{'label': 'NEGATIVE', 'score': 0.9989128112792969}"
2022-02-27 17:15:30,https://www.reddit.com/r/addiction/comments/t2zc9u/am_i_being_paranoid_or_has_my_husband_relapsed/,"Am I being paranoid, or has my husband relapsed?","UPDATE THREE:

I called his mom to see if she could shed some light on the situation. She said that he sometimes asked her for cash (even though they are struggling financially). After a decently long conversation, she mentioned that they have given him some pills from time to time because his back was hurting. She mentioned it as an afterthought. Like the thought hadn't occurred to her that it was wrong or that he shouldn't have them. I explained to her that he can't casually take pills when he's in pain because he can't control his addiction. She said she understood and that she wouldn't give him anymore. I hope that's true. 

I finally spoke to my husband again after he blew my phone up all morning, then turned his off out of spite when I wouldn't answer.

I told him I spoke to his Mom and he said he knew. That instead of going to work he drove down there to vent. With a shaky voice, he told me he was sorry and that he would just leave. I told him I don't want him to leave, I want him to stop. He said he wanted that to. That he never had to be accountable. He said that he was ashamed and embarrassed. I reminded him that I agreed to help him in any way I could.

 I told him that we needed to talk so he should come home. He told me he really needed to go to work. I told him then I'll drive down to his parents then, to talk. He said he was about to leave and we could talk tonight. 

I'm not sure what to do next. I don't want him to leave, but I'm so tired of the deceit and being neglected. I already have one failed marriage, and I'm only 34. I was about to say that we have built a great life together otherwise...but in all honesty. ""I"" have built a great life for us. I..got us out of debt working three jobs. I...built a business from scratch that is our main source of income. I...planned, saved, and orchestrated for two years so that we could buy our dream home, that we now live in. I...plan our live, finances, make our house a home, clean, cook, organized, worry, stress, etc.. I know I can do it alone. I'm not stuck. I just don't want to. I don't want to put our kids through another broken home (we don't have kids together but we each have kids from previous marriages). I don't want to fail again. I don't want to hurt each of our families again. I don't want to be alone. He is kind and sensitive, a great Dad, and emotionally supportive and believe it or not..light-years better than my narcissistic ex. I just miss our old life. When I was a priority, when he was vibrant, and engaged. I'm sorry..I know I'm just rambling now. But this is how I'll be all day, until I can talk to him. 


UPDATE TWO: It didn't go well this morning. I asked him to give me the cash in his wallet and I would transfer it back to his account to use on his debit card. He absolutely refused. He couldn't give me a reason for why he needed it. Just that he needed it to prove to me that he wouldn't spend it. Which makes no fucking sense. I told him calmly that there was no reason for him to need cash unless he wanted to continue to be sneaky. He was being really unreasonable and refused..got super defensive. So I blew up...I know that was the wrong move. I told him if he wanted to keep living here he was to use no cash and he needed to take a drug test. NOW he is saying he isn't taking a drug test. That he only agreed to do that because he was high. I don't freaking know man... he clearly has no intentions of changing but this seriously fucks up our whole lives.





UPDATE ONE: 

I'm new to reddit and I'm not sure how best to update. I had a conversation with him tonight. I calmly approached him and stated that I'm not mad, and I will help him however I need to, but I need him to be honest. He told me that he hasn't been using pills but has been using a weed vape for a long time. He said he hates it, and it makes him feel terrible, and he wants to quit. That he does it all day long, and it doesn't even do anything for him. He gave me what he had, and I threw it away. I told him I wanted him to take a drug test, to assure me that that's all he's been doing, and he said he would. What do you all think? I'm not knowledgeable enough about symptoms and side effects of the weed vapes. I wasn't even aware they were legal here. Would they cause these effects? Or did I just fall for the lesser of two evils? He seemed very sincere that this was it.


ORIGINAL POST:
I'm afraid my husband of 9 years is using again. He had a pill addiction before we were together. For the most part he has remained clean, however he did relapse a few years ago for a short period, and he did have an addiction to Kratom for a while. 

I'm sorry for giving so little backstory..there is so much more to it, but I'm afraid it would be too much to explain.

I'll be honest...I'm very trusting and gullible by nature.  So I'm sort of easily manipulated. Not to mention I hate confrontation. But I can't tell if my trust is just too broken or if these are actual red flags. 

Here's a few reasons why I'm concerned. 

He's been sneaky about cash. He has been on a cash ""allowance"" for years because we were on a strict budget, getting out of debt (partially acquired from his kratom addiction), and he isn't great with money. I recently opened a separate account just for him because he kept accidentally swiping our card for his work expenses. 

He still goes by the atm and takes cash out of his account instead of just swiping his debit card. He takes ALL of it out. He also used our family account at the grocery store the other day, and when the charge hit the account, it was way more than I expected. So, I decided to check the receipt. 
I found it torn in tiny pieces in the trash...and saw that he got cash back. I asked him why, and he said with prices going up, it's hard for him to make the budget work, and he just wanted a little extra. 
So...I told him I would give him more money and to stop being sneaky. But then Valentines Day rolled around...

He also always gets cash out of our family account around holidays, anniversaries, etc. under the guise of using it to buy me gifts. However, the gifts never equal the amount, OR they wind up being something he ordered online and didn't use cash for at all. This was the same deal at Valentines Day. 

He also goes to meet his enabling mom multiple times a month, saying he's,""helping her, picking something up for her, giving her money because they are struggling financially,"" etc. His parents, though lovely people, will give him anything he wants...including drugs. Because they are the ones that gave him pills the last time he relapsed.

The last thing that has me the most concerned is he NEVER feels good. We have a non exsistant sex life, he never wants to go anywhere or do anything. He always either ""has a migraine"" or ""his stomach is messed up"" or ""his back hurts"" or more recently, ""his allergies are killing him"". It's literally, and I'm not exaggerating..every single effing day. My parents just came to visit and we both love when they come, we always have a blast with them. He barely engaged with them, saying his allergies were bothering him. He stayed in the room all weekend and didn't engage at all. My parents noticed he was acting differently and wondered what was going on. 

It's not just his allergies, because if it wasn't allergies, it would've been something else. Our last date night ended early because he had a stomach ache. We drove an hour to one of our favorite restaurants, then I wanted to look around at some stores and just hang out. As soon as we finished eating, he didn't feel good. I wound up going into target by myself for 10 minutes, getting back in the car, and we drove home. Not to mention, he flaked on another bigger day trip I planned because he was too tired to go. I got ready and walked up to him to ask if he was going to get ready too. He said he didn't feel like it, and we would go tomorrow. This was literally the perfect day to go. We had no kids, no work, and no time limit. The next day would've been rushed and unpracticle. So I said forget it and I went to a closer destination by myself. I was heartbroken because I had been looking forward to it all week. 

Does this sound like he has relapsed again? What do I do? I'm afraid he's just going to lie if I don't have proof. Please help.",15,{},"{'label': 'NEGATIVE', 'score': 0.9810736179351807}"
2022-02-27 17:07:27,https://www.reddit.com/r/addiction/comments/t2z66d/i_will_always_choose_drugs_over_everything/,I will always choose drugs over everything,"No matter how “soft” the drug is, I will choose it over spending time with family and friends, over getting good grades, over my relationship, over socializing and over my hobbies. At this point, I cannot make good decisions while indulging, no matter how much I cut back.",8,{},"{'label': 'NEGATIVE', 'score': 0.9946551322937012}"
2022-02-27 15:26:42,https://www.reddit.com/r/addiction/comments/t2x03g/today_is_the_first_day_im_sober/,Today is the first day I’m sober.,"Well technically. Currently going through a really shitty cocaine come down so I feel like garbage. But I don’t wanna live like this anymore. I think the first step is to drink water and then safely dispose of all my alcohol and pills. Any other advice?

Edit-yeah got rid of everything and will just be using nicotine. Made it though. Epic win. Day one sober it feels good. Thanks for all the advice.",60,{},"{'label': 'POSITIVE', 'score': 0.9843189120292664}"
2022-02-27 13:59:11,https://www.reddit.com/r/addiction/comments/t2v41p/short_poem_i_wrote_while_half_in_the_bag_as_usual/,Short poem I wrote while half in the bag (as usual) When will this end?,"One sip, another, then another  

A beer, a toke, a shot,  

Which one would I rather? 

I'll take all three 

An addict, is this what I was destined to be? 

It's as if I sold my soul for free 

A shot, chase it with beer, then a toke  

One toke, two tokes, three tokes, four 

One shot, another beer, this feeling is all I care for 

Only takes three big gulps to finish a beer 

Before I know it, I'm six deep, only question is, when will the demons reappear?  

It's all fun and games till that one sip does it,  

The monsters unleashed and I become the world's worst hypocrite 

The boiled up anger I have at myself comes out on the one's I love, 

It's the last thing I want but this darkness I just can't seem to rid of ",6,{},"{'label': 'NEGATIVE', 'score': 0.9955032467842102}"
2022-02-27 12:50:56,https://www.reddit.com/r/addiction/comments/t2tm5v/i_lost_my_best_friend_to_cocaine_and_alcohol_hes/,"I lost my best friend to cocaine and alcohol. He's still alive, but he isn't the person I thought he was.","I fell in love with my friend. I knew he had issues with drinking and drugs, particularly cocaine. There's also the nicotine and gambling but those are child's play in comparison to the devil's drug that is cocaine. I partake in weed and alcohol only. And would not consider myself an addict. I didn't know how deep his addictions were. But I loved him anyways. It was a foolish endeavour but my heart couldn't say no to him. He pursued me, slowly, as friends. A great friendship formed between us. He's such a smart, great, funny, charismatic, good looking guy. Even after the terrible things he's done I can't stop seeing him as such. After a while our friendship escalated to hooking up and hanging out, maybe once a week, sometimes less. But we talked more deeply than people who were just hooking up. He confided his problems in me. he opened up to me about his struggles, goals, values; as did I. He slowly got things to be more serious.

Before I knew it, he was my boyfriend. There was concerns on both sides. Problems. Always due to cocaine or drinking. The blackouts. Being scared for my life at times. Not knowing when he'd bail on me or not answer. Stories he'd tell me about terrible things he did while he was fucked up or seeing said things before my own eyes. But he promised he would stop and stay clean. He promised he'd get help after a particularly bad black out that ended up in me getting hurt. I trusted him, maybe too much. Love him, maybe too much.

Things are great for a while. I envision a beautifull future together because I thought he was staying clean. We even talk about having kids. Go on trips together. Have some great adventures. Then comes this weekend. Just under a year into us being officially together. This is a week after we have an amazing and special date together that was just perfect. he's on another bender (not the first, unfortunately probably won't be the last). Ignores my calls for days. Doesn't text me back.

I'm concerned. I think, foolishly, that this is his first relapse since the last bout of staying clean - he actually did have a period while we were together of several months off the drugs. though with drinking he never stayed away for more than a month. But overall he was starting to look a lot healthier and happier, or so I thought? We finally speak on the phone and he sounds high as hell. This doesn't surprise me, but breaks my heart. We eventually breakup. Unlike other stories I read online, there was no name calling. No blame on my side. No yelling. No gas lighting. He says I deserved the best, he's heart broken he couldn't truly be who I needed. That he couldn't keep up with the monster inside him. I urge him to get help, even though he won't have my support anymore. Tell him that he never will because I'm in so much pain. Pain that's existed since the beginning of our hook up days, all the way to our relationship getting more serious.

But I feel really confused. We had several nights a week together. He works long hours and I know this for a fact so I don't even know how he hast the time to manage both that, life in general, and getting high. He's the definition of a high functioning addict. I have no idea how somebody sleeping in your bed has the ability to hide drug use in plain sight. I had a feeling he would relapse but I literally had no idea when it happened - I made him admit when, he says it was months ago but I only knew about it recently. Maybe it was because we had ""cover drugs"", we often drank together or he'd show up already have drank, and we both smoke weed. He also lied before about not doing coke and silly me, he fooled me again.

Today is the day I walked away from this relationship. I'm choosing myself. My depression and anxiety (not caused by him) cannot handle anything more. He says over and over that I'm amazing but knows I deserve better. He's still my best friend in my heart but he's not the person I painted him out to be. The demons inside him took over. Addiction is heart breaking. I will always care about him and hope the best for him. I still think of him as a good person.

Please if you are struggling, get any kind of help. Therapy, NA, AA, rehab, anything is a step in the right direction. If you fall in love with an addict, you can't make them get help or stay clean. Only they can make that choice. I'm sure you know that, but I thought my love could help him. it only made him lie and hide things because he didn't want to lose me. I'm devastated. My best friend is gone. But maybe he was never really here.",27,{},"{'label': 'POSITIVE', 'score': 0.9944544434547424}"
