,Date,URL,Title,Body,Score,COVID-19 Mentions
0,2021-11-29 23:48:43,https://www.reddit.com/r/addiction/comments/r5f3lc/im_tired/,I’m tired,"Of being tired. Of being alone. Of not being where I think I’m supposed to be. Of not accomplishing my goals. Of being a loser. Of being a pussy. Of being a prisoner to my urges. of being a man child. Of being immature. Of being scared. Of being lazy. 

I’m tired of being tired. I’m just tired of letting myself down, of letting others down. The ones that care about me, that believe in me. I’m tired of just being boring, uninteresting, and a shell of my true self.",7,0
1,2021-11-29 23:18:36,https://www.reddit.com/r/addiction/comments/r5ejid/i_just_spent_300_on_a_video_game_i_get_750_per/,i just spent 300$ on a video game. i get 750$ per month and the month has just started,,8,0
2,2021-11-29 21:51:31,/r/REDDITORSINRECOVERY/comments/r5944o/10_years_sober_today_my_story/,10 Years Sober Today - My Story,,19,0
3,2021-11-29 21:45:19,https://www.reddit.com/r/addiction/comments/r5cp8h/where_to_begin/,Where to begin?,"After a separation, a bad one. Myself in my addiction did things, that I have ask forgiveness for. I’m sober. Been sober for months now, but when I try to tell the people I’ve hurt that I’m sorry. I’m told it’s not sincere. How are you suppose to forgive yourself so you can move on without the guilt from it all? I wasn’t myself, I know that now and honestly somethings I can’t recall, it’s been a tough recovery. I’ve maintained sobriety and will always maintain it. I won’t ever go back to that lifestyle, but I feel that I have paid my dues. My addiction and my actions left me alone, my so, my kids, all gone. I’m working on getting my daughter back in my life. I’m just want relief from the guilt, will it ever go away. I wasn’t a bad person, and I’m still not I just took things to far in the haze.",1,0
4,2021-11-29 21:31:22,https://www.reddit.com/r/addiction/comments/r5cf6s/withdrawal_symptoms/,Withdrawal symptoms,My husband finally admitted he had a problem! What are some of the cocaine withdrawal symptoms? It’s been a week for him! Thank you!!,1,0
5,2021-11-29 20:09:05,https://www.reddit.com/r/addiction/comments/r5ashh/please_stop_me_someone/,Please stop me someone!!,"I don't know if it counts as an addition but  long story short. I have fucked up my liver since before (pills+alkohol) and now I can't drink with my stomach reacting like it's laxative. I haven't been drinking for a few months but now it's winter, I'm stressed and i just couldn't resist it any longer. Last night was my first drink , tonight I'm already two drinks in.(one drink is enough for my stomach to react) but i don't care  i wanted that dink so badly. 
I don't know if this goes if addiction or self destruction or both.  I've been an sex addict. 
My boyfriend doesn't know. He will be so disappointed in me if he new. I will tell him in a few days.",3,0
6,2021-11-29 19:51:32,https://www.reddit.com/r/addiction/comments/r5afry/my_friend_is_addicted_to_marijuana_cant_go_a_day/,"My friend is addicted to marijuana, can’t go a day without it, how do I help him?","He says he doesn’t want to quit but he gets depressed when he runs out and spends a lot of money on it and smokes 15 times a day. I think when someone is addicted to pot, they don’t want to quit but when they finally recover, they are glad they did.

Not to mention the serious psychological and physical side effects it has.",0,0
7,2021-11-29 17:44:05,https://www.reddit.com/r/addiction/comments/r57s7h/im_not_clean_anymore/,Im not clean anymore /:,Today I took pills again....tomorrow was my second month of being clean but I failed....I did it cuz its hurts so much.....,9,0
8,2021-11-29 17:43:15,https://www.reddit.com/r/addiction/comments/r57rk4/cant_stop_drinking/,Cant stop drinking,So I’m 17 and a male I don’t know if that really matters but I love drinking at first it was more of a weekend thing to have fun ya know but it’s slowly turning into drinking before class and during the week. I even drink and drive I’m slowly becoming a worse and worse person and feel like at this point there’s no fixing it.,2,0
9,2021-11-29 17:30:16,https://www.reddit.com/r/addiction/comments/r57i12/i_fucking_hate_alcohol_rant/,I fucking hate alcohol (rant),"Here we are me sitting in the train on the way to go home. I had a couple drinks with friends in the city. I am a bit tipsy. I am having a craving to get some coke. I know i have a addictive personality. But i hate the fact that i am  just so god damm weak. I just want to get high now. Why cant i just enjoy a couple drinks without getting the cravings. If i want to stop doing drugs i have to quit everything, but i feel like i cant do that.",3,0
10,2021-11-29 16:54:16,https://www.reddit.com/r/addiction/comments/r56q6u/how_do_i_forgive_myself_for_my_addiction/,How do I forgive myself for my addiction?,"I have done some truly stupid things because of my addiction to weed. I've done things that make no sense, and which i deeply regret. Things which have ruined my life path and which I'm now dealing with. 

I cant forgive myself for these mistakes, as they were done by me. But just the thought of them makes me suicidal. I cant stand living in this world with all of these fuck ups I've made. I cant stop looking at the pictures of her, and thinking of the life we could have had if I didn't fuck up. How have you moved on from your addiction and forgiven yourself, because I cant right now.",3,0
11,2021-11-29 16:36:39,https://www.reddit.com/r/addiction/comments/r56cgi/how_to_help_with_my_youtube_time_use/,How to help with my Youtube time use?,"I figured this would be a good sub to ask in, as both are non-physiological and can be huge time sinks. I want to quit wasting all my time with all the pointless bullshit fed to me by algorithms on Youtube, while still being able to use Youtube as the educational tool that it can be. What's the best evidence based advice? I am a pretty much a novice at quitting so I'm not exactly sure where to begin. Genuinely, I feel like I am losing hours a day. Thank you!",3,0
12,2021-11-29 15:23:12,https://www.reddit.com/r/addiction/comments/r54ppg/worried_mom_might_have_a_drug_abuse_problem/,Worried mom might have a drug abuse problem,"It’s kind of ironic I went in her clothing drawers looking for a bottle of my grandmothers hydros she had hidden in there, but then I found a bunch of empty bottles of my sisters adhd medication (amphetamine/dextroamphetamine) do you think it’s possible she’s been taking them? I think it would be possible for her to be taking them to try to lose weight, what do y’all think?",2,0
13,2021-11-29 14:58:45,https://www.reddit.com/r/addiction/comments/r545ri/addicted_to_sugar_cant_stop_eating_help/,"Addicted to sugar, can't stop eating. Help.","I always had a thing for sweets but rn I've been eating non stop, vomiting, eating sugar again. I don't even have money left but the last thing i buy are some kinders amd snickers. I'm ashamed of myself but can't stop. People don't take my addiction seriously cause i guess i don't either. But i just wanna stop eating shit. Please help.",30,0
14,2021-11-29 10:02:57,https://www.reddit.com/r/addiction/comments/r4xpx7/plz_i_need_help_pornography_addiction/,Plz i need help (pornography addiction,"Plz i need help .. porn addiction ruining my life, wasting my time and makes my mind corrupted .. i watch porn for many hours each day and masturbating 3 to 5 times every day i can't live like this but also i can't cure it ... So tell me some tips to follow cause really really i need help.",15,0
15,2021-11-29 09:24:12,https://www.reddit.com/r/addiction/comments/r4wxa1/advice/,Advice,"Hi so I'm currently in the process of quitting nicotine and i know small thing that a lot of people will say no big deal to, but here is the problem i was dipping and personally I'm happy I'm giving it up because it was just a disgusting hobby in general, but my problem currently is that every time i'm finished eating i would put one in but now i can't do that so i'm asking more along the lines of what i should do when I'm finished eating and that craving kicks in?",1,0
16,2021-11-29 06:13:38,https://www.reddit.com/r/addiction/comments/r4tmlu/sleep_meds_addicted/,Sleep meds addicted,"So, I have been addicted to sleeping pills for one year now and I can’t fall asleep unless I’m heavily knocked out. Sometimes I even need to take some to fall asleep again after I waked up (I wake up after 3 hours of sleep for some reasons).
I’m feeling shit every day. They inhibits a lot of your emotions and reduce physical performance a lot. 
I need help or somebody who had the same experience to share it.",1,0
17,2021-11-29 04:18:35,https://www.reddit.com/r/addiction/comments/r4rzvn/im_so_ashamed_of_myself/,I’m so ashamed of myself,"I was supposed to make 3.5 gs of fent last for at least a week or so but I blew through two in one day and now my bro’s so mad at me and hates me again. Says I betrayed him by not pacing myself, usually I give it to him to hold and he doses it out for me but he trusted me this time and I blew it. I don’t know how to live like this I’m so sad all the time I only use it for severe chronic migraines. I just need someone to tell me I’m not evil.",2,0
18,2021-11-29 02:26:36,https://www.reddit.com/r/addiction/comments/r4qcyu/dating_an_addict/,Dating an Addict,"So new to reddit so if it's anything as strict as kiwifarms, please let me know the rules.

I just found out that a guy that I'm involved with is an addict. Apparently 'addict' means more than alcohol and I was completely unaware of that distinction and it shifts into the harder stuff and I'm not immediately pushed away but I know that there are some tools I need to at least know. I don't want the ""leave it alone"" post, I need some genuine advice on the situation because at the very least I want to be their friend and have no idea where to start.

&#x200B;

Thank you reddit company. I accept everything.",2,0
19,2021-11-29 00:46:02,https://www.reddit.com/r/addiction/comments/r4oror/cocaine_relapse/,cocaine relapse,"hey

i’m f, 21 and i recently was 100-ish days clean from cocaine up until this past halloween weekend. it started my sophomore(?) (17-18ish) year of college and it became an addiction very quickly. i lost a lot of weight and got compliments (i’m not very skinny to begin with), im supposed to be a senior in college now but i’m getting there. i relapsed on halloween week because i found out someone i knew sold for a cheaper price than i used to buy for and i “just wanted it for halloween” but it’s been a month now and i’ve kept buying. i don’t have the money for this habit and yet i can’t break it. im going through a rough breakup too so i’ve been doing this and drinking a lot more. falling so behind in school getting continually depressed, was diagnosed with bipolar this past summer and started mood stabilizers that don’t seem to be working much. was hooked on xanax for a while too but once i couldn’t get that anymore i started the cocaine again. with the break up i’m trying hard to focus on myself and pick up hobbies but since i started doing coke again it’s all i can think about, especially right now because i’m too broke to buy it. i guess im just asking what i can do to distract myself? i don’t know, this is all very new to me and i feel lost. i knew it was bad when i would do lines in the bathroom last year during thanksgiving, get drunk without my sister knowing and her being so happy im spending time with her when in reality i was just fucked up. i feel awful about it all but it’s so hard. it’s hard to focus on a hobby but i’m not medicated for that . the psychiatry and all is new and with my admission to being an addict and telling them i’m 99% sure i have some attention deficiency, it’s hard to get them to trust me with that kind of medication since i did abuse adderall a bit at one point . i feel like a burden to the people around me and myself",3,0
20,2021-11-28 22:02:41,https://www.reddit.com/r/addiction/comments/r4lr5i/please_if_anyone_knows_where_i_can_start_help_me/,"Please, if anyone knows where I can start, help me. I don’t know what to do","I’m an alcoholic. I’ve called about 1 or 2 treatment centers a month since June, so like 9 now. They all say they’ll get back to me, and they never, ever do. They say they’ll go over a list of treatment centers that my insurance will cover, and that they’ll email me, or call me back. They never have, not once.

I can’t help but feel like I’m a hopeless case, and that’s why they aren’t calling back. Every time I gather the courage to take that one step forward of reaching out, and I don’t hear back from anyone.. it’s like I’m taking 3 steps back.

They all say, based on my intake, I’ll need inpatient detox, which doesn’t surprise me. I’m beyond ready to do it. But NO ONE will fucking help me, or all their beds are full, or they aren’t accepting new clients, etc. I need to get this done. I’m worried I won’t last another year. 

I don’t want to put my personal fucking information out on the internet but I’m in America, BCBS SC, Blue Essentials. Apparently I have like a $700 deductible for this kind of thing. But no one will tell me what to do and I’ll probably delete this post in a couple of hours but I had to take a shot. If anyone knows where I should start (or continue, really), please help.",1,0
21,2021-11-28 21:52:28,https://www.reddit.com/r/addiction/comments/r4lk11/getting_over_a_girl/,Getting over a girl,"I made it 13 days sober and I had a few drinks today (stupid I know but I intend to restart tomorrow) but I posted on my social media that tomorrow was gonna be day 1 again and a girl I had been fucking on and off while I was an addict told me that sobriety was stupid. I tried to explain why I was doing it but she doesn't seem like she understands, and after she said that I thought back and she's only visited me 1 time since I've been sober. So, clearly she's not supportive or understanding and she doesn't want to see me anymore so how do you deal with losing someone while also dealing with newly being sober? Seems like too much on my plate at once (I'm also severe bipolar) I know the whole ""take it one day at a time"" thing but I'm looking for actual advice here. It's all too much sometimes",1,0
22,2021-11-28 20:38:48,https://www.reddit.com/r/addiction/comments/r4k472/weed_addiction/,Weed addiction,"I don’t know how to stop smoking weed I’ve tried so many times and I can’t. I started smoking everyday when I was 16 and I’m 19 now. It’s ruined my life I graduated highschool don’t even know how, I work at a warehouse now and all my money goes to bills and weed. I hate my job, don’t have hardly any friends. I come home from work everyday and smoke until I go to bed to do it all over the again the next day. Trying to save money to move out of my moms house is impossible when it all goes to weed. Idk what to do.",10,0
23,2021-11-28 19:16:16,https://www.reddit.com/r/addiction/comments/r4iglm/3_days_sober/,3 days sober....,"I've posted here before about my addiction to fentynal and meth. I wouldn't even say I'm addicted to meth it just goes hand in hand. But I'm 3 days in, it wasn't intentional and this time I'm hopeful. Wish me luck yall, thanks for reading.",10,0
24,2021-11-28 18:24:06,https://www.reddit.com/r/addiction/comments/r4hdry/my_boyfriend_oded/,my boyfriend OD’ed,"He had 3 years clean. 3 years. Relapsed and I never saw the version of Him I loved and fell in love with again. I begged, did everything I could humanly possibly do. He just wasn’t there anymore. The things he said and did to hurt me, just so he could get high. I have no words. I loved this man more than anything… but in the end I couldn’t stay. I refused to enable him using so I would leave. I left because seeing him do this to himself, destroyed me. I saw him for the last time yesterday. And for the last 3 days I was beyond angry with him. Seeing his lifeless body, I became angry at myself, the “friend” who connected him back to this life, the universe, the dealers. I told him I don’t blame him for trying to heal his own pain. But im here so fucking angry that he is gone. Hurt that he saw no value in his life. Shattered that no amount of tears, compromising, begging or fighting could change his mind. Addiction took him from the world, and he thought he could beat it. No matter how many times you have gotten clean, relapsed, clean and relapsed: YOU ARE NOT SMARTER OR STRONGER THAN YOUR ADDICTION. There is no beating active addiction without seeking help. He said he couldn’t afford a week out of work for detox, but now? My baby doesn’t have to worry about anything or feel anymore pain. And I want to forgive him for this. Please help yourself, help your friends and family. Even help a stranger because one person alone is not stronger than this.",80,0
25,2021-11-28 16:58:16,https://www.reddit.com/r/addiction/comments/r4fjfs/odd_time_in_my_life/,Odd Time in my life,"I've been using drugs for the last 25 years of my life. I never found it life-crippling. I got by and I succeeded in life coming from very little. So it never upset me to be addicted. The last few years have become particularly bad. I deal with chronic pain and have allowed my self to become a heavy user of cocaine. Add in the alcohol and you got a whopper of a time. I currently do not work due to pain and finding my path has been difficult. I have almost lost my wife multiple times to my insane benders and attitude. I'm a proud to say I'm been clean for 6 days and I plan on changing my tune about life immediately. I was using multiple grams of cocaine a day and it had to stop. It is different not being high all the time but my life has improved so much in 6 days. I'm grateful and trying to communicate openly with my spouse. I just here to give myself a boost and hope to transform from someone who lingers on r/addiction to someone that participates!

Reading the posts on here always kept me going day to day.",6,0
26,2021-11-28 16:46:52,https://www.reddit.com/r/addiction/comments/r4faff/my_pornography_addiction_and_how_i_have_fought_it/,My pornography addiction and how I have fought it.,"
Now it’s quite obvious these days that so many teens are watching porn, and I’m one of them. It all started one day when I was on my phone and put sex into the browser (I know pretty stupid). What I found is something that I thought was absolutely gross at that time in my life (which was like when I was 11 or 12). But a day came around where I felt aroused/horny and suddenly this gross thing was something I was more than curious in. So I did the dirty that day and the feelings I had watching pornography were so strong and crazy. Like what the fuck, how does thing feeling exist without drugs. A week later this intense curiosity came back and then 3 days later and then the next day. 

This started a 2 year period of time where everyday I would watch porn in the bathroom before showering. As every addiction, this strong feeling died down through the weeks. 6 months from today, I realized really what was going on: I’m addicted and I don’t even know it. This whole time I thought I could stop at any time but why would I think that if I do it everyday? Why would I think that if the feeling to watch porn is more strong than the feelings I have watching porn? Why would I think that if all I think about when I see a girl is how sexy she is and how I could use her for my own desires? So in this moment of realization, I looked at ways to slowly break out of this, because I knew I couldn’t just stop instantly of course. 

The first tip I read about is opening up to parents but obviously this is much harder for me because to tell my parents that I’ve been addicted to porn for years and then they didn’t know would say that they are terrible parents. So my second option was to tell friends, which is much more easy to do. One night I told my best friend about something no one else knows. After me explaining my problem he told me a similar thing that has been happening to him too. That night I felt so accomplished and happy that I began my fight with my addiction.

Soon enough I told my girlfriend that I started dating a couple months ago about my problem as I thought that would be good for our relationship considering me and her wanted to be as honest as possible during our relationship. As I explained this to her, I emphasized and promised that porn would never come before her. She thanked me for such a such promise yet she seemed a little skeptical, although I have kept my promise. Something that I found absolutely amazing dating her is that she was someone that replaced porn when I felt something needed to fulfill my loneliness. She truly has helped me with my addiction without even knowing it. 

Today, I only give into the pleasure of pornography once a week by simply pleasuring myself without pornography, only the thoughts in my mind (Even then I do that once a week along with watching porn). I keep this down to once a week by what I currently do to stay out of my lustful thoughts. What I do is have a rubber band around my wrist all the time. When I get horny or have that desire to watch porn I slap the band on my wrist. This seems silly and stupid but for some reason it has a phycological effect on denying these thoughts and has worked for months.  

If you have gotten this far, THANK YOU. This is my first time confessing such a serious thing on the internet but I felt this community would understand, relate, and support my story. If you are someone who had my similar problem or is still going through the fight, say something in the comments as this community and I will help you and support you. One last thing is that I could have done more to get out of my addiction. It could of taken me only a month to get out of my addiction if I told my parents. But you can, I know it's hard but it's the best way to do it. Most likely your parents will do little to make you feel bad and a lot to help you because they love you. If you feel that is just to much, consider your higher power, if your religious at all. Pray to your God(s) or talk to a religious leader as they will do probably the same as your parents, simply help you not shame you. Help is out there. The only thing holding you from that help is yourself.",8,0
27,2021-11-28 15:19:19,https://www.reddit.com/r/addiction/comments/r4dbt6/not_receiving_the_right_treatmentsupport_for_my/,Not receiving the right treatment/support for my mental health,"Can anyone help and advise?
I've suffered with psycosis, depression and a personality disorder since as young as I can remember as well as abuse, causing me to have PTSD. I was victim to domestic abuse with my ex partner for 4 years which made my PTSD worse. I became homeless May 2020, and was moved to a new borough after living in a different county most of my life, during my time being homeless, I ended up under the local drug and alcohol services and on a methadone program.

I was receiving mental health treatment and prescribed anti depressants and anti psycotics, which I have taken on/off since I was about 15.

The doctor has just taken me off all forms of anti depressants and anti psycotics, instantly and didn't even wean me off and has said that they will no longer prescribe me my anti psycotics/depressants because they say my psycosis and mental health is drug related, which is completely incorrect, as I have suffered with psycosis and depression since I was as young as 12, and I was not using any substances and only started using substances in the last year, I also have an official diagnosis of a personality disorder, psycosis and depression given to me at 15. So my mental health is not a result of substance abuse, and in fact my substance abuse occured as a result of trying to self medicate for my mental health.

Since I am no longer taking any medication for my mental health, I am suffering really badly with my psycosis and depression and unable to cope.

Regardless of whether I use substances or not, I still suffer with psycosis, depression, PTSD etc and need treatment for these things but receiving no support for my mental health by my GP.

Who do I speak to/go to, to receive the right treatment and support, what services are available to me so that I can get the right treatment and support I need as I am unaware of what is available to me. Would it perhaps be a good idea to change GP surgery as I am not receiving treatment for my mental health at my GP and they are completely ignoring the fact that I have had on going mental health from a young age, before I was using any substances

I'd appreciate any advice.

I'm living in the UK, London.",1,0
28,2021-11-28 15:13:22,https://www.reddit.com/r/addiction/comments/r4d73e/why_does_my_boyfriend_forbid_me_from_using_my/,Why does my boyfriend forbid me from using my drug of choice(pills) but he can smoke weed 24/7 and binge drink once a week?,"Is this a bullshit double standard? Im sober, out of choice, but he is not comfortable with the thought of me having a small relapse or anything.

What the fuck?

He isnt getting sober....",5,0
