,Date,URL,Title,Body,Score,COVID-19 Mentions
112,2021-11-23 01:41:26,https://www.reddit.com/r/addiction/comments/r072gj/sexual_attractiveness/,Sexual Attractiveness,"Time for an ungrateful, narcissistic rant. Please feel free to insult me in the comments, I need it

So when I got into drug use around age 16, I was in a very depressed mental state. Why? Because I was convinced that I was physically ugly and that nobody would ever love me, so I saw no reason not to say ""fuck it"" and do a ton of drugs.

Well, I was a pretty lanky and nerdy looking teenager, and so in a way I was physically ugly back then, but around age 20 I put a lot of work into myself and I became more physically attractive over the next few years.

The thing is, placing importance on sexual attractiveness turned out to be another goddamn dopamine trap, just like pleasure unwoven talks about. I'm 24 now and I am so fucking lonely. I am trying to finish school but I can't stop doing drugs because I really see myself as pathetic and ugly in spite of getting attention from women irl. If I could somehow ""prove"" to myself that I'm actually attractive, then maybe this pain would stop. But I can't, because unless you're extremely good looking (which I'm not, just a bit above average), you have to put some effort into sexual relationships, which I'm too depressed to do

I have been ""ugly"" before due to being fat for a short time in the past (seroquel in rehab lol), so I know the difference between the two states of ""attractive"" and ""ugly"". In the ugly state I had zero confidence about my looks but at least people were somehow more friendly and laughed at my shitty self deprecating jokes. Nowadays, it's damn near impossible to filter between genuine affection and simple politeness, not to mention the rather threatened aura that some guys have towards me. 

One of my friends, who is quite physically attractive, seems to know that I have been using in secret. Or, at least, he seemed to understand my situation, insofar that when one is physically attractive, people are less likely to confront you about problematic behaviors and related shit; they just put up with it when you're around and then talk shit behind your back. It's not like I'm begging my higher power to make me wake up tomorrow with a deformity, but I don't think attractiveness is ultimately a benefit in life and it fucking kills me that my suicidality and BDD aren't taken seriously just because I'm already sooooo privileged.",7,0
113,2021-11-23 00:18:06,https://www.reddit.com/r/addiction/comments/r05py5/man_i_hate_cravings/,"Man, I hate cravings!","My cravings have been really high the past few days, and honestly it feels like hell. It’s like I want to use just to make the cravings stop. I really hate this. Why is sobriety so hard?",1,0
114,2021-11-23 00:14:00,https://www.reddit.com/r/addiction/comments/r05nem/dopelessnationcom_has_their_soberrecovery_black/,DOPELESSNATION.COM HAS THEIR SOBER/RECOVERY BLACK FRIDAY SALE LIVE NOW!,"Just thought I’d share this with the community. Aside from working on my recovery, it felt good to look good and feel better about myself along the way. 

They’re basically the hottest sober apparel/merch company in the world and I know they got a 15% off promo code live until January 2022. 

USE PROMO CODE “CLEAN” @ CHECKOUT. 

Thank me later.",0,0
115,2021-11-22 22:47:50,https://www.reddit.com/r/addiction/comments/r043jh/will_a_cocaine_addict_be_offended_if_you_give/,Will a cocaine addict be offended if you give them Narcan?,I understand it won't actually help with a cocaine overdose. I guess I'm more or less worried his drugs will be laced with Fentanyl.,2,0
116,2021-11-22 22:41:00,https://www.reddit.com/r/addiction/comments/r03z36/i_am_not_ok_and_that_is_ok_being_ok_with_not/,I AM NOT OK AND THAT IS OK: Being OK with Not being OK,"It's ok to not be ok, and accepting that can be a step and even The step towards recovery

[https://youtu.be/PjRNDqafb4Y](https://youtu.be/PjRNDqafb4Y)",6,0
117,2021-11-22 20:54:01,https://www.reddit.com/r/addiction/comments/r01xlf/im_having_zero_character_development/,i’m having zero character development:/,,1,0
118,2021-11-22 20:52:43,https://www.reddit.com/r/addiction/comments/r01wqs/another_day/,Another day,"Another day of not sleeping and letting people around me down so I can be alone. Another day of hyper focusing on tasks that make it so I don’t feel as guilty for not looking towards the future 
Another day where once I start I feel like I can’t stop 
I know this isn’t good for me but I don’t know how to convince myself to choose different once I begin",3,0
119,2021-11-22 20:13:27,https://www.reddit.com/r/addiction/comments/r016dw/my_addiction_warning_quite_lengthy/,My addiction ( warning: quite lengthy!),"Using a throwaway and I will keep my details minimal but all you need to know is I'm an under 18 male teenager.


Today I failed for the 11th time to stop my addiction . I have tried so many different ways to quit and with each fail it only makes me try harder. I am dedicated to quit and I won't stop trying. At this point you are probably wondering what addiction ... porn , yes a lot of people will think it's silly others may even believe that no such addiction exists but it very well does.


I started at a young age like most but it was never something I was ashamed of doing and it's something most people do anyway as it has become normalised. It was a multiple time a day habit that I enjoyed doing and as a kid it was quick and simple, the stuff I was watching was considered normal so I didn't feel too guilty afterwards. And at that age it really didn't bother me, it's not like I had anything better to do other than play PlayStation.


As the years went by the stuff I watched and the frequency stayed relatively the same , i might have even done it less at times. Now this is where the problem starts... so as I was growing up my interests changed and I got smarter meaning I started to figure out how to access other parts of the internet which lead to the things I was watching to become more extreme and over time I started getting into the really nasty stuff because regular porn just didn't make me feel anything anymore, even then I didn't look at it as something completely abnormal so it got even worse...

I figured out how to access the dark web and pretty much all the messed up places all over the internet. I won't go into detail the type of stuff that i watched but you can probably guess for yourself. At that point I slowed things down a little and went back to the slightly less messed up but still bad stuff I was watching but after some time even that messed up stuff I was watching wasn't good enough so I had to go back to those dark places in order to be satisfied. That's when I realised I have a problem.


The first attempt I made at quitting was accidental becuase I was too busy with some amazing videogames and movies so I completely forgot about porn which made me go 2 weeks without it which was my best attempt so far and the one I am trying to beat to this day. It was amazing I was at my happiest during those 2 weeks. But as all good things must come to an end I completed the videogames and watched all the movies so back to porn it was , i didn't look at the messed up stuff straight away but I very quickly got back into it


After I got to experience the benefits of staying away from porn for just 2 weeks I wanted to feel that happiness again so thats when I dedicated myself to quit it for good. 


Some of the attempts were honestly pathetic while some managed to last over a week. Even tho i did not manage to quit after each attempt the type of stuff i was watching became less messed up and because of the attempts I was only doing it once or twice per week on average. I only had a few major slip ups where I went back to the really bad stuff including today.


I have acknowledged the fact that i have a problem and I am doing everything I can to fix it. I have listened to podcasts and watched videos for tips on quitting , I have also read stories from people on reddit and other social media pages. I have installed countless apps which have helped me stay away from looking at it accidentally and one of the more extreme ways I have tried to quit is by punishing myself, every time I fail I take a cold shower and after every fail the time I have to stay in the shower increases. I know some people take cold showers daily but for me it's like torture although after so many fails I am starting to get used to it. Another form of punishment I have done is by restricting myself form social media or music that I like for a number of days. All those things have helped but its nowhere near enough to stop the demon inside of me from taking over. 


Speaking of demons it really feels like there is one living in my head. When I look at porn I don't even get much enjoyment out of it. I will try to describe this in the best way possible... When I am looking at porn my vision goes blurry and my Brian stops thinking.  I am looking at stuff I feel disgusted by but I just can't stop it , at times i will snap back to reality and try to put my phone down but I can never do it in time so it just takes back over me. And when is say i don't get much pleasure out of it what I mean by that is that it feels good for about the first 10seconds and then i won't feel pleasure anymore but at that point it's too late and I won't be able to stop until it's done. The first thought I get in my head when I get the urge is I'll just look at one image to help me do it without porn but i always end up going back down deep down into those dark places.


I have refrained from using the word masturbate becuase what I am mainly trying to quit is porn and not masturbation, of course it would be great If I could quit both at the same time but porn is the main problem. I have even tried masturbating without porn and i try to keep it as my trump card in my back pocket but I am never able to pull it out in time as my phone is already typing the letter p into Google before I even get the chance to use it.


Porn is holding me back as a person and my progress in life , there are hobbies I want to do and happy moments that I want to experience but my addiction keeps getting on the way


With all of that said I am proud of the progress that i have made, even after 11 fails I will keep trying to better myself and quit for good. I doubt anyone will take their time to read through this entire essay (sorry its so long) but if you did and have any tips or ideas to help me please leave a reply :)",5,0
120,2021-11-22 19:21:27,https://www.reddit.com/r/addiction/comments/r005ql/addicted_to_gambling/,Addicted to Gambling,"Any advice on how to recover from gambling addiction. I have been gambling every evening and it scares the hell out of me when i see my account balance drops. 

Any help??",2,0
121,2021-11-22 18:59:59,https://www.reddit.com/r/addiction/comments/qzzpmx/my_partner_just_got_a_xanax_prescription/,My partner just got a Xanax prescription,"I am about a year and a half sober from xanax and painkillers. A few days ago my girlfriend got a xanax prescription for when she gets her blood drawn bc it really freaks her out. 
Her getting this prescription is just bringing up so many feelings of missing it and frustration at myself for wanting it
I have to keep reminding myself i’m better without it


Edit: I really appreciate everyone commenting and supporting me and my sobriety !
to clarify 2 things    1) she doesn’t keep it in our apartment and had an extensive conversation with me about it before she even picked up the prescription 
2) it’s not really a ‘minor phobia’ for her, getting her blood drawn sends her into hysterics and panic attacks",32,0
122,2021-11-22 17:49:39,https://www.reddit.com/r/addiction/comments/qzy79u/the_boredom_is_killing_me/,The boredom is killing me,"As of this post I'm only 6 days sober, but every second of those 6 days has been agonizing. I feel like using was the only thing keeping me sane. I don't like doing anything anymore. I just feel empty and sooooo bored all the time. I don't have a car, no money, no real friends I have nothing to distract me from this feeling of eternal nothingness. I just want to know how the fuck do you get past this? Only 6 days in and I'm already feeling defeated... I have no idea how I'll make it a year, let alone the rest of my life",4,0
123,2021-11-22 08:50:28,/r/opiates/comments/qx1hnm/my_struggle/,I'm so lost..,,2,0
124,2021-11-22 06:29:51,https://www.reddit.com/r/addiction/comments/qzjecr/thanksgiving_dinner_drug_addicts_need_feedback/,THANKSGIVING DINNER & DRUG ADDICTS - need feedback,"

I had a previous post however NOBODY really read what I wrote, they were all too quick to pass judgement and were not focusing on the big picture.  


So I’m posting again and asking that you read EVERYTHING I WROTE BEFORE YOU RESPOND 


This is a very serious question… Please focus on the situation and not your opinions on the person. This is a very serious situation I need advice on

I am helping a 28-year-old girl whom we shall call ANN for privacy purposes try to get her life on track. She’s a good person, but just like everyone she has her faults.  Hers happens to be a drug dependency on opiates.  

Ann’s family scenario is a bit dysfunctional.  She is the youngest out of six brothers and sisters…4 are what we would call “normies” no drug dependency’s …. and 1 has been sober 1 year.  

Her parents are divorced and she really has no relationship with her father… Just her mother, whom has a plethora of illnesses… Including extreme OCD (everything has to be spotless and in order and she’s a germ-a-phobe).  

Ann speaks to & texts her mother on the phone several times each day.  Her mother will ONLY speak to her on the phone, she will NOT physically see Ann unless Ann is “sober“. 

Meaning…. Her mother won’t see her today because she is on drugs….. however if Ann went to rehab tomorrow her mother will go and see her. It really upsets this young lady that her mother will not see her, she is heartbroken over it yet she continues to talk to her mother on the phone every day and text back and forth a zillion times.  She tells her mother everything.  

Thanksgiving is next week and this girl wants nothing more than to go to Thanksgiving dinner… However she is NOT invited. I sat in on a three-way FaceTime call and Ann asked her mother if she could please go to Thanksgiving dinner and her mother told her “ABSOLUTELY NOT”  because she is on drugs. If she was sober… she would be allowed to go.   This young lady argued with her mother and said “I could just lie to you and say I am sober and you would never know… So what’s the difference? It’s not like I am going to be doing anything in front of you guys” 

I did not want to include my opinion on this situation however after much deliberation I’ve changed my mind.  I want people whom are especially closed minded to see the whole picture and think about things they may not have normally thought about. 

Personally, I agree with Ann… and my whole thing is this: as long as whatever she is doing is not negatively affecting anyone else or getting in the way of anything what’s the problem??? Drug addiction is NOT contagious.  Ann is still the same person whether she says she is sober or on drugs…. And as long as she does not do the drugs infront of anyone what the heck is the problem??? 

I’m sorry but I have a very hard time with this and it’s breaking my heart.  I think it’s bullsh^t. Her mother told her she could face time into thanksgiving dinner and Ann said “Hell NO!” and then said to her mother “oh that’s nice….so I can see you all together having a good time without me, no thanks” her mother disagreed and said FaceTiming was just as good.  Sorry but I agree with Ann.  I feel that’s like a slap in the face and more hurtful.

Ann’s mother then tried to say it was not her call on whether Ann could come or not because Ann’s older sister is hosting the dinner.  Her mother said she should call her older sister and ask if she could go but doesn’t think the sister will say yes.  Personally, if it was my family, I would not have to call my sibling and ask because my mother would be fighting it on my behalf and would probably say that if I wasnt invited she would not attend either.  I think it’s just a cop out for Ann’s mother.  I’m sorry but I just don’t get it and I think it’s terrible.  



I also have a difficult time with the fact that Ann’s mother won’t physically see her but will talk to her on the phone a hundred times per day.  I heard her mother admit that if Ann went to rehab tomorrow she would go see her.  My thoughts are this:  If your talking to her anyways why does she have to be in rehab for you to physically see her? Personally, if it were me, I wouldn’t even be speaking to my mother on the phone if that’s what was going on.   


Please share your thoughts on all this.  I’d especially like to know if you think Ann should be invited to thanksgiving dinner with the rest of the family.",3,0
125,2021-11-22 06:20:43,https://www.reddit.com/r/addiction/comments/qzj9ga/defeating_my_marijuana_addiction/,Defeating my marijuana addiction.,"Hello guys I'm (20m) here to tell u about my weed addiction ,so I've been using marijuana daily in 4 years and I never thought about quitting bcz I thought it's just weed ! It can't do any harm ! But I was wrong , it started ruining life and and I started losing control , so one day I was high and I took the decision of quitting it ,I dropped the joint and didn't smoke for 2 months ! It feels like an achievement and I'm really proud of myself .",18,0
126,2021-11-22 05:23:16,https://www.reddit.com/r/addiction/comments/qziff8/am_i_addicted/,Am I addicted?,"Throwaway account. I’m on a coke high, and it started innocent at first but now I feel like I need it, especially when I drink. Every time I’m out I get an overwhelming craving and I spend so much money on it. I know all the terrible side effects long-term, and I’m an PhD immunologist by training, so I should know better re: health effects...but for some reason I keep doing this shit. 

I’m still productive at my job, and besides the occasional weekend bender, I’m able to function the next day. But I’ve noticed it has gotten worse over the last couple of months, esp. after a bad breakup. I hate that I even tried it once. Idk if I’m overreacting or if I should be more concerned. I don’t even know who to turn to to talk about this.",6,1
127,2021-11-22 04:29:58,https://www.reddit.com/r/addiction/comments/qzho4d/im_a_giant_shopaholic/,I’m a giant “shopaholic”,"So, I’m not addicted to drugs or anything like that, but I can’t stop buying things. I use my debit card, Klarna, even sometimes my mom’s (I’m 16) Are there any methods you guys know that can get me to stop buying things or be so impulsive? Thanks a lot.",3,0
128,2021-11-22 00:33:55,https://www.reddit.com/r/addiction/comments/qze3vi/how_do_you_build_a_social_support_network/,How do you build a social support network?,People outside of AA how do you meet people who are sober and supportive? I'm 31 and have no idea how to meet new friends. Loneliness kills my sobriety.,9,0
129,2021-11-21 22:21:08,/r/pregabalin/comments/qzbr4a/iv_vs_oral/,IV vs Oral,,1,0
130,2021-11-21 22:13:19,https://www.reddit.com/r/addiction/comments/qzbmiy/help_me_help_my_husband_reddit/,Help me help my husband Reddit!,"Hello! I’ve never posted anything on Reddit before, so this is a first. I need help and advice. My SO was addicted to coke. He finally admitted he needs help. His addiction wasn’t severely bad, but was getting there. We are helping him at home. I wanted to try and get advice from real people rather than google. What is this journey like? What am I going to have to deal with? How can I help him overcome this? What are the days going to look like? Thank you Reddit!!",16,0
131,2021-11-21 20:54:01,https://www.reddit.com/r/addiction/comments/qza5me/destroyed_my_life/,Destroyed my life,My addiction ruined my relationship. Was doing well but messed up and now I’m single and living with remorse,1,0
132,2021-11-21 20:35:57,https://www.reddit.com/r/addiction/comments/qz9tvt/advice_on_how_to_proceed/,Advice on how to proceed.,"I have multiple addictions- marijuana, Kratom, Klonopin vyvanse and gabapentin. The last three are taken as prescribed. I am also schizophrenic. 
If I wanted to taper off all these drugs what would be the first you would try to tackle. I do find cannabis to be one of the harder addictions to quit and I’ve kicked methadone but I was going to start there. My goal is to be free of medication (except antipsychotics) by Christmas next year, to give me some time especially with the three mg of klonopin. Should I taper off more than one drug at a time?",2,0
133,2021-11-21 20:35:09,https://www.reddit.com/r/addiction/comments/qz9tc7/please_help_me_understand/,Please help me understand..,"My little brother is doing something. He goes to the bathroom and falls asleep on the toilet, falls asleep at the dinner table, sneaks away during meals or when we are hanging out. His eyes glow red. I know he smokes weed and that is fine. The terrifying part is that my mom has found him multiple times passed out behind gas stations in his car with tinfoil, a straw, and a lighter in his hand. She asked him what he was smoking and he said opioids laced with fentanyl. I don’t know exactly what that means tho. I know he has a problem. He has been to rehab for opioids, had a coke addiction but this is scary. I’m scared for him. I don’t want to make this about me but I need to know what he is smoking. It smells like burnt tar or burn chemicals. 
He doesn’t want help but I can tell he is sad that my family is always on edge when he is around. I don’t want that sadness to make his habits worse. 
So I guess after that long senseless ramble I’m asking 
 1. Is he doing this because he is sad or dealing with something we don’t know about? Or does he just like the high?
2. What is he smoking? I thought it may be heroin.. but I don’t know anything about drugs other than shrooms. 
Please and thank you in advance",15,0
134,2021-11-21 19:42:43,https://www.reddit.com/r/addiction/comments/qz8tuf/please_help_to_give_my_community_a_chance_to_get/,Please help to give my community a chance to get educated thanks - Josh,"I'm raising $2,000 until 12/21/2021 for f*** Heroin. Can you help? https://paypal.com/pools/c/8ERO7OFRPp",0,0
135,2021-11-21 19:02:28,https://www.reddit.com/r/addiction/comments/qz81k1/recommended_sober_facility_in_ca/,Recommended sober facility in CA?,"My family is looking for one for my brother. He needs to stay sober per court order to stay out of jail. We think the best way for him to stay out of jail is to enter a sober facility. It is not the perfect solution but we have run out of options. 
Thank you.",3,0
136,2021-11-21 17:27:39,https://www.reddit.com/r/addiction/comments/qz64hu/top_ten_or_i_guess_bottom_ten_things_you_hate/,"Top Ten (Or I Guess, Bottom Ten) Things You Hate About Drugs/Being An Addict","So I'm going to do mine in the format of 5 things I hate about soft drugs (weed, booze, pills) and 5 things I hate about hard drugs (crack, heroin, etc)

Soft Drugs 5:
1. The unique anger and frustration you get when you don't have weed
2. Making stupid/regrettable decisions that you would never make sober
3. Smoking weed with people/a person you like, but then completely disliking them after being around them when you're stoned and you can't go back to how you felt when you first liked them as you are now permanently put off, annoyed and weirded out by all the things that bothered you about them when you were high. I have stopped being friends with people and ended relationships because of this.. many times as well
4. Ending up broke, not because you spent all your money on weed/booze, but because you wasted all of your money on munch/sweets/food or buying unnecessary crap that you don't need online
5. Not wanting to get out of bed after smoking a lot of weed or drinking a lot the night before

Hard drugs 5:

1. Letting yourself go and completely neglecting yourself and your hygiene, like wearing the same clothes all week, not having a shower or a wash for ages, not brushing your teeth or hair, not wearing make up or nice clothes anymore, not going to the hairdresser's etc.. mostly because 1. You can't be bothered anymore and 2. You just don't care anymore or see the point in these things which feel futile
2. Always having dirt under your nails, black fingers, all of your skin torn up and ripped off your thumbs and index fingers from gauze/steel wool and then continuing to rip your skin on your thumb/finger because you excessively chew them when you're waiting for gear or dont have anything at all.
3. Wishing you could waste your money on shit you don't need and buying lots of nice food and sweets, but never having any money cos you spent everything on the gear/smoke
4. All of your ""friends"" and people you associate with now are two faced, fake, users, liars, scammers, people who would happily stab you for a couple of hits and not having any real friends to rely on or turn to
5. Losing all want and/or confidence for anything sexual, romantic or affectionate. You could literally watch hours of porn, be touched intimately, get naked with someone and you would still be as dry as your mouth when you smoke weed or as limp as frozen pizza which has defrosted

Okay, now it's your turn",2,0
