Date,URL,Title,Body,Score,COVID-19 Mentions,Sentiment
2022-02-14 14:27:08,https://www.reddit.com/r/addiction/comments/ssizl3/my_brother_finally_called_me/,My brother finally called me.,"Update: I first want to start by thanking everyone for their kind words and advice. It truly meant more than you can ever imagine. This update isn’t the one I was hoping for but one that I thought might happen. I apologize if this is long. 

I flew down with my best friend Thursday morning with the understanding that I would see him that afternoon. We had been communicating since he called me on Sunday. He even offered to pick me up from the airport, which I politely declined. I called and texted all afternoon, the phone was ringing and going to voicemails. My friend and I drove by where he was staying hoping we might see him outside or in the area. He didn’t respond to me until around 8pm and said sorry his phone was off and then stopped responding again. 

Friday we woke up and came up with a plan that if he didn’t call me back or text me by 3PM I would request a wellness check. We actually weren’t sure how wellness checks work in that area so we drove to the local police station just to get some information. The officer I spoke with was so kind and empathetic which isn’t something I’ve experienced before with officers in situations regarding addicts. She gave me all the information I needed and included her personal cellphone number and asked that I update her if I hear back from my brother. 

He texted me in the afternoon saying that his and the girl he’s with were going to sign a lease and should be done by 3:30pm. My friend and I were went to the hotel at 2:30pm and camped out by the parking lot entrance - this hotel only have one entrance into the parking lot so we would be able to see them come and go. By 4pm we haven’t seen them so I call him and he actually answered and said “oh we just got back” and I said “ok we’ll I’m outside your hotel, you need to come downstairs”. 20 minutes later they both came down. My friend moved the car because next to the entrance of the hotel has a little seating area where I was going to move them to so we could sit and talk. She wanted to be able to see me good forbid anything happened. 

My heart sank when I saw him but I held in my tears. They are both so skinny. My brother specially is about 5’11 and couldn’t be more than 115 pounds. He had sores around his mouth from the crack pipe and track marks on his arms. His cheeks were hallow. He’s never looked worse, but I’m glad I had people prepare me to an extent, but it was still heartbreaking. 

I kept the conversation light with them since they were both together because my goal was to get him alone to have a conversation. I did offer them both help and said I will drive them home both right now if they were ready. But they said they weren’t. However she said she was going to work at a bar at 6pm and I took that opportunity to tell my bother “perfect let me take you for dinner!” He was declining at first but the girl he’s with encouraged him to go. 

At dinner is where I got more serious. He doesn’t even remember calling me and saying those things. He only remembered parts when I texted him Monday saying I wasn’t driving down that day but I booked my flight for Thursday morning. He tried to tell me they’re not using as much as I think they are. I looked him right in the eyes and said “you are addicts and you are lying to me”. 

He told me all these plans they had about moving down permanently to where they are. Reasons they couldn’t come home. All the things people say when they aren’t ready. I’m proud of myself for not getting emotional because I needed him to know how serious I was about the things I was going to say next. 

He told me that they planned on getting sober on 5/1 and I asked “what are they waiting for” and he just closed his eyes and cried. He said “Our heads are above water” and I said that’s not enough. I reminded him of the value he has, and the support he has and that while he will have to face his trauma when he gets sober that I will be there to support him. I reminded him that his best friend who doesn’t use (most of his friends also use back home) is desperate to here from him and to know he’s ok. She’s even offered that if he gets clean he can move in with her states away for a fresh start to get away from all his old friends and still have a support system. 

He told me he’s not ready and doesn’t want help. I told him that if he continues like this I cannot have a relationship with him. That I can’t worry about if he’s dead or alive. I can’t spend my time calling random phone numbers hoping it’s his. That I can’t call police stations and hotels go find out information. That my mental health is can’t suffer because of his addiction. 

He got so angry and started yelling at me asking how I could do this to him. That I’m the only person that has loved him through this no matter what. That I’m the only person he cares about enough to checkin with when he’s ready. That I’m the only person who tries to make sure he’s ok. I said I that I am not doing this to him, that his addiction is. He asked if he’s invited to my wedding in September and I said if you are not sober I cannot have you there. He started hitting the car dashboard and crying. He said he was getting out of the car and that they were planning to come home next weekend to visit for a few days. 

I told him that he can call me but I will not answer. I told him that I loved him and I will always be there for him and that when he’s ready for help I will be there. I hugged him and cried and said “I’m afraid this is the last time I’m going to see you”. He got out of the car and sat on the curb of the hotel entrance and cried. I drove away. 

I obviously was hoping that the outcome was going to be different that he would come home and get help. That she would come home and get help. I knew that on a human level if he was ready and she wasn’t I would have to figure out a way to get her home. I’m friends with her sister and wouldn’t be able to leave her there on her own but I also knew going into it that they wouldn’t leave without each other.

I didn’t cry and haven’t cried since I left him. I went back to my hotel and slept and the next morning my friend and I got coffee and walked the beach before our flight. We actually saw a group of dolphins in the ocean which gave me this odd sense of peace. I know I did the right thing when he called me on Sunday and offered everything I could. But I set more boundaries around our relationship, ones that I will not go back on. 

I have to regrets about going down and maybe I’m stupid to be hopeful that what I said left an impact and will help them realize it’s time for help, but I’m being realistic that they are going to continue to use until the end. Whatever their end maybe. 


Original:My brother has been in active addiction for the last 10 years. I’ve watched him go from this giant personality who could light up a room to someone I no longer recognize. 

He’s been missing since before thanksgiving and changed his phone number and hasn’t talked to anyone. His mail still goes to our dads house and I’ve been texting and calling the numbers on the phone bill just saying that I love him and I am always here for him no matter what. 

Last night he finally called me just saying he loved me that he missed me and how sorry he was and that he needs me. 

I don’t know if this is his cry for help but I will never give up on him. I booked my flights to where he is and will be going down Thursday with the hopes that I can bring him home and get him into treatment. 

I’m not sure what to say when I get down there or really even what I should do. Any advice would be beyond appreciated. Even if this isn’t the time and he’s not ready, I just want him to know that no matter what when he’s ready I will be there.",39,{},"{'label': 'NEGATIVE', 'score': 0.9951168298721313}"
2022-02-14 14:21:10,https://www.reddit.com/r/addiction/comments/ssiuhs/tw_self_harm_and_stuff_is_there_such_a_thing_as/,Tw self harm and stuff. Is there such a thing as addictive personality ?,"In the sense of being more prone to addictions... I have been addicted to so many things in my life it's insane. I was a cutter in the past and struggle with it years later. I am pretty sure I'm borderline alcoholic at this point, I am addicted to YouTube and social media. I also used to take pills and I stopped those just because I had no more money to burn. For ref I'm just 18 and managed to rack up more addictions and coping mechanisms others don't get in their lifetimes...",1,{},"{'label': 'NEGATIVE', 'score': 0.9917821884155273}"
2022-02-14 07:57:25,https://www.reddit.com/r/addiction/comments/ss9zgt/my_ongoing_struggle_with_addiction/,My ongoing struggle with addiction,"Hi, hope everyone is well and safe! 
So since Feb last year I got myself on heroin which has been the darkest time in my life. It all started so well but quickly deteriorated and before I knew it it’s been a year already. It basically started when I started to see my ex and he started coming round but he only smokes crack normally but would occasionally smoke heroin with me. It started just being the weekends and we would have so much fun, we would have a smoke and stay up all weekend watching films and having a laugh and I felt amazing, I suffer with lifelong depression and anxiety but when I smoked I felt really confident and enjoyed life but this started to creep into the week so I would have a smoke while working which actually made me work so hard and my concentration was crazy, never been able to concentrate like this before and I really enjoyed my job, I would work really hard and before I knew hours would pass. It was crazy and I loved it. One weekend I went to my mates for a drink, I came back went bed and slept most of the next day but then the sickness started and I was being sick for a straight 24hours which was horrible and really drained me, after the sickness I was so ill, I could do anything so stayed in bed in pain, never felt anything like it and this went on for another day or two and started to slowly get better but my mate would come round and bring me a bag, I’d tell him no I can’t but I would end up having it shortly after. I knew my ex wanted to get back with me but wasn’t interested and I think he wanted me on gear so I needed him, so I would keep buying it and buying him crack too cos he really pushed and hinted for me to keep having it which I know now I shouldn’t have listened or got him back out my life but this was really hard because I knew after a couple of lines I would feel amazing again. Well I finally accepted I was an addict and ensured I always had some so I wouldn’t get sick and not be able to work and this is when I became used to it and needed more until it got to the point where I can’t really get high anymore and ending up spending most my wages on it and slowly became in debt so decided I can’t go on like this and got on a meth program which I had high hopes for. At first although I didn’t experience any harsh withdrawals I still found it hard not having a smoke and feeling like I can’t concentrate so for the past 3 months I’ve really cut down but crave like mad then when I had 5 days of just meth I called the meth program and asked to be reduced which they advised would be a mistake so I started to lower myself and save up the rest & I had 2 full bottles so left the program and trying to get off all this before it runs out, I have a bottle and half left which I think will last at least a month, maybe a month and half. I’m struggling so much to keep my job but at the same time finding it really difficult work without a smoke and the cravings are crazy 😔😩 does anyone have any tips for me or even any success stories like my position please or anyone else in the same position? I can’t go on like this. I need a miracle 😭 thank you for reading if you got this far 🥰",8,{},"{'label': 'NEGATIVE', 'score': 0.9725313186645508}"
2022-02-14 03:32:58,https://www.reddit.com/r/addiction/comments/ss5tbp/i_finally_asked_for_help_and_it_went_so_well/,I finally asked for help and it went so well,"I’ve always been very good at hiding things, and my addiction is no different. I’m a great liar, and too proud of it. I’ve been hooked on pills for about a year. I’ve managed to avoid becoming physically dependent on anything because I switch up what I do very frequently, I basically have a rotation of 7 or 8 drugs that I enjoy. Of course I have a favorite, oxy, but I tried to spread things out like I said to not build a tolerance or physical dependence on anything. I thought I “outsmarted” addiction. I couldn’t possible become addicted, but I recently realized that addiction is a mental game, not a physical one. I have yet to actually face any hard consequences of my abuse, which is another reason I never considered myself “addicted”. 

I am a college student with big plans for the future. I want to go to law school and work in health law. Too many people are getting fucked by the system (but that’s another post). I am doing well in school, 3.7 and making deans list every semester. Scored a 165 on my first practice LSAT. So I know law school is obtainable, but I would be doing even better in school if I quit all the pills. 

Currently my biggest problem is that I am an athlete at my school. I have yet to be drug tested because they are random, but I would be absolutely fucked if I was tested. (Though maybe they would assume it’s an error if I tested positive for everything lol.) I don’t even want to think about the consequences of that. For weed, most people just get a warning for the first positive test, but I have heard my school is super strict about anything else. I would likely be cut from the team, and that would be bad for many reasons. Aside from losing the little scholarship money I get (I play a pretty niche sport, so even at the top level we don’t get much money), I would be losing all of my best friends. My team has become my family. I love them with all of my heart and would do anything for them. 

My head coach told me at practice yesterday that he noticed that I had lost weight and it was seemingly muscle mass that I lost, and he knows I’ve been in the gym everyday so it didn’t make sense to him. I think he was concerned might I have an ED. I finally came clean to him and told him everything. I told him about my shitty childhood full of abuse, both physical and mental, how my dad hates me for being gay, my suicide attempt, and my drug problems. It felt really good to open up and tell someone something. Like I said, I’m good at hiding things, and because of trust issues, I hide most things from most people.  His reaction was better than I ever could have imagined. He basically told me that he’s been in my position before and that he will do whatever he can to help me, and he doesn’t want to get me in trouble, with school or my parents.

We came up with a plan together to help me. Firstly we are going to meet at least once a week and talk, I have to keep him updated. I can call him anytime for any reason. If either of us think I need it at any point, he will arrange professional help. If I show up to practice, team meetings, games, or anything else drunk or high he will make me leave. And if I drink or use the day before or day of a game I will be riding the bench. And biggest of all if I lie to him about any of this, he will have to talk to the school. This may seem way too loose, like he should be making me stop everything all at once, but he knows because he’s been in my position that this is the best starting place, and this is how we will build trust in each other. I know that over time he will tighten up his “rules” for me. I am so incredibly grateful to him. He treated me with nothing but acceptance, love and respect. He made sure to tell me not to feel guilty or ashamed, and that we will get me through this together. 

I don’t think he’ll ever see this, but just in case: Coach K, thank you, I promise I will put the work in, this isn’t how my story ends.",11,{},"{'label': 'NEGATIVE', 'score': 0.9939940571784973}"
2022-02-14 01:21:43,https://www.reddit.com/r/addiction/comments/ss3t36/im_so_addicted_to_adderall/,I’m so addicted to Adderall.,"This is day three of being awake. I don’t want more adderall because my heart will explode and I don’t want the rush at this point, but the further it’s out of my system the more heartbroken and hopeless I become due to the addiction. I’ve taken a ridiculous amount, but that’s nothing new. But I don’t go out anymore and have lost all of my charisma and the anxiety has made me agoraphobic to a degree. And I’m going to think that the cravings are gone tomorrow as usual, until they come back and make me a pathetic helpless addict again the day after. My friends all know (to an extent) but they don’t attack me for it, instead they’re disappearing from my life slowly but surely. 24 m. Need a hug to say the least",26,{},"{'label': 'NEGATIVE', 'score': 0.9969307780265808}"
2022-02-14 00:07:54,https://www.reddit.com/r/addiction/comments/ss2j1b/cigarettes/,Cigarettes,"I’m 35. I’ve probably smoked cigarettes for close to 20 years now. A few years ago I got a new car, and refused to smoke in it. Also decided to not smoke at work(I work in a restaurant. You know, where you really only get breaks if you smoke?). The next steps were the bar and home. Covid took care of one of those for long enough for me to not think about it. Then it was just home. 

3 weeks ago my partner and I were at a local casino, and we stepped into the smoking area for maybe 15 minutes(he smokes regularly). We stayed the night in the hotel there, and when we got up and got dressed in the morning, my hoodie I was wearing the night before almost made me gag. I didn’t notice it at the time but, that smell was overwhelming. 

I haven’t had a cigarette since. For the record I do have an “On!” brand nicotine pouch in my mouth a few times a day. But, besides that, even with the partner and the roommate both being regular smokers….the cravings basically don’t exist. It’s crazy to me. 

Somebody motivate me to take a jog, or join a gym or something.",9,{'covid': 1},"{'label': 'NEGATIVE', 'score': 0.994178295135498}"
2022-02-13 22:59:18,https://www.reddit.com/r/addiction/comments/ss197c/am_i_addicted/,Am I addicted?,So I’m a teen and I couldn’t find any info on the internet about this but I masturbate about like 1-2 some times 3 per day. Is that bad? Also I don’t think about it all day or that frequently at all mainly only at night and sometimes in the middle of the day when nothings going on yk go and have a wank but I just wanna make sure I’m not headed down a path I shouldn’t be heading down. I don’t rely on it as my main and only source of dopamine either. So do I have an addiction?,3,{},"{'label': 'NEGATIVE', 'score': 0.9895765781402588}"
2022-02-13 22:35:05,https://www.reddit.com/r/addiction/comments/ss0sbf/how_to_explain_this_to_my_place_of_employment/,How To Explain This To My Place of Employment?,"Right now, I'm struggling with my addiction. I relapsed on Marijuana 41 days ago and have been having a lot of problems in regards to my chronic pain. 

As a result, I've come to a decision to go to a residential treatment facility for 14 days to build the foundation I need to get a handle on some of my trauma, addiction, and chronic pain. The rehab I'm going to specializes in chronic pain.

As far as work is concerned, I have pancreatic and spinal problems that cause me to need time off every so often. They don't have very many details about it though and I'm super lucky because:

1. I work for a union
2. My boss is understanding and compassionate

Personally, I think they'd be SHOCKED to find out about my addiction or that I'm a member of Narcotics Anonymous and have been for over 2 years now.

For those who may have been through this before how should I approach this with work? I've considered going to my union rep before approaching my boss but I don't know if that is standard protocol or not. 

Currently, I plan to start the conversation by saying to the office manage something along these lines, ""If I needed to take a two week leave of absence who/where would I go to address that?"" After that I feel like I'd be left floundering with the onslaught of questions that will surely follow.

Advice is warmly welcomed.",2,{},"{'label': 'POSITIVE', 'score': 0.877737820148468}"
2022-02-13 19:23:05,https://www.reddit.com/r/addiction/comments/srx68l/thsi_sub_is_honelty_so_helpful_nd_kind/,thsi sub is honelty so helpful nd kind,"I'm cutewcntly gurning like a mfer with my eyes occasionally rolling back in my head, all to be stimulated to do my essay due for tomorrow.

I'm peaking and distracted now so I just want to say I don't thi k I've ever met anyone on this sub who is judgemental or a prick in anyway. Everyone is so kind and understanding, it really feels like a tight-knit community where everybody understands and will help each other. What a great subreddit with great people :)",8,{},"{'label': 'POSITIVE', 'score': 0.9823037981987}"
2022-02-13 18:53:43,https://www.reddit.com/r/addiction/comments/srwlyk/i_just_hate_being_sober/,I just hate being sober,"I can't stand it, I procrastinate, I feel anxious, I never know what to say or do, and I've always got something niggling at the back of my head

And I just love being intoxicated in anyway to do anything

I will always end up justifying it to myself either, I did 300mg md with a mate yesterday because our 2cb had ran out, that was the just if action for that time, then just a couple hours ago I took 2 E pills just to justify finishing a school essay. I can't keep my shit together and I feel like nothing I ever do is good enough, but I can never motivate myself when I'm sober. And when I'm high I can still do the work and not he sober. I feel trapped. Sorry I don't make much sense.

I was feeling so empowered a few weeks ago when I got a gym membership and hadn't used anything in so long

I ahte my life so much I honestly just want to off myself so much. Its easily 20% of my thoughts/daydreams. Tha ks for reading my little rant",31,{},"{'label': 'NEGATIVE', 'score': 0.9928749799728394}"
2022-02-13 18:18:33,https://www.reddit.com/r/addiction/comments/srvxnz/someone_probly_posts_this_every_day_but_im_4/,someone probly posts this every day but i’m 4 years clean from cocaine and in the best phase of my life up until this point.,"maybe this belongs in r/trueoffmychest but i used to be an asshole for drugs. i orchestrated my entire life around who was fun to do lines with, pop pills and get wasted. i smoked ritalin, dipped cigarettes in codeine, OD’d on benzos and opioids, and made enough cocaethylene in my metabolism to stay drunk for two straight months. my drinks were always strong too. my drink of choice runs about 160 proof. i used to live for the drip in the throat and the feeling of bestial immortality from hitting a line of cocaine. i was introduced to treatment when i went off the rails and crashed my car, lost my job, my relationships, and my sanity all at the same damn time. i urge you if you’re struggling to read what i write here as proof that there is no nobility in drug use. it truly is a better life for me as a sober individual. i won’t speak for others, but i am better at everything i used to only do high, i am able to function emotionally without the weight of guilt and the slow lonely death spiral of drugs and depression that comes with the territory. i feel better than ever and i want to keep going. i never imagined what straight edge was like and i never could, i hope whoever reads this does.",61,{},"{'label': 'POSITIVE', 'score': 0.9559859037399292}"
2022-02-13 17:21:29,https://www.reddit.com/r/addiction/comments/srupfz/the_cycle_repeats_itself/,The cycle repeats itself!,"I have done it again. I have relapsed.

I recently came to the insight that it wasn't working the way I was using amphetamine once again.

I had to become honest to myself and to my girlfriend that I live with, which is a very hard thing to admit, I think for every addict. I do not want to hurt the people I love and care for.

This is the second time I have to do this here.
And it breaks my heart. This cycle has repeated itself with my x as well.

I am tired of this, and I'm tired of myself.
But I'm trying not to be too harsh on myself; it's counterproductive. 

But I am afraid it will happen again in the future. 

I need to feel some hope. If anyone has some tips on how I can stay sober and not repeat this cycle, I would be grateful ❤. 

Love to you all! 

My name is Dennis, and I'm 33 years old",1,{},"{'label': 'POSITIVE', 'score': 0.9926764965057373}"
