Date,URL,Title,Body,Score,COVID-19 Mentions,Sentiment
2022-02-08 18:51:09,https://www.reddit.com/r/addiction/comments/snyptu/today_i_will_argue_for_12_step_fellowship_recovery/,Today.. I will argue FOR 12 Step Fellowship Recovery,"It's important that I preface this post with this statement:**I do not think that the 12 Step method is the only method to get clean.**It is one of many, many options.I am not a 'big book thumper', (""Big Book"" ie the nickname for the AA book that when followed, act as a guide to recovery. People memorise and quote this constantly.) nor will I zealously defend what a recovery group is - The idea of getting a bunch of untrained, mentally ill people together and attempt to break a severe substance dependence using a 1930s book as an instruction manual.

I also only occasionally attend an AA meeting, I'm actually more involved in CA as it's open to all mind altering substances and different fellowships all seem to have a different vibe. AA can be quite maudlin at times, CA is generally more uplifting and hopeful, NA often devolves into shares about how bad it got for some of them - war stories.

My intention is only to set straight misconceptions and more importantly, misinformation spread by angry people that have had bad experiences.

I completed the 12 Steps after 10 years of rehabs and not staying clean. When I engaged in the program, I managed 2 years clean & sober. My perceptions changed, I had a different outlook, I felt connected and whole - I didn't crave anything and many of my other compulsions quietened down - such as overeating, porn (haven't exposed myself to anything in over 6 years), shopping etc. It really gave me pause before acting and my mental executive functions were restored rather than acting on impulse and instinct and then justifying it later.

I'll attempt to get the main stumbling block out of the way first.. A higher Power

Yes -

It can be done entirely as an atheist. My sponsor was an atheist. The book repeatedly uses the word 'God' and you'll hear people use it in meetings as well. Get over it.. it's just a word and has different implications for virtually anyone you speak to.

The book insists it's a spiritual not religious program. This is true - the word God is there for a few reasons. Simplicity. And if you remove all preconceived ideas (your upbringing or exposure to religion) then you can believe in something bigger than you - I believe that many psychedelic experiences give you a taste of this. By dissolving the ego, the wall around your mind that makes you think you are an individual) you dissolve into the infinite nature of the universe. Despite the 'total abstinence' requirement of being in AA - [the founder himself believed in psychedelic therap](https://www.theguardian.com/science/2012/aug/23/lsd-help-alcoholics-theory)y that might help people have spiritual experiences and connection to the universe

If you Google things like 'looking for a higher power' there are myriad articles giving you options to explore. Don't let anyone push an idea on you. Which is how many of us felt growing up in a religious household .

At the most fundamental, the simplest thing one could start with is simply - the best version of yourself. How would someone in their right mind, who cared, who wasn't selfish or self seeking be acting.

Well, I wouldn't be lying, stealing, using drugs etc.. Many people feel that once they establish a connection with this so-called higher power, their conscience comes back. They feel the difference between right and wrong and do care more about other people.

Remember, I believe the principles are universal, despite being a book from 1930s - Yes, its very much of its time. However, it does stress that it is a God/Higher Power of YOUR own understanding. You can abandon all of your religious upbringing, brainwashing, the Bible, Christianity, Catholicism.. all of it.. And just believe in a universal consciousness or nature or whatever you damn well please..

I'm going to be going through a video called  [Why 12 Step Programs Are Toxic](https://www.youtube.com/watch?v=mzWXw24ZZtY&t=889s) and try to dispel some of the most common grievances with the fellowship, many of which appear in this video.

&#x200B;

\-

&#x200B;

***Point***: It's the only way.. if it doesn't work you're not working hard enough. Anything you do by yourself is equally likely to work as this.

***Rebuttal***: It is absolutely not the only way, it actually says so in the book - it is open to scrutiny from medical professionals or scientific investigation and it holds no monopoly on recovery.

There have been spontaneous recoveries from people that decide they have absolutely had enough and detox themselves and stay clean. However, I believe that there is a sliding scale for addiction.

In the meetings you're like to find people that have underlying mental conditions to deal with as well as addiction. There may be people in the room that simply drink to much and decide to investigate what AA is all about, then leave or cut down by themselves. There is a particular type of addict described in the book - the absolute top end of addiction. You cannot stop, no matter what. You return to it with no thought of consequences and obsess about it when you don't have it. Your thoughts are dominated by that desire, there is virtually no 'normal' thought processes whatsoever, they inevitably lead back to drinking.

Anyone below this level of obsession and mental illness may well find themselves able to recover. I myself have quit smoking, weed and a nasty addiction to GHB - no program, simply stopped. And I was heavily addicted, using all day, every day. However, I still had addictive tendencies and simply switched to other things. I've been in meetings where the subject of alcohol or drugs never came up - people began sharing about their obsessions with shopping or relationships or gambling (my sponsor along with his cocaine problem, was $25,000 in the hole and spent 4 years slowly paying it back).

This program may not work for everyone nor may it even be necessary for some. But for those that deep into the illness - it is designed for them. This accounts for why the success rate is so low. I believe it's 5-8% of people stay sober after the first year. That is terrible. But that also illustrates what a terrible illness this is. Many people need to be absolutely broken - at rock bottom - before they do take on every single suggestion and do what is suggested. Many of those people do recover when they reach that level of desperation.

***Point: Step 1*** \- You must admit you are powerless over your addiction - this is like saying 'lie down and die'

***Rebuttal***: It took me 10 years to accept this. My first rehab I refused to accept I was mentally ill. I was angry that the councillors at that place referred to it as a mental hospital. I've come to accept that this is an accurate definition of my problem. When I'm in active addiction, my decisions make no sense in retrospect and I have got myself into terrible situations. It's insane. If I did to someone else, what I've done to myself I would be charged with attempted murder!

This illness doesn't go away. If it is really a mental illness with brain involvement - issues with dopamine receptors and perhaps low neurotransmitters, and its genetic, often running in families - then I don't see what the issue is of getting this diagnosis. Once I accepted I had it, I began the process of taking responsibility for it.

I tried repeatedly, I couldn't stop myself. Always ending up in the same places I didn't want to be. I hated my life by the end of it. That, to me, is the very definition of powerless. There is a lot of semantic debate over some of the words used in a book nearly 100 years old. I think we should get over that and try to accept the principle of what is being said rather than obsess about the wording.

&#x200B;

***Step 2 - Only 'GOD' can save you and I don't see him as very active in peoples lives - he doesn't talk back***

***Rebuttal***: The issue here is that God has been personified. We've already been through the simplicity of what it could be and to reject any idea that doesn't fit your version. I personally believe that this may even just be a psychological trick - in shrinking the ego to allow for the possibility of connection with the universe (see: Psychedelic effects) it begins to reduce the chatter inside the head and feel more open. I remember this along with step 3 - I began to feel like I was inside something (the universe) instead of just a body with a head that wouldn't shut up, obsessing. However it worked, I didn't need to question it - if I feel a change, that's good enough for me.

This may be really 'out there' in terms of ideas. But there is a subreddit about '[Tulpas](https://www.reddit.com/r/Tulpas/)' - imaginary beings that you will into existence and they begin to speak back to you. Sounds like induced mental illness and schizophrenia to be honest! But let's say there is a part of the brain that can imagine something outside yourself - and you being to active it. Whether it's real or not, using that part of the brain seems to bring about psychological benefits - or you could just believe that it is the spirit of the universe you're plugging in to.

I'm sure each experience of becoming more open minded to an idea that the world doesn't revolve around you is unique. I'm not here to say what happens, I'm saying that it can be done and it seems to have positive effects. Whether you engage in cultivating the idea or you simply acknowledge something bigger than you (I rarely sat down while I was high and contemplated the immense complexity of an infinite universe. Creator or not - consciousness from the arrangement of matter is baffling and scientifically unsolvable in my opinion. Is there a quantum field of consciousness everywhere that the brain tunes into due to its arrangement. Many reputable scientific journals are allowing more papers desperate not to venture into woo-woo land, but are hinting at [panpsychism](https://aeon.co/ideas/panpsychism-is-crazy-but-its-also-most-probably-true).

TL;DR It's complicated.. almost certainly nobody has the right idea, but tapping into the belief in whatever it is seems to affect our ability to break addictive thought loops and allow pause in order to reevaluate our decision making process. A better version of me wouldn't do this..

***Point: Prayer is Magical Thinking***

***Rebuttal***:  Semantic debate. Would 'mantra' suit better? And the sustained practice of magical thinking has an effect in the brain. Sponsors tell you to pray on your resentments against people, attempting compassion and kindness instead. I don't know what sort of sponsors people get, but they should not be telling you to manifest money in your life or material goods. It should be about removing your issues, keeping a clear head through the day, making sure you stay on the right path. 

Simply - if I repeat this idea in my head, I'm more likely to accomplish it.

  
There is an incredible book called '[Altered Traits](https://www.amazon.co.uk/Altered-Traits-Science-Reveals-Meditation/dp/0399184384)'  all about meditation. No new age bullshit. No hippy stuff. Pure science. Including MRI scans of long term meditators and monks showing structural brain changes. 

The effect on the brain can all be measured. [Here is a list of the MANY types of Buddhist meditation.](https://www.bbc.co.uk/bitesize/guides/zkdbcj6/revision/3) One practice, known as loving kindness, karuna or compassion -    


""Being compassionate is part of a Buddhist’s spiritual path, and they attempt to show compassion for everyone in the world who is suffering. Buddhists accept that there is suffering in the world. Karuna teaches that a Buddhist should care for others even though they are also attempting to overcome their own suffering.""  


Placed in a brain scanner - a monk with many years of meditation and mantra (prayer) practice was able to activate at will, the part of the brain responsible for compassion and care.  


Prayer doesn't have to have the ridiculous connotations of everyone in a church bowing down and worshipping the invisible sky daddy. But if you see it as the practice of gratitude and giving thanks, that's a fantastic thing to practice so that you can choose to feel those emotions more frequently than the obsession to change how you feel through chemical means.  


\-  


I will post this here and update it as I write more. Comments welcome at this stage.",5,{},"{'label': 'NEGATIVE', 'score': 0.9912014007568359}"
2022-02-08 17:18:47,https://www.reddit.com/r/addiction/comments/snwksk/i_think_i_might_be_an_addict_and_i_need_help/,I think I might be an addict and I need help,"For background information, I’m a 19-year-old girl who’s diagnosed with ADD (same thing as ADHD minus the hyperactivity). I’ve been taking prescription Adderall since I was about 12 years old. Mind you, despite how over-prescribed Adderall supposedly is, it was something I definitely needed at the time. I had a traumatic event happen to me as a child involving my father (who was addicted to painkillers and alcohol), and I believe the trauma has something to do with my ADD because I started showing symptoms shortly afterwards, though I didn’t get medicated for it until years later. Also, I got diagnosed with PTSD and anxiety as a direct result of the trauma.

I know Adderall is a controlled substance that can lead to addiction, which is why I’m seeking answers about this. I can’t tell if what I’m going through is an addiction or not. Let me explain:

After being prescribed Adderall at age 12, I took it normally and consistently (once a day throughout the 5-day school week). I had a much easier time focusing in class and my grades improved significantly. This was the case up until I was about 15 years old, when my doctor suggested that I start taking Adderall twice a day (once in the morning, once in the evening). I started to realize how much I liked the way Adderall made me feel. Whenever I took it, it made me feel like I was capable of doing anything I put my mind to. I’d pull all nighters and spend the entire night sketching, writing, or doing anything productive, all while I popped more pills than I was supposed to take. There were times where I’d take 5 pills a day. At that point, I was also at the peak of my eating disorder (anorexia nervosa), and frequently I’d take Adderall just to get rid of my appetite. It made me lose a lot of weight.

The reason why I’m not sure if this is an addiction is because when I eventually had to stop taking it so often, I couldn’t tell whether my symptoms were from withdrawal or simply normal side effects of coming down from the medication. After spending so many days and nights on it, spending a day without it was just…exhausting. I’d be fatigued, irritable, and sometimes feel physically ill the entire day. There was a time where I binged on Adderall for nearly 48 hours, then I finally went to sleep around 3 a.m., and woke up at 8 p.m. later that same day. That long crash was most likely due to how sleep deprived I was in general, but I’ve crashed for extensive periods after taking Adderall when I wasn’t necessarily sleep deprived before.

Another thing that convinces me that this might be an addiction is already having an addictive personality, and being predisposed to addiction due to how much it runs in my family, including my father. This is what worries me the most.

Would anybody be able to tell me if it sounds like I’m addicted to Adderall or not? I realize it probably sounds like a stupid question, but drug addiction is very serious and I want to make sure I’m not blowing it out of proportion before I reach out for help. Please don’t hesitate to be honest, this is something I really want to know so I can figure out how to approach it when I talk to my loved ones about it.",12,{},"{'label': 'NEGATIVE', 'score': 0.9948752522468567}"
2022-02-08 16:34:02,https://www.reddit.com/r/addiction/comments/snviax/update_3_of_hour_11_of_being_clean_from_opioids/,Update 3 of hour 11 of being clean from opioids and cigs going through wd rn,I'm heading home with 2 of my really good friends I'm gonna tell them about my problem when we get there and that I wanna get clean  there gonna kill me for lieing to them because I did good job at hiding it also I still feel the same physically as hour 10,18,{},"{'label': 'NEGATIVE', 'score': 0.9780752658843994}"
2022-02-08 15:17:52,https://www.reddit.com/r/addiction/comments/sntqhk/how_to_stop_shopping/,how to stop shopping?,"i know it’s not the same as substance abuse, but i’ve had a shopping addiction/compulsion for a long time and i don’t know how to stop. me and my partner have been housebouncing for over a year, and soon we’ll be out of a place to live. we’re pretty much dependent on my income, but so much of it is going to clothes and i need to find a way to start really saving my money. i have been taking money out of savings when i run out of the rest of my paycheck, and i sneak clothes in so the people i live with don’t see that i’m still shopping. do you guys have any suggestions?",2,{},"{'label': 'NEGATIVE', 'score': 0.9976595640182495}"
2022-02-08 15:14:30,https://www.reddit.com/r/addiction/comments/sntnmn/ive_been_clean_for_years_but_today_is_really_hard/,"I’ve been clean for years, but today is really hard for some reason.","I temporarily transferred any money I have to my husband, since he’s out of town for work. I barely have any money anyway, but just to be safe. For some reason all I can think about right now is using and I have no idea why, nothing was triggering in particular. I deal with overdoses at work all the time and it has never bothered me. I really don’t think it’s my job. 

Does anyone else go through this? Why is this happening? It’s been three years since I did heroin and I never want to be there again. I really doubt I would use anyway, I would loose my job since I get drug tested all the time (I work in addictions/shelters). I’m going for my BA, and I don’t want to mess that up I only have a year and a half left.",3,{},"{'label': 'NEGATIVE', 'score': 0.9985754489898682}"
2022-02-08 15:04:37,https://www.reddit.com/r/addiction/comments/sntfay/need_some_advice/,Need some advice,"So I’m a student in college that is having some trouble adapting to my environment.

I went sober from adderall, nicotine, and weed January 5th. After my “sobriety date” I tripped on acid twice times and micro dosed on shrooms.

All things considered those experienced helped me break away from my addictive tendencies.

However now I am in school and I guess the stress of my new environment is causing me to want to use the psychedelics again.

There’s this little tick in my head going “remember me, I’m the addiction, the only way to get rid of me is to use acid again. Even the science backs this up. Remember your last trips. Don’t you want to get rid of me”

It doesn’t make any logical sense, using those substance would only make the addiction stronger, but that tick is still there and I think I’m just reaching out so I have someone other than me to hold myself accountable.

In terms of other addictions I have tried working out, eating healthy and doing “no-fap” as those are all things I’ve heard can help with self control. Maybe I’m pushing my limit and this is my brains way of telling me to calm down. It’s just that… well I’m a drug addict and my brain is craving drugs.

Thank you.",1,{},"{'label': 'NEGATIVE', 'score': 0.9927608966827393}"
2022-02-08 14:34:55,https://www.reddit.com/r/addiction/comments/snspvj/addicted_to_coffeecaffeine_any_advice_could_help/,Addicted to coffee/caffeine. Any advice could help.,Title sums it up.,1,{},"{'label': 'NEGATIVE', 'score': 0.7477840185165405}"
2022-02-08 13:20:03,https://www.reddit.com/r/addiction/comments/snqxuz/would_you_stop/,Would you stop...,"Masturbating if you ejaculated blood? And would you get medical attention or just wait it out?

Edit: I have not yet ejaculated blood. I was just thinking this while I was masturbating.

Edit: probably should have a small back story, sorry. I've been addicted to dopamine though masterbation since I found my dad's playboys in his closet at around age 8. I'm 40 now. I edge for as long as possible. Sober I can get maybe 30 minutes before I cum. With weed I have about a hour, but with Adderall I think my record is 10 hours straight. I can't just cum, well I can but I need that dopamine for as long as I can get it. Sometimes I stop mid stoke and just think. Today was this.",17,{},"{'label': 'NEGATIVE', 'score': 0.9980629086494446}"
2022-02-08 13:11:13,https://www.reddit.com/r/addiction/comments/snqq7z/i_cant_do_this/,I can’t do this,"I’m a 19 year old girl, I’ve dropped out of school, moved away from and partially cut off my family, stopped going out, stopped taking care of myself or caring about anything, lost all my friends- because I’m addicted to food and sugar. 

It’s so hard to talk about because it doesn’t even sound real, but I have been for years, and I keep doing more and more terrible things to allow myself to eat more. My life is just a cycle of working full time to come home and eat. Anytime I try to improve myself, or pick up old interests or hobbies, I feel depressed and unfulfilled. I feel empty and in pain at the same time, so I eat to fill the void.

I just can’t keep doing this alone, but I don’t know where to find resources for fucking FOOD addiction of all things. Idk if it’s even appropriate to talk about this on this sub. I just feel so much shame and loneliness and I can’t stop trying to shut it all out. 

Vent over I guess lol.",13,{},"{'label': 'NEGATIVE', 'score': 0.9981114864349365}"
2022-02-08 12:17:54,https://www.reddit.com/r/addiction/comments/snpflh/high_functioning_addictive_tendencies_monologue/,High functioning addictive tendencies monologue,"(22 F) I hear a lot of people say they have an “addictive personality” and I’d definitely identify with that label.
Anytime I’ve used drugs I’ve gotten hooked and wanted to do them always. I find I can’t even start smoking weed or else it quickly becomes a daily thing that I rely on. I have friends who’ve done more addictive chemicals but they don’t respond to them in the same way I do. I get hooked on ideas and can’t stop thinking about them. Right now it’s drugs, in particular Adderall (not prescribed), shrooms, and nicotine. I want to try others but my addictive tendencies have shown that when I introduce a new compound into my life it feels like it’s just one extra thing I have to work to not abuse. 

Even just nicotine I’ve watched my friends casually vape which I took too far and felt like my lungs were giving out everyday so I switched to pouches and Nicorette mints. What I deem addictive tendencies become apparent when I purposefully use drugs like nicotine and Adderall when I have no food in my system just to maximize the dopamine rush. I also crush up the Nicorettes into powder because I want it to get absorbed as quickly as possible to feel something. I love bingeing and once I start I can’t stop. Is this just the nature of being 22 years old? Do I need to engage more work than others to steer clear from substances? My father is an alcoholic and I see a lot of myself in him. We both have “ticks” that we have never been able to kick like head picking and mouth biting. I found I always take it too far though. My dad just bites the inside of his mouth like he would biting his nails but I do it in a way where I hunt for the most painful parts and bite there and then my mouth is full of blood. And I can’t stop when I start. 

All this to say, I feel shameful about my addictions to things that feel normal to others. I have an insane job in tech and a degree and work in the creative industry and I see so many people using Adderall and nicotine and caffeine and other substances unhealthily just to make a name for themselves and as a workaholic artist having unhealthy addictions almost makes it feel like I’m living the part. I don’t even know if I want to quit. I’m really curious about other drugs like MDMA and painkillers but I’m scared they’d really ruin me. Most of my friends are very straight edge so I feel alien when I talk about drugs which is a good thing I suppose that theres no external pressure to participate. I’m super stressed these days and in the dumps emotionally and it feels like I’m always just waiting for the next time I use a pouch or take shrooms or Adderall to make days less boring.

In the process of writing this I realized I should probably just go to therapy but if anyone relates or has knowledge or advice it’d be greatly appreciated.",3,{},"{'label': 'NEGATIVE', 'score': 0.9696553945541382}"
2022-02-08 11:24:44,https://www.reddit.com/r/addiction/comments/sno67v/addiction_apps/,Addiction apps,"Since I relapsed does anyone know a good addiction app tracker? I just want to keep track of my progress as I start back at zero. 

My main addiction is SH, but I also used pills in the past.",8,{},"{'label': 'NEGATIVE', 'score': 0.9972060322761536}"
