Date,URL,Title,Body,Score
2019-10-18 15:35:04,https://www.reddit.com/r/OpiatesRecovery/comments/djsllu/almost_a_year_off_subs_still_feel_like_i_was/,"Almost a year off subs, still feel like I was happier on them.","I used subs to get off Roxy and methadone and was on them several years. I don't know if this is just me being nostalgic looking back on my life around age 22-25 but I feel like i was so much happier on subs. I loved subs, they always made me feel amazing. Like a light euphoria for hours. I had so much energy, no depression, and very low anxiety on them. But I did abuse them and was obsessed and addicted to them.

I quit them almost a year ago using Kratom. I've been off Kratom a few months except for a relapse in June and July. My anxiety and depression are back ten fold even though I'm on anti depressants. I feel very unhappy and bored in life and apathetic. I miss being on subs. I still have restless legs every night. Seriously considering going back on subs if things don't get better in a few months. Any advice?",2
2019-10-18 14:07:23,https://www.reddit.com/r/OpiatesRecovery/comments/djrcnu/72_hours_no_methadone/,72 hours no methadone,"so today is my birthday! i’m 24, & this is my first birthday in 7 years that i haven’t taken any drugs. ☺️

day 3 check in 

i was able to sleep really well last night, a full 8 hours. i also went to my dance classes which are really helping. i still have chills all day & RLS at night. my joints are aching, but nothing bad still! i have been having some muscle twitching but they’re subtle. 

for anyone who is curious my highest dose was 65mg & i tapered down to 1mg over the course of a year & a half. (:",35
2019-10-18 12:49:47,https://www.reddit.com/r/OpiatesRecovery/comments/djq8hh/anyone_here_dealing_with_chronic_pain/,Anyone here dealing with chronic pain?,I've been struggling with Percocet/Hydrocodone for a few years. I'm clean now sleeping no depression. But I've been using on again off again one week a month. I don't really crave the high just the relief from this awful back injury I have. I don't like taking the pills because they fuck up my being for like 5 or 6 days after a use em for a week. I've tried everything besides a major risky surgery that surgeons say can paralyze me at worst or make the problem worse. I'm in so much pain all the time life doesn't feel worth living sometimes. I really don't know why I'm posting this. I just needed to vent I guess.,1
2019-10-18 11:15:58,https://www.reddit.com/r/OpiatesRecovery/comments/djoxc2/friday_oct_18_2019_check_in/,"Friday oct 18, 2019 check in","Hey all!!!

Today's a great day to be sober",15
2019-10-18 05:40:10,https://www.reddit.com/r/OpiatesRecovery/comments/djl3yz/does_anyone_have_experience_with_subs_in/,Does anyone have experience with subs in Indonesia. Specifically Bali.,"So, long story short, I'm delayed in Bali at the moment because my bag got stolen that included my passport. I only anticipated being here 4 days, so I only brought enough subs to cover 4 days plus 2 days extra. I've paid to have my replacement passport expedited, but I'm now on day 12 of being in Bali. I have one tiny piece of a 4mg strip left. I've been taking tiny pieces everyday, but have still been in withdrawal. I take it in the evening so I can sleep but am in withdrawal all day long. Anyone familiar with getting subs in Bali? I don't mean illegally, but if I'm perfectly honest, I'm not opposed to it. But, I want to avoid that as much as I can. I really don't want to get locked up abroad. I know there are TONS of rehab resorts here, but I don't have the money for that.
I know about kratom. I've tried it before when I was in the states and it was such a bad mistake. I will spare you the details of what happened with my bodily functions. I ended up going to the ER because I was so dehydrated. I was honest with the doc there and he said I'm either allergic to it, or there was something in it other than kratom. 
Any advice is much appreciated.

Edit: I've been on subs for 4 years. I have my empty sub box with prescription label with me. I always take the box with me when traveling. Don't know if this will even help with getting more. I just need a few days supply.",4
2019-10-18 05:01:22,https://www.reddit.com/r/OpiatesRecovery/comments/djks8x/day_5/,Day 5,[deleted],4
2019-10-17 22:53:53,https://www.reddit.com/r/OpiatesRecovery/comments/djh7d5/struggling_first_week_out_of_detox/,Struggling first week out of detox,"Sorry for the long post I just really need to vent. First time trying to kick dope, I’ve been clean from mostly fentanyl some heroin (both IV) for 8 days, been off subs for 4 days. Today was my first day in a mandatory group program and it felt like my cravings were even worse from being there. I was only using about 2-3 bags a day for 4 months and tried to kick it cold turkey but I couldn’t even make it through 2 days of the withdrawals. When I went to detox they put me on a sub taper of 8mg for 4 days then 4mg on the last day with no outpatient prescription. I thought I would be fine but having been having horrible sweats, chills, anxiety, stomach pain and cravings so today I asked the group counselor about being in a suboxone program. I was denied because of weed (I don’t have my med card but it is the only thing I’ve found to help with my depression) and that sent me into full panic mode cuz I don’t know how I can get through these feelings. My counselor said she might be able to get me in tomorrow, but all I can think about is how I have almost 3 days before my next urine test which is plenty of time for fent to get out of my system if I did it one more day. Is it even worth going on subs again, or better to just push through so I don’t have to withdraw from subs too? I was thinking of maybe just getting some weed and whipits, maybe some acid if possible, but I’m worried that they won’t help.",3
2019-10-17 20:50:58,https://www.reddit.com/r/OpiatesRecovery/comments/djfoa4/quitting_kratom_with_subs/,Quitting Kratom with Subs,"I know this is kinda ass backwards but I developed a nasty Kratom habit that has cost me thousands and ruined my marriage. So today I went to the drs for Suboxone and got a weeks supply, my plan is to do a 7 day taper while going to meetings. I don’t know the specifics of mg per day yet I’m thinking cut the dose in half everyday? Just putting this out there for the hell of it and to maybe get some support or something.",1
2019-10-17 20:17:25,https://www.reddit.com/r/OpiatesRecovery/comments/djf9hz/stomach_issues_after_quitting/,Stomach issues after quitting,"Is it normal to still have stomach issues on and off 8 weeks after quitting a 1 year habit of oxycodone and suboxone (switching in between). Such as diarreah, low appetite, etc.",6
2019-10-17 18:28:51,https://www.reddit.com/r/OpiatesRecovery/comments/djdv71/you_can_do_it/,You can do it!,[deleted],13
2019-10-17 17:22:57,https://www.reddit.com/r/OpiatesRecovery/comments/djcz5d/husband_sub_eyes/,Husband sub eyes?,[deleted],1
2019-10-17 16:31:53,https://www.reddit.com/r/OpiatesRecovery/comments/djc92q/paws_or_something_else_ladies_can_you_relate/,PAWS or something else? Ladies can you relate..,[deleted],1
2019-10-17 16:13:33,https://www.reddit.com/r/OpiatesRecovery/comments/djbzd3/day_4_instead_of_taking_the_day_off_was_doing/,"Day 4. Instead of taking the day off was doing 0.5mg every other day, I decided to go for a .25 dose which really don’t know if it did much because it got suck on my tooth 🤦‍♂️. Going to take advice those that are urging me to get as close to 0 mg as possible before jumping.","Will need to find another suboxone on the streets in order to do this. I think it’s best to get it close to0 as possible.    
Today don’t feel to bad.   BOWEL MOVEMENTS strong


3mg Kratom and a 2mg alprazolam a bow of some really potent cannabis

Despite feeling 70% and kind sick, made myself some bacon, a spinach salad and a pbj sandwich which I managed down because of the help the  alprazolam and marijuana had on my appetite.   

Going to take my ore workout after I dose 3mg kratom to make sure I can stomach it (makes me throw it ALL up very easily if I’m not careful) 
 Then his a badass leg workout.   Getting strong in the gym. Making muscle gains.  And staying the in sauna for at least 20 at the ends to put my body through stress and that the stress reaction will aid in repairing my opioid receptors.    Please pray for me fellas.  Going to pray with my pastor tonight after the gym, as well",14
2019-10-17 14:58:04,https://www.reddit.com/r/OpiatesRecovery/comments/djaw5f/52_hours_no_methadone/,52 hours no methadone.,"day 2 check in. 

i am feeling pretty good. i was able to sleep last night but i kept waking up to fidget. my chills are still bad but not severe. my joints are really achy but that’s about it, not bad at all. hopefully it stays that way! it’s raining so probably won’t be doing much but i am going to try & stay distracted! 

i ended up taking one imodium yesterday because my stomach was hurting really bad, and was having to go to the bathroom every 5 min, but after taking that i was better! 

just gotta take it one hour at a time (:",45
2019-10-17 10:12:51,https://www.reddit.com/r/OpiatesRecovery/comments/dj6yjk/thursday_17th_october_daily_checkin/,Thursday 17th October Daily Check-in,[deleted],6
2019-10-17 04:40:50,https://www.reddit.com/r/OpiatesRecovery/comments/dj3ht5/is_this_a_good_idea_or_just_my_drug_addict_mind/,Is this a good idea? Or just my drug addict mind trying to trick me.,"I have been addicted to tramadol for about 3 months, average dose, 200mg a day. Been trying to quit cold turkey the past 2 weeks. Usually make it a couple of days but can't stand the agitation, restlessness I feel. I have tried tapering down my dose, but I usually end up just eating the pills if they are sitting around my house.

I am now about 48hours since last dose, but I am struggling. I even bought some strong weed to help withdrawal, but it's not helping that much. I thought if I buy another 400mg and mix it with alot of liquid it would be easier to stick to a tapering schedule if i had to drink over 2 litres of liquid for a dose. It seems like if I have just 75mg it relieves negative effects.

Not sure if this will just delay the inevitable or legitimately make things easier and decrease the risk of me relapsing again. Anyone got an opinion on this line of thinking?",3
2019-10-16 22:16:18,https://www.reddit.com/r/OpiatesRecovery/comments/dizs9n/365_days_no_opiates/,365 days no opiates,[deleted],121
2019-10-16 22:09:41,https://www.reddit.com/r/OpiatesRecovery/comments/dizpf0/rehab_advice/,Rehab advice?,"I finally told
My family i need rehab & this weekend were picking a place and im going. Im super nervous but excited because i know this is what i need, a break from work & my home/ day to day pressures & toxicity to reflect on myself and work on my traumas in order to come out strong with new skills and a clean head to battle this addiction. This will be my first time ever going, any words of wisdom/ things I should expect and know before would be greatly appreciated, feel free to also ask me anything! Much love.",4
2019-10-16 18:22:02,https://www.reddit.com/r/OpiatesRecovery/comments/diwvyh/last_day_podcast_a_look_at_the_opioid_epidemic/,Last Day Podcast - a look at the opioid epidemic,"Harris Wittles was a writer for Parks and Recreation and a stand up comedian.   He died of a heroin overdose.  His sister has developed a podcast called Last Day, exploring different facets of the opioid epidemic.   In particular, it often focuses on family members and how they are affected by living with addicts, reliving the OD, and coping with the aftermath.  As a recovering IV heroin addict, I’ve found it very impactful.  Although I try to put myself in the shoes of my loved ones, this podcast has really hit me in the gut and made me realize just how much my actions affect those around me.  I’m constantly looking for addiction/recovery related content and find this one to be well done.  Thought I would share.",11
2019-10-16 17:27:56,https://www.reddit.com/r/OpiatesRecovery/comments/diw47z/interested_in_doing_mat_with_suboxone_scared_of/,"Interested in doing MAT with Suboxone, scared of predatory doctors","I've been a chronic relapser and have only been using fentanyl analogues since May (snorting only) and I've heard of the wonders of Suboxone for addicts like me that will go a week clean, then relapse, then withdraw again and again. I'm worried this doctor I'm seeing Monday might be only interested in prescribing Suboxone without the treatment part of it. Is this a legitimate worry or am I amping myself up? I will voice these concerns on Monday too.",1
2019-10-16 16:49:07,https://www.reddit.com/r/OpiatesRecovery/comments/divjwo/30_hours_no_methadone/,30 hours no methadone,"i dosed yesterday at 8am & i only took half of my dose which is 0.5 mg. i feel good, just a bit of restlessness, chills & anxiety. nothing too crazy though. 

i will be updating daily to keep myself accountable, & if i start feeling really shitty i will update you all! i am going to dance classes tonight so the exercise should also help! (:",15
2019-10-16 13:35:31,https://www.reddit.com/r/OpiatesRecovery/comments/disqis/7_days_clean_mental_game_hell/,"7 Days Clean, Mental Game Hell",[deleted],3
2019-10-16 11:44:33,https://www.reddit.com/r/OpiatesRecovery/comments/dir41u/day_3_current_taper_05mg_every_other_day/,Day 3 Current taper 0.5mg every other day.,"Suboxone for 2 years.  
8mg (once in the morning) for 1 month
4mg (once in the morning) 1 year
2mg for 8 months
1mg for 4 months
0.5 for 1 week 

Day 1 0.5mg (felt about 90% of what I felt on 1mg/day  but I was fine the whole day)
Day 2 0mg (woke up pretty sick.  Pretty sure it was very much mental because I wake up at 4am every morning and this day, I broke a routine I’ve had for two years.  Used 15g kratom throughout the day and 2mg alprazolam and a big joint at night to sleep. (Was able to get through work and do some chores).  *was around people doing drugs.  Was able to abstain but eventually just left early bc it was too much.  Going to be more proactive about that* I also had probably the most significant bowel movements I’ve had in a while 

Day 3 0.5mg in the morning.  Obviously feeling so much better.  Looking forward to the next taper to .25mg On day 5.    Day 2, I swear I was experiencing some emotions I haven’t felt in a long time.  Not like happiness or sadness but just a sense of familiarity that made me comfortable 


We got this guys!!",4
2019-10-16 11:04:29,https://www.reddit.com/r/OpiatesRecovery/comments/diqjpu/hour_14_again/,"hour 14 .., again",[deleted],11
2019-10-16 08:10:35,https://www.reddit.com/r/OpiatesRecovery/comments/diof0n/wednesday_16th_october_daily_checkin/,Wednesday 16th October Daily Check-in,[deleted],7
2019-10-16 07:28:27,https://www.reddit.com/r/OpiatesRecovery/comments/dinyfc/day_3_taper/,Day 3 taper,[deleted],1
2019-10-16 07:03:04,https://www.reddit.com/r/OpiatesRecovery/comments/dinowf/heroin_free_birthday/,Heroin free Birthday,Today is my birthday and for the last few birthdays 🎉🎂🎈 I have wished that I was no longer addicted to Heroin when I blew out my candles!!!! This year I'm clean!!! 74 days clean and 25 pounds heavier! So here's to the future! Good luck to all of you!,115
2019-10-16 05:52:45,https://www.reddit.com/r/OpiatesRecovery/comments/din11f/my_shitty_poem/,My shitty poem,[removed],7
2019-10-16 00:21:53,https://www.reddit.com/r/OpiatesRecovery/comments/dik16p/rls_how_i_hate_you_so_very_much_can_anyone_relate/,"RLS, how I hate you so very much, can anyone relate?","I totally understood there are far worse symptoms like acute physical withdrawals, chronic depression, feelings of emptiness, anhedonia, etc, but RLS seems to plague me every time I quit and for prolonged periods. I have stopped for 3 weeks ( a couple times in the past) and I still would get crazy upper body RLS. I’m nearing 2 weeks clean again, and I still experience RLS nearly everyday. 

It’s moderate symptoms, but it’s just so annoying. It feels like my body is broken. I wish there was something I could take to stop it (apart from opiates). Off topic, but I have experienced panic attacks while I used, and it has scarred me, I have mild PTSD from it. Every time I think of it I get the worse impending feeling of doom, a feeling I’ve never felt before. The main reason I stopped using was because of how traumatic my panic attacks got. I know time will heal this mental wound.

I just can’t  deal with the RLS; and feeling like I’m broken. Can anyone relate ? Does it get better with time? 

As usual, thank you everyone on this forum. You guys are the best. Feel free to PM or chat with me. Let’s fight this fight together.",3
2019-10-15 22:42:54,https://www.reddit.com/r/OpiatesRecovery/comments/diivt3/tips_on_quitting_when_youre_ready/,"Tips on quitting, when you’re ready","I’m not going to fire up my backstory, I’ll keep it short and say there was a bundle to 2ga day, several relapses and even a MAT once. No needles, I think a higher being gave me that phobia for a reason, I still have a hard time with blood tests @ 30yo. 

Anyway, I’m going to tell you some things that I did, that led to my most successful recovery. 

I went CT with helper meds. Had about 10mg xan/etiz, limited on purpose. Clonadine, Kava, loperamide (dosed by instructions on box), some herbal BS from the store for sleep & anxiety(minor help if any) for the 1st week. I used Kratom in a dose high enough to help WD for days 3-6 because I needed a break, but taking the 50-90g a day made my body so ill I had to stop and get back to the semiacute wds without it. 
Save your benzos for bedtime, you’ll need them.  Shake it out during the day. Drink plant based protein mix and as much water and you can hold if foods not easy. Oh, and tremendous help to THC as well as CBD. after the first few days of craziness, I was smoking weed 24/7 and taking CBD oil like it was candy. It really helps the mind slow down and the legs stop shaking for a little. After 7 days sleeping 0-1.5 hours every 24 hours, I introduced gabapentin & seroquel, at 300mg 2x a day and 50-75mg nightly. Yeah, these are all low doses for a reason, I’ll explain later. Introduced a healthy workout routine, changed some friend around, forced self care & healtier eating. Fasted 12 hours a day(not sure if it helped but some ppl say yes) I also added for the first time, a low daily dose of naltrexone. I stared with 1mg and moved up to about 3-4 a night. I think it really helped with my endorphin restoration. Gaba needs to be weened off by week 3-5 sooner the better trust me. I’ve always been an insomniac so I kept with the seroq but might seek alternatives. 


All that shit helped. But it was, and is still hard. I got clean plenty of times with subs or total excess prescription abuse to deal with the effects, before eventually just relapsing.  

I had to be ready to quit. It was taking my life from me, so I changed everything about me. I stopped taking shortcuts, I moved away from suppliers and enablers, I invested into myself and relationships, I gave back to people and I dealt with the pain because I knew I brought this upon myself. I don’t sit around and be a sea urchin when I get a hangover, because I know my dumb ass was the one that drank all night. So don’t let this long ass dope hangover ruin your week/month. Be radical, be different, live a life without the game taking up all your time. 

All this shit is brain chemicals, realize that when you’re at your worst. And remember, the first ten day are actually easier then the next 30-90. I’d rather have 2 weeks of acutes then deal with paws. But I know that RESPONSIBLE use of prescriptions that your psych will give you can allow you to make your changes easier. 


So here, cliff notes 

Day 1-8 zans, clonadine, loperamide, THC, CBD, vitimins and supplements. 

Day 8-30 lope, THC, CBD (weened back to just late PM smoke) gabapentin, serq, and LDN (low dose naltrexone) 

The longer you can wait out for meds, the better off you’ll be. Don’t touch the naltrexone until day 7. The first 3-4 days, I wouldn’t judge about a little extra spice for when you’re on fire but you really want to be on and off these meds ASAP because they’re all addictive, since you are in fact an addict. 


Be ready for it, if you’re gonna half ass recovery, you’re just setting up for failure cause trust me, they get harder every time.",10
2019-10-15 21:26:45,https://www.reddit.com/r/OpiatesRecovery/comments/dihy92/sneezing_during_wds/,Sneezing during WDs,"Hey all, just curious if any of you got the sneezes while in withdrawal, it’s just weird because the only time I used to sneeze out of the norm was after being sick for 20+ hours and once I used I would sneeze right after the first hit... is this my body trying to get itself natural “opiates” Idk why the right word for it is. But yea just weird I’ve sneezed about 20x today, and I’m at day 4 clean",1
2019-10-15 20:52:55,https://www.reddit.com/r/OpiatesRecovery/comments/dihiv9/my_cousin_overdosed_on_heroin_and_im_very_worried/,My cousin overdosed on heroin and I'm very worried. Any advice?,[deleted],2
2019-10-15 20:13:05,https://www.reddit.com/r/OpiatesRecovery/comments/dih18a/will_i_ever_feel_normal/,Will I Ever Feel ‘Normal’?,"Opiate user for 8 yrs, heavy addict the last 4. Last 2yrs I was using a lot of fent just to avoid being sick and as a result I have an extremely high tolerance. 

Anyway, I entered treatment in March of this year and have had a few 1 day relapses along the way. Ever since I got clean I’ve been overwhelmed with a constant feeling of toxicity and anxiety, though it has gotten noticeably better by this point (~7 months, though as I said that’s not continuous). My mind seems dulled, motivation shot, and I’ve had some serious bouts of depression. I was a high functioning addict in a prestigious career, and now I worry I’ll ever be able to get back to the level I’m accustomed to being able to perform at. Is my brain permanently rewired to require opiates?

Idk man but something needs to change bc I’m having trouble convincing myself that my life clean is better than my life high.",3
2019-10-15 20:11:12,https://www.reddit.com/r/OpiatesRecovery/comments/dih0bp/na_step_two_a_higher_power/,NA Step Two - A Higher Power?,[deleted],1
2019-10-15 19:53:25,https://www.reddit.com/r/OpiatesRecovery/comments/digsea/hoping_my_story_can_help_someone_out_there/,Hoping my story can help someone out there,"I was interviewed by my local newspaper this week as a ""success story"" from the bupe clinic for pregnant women we have here. I don't like putting myself out there. However, I really hope that by doing so I can inspire someone who is scared, or suffering, or embarrassed to take the next step. So, here it is.

[Interview](https://pg-share.newsslide.com/cde9da95-35d7-4265-affc-c61b00de1139/000cae9d-20dc-4edf-802a-0d0f771a2b27/)",45
2019-10-15 19:46:11,https://www.reddit.com/r/OpiatesRecovery/comments/digowx/what_is_the_order_of_your_withdrawal_symptoms/,What is the order of your withdrawal symptoms?,"Okay this is the first time I’m experiencing withdrawals so bear with me. Curious to hear if there’s a certain order. 

I’m on day 2. Slight insomnia last night, but mostly congested/runny nose, watery eyes and sneezing during the day today.

Right now the chills are coming on.

No diarrhea or nausea. My dose isn’t very high so I don’t think I’ll get those.

Appreciate all of your input",1
2019-10-15 19:26:19,https://www.reddit.com/r/OpiatesRecovery/comments/digfdl/just_struggling_a_bit_today/,Just struggling a bit today.,[deleted],3
2019-10-15 17:17:00,https://www.reddit.com/r/OpiatesRecovery/comments/diemgz/venting_and_a_question/,Venting and a question,[deleted],1
2019-10-15 16:49:42,https://www.reddit.com/r/OpiatesRecovery/comments/die7qz/trying_to_help_my_partner/,Trying to help my partner,"I married my partner earlier this year and he really is one of the most wonderful people I’ve ever met. I knew he was an opiate addict and that he was in recovery. I was there when he got off methadone and have talked him down from multiple cravings and impulses. I knew a serious relapse was a possibility and in the last four weeks it happened because i found out he’d taken out a loan in my name and used it all. We’re in the process of getting the loan cleared up but he’s been stealing from me and others. I’ve gotten his family involved who care for him but like any family there are lingering issues which make him cagey. We’re looking into rehabs to get him into because he want to go to one. I’ve never been addicted to a substance so I don’t truly understand what he’s going through. I want to help but I am exhausted from taking care of him and I need to take care of myself at some point. 

Does anyone have any advice? Anything you would have wanted to hear or have a loved one do for you in this scenario? I love him but I’m worn down and heartbroken over this.",2
