Date,URL,Title,Body,Score
2019-10-09 13:31:17,https://www.reddit.com/r/OpiatesRecovery/comments/dfkdnk/loperamide_addicted_and_now_on_suboxone_for/,Loperamide addicted and now on suboxone for withdraws.,"A little about me..... I have never done any street drugs. I am an alcoholic but been sober for one year. I am also bipolar, hate this disease!! Anyway, I started using loperamide to get away from the alcohol withdraws. At first it got me high then months later it didn’t do anything. I was taking 100 pills a day. So I quit CT and I had the worst withdrawals. They were extreme and the longer I went without the worst the withdraws. They are long last opiates. If anyone ever read “mad Margaret” then you know that she had extreme withdraws for 5 weeks then paws after.

So I couldn’t take the withdraws and got back on them. Then I tried to taper several times but couldn’t. My family wanted me off these pills and so did I. They ruin my life. So finally I convinced my family to put me on suboxone. They do not call Lope “poor man methadone” for nothing. 

Today makes a week off lope and 5 days on suboxone. The doctor started me off I 16mg - 8mg twice a day. I only been on them for 5 days now and the past 2 days, I went down to 8mg.  They are doing good and no withdraws.

I never been on suboxone but I’m only wanting to stay on them for 1-2 months. To get over the lope withdraws. These things are expensive - 250 dollars a month. My questions- should I go down even more? Will I get addicted to these things? How long should I stay on them? If lope withdraws are 5 weeks then should I stay on these for 5 weeks? Will I have withdraws from the subs?

Thanks and please stay away from lope!!!",2
2019-10-09 11:04:22,https://www.reddit.com/r/OpiatesRecovery/comments/dfiatn/gratitude_come_share_a_little_piece_of_what_you/,Gratitude! Come share a little piece of what you are grateful for.,,9
2019-10-09 10:28:52,https://www.reddit.com/r/OpiatesRecovery/comments/dfhtkl/wednesday_oct_109/,Wednesday Oct 10/9,[deleted],2
2019-10-09 05:13:16,https://www.reddit.com/r/OpiatesRecovery/comments/dfehm4/pretty_bloody_keen_for_help_serious_kidney_and/,Pretty bloody keen for help. Serious kidney and liver stress after 2-3 years of being a fuckwit with OTC codeine,"28yo male

Hey guys

I'm in a spot of serious bother and would massively appreciate some help from those of you who have kept their shit together after abusing acetaminophen and ibuprofen codeine products for a while or had issues with poly drug addictions. 

I was diagnosed adhd and take dexamphetamine and low doses of clonazepam which I usually finish within a week of a script

For nearly 3 years I've been using 5 - 12 panadeine extra (15mg codeine per tab) or 8 - 20 nurofen plus (12.8mg codeine per tab). It doesn't sound like much but it hits the spot for me and kicks me in the ass when I stop. 

I've tried CWE but can't get it right and can't really do it at my flat w partner and flatmates. 

To top that off, Im prescribed 40mg dexamphetamine per day and generally finish the scripts 1 - 2 weeks before the next payday. Probably take an average of about 70mg per day. 

I'm so  aware of the organ damage this can cause so please don't remind me. I have a degenerative eye disease and I'm going blind, plus issues with anxiety and depression. Whether these two things are correlated, I can't figure out.

I'm stressing about kidney symptoms (cloudy, foamy urine and swelling in face) and bowel problems (no strength in the pooper and can't pee properly) which are scaring the shit out of me. Constipation is a mother fucker 

I would be so grateful to hear from anyone who's been through a similar stint. If I go cold turkey on the codeine, how long will it suck for? What should I take or do to not make me go straight back to it when things get tough?

I'm also keen to know about dexamp withdrawal because that's the next milestone and that will be a world of pain I think.

I love you all and thanks in advance

TlDR: 150ish MG per day codeine habit w too much acetaminophen and ibuprofen + overdoing dexamphetamine prescription and worried about organ/other damage to my body",19
2019-10-08 20:44:47,https://www.reddit.com/r/OpiatesRecovery/comments/df9d1l/hey_opiate_addicts_i_can_help/,Hey opiate addicts I can help,"Hey guys my name is Mark, and I have to say this is my very first Reddit post. All right guys this is going to be a long post and a very deep post but the message will be clear. I'm going to start by giving everybody a little history on myself. I'm a white kid from the suburbs of Mesa, Arizona. I grew up in a broken home like the majority of everybody else. My dad took off like a bitch and my mom had to work numerous jobs and was never home.. needless to say I got to raise myself. Definitely not a good idea looking back on it lol. Got married in 2005, and because I had responsibilities now I got my first real hardcore job. I started working for a metal fabrication company that I'm not going to name. Over the course of three years I went from being the low man on the totem pole to the lead grinder at the facility. I've had this position now maybe eight months then my wife came home and told me that her boss accused her of cooking the books at the shop LOL. At the time she was like 20 and never did a county before and was not cooking the books just made a journal entry error and erased it instead of making a journal entry correction. Anyway that drove me into a horrible anger that they accused her of that and I punched the cat hut that was located in our bedroom.. and no, there was no cat in the cat hut at the time. I end up breaking the 3rd, 4th, and 5th metacarpal in my hand and thus begins my relationship with opiates. The first run I'm just going to breeze through. There was about a 9-month. Of time that I took the Percocet while dealing with surgeries. After the surgery it was hard to stop taking the low dose of Percocet I was given, but was able to stop taking them on my own I just had a rough month. Fast forward to 2009.. the day before Thanksgiving 2009, a few of my friends from out of town came in and we decided to go to the local skate park down the street. Long story short I break both of my legs. I end up going to the ER via 1998 Grand Cherokee driving like a f****** ambulance the whole way there lol. As I'm at the hospital a few of my other buddies showed up and he happened to be with somebody who referred me to a doctor for pain management. This Doctor ended up being pretty crooked and I was fully on board with it after my first run with opiates, I love them. They've been the only thing ever that has ever made me feel happiness, and real honest-to-god happy. from this point forward I proceeded to slowly destroy every aspect of my life including my marriage, job, and everything else all the way down to the relationship with family members. I continue to do this until 2014 when I ended up stealing my mother's wedding rings because she didn't wear them anymore and wouldn't notice that were missing... So I thought. My mom terrifies me, and when I found out that she knew,I have never been so scared in my life! and mind you I'm a grown ass man at this time. And when I say grown ass man, by age only at that point. I end up getting help and getting prescribed some stuff called Suboxone that 100% gave me my life back..  however they failed to tell you that you shouldn't take it for prolonged periods of time or you will just get addicted to that and have issues getting off of it. But like I said the s*** is a miracle, and did put me on the path to getting my life back. I just went to a doctor that really didn't know what he was doing I don't think. Anyways I have spent the last couple of years trying to feel somewhat normal now that there is no Suboxone and there is no opiates.. I have spent thousands of dollars on the highest grade supplements extracts and vitamins with no luck at all. for some things I even spent more money than I did on drugs just trying to get my brain to work a little bit closer to the way it did before the opiates.. to anyone who has never taken opiates, when you can't take them anymore it makes it impossible to be excited or have any kind of enthusiasm for anything. It sucks every molecule of motivation out of you every day, and every tasks are a horrible chore that you do not want to do. It makes life miserable that is why you never hear of heroin addicts really ever staying clean. It doesn't matter if 25 years pass, that shit never comes back, it's gone forever!!!!!! I cannot stress this enough to anyone is thinking about taking opiates or just started taking them don't do it, you will never be right again. I have found three supplements that actually do work and make life a lot easier for someone in the same position as myself. I'm just going to tell you the names of the vitamins I'm not going to give you a company name this is not an advertisement this s*** is from my heart and I'm trying to help somebody or anyone who has felt like me. if you really want to know where I get them sent me a message and I'll tell you.. the number one most important supplement or vitamin I take is called phenibut I take 1500 mg a day even though you should not take a daily, I do anyway. I also take a men's two-a-day vitamins that has selenium in it and then I take another supplement called redwood. these three things combined in the morning help me get through my entire 10 hour work day. it makes my life far more easier and I feel way closer to normal than without them. I hope this long-drawn-out post help somebody and please take it easy on me internet people,I've never posted anything like this before. Excuse all the punctuation errors but you get the idea",0
2019-10-08 15:00:09,https://www.reddit.com/r/OpiatesRecovery/comments/df4h3i/tuesday_october_8th_2019_check_in/,"Tuesday October 8th, 2019 check in",Sup ladies and germs?,1
2019-10-08 13:04:17,https://www.reddit.com/r/OpiatesRecovery/comments/df2vnt/feeling_so_overwhelmed/,Feeling so overwhelmed,"I hit the 3 week mark today. I feel so alone and fucking depressed. I ended a 4.5 yr toxic relationship moved out and checked myself into detox 9/16. When my ex found out she immediately tried getting back in my life. I made 60k this year so far and have nothing to show for it (except an untouchable 401k). I’m staying with friends currently while saving money to get a place. I have my job still I have family that supports me yet I am feeling so fucking sorry.

I went and copped a 1/2 G this morning and did a small amount and immediately felt so fucking guilty. I hit my bottom yet here I am. I am absolutely fucking disgusting I went and did that but I’m sick of the sleepless nights, the no energy and depression. I caved. I don’t even want to do the rest. I am scared this is going to bring me back to square 1

I’m such a sucker for beautiful women and fucking dope. I’m a smart person I was raised better than this.

In April I was clean, I ran the fucking Boston marathon, flew home and while driving home crashed and totaled my car. Flipped 5 times broke 3 vertebrae’s  in my neck. I had a past with oxy and this brought me back full swing and to heroin of all things. I’ve been able to do what I set my mind to. However this time feels different. I spent all my savings, have no where to call my own right now lost my shitty relationship. 

I dont know what the point of this is just wanted to vent and hopefully someone can relate or have been in my spot and give me some advice. I just want to be happy I know it’s not an overnight thing but fuxk.",20
2019-10-08 10:44:14,https://www.reddit.com/r/OpiatesRecovery/comments/df0xdv/xanax_for_opiate_withdrawal/,Xanax for opiate withdrawal,"Sorry if someone has posted this before, just going through hell like most of us. I have green bars that can be cut into 3rds I was wondering if anyone has used xanax to calm themselves during withdrawls.  I've never taken a benzo so I'm not going to take the whole thing but was wondering if you guys have? I don't know what else to do",2
2019-10-08 10:27:34,https://www.reddit.com/r/OpiatesRecovery/comments/df0pct/check_this_out_guys/,Check this out guys. 😊,https://www.facebook.com/TheAddictsDiary/photos/a.1612747468845280/2514688608651157?type=3&sfns=mo,0
2019-10-07 23:29:25,https://www.reddit.com/r/opiates/comments/dekhzb/sign_the_petition_for_treatment_freedom/,Let’s Start Something Big,,1
2019-10-07 19:22:31,https://www.reddit.com/r/OpiatesRecovery/comments/derlu5/struggling_with_8_mg_suboxone_beginning_taper/,"Struggling with 8 mg Suboxone, beginning taper.",[deleted],1
2019-10-07 18:23:51,https://www.reddit.com/r/OpiatesRecovery/comments/dequq1/having_a_hard_time_believing_im_clean/,Having a hard time believing I’m clean,"I’m struggling with this idea that I’m actually clean and more importantly want to be clean. I’m towards the end of my vivitrol shot and could definitely do some Fentanyl right now but it’s like... I can’t find a reason to use today? I simply don’t want to. 

There is this part of me that is more taken by surprise of the lifestyle I’m living now. When did it finally “click” with you that you’re during the right thing and accept it? Like I was on the pink cloud heavy, I would be hype af before and after meetings, now I’m just like “blah just another day”

I don’t know if any of this stuff made any sense.",2
2019-10-07 18:19:26,https://www.reddit.com/r/OpiatesRecovery/comments/deqshp/halving_my_taper_today/,Halving my taper today,[deleted],2
2019-10-07 16:47:01,https://www.reddit.com/r/OpiatesRecovery/comments/depi56/stopped_taking_naltrexone_due_to_intrusive/,Stopped taking naltrexone due to intrusive suicidal and “theres no point in living” thoughts. Relapsed 2 weeks later after off naltrexone. Unsure what to do now,[deleted],2
2019-10-07 13:19:21,https://www.reddit.com/r/OpiatesRecovery/comments/demjg7/vivitrol_not_working/,Vivitrol not working?,"So I got the vivitrol shot twice bc I was addicted to fent and was on subs but detoxed off those so I could do vivitrol instead. The first time i got the shot it didnt help with cravings but i didnt try and use on it at all i relapsed after it had worn off and ended up going back to rehab and getting the shot again. This time tho I decided to drink after a week and a half and felt the full effect including euphoria but I still thought it would block opiates and I wanted to get high so I ended up smoking crack. Once the crack was gone my comedown was bad and my friend had gotten fetty and told me to just try to use it for the comedown so I sniffed a smallish bump and got fucking blasted, the vivitrol didnt work at all to block the opiates and I def didnt push through it bc I literally shoot a shit ton of fent and this time I literally sniffed not even a big bump and still was nodding and everything so I continued to use for the next 2 months including while vivitrol was supposedly in my system. Does anyone have any idea why it just didn't work for me, I literally detoxed cold Turkey off subs for no reason bc now I'm back on them for cravings bc the vivitrol didnt work and the subs do, I'm pretty frustrated bc I was hoping it would work for me",2
2019-10-07 08:19:37,https://www.reddit.com/r/OpiatesRecovery/comments/deinms/monday_october_7th_check_in/,Monday October 7th Check In,,3
2019-10-07 06:51:44,https://www.reddit.com/r/OpiatesRecovery/comments/dehsey/im_hoping_you_can_help_me_i_just_realized_that/,I’m hoping you can help me. I just realized that taking kratom is making me feel sick (withdraws). Not my anxiety.,"I just realized today I need to get off kratom. I haven’t found a group that is active. However, kratom withdraws are very similar to opiate withdraws. My withdraws start about 12 hours of last use. 

How do I start tapering. I am thinking I need to first write down how much I am taking 1st. Then slowly take less. 

I have Lyrica and Xanax for help. 

Need some advice to start and work on my taper. Any suggestions on supplements to help bring back dopamine levels back to normal.",3
2019-10-07 02:35:56,https://www.reddit.com/r/OpiatesRecovery/comments/defpr6/im_only_human/,Im only human,"Day 60-something... im walking talking and joking, but im a hollowed out version of myself that i remember. That evil little voice keeps whispering in my ear how life is fucked, and i have an easy escape with my tolerance so low. This feeling is constant tonight. I know its bullshit, but its there.  Combine this with the shame of being a fucken addict, and its a real shit show. Thank fuck that smoking weed calms my violent legs from kicking a hole in the sheetrock.. im doing this whole thing alone which im sure makes shit harder. I asked somebody at dinner to pray for me. How fucked is That? I feel like im running out of gas in this fight..like a boxer in the later rounds.... if u have anything productive to say, now the time to say it. Im jammed up, but not giving up yet..i could really just use some support",5
2019-10-07 02:17:57,https://www.reddit.com/r/OpiatesRecovery/comments/defk51/small_victories_keeping_me_grounded/,Small victories keeping me grounded,"First I'll share my personal win; went to my regular gas station to pick up a couple packs of cigarettes, and while in line an middle aged fella makes conversation with me about money, drug dealing, and then he says ""you know anyone who fw pain?"" and I responded ""Man, you bet I do. If you asked another day I'd be hitting your line, but I got a problem with that shit, and I'm dealing with the consequences."" He was first surprised, and then smiled and apologized profusely for tempting me. I paid and left.

Day 3.. 
I've been slipping up nearly once a week after hitting 30 days for the first time in many years a month ago. I began lowering the amount of Suboxone I take to a minimal amount, and then skipping a day before I planned to get high. This is no longer an option. I'm going to take my medicine as prescribed until I am in a good condition, with the right support and tools for my next step in recovery. I've never cared much for NA, but I am going to hit a meeting tomorrow. Hope everyone is well ♡

Tl;dr: denied a potential new opiate plug in public on day 3. Diving back into daily focus on recovery.",4
2019-10-06 22:23:56,https://www.reddit.com/r/OpiatesRecovery/comments/ded9il/new_to_this_sub_need_some_help_and_would_like_to/,"New to this sub, need some help and would like to hear other people’s experiences",[deleted],2
2019-10-06 21:48:32,https://www.reddit.com/r/OpiatesRecovery/comments/decvcj/selftapering_hydromorphone/,Self-tapering Hydromorphone,"It's been quite a year for me. Thanks to my girlfriend/wife/mother of my child. She's been pushing me to get out of this habit. We've fought alot, I've made alot of promises, and broke twice as many.

But over this year one thing has been constantly changing. I have steadily been wanting to quit and putting in more effort. Before I had this women breathing down my neck wanting me to stop before our baby is born I didn't see the problem and was up to between 30mg to 50mg hydromorphone a day.

So, here I am, steadily tapering my dose.

~~~~~~~~~~~~~~~~~~~~~~~~~~~~~~~~~~~~~~~~~
Highest dose(common dose): 20mg through 50mg(during the peak of my addiction I would go through 140mg in 3 to 5 days spending 3 to 4 days in W/D :( 
ROA: Insufflation(plugging never seemed to give me any effect simply wasting the drug.)
September 1st: 20mg once a day @ 22:00
September 25th(until now): 10mg once a day @ 22:00
October 6th: The plan is to reduce 25% per 7 to 14 days resulting in dropping to zero-use within 30 to 60 days.
~~~~~~~~~~~~~~~~~~~~~~~~~~~~~~~~~~~~~~~~~

Am I doing this right? I've never had to do this before and my doctor knows that I have this addiction now. I thought of asking her to help me with this plan and (maybe) she could perscribe the hydromorphone needed for this tapering plan, but I don't want her thinking I am simply seeking a high from her perscription.

Any advice? Thoughts? I tried CT.....it worked for 7 days before constantly relapsing.",3
2019-10-06 20:03:14,https://www.reddit.com/r/OpiatesRecovery/comments/debmv6/will_it_get_better/,Will it get better???,I been an opiate user for years now. I tried kicking it months ago and simply didn’t work out the anxiety and cravings were the devil itself.. I have a full bottle of pills yet I don’t feel the urge to take them today I want my sober life back. I’m 32 no friends no job no motivation to even get up and clean my house. I don’t answer no calls or text everyday is drag & dreadful and let’s not talk about the depression I see life so non existent I ask myself when I see strangers how do they cope with this thing called life. A trip to the super market is a challenge. I don’t have energy or motivation to even eat.I’m sorry guys I know I need to toughen up and get positive & get off my ass had be productive yet I pray to god to help me reach that level of energy.,18
2019-10-06 14:17:24,https://www.reddit.com/r/OpiatesRecovery/comments/de70oc/day_1/,Day 1,"So today will be the first day of my recovery. For anyone out of context I made a post yesterday about moving to my sisters place for a week to detox from a 2g a day heroin habit.

Today I arrived and I'm planning on doing my last dose tonight before bed.
I already ate a tasty ass Pizza and am watching a movie on Netflix right now. So far so good.

I will use the clonazepam I have to help with sleep and RLS. Also I'm stocked up on comfort food like ramen and keep myself busy with petting her adorable cats.

I will keep you guys updated tomorrow when the real struggle is going to begin. Wish me luck friends, I'm seeing this as the single best chance I get to sober up and finally change my life for the better.

I hope everone is having a good day and does something you love. Peace out!",14
2019-10-06 13:55:42,https://www.reddit.com/r/OpiatesRecovery/comments/de6p3l/hit_500_days_yesterday/,Hit 500 days yesterday.,"[500 Days Down](https://imgur.com/I9DqxHg.jpg)

I am so thankful to YOU all, in this sub. I am so happy I found it. My life has gotten so much healthier in every way and I wouldn't trade it for the world. It feels so damn good.

**Just. Keep. Going.**

**edit:** in case anyone is wondering, yes, that money saved number is accurate. Crazy.",86
2019-10-06 08:59:16,https://www.reddit.com/r/OpiatesRecovery/comments/de2wu1/101_days/,101 days,I’ve made it 101 days. I wish i could say there’s some miraculous wonder that’s happened in my life but there’s not. Every single day is a struggle. My friend had surgery last week and offered me some pills which i turned down. I was proud but my mind tried to trick me by saying “just a few won’t hurt”. She’s been on and off pain medication for 10+ years and doesn’t recognize her withdrawals as withdrawals. Her brother died of an overdose a few years back. I want to help her but she doesn’t recognize it as a problem because she is high functioning. Today is not the best day for me...I’m trying to quit smoking with chantix which I’m pretty sure is making me a mean hateful person at the moment but figured it’s was worth a shot. Just wanted to give everyone an update.,46
2019-10-05 19:47:37,https://www.reddit.com/r/OpiatesRecovery/comments/ddvf9j/does_xanax_extend_withdrawals/,Does Xanax extend withdrawals?,[deleted],2
2019-10-05 19:12:16,https://www.reddit.com/r/OpiatesRecovery/comments/dduz76/decided_to_relapse_on_day_7/,Decided to relapse on day 7,"I'm really tired of this routine. I went to Detox at the end of July and wasn't able to attend IOP that I was set up for because I knew someone in there. I ended up getting a suboxone doctor a few weeks larer, and while that helps most days, I can decide not to take it for a little while in order to get high. I moved right back in with my ex, who is also a chronic relapser. We will go 10 days, use, 30 days use, 7 days, use... last night I got so messed up, and now I don't want to stop. I don't think I'm going to be able to do it without rehab, man. Especially here. I dunno how to tell my probation officer... I am required to go, if I do, in the state if Georgia. My family is finally healing because they think I'm doing okay... I've yet to go to rehab, but I've been struggling for years. It's so hard to look at my mother and father and ask for help. 

Tl;dr: chronic relapser IV heroin/fent just wants someone to help escape addiction",5
