Date,URL,Title,Body,Score
2019-10-30 23:43:53,https://www.reddit.com/r/OpiatesRecovery/comments/dpi2ul/my_girl_and_i_are_two_days_in_from_smoking_6/,My girl and I are two days in from smoking 6 grams of black a day., We were smoking 6 grams between us every two days.  We both decided it was time. So we got loaded waiting 25 hours than took 4mg sub. Mind u we have a huge bottle of gaba 600mg and xanax 2mg and Valium 10mg. So let’s say it’s going well. All I’m saying is if u prep enough ur good. Haven’t had shot of wd really. Just stay strong everyone. This was a 12 year run for me. Best of luck I hope this helps someone.,2
2019-10-30 23:29:52,https://www.reddit.com/r/OpiatesRecovery/comments/dphxlk/welp/,Welp,"Today is almost my 41st day off oxys and 17th day off subs and today’s the first day that I had to face life (shit) hitting the fan while sober. My car has been giving me trouble for like a month now. Nothing too major...until today. Something punctured my oil pan on my way home from work today. I obviously immediately had to stop driving the car because it can burn up your engine completely otherwise - even I know that much. I literally just sat in my car and bawled for a good 15 minutes because I’m so sick of the shit that keeps happening with my car. Plus, I haven’t been saving to buy a new car, so I was just panic stricken and overall sad about wtf I was going to do. It’s the first time since I started my recovery that I was really thinking about relapse and how nice it’d be to have something to take the edge off of such a horrible situation. Anyway, long story short, I’m having my car towed tomorrow morning to a dealership. It’s a 2010 car, so if it’s more than $1,000 to fix it, I’m just going to say fuck it and buy a new one off the lot. Probably not financially wise since I have next to nothing as a down payment if I buy one tomorrow, but my car is like $3-4K max at resale value anyway. Why pour all this money for it to crap out on me again next month for something else?? Anyway, I’m ranting. But I’ve calmed down and I’m actually really proud of myself that I didn’t immediately call an Uber to go get high. I still don’t even feel physically great, much less mentally/emotionally with all this new bullshit. First of many of the trials and tribulations of sober life to come, I suppose! Lol",2
2019-10-30 17:03:45,https://www.reddit.com/r/OpiatesRecovery/comments/dpctpw/suboxone_faqs_an_extensive_guide_to_all_things/,"Suboxone FAQs - an extensive guide to all things buprenorphine for those who take it, are considering it, or may have questions/need info about it :)","Hey guys, heres an xpost of an extensive writeup i did of bupe for Suboxone FAQs for my sidebar on r/opiates. figured id share it here since some of you recovery folks are suboxone users, and some people that join here often have suboxone questions or looking for info etc. figured this may be a helpful resource to share with yall :)
---


#BUPRENORPHINE/SUBOXONE FAQs 
####a reference guide for all things bupe related
--- 

###Sub/Bupe defined; Available formulations & dosages; What it is prescribed for & who can prescribe it:

**What is suboxone?** Suboxone is a brand name drug manufactured by Reckitt-Benckiser that is a combination of buprenorphine and naloxone in a 4:1 ratio. It is a powerful semi-synthetic opioid that is most commonly used as a maintenance medication for people that are opioid dependent; however it can also be used for a couple other purposes that will be covered in this guide. It is the preferred medication for maintenance treatment because it is only a partial agonist and doesn't have all the awesome euphoria associated with most opioids. It also has a ceiling effect that keeps people from just upping the dose through the rough and getting high like with methadone.

**What forms and doses does it typically come in?**

Suboxone strips(or generic strips): buprenorphine / naloxone 4:1.

Subutex: buprenorphine 

Generic tablets: buprenorphine/ naloxone 4:1

*DOSES AVAILABLE*: 2mg, 4mg, 8mg, 12mg

**Lesser common formulations of bupe:**

Zubsolv: slightly differing from suboxone, Zubsolv is made with a different formulation that allows the body to absorb it better than it does suboxone - which therefore increases it's bioavailability in comparison. It comes in 2 strengths: 1.4mg bupe/0.36mg nalox (equivalent to 2mg bupe/0.5mg suboxone), and 5.7mg bupe/1.4mg nalox (equivalent to 8mg bupe/2mg  suboxone). This form of bupe also is known for its minty taste, while subs are citrusy. 

Butrans Patch: skin patch containing buprenorphine, worn for round-the-clock treatment used in Pain Management for moderate to severe chronic pain. 

Sublocade: a buprenorphine injection, typically received once per month, that has a different delivery mechanism and different requirements than the other available forms of bupe/sub. [Here](https://www.drugs.com/sublocade.html) is a good reference that breaks down the info about the injection and explains its uses, doses, mechanism, and how to get approved for this type of bupe treatment. 

**What is bupe/sub prescribed for & Who Can Prescribe it?**

Most commonly used in addiction treatment as a form of MAT (medication assisted treatment) for those opioid dependent. It blocks full agonists which discourages use/relapse while taking it, and is known to help many people with cravings.

It is sometimes used in Pain Management, and while some do not find it to be effective in treating their chronic pain many people do find success with this treatment and benefit from bupe's good analgesic properties, which are often found best effective for pain in low doses under 1mg.

Less common, bupe is being used in some studies and medical facilities off-label in managing depression in patients with treatment resistant depression.

Buprenorphine can only be prescribed by certain physicians, requiring a special course & license in order to be able to prescribe it. It is typically prescribed by addiction specialists, pain management doctors, sometimes psychiatrists.

**How many times a day should bupe be taken?**

Ideally it is best to try and stabilize and stick with taking your dose just once a day, as part of MAT encourages this to help discontinue addict behaviors like redosing. However, some people swear by doing best on ""split dosing"" aka dosing twice a day, and this dosing regimen is frequently used when taking bupe for pain management purposes. 

**Can you take bupe/sub while pregnant?**

Buprenorphine on its own is safe to take during pregnancy, however Suboxone is NOT due to naloxone being potentially harmful to fetuses. Pregnant women on suboxone are switched to subutex, and typically advised to not discontinue their bupe treatment during the pregnancy as the withdrawal symptoms from discontinuation and/or dose fluctuation would be more harmful on the fetus than the medication itself.

###When to induce bupe; Precipitated Withdrawals; How to best induce

-Buprenorphine needs to be induced when a person is already in moderate to severe withdrawal. There is no set amount of time after your last opioid dose that you must wait, as it really relies on your symptoms, but waiting at least 24 hours is a pretty standard and safe way to go. However, you should use the COWS scale to rank your withdrawal symptoms when determining the right time to begin induction.

-If you induce bupe too soon, you can very likely experience precipitated withdrawals (PWDs). This occurs when you still have full agonist opioids on your receptors, take your bupe too soon, which then rips the full agonist off very uncomfortably and throws you into a horrible, magnified withdrawal that is worse than typical WD and can last hours. 

**NOTE: it is a common myth that the naloxone in suboxone is what causes PWD, and also that under that notion subutex will not cause PWD. THIS IS INCORRECT!!  PWD is caused by buprenorphine, not the naloxone! Bupe has a higher binding affinity than naloxone. Also, the naloxone is only added as  an IV abuse deterrent... the nalox has a very low BA sublingually (around 2%) and is essentially inactive, but it does have more effect and impact via IV.**

-To induce bupe once you've determined you're ready and safe to do so, while many doctors (who drastically overprescribe) tell you to take an entire 8mg as your first dose... in my extended experience and extensive research over the years, i've found that it's best to begin with a small amount and work your way up higher as needed. A good start would be taking 1-2mg, waiting an hour to gauge how you feel before adding on, and then if your symptoms still have not subsided induce another 1-2mg every hour until you are reasonably comfortable. Its common to begin your sub use on higher doses such as 8-16mg; however it is often unnecessary to go that high and its better to get by on as low of a dose as you can stabilize on.


**The Bernese Method of Induction**

For those that struggle to wait the 24+ hour period of sickness before they can take sub, there is a method available that if done right will make the transition much smoother, called the Bernese Method.

This method is the use of bupe alongside your full agonist opiate for a short period, taking the bupe in micro amounts that gradually increase while your dose of full agonist gradually decreases. What this does is allows bupe to start binding to your receptors and creating a buildup, but due to the low amount and the full agonist taken on top of it you wont experience PWD while this happens. As your system begins to have bupe built up on your receptors, it makes dropping off your full agonist and all the way onto a higher dose of the bupe essentially painless.

An example of how this is done: In this example we're looking at a 5 day schedule, with bupe increasing in very small amounts while your full agonist will decrease by 20% each day. For this example lets assume your habit is 1gram of heroin per day. Here is how you could use the Bernese Method to induce bupe:

*Starting point: 1g dope, 0mg bupe

*Day 1: 0.125mg bupe, then 0.8g dope

*Day 2: 0.25mg bupe, then 0.6g dope

*Day 3: 0.5mg bupe, then 0.4g dope

*Day 4: 0.75mg bupe, then 0.2g dope

*Day 5: 1mg bupe, 0 dope. Now that you've dropped your full agonist, you can begin increasing your bupe using the same method described above for regular induction, until you reach a dose you can stabilize on.

###Getting on bupe: cost; how to obtain a prescription

**How to get a prescription:** you can use suboxone.com to browse for doctors in your area, or google ""suboxone doctors in my area"" or something of the sort. also, if you have insurance you can call your provider and ask for doctors that accept your plan that way. Once you've found a doctor, you'll go in for an intake. Expect a UA at this, and every visit. You must fail for opiates or buprenorphine generally in order to be scripted on your intake appointment. As long as you go to your intake, drop a dirty UA, and pay - you should be walking out the door that day with your script. Some places will make you go weekly or biweekly at first or if you come in with dirty UAs. Some places will script you a month at a time as long as you pass your UA. It varies a little bit for each person, but many times you will start out scripted 8-16mg a day.

**Cost:** This varies quite a bit, based on whether or not you have insurance and on your location. Many places will still charge a cash copay too even if you do have insurance coverage, but your script should be mostly (if not fully) covered by the insurance.

Typically an intake visit runs from around 200-350$, and then goes down in future visits to a lesser amount ranging from around 100-200$.

Without insurance, you can get the generic bupe tablets for like $3ea with coupon that is available online.

**Bonus- street cost**: Some of us cannot afford to obtain a script the legitimate way, or just cant have access for whatever reason. But good thing thanks to overprescribing, the streets are flooded with subs in many areas. The price varies state to state, going from $10ea at minimum to $25ea at maximum. $15 or so could be considered the average, and if you choose the Dark Web route the average cost is generally ~$15ea-$20ea. (these prices are all based on 8mg doses, which is the most commonly scripted strip/pill and is most commonly found on the black market)

###Getting off bupe: Disproving horror stories; Proper Tapering; How to approach a proper taper

*Getting off bupe can be difficult, but it does NOT at all have to be what people make it out to be. If you do it the right way!*

**Disputing horror stories:** People often say how horrible it is to come off subs, how its worse than dope, how its not worth it to go on them at all due to the detox, that its hell etc. However, its very likely that 95% of these people did not do a proper taper. They either jumped too high, tapered too fast, or didnt taper at all and cold turkeyed it. If you do any of those things, you will have a horror story.

**Properly Tapering:** Tapering off subs can be a process that takes a bit of time, patience, and committment. Its common for the taper process to take weeks or months.  The specifics that will make up your  best available taper will vary from person to person - depending mostly on your daily dosage, how long you've been taking it, and your the supply/amount you have available to work with. 

**How to approach a proper taper**: Of course doing this under the guidance and supervision of a medical professional is the ideal way to go. But if you are  going to/have to taper off on your own, there are helpful resources available that can point you in the right direction. [Here](http://www.helpmegetoffdrugs.com/taper) is a very informative website that can be extremely helpful for those looking to taper, and it even offers a suggested taper schedule calculator based on your current stable dose. 

*I (u/chasingd0pamine) also write custom tapers for fellow redditors, that i carefully put together using the details of your specific situation and customize for each individual person. Note, once again I am not a doctor myself but have extensive knowledge/experience of buprenorphine, its pharmacology, and the proper procedures involved in getting on/off the drug - and have put together probably between 30-40 tapers for people. These tapers i write are merely suggestions - not medical advice - and i simply offer this service as an additional option for those coming off bupe to try out.*


###Routes of Administration (ROAs) & their Bioavailabilities

*The prescribed way to take it is sublingually - dissolved under the tongue. but there are other ways, which do have higher bioavailabilities. I am not suggesting anyone abuse their meds, but if you can cut your dose by using another ROA you can cut your cost and make this more affordable. However a warning: once you switch your ROA from sublingual use to another form of ingestion, it can be very difficult to break that habit and go back to sublingual dosing in the future*

Sublingual: 30%

Intranasal: 45%

Rectal: 54%

IV: 100%

###Breaking through bupe/using after bupe; recreational value

**Attempting breakthrough:** It is extremely dangerous to try and break through your dose to get high. If you are going to use, it really depends on your bupe dose but youll typically need to wait 24-48 hours in order to get high. sometimes more if you are on a high dose of sub and have been on it for a while. 

**Recreational Value:** Bupe can have a recreational value to some users, but really just to those who have a very low tolerance. Remember that less is more when taking it to get high, and that it is very potent and sometimes makes people sick when they are trying to get high off it. 

##Suboxone Maintenance: benefits; clean vs not

-Benefits: Choosing bupe is not for everyone, but it saves many lives. It is great for chronic relapsers, for those who need a stepping stone while rebuilding their lives and working recovery, for those who have pain and are also an addict, etc.

-Clean or not?: This question gets asked a lot here and there is no right answer for it. Suboxone can greatly assist in working your recovery, making personal progress, rebuilding your life, getting off dope when nothing else seems to stop you, saving your life, and so on. To those that are in NA and/or are fully abstinent from all opiates and drugs, then no they wont consider you clean. But if you are clean from your opiate abuse, from full agonists, from your addiction, and are using it as intended then that can be considered clean too.",8
2019-10-30 14:58:38,https://www.reddit.com/r/OpiatesRecovery/comments/dpb2ap/work_motivation/,Work motivation,Would like to hear some stories of you guys going through withdrawal while at work. Just picked up a second job and am dreading it. The work is easy but feeling like shit certainly don't help. What sort of work do you do? What did you have to go through? And how did you go through with it?,1
2019-10-30 14:22:24,https://www.reddit.com/r/OpiatesRecovery/comments/dpakc7/jumping_off/,Jumping off,"I made the decision to jump off suboxone, 2-4 mg.  I've been using it for five months to try and kick an eleven year oxycodone habit.  I've never come off suboxone before so i don't know what to expect.  It's day 2 and it feels bad, but not horrible.  I tried to taper but if i have them, I'll take them, so i made the decision to quit. I've done this more times than i can count but this time is different.  A lot of people in my life found out and this is my last chance to quit and preserve the relationships I've damaged so much.  The pressure of knowing ""this has to be it"" is scary.  My husband is supportive, but i broke his trust and confidence in me.  I've read suboxone withdrawal can be longer than other opiates which makes me nervous.  I've been clean for months at a time, and  usually relapse 5-8 months out.  But I need to shake this demon once and for all.  I want to maintain some semblance of self respect.  I don't want to feel the familiar deep depression and fear when I begin to go into withdrawal.  I'm losing myself to this.  I need to get rid of this voice in my head that says, ""what makes you think you can do it this time""?",2
2019-10-30 13:37:36,https://www.reddit.com/r/OpiatesRecovery/comments/dp9y4b/advice_on_jumping/,Advice on jumping,"Hi, i had a pretty bad fentanyl habit and after a couple od's I decided enough was enough I stopped cold turkey from about a gram a day(dont know the actual amount of fentanyl) for about a week I couldn't move but the physical symptoms got better, although the real wd was just starting. I went clean for about a month. My family saw very clearly how bad my paws were and they along with a doctor convinced me to go on suboxon for the fear of relapse. I must say this is the worst decision I made. I started off at 8mg with basically no tolerance and being a addict I didnt complain, i was getting very high and for free as well off the suboxone. 

Cut to about 8 months later I am on my third day of .5 mg. The only wd i ever felt was the jump from 2 to 1 mg and that was only some insomnia and some nasua in the morning. So far I am 3 days into .5 mg and I feel perfectly fine have not noticed any change. I would go as far as to say I feel better mentally, happier. One part I left out was for the suboxone treatment I came back home to where I was originally from, to minimize risk of relapse. This was my families idea and they agreed to send me money for anything I needed to help me get through this. They have been extremely supportive. But I just had enough of laying around all day and I needed to go back to Canada and resume my life so after my last visit with the doc and he gave me the prescription for .5mg for 2 weeks i booked a ticket back to canada. Now looking at it I have enough suboxone for 2 weeks for .5mg a day and I dont if he'll give me another script. I have a appointment with him 2 days before my flight. So my question is really what can I expect jumping of at .5mg and what advice would you guys give me to make the jump easier. I was thinking of going down to .25mg in a week and then staying in that for a week, then taking the remainder with me and just taking  .25 when I really need it. Im gonna back to work as soon as I get back to help take my mind of any wd.",1
2019-10-30 13:06:40,https://www.reddit.com/r/OpiatesRecovery/comments/dp9ibi/i_broke_im_going_to_rehab/,"I broke, I’m going to rehab","My dad has tramadol and I couldn’t take it anymore I told him. He thought I just had the flu. He took my girls to school then asked if I needed to go. I said yes. So here I am, waiting for laundry to be done so I can go. Thanks for the support. Love you all",77
2019-10-30 12:52:16,https://www.reddit.com/r/OpiatesRecovery/comments/dp9cxp/coming_clean/,Coming clean,[deleted],9
2019-10-30 11:49:53,https://www.reddit.com/r/OpiatesRecovery/comments/dp8l51/day_4_of_heroin_withdrawals_cold_turkey/,Day 4 of heroin withdrawals cold turkey,Today is day 4 the past 3 days have been total hell I've been in so much pain and haven't slept at all. I'm going totally crazy and been hallucinating cause of lack of sleep. I went to my doctor today and he prescribed me 0.25mg of alprazolam and told me to have one. I really need to sleep soon and I'll take one pill will I be able to sleep a little atleast.,15
2019-10-30 11:09:48,https://www.reddit.com/r/OpiatesRecovery/comments/dp81fz/my_teeth_feel_better_after_quitting_vaping_h/,My teeth feel better after quitting vaping H,"Anybody else? For some reason that shit hurt my teeth a lot, the pain would move around too, but 3 days out its disappeared and I’ve stopped vaping for quite awhile before so I know it was that. I wouldn’t get it if I snorted, but when I would vape I’d get weird pains. Just counting the benefits.",2
2019-10-30 10:06:44,https://www.reddit.com/r/OpiatesRecovery/comments/dp77jn/day_3/,Day 3,"Well made it to day 3, developed a nasty cough that kept me awake most of the night. Doing this with a cold may not have been the best idea, combination producing a lot of fluids is bad, but it may end up working out. Going to work, hopefully I can check out early today. Tomorrow is a half day so it’s almost day 4, just get thru this bitch and I’m in good shape.",9
2019-10-30 09:00:42,https://www.reddit.com/r/OpiatesRecovery/comments/dp6er4/can_i_help_a_friend/,Can I help a friend?,"My friend has lost everything recently— her home, her kids, her husband, her car. She has severe pain issues including dental issues to the point they need to do reconstructive surgery on her jaw, a congenital issue where her legs are kinda twisted, trigger finger, and arthritis. I was just hoping to get her a place to stay and get her off street drugs and onto legitimate prescriptions. She says she’s kicked so many times but she’s always in debilitating pain. She’s considering coming to the room I found her and using kratom to manage the withdrawals from H. She needs to be clean, or at least legal, if she’s going to fight for her kids. What’s to be done when opiates are ruining your life but you’re legitimacy in so much pain?",6
2019-10-30 08:43:54,https://www.reddit.com/r/OpiatesRecovery/comments/dp67qx/im_trying_to_wean_and_i_need_advice_can_anyone/,"I'm trying to wean and I need advice, can anyone help?",[deleted],3
2019-10-30 07:22:50,https://www.reddit.com/r/OpiatesRecovery/comments/dp5d5f/day_3_ct/,Day 3 CT,[deleted],1
2019-10-30 07:16:49,https://www.reddit.com/r/OpiatesRecovery/comments/dp5ayx/wednesday_30th_october_daily_checkin/,Wednesday 30th October Daily Check-in,[deleted],7
2019-10-30 05:14:16,https://www.reddit.com/r/OpiatesRecovery/comments/dp4861/whats_going_on/,What’s going on?,[deleted],1
2019-10-30 02:02:33,https://www.reddit.com/r/OpiatesRecovery/comments/dp2q0e/what_day_do_the_intense_cravings_lessen/,What day do the intense cravings lessen?,"Just curious, I know with something like cocaine for me, the intense cravings subside at day 3 and turn into more thoughts like it’d be nice to do more, but I don’t really want to. What about H? When does it change from a craving with feeling to more of a thought that doesn’t have so much power behind it. It’s my first withdrawal from this substance and god damn if those cravings don’t get bad the closer it is to the evening. Anyways, would appreciate how you experience. I’m good at blocking pain or ignoring it, so the physical ness isn’t too bad, but I’m also a weak at denying pleasure, so the mental part is yelling at me to go get more. Nope.",1
2019-10-30 01:02:05,https://www.reddit.com/r/OpiatesRecovery/comments/dp27o6/plan_to_quit_kratom_can_someone_help_me/,Plan to quit kraTom can someone help me!,[deleted],2
2019-10-30 00:46:00,https://www.reddit.com/r/OpiatesRecovery/comments/dp22fk/how_can_i_suffer_the_least/,How can I suffer the least?,[deleted],2
