Date,URL,Title,Body,Score
2019-10-28 08:01:07,https://www.reddit.com/r/OpiatesRecovery/comments/do7v1g/loperamide_volumetric_dosing_and_taper_questions/,Loperamide volumetric dosing and taper questions?,"So I'm a few months of bupe CT and 5 days from chipping codeine 60mg about 3 times a week. Before chipping codeine my bowels where still quite loose with no signs of improvement and I beleive it will be a while still before they get better.

Questions.

What solvent would he best? Polypropylene glycol or alcohol? Assuming water won't be any good but am researching atm. Have PG ready so would rather use that.

How much loperamide per ml of solvent? There is fillers in the capsules so that will probably need to be accounted for. I haven't found any info for the solubility yet but assume 1mg/ml should be fine.

Dosing and taper schedule? I am thinking of starting at 1mg and hoping to dose every other day but have no idea when or how much to drop by for the taper.

If anyone knows anywhere else I could ask these questions or has any experience with this please pet me know.

Edit: After putting 2mg into 2ml of propylene glycol the solution looks a little cloudy after 15 minutes and there's sediment settling at the bottom. The Lope should be dissolved right? If I siphone off the liquid it should be fine to assume that there's 2mg of lope to 2ml of pg?",1
2019-10-28 07:39:15,https://www.reddit.com/r/OpiatesRecovery/comments/do7n0o/first_probation_ua/,First Probation UA,Wanted to get some opinions on people who have been through this. What would the consequences be if you piss dirty on your first UA for probation? If you were to tell the Probation officer that you messed up and did one last bit before starting and that you can promise you won't come up dirty on the following visit and thereafter. From what I heard usually the first one isn't going to penalize you.,0
2019-10-28 02:03:27,https://www.reddit.com/r/OpiatesRecovery/comments/do4v3s/fucking_help/,Fucking help.,"I'm fucking done with BTH. I decided to stop after failing to taper down and kept just doing more... 36 hours into withdrawal I called 911 on myself Friday at 2am because it felt like something more than your typical heroin withdrawal. I felt like I had a bad fever and I was having major trouble breathing. 

The hospital was actually very kind to me and IVd me some Ativan to relax me and put warm blankets over my goosebump ridden body. Then they sent me to detox in a really nice facility for 3 days. 

I just got out today and went home. I live alone, separated from my wife who is also a heroin addict.. I vowed not to touch black again, I promised to God I would not relapse after going through that. But I started having major trouble breathing and I felt my blood pressure go up. It was so bad I swear I was about to have a stroke. I went back to the same ER. I was coughing up black tar (I smoke) and blood. Doc did a chest x-ray and diagnosed me with a lung infection along with high blood pressure. He just prescribed me clonodine and an antibiotic but the fucking pharmacy is closed because it is now 10:50pm and I feel like my chest is emitting a ton of heat from the infection. Not to mention I got the chills from hell and my eyeballs feel like they're on fire. I'm drinking water and bone broth but I'm really not doing well. Wtf do i do!?",19
2019-10-28 00:49:55,https://www.reddit.com/r/OpiatesRecovery/comments/do4823/day_4_of_lucemyra_to_get_off_opiates_and_relapsed/,Day 4 of lucemyra to get off opiates and relapsed,[removed],3
2019-10-27 23:32:10,https://www.reddit.com/r/OpiatesRecovery/comments/do3ifl/i_need_honest_feedback/,I need honest feedback,"Just some background...Ive been abusing opiates off and on for the last 10 years. The longest clean time I had was 2 years, 1 year on suboxone and 1 year taking kratom. For the last year and a half i've been sniffing fentanyl and heroin and I'm just so tired of it. Being sick constantly, not being able to function at work unless I'm high, never having money, gettig my utilities shut off, paying rent late, etc. 

Ive tried multiple times over the last 2 months to taper off and use kratom, but I keep usng after 5 days tops. Im thinking of suboxone or methadone, but I dont want to get stuck on something else. Im at my witts end. My job has gotten really streasful and with my secret addiction I feel like I'm going to explode, or flip out and intentionally OD. Im just really sick of being this way. I just feel hopeless like nothing will even work. Right now I havent used in 3 days and feel like abosolute shit and dreading work tomorrow. 

I'd appreciate any helpful advice or opinions about MAT, rehab, anything. My state is one of the worst states for resources with one of the highest addiction rates.  I just feel like I'm running out of time.",3
2019-10-27 22:36:02,https://www.reddit.com/r/OpiatesRecovery/comments/do2xpv/i_fucked_up_because_of_a_leg_injury_for_a_week/,"I fucked up because of a leg injury for a week after 6 weeks clean. Back off, day 6. The withdrawal, cold sweats and pain aggravation is fucked.","Why does it always feel like forever? I never thought I'd go back but I have a connective tissue disorder and slept wrong which fucked up my leg so bad I was basically screaming and had to go to the ER. So yeah, I took pain meds again for a little over a week. I had to.

The aftermath is awful. My brain keeps telling me suicide would fix the pain. Since I already have chronic pain, this is aggravating it pretty bad. Still, my leg injury was worse in some ways. Fuck. I just need advice or something.

Went through 120 10mg oxycodone and 60 30mg morphine in that week. No wonder I feel like shit. My tolerance never went down even though I hadn't used? Other than kratom to manage pain now.

I feel like dying.",1
2019-10-27 22:22:42,https://www.reddit.com/r/OpiatesRecovery/comments/do2sme/just_checking_in/,Just checking in,"I’m almost at 38 days off oxys and almost 14 days off subs. It’s crazy to read my posts from the last few days and compare to how I feel now. I feel almost totally back to normal. My sleeping habits are really the only problem at this point, which is pretty sucky, and I still have a little bit of lethargy. But I feel a lot better and like I can get up and face the day tomorrow at work. I appreciate all of you that have reached out and given me advice about what to expect and what I should/shouldn’t do. I may be jumping the gun here and another wave of withdraws may hit me right in the face somehow, but I’m feeling hopeful! Y’all were right, it does get better.",1
2019-10-27 21:03:29,https://www.reddit.com/r/OpiatesRecovery/comments/do1x1y/suboxone_cold_turkey/,Suboxone Cold Turkey,"Tired of the same old cycle of running out of Suboxone and going through hell for 3-4 days before being able to get my script renewed. So this time I’m saying fuck it I’m just go through the shitty opiate wall I’ve built for myself over the years.... 23 years old. Started with hydrocodone in college, loved it. Recreational use for a couple months. Found oxycodone and that’s where it all went down hill. Started using everyday and before I knew it I was addicted. Used probably 180-250 mg a day for 3 years. Tried heroine and the fent presses and would binge those sometimes but oxy was always my favorite. Anyways, once I left college and got a job and had rent, bills, all that good stuff on my own for the first time I just couldn’t afford it anymore so I found Suboxone and have been on that for probably 6-7 months but I’m just tired of the endless cycle of having to rely on a substance to keep me normal. Been scrolling through reddit all day looking at stories of quitting subs, some reallyyyy brutal even months down the line and some rather inspiring after only a couple weeks. I figured I would post partly to vent about how bad this shit is cause nobody in my life really seems to understand. I’m on day 3 right now and fuck it sucks. Chills, sweats, fatigue, but fuck the depression is what is kicking my ass the most. So that’s what I got going on and would love some responses, tips, or whatever just so I have an outlet to look at before I go buy some oxy and feed the demon. Thanks for reading guys.",2
2019-10-27 20:01:14,https://www.reddit.com/r/OpiatesRecovery/comments/do18rm/going_into_1037_days_clean_from_methadone_1461/,"Going into 1037 days clean from Methadone, 1461 days clean from Heroin.",[deleted],1
2019-10-27 19:20:01,https://www.reddit.com/r/OpiatesRecovery/comments/do0sdn/need_help_to_go_to_dont_which_doctor_to_see_or/,"Need help to go to. Don't which doctor to see, or even just. Im an addict but I feel like my withdrawal symptoms are not normal and may point to something else like a disease.","My history with opiates was from June 2016 to now.  Habit increased for 10 mg Percocet until about a 1.5 year go with 30, 60, then 90-120 pills a day oxy ir.  Was on ambien and bars legally from a tragic car accident, but they didn't believe I had pain cause of MRI.

&#x200B;

&#x200B;

lately trying to quit.  I was good for 3months since may.  relapse with the devil named fentanyl / heroin.  snorted but when overboard leading to the worst sickness I have ever experienced. I crashed my car 3 times. got into debt, fucked my mind and memory to the point where I canter member thanks as if im amnesic and epileptic.

&#x200B;

I feel like I overdosed and unknowingly caused brain damage.... 

&#x200B;

my withdrawals are weird because I experience nerve pain on my arms where it feels like its on fire. severe GI issues (used to be on accutane). that make me also fluctuate and monitor my temperature for body",1
2019-10-27 17:27:15,https://www.reddit.com/r/OpiatesRecovery/comments/dnzedc/6_months_this_sub_helped_a_lot/,6 months. This Sub helped a lot!,"It’s 6 months, today, since I took my last oxy pill (or coke etc) and started on suboxone.  I am so so so grateful to these reddit subs that allowed me to ask a bunch of questions with so many people willing to give answers.  Even if it was the 50th time someone asked the same questions.  THANK YOU!!
Honestly, without the information and answers I got from this sub, I would have never made the leap and stuck with it!!  
I’ll still be on suboxone for awhile - but I’m okay with that for now.  I’m so glad to have 6 months without all the messed up shit that pills had me doing.  I could buy myself clothes and makeup today because I haven’t spent every last cent on drugs (not to mention not having to borrow money and wreak havoc on other people’s lives!!)
I’m not sure I have any amazing answers - but if anyone has any questions or is just starting out, feel free to reply or message me.",2
2019-10-27 16:25:32,https://www.reddit.com/r/OpiatesRecovery/comments/dnyunn/looking_to_help/,Looking to help,[removed],1
2019-10-27 15:48:53,https://www.reddit.com/r/OpiatesRecovery/comments/dnyh7z/im_spiraling/,I’m spiraling,[deleted],1
2019-10-27 11:03:50,https://www.reddit.com/r/OpiatesRecovery/comments/dnui1v/um_am_i_good_now/,Um... am I good now?,"Long story short - I’ve been snorting anywhere from 60-180 mg of oxys a day for almost 9 months. Relapse number I can’t even remember anymore. But I’m at the point of broke beyond belief so I figured this is it - I have to quit. My dealer gave me 3 8 mg sub tablets. I waited the full 24 hours of feeling like shit and then took 1/6 of a sub.

It’s been 12 hours since I took that sub and I feel fine.  I’m beyond confused.  As many times as I’ve gotten clean again, it’s never been that “easy”. 

Do I even need to take another dose of the sub?",2
2019-10-27 09:38:44,https://www.reddit.com/r/OpiatesRecovery/comments/dntccj/sunday_october_27_daily_checkin_thread/,"Sunday, October 27 - Daily Check-in Thread",[deleted],9
2019-10-27 08:31:34,https://www.reddit.com/r/OpiatesRecovery/comments/dnslp4/guys_days_8_into_no_subs_waking_up_feeling_like/,"Guys days 8 into no subs. Waking up feeling like death, want to hit up my dealer and just get one day of relief and a decent night of sleep. Haven’t used dope in over two years and my brain is tryna justify that it’s buprenorphine my body is addicted to and I can get away with smoking H","I know that’s my brain playing tricks on me.   What it’s telling me is “one day of smoking h will not have any withdrawals bc you are addicted To/kicking buprenorphine, so session of H and a good night of sleep will give you the strength to continue going.   I have a tingling sensation in my right arm (feels like a nerve that starts in my fingers and is inside my arm all the way to my brachial artery) that gets so itchy and uncomfortable and I wanna smash my hand with a hammer or punch a wall in order to get rid of that discomfort.     


I have heard of people using h their first few days of getting off subs so that when the WD from the dope goes away (after a few days), the sub withdrawal (which is 4-5x longer) won’t seem as bad.   

Not going to hit up one of several dboys.   Even have an old homie that recently offered to split a gram with me if I just drive him 15 min to and from his dboy.  All fire 🔥 bth.    But I turned him down twice.   
*Smoking Weed completely helps me to almost forget I was craving bth*

Wake up at 3am after 2-5 of of heavily interrupted sleep.   Once I feel like ima scream bc of the chills and punch a hole in my wall, I go straight downstairs. Brew 5g tea of Coastline Kratom (which feels impossible to make at first) I brew for 15 min and I pop 4mg of alprazolam.  Drink 5G tea within an hour and then notice I am able to somewhat pay attention to what’s on TV and I stop sweating profusely.   Smoke my morning doobie for a wake and bake.  Im good for about 4-5 hours. Then I make a 2-3 more 5G teas throughout the day.     

Will I notice sub withdrawals dissipate as long as I’m taking kratom or am I postponing the inevitable and should just endure the worst with no Kratom.  The kratom and weed and bars definitely stopped me from picking up black many times.",1
2019-10-27 06:45:43,https://www.reddit.com/r/OpiatesRecovery/comments/dnrpc6/relapsed_on_day_9/,Relapsed on day 9...,[deleted],1
2019-10-27 04:53:59,https://www.reddit.com/r/OpiatesRecovery/comments/dnquip/my_first_overdose/,My first overdose,[deleted],7
2019-10-27 03:05:27,https://www.reddit.com/r/OpiatesRecovery/comments/dnq1ee/sister_relapsed_while_pregnant_advice/,Sister relapsed while pregnant — advice?,[deleted],1
2019-10-26 21:46:52,https://www.reddit.com/r/OpiatesRecovery/comments/dnn30z/fresh_out_of_the_icu/,Fresh out of the icu,"So I would of had 3 years off of opiates this November but ended up having a horrific overdose Tuesday.  Laying in my hospital bed now just waiting for the trazadone to kick in.  So all things considering my life life was going pretty good , at least on paper.   I had been working steady the last 3 years, just started a union job and was bartending on the weekends.  Finally bought a car I enjoyed.  I am in really great shape and the gym is a must for me.  The last year or so I’d even started dating more and more and was enjoying quite a bit of success in that realm.  

When they removed the breathing tube and my vocal chords healed some enough to talk I had no immediate answer as to why?  Was it just a stressful day? Was I truly not happy ?  I seem to just find life just unbearable sometimes.  I really wish that I could just go to work everyday and think like a normal person.  I see people with much less so much more grateful.  Anyways that’s it for me.  I’m sure you guys know the feeling of being stuck in a hospital or detox just stuck with your thoughts.",39
2019-10-26 18:52:31,https://www.reddit.com/r/OpiatesRecovery/comments/dnl4z7/vicious_cycle/,Vicious Cycle,"Im currently on 4 days.  This thing has destroyed my career over n over.  My livelihood.  I am the person how stops over n over.  Like groudhogs day.  I'm watching it happen over n over with no self control when I get the urge.  Im in a constant state of inbetween. 

I did cocaine all night and now I'm on day 2 of whip its.   Im a nitrous monster at times like these...   My job has become extremely stressful and I'm supposed to change shit that is unable to be changed. 

I know what u think of me but I cant seem to stop.  I trade.  

Im with someone now who does coke and that's how it came into the mix.  I know our relationship is based in drugs and looks.  I'm very attracted but know in the back of my head it's wrong.  I cant seem to stop either.  

I know nothing just watch it happen.  I want to die because I'm so down all the time.  I think marilyn whitney and chis farley likelg welcomed death when it came because that's how I feel.  Last night my Vision became orange and I thought hell yes this is it.  No dice.  Sorry to be depressing but jist being real.",1
2019-10-26 16:28:00,https://www.reddit.com/r/OpiatesRecovery/comments/dnjabt/ibogaine_addiction_trials/,Ibogaine Addiction Trials,[deleted],2
2019-10-26 16:17:48,https://www.reddit.com/r/OpiatesRecovery/comments/dnj5ml/day_one/,Day one,"It's day one again. It's my 3rd day one in the past year. I don't know how to feel. You know that ""insane"" person they talk about in in AA/NA That will just never stop using? That feels like me. Fuck. I got so lucky last year. I got 40 days in a really nice rehab, that costs a shit ton of money. My insurance is great, and paid for it all. But I've relapsed twice since then. The deamon is just strong in me. I don't have anything like childhood trauma, or super damaging past experiences that make me use. I just like to get high damnit. I know the beast will get weaker as time goes on. I've lived with it for almost 20 years. There isn't much I don't understand about addiction. I've had runs of 4 and 8 years clean. But that monster never dies. It just waits. Even though it gets weaker over time, it's still there, waiting for that one moment to pounce, and get it's strength back. That moment I'm weak, that moment I think it's ok and I let my guard down. It knows how to manipulate me even at its weakest point. That one little crack it seeps into. How long will I last this time? Hopefully more than a week. I don't exactly know why I'm writing this. But thanks for reading.",8
2019-10-26 12:20:06,https://www.reddit.com/r/OpiatesRecovery/comments/dnfzta/sub_to_kratom_pleasssse_help_i_need_some_responses/,Sub to Kratom PLEASSSSE HELP. I need some responses,[deleted],2
2019-10-26 11:42:26,https://www.reddit.com/r/OpiatesRecovery/comments/dnfhe0/day_7_no_subs/,Day 7 no Subs,"Wow 😳. Everyday gets worse.   Idk about you guys but when I am going to the first few days, I get this tingling sensation that begins in my right Middle, ring and pinky fingers and shoots upon all the way towards my brachial artery.   It is a tingling/tickling/discomfort that gets so bad bc I cannot relieve it.   It gets so bad I feel like I wanna chop my arm off.    Anyways, having really bad digestive issues and I am stuck in bed until I manage to make kratom tea and let it kick in.  Hoping it will get better sooner.",3
2019-10-26 11:41:18,https://www.reddit.com/r/OpiatesRecovery/comments/dnfgwh/day_6_without_h/,Day 6 without H,"I detoxed myself, im feeling better now and all that but im just SO fatigued! Is this normal? What can help?",6
2019-10-26 11:19:54,https://www.reddit.com/r/OpiatesRecovery/comments/dnf6ue/one_year_clean/,One year clean :),"After struggling for years, today I am one year clean from drugs and alcohol. Oxycodone was my drug of choice, but looking back I can see I always based my life around getting high. Take it one day at a time, it gets better :)",65
2019-10-26 09:55:07,https://www.reddit.com/r/OpiatesRecovery/comments/dne5tj/anyone_suffering_from_insomnia_months_down_the/,Anyone suffering from insomnia months down the line?,[deleted],3
2019-10-26 09:46:46,https://www.reddit.com/r/OpiatesRecovery/comments/dne2ek/clean_and_extremely_horny/,Clean and extremely horny?,"I've been off opiates about a month now, and I am extremely horny all the time, forced to rub em out then I get a serious sex headache. Anyone else experience this?",3
2019-10-26 07:04:29,https://www.reddit.com/r/OpiatesRecovery/comments/dnch5e/is_there_a_support_network_out_there/,Is there a support network out there?,[deleted],16
2019-10-25 21:25:55,https://www.reddit.com/r/OpiatesRecovery/comments/dn74bi/can_you_stabilize_on_1mg_sub/,Can you “stabilize” on 1mg sub?,[deleted],2
2019-10-25 16:19:52,https://www.reddit.com/r/OpiatesRecovery/comments/dn36db/advice_for_someone_who_relapsed_after_4_years_and/,Advice for someone who relapsed after 4 years and how to end this round.,[deleted],1
2019-10-25 15:01:55,https://www.reddit.com/r/OpiatesRecovery/comments/dn22jx/home_alone_this_weekend/,home alone this weekend...,"ive been off that crap for several months now. the routine has been running through my mind today though, not gonna lie. gotta distract myself somehow. sorry for the super lame post.",4
2019-10-25 14:17:21,https://www.reddit.com/r/OpiatesRecovery/comments/dn1fnq/advice_needed_im_9999_sure_a_lifelong_friend_is/,"Advice Needed - I'm 99.99% sure a life-long friend is currently relapsing, I'm the only one who knows, but I am 1400 miles away and don't if I should tell his family.","Hey everyone - first time here. Posting from a throwaway. One of my best friends from growing up went to rehab this past summer for opiates. He spent 40 days in a facility, and was discharged in August. We live across the country from each other (1400 miles), and over the course of the past couple months, it's become apparent to me that he's using again. He hasn't come out and told me, but he's back in his old habits of 1AM slurred phone calls, rambling about the world being out to get him. He is only 20-40 miles from mom/dad/brother/sister.  I have a fairly close relationship with his family, but I'm struggling with telling them because it doesn't feel right from so far away. Am I wrong here? I would appreciate any and all insights. This is my first time dealing with something like this with someone who is so close to me.

Thank you.",0
2019-10-25 13:59:32,https://www.reddit.com/r/OpiatesRecovery/comments/dn1676/day_3/,Day 3...,[deleted],7
2019-10-25 13:41:01,https://www.reddit.com/r/OpiatesRecovery/comments/dn0wfq/110_days_clean_struggling/,110 Days Clean & Struggling,"I am 110 days clean off H I quit cold turkey after 2 years of everyday use I just flushed what I had left (crazy right, I know) and locked myself in my room for 2 weeks. The past few days I’ve been STRUGGLING not to get high. I’ve been hella depressed it’s all I’ve been able to think ab to get out of the way I feel. I was on the way to meet my dealer 2 nights ago but as I got ready I felt physically sick I literally couldn’t leave the house (Assuming my stupid conscience stopping me) I’m having a battle with myself in my head it’s awful 😩 I use to think the WD were the worse part but now I’m realizing PAWS (if that’s what this is) is a whole different story ! I didn’t even think after 110 days I’d feel this way...I feel like I’m going crazy ! Any tips, advice, kind words from others who know what I’m going through would be greatly appreciated 🖤🖤🖤",29
2019-10-25 12:42:05,https://www.reddit.com/r/OpiatesRecovery/comments/dn02ol/degenerative_post_acute_withdrawal/,Degenerative Post acute withdrawal,"Are there any people who have experienced this kind of paws, with symptoms worsening the further out you get in sobriety?
Particularly the mental symptoms :

Memory impairment 
Unclear thinking
Anxiety
Depression
Concentration 

To mention a few. 

I'm battling here.",3
2019-10-25 09:31:03,https://www.reddit.com/r/OpiatesRecovery/comments/dmxhkf/does_rehab_actually_work/,Does rehab actually work?,"I've been looking into going to rehab for my addiction, but I'm not convinced that it works. Especially for opioid addiction. It seems like everyone relapses, so what's the point? Any thoughts?",6
2019-10-25 08:22:00,https://www.reddit.com/r/OpiatesRecovery/comments/dmwog9/30_days/,30 days,Just got out of inpatient 2 days ago starting iop today. 1st 30 days I've had in the last 15yrs. No desire to use just dealing with being unhappy. Too many emotions at once and my only coping skill is getting high so everything goes away. Music seems too help and meditation. Any other suggestions? I'm not working right now so I'm trying to fill my days but they are dragging.,12
2019-10-25 08:06:11,https://www.reddit.com/r/OpiatesRecovery/comments/dmwi30/friday_25th_october_daily_checkin/,Friday 25th October Daily Check-in,[deleted],10
2019-10-25 05:07:10,https://www.reddit.com/r/OpiatesRecovery/comments/dmurh0/2_months_almost_clean/,2 months almost clean!,"Hi all,  

For about 18 months Ive been trying to come off opioids and feel a bit silly as to how I finally came off them.  My wife takes opioids for back pain and doesn't seems to suffer from an addiction to them.   Shes now pregnant and came off as soon as we found out.   There's now none in the house for me to take and surprise surprise,  I'm a couple of months off and doing ok ( not amazing but good).    
Just losing the supply forced me to come off.  I did find a few tabs the other day and took them but they ran out within a day or so.  So overall it seems pretty obvious now that these things need to not be within reach and you have no other option but to come off.  

I know this can be more difficult for others but just thought to share as there may be other people in this situation.",26
2019-10-25 04:57:48,https://www.reddit.com/r/OpiatesRecovery/comments/dmuog1/ct_advice/,Ct advice,[deleted],2
