Date,URL,Title,Body,Score
2021-09-29 21:34:53,https://www.reddit.com/r/REDDITORSINRECOVERY/comments/py9jnp/deleted_by_user/,[deleted by user],[removed],31
2021-09-29 16:32:23,https://www.reddit.com/r/REDDITORSINRECOVERY/comments/py40vy/to_the_one/,To the one...,"To the one who’s wearing long sleeves in the summer.

To the one who spends way too many hours in the bathroom.

To the one that won’t ever put their purse down because there is paraphernalia or drugs in there.

To the one who is looking at the mess they are in and thinking there is no coming back from this.

To the one who thinks they are too broken.

To the one who is plotting how to get money.

To the one who has a bag of clothes and no place to stay. To the one who thinks it isn’t too bad.

To the one who is getting high on their lunch break.

To the one whose family won’t talk to you.

To the one that’s caught charges and is dreading their day in court.

To the one who is withdrawing.

To the one who is about to meet their drug dealer.

To the one drinking alcohol at the crack of dawn to keep the shakes at bay.

To the one who hasn’t seen their kids for a month.

To the one whose only gifts they have to give for Christmas are stolen.

 To the one that has a CPS case.

To the one that thinks they would be better off dead...

I speak up for YOU.

Because I am you. You are me.  
You can be sober.  
You can be happy.  
You can be successful.  
You can be free.  
You can be healthy.  
You can love yourself.  
Others can love you.  
You matter.  
Your life matters.  
You are beautifully and wonderfully made.  
You are not alone.",48
2021-09-29 14:17:15,https://www.reddit.com/r/REDDITORSINRECOVERY/comments/py1ans/what_your_favorite_online_meeting_and_why/,What your favorite Online meeting and why?,I need to check out new meetings.,11
2021-09-29 05:59:04,https://www.reddit.com/r/REDDITORSINRECOVERY/comments/pxs5ou/10_years_sober_and_relapsing_because_of_life/,10 years sober and relapsing because of... life,"10 years with no urges at all. Truth be told, drinking and drugs doesnt even appeal right now, but I need to get away from the shitshow that is my life right now.  Been sober for 10 years but only been medication (methadone) free for 2 years. The day I kicked methadone was the day my partner of 10 years left me and refuses to speak to me leaving me with no friends. My dad died a month ago and I couldnt be there because I'm stuck for the 7th year in a demeaning, minimum wage job I hate.   
Everyone tells me I'm too negative and that getting a job is easy but all I meet is rejection.   


I needed some sense of freedom and it came in the form of not being ""a good boy"" anymore. Tired of having made all the right choices (being sober, having hope, working hard) and still getting screwed over by life.",34
2021-09-29 03:45:36,https://www.reddit.com/r/REDDITORSINRECOVERY/comments/pxqj1p/deleted_by_user/,[deleted by user],[removed],3
2021-09-29 03:07:52,https://www.reddit.com/r/REDDITORSINRECOVERY/comments/pxq2cz/just_for_today_september_29_just_for_today/,Just For Today: September 29 - Just for today,"*“When we stop living in the here and now, our problems become magnified unreasonably.”*

**Basic Text, p. 99**

&#x200B;

“Just for today”—it’s a comforting thought.  If  we try to live in the past, we may find ourselves torn by painful,  disquieting memories.  The lessons of our using are not the teachers we  seek for recovery.  Living in tomorrow means moving in with fear.  We  cannot see the shape of the secret future, and uncertainty brings  worry.  Our lives look overwhelming when we lose the focus of today.

Living in the moment offers freedom.  In this  moment, we know that we are safe.  We are not using, and we have  everything we need.  What’s more, life is happening in the here and  now.  The past is gone and the future has yet to arrive; our worrying  won’t change any of it.  Today, we can enjoy our recovery, this very  minute.

&#x200B;

**Just for today:**  I will stay in the here and now.  Today—this moment—I am free.

^(Copyright © 1991-2021 by Narcotics Anonymous World Services, Inc. All Rights Reserved)  

[^(https://twitter.com/compose/tweet)](https://twitter.com/compose/tweet) ",11
2021-09-28 17:30:47,https://www.reddit.com/r/REDDITORSINRECOVERY/comments/pxgg7e/question_about_relapse/,Question about relapse.,"I'm just going to put this plainly. If someone tries to OD in order to kill themselves, does it reset the sober time? I'm not saying I have. I'm not saying I'm going to. I'm not saying this is for me. I'm just curious. Thanks",11
2021-09-28 16:56:00,https://www.reddit.com/r/REDDITORSINRECOVERY/comments/pxfpa7/liver_ultrasound_reading_help_please/,Liver Ultrasound Reading Help Please,[removed],3
2021-09-28 06:39:59,https://www.reddit.com/r/REDDITORSINRECOVERY/comments/px3m8l/addiction_is_really_tough_quitting_addiction_is/,Addiction is really tough. Quitting addiction is really reallyyy tough! Staying clean seems damn near impossible.,[deleted],16
2021-09-28 03:40:41,https://www.reddit.com/r/REDDITORSINRECOVERY/comments/px19q6/180_days/,180 days!,"Finally hit that six month mark. It's been rough and I've come close to giving in. I know it's a daily struggle, but I'm trying.",44
2021-09-28 02:27:40,https://www.reddit.com/r/REDDITORSINRECOVERY/comments/px0b0x/just_for_today_september_28_hope/,Just For Today: September 28 - Hope,"*“Gradually, as we become more God-centered than self-centered, our despair turns to hope.”*

**Basic Text, p. 95**

&#x200B;

As using addicts, despair was our relentless  companion.  It colored our every waking moment.  Despair was born of  our experience in active addiction:  No matter what measures we tried to  make our lives better, we slid ever deeper into misery.  Attempts we  made to control our lives frequently met with failure.  In a sense, our  First Step admission of powerlessness was an acknowledgment of despair.

Steps Two and Three lead us gradually out of  that despair and into new hope, the companion of the recovering  addict.  Having accepted that so many of our efforts to change have  failed, we come to believe that there is a Power greater than  ourselves.  We believe this Power can—and will—help us.  We practice the  Second and Third Steps as an affirmation of our hope for a better life,  turning to this Power for guidance.  As we come to rely more and more  on a Higher Power for the management of our day-to-day life, the despair  arising from our long experiment with self-sufficiency disappears.

&#x200B;

**Just for today:**  I will reaffirm my Third Step decision.  I know that, with a Higher Power in my life, there is hope.

^(Copyright © 1991-2021 by Narcotics Anonymous World Services, Inc. All Rights Reserved) 

[^(https://twitter.com/\_nohead\_)](https://twitter.com/_nohead_)",4
2021-09-27 20:00:51,https://www.reddit.com/r/REDDITORSINRECOVERY/comments/pwtxz9/sobriety_shines_on_the_world/,Sobriety shines on the world.,"A man that was once reckless that is now sober shines on the world, like the moon coming from behind the clouds. Buddhist teaching.",6
2021-09-27 15:05:17,https://www.reddit.com/r/REDDITORSINRECOVERY/comments/pwo19d/help_with_picking_a_rehab/,Help with picking a rehab,"Detox questions

Hey guys I am looking into finally stopping use by going back to detox/rehab. 

I wanted to get some advice from y’all. I have been using straight fent for the last 3 years. Anywhere from 1.5-3 grams a day. I make really good money and it’s just fueled my tolerance getting ridiculous. I remember when I first relapsed an amount a quarter the size of my pinky nail had me od’d on the bathroom floor. I’m using the same stuff and now doing quarter to half gram shots of it at a time unphased. 

The biggest thing I’m afraid of in detoxing is precip withdrawal. I know the standard protocol at most rehabs is bupe and I have tried over 5 different times ranging from 24-60 hours before inducing only to be thrown into precipitated withdrawal every time. I don’t want to go through that hell ever again. 

My question is, have any of y’all gone to a rehab or know of one that will do a methadone taper instead of bupe given the circumstance of the fentalogue I’m using causing precipitated withdrawal even after long abstinence(in full withdrawal; scoring with COWs worksheet)?

Any info is super appreciated. Thanks",12
2021-09-27 05:04:47,https://www.reddit.com/r/REDDITORSINRECOVERY/comments/pwd7kq/finally_got_my_day_one_and_a_few_more_to_boot/,"Finally got my day one, and a few more to boot.","A couple of you may remember my last few posts here, one titled “how to get my day one” and somehow, without doing any of the things suggested, I managed to do it. Im not saying this to throw jabs at any one, I’m saying it because it’s a goddamn miracle I made it this far. A whole entire week without using a needle, after doing so multiple times a day for 4 years. I haven’t had a week without shooting in all that time. I’m not “clean” per se, not in the eyes of NA anyways (or myself for that matter) but eliminating the needle was always my first step. Now I’m here and I still don’t have the courage to go to a meeting like I thought I would. I guess it’s a little bit of self isolation mixed with a fear of failure and a dash of guilt and anxiety around exposing my truth. It is going to be hard to believe but besides wearing long sleeves all the time, I had a lot of people convinced that I’ve been clean. For the past 2 years anyways, since my son was born. I’m afraid of the judgment that will follow once they realize, and once I own the fact that I’ve been using around my son for longer than I care to admit. So disgusting. Shameful. Everything I thought I wouldn’t be, but here I am. I don’t know how to come to terms with the fact that if I want to stay clean, I’ve got to get honest. Good news is, it’s probably nothing they haven’t done themselves, bad news is, we addicts are human too- prone to judging and gossiping and belittling. My mom has 6 years clean in NA so to everyone in the rooms I’m just “Brittany G’s daughter” or whatever, that’s how it was even when I racked up clean time before my relapse, I’m nervous of how that will turn out. Also, suboxone is my current DOC and I believe I’ll go the tapering route so technically I’m not even allowed to speak in a meeting until I haven’t used any mind or mood altering substances. That’s what I’ve shot for 4 years if you’re wondering- crazy, I know, haven’t touched anything I actually “like” (xans, Roxys, opanas, etc) in FOUR years but still managed to mainline everyday and smoke a little bit of weed. Definitely a bad case of needle fixation, I’m for sure an addict. I think this is more of a diary entry than anything else so if you’ve made it this far, thanks for listening ❤️ Leave some kind words or advice if you have it to give. I appreciate you.",22
2021-09-27 03:05:49,https://www.reddit.com/r/REDDITORSINRECOVERY/comments/pwbwcf/just_for_today_september_27_right_back_up/,Just For Today: September 27 - Right back up,"*“There is something in our self-destructive personalities that cries for failure.”*

**Basic Text, p. 80**

&#x200B;

“Poor me; woe is me; look at me, my life is  such a mess!  I’ve fallen, and no matter how hard I try, I continue to  fail.”  Many of us came to NA singing this sad refrain.

Life isn’t like that anymore.  True, sometimes  we still stumble; at times we even fall.  Sometimes we feel like we  can’t move forward in our lives, no matter how hard we try.  But the  truth of the matter is that, with the help of other recovering addicts  in NA, we find a hand to pull us up, dust us off, and help us start all  over again.  That’s the new refrain in our lives today.

No longer do we say, “I’m a failure and I’m  going nowhere.”  Usually, it’s more like, “Rats!  I hit that same bump  in the road of life again.  Pretty soon I’ll learn to slow down or avoid  it entirely.”  Until then, we may continue to fall down occasionally,  but we’ve learned that there’s always a helping hand to set us on our  feet again.

&#x200B;

**Just for today:**  If I begin to cry failure, I’ll remember there is a way to move forward.  I will accept the encouragement and support of NA.

^(Copyright © 1991-2021 by Narcotics Anonymous World Services, Inc. All Rights Reserved)   ",5
2021-09-26 22:22:16,https://www.reddit.com/r/REDDITORSINRECOVERY/comments/pw7rkd/i_need_some_help/,I need some help.,"Ive been having a very hard time quitting a certain substance. I have been using crystal meth (smoking, snorting, hot railing etc.) For a decade, since fourteen, and I want to stop. I left the city and all my associates behind, not only because they were deterrent to my attempts at sobriety, but because I met someone, who understood and helped me lean away from using. In the last while, I met some people living a few houses from my new home, and although I could tell they were probably not the best for my recovery, I got involved with them, and have relapsed... My girlfriend found out; being a drug addled moron, I kept it from her and pushed her more than I could've if I'd just told her. I really want to change, not just for her, but for me. I need some advice on how to ride through the come down depression, and tips to help me stay clean after. If you need any details before giving  please let me know.",6
2021-09-26 17:57:04,https://www.reddit.com/r/REDDITORSINRECOVERY/comments/pw3amp/tips_on_staying_clean_how_to_get_my_life_on_track/,Tips On Staying Clean? How To Get My Life On Track???,"I recently ended a 4 month crystal meth addiction less than 20 days ago. I checked myself into rehab and have managed to avoid any trouble with the Law, I have caught no felonies during my days of geeking and tweaking. For this I am grateful for although I recognize that this is simply out of pure luck. Time to get my life on track. Since mid 202, I have explored the world of illicit drugs with both intense passion and fascination, so I have been a polysubstance user for about 18 months. I got into crystal meth during the final 6 months of my drug ""career"". I used daily for 4 months and have came to the conclusion that things would only worsen. I did not like the way I was behaving whilst under the influence, so I have made the decision to seek professional help on my own. I am currently  in rehab and will be entering into Intensive Outpatient Program for about 4 months. After that I will be returning to my city to resume life with my family as I knew it. Hopefully by then I will be stable enough to live without drugs but if I feel I am not then I will relocate completely. I am learning tio put my recovery first..Yes I still want to use here and there but I have Faith the cravings will dispate and thin out completely. I wnt to live life again, life on my terms rather than that of illicit drugs. I plan on getting really fit, starting college, learning to drive, and getting back into my hobby of language learning. All of this faded away and disipated completely during my years of drug use. I wish I checked myself in sooner rather than later but should have ,could have, and  would have wont be flying here tonight. Can anyone share their storiues of recovery to give me hope??",7
2021-09-26 11:55:22,https://www.reddit.com/r/REDDITORSINRECOVERY/comments/pvwjs6/sobriety_birthday/,Sobriety birthday!,Today marks 5 years of sobriety and part of a recovery community. I got a medallion last night and I hope all of you continue to collect chips and medallions. Much love.,73
2021-09-26 06:03:25,https://www.reddit.com/r/REDDITORSINRECOVERY/comments/pvqyq4/first_time_post/,First time post,"Hi. I'm a recovering cocaine addict and been sober for almost 2 years now. It's been a interesting ride and I've cut out some people in my life and are now dealing with my relationship with alcohol. It feels pretty weird writing this because I never really talked with someone or about my addiction problems and mostly joked it away when it have come up.
I have a question about recovering from cocaine. When I first quit after a 4 months of taking on a daily basis I stayed sober for 5 months untill I came home for a visit and ended up taking again. I've never felt so depressed and that I sucked as a human being for 2+ months. Can anyone relate? I'm not really afraid of relapsing again since I've cut my contacts and the friends I hang with when I'm coming home for visit uses it very loosely and haven't brought anything last 2-3 times I visited. But are every relapse the same process of feeling shame and like you should stay in bed for the rest of time?",7
2021-09-26 05:02:51,https://www.reddit.com/r/REDDITORSINRECOVERY/comments/pvq8kt/my_boyfriend_might_be_relapsing_and_i_need_help/,my boyfriend might be relapsing and i need help..,"my boyfriend has been clean of meth and heroine for what i thought was now just over 5months.. thats as long as weve been dating alot of shit has happened within these months he moved into my place away from the city he was in and people he was around.. it was gonna be a new start, and the other night idk why i did but i did.. i had a weird feeling and i looked through his phone while he was asleep.. i know it was wrong and i shouldnt have done it but... i found text messages to #s without names ans him asking for another set of windows.. he doesnt know anybody here and he met our neighbours which im sure are on crack.. so i saw these messages and,i have mo clue how to try and bring it up without making it seem like im attacking him, i just want to help him.. ive never been through this with someone ive cares so much about and im at a loss..",4
