Date,URL,Title,Body,Score
2021-09-11 18:36:56,https://www.reddit.com/r/REDDITORSINRECOVERY/comments/pmgyd7/whats_the_best_way_to_be_there_for_others/,Whats the best way to be there for others?,"I already struggle with mental fog and fatigue, my attention span is gone, my memory is short. I will listen but essentially someone is emptying themselves into nothing, so am I really helping my peers in recovery. I don’t have profound advice or knowledge and never know the right things to say. Im just a fucking fuckup trying to recovery whats left of their life, so how can I even try to help anyone.",12
2021-09-11 10:00:13,https://www.reddit.com/r/REDDITORSINRECOVERY/comments/pm7xtk/how_to_accept_how_do_most_women_accept_that_its/,How to accept & how do most women accept that it's common for men behind closed doors to fetishize women with penises/watch the porn/be open to having sex with them due to even straight men liking penises. When straight women & gay men NEED penis & have no interest sexually in men with vaginas?,[removed],0
2021-09-11 04:09:28,https://www.reddit.com/r/REDDITORSINRECOVERY/comments/pm3e9s/rapid_taper/,Rapid Taper,[removed],6
2021-09-10 16:59:46,https://www.reddit.com/r/REDDITORSINRECOVERY/comments/pltk1o/how_can_i_keep_my_addictive_personality_in_check/,How can I keep my addictive personality in check more often?,"Title, I switch from addiction to addiction, telling myself im getting better when in reality im looking for something to replace X,Y, and Z. Currently im scared im 60days clean from stims, but feel this urge and that next thing haunting me is smoking cigarettes, and am trying my best to avoid it. Yet I feel that feeling of emptiness wanting to be filled. Thank you in advance",4
2021-09-10 15:03:21,https://www.reddit.com/r/REDDITORSINRECOVERY/comments/plrebk/gift_for_someone_in_recovery/,Gift for someone in recovery,"Sorry that this might be pretty off topic.  I can delete if its not appropriate.  

I have a friend who has been battling a cocaine addiction for many years now.  At a really low point I loaned him some money without any real expectation that I'd see it again.  He has now been sober for about 9 months and has begun paying me back slowly.  I was thinking about just saving the money he is paying back and doing something really nice if/when he makes it to 1 year.

Any thoughts or ideas?  Appropriate or not?  Specific ideas?",23
2021-09-10 11:11:28,https://www.reddit.com/r/REDDITORSINRECOVERY/comments/plmz2z/success_story_in_the_making/,Success story in the making ??,"So on June 4th of this year I made the decisions to actually do something about my fucked up life. I was addicted to heroin, Xanax, ketamine and tbh, anything that got me high and away from reality. I was addicted to Xanax for 5 years and heroin 7 months.

I was an unemployed, severely unhealthy, homeless drug addict. My hobbies used to be playing football and making music, I stopped playing football 6 years ago, just as I was getting into drugs. 

I’ve been unemployed now for almost 2 years. I went from 64kg down to 52kg. I barely ate one meal a day. 

Drugs took over my life, I didn’t wanna do anything but drugs. Everyday I would ask anyone and everyone for money so I could get my fix. All day and night, all I’d think about was drugs. I lost all my friends and my family were slowly giving up on me, I was genuinely rock bottom. I’ve had two seizures in the past tryna get clean. 

June 4th, I moved away to live with my nan (June 10th I turned 24). I moved to a place I had no access to drugs and didn’t know anyone, it was my only option. 

My life needed to change, I had to start making different choices otherwise I didn’t know how much longer I’d be alive. 

Now, I’m clean! I’ve got a job! I joined a Sunday league football team! My health is better than ever, I now weigh 62kg (put on 10kg). I’m finally starting my driving lessons and I’ve started going to the gym and working out. 

My family are sooo fckn proud of me! I’m proud of me! Feeling pride after half a decade of not feeling anything but depression is absolutely amazing! 

I thought it was impossible for me to turn my life round like this but I made different choices and suffered but now I’m reaping the rewards! 

Ive been clean 98 days now (and counting!) 

Believe in yourself! That’s the first step. 

I’ve got myself back! I have my life back.. I mean fuck, I actually have a life now!! This feeling is unmatched.",49
2021-09-10 00:52:04,https://www.reddit.com/r/REDDITORSINRECOVERY/comments/plec6l/deleted_by_user/,[deleted by user],[removed],1
2021-09-09 23:43:35,https://www.reddit.com/r/REDDITORSINRECOVERY/comments/pldbwa/deleted_by_user/,[deleted by user],[removed],26
2021-09-09 22:44:22,https://www.reddit.com/r/REDDITORSINRECOVERY/comments/plceyd/deleted_by_user/,[deleted by user],[removed],10
2021-09-09 22:12:51,https://www.reddit.com/r/REDDITORSINRECOVERY/comments/plbwxe/alcohol_addiction/,Alcohol addiction,"So, I’m sitting here, drunk again. Getting tired of this feeling. I’m looking through audio books for self help and there is quite a few choices. I was hoping to get some recommendations on books that have made an impact on people going through what I am.",12
2021-09-09 21:10:27,https://www.reddit.com/r/REDDITORSINRECOVERY/comments/plavud/will_i_be_fried_for_life/,Will I be fried for life?,"
So about a year ago my friends and I got heavily into raves. It opened me up to a lot of drug use that younger me would’ve never imagined doing. I took hits and hits of Molly, ecstasy, lsd, shrooms, ketamine, you name it I’ve probably done it. (Nothing extreme extreme like meth, coke, heroin etc.) I’m now about 6 months sober. I never noticed until about 4-5 months ago that I hardly have recollection of memories from when I was younger, couldn’t hold a conversation, and blatantly couldn’t remember most of almost anything I knew. It’s caused severe depression and suicidal thoughts now and they take over. I can’t feel emotions. I sleep like absolute shit. I’ll try my absolute best to tell myself it’s going to be a good day and they still run across my head. Will my brain be this damaged for life? It’s caused a pretty major boundary in my relationship and now we’ve got a child on the way. I just want to be naturally happy again and be the dad I always wanted to be.",10
2021-09-09 19:41:44,https://www.reddit.com/r/REDDITORSINRECOVERY/comments/pl9gl7/wedorecover/,WeDoRecover,[removed],6
2021-09-09 05:34:38,https://www.reddit.com/r/REDDITORSINRECOVERY/comments/pkuh7w/just_for_today_september_9_feet_of_clay/,Just For Today: September 9 - Feet of clay,"*“One of the biggest stumbling blocks to recovery seems to be placing unrealistic expectations on... others.”*

**Basic Text, p. 82**

&#x200B;

Many of us come into Narcotics Anonymous  feeling pretty poorly about ourselves.  By comparison, the recovering  addicts we meet at meetings may seem almost superhumanly serene.  These  wise, loving people have many months, even years of living in accordance  with spiritual principles, giving of themselves to others without  expecting anything back.  We trust them, allowing them to love us until  we can love ourselves.  We expect them to make everything alright again.

Then the glow of early recovery begins to fade,  and we start to see the human side of our NA friends and sponsor.   Perhaps a fellow member of our home group stands us up for a coffee  date, or we see two oldtimers bickering at a committee meeting, or we  realize our sponsor has a defect of character or two.  We’re crushed,  disillusioned—these recovering addicts aren’t perfect after all!  How  can we possibly trust them anymore?

Somewhere between “the heroes of recovery” and  “the lousy NA bums” lies the truth:  Our fellow addicts are neither  completely bad nor completely good.  After all, if they were perfect,  they wouldn’t need this program.  Our friends and sponsor are ordinary  recovering addicts, just like we are.  We can relate to their ordinary  recovery experience and use it in our own program.

&#x200B;

**Just for today:**  My friends and my sponsor are human, just like me—and I trust their experience all the more for that.

^(Copyright © 1991-2021 by Narcotics Anonymous World Services, Inc. All Rights Reserved)  

[^(https://twitter.com/\_nohead\_)](https://twitter.com/_nohead_)",17
2021-09-08 18:48:56,https://www.reddit.com/r/REDDITORSINRECOVERY/comments/pkl40o/im_struggling/,I’m struggling,[removed],1
2021-09-08 06:33:22,https://www.reddit.com/r/REDDITORSINRECOVERY/comments/pk7wkg/just_for_today_september_8_rebellion/,Just For Today: September 8 - Rebellion," *“We need not lose faith when we become rebellious.”*

**Basic Text, p. 35**

&#x200B;

Many of us have lived our entire lives in  revolt.  Our initial response to any type of direction is often  negative.  Automatic rejection of authority seems to be a troubling  character defect for many addicts.

A thorough self-examination can show us how we  react to the world around us.  We can ask ourselves if our rebellion  against people, places, and institutions is justified.  If we keep  writing long enough, we can usually get past what others did and uncover  our own part in our affairs.  We find that what others did to us was  not as important as how we responded to the situations we found  ourselves in.

Regular inventory allows us to examine the  patterns in our reactions to life and see if we are prone to chronic  rebelliousness.  Sometimes we will find that, while we may usually go  along with what is suggested to us rather than risk rejection, we  secretly harbor resentments against authority.  If left to themselves,  these resentments can lead us away from our program of recovery.

The inventory process allows us to uncover,  evaluate, and alter our rebellious patterns. We can’t change the world  by taking an inventory, but we can change the way we react to it.

&#x200B;

**Just for today:**  I want freedom from the turmoil of rebelliousness.  Before I act, I will inventory myself and think about my true values.

^(Copyright © 1991-2021 by Narcotics Anonymous World Services, Inc. All Rights Reserved)    

[^(https://twitter.com/\_nohead\_)](https://twitter.com/_nohead_)",11
2021-09-07 21:49:12,https://www.reddit.com/r/REDDITORSINRECOVERY/comments/pk103t/1_year_clean_today/,1 year clean today,"It’s been 365 days in a row that I havnt touched ANY drugs or alcohol . It’s a fucking trip is what it is! So rad yet wild at the same time to see the life I’m living today and the life I was trapped inside before. Before in my addiction everything was a tragedy, everything was dramatic, everything was about getting loaded and where I would get too next. Today bad shit happens and heart breK and grief exists but I’m able to walk through it better than I did before. In one of my worst points of my addiction I found someone I truly loved in the last few years and our relationship was destroyed by drugs, the relationships with my family and friends were gone, and I couldn’t bare to look at the person I saw in the mirror . For the first time ever I wanted to change everything . I didn’t know if I wanted to be clean but I knew I wanted the misery and consequences to stop. So I got some help, I found a program and a set of people that worked for me, I listened to what they had to say and even though I did a lot of shit I didn’t want to , I trusted them . Learning to live on life’s terms isn’t what I love but it’s what I need because this head of mine will tell me all sorts of shit and lies that all seem so true to me at the time reminding me how sick I still am. And how this is a progressive disease but there is something to be done about it. If you asked me where I thought I’d be today last year answer would be dead. Today I’m in school to become a nurse, for work I nanny two young boys, I have a safe place to live and I’m learning to love myself again. TodY I am rebuilding some not all but some relationships that are important to me. Unfortunately in our addiction just cus we get better doesn’t mean everything and everyone else gets better but I can say that today I’m
Grateful & happy to be clean! I fucking did it !!!!",90
2021-09-07 19:50:21,https://www.reddit.com/r/REDDITORSINRECOVERY/comments/pjz1dz/1_year_clean/,1 year clean,"It’s been exactly 365 days since I last used heroin. Doing much better and finally feeling like myself again. 

The light at the end of the *extremely* long tunnel is worth it.",50
2021-09-07 17:50:16,https://www.reddit.com/r/REDDITORSINRECOVERY/comments/pjwr0w/recovery_help/,Recovery help,[removed],0
2021-09-07 16:34:36,https://www.reddit.com/r/REDDITORSINRECOVERY/comments/pjvd2s/looking_to_meet_people_in_cambridge_uk_for_a/,"Looking to meet people in Cambridge, UK, for a coffee. Oh, and to talk about mine/your crippling addition/addictions","Hey, first off I just want to say this subreddit  is a truly beautiful thing that has helped me more times than I care to think about. Sadly I have just relapsed for the 7th time (on a combo of benzos, kratom, phenibut, and the occasional coke binge). It is fair to say that I am reaching my breaking point with addiction. I simply do not know how to break the loop. It is my 7th time so I feel like I'm getting closer and closer, and simply learning what my triggers are, but yet here I am.

Personally I'm not much of a texter, or a caller really. I like to talk to people face to face. 

I've been to NA multiple times, with no success. It seemed to just be a bunch of people reding verses from some book that sounded like the Bible. Before I insult anyone, I'm sure this book has saved countless lives, but personally no matter how much I tried I could not get it to help me. Frankly I wanted to to talk about why people took the substance in the first place? Why people felt inclined to keep taking it? What people's triggers were and what they did to control them? And if they were completely clean from the stuff, what was there final solution to kick It for good?

I have an incredible group of friends and family who have relentlessly supported me through my multiple relapses, but I would like to speak in person with someone who actually has or has had a serious drug addiction.



I live I Cambridge, UK, 26, male. 

The way I pictured it was we would all meet midday at a coffee shop in a relatively crowded location. This way everyone would feel safe.


Please tell me if I am

1. Breaking one of the subreddits rules
2. am being completely unaware of a much easier way to do this
3. Being a complete moron in some way

Thanks to you all, and if your like me and are still stuck in this nightmare, freedom is possible, and you are more than capable of making your way out of this twisted addiction

Much love 

C.H",6
2021-09-07 11:43:27,https://www.reddit.com/r/REDDITORSINRECOVERY/comments/pjplsj/i_dont_think_theres_a_way_forward/,I don’t think there’s a way forward.,"I’m way tired. Tired of fighting. Tired of trying to do the right things and failing miserably every single time. Tired of hunting for new options. Tired of looking at dwindling possibilities, dwindling resources, dwindling friends. I’m damn near close to zero across all of those. 

I can’t hold my shit together for even a week. Nothing is reason enough to do it. Not family, not work, not reputation, not nothing. Things have done nothing but run downhill. 

I’ve had HIV for decades. I’ve likely had some form of depression for damn near my whole life. Now I can’t even bother to take my meds. It’s not that I forget to. I’ll literally lie in bed arguing with myself, dumbfounded at how easy that step would be and literally be unable to do it. I’m doing it right now. 

Needless to say, doctor’s appointments or anything else that might help are completely out of the question. I can’t so much as brush my teeth. How can I go to a doctor?

I hate blues. They aren’t my thing at all. But they have one use. And I think it’s almost time to exercise that option. 

PS: don’t feed me any 12 step bullshit about surrender. It doesn’t work. And if I wanted your half baked pseudo Christianity, I’d go back to trying meetings like I did for years.  It didn’t work then and there’s even less reason to think it would work now.",30
2021-09-07 11:20:11,https://www.reddit.com/r/REDDITORSINRECOVERY/comments/pjp51c/cocaine_recovery/,Cocaine recovery,[deleted],5
2021-09-07 10:35:53,https://www.reddit.com/r/REDDITORSINRECOVERY/comments/pjoa66/inspiring_final_monologue_from_the_movie_the_big/,Inspiring final monologue from the movie 'The Big Kahuna'.,[removed],1
2021-09-07 06:47:22,https://www.reddit.com/r/REDDITORSINRECOVERY/comments/pjkn1q/new_to_recovery_and_cant_sleep/,New to recovery and can’t sleep,"Has anyone else experienced this? I vaguely remember not being able to sleep more than like 4 hours in high school. I’m 5 days clean from literally everything and I have not been able to sleep for the life of me. What can I do to help me sleep? My last clean time was like February for a couple weeks. 
I’m doing MAT and taking strips, but I don’t think they make it hard to sleep. I tried taking a sleep aid and still couldn’t sleep. I don’t remember not being able to sleep like at all before. It isn’t triggering me now but definitely will in the future. 



Summary: 5 days clean, cannot sleep whatsoever. Trying to avoid it becoming a trigger",6
2021-09-06 21:29:04,https://www.reddit.com/r/REDDITORSINRECOVERY/comments/pjd2f9/eating_food_to_cope_with_the_loss_of_my_substances/,Eating food to cope with the loss of my substances?,"Hey yall.

I stopped drinking, taking opiates, and smoking (tobacco and weed) a month ago (~10+ year use). I feel like I want to eat all of the time because it gives me a rush to taste great food, makes me feel full, and gets those dopamine receptors firing.

Is this a common issue with quitting substances? I feel like I'm dropping all of my bad habits, but picking up another one in place of the others. Have tried drinking lots of water and other tools to help with it, but none seem to be working. I could be full and still just want to eat EVERYTHING. 

Any advice? I've been trying to ""white knuckle"" it and tell myself ""no"" but I feel like I might be missing something that could help. Maybe eating mints or something whenever I have a craving? 

Thanks!",21
2021-09-06 16:29:21,https://www.reddit.com/r/REDDITORSINRECOVERY/comments/pj7sb4/deleted_by_user/,[deleted by user],[removed],9
2021-09-06 11:12:58,https://www.reddit.com/r/REDDITORSINRECOVERY/comments/pj1ac3/crossposted_need_advice_on_husband_in_rehab/,Crossposted: Need advice on husband in rehab. Please help!,[deleted],12
2021-09-06 09:37:57,https://www.reddit.com/r/REDDITORSINRECOVERY/comments/pizkxj/have_the_patience_of_a_garden/,Have the patience of a garden.,"You can plant a seed but you can’t force it to grow faster. Natural growth takes time. Small changes are rewarding. (And don’t forget to get some sun, fresh air, and water daily.)",19
2021-09-06 06:02:13,https://www.reddit.com/r/REDDITORSINRECOVERY/comments/piwi7a/youth_in_recovery/,Youth in recovery,"I am a recovering addict who is having a hard time finding other recovering addicts around my age (14) and every time I step into an NA meeting I feel like nobody takes me seriously because of how young I am, and even though I only have 90 days under my belt I still feel it’s enough to start being taken seriously by older addicts in recovery. Because of this I have been thinking of starting an NA meeting but for youth, does it seem like a good idea? I know I a lot of people around my age in my area are addicts and I feel that they might benefit from showing up to a meeting or two if desired",13
2021-09-05 22:12:14,/r/Therecoverygarden/comments/piq81q/praying_for_paul/,Praying for Paul,,16
2021-09-05 22:10:40,/r/Advice/comments/piox0o/im_having_a_problem_with_a_friend/,Advice wanted!,[deleted],2
2021-09-05 08:30:01,https://www.reddit.com/r/REDDITORSINRECOVERY/comments/pic8j6/deleted_by_user/,[deleted by user],[removed],10
2021-09-04 20:02:30,https://www.reddit.com/r/REDDITORSINRECOVERY/comments/pi2k8b/sober_vacation_success/,Sober vacation success!,It wasn’t even that hard. Get to enjoy each day to the max since I am not hung over and feeling like shit.,20
2021-09-04 19:41:17,https://www.reddit.com/r/REDDITORSINRECOVERY/comments/pi28bt/i_hate_when_relatives_get_together_to_end_up_drunk/,I hate when relatives get together to end up drunk,"In my past I used to binge drink and was addicted to a handful of different hard drugs through four years. Now I'm sober and strongly against the mind-altering substances.

Today was sort of a family gathering and I clearly stated that I'm not going to drink. Felt no cravings and my mood was quite alright. There was this one lady who's my distant relative who knew about my previous struggles, but it isn't me who told her so we both pretend like she doesn't know because I haven't said a word about it.

First thing, after I stated my sober point she (ironically?) asked my why I didn't quit smoking if I'm not going to drink today. Lady like how the fuck it's your business?

Second, when she was already drunk to the point of talking non-stop, singing and dancing, she went out to the balcony where I was sitting with a cigarette after my workout session. Asked me about my workout, this is where I got engaged in the conversation and started telling her about some nuances. I got quite gesticulating and made my voice clearer and louder since I was telling her about the thing I love.

And that's where she interrupted me with a line: ""Why are you acting like that? Waving your hands here and there! You think it's cool, why you got to show off like this? You're acting like a complete druggie!"". I was shocked and my response was something like ""What?.. I'm just interested in that topic and you know that I'm very emotional by nature."". After that I shut down into my thoughts.

FUCK. In that moment my head wasn't quite clear since I was resting after a long heavy workout. And her words even made me question myself and did shaken my self-confidence a lot.

I don't know how to feel about it now. Don't wanna talk with her ever again, not a single time in my life. You're not my family member if you're not even showing compassion but going straight offensive on my trauma-related topic.",3
