Date,URL,Title,Body,Score
2020-06-16 04:07:25,https://www.reddit.com/r/REDDITORSINRECOVERY/comments/h9zl2j/trigger_warning_being_a_dope_addict/,* Trigger warning * Being a dope addict.,"I'm an 18 year old female, when I first got high I was just turning 17, It was the most amazing high and I began chasing that feeling for almost a year before I was never anything but a liar, thief, and sick all of the time. It got so bad, I looked so bad, I went to rehab for 45 days and was clean for a long time. But eventually that voice in your head becomes you. ""Just one line, its fine, just one more and I'll stop."" One is too many, a thousand, never enough. Another voice in me says ""Just quit, it's not helping you."" the other one says ""Just do enough to get you through the day."" You think losing my cousin to an overdose would scare me straight, almost lost my sister but she survived. Well, I have my first therapy appointment on Friday. Wish me luck.",16
2020-06-15 23:20:13,https://www.reddit.com/r/REDDITORSINRECOVERY/comments/h9vi6a/guide_on_how_to_avoid_alcohol_withdrawals_with/,Guide on how to avoid alcohol withdrawals with benzos?,"Has anyone read a real guide from the personal perspective and not just some medical article talking about how yes they use benzos for AWS? 

I'm scared of benzos due to prior use, so not going to use long term. However I've been drinking like 10+ drinks per day and I'm done with the shakes and whatnot. Got three 2mg bars, and I'm sensitive so it might work.

Took one drink upon waking for standard shakes, waited an hour until it cleared system then took 0.5mg of Xanax. Worked for a couple hours but then shakes again when I was making lunch, so I took another 0.5mg and promptly passed out for 5 hours. So obviously I should space them out more, but please send any guides/resources on doing this yourself! I successfully tapered by myself in 2018 so I know I can do it.

Edit - I did it and recorded all my usage of benzos, 0.25mg at a time when extremely uncomfortable. Will post later, DM me if you need advice.",2
2020-06-15 17:49:01,https://www.reddit.com/r/REDDITORSINRECOVERY/comments/h9po84/10_days_clean_of_tramadol/,10 Days clean of Tramadol,"Tenth day without those pills, I was taking up to 20 50mg tablets a day, I honestly feel like a different person.",64
2020-06-15 12:31:12,https://www.reddit.com/r/REDDITORSINRECOVERY/comments/h9jnr7/emotional_sobriety/,Emotional sobriety,I just hit one month sober last week and I physically feel great. The fog has lifted and I’ve started treating my body better. I’m doing step work now with a sponsor and on my 9th step. But holy cow my emotions are WILD! So up and down. Is this normal? Will it go away? How can I even out? I’m afraid of myself sober now because I’m being a bit impulsive with my emotions. I don’t know how to handle them.,6
2020-06-15 08:09:56,https://www.reddit.com/r/REDDITORSINRECOVERY/comments/h9f2yf/thank_you_in_general_i_hope_i_can_return_what/,"Thank you in general, I hope i can return what this sub has given me one day.","I had to write what i am grateful for myself and remembered here, I just had difficulty attending meetings(both online and in person). So I would come here hoping to be ignored and just ramble on, yet that would not happen. Fellow recoverees would offer their insights and just comments in general. I always felt i was wasting their time fact everyone’s time, yet never considered the impact this sub has had on my own. I have a very long way to go, I’m currently 7 months free from self-harm. I blame many aspects for it but one of them was this sub. I thank anyone and everyone for their support may i return that to someone in need in the future. That is all and I apologize if i was not supposed to post this here",7
2020-06-15 07:59:04,https://www.reddit.com/r/REDDITORSINRECOVERY/comments/h9ex14/is_it_normal_to_go_through_a_range_of_emotions/,Is it normal to go through a range of emotions daily(Particularly when you awaken) no matter the sub of choice?,"Now I truly don’t like to ask this question as I haven't been able to word it properly. So I will ask it straight, while recovering is it normal to no matter what sub of use, to feel a range of emotional energy upon when the body wakes up? Every morning I find myself crying and it’s pitiful and every morning I ask, what is wrong the only answer that’s makes sense is I’ve been without dxm for too long n now that is what I may be feeling? Nonetheless the real healing is coming here, yea I don’t have to post it but apart of me 1 feels better releasing it out and 2 even though I’ve attended no meeting online yet, reading replies makes me feel better. Mainly because it take me out of my head where the tearing repeats its like a slap to the face, I feel like it’s a crutch and I have to fix that.",3
2020-06-15 07:33:35,https://www.reddit.com/r/REDDITORSINRECOVERY/comments/h9ejtj/4_weeks_sober_today/,4 weeks sober today,[deleted],72
2020-06-15 07:11:18,https://www.reddit.com/r/REDDITORSINRECOVERY/comments/h9e8h1/its_time_to_get_healthy_again/,It’s time to get healthy again...,"My relapse started about a month ago and quickly got out of control.  No surprise.  My body and mind are exhausted at this point. It’s day 5 of being awake.  When I crash I will crash hard for sure. 

I will crash tomorrow. Tomorrow I leave for detox and then treatment.  I’m choosing recovery over this life of destruction.  It’s going to kill me if I continue. 

I’m anxious for these next steps. Yet excited too!",12
2020-06-15 04:13:50,https://www.reddit.com/r/REDDITORSINRECOVERY/comments/h9bxci/relapsed_again/,Relapsed AGAIN,This is driving me insane,2
2020-06-15 01:42:42,https://www.reddit.com/r/REDDITORSINRECOVERY/comments/h99y9w/lets_just_say_that_i_am_struggling_hard_with/,"Let's just say that I am struggling hard, with everything, and the universe is throwing some pretty hard stuff at me. Only 18days sober. Opiates. Just wondering when the ""life is so much better"" part starts, because I'm just going through the motions out of necessity. Life can't just be this.",[deleted],3
2020-06-15 00:56:28,https://www.reddit.com/r/REDDITORSINRECOVERY/comments/h99b3m/fuck/,Fuck,High on coke again. I need help.,8
2020-06-14 22:31:25,https://www.reddit.com/r/REDDITORSINRECOVERY/comments/h9790k/stopped_myself_from_buying_garbage_coke/,Stopped Myself From Buying Garbage Coke,"A combination of quarentine and complications with medicine I take has limited me to just smoking weed.

That stupid lil itch kept scratching at the back of my mind and I caved and hit up my guy. He wanted 90 for a g of white that looked like it had been stepped on by a marching band.

All I had was 80 but i didnt mind being short, but on my way to him i stopped myself. 

Why am I going to spend all my money for something I'll barely enjoy for the night? I feel proud of myself. I'll stick to my smoke.",19
2020-06-14 16:40:17,https://www.reddit.com/r/REDDITORSINRECOVERY/comments/h91aoj/30_days_sober/,30 days sober,"I know it’s not much compared to many others, but there was a point not long ago that I wasn’t sure I could make it through a single day.  I’m not a religious man, but I did pray to God a month ago for help, and I received just enough to get me started. I’ve been sober for 30 days now, and while there have been some very difficult moments mentally, physically and emotionally, I am in a much better place now than I was and I am super proud to be here.  I am taking each day at a time, but what I do know is that I can’t go back to that life anymore. Thanks to all of you for your inspirational posts about your own recoveries — they continue to be a huge motivating factor.  For those struggling to make a change, just know there is strength in you.  You can make things happen.  Don’t give up trying.",97
2020-06-14 16:07:07,https://www.reddit.com/r/REDDITORSINRECOVERY/comments/h90pjn/cost_of_luxury_rehab_centers/,Cost of “luxury” rehab centers?,"Hi,

I know this question probably has many variables and probably is hard to answer. I’m just looking to get the best guess.

I’m looking to find the general cost of a “luxury” rehab center. I tried to attend a generic rehab center covered by Medicaid and found my anxiety to be too severe to even last a day. :( I’ve read up on how “luxury” rehab centers provide your own room, less “chores” etc. and I feel this would be a lot more do-able. However I don’t have an income and my family won’t be able to pay more than roughly $6,000. :/ 

Could anyone provide more financial information on a luxury rehab center? 

Thanks.",6
2020-06-14 14:21:59,https://www.reddit.com/r/REDDITORSINRECOVERY/comments/h8yu4b/rant_post_nonaddicts_posting_in_this_sub/,Rant post: Non-addicts posting in this sub,[deleted],0
2020-06-14 05:41:37,https://www.reddit.com/r/REDDITORSINRECOVERY/comments/h8qu1m/im_new/,I’m new,[deleted],28
2020-06-13 18:48:31,https://www.reddit.com/r/REDDITORSINRECOVERY/comments/h8hqu6/struggling/,Struggling,"I’m struggling today. My son is with his dad and step mom on vacation for a week. Same vacation and place I was vacationing with my little family of three just 3 years ago. It’s like I’ve been replaced. Easily. As for my recovery, I’m struggling. I wanna drink. Now being a single woman, how do we even date in recovery? Dating without recovery is a mind fuck- like how do people our age meet? Throw in a “I don’t drink” and forget it. I’m feeling a lone, hopeless and borderline like fuck it. I currently don’t have a sponsor/ can’t meet one because of covid, - do some meetings online but not enough, and I’ve never completed the steps gain that spiritual freedom they talk about. Maybe my family and son would be better off with me not around? All these things I think about. It’s beautiful out and I sit alone in my condo. No friends. No motivation. Just alone.",14
2020-06-13 17:38:38,https://www.reddit.com/r/REDDITORSINRECOVERY/comments/h8gh0y/audio_meetings_possible_trying_to_avoid_using_but/,Audio meetings possible? Trying to avoid using but anxiety keeps me from regular online meets.,"Alright well this may sound stupid, so i apologize in advance. I already have difficulty attending meetings because of anxiety, but when they were around I'd force myself to. Of course now i keep hearing about online meetings and found myself avoiding them because well i don't want to show myself. I feel like I'm being rude by doing that but it just helps me feel better and much more engaged. So are there places I'm allowed to just have an audio meeting, i understand if this is already answered i just need to do more research, thank you.",15
2020-06-13 03:55:07,https://www.reddit.com/r/REDDITORSINRECOVERY/comments/h837tt/polyadvice_please_2months_clean/,poly/advice please 2months clean,[deleted],1
2020-06-12 22:37:37,https://www.reddit.com/r/REDDITORSINRECOVERY/comments/h7yvwq/how_can_i_help_my_boyfriend_to_tell_me_the_truth/,How can I help my boyfriend to tell me the truth about his recent drug taking so I can help him move forward without them?,[deleted],2
2020-06-12 14:01:34,https://www.reddit.com/r/REDDITORSINRECOVERY/comments/h7pqcw/3_days_clean/,3 Days Clean,"Hello all, I'm three days clean off fentanyl and I just wanted some help or encouragement if anyone was willing to do so. Any tips or anything would be appreciated. Thank you, God bless.",66
2020-06-11 16:19:51,https://www.reddit.com/r/REDDITORSINRECOVERY/comments/h174vm/i_get_addicted_to_hobbys_in_recovery_and_then_i/,I get addicted to hobbys in recovery and then I do them all the time until I can’t enjoy it anymore. How do I moderate behavior?,"I did it with reading, videogames, the internet, poker, guitar and singing, clothes shopping and basically any other possibly addictive behavior I did during recovery. This has been a pattern since I was a kid and I’m not sure how to break it. I remember thinking I needed to stop doing something and go do something else but the behavior is so ingrained that I would just go back to hyperfocusing on something the next day without thinking. I even tried making a schedule that moderated all the behaviors but didn’t even think to check it the next day.

I’ve been thinking a lot more about what’s actually happening in my brain because it helps with understanding how changing behaviors can feel so wrong because my brain hasn’t had time to rewire yet. Is this what it is? Is my brain just completely wired for compulsion and addiction? Does it take longer to break the habit if it’s been going on since childhood?

It can be a good thing if it’s turned towards something productive, like a project. But it also destroys the fun in everything I like and it’s stupid. I know this is probably adhd behavior  but I also can’t take stimulants and am just happier without having to worry about any sort of substance.",41
2020-06-11 07:56:54,https://www.reddit.com/r/REDDITORSINRECOVERY/comments/h0xx2q/looking_for_some_support/,Looking for some support,"Hi all, I know this is my first post here, and I may be in the wrong subreddit, but I need a little advice from you all. 

TL:Dr; My Aunt is addicted to valium and opiates, and is refusing point blank to do anything about it at the cost of her physical and mental health. I'm going through to her in a few days to try talk with her and would like some advice on how to approach her. 

I'm in Scotland and my aunt has been living in a different city for most of my life, she was on heroin for a long time before switching to methadone (yay, NHS). Shes been having epileptic seizures from what we can tell and is mixing valium and other powerful pain killers. She has had legit problems with her spine before, so she took to self medicating to try sort that out. 

A few weeks ago, she was rushed to hospital after being unresponsive, and has been kept in since. She's been uncooperative with the drs and is running my mum ragged getting things outside the house brought in for her. She's had MRIs and tests done and it has came back with nothing out of the ordinary. My mum has been helping her clean up her flat and throwing away (to a chemist) the medication she has been abusing. She would not get rid of a cube of hash (understandable, I've not got much of a problem with that), but what is worrying us is a large pill bottle full of valium. In hospital they have lowered her dosage of methadone and painkillers

 She is now looking to be released from hospital (surprisingly after her medication was lowered) and I'm worried that she will go straight back to self medicating or worse, ODing on something she can get from the streets. 

I'm a youth worker/teaching assistant and used to working with young people that society has let slip through, but it's a whole other thing when it comes to family.

I'm at a loose end and would like to have some outside experience on this. 

Thank you for reading through, and stay strong.

Edit: meant to say that we (mum and I) have been trying to get social work, housing etc involved. We've been in talks with her about rehab to try and get her better, but she turned round yesterday and told us to basically go fuck ourselves she wasn't going. Then demanded us to come pick her up and take her to where she lives.",3
2020-06-11 05:45:16,https://www.reddit.com/r/REDDITORSINRECOVERY/comments/h0w63z/ive_had_enough_i_am_going_to_rehab/,I’ve had enough. I am going to rehab.,[deleted],20
2020-06-11 03:32:48,https://www.reddit.com/r/REDDITORSINRECOVERY/comments/h0uiyc/possible_nose_damage/,Possible nose damage?,"I have over 9 months clean. I was clean for longer before but I was forced to be clean and now I want to be. I'll try and give a short summary. I been using drugs and mostly snorting pills from 14 and then coke and meth at 18. 

After I got clean last yr on a meth binge, I realized that sense 26th of September to now I can't smell as good as I once did. I somewhat feel congested even tho when I blow my nose nothing comes out. I've had white boogers for months and they have pretty much went away and sometimes I'll blow my nose and blood comes out.

I know I need to see a doctor but I wanted to ask if any one else has had this?",2
2020-06-10 19:00:45,https://www.reddit.com/r/REDDITORSINRECOVERY/comments/h0mjt7/some_assistance_rehab/,Some Assistance (Rehab),[removed],2
2020-06-10 07:03:33,https://www.reddit.com/r/REDDITORSINRECOVERY/comments/h08np3/my_dad_is_addicted_to_cocaine_how_can_i_help_him/,"My dad is addicted to cocaine, how can I help him?","Okay this is hard to write but it needs to be done. 
I've know since I was around 10 or 11 that my dad uses coke. I'm now 21. My brothers first birthday he was coming down so hard that he didn't leave his bed. Over the years though, things have become worse, a lot worse. He isn't a young man anymore yet he keeps shoveling that shit into his nose like he's 25. I'm scared, genuinely scared that he is going to kill himself. 

Well anyway I put my foot down and made him tell my mum what was going on. She was and still is heartbroken. Mostly for the reason that I have been whiteness to his usage many times and she never suspected a thing. 

He admitted to using a gram a night for the past three weeks. For a man in debt that doesn't sound cheap. 

He's promised me before that he would change. When I was 14 and found a bag of coke he promised me then. When I was 16 and watched him do a line he promised me then. When I was 18 being asked if I wanted to try it... I made him promise me then. 

This time, no promise. Not even a care in the world. Just his own guilt. I want him to see why he needs to be clean, why he needs to stop and live a normal life. I can't believe he's been using it for 10 years now, I've lied for him too many times. Now I need to give him the truth. He's going to die, he's going to destroy his family and he will not live to watch his two baby grandchildren grown up if he doesn't stop. 

My mum called for a divorce. Believing he can't hide that for so long and not have other secrets. 

I told him to get help (he already has CBT) from a therapist and to get help with his addiction but he doesn't see the issue. He thinks he can just stop. I don't get it... Why can't he see what he is doing? 

How can I help him, what can I say or do to make it easier. 

I'm so angry but I'm not selfish enough to make him deal with this alone. What can I do?",2
2020-06-10 04:04:40,https://www.reddit.com/r/REDDITORSINRECOVERY/comments/h06fyt/1_week_clean_and_counting_quitting_cold_turkey/,1 week clean and counting quitting cold turkey,Just gunna go for it pretty much. I was coming off of just experiencing losing four family members. 1 being my father then a few years later within half a year apart then lost three kinda back to back to back so sadly seeing it now all I wanted to do was numb myself. one night was offered to try smoking heroine and must of been the pain I was in cause I said sure and that led to being addicted to it for about two years only smoking it never got into needles or anything and fast forward to now 9 days ago I had to travel down to California to visit family so I’ve been clean since then I’m more so just wondering what I should do I went and tried to kinda figure it out for myself but it just kinda scared me cause all it said  that I was doing the worst way of breaking the addiction and I just would like some help or insight into what I should prepare I feel as Thoe Most of my withdrawal symptoms have passed I think I don’t know that’s why I’d just enjoy someone who would be able to help anything would be something sorry for punctuation on phone,7
2020-06-10 03:12:28,https://www.reddit.com/r/REDDITORSINRECOVERY/comments/h05t0p/deleted_by_user/,[deleted by user],[removed],49
2020-06-09 19:28:26,https://www.reddit.com/r/REDDITORSINRECOVERY/comments/gzz0dz/why_does_the_desire_for_alcohol_remain_after/,Why does the desire for alcohol remain after years of sobriety but the desire for cigarettes last only a few weeks after quitting? Is this common or just a personal quirk of mine?,[deleted],1
2020-06-09 11:34:23,https://www.reddit.com/r/REDDITORSINRECOVERY/comments/gzpffr/9_days_of_moderation/,9 days of moderation,[deleted],5
2020-06-09 11:25:47,https://www.reddit.com/r/REDDITORSINRECOVERY/comments/gzp9g2/i_24f_dont_know_how_to_address_my_social_drinking/,I (24F) don’t know how to address my social drinking. But I also don’t feel like an alcoholic,"Okay so basically. It’s in the title. Since quarantine started I’ve really really started to have a lot of self reflection on my relationship with social drinking. 

I feel like I either have one drink or I drink until I’m totally drunk. Thinking back, most of the time there has been no in-between. And the last few times I’ve been drunk I did some things and said some things I really regret. Totally black out at a bachelorette party and became “that drunk girl” and then the next time got into a huge blow out fight with my parents. 

Most of the time however, When I’m drunk, im the life of the party and don’t really have any negative repercussions except a hangover the next day. Usually people text me the next day saying how much fun they had with me or things like that. 

The issue here is that I don’t go out to drink often. So my husband for example feels like it’s just a rare occurrence since I usually dont “act out” when I’m drunk. I also have no problem having a glass of wine or two at home and not getting out of control. So to him he sees me drinking all the time and feels like I’m over analyzing my social drinking based on two bad days. 

Last night my cousin came over and he and my husband were drinking. My cousin asked why I wasn’t drinking with them and I told him why. I basically said “I feel like when I drink socially I’m either sober or drunk. Like I can’t control how much I drink once I start” my cousin didn’t make a big deal of it and never asked me to have a beer or anything the rest of the night. When we were going to bed though, my husband said he felt like I was making myself look really bad and sound like I had a serious drinking problem that I don’t have. 

But I feel like it IS a serious problem that since I started drinking at 15 that Ive never learned how to regulate. I always show up ready to party and get fucked up. And I feel like that’s a problem even if I’m only going out once a month. 

Where do I go from here? How do I address the severity of the situation without making myself “sound like an alcoholic”?????

TLDR- I feel like I might have a problem with social drinking and getting too drunk. Where do I go from here?",25
2020-06-09 03:07:39,https://www.reddit.com/r/REDDITORSINRECOVERY/comments/gzi1b9/circles/,Circles,"Every week is the same recently, I work through the week and end up getting paid on the Friday I always tell myself not this week save the money for something useful - how I’m going to at least take a break or only use on special occasions / events.

Sooner or later my brain is tricking me making excuses and reasons the typical “it’s weekend you’ve worked hard all week, some money is meant to be spent on yours self”

Sooner or later I cave in again telling myself well this is the only one I’m allowed.

Then it takes over “I’m only doing one bag that’s the rule” turns to well just one of the 2nd and by the Saturday there I am picking up again I hate how I can’t break this cycle I hate justifying it to myself 

I’ve tried distancing myself deleting numbers but  I always seem to find a way - it’s become by go to if I ever have an argument etc I just want to get myself out of this situation 

They best I’ve done is around 2 months but even then every time I had the feeling and was just distracting myself it never went away and I eventually folded 

Not looking for a straight forward solution just hopefully something I haven’t tried",2
2020-06-09 00:56:39,https://www.reddit.com/r/REDDITORSINRECOVERY/comments/gzgasy/everything_just_feels_kind_of_pointless_lately/,Everything just feels kind of pointless lately.,[deleted],3
