Date,URL,Title,Body,Score
2020-06-22 13:37:59,https://www.reddit.com/r/REDDITORSINRECOVERY/comments/hdwuc1/bureaucratic_roadblock_to_recovery/,Bureaucratic Roadblock to Recovery,"Help. 

I am a 32 year old male and I've been, in the language of the politically correct, physiologically dependent on opioids - in various forms, it's all the same junk - since the age of seventeen. By age twenty five I had comfortably come to terms with the idea of long term MAT w/ methadone or suboxone - with being a ""lifer"" as they call it. MAT has always worked well for me and allowed me to live to my fullest potential. Due however to the policies of the programs themselves and to my own transient pattern of living (residing back and forth between two different cities but in the same state, Michigan) I've gone through multiple MAT providers over the course of the last decade. 

For the last two years I've been paying a sickening amount of money out of pocket at the pharmacy mind you for a medication that my health insurer (Medicaid) should be paying for. The trouble is with Medicaid's Benefits Monitoring Program - It's basically like the police department for doctor shoppers and other insurance plan ""abusers"". The BMP has me ""locked in"" to a doctor 150 miles away in Grand Rapids and will only cover Suboxone prescriptions by this doctor. 

The irony in this should be apparent....

But, cool, whatever, easy fix right? 

Well, starting about two years ago, each time I would go to the pharmacy and try to have the RX billed through Medicaid, I would hear the same song and dance - ""You're 'locked in'. You need to call Medicaid and change your provider; here's the number yada yada"" 

And so became the routine that I would call Medicaid and ultimately after going through one or two or three or so support people and explaining a problem which I myself don't understand to each one of these people, I'm transferred to the Benefits Monitoring department. Seems like it's been the same guy answering for the last two years, and each time they/he point(s) the finger to ""United Healthcare"", my direct plan provider but this is through Medicaid (don't ask because I don't know). So... I call United Health and come to find out Suboxone is what they call a ""carve out"" or ""green card"" medication, meaning it's something that MEDICAID pays for. NOT United Health. As such, I must contact Medicaid. 

I contact Medicaid.... 

Eventually I'm brought back to the Benefits Monitoring department. Same damn guy... Talks to me like I'm a complete scumbag, system ""abuser"", ""doctor shopper"" what have you and tells me the same thing he did before - to contact United Health.

After about a year and dozens upon dozens of hours of repeating this cycle I gave up. Relapsed. Started drinking too. Made a dumb decision and ended up incarcerated for seven months...

Now I'm out. I was released from jail two months ago and I've been doing everything in my power to get my life back together. I started MAT again last month - living now in Traverse City Michigan - and I'm now dealing with the same issue. I'm unemployed at the moment (restaurant work is my occupational forte) and I'm having to rely on the help of my family and the kindness of strangers (I play guitar on the street) for an essential medication to which as I understand it I am fully entitled as a Medicaid recipient. 

This feels wrong on so many levels. I have contacted the bureau of Licensing and Regulatory Affairs - It's the number provided inside of that ""Know Your Rights"" packet. I'm still waiting to hear back, however, the team there that deals with these complaints are a part of a funding entity called NMRE which is essentially Medicaid's b\*&#% - you can see how I might not be too optimistic.  

The whole thing is extremely KAFKAESQUE. In fact I cannot think of a better word.

I feel like the only other route to take is a civil suit - Seems clear to me that compensation is in order (all that money that myself and my family have paid thus far while the insurer just bullshits me, sends me chasing unicorns). If I do end up having to go this route I'll need an attorney that works on contingency, as I have no money.

How can Medicaid be held accountable? I do feel that my healthcare recipient rights are being violated, in some way, and I do feel this is discriminatory. I'm also POSITIVE that BMP and the representative who is answering my calls in that department are in the wrong.. What do you think? I'm at a loss.",4
2020-06-22 11:24:10,https://www.reddit.com/r/REDDITORSINRECOVERY/comments/hduby6/do_the_lives_of_addicts_matter/,Do the lives of addicts matter?,"Ignore the title, I probably should not have chosen that phrasing. Anyways, it is a provocative question, so I am being provocative, and reading it has probably made you uncomfortable. You want to reflexively answer in the affirmative, but there is a whisper in your ear that won’t go away: maybe their lives, don’t, in fact, matter. Maybe they deserve whatever suffering comes their way.  Maybe the world would be better without them. 

I will grant you that last one, in that the world would in fact be a much better place if addiction, and addicts, didn’t exist. But they do. The various realities of biology, pharmacology, and simple, basic human nature have always, and will always, conspire to make addicts out of a significant proportion of all human beings. The consequences are tragic, and our general reaction, as a culture, to these consequences: also tragic. 

We generally treat addiction as a monstrous character flaw, and addicts as untouchables. But addiction is not classified as a personality disorder (notwithstanding the fact that one should also be able to have compassion for those unfortunate enough to afflicted with one) - it is a mental illness. The brain is, ultimately, a very sophisticated piece of meat, and having a thinking brain is not analogous to being a little homunculus driving a body - our brains are susceptible to unasked-for illnesses in the same way that our bodies are. The question of whether we truly have free will in the first place is one for people much smarter than me to debate, but no one can deny that given the uncountable number of variables and processes that go into making a mind, we are not as in control as we like to think we are. I like the analogy of a brain tumor. If someone were to develop a mass in a certain area of the brain, and their behavior began to change dramatically - to the point that they were essentially a different person - wouldn’t they be a victim deserving of compassion? They might become impossible to live with and hard to understand, but they didn’t choose to become that way. So, when basically the same thing happens to people suffering from a mental illness, through more mysterious  but no less physically real processes taking place in the brain - why do we react differently? 

So, if you can accept the fact that addicts are in fact suffering from a mental illness (one among many, as is most often the case), and that they are not simply people who have thrown caution to the wind and decided to yolo with the best of them, what does that mean for how we treat them? Haven’t we decided that it’s monstrous to see someone in pain because of an illness  and to ignore them? Wouldn’t it become monstrous to see someone suffering from some invisible compulsion - something that if they could only find the off switch for, something that makes them crave a time machine -  to see them and to ignore them? Wouldn’t it be be wrong to decide that whatever dreams they may have had, whoever they may have been before or may yet become - that these things don’t matter anymore because they chose their lot? 

This isn’t just a problem when it comes to addiction. It applies more or less to all mental illnesses, in that even though science has been telling us for decades that these things are in fact illnesses, we can’t resist assigning some value judgement to those afflicted. In a way, I think it’s a protective mechanism, because if you believe that mental illnesses only happen to those deserving of them, you can convince yourself you’ll never get one. That’s understandable, if misguided. What isn’t understandable is that, even in this age of supposed mental health awareness and supposed compassion for those suffering, I, and many others, still feel ashamed and terrified about how others might react. And rightly so. I still catch myself judging people who seem really down and out, even though I know better, so I can only imagine what other people must think. The culture is saturated with the idea that people suffering from mental illnesses, and especially addiction, are dangerous - that they are bad, irredeemable villains who are just reaping what they sowed. 

And sure, some are dangerous. And some are a drain on finances and emotions.  I was never quite dangerous myself, but I became preternaturally manipulative and I hated every second of it. But that is the nature of this illness, and we seem to be able to tolerate the bad things that come with the physical ones, and mercifully, some of the more palatable mental ones, because we recognize that no one chooses to become ill. 


Deaths resulting from self harm and substance abuse are the two top causes of death for 15-49 year olds in the U.S. One in four of all deaths are ultimately attributable to alcohol, tobacco, and drug use. So, did these lives matter? We certainly don’t act like it. And who is the monster - the person suffering, or the society casting them out?",4
2020-06-22 08:04:03,https://www.reddit.com/r/REDDITORSINRECOVERY/comments/hdr4du/im_not_sure_what_to_do_anymore/,Im not sure what to do anymore,"Hello, I have an addictive personality, my current addiction is both self sabotaging myself and DXM. I know what I should and can do for the dxm, but the self sabotage has been an ongoing battle and it’s severely crippling my life. I’m not sure how to properly recover and i feel even asking for help is pathetic, thank you in advance for any responses.",6
2020-06-21 23:13:54,https://www.reddit.com/r/REDDITORSINRECOVERY/comments/hdk716/struggling/,Struggling,[deleted],10
2020-06-21 19:07:54,https://www.reddit.com/r/REDDITORSINRECOVERY/comments/hdglab/3_months_sober_lately_overeating_rather_than/,"3 months sober, lately over-eating rather than relapsing.","have any of you had an issue with this?

been REALLY overeating a LOT lately as a way to deal with my pain. 

i'm a healthy weight. i think this is how i'm dealing with some relationship issues right now. is this normal? i',m forcing myself to stop. still better than killing myself with coke but fuck.",28
2020-06-21 13:49:01,https://www.reddit.com/r/REDDITORSINRECOVERY/comments/hdb50f/an_eye_opening_assignment_i_did_at_my_program/,An eye opening assignment I did at my program.,"Celebrating 90 days today and I feel like sharing a rough paper I had to write while I was in treatment. I had to write a goodbye letter to my daughter who is 5 years old, because I was going to go back to using and probably die. Here it goes

-Audrey,
Hey sweetie, first of all just know I love you with every ounce of my being. I hope this letter reaches you and I hope you can understand it, although you may not understand why. I dont even know how to begin. I suffer from the disease of addiction and have well before you came into my life. I knew having you while I was still lost in my addiction was a **bad** idea, but I had hopes that having you would get me straight, motivate and push me in the right direction. But it wasn't. It's not your fault, none of this is. Your dad just was not open and willing to try something new. Although I knew what was at stake I still let my disease run my life. During my addiction drugs were always my top priority, I would do anything and everything to stay loaded. Drugs kept me from you in your earlier years and they are going to continue to keep me away. You probably don't remember this but I didn't officially meet you until you were two years old. I had gotten sober around your second birthday. I did a residential program and made a promise to myself that when I was done there I was going to meet you and you were going to keep me sober. I remember the first time we met, you were on your grandma's iPad watching stuff on YouTube. Way too busy to notice me, which was fine. I was overjoyed with just being a stranger to you. But as time went on our bond formed. I remember one time I brought my mom to come meet you for her first time and you surprised the both of us when you called me daddy. Just then my heart dropped into my stomach and I finally felt important to you. Shortly thereafter my addiction came calling and I had to go. You were not enough to keep me sober, again, not your fault. Once i relapsed i was using until i went to prison at the end of 2017. I'm sorry for leaving you Audrey, it doesn't mean i dont love you. It sucks having one absent parent, it's even worse when both are gone. I can only speak on my behalf but I'm sorry your mom has slipped on her motherly duties. She had you at 19, neither of us were ready. Her  and I were on two different paths and could not come together for you. We both love you so much but we have our own issues. I am so grateful for your grandmother, because of her you are growing up in a safe, loving and nurturing environment. Something I could not give you. My grandmother, your great grandmother has been there as much as possible and loves you unconditionally. Unlike me she will always be there for you no matter what. Anything you ever need just ask her. I'm sorry that its come to this Audrey, but I have to say goodbye. I'm sorry that I wasn't there then, and won't be when you need me most. I'm sorry that I never made it to any of your birthday parties. I'm sorry I missed your first day of kindergarten. I'm sorry I won't be able to teach you how to drive. I'm sorry I won't be able to buy you your first car. I'm sorry I won't be there for any of your graduations. I'm sorry I won't be there to see you off to college. I'm sorry I won't be able to warn you about boys. I'm sorry I won't be there the first time your heart gets broken. I'm sorry I won't be at your wedding. I'm sorry I won't be there for you and your kids when you have them. I'm sorry I wont be there when you need advice on parenting. I'm sorry I failed you as a father. I'm sorry you're going to go your whole life with out me. Audrey I cherish and am going to continue to carry all the memories I have of you. You were the greatest thing to ever happen to me, I just wish I could of got my act together in time to be there for you. You're so smart Audrey, you can do anything you set your mind on. Set goals and work hard to achieve them. I had goals but I didn't put the work in to reach them. This is my goodbye and goodbye is forever. Love your life

-Dad",10
2020-06-21 00:02:38,https://www.reddit.com/r/REDDITORSINRECOVERY/comments/hd0cwn/update_most_complicated_situation_of_all_time/,Update: most complicated situation of all time blah blah,"To start, to the individual in this community who did the exact opposite of what I needed when I asked for help last night... I ask that you please refrain from posting on this thread and I vow to remain neutral.

ACTUAL UPDATE: 
After reaching out to some folks from my undergrad who know more resources in the area, I was able to find a couple places that can work with and accommodate the multi layered “not your average” situation 

To the individual who told me to attack insurance first, thank you. Cause that’s absolutely the first step to take.

I have since spoke with my brother and what I, we, (him and I) need help in is more on logistics.

He wants to seek treatment in the state I’m in (and some of his other family is in) bc he realizes that’s going to be his way of gaining natural support.

Does anyone have experience in getting residential treatment WITHOUT insurance and little to no private funds? Has anyone seeked recovery in another state and found you wanted to plant your roots there?

Am I making any sense? I’m trying to address one issue first before moving to the next. 

Logistics and finance is the present issue (as of 11pm on 6/20/2020)

This is a sincere post as I’m at a total loss and am admitting that I know I can’t help him by myself.
*disclaimer: so that it’s clear. He WANTS the help*",3
2020-06-20 21:36:37,https://www.reddit.com/r/REDDITORSINRECOVERY/comments/hcy88c/just_some_thoughts/,Just some thoughts,"The darkness weighs down on me like the weight of the sea, pulling at my feet, begging to take me to its crushing depths. Even though I can still see the light, it's too far away to grasp, and I wonder who will win the battle. I take a drag off the cigarette and wish the smoke could consume me and take me away to a place neither light or dark. Time seems to stand still and wiz past all in the same moment. This place is worse than death, but I can't seem to find a way to release myself to the darkness. I don't know if it's stubbornness or the light grasping on to me for dear life. So I sit here wondering if something will ever give, if the battle will ever be won, or if I’m stuck in an endless tug of war.",6
2020-06-20 18:33:16,https://www.reddit.com/r/REDDITORSINRECOVERY/comments/hcv83h/so_how_do_you_avoid_unnecessary_relapse/,So how do you avoid unnecessary relapse,"So how are you supposed to avoid an unnecessary relapse if you can't really avoid the trigger in the first place. I figured it would be wise to come to the people that have Tangled with this problem first hand.

Also if this is the wrong subreddit please let me know",4
2020-06-20 17:40:04,https://www.reddit.com/r/REDDITORSINRECOVERY/comments/hcubo5/forkn_sp00n_here/,ForkN Sp00n here.,"Yo do you know what I'm really relived what I don't have to deal with anymore from being sober? 

Not the 4 days binge of not eating or sleeping. 

Not the inside of my lips being chewed out and not being able to eat properly untill its healed. 

Not the thousands of dollars I spend in days. 

Not the calling into work sick.

Not the prostitutes or the like threatening altercatoins. 

I'm really happy I don't ask for ""rent"" money at 3am and I ask for 60$ from all my friends and I than have 100$ of messages from them asking if im alright and I have to deal with that and deal with paying them back and at the same time coming down.

&#x200B;

oof its nice being clean , 

I did make a video recently about how stupid I would sound asking for rent money at 3am and made me reaalize how crazy it sounds. if anyone needs it your in a better place right now and I am very proud of you for staying clean keep going. 

Sick.",13
2020-06-20 16:05:15,https://www.reddit.com/r/REDDITORSINRECOVERY/comments/hcst0p/7_months_clean/,7 months clean,Hey everyone I(21m) am clean 7 months this week. I still dream of using a few nights a week money has been low and stress high during the quarantine but I’ve managed to stay clean besides to few drinks here and there but never let it lead to something new even took my first drug test last week that I didn’t have to fake. I’ve been in a relationship for a few months too life has been good and I’m thankful.,55
2020-06-20 15:22:18,https://www.reddit.com/r/REDDITORSINRECOVERY/comments/hcs3ki/lets_try_this_again/,Let’s try this again,[deleted],9
2020-06-20 06:48:11,https://www.reddit.com/r/REDDITORSINRECOVERY/comments/hck7pq/deleted_by_user/,[deleted by user],[removed],9
2020-06-19 23:28:38,https://www.reddit.com/r/REDDITORSINRECOVERY/comments/hcexge/recovery_charities/,RECOVERY CHARITIES,[removed],1
2020-06-19 22:38:07,https://www.reddit.com/r/REDDITORSINRECOVERY/comments/hce898/deleted_by_user/,[deleted by user],[removed],2
2020-06-19 21:08:58,https://www.reddit.com/r/REDDITORSINRECOVERY/comments/hcczi7/the_obsession/,The Obsession,[deleted],6
2020-06-19 20:59:09,https://www.reddit.com/r/REDDITORSINRECOVERY/comments/hccuab/im_117_days_alcoholfree_but_i_still_use_xanax/,"I'm 117 days alcohol-free but I still use Xanax, Ambien, etc. Feeling guilty for not being completely sober :(",[deleted],24
2020-06-19 20:39:19,https://www.reddit.com/r/REDDITORSINRECOVERY/comments/hcciuq/any_advice_helps/,Any advice helps,"One of my close friends (16yrs) is going into rehab soon and he's really worried about detoxing there since they cant legally give him prescriptions so he'll just be going cold turkey.  Hes been tapering off xanax for a while now, he'll be done on the 25th and hes been using weed to help with the shitty withdrawals, was using vodka to strengthen the doses before but has stopped.  He tried quitting weed a bit ago when he was still tapering and it was terrible, that with the withdrawals were too much and now that hes going to rehab he wont have that as a crutch either.  Weed helped him a lot to sleep and to calm him down, but his tolerance is pretty high and hes gonna run out soon anyways in a few days.  So ig my question is how was completely detoxing or rehab for anyone who has gone through something similar? Was it a lot worse than tapering? Hes just been really nervous about the whole thing, please anything will help.",1
2020-06-19 20:21:06,https://www.reddit.com/r/REDDITORSINRECOVERY/comments/hcc7t1/any_advice_helps/,Any advice helps,[deleted],1
2020-06-19 18:07:49,https://www.reddit.com/r/REDDITORSINRECOVERY/comments/hc9xdn/have_a_question_about_alcohol_detox/,Have a question about alcohol detox.,"How long does it last? It’s day 4, is my sister over the hump? I couldn’t remember, it’s been 9 years for me (with some slip ups), nothing too serious) and I went to a detox. She got denied Librium? Paxil? Or whatever. She decided to self detox at home so I stayed with her. Lots and lots and LOTS of pacing. Her sleep is getting better, no seizures, some bad shaking.. idk what to do. Should I just stay another week? We got her a therapist, she’s doing AA online, she’s agreed to go to out patient. She’s very motivated. Motivated enough to where I had a friend who said Xanax? Would help and that she can have some and she denied that saying “no more poison of any kind” she’s strong. I’m just clueless as to how long this is gonna take her?",3
2020-06-19 17:21:27,https://www.reddit.com/r/REDDITORSINRECOVERY/comments/hc8y3q/found_my_way_back/,Found my way back,[deleted],1
2020-06-19 15:46:15,https://www.reddit.com/r/REDDITORSINRECOVERY/comments/hc7ed8/how_do_you_deal_with_the_idea_that_you_will_never/,how do you deal with the idea that you will never stop wanting to get high?,[deleted],44
2020-06-19 12:38:30,https://www.reddit.com/r/REDDITORSINRECOVERY/comments/hc3z21/i_need_advice_on_the_most_complicated_situation/,I need advice on the most complicated situation of all time,"I’ll try to keep this as short as possible.
My brother needs rehab for alcohol.
He does not live in the same state as I.
He without a doubt has an undiagnosed mental illness that is certainly a barrier to him being successful with treatment.
He also has a temporary disability due to health complications and alcohol abuse. He can only get around with a wheelchair or a walker. He has the potential to walk again, work again, etc but currently all of the issues at hand are stacking up and I don’t know what avenue to take.
He is also part of the LGBT community so he needs support there as well.
He’s willing to go anywhere (so he says)
But how do you address someone who doesn’t know they have a mental illness, is in active addiction, can’t walk without physical therapy, and quite frankly might not have insurance to fund this.

He will be 38 this year and if he doesn’t get into treatment soon, he will without a doubt not see 39.

Any advice is so so appreciated.",12
2020-06-19 12:13:39,/r/relationship_advice/comments/hc1x5m/boyfriend_is_addicted_to_video_games_while_in/,Please help me stop caring about this,,1
2020-06-19 09:17:44,https://www.reddit.com/r/REDDITORSINRECOVERY/comments/hc0j20/tasting_a_very_small_beer_in_recovery_without/,Tasting a very small beer in recovery without swallowing it; would this be considered drinking/relapsing?,[deleted],1
2020-06-19 08:23:56,https://www.reddit.com/r/REDDITORSINRECOVERY/comments/hbzr30/one_and_not_the_other/,One and not the other.,"Is it possible to just wanna be clean from one drug at a time? I really wanna quit alcohol. But MJ helps from
Time to time.",4
