Date,URL,Title,Body,Score
2020-02-08 15:17:33,https://www.reddit.com/r/REDDITORSINRECOVERY/comments/f0x1yi/i_dont_know_what_to_do/,I don’t know what to do...,"(X-posting to r/marriage )

Okay, bear with me because this might get a little long. 

My husband (35m) and I (34f) are high school sweethearts. We have been together for almost 20 years, married for 5 of those. We had always gotten high together but after I had my first daughter our drug use got out of control and we both ended up having a raging addiction to oxy’s and heroin. I got clean about 7 years ago, he got clean a few months after I did. I got on the suboxone program and after months of him taking mine I told him he had to get himself on the program or that was it. Things have been awesome since we got on the program, we both have good jobs, drive nice cars, own our home, and I recently went back to school to pursue my substance abuse counselor license. 

Things changed back in may though. My husband decided he didn’t want to take suboxone anymore, so he went through a detox and got off of it. He did great for the first two months, and then I think the never-ending lethargy and lack of motivation started to get to him. He started drinking every day. After a month of that I put my foot down and told him I would not stay married to an alcoholic. We have had so many arguments, I just can’t take it any more. I have so many dreams of using now and my stress level is at a constant 100%. He stopped drinking during the week, but once he starts drinking on Friday afternoon he doesn’t stop until late Sunday night. When he has a long weekend off or any day off, he spends it drinking. I took him to a concert a couple weeks ago for his birthday, and he drank Thursday, Friday, Saturday, Sunday and Monday, took Tuesday-Thursday off, and started drinking on Friday again. He tells me he doesn’t have a problem because he only drinks on the weekends. I am at a loss. I have told him that I can’t be with him if he chooses to continue, (my dad and brother are alcoholics, I lost my dad to drinking and driving when I was 12 so alcohol is the one thing I can’t tolerate). Even though I am going to school for this, I’m having a hard time dealing with it in my own life. Our daughters are 9 and 13 and they love their father dearly, which complicates things. I’ve tried being supportive, I’ve tried being firm, nothing gets through to him. My patience has run out though and he knows I am at the end of my rope but he still does it. I just want to know what other people think and what they would do, some outside perspective might help me make a decision.",2
2020-02-08 08:58:34,https://www.reddit.com/r/REDDITORSINRECOVERY/comments/f0rwg9/need_some_help_if_possible/,Need some help if possible,Post,3
2020-02-08 06:34:02,https://www.reddit.com/r/REDDITORSINRECOVERY/comments/f0qhds/how_long_do_i_have_to_stop_drinking_to_break_my/,How long do I have to stop drinking to break my coke habit?,"I have a habit where every time I drink I end up binging on coke. I'm in college and I love going out with my friends and drinking, but now every time I drink I do coke. I want to quit drinking in order to quit cocaine, but I don't want to permanently quit drinking. How long do I need to stop drinking in order to be able to drink again without doing coke?

Thanks",1
2020-02-08 06:26:51,https://www.reddit.com/r/REDDITORSINRECOVERY/comments/f0qf05/sober_a_year_and_a_half_today/,Sober a year and a half today!,"Never thought I'd see the day

About two years ago I hit my lowest point ; pan handling on the street, lost my career, fiance left me, drinking hand sanitizer and mouth wash when I could get it. Family intervened and took all my firearms away. I still have no recollection as to the events that proceeded that.

Did one stint in rehab, was kicked out when they found me passed out on my floor in my underwear having pissed myself. Did another stay in rehab, this time for a year. Moved out of there, decided to stay in the city that it was in and enroll in college where I now study mental health and addictions.

Thank God and and AA, because I could never have done it myself.

Hope everyone has a good day! :D",87
2020-02-07 13:51:02,https://www.reddit.com/r/REDDITORSINRECOVERY/comments/f0exaw/getting_tested_lately/,Getting Tested Lately,"I won’t but am tempted to throw these 625 days of sobriety out the fucking window.

Job sucks (big issue here too much to write), husband’s lost patience with my stressed out SHIT and messy space, I’m tired, my workout schedule is a wreck, i started grad school and work isn’t giving me any downtime even off hours so I’ve pulled four all-nighters the past two weeks and haven’t started this week’s schoolwork yet, I stopped dreaming about my dad and brother (both passed) months ago, lost a grandmother over the weekend, and I went to sweet frog in desperation last night only to find them out of almost everything. I’m celiac but ended up sucking it up and getting cookies n cream so now I’m also in pain. 

OMG this has to stop.",6
2020-02-07 12:54:14,https://www.reddit.com/r/REDDITORSINRECOVERY/comments/f0e3i6/helping_someone_who_is_homeless_with_drug/,Helping someone who is homeless with drug addiction.,"I have recently found out that someone I used to know as a teenager is homeless, addicted to drugs and often begging at my local high street.

Myself and a few other people have decided we should do something to help. But in all honesty I have no idea how and I dont want to make anything worse. 

If anyone has any advice on how to go about doing this or links to helpful sites I would be grateful.

Apologies if it's the wrong sub to post in.",4
2020-02-07 12:40:03,https://www.reddit.com/r/REDDITORSINRECOVERY/comments/f0dw4l/day_1_part_1/,"Day 1, part 1","The inevitable has come, today is the day, and I am left with nothing but dust....

I have been so proud of myself this last week, tapering my doses and sticking to my schedule. I don't know why I thought this would help ease my detox, it hasn't. After my last dose yesterday morning, I slept for hours, all I dreamt of was redosing. I woke up to a phone call, to the sound of your voice, you are forever keeping me grounded. I blocked my plugs number with shaky hands and slowly drifted back off into my numb slumber. 

This morning, when I opened my eyes, I felt my body starting to react to the absence of the poison. My blood pressure crashed, my body temperature is the lowest I've ever seen it, my once beautiful face now pale with sharp cheekbones and shadowed eyes, my lips are cracked and bleeding, a sharp pain in my stomach, a darkness in my mind... How foolish I was to be hopeful that the inevitable could be avoided this time. Now I shake as my skin crawls, every vein begging for a taste of that poison, my lover, for she is my only cure.

Asleep again, plagued with memories of using. How it felt, all those months ago, to feel it for the first time... How it used to make me dance, how it made me feel like I was super woman, how I became the world's most productive worker and mother. But when I opened my eyes, moments later, I am reminded of the damage I have caused... 

I called the kids in sick from school today, claiming the family had all come down with the flu. The reality is I couldn't drive them safely, fuck I couldn't even stand. We're all in the living room, I'm letting them watch TV and tell them mommies sick so they need to be good to me today. My 9 year old feeds his little brother breakfast, and he leaves me a poptart next to my chair. These boys, I have failed them... 

I know I could have it much worse, that my life isn't as bad as many of those before me. I have been an expert at hiding, well, mostly... But, in retrospect, I could have failed more, despite feeling I've been the worst. No jail time, no institution, no social workers at my door, no suspecting teachers or coworkers or friends.... I tell myself it could be much worse, I still have something left to rebuild. None of those thoughts stop me from the guilt, none of those thoughts can ease the crushing weight of the things I've done. 

How did this begin you ask? It's been a life long affair really. I started out as a foster kid, knowing exactly how to handle that first baggie, knowing damn well what it does to people, having seen it and lived it, but I didnt care, I was so numb and dead inside, and in actuality, no one would even care. So it was then I met the love of my life, her poison washed over me, making me feel like the first time I was truely alive. She gave me confidence, she allowed me to survive, she got me through the years of abuse and unwanted touches, she kept me firm on my journey and eyes set ahead on my goals. 

Years later I was adopted by a wealthy family. They had horses, even bought one just for me. It was a dream come true, everything I had ever wanted. They loved me as if they made me, even though by that time i was already 14. I remember the first time I quit, mom thought I had the flu, she stayed home from work and took care of me. My body bounced back quickly, back to school i went.. No one ever knew back then, by that time the substance was such a constant in my life that no one had even seen me sober. Straight a student, president of my 4H club, captain of the swim team... But now they all knew something was off, i wasnt myself... I began to lose friends, i withdrew, i dropped out of the swim team, and i asked my mom if i could go to school online instead. I got sober for the first time at 16, but it didnt last long. I went right back to the only love I've ever known, and she was there to welcome me. This time was different, she didnt treat me like she did before... 

Maybe I had chaged? Maybe because I was no longer using for the sense of survival? In either case she brought hell... At 17 my parents forced me into a rehab program, their disappointment was immeasurable. They didn't understand what happened, why I did this, why I ""changed"". They could never understand that all I was trying to do was be myself! I finished highschool online, somehow still managing a 4.0. I graduated early, top 3 of my class, and with honors, that's about every thing I accomplished in rehab. Still, I was able to find my footing and decide I wanted to live without my love. 

And I did! For 12 long years, I lived my life of sobriety. I went the college. At 19 I bought a house. By 20 I met the man of my dreams. Years passed and he became abusive, we had two kids, and I left him at 24 after his abuse shifted to the boys, for I knew I was a strong woman, and I would give my children the childhood I never had. Fast forward, he dipped state,I struggled to support two kids financially but I managed. Met another man, we dated two years, split on mutual terms, he's still my friend, just texted this morning acutally. And then I met *her* and my entire world shifted. My heart stopped the moment our eyes met, and from that point forward it's like it beat only for her. And to this day, it still does. 

... Looking back I dont know how I got to where I am now. Things just slowly fell to pieces. I lost focus, I gave too much maybe, and then I gave in. 

Idk. I'm going to cry again. I should shower, I feel so gross. Maybe I'll write more later.",8
2020-02-07 11:38:17,https://www.reddit.com/r/REDDITORSINRECOVERY/comments/f0cz6t/two_months_juul_free/,two months juul free,"i am 35, i know, vaping is supposed to be a teenager thing. i used one for almost three years, very expensive habit and i hated myself for how attached i was to the thing, and worried what that much nicotine was doing to my body, my veins in particular.

it took me several tries of quitting but two months ago i smashed the last of 3 juuls i had left. The withdrawal was intense for me: night sweats, warped sense of time, waking up every hour thinking it was morning.

i’m posting today because i have been really wanting to go out and buy another one, but i am not going to today. 

mostly i don’t want to go back because i feel so bad releasing those little plastic pods into the environment. 

i realize that maybe i could work on another reason, which is maybe i am worth it. 
thank you for reading this. please, no replies to tell me it’s not a bad habit. thanks.",2
2020-02-07 10:13:22,https://www.reddit.com/r/REDDITORSINRECOVERY/comments/f0brvv/please_help_im_addicted_to_fentanyl/,"Please help, I’m addicted to fentanyl","I am 5”2 and 100 pounds and I am taking about 2-3 grams a day and unless I’m sitting down it doesn’t even phase me. What I mean is, I’m fully able to work and walk around like a perfectly normal person you would not even know I am on it. I need to quit I’m scared to die and I can’t keep living my life this way. I really want to use Kratom to try and get myself off it and I don’t know if that will work? I have Suboxone too but I guess I’m here looking for advice on if anyone has had success quitting fentanyl with Kratom. Please help. I’m a mom and I can’t go to rehab or my sons father WILL take custody and then I would be suicidal (again..)",16
2020-02-07 08:13:46,https://www.reddit.com/r/REDDITORSINRECOVERY/comments/f0ab2q/trust_issues/,Trust issues,"I've been sober last year and the day i completed a year i had a beer with a friend. Felt not good and two days later I drank a bottle of vodka. Got so mad at myself and decided not to do it again. For a couple of weeks I was doing fine and over what I did. But I had a job offer in the same place I was getting high at all the time. I panicked and I've been fantasizing about using and drinking since then. Yesterday I got drunk and my friends tried to not let me drink but I insisted. I got home to find my mother who helped me a lot getting sober. She got angry and her trust is down right now. I feel like I'm losing control over every aspect of my life. My work, my relationships and my whole life are falling apart. My family won't trust me again and my friends also. To rebuild the fallen trust I've been working on seems like a whole lot of work I'm not able to do. I'm overwhelmed and I don't understand the depth of the urges that makes me want to use or drink. I'm so frightened that I walk the same path I had before I got sober more than a year ago.",21
2020-02-06 14:45:17,https://www.reddit.com/r/REDDITORSINRECOVERY/comments/ezxrns/using_dream/,Using Dream,"I had another using dream a few nights ago but it was my first one where I didn't drink! Usually, in my dreams, I will drink then be really upset that I did and this time I didn't drink but was upset that I was thinking about it. Progress I think...",4
2020-02-05 20:07:40,https://www.reddit.com/r/REDDITORSINRECOVERY/comments/ezk598/im_so_scared_im_going_to_fuck_everything_up_how/,"Im so scared I’m going to fuck everything up, how can i calm this thought","We can finally say it man, you just have to make a routine /schedule but I can say I’m 
Proud of you. You have a long way to go and more to complete but you can finally start saying you have earned things, you earned having this job, you earned having a girl, you earned being 4months clean of self-harm, and there is only so much more for you to earn keep it up, I love you.",6
2020-02-05 18:25:43,https://www.reddit.com/r/REDDITORSINRECOVERY/comments/ezinyc/clean/,Clean..,"I’m around a week and a half clean.. I-idek if it’s a big deal for anyone.. the lasts time I self harmed was Jan14. 

But yeah I’m a little proud of myself. I felt tempted a bit earlier because my father screamed at me but I didn’t do anything, instead I just talked to a friend of mine. 

❤️

Edit: thank you so so so much for the very kind comments 🥺♥️♥️ i never thought people online could be so kind 😭

Thank you thank you so so muchhh",13
2020-02-05 11:39:14,https://www.reddit.com/r/REDDITORSINRECOVERY/comments/ezc8pq/making_the_switch/,Making the switch,"Hey, redditors in recovery. I am looking at very likely switching from Subutex tablets to the sublocade shot. My insurance has already approved it, and my doctor has agreed to let me switch. I’ve been stable on subutex for 4 years and I’m so ready to step off. 
My goal is to start the shot, and then after three months of being on it I am going to allow myself to taper off. Well, it won’t be a traditional taper, but the shot apparently leaves the system so slowly that weaning isn’t as bad as you would think. W/d symptoms are bearable, according to the few I’ve spoken to who have gone through it.  So, I’m trying to gain some insight from those who are either on it or have been on Sublocade. I understand that it is still relatively new, and many do not yet have access to it. This is a shot in the dark, for sure. 
Thanks for sharing with me.",2
2020-02-05 11:22:30,https://www.reddit.com/r/REDDITORSINRECOVERY/comments/ezbziq/just_celebrated_another_anniversary_1311996/,Just celebrated another anniversary (1/31/1996),"I'm a bit late in posting this since I'm mostly a lurker here, but last Friday I celebrated 24 years. I've now been clean for half my life. I started in NA when I was 22 and it took two years and a few relapses (and the collapse of a relationship) for me to decide that I needed to stay clean for ME. I wasn't sure I belonged here because I'd only been using for a handful of years, I'd never been arrested, and I'd never been to jail. Eventually I learned that in my head, I'm just as sick as the rest of y'all in the rooms. Once I came to that realization, it was easier for me to get focused on my program and make the steps work for me. It's been a wild journey, but I wouldn't change it for the world.

To the newcomer who may not be sure if they belong here: listen for the similarities, not the differences; you'll eventually hear somebody share your story.",6
2020-02-05 07:40:14,https://www.reddit.com/r/REDDITORSINRECOVERY/comments/ez8z02/i_am_6_months_sober_today/,I am 6 months sober today!,"That’s it, haha. Just wanted to put it out in the universe!",196
2020-02-05 00:06:42,https://www.reddit.com/r/REDDITORSINRECOVERY/comments/ez470f/my_partner_just_enrolled_in_an_alcohol_outpatient/,My partner just enrolled in an alcohol outpatient program,"It was a long road to get here, but he is doing the work. I noticed on our first date that he could put away hard liquor without flinching, 3yrs ago. We moved back near his hometown for a job promotion just over 2 yrs ago and the life transition just went terribly. I have lived with partners before, he hasnt. I went beyond broke unable to find work, and his finances just werent organized to cover. This combined with old toxic friends, arrested interpersonal skills, and dysfunctional family history led to unmanaged stress, more drinking and here we are. None of it was done on purpose, it was chaos that seems to make sense now that we know where much of it has come from. 

He is not abusive, he is distant. He doesnt party in bars or have the trigger of seeing other people drink, he drinks alone at home after work. He realized he was an alcoholic in Sept 2019, and started his outpatient program this week. We have went thru spells before of almost splitting up, no sex, distance, leading up to realizing that addiction is the center of the problems we've faced. 

What can I do to support him and connect with him, without smothering him during his program? I was looking forward to having a few evenings off of work (I am a waitress) to spend time with him and it's very eerily quiet here at home. He hasnt had a drink in 3 days and I can tell he's adjusting. I have no idea what going on in his mind, I dont want to smother. He is subdued, distant and feels cold. He came home from his meeting last night almost in tears and didnt say much. I hug him and tell him I'm proud of him. I make us tea and fold his laundry. 

His program is 3 nights a week, they want more but wprk with him because his work schedule is demanding. I hope to adjust my schedule to be home at night more. I just dont know what to do to help keep it together. I DO and WILL continue to make a point to take care of me even though I hate where we live. 

But if I'm being honest I'm not sure if we will make it. I'm not sure if he is capable of showing up emotionally in the ways I need in order to build a life together. I currently feel like there may not be room for me. I hope on the other side of rehab the man I met is still in there for me and us, but I also wonder if he even knows who that person is inside. 

I dont want to give up on us, but I want to feel loved and wanted too. 

I guess what I am asking is, in hindsight for those of you who have been thru alcohol rehab, what did YOU need when you were in that space? Any tips are appreciated. Thanks in advance, yall are rockstars.",17
2020-02-04 14:44:36,https://www.reddit.com/r/REDDITORSINRECOVERY/comments/eyvrcy/need_some_help_maybe/,Need some help maybe,"So I'm 16 years old from sweden and been in rehab since I've been 14 I lived at a rehab for 1 year and 3 months was there only for smoking weed and that my father was a addict, it worked out really good the first 10 months didn't take anything went to school stopped smoking cigarettes for a while everything went good but 10 months passed and nothing happened I was just there no rehab at all in my opinion I meet a drug therapist 1 day every week but anyway 10 months and nothing happened they said i couldn't move back home even though i did everything so I thought fuck it nothing happens anyway so I ran away a couple of times at 1 time I first discovered esctasy and I loved it alot, so 5 months passes and I moved to a foster home and everything worked out for about 3 months but all i did every day was playing games because i didn't know anyone where i moved so after a while i started to get bored so i started smoking weed and then a esctasy then 1 day social services came to the foster home and took me to a rehab and been here for 7 months now but the problem is I collapse like once every month on esctasy/MDMA everytime I go on a permission I collapse because I like mdma too much so I need some help to fight the cravings for the drug I've been clean for a month now or something and I'm afraid that i will collapse again i get these thoughts that I want to take something any help would be appreciated. Hope anyone read all this I might not be the best writing long texts as my grammar in English is not that good so yeah just a 16 year old that need help thanks for me",1
2020-02-04 13:43:56,https://www.reddit.com/r/REDDITORSINRECOVERY/comments/eyurhm/do_you_know_rule_62/,Do you know rule #62?,"It is on page 149 of the 12 and 12.

Been in AA for 31 years and had never run across this.  

Really apt and important!",15
2020-02-04 10:15:49,https://www.reddit.com/r/REDDITORSINRECOVERY/comments/eyrh3p/recovery_info/,Recovery info...?,"Sorry if this isn't the right sub, certainly remove it if it's breaking any of the rules or intentions of the sub please.
I'm in my mid-forties, and have been a functioning addict 4 all of my life. I drank heavily and indulged in anything I could get my hands on until I was in my mid-20s, starting around 14. In my early twenties I developed a love for speed, as a result of the circles that I ran in, mainly cocaine. I've always beenable 2 maintain a job, and my relationships usually allowed for me to sell to other users, that I might get my own Supply relatively inexpensively.
By my early thirties, through seemingly endless struggle, I was able to stop using everything but pot. With the current attitude surrounding marijuana, I feel silly even posting this. I don't feel the problem is with marijuana itself, but it has everything to do with my attitudes and the way that I think.
 I'm simply an addict.
Regardless of what it is that I feel is providing me with my happy space, I go ahead at 110%... and then figure out how to push the envelope further. My life has been littered with behaviors that I had to cut out completely because I couldn't figure out how to participate in a healthy moderate manner.
My days are the same as they've always been, I wake up 5 in the morning start smoking, work out, smoke, head to work where I proceed to smoke 4 to 5 times throughout my work day, before heading home to wash rinse and repeat. I should share that this is absolutely Anon acceptable behavior in my workplace. I would instantly lose my job, which is subject to drug testing, if my usage were discovered. I have a wonderful wife who at most drinks a few glasses of wine throughout the course of a year, and I feel like she deserves somebody stronger.
The deal is, after everything else that I done, herb just seems so not dangerous. I feel like I've learned things from it, but I also feel like I'm ready to move on. There's nothing about the substance that I feel is problematic, rather the problem resides within my head. The problem resides in trying to stay as high as I can all day, because that helps to keep my mind from searching for other things, and it scares me a bit.
I had overdosed a couple of times as a teenager, and I have been through several faith-based recovery programs, but my faith has become very personal, and no longer aligns with the recovery programs of which I am aware.
Are there recovery programs for people who are simply addicts? I think it's more of the adrenaline and escape-probably just the escape-that I am addicted to. I've been in counseling for almost a year now, and while it has shed some light on some of the issues in my past and I am working through that, I don't feel like we're making any progress on my issues with being sober.
Anyone out there with similar histories, or suggestions?
Thank you if you have read this, and congratulations on choosing sobriety.",2
