Date,URL,Title,Body,Score
2020-02-28 20:50:04,https://www.reddit.com/r/REDDITORSINRECOVERY/comments/fb5dfg/been_studying_psychology_and_had_this_thought/,Been studying psychology and had this thought - being dependent on a substance is like being in a relationship with a sociopath.,Will do everything you hope but won't love you back,47
2020-02-28 02:24:13,https://www.reddit.com/r/REDDITORSINRECOVERY/comments/far1ir/what_would_the_title_of_your_chapter_in_the_basic/,What would the title of your chapter in The Basic Text be?,,14
2020-02-27 11:22:53,https://www.reddit.com/r/REDDITORSINRECOVERY/comments/faejaz/what_do_you_call_earthlings/,What do you call earthlings?,"I use earthlings, earth people, normies, civilians....

What do they call the ""normal"" people who aren't in recovery in your area?",9
2020-02-26 21:12:42,https://www.reddit.com/r/REDDITORSINRECOVERY/comments/fa4svi/one_year_sober/,One year Sober!,I just hit my one year clean on methadone and 4 years off heroin and meth. I am super duper proud of myself but keep it all private. I just needed to share. If anyone has questions about anything I am here.,127
2020-02-26 12:38:05,https://www.reddit.com/r/REDDITORSINRECOVERY/comments/f9wwf9/how_to_deal_with_ptsd/,How to deal with ptsd?,"I had the shit beat outta me pretty bad and it honestly fucked me up. 

So I accidentally pissed off this guy I’m living with. I was like “please don’t start shit” and he started saying I’m the one who started shit. I started having a panic attack and left the place to buy some cigarettes(was literally 1 day off them and was trying to quit so damn bad). Then after the smoke it kinda set my head straight but then I grabbed a screw driver and hid it in my jacket in case he decided to fuck with me. I’m laying in bed now and starting to realize this ain’t normal behavior. I’m wondering if I got ptsd or some shit. I’ve been choked unconscious before and beaten up and the idea of someone doing it to me makes me extremely hostile. Also I’m  17 days off Kratom but many many months off speed. And 3 days off weed. And just because you take away the drugs doesn’t mean your mind is automatically cured. I still remember what happened. I can’t afford counseling or a therapist as of rn but I might in about a month or so. Any advice until then? Because its been effecting my daily life since I was a kid. I’m not a violent person but instinct kicks over once certain emotions are pressed.",5
2020-02-25 23:23:32,https://www.reddit.com/r/REDDITORSINRECOVERY/comments/f9nlf4/stay_blessed/,Stay blessed,"If you made it through today clean, count today as a huge win! Say a prayer for the still struggling addict and for those who pick up for the first time. They need our help. I love you all even if we will never meet.",5
2020-02-25 22:12:40,https://www.reddit.com/r/REDDITORSINRECOVERY/comments/f9mn6r/should_i_apologize/,Should I apologize?,"Should I apologize?

To keep this short basically I can’t get my ex girlfriend off my mind I hid my drug use from her which made our relationship come to an end she still doesn’t know the reason I was pushing her away is because I kept going deeper and deeper into my addiction and was embarrassed not only to be around but to even talk to her on the phone when I was using so I started avoiding her most nights to go use and she’d always wanna yak about what’s wrong with us but in reality I was the problem my question is do I write her and apologize for what I did and explain the situation that I’m cleaning myself up or just leave in the past I know I truly hurt her from using drugs and alcohol and so many lies she is an amazing person that never deserved it and to be honest I’m not sure if I’ll ever move on I really did love her I knew she loved me she tried and tried to hold on and I pushed her farther and farther away the more I used i know I should not try and get back together because personally i don’t think it will ever work with what I’ve done P.S sorry for bad grammar again I don’t have much education",5
2020-02-25 11:33:09,https://www.reddit.com/r/REDDITORSINRECOVERY/comments/f9cvhw/how_the_fuck_do_i_cut_off_good_friends_who_are/,How the fuck do I cut off good friends who are bad influences?,"I tell myself that I'm going to do it but in the moment I just can't. Most of my best friends are from meetings or rehabs and a good chunk of them are still/again getting high. They're such amazing people and they don't pressure me into picking up on purpose but it ends up going that way all the time.

Worse yet I've been one foot in one foot out fir a long time and a lot of my friends are the same way. We'll both have a couple weeks or a couple months and we get together and somebody jokes about picking up and then it's not a joke anymore. Last time my homie joked about smoking some crack so we picked up a 20, next thing you know I'm kicked out of my SLE and I pick up crystal (my DOC) on the way over.

A good half the time I'm either the one who starts the joke or makes it happen or both and I respect people who've cut me off for that reason even though it hurts. But I've also had so many people reach out and help when I'm unsure of my recovery that it's really hard to tell people I can't hang out because they're not serious enough or I don't want to talk on the phone until they're at least trying to get clean without feeling like I'm betraying them and by proxy myself when I'm in that position.

 I'm starting to understand the importance of the ""stay in the middle of the herd"" concept. I tell myself I'm going to set boundaries next time someone hits me up but they're just such fucking decent people even when they're using that the words don't come out of my mouth. I'm sure sometimes it's about subconsciously keeping the option open but sometimes it's just about wanting to stay close with people I love no matter what. Being a good friend to people who have supported me is really, really important to me and I just don't know if I'm willing to sacrifice that trait in favor of my own safety and well-being. And yet I know where it leads, and unlike some of my friends I'm not always capable of being a good friend when I'm getting high...

Ugh. Rant. Advice is welcome although to be honest I'm probably going to argue with you.",3
2020-02-25 10:03:58,https://www.reddit.com/r/REDDITORSINRECOVERY/comments/f9bj8i/i_am_struggling_with_my_sobriety_after_a/,I am struggling with my sobriety after a devastating break up.,"I am going on 8 years clean and I feel ready to throw it all away because of this heart break. I’m a 26 year old woman who just got dumped out of the blue by a 30 year old woman. She said it had nothing to do with me, and that she just “wasn’t feeling it anymore”. This came out of nowhere as we had literally just been talking about our future together. We were about to buy one plane tickets to Europe, we were planning on buying a house, ect. People close to both of us have reached out to say that they’re equally as confused as I am by this because it came from nowhere.

So now my life is in a state of disarray. There were no warning signed and now I have to rewrite my future without her in it. I’ve been through break ups before, but honestly never felt that anyone loved me like she did. For the first time in my life, I felt loved. 

And now all I want to do is throw away my clean time and use because I can’t stop crying, I can’t do anything, and all I can do is feel this horrible pain in my chest all day every day. I would kill to numb this pain.

I work at a treatment facility so my job entirely depends on my clean time. I am in school (finals week too) and I was doing really well up until this point. And now I want to relapse because what’s the ducking point anymore? I’ve never felt this level of pain before. I just want it all to go away.",28
2020-02-25 10:02:53,https://www.reddit.com/r/REDDITORSINRECOVERY/comments/f9biol/they_said_i_would_gain_weight_after_quitting/,They said I would gain weight after quitting smoking how long does it take :(,I'm 5 foot 11 and I only weigh 127.  I've been off heroin and meth for 2 years but am on methadone I've been a cigarette smoker for about 13 years and quit last month maybe I'm just impatient but I really need to gain weight and I've been told by a lot of people and doctors that I will most definitely gained some weight does anybody know how long and maybe on average how much weight I might gain... particularly any experiences from naturally tall and skinny people like myself with Fast Metabolism would help,1
2020-02-24 16:29:27,https://www.reddit.com/r/REDDITORSINRECOVERY/comments/f8yjqq/after_a_full_year_its_finally_over/,"After a full year, it’s finally over.","I found an entire bottle of norco yesterday. I thought about it. Then I turned around and went on a run. I’ve been hardcore addicted to opiates for the past year of my life. It happened so fast, before I knew it I was taking oxy multiple times a day to the point where I was acting so erratically I genuinely could not see that the addiction was causing the horrible mood swings, depression, and anxiety when coming off of it. I’m 20 now, and not a single person really knows how bad it was. It’s been two weeks. And I was able to refuse yesterday. I’m slowly forgetting the feeling which is awesome, let’s hope it sticks. I’m fucking proud of myself, even if I can only tell internet strangers lol. Here’s to recovery!!! It’s worth it.",104
2020-02-23 01:55:10,https://www.reddit.com/r/REDDITORSINRECOVERY/comments/f861r7/help_sos/,Help SOS,"I’ve been in a relationship with my current gf for about a year now. When we started hanging out all we really did was get fucked up (mainly drinking) and I ended up overdosing on heroin (recovering addict) which violated my probation and went to jail for 4 months and was released into an intense 18 month drug court program which I’ve been in for almost 4 months now.

They drug test 3-4 times a week and I go to iop classes 3 days a week and even outside of that they run my life. She made the decision to stick around and support me but lately she’s been breaking promises she makes with me to spend time and instead goes out and gets fucked up with her friends. I love her to death but this shit is weighing on me I don’t know what to do I need suggestions please",21
2020-02-22 22:33:22,https://www.reddit.com/r/REDDITORSINRECOVERY/comments/f83y8j/what_are_you_grateful_for_today/,What are you grateful for today?,,6
2020-02-22 15:34:04,https://www.reddit.com/r/REDDITORSINRECOVERY/comments/f7yd1t/need_advice_badly_for_recovery_and_marital_sex/,Need advice badly for recovery and marital sex (possibly sex addiction?),"Really need some advice. I've been so effing sexually frustrated/disappointed  in my marriage that it's been unbearable and just so sad. Could use some practical advice. Also I appreciate spiritual advice and love the 12 steps. 

I'm wondering if I've been switching addictions. 
Does anyone have experience with sexual addiction? 

 I've been clean off hard drugs for 12 years. Picked up a bad masturbation habit for 2 of those years on meth n addy. Got clean, Did no fap for 4 years. Got married. The sex was pretty awesome at first because we really love each other and were so excited to be doing life together. 

Once we had kids we were so tired our sex turned into quickies all the time. I'm pretty sure she has a hormone deficiency. She wont really see the doctor I have to do everything. 

Now I totally regret having quickies. And I fuxking hate our sex life. Everything rests on me. She just lies there. She claims she really likes sex and she moans pretty hard and ever once in a while squirts and says she really enjoys it. But . I've begged her to just do anything sexual. Give me a dance, put on a skirt. Do some foreplay. Honestly any God dam thing she would do I would be totally happy with.

 I would like it way more  often
 But honestly if it was really good I might not need it that much. 
. I want to see her face. I want to see her being attracted to me. I want to see her aroused and try to arouse me. How it was earlier. This is disappointing as fuck. I can't even hardly sleep in the same room with her because it's just fucking sad.

What have I done to help: Say alot of nice things, sweet notes, take her on dates, watch the kids, fix/clean the house, give her alot of space..I could do more but I'm fucking exhausted from it. It doesnt get anywhere. But I am happy to make her happy and she is getting stronger and happier I think. Also I used to come on to her and romance her and touch her alot. Now it just makes me sad so one sided so I backed off. 

So I love my wife and want to serve her and be there for her as best I can. I think she has hormone deficiencies. I could be more vocal about this but I feel like I've already said too much and Im worn out from trying. 

Weve been married 7 years  and kids for 5. That was rough but massive joy. We're just grinding it out in expensive California pretty broke and working alot and raising our kids. So I want to be nice because she's delt with alot of shame and insecurities. 

I think the problem is when I'm stressed I want to have more sex. I see it as a pleasant distraction . Especially if I'm trying not to drink. But she wouldn't care if we had sex a few times a year.",6
2020-02-22 10:31:27,https://www.reddit.com/r/REDDITORSINRECOVERY/comments/f7tzrh/rrationalrecovery_is_back_in_business/,R/RationalRecovery is back in business,"Hi all, 

I want to let you know that I am now moderating r/rationalrecovery, which had been defunct for far too long. It is based on Jack Trimpey's secular [Rational Recovery](https://rational.org/index.php?id=1) self-help approach to quitting addictions, including gambling and eating disorders. I hope you join the community and check it out. 

Dave",29
2020-02-22 04:25:19,https://www.reddit.com/r/REDDITORSINRECOVERY/comments/f7qd8z/any_tips_for_finding_a_gym_partner_in_san/,Any tips for finding a gym partner (in San Francisco)?,I'm in recovery and looking for a gym or exercise partner or buddy. Anybody know of any groups (virtual or IRL) or apps or other resources to finding an IRL gym partner or buddy?,3
2020-02-21 04:10:49,https://www.reddit.com/r/REDDITORSINRECOVERY/comments/f78ksg/hi_im_starting_a_new_journey/,Hi I’m starting a new journey,"Hey, so today marks my first day of sobriety after relapsing from 4 months of being sober. I just wanted to post here to say hi and that I’m only new to posting to reddit and I really think this community can help me a lot. I used to be addicted to many different drugs for 3 years and I just turned 19 and realized I needed a change after having a relapse that lasted a week.",7
2020-02-20 15:45:12,https://www.reddit.com/r/REDDITORSINRECOVERY/comments/f6zf5n/500_days_sober_from_cocaine/,500 Days Sober from Cocaine,"I've never shared online about my struggle with sobriety from this substance, but I've shared with CLOSE friends (no family, they don't know about my past drug usage at all), and have kept a count-up timer on my phone since the day I quit cold-turkey.

Previously I was spending upwards of (minimum) $250 per week on cocaine, quit cold turkey in October 2018. Just realized that today officially marks 500 days since I've used coke and really wanted a place to celebrate that...

First time poster in this subreddit, but thankful to have found it and hope I can contribute to it in the future to help others who are in the same journey of recovery as me!",153
2020-02-19 16:06:24,https://www.reddit.com/r/REDDITORSINRECOVERY/comments/f6he1d/seeking_positivity/,Seeking Positivity,"I've been sober completely (including alcohol) for about a month and a half but sober from narcotics for almost seven months. Before that I had spent two years of my life addicted and reliant, and four years of my life an alcoholic.

Being sober is harder than I could've ever imagined, especially noticing that my entire personality was based on drugs and alcohol. That was how I had fun. That was how I relaxed. That was how I coped with life. Now it feels like I can't do any of those things. I go to meetings, I see a therapist, but still I feel like I can't find the same happiness or positivity that I had using.

That was a lot of words to explain that I'm here seeking a way to be positive again with my newfound sobriety. Any literature you could reccomend, any subreddits, any articles, or anything that could help me become someone who can feel like they're thriving without using. I feel weak struggling to be happy without using, but I'm asking for any kind of help or advice. 

Stay strong guys. It's hard to see that it's worth it, but I promise it is.",2
2020-02-19 15:30:16,https://www.reddit.com/r/REDDITORSINRECOVERY/comments/f6guli/relapse_after_almost_2_monthswhy_and_what_now/,Relapse after almost 2 months..why? and what now?,"I had almost 2 months clean from shooting anything into my veins and a few days ago I went back to sticking a needle in my arms. I was doing certain things right, such as attending IOP 3x a week, going to the gym regularly, eating healthy, engaging in self care, forming healthy relationships, etc...but there were warning signs that I decided to ignore... I was foolishly trying to make some extra cash by selling drugs and I thought I would be okay because it wasn't my DOC. 

&#x200B;

FFS, will this ever end? I let my family down once again as I came clean to them about it and now they think I'm back at square one... Am I? I feel like all the progress I've made up to this point has been lost and its an awful feeling. Just total despair. I feel directionless. I will no doubt be booted from my IOP and then I will have even less structure, but I'm not willing to go to inpatient again. I managed to use for just a few days then stop and honestly that's how I got these 45 days or whatever this time. I can do it again. 

&#x200B;

I guess what I'm really looking for is for someone to reassure me and tell me it's going to be okay.",24
2020-02-18 19:18:02,https://www.reddit.com/r/REDDITORSINRECOVERY/comments/f61s2i/reflections_coming_up_on_six_months/,Reflections coming up on six months,"I had been abstinent from crystal meth for six years when I relapsed in 2018. Within a couple months, I was trying to quit. I could make it a couple days sometimes. Other times, a week or so. In nine months, unable to abstain, I told my husband. It was so hard. He had so many ideas about addiction that weren't based on medical science but rather were based on the moralism that people with substance use disorders have been dealing with since our suffering began.

I am blessed. My husband read the research I shared with him. He was skeptical but grew to be supportive. I got involved in advocating for changes in drug policy and more access to treatment. Then I relapsed again after a few months. But the advocacy was so important to me. Even high on meth, I showed up. Then someone called me a leader in the recovery movement and I knew I had to find a way to make recovery stick.

I made plans to quit again at the beginning of September, 2019. I told my husband about my new relapse and that I was going off to the woods to detox (because fuck fluorescent lighting). I came back and my final year of school began. It was so different. Being off meth, I could show up 100% for my classes and my clients. Every day felt like such a blessing. Still, the cravings were terrible. Some tv show I was watching suddenly had someone smoking a meth pipe and I was pulling out my phone to find where the party was at. Thank God I was too drunk to drive.

Everything changed in November. I had been out at a bar and I met someone who was talking about psychedelic mushrooms. I'd been trying really hard to do things that could heal my brain damage but I was constantly finding myself pressing up against places where I used to have capacity and I just didn't anymore. I had read that psilocybin could potentially help with neurogenesis. So I bought some and I did a mushroom trip with a dear friend. The next day, I woke up without nicotine cravings. I haven't had a craving for nicotine or used nicotine since that next day. The next time I saw someone using meth on TV, I felt nothing.

The mushrooms made it so clear. I am so happy today. Meth made me unhappy. I prefer being happy to unhappy. I have no interest in ever doing the drugs that made me unhappy ever again.

Now I try to do mushrooms once a month. It helped me quit nicotine, stopped my meth cravings, changed my relationship with food and alcohol, made me love my job and broke me out of post-acute withdrawal depression. Psilocybin may be the best thing that ever happened to me. Imagine being lost in the darkness for so long and then suddenly someone turns on the lights and the scary things aren't anymore. You can see what you're doing and where you are going. I am so blessed and there's nothing I want to do more than help others who are lost in the dark turn on the lights and find their way home.",5
2020-02-18 18:42:58,https://www.reddit.com/r/REDDITORSINRECOVERY/comments/f619i4/i_woke_up_today_with_2_years_clean/,I woke up today with 2 years clean!,,158
2020-02-17 13:58:24,https://www.reddit.com/r/REDDITORSINRECOVERY/comments/f5dm1v/2nd_day_of_recovery/,2nd day of recovery,Just wanted to say this is my second day of recovery from my marijuana addiction.  I have been addicted for 45 years to marijuana and has ruined so many things for me.  Hopefully this will work this time!  Thanks for listening.,51
2020-02-17 00:43:29,https://www.reddit.com/r/REDDITORSINRECOVERY/comments/f541ek/looking_for_advice_to_help_a_friend_struggling/,Looking for advice to help a friend struggling with benzos and alcohol,"Looking for advice about how to help a friend dealing with significant addiction problems. Two nights ago, an old friend reached out to me and another old friend seeking guidance and support about how to get sober. 
His specific problems include the following: at least two years of regular benzodiazepine and alcohol use, occasional other drugs including opiates and ketamine, a general anxiety and ADHD diagnosis, and a lot of past emotional trauma. He reached out clearly looking for help, but has overdosed on benzos and other drugs and taken himself to the hospital twice in the last 24 hours. Though at moments he wants to pursue a detox and rehab, at other moments he’s angry and afraid about what the future holds, and that combined with withdrawal and addiction pushes him back to using. He lives out of state, so I’m only currently able to help him remotely. He’s in his late 20s, and has struggled with addiction on and off for about a decade. He had a very strained relationship with his parents, but they’ve indicated that he’s been at a hospital to treat overdose repeatedly over the last two years. 

I’m looking for any advice about how to approach a situation like this, what kinds of treatment and resources are available, or ideas about where else to find out more about how to help him. 

Thanks.",2
2020-02-16 21:46:44,https://www.reddit.com/r/REDDITORSINRECOVERY/comments/f51vev/i_know_this_is_some_what_nonspiritual/,I know this is some what nonspiritual,"We have a house meeting every week and the owner comes by for a short meeting to introduce anyone new, discuss the rules and any issues going on in the house, well this is what it should be for but instead we get held hostage by the owner who uses AN HOUR  to talk shit about ex members of the house, and how badly he wants to take pain killers but he cant because of his back surgery. He spends the time to proliferate drama, talk about who oded, whos homeless, all people that no longer live here that have nothing to do with us or the house. Its pathetic and nothing really gets talked about and no new information is given. I try to ignore it and secretly go on my phone but then he sees that and scolds me for being on my phone, I responded with ""sorry i dont want to talk about the drugs i desperately want to do (sarcastically)"" and he replied if you cant handle it how are you going to handle it at a meeting. A) this isnt an NA meeting, B) most people at meetings dont glorify and express how badly they want to get high, sure it happens sometimes but for the most part it is about the steps and the solution. And this guy does this. every. single. week. I tried to respond  like this, along these lines but what is the point? You cant talk sense into stupid, just like you cant talk an addict if they truly want to use. I am so close to telling him to shut the fuck up you dry drunk slum lord piece of shit. But I wont, and i am just upset that he misunderstands me, I truly DONT want to get high, and disagree with him when he says ""all addicts want to get high, all the time"" I really doubt this and think its just his his small perception, I have my moments, just like any other addict in recovery, but 90 percent of the time I truly dont want to go back to that misery. I wish I can wear earplugs to stop hearing his negativity.  


But alas it is only 1 hour out of the week. This is a pretty quiet house, not a lot of people, and so far it is manageable. trying to work a third step here...but i really wouldnt mind if the owner rebroke his back.   


TL/DR- I am bithcing about my house manager and wouldnt mind if he died in an electrical fire",4
