Date,URL,Title,Body,Score
2021-09-23 06:31:43,https://www.reddit.com/r/REDDITORSINRECOVERY/comments/ptsci0/i_hate_cocaine/,I HATE COCAINE!!!,"It would've been 14ys of marriage for us today. We would've been together 17.5 yrs. He should be here to watch our daughter turn 14 in Dec. But....no! He's DEAD! ALL BECAUSE HE CHOSE COCAINE OVER US! He kept choosing it over and over again until it ravaged his heart, and he died. I miss him. 

I HATE COCAINE. And, being an addict is the most SELFISH thing in the world. PERIOD!",29
2021-09-23 04:50:59,https://www.reddit.com/r/REDDITORSINRECOVERY/comments/ptr1o5/i_just_need_some_extra_support/,I just need some extra support :),"Heya, My name is Elsey (18F)

At this very moment, I'm clean for 1.5 day. I live in a clinic (for other mental issues) where drugs aren't allowed at all, but they all know about my addiction and they try to help. I feel really alone in all this as they don't quite understand me. I've been using for 3 years, I tried to get clean quite a few times. I got forced into rehab for some time, but started using again right after. This year, I was clean for 3 months, then i relapsed, then 2 months clean and last week i relapsed again. for a week long i used constantly and didn't want to stop and face reality. I started going to NA-meetings, which is really.. nice to be honest. But still, I feel alone and stuck in all this. I know why I want to stay clean, what it brings me, what smoking does to me, etc. But still I can't seem to stop destroying myself heh. Yesterday I went to a meeting, and they talked about: ""Step 1: Admitting powerlessness over addiction"" And quite some people shared about their moment where they were Fucking done with drugs and everything. I've had quite some moments like that but I still keep going back which makes me think: Am I really done with it all? I can't seem to understand myself and I feel stuck. If you're readin this: thanks for reading the whole thing haha. I could really ehm,. use some support from others.. Or someone to talk to. 

&#x200B;

\- elsey",6
2021-09-23 00:02:07,https://www.reddit.com/r/REDDITORSINRECOVERY/comments/ptn4qj/deleted_by_user/,[deleted by user],[removed],23
2021-09-22 16:06:48,https://www.reddit.com/r/REDDITORSINRECOVERY/comments/ptfq2i/do_drug_counselors_agree_with_the_direction_of/,Do drug counselors agree with the direction of drug decriminalization in Oregon?,[removed],4
2021-09-22 09:48:58,https://www.reddit.com/r/REDDITORSINRECOVERY/comments/pt7xh9/is_it_ok_to_turn_25_when_you_are_nothing/,IS IT OK TO TURN 25 WHEN YOU ARE NOTHING,"Hey, I am gonna turn 25 yo in 2 months, without a job or internship experience yet, as I had to change the course in between as I failed badly so I just graduated this year compared to my friends who are already settled. I have been trying for jobs or internships but no luck at all. I keep trying but am scared that I will have a failure like my studies in my work too. Is it okay not to have any job or internship till 25 years old?",27
2021-09-22 06:12:20,https://www.reddit.com/r/REDDITORSINRECOVERY/comments/pt4e0h/670_days_you_can_do_it/,670 days! You can do it!,"[670 days](https://imgur.com/gallery/Bzcsy18)

Anyone can do this",22
2021-09-22 03:33:10,https://www.reddit.com/r/REDDITORSINRECOVERY/comments/pt2fc9/just_for_today_september_22_keeping_the_gift/,Just For Today: September 22 - Keeping the gift,"*“Life takes on a new meaning when we open ourselves to this gift.”*

**Basic Text, p. 107**

&#x200B;

Neglecting our recovery is like neglecting any  other gift we’ve been given.  Suppose someone gave you a new car.  Would  you let it sit in the driveway until the tires rotted?  Would you just  drive it, ignoring routine maintenance, until it expired on the road?   Of course not!  You would go to great lengths to maintain the condition  of such a valuable gift.

Recovery is also a gift, and we have to care  for it if we want to keep it.  While our recovery doesn’t come with an  extended warranty, there is a routine maintenance schedule.  This  maintenance includes regular meeting attendance and various forms of  service.  We’ll have to do some daily cleaning—our Tenth Step—and, once  in a while, a major Fourth Step overhaul will be required.  But if we  maintain the gift of recovery, thanking the Giver each day, it will  continue.

The gift of recovery is one that grows with the  giving.  Unless we give it away, we can’t keep it.  But in sharing our  recovery with others, we come to value it all the more.

&#x200B;

**Just for today:**  My recovery is a gift, and I want to keep it.  I’ll do the required maintenance, and I’ll share my recovery with others.

^(Copyright © 1991-2021 by Narcotics Anonymous World Services, Inc. All Rights Reserved)    ",3
2021-09-21 20:39:57,https://www.reddit.com/r/REDDITORSINRECOVERY/comments/psw4mv/without_sobriety_and_recovery_i_wouldnt_be_able/,Without sobriety and recovery I wouldn't be able to take this trip. Truly blessed.,"Wanted to take the time to thank everyone here for always being here. Always replying on the threads for help (numerous alts).
With the constant community and support I see here, thank you.

I'm still trying to kick some bad habits I see in my addiction but I'm away from the hard shit. Away from the lifestyle. 

I'm traveling to the west coast to see all the national parks. I'm really poor from this whole trip but I just can't believe I'm doing this and I'm seeing these things soon. I couldn't do this if I was shooting dope, snorting yay, or smoking meth. 

Thank you. I hope everyone gets an experience to see life for fully what it is, especially for the ones we know didn't get to live a full life",17
2021-09-21 20:04:19,https://www.reddit.com/r/REDDITORSINRECOVERY/comments/psviop/does_anybody_else_feel_like_theyve_lost_their/,Does anybody else feel like they've lost their shine after getting sober?,"22m here, 2 months clean, until a couple months ago I hadn't gone a day sober in 4-5 years, Benzos such as Xanax, diazepam were mainly my jam along with heavy opiates like Codiene and oxy and later on in my addiction Heroin, so many years of broken relationships with my family, losing all my friends who probably just wanted to help but how can you, eventually living pretty lonely with strangers and my only friends being friends because drugs were involved.. fast forward to waking up after a 4 day binge of opiates and benzos and not remembering a thing and feeling like if I carry this on i'll end up dead, phoned my mum and told her i'm ready to come home, she drives 5 hours I pack my shit and we drive home together, I rough it out and the opiate withdraw is intense as fuck 6-7 days of sweats shits camps and feeling like dying, but the worst was the benzos, years of heavy abuse and suddenly stopping causes your brain to fuck with you like nothing i've witnessed before, such real dreams you wake up thinking you've murdered people etc, followed by about a month of paranoid shaky feeling that feels like it will never go away.. If you are on benzos currently please do research as to what you're doing, never quit cold turkey it can kill, i'm lucky i got out alive with the amount I took so stay safe guys

&#x200B;

Anyway my main question is now that i'm back in my home town I grew up in life feels impossible, and I really mean that, I'm struggling to find reasons to keep on trying this so called 'better life'

&#x200B;

Everyone I was friends with before has obviously moved on with their life, grown up a lot, and I just feel like i've missed years of my life that I'll never get back. For context my hometown is a Scottish island with about 25-30 thousand people, a place where everyone knows everyone, I moved south to a big city and lost contact with people from home, but I know everyone probably heard of my drug use, I feel like everyone I talk to is judging me and wanting to ask me questions like so are you still using etc. I don't want to settle here and get a job but at the same time I don't know if I trust myself to go back and not use again, that's what I did last time after a month and a half moved back and the next day boom I was back and another year flew by, now that i have my mum, sister, grandparents who I missed so much but rightfully cut me out back I feel like I owe them all and myself to at least give it a go.. I just feel like i've woken up from this 4-5 year dream and I'm learning to walk again in this scary fast world that I hardly know nothing about and my post drug addiction paranoid anxious self who used to not have a care in the world feels like i'm drowning all the time and the thought of all this sometimes feels so daunting I want to quit and go back to how I was before.. 

&#x200B;

It's like i used to be the life and soul of any situation and now I struggle to have a basic conversation.. sorry for the long post I've not opened up since I got clean, peace and love everyone you're all doing great x",38
2021-09-21 19:47:09,https://www.reddit.com/r/REDDITORSINRECOVERY/comments/psv7wg/want_to_get_high/,Want to get high,"22y M, I’m about 6 months sober, I’ve been doing really well lately but the past few days have really wanted to smoke weed. Last time I was smoking weed before I got sober I developed ocd and a severe panic disorder and smoking weed either caused it to come out or just made it ten times worse. Either way. Yesterday I bought a dab pen but threw it away before smoking. I have a sponsor and I go to meetings and work the 12 steps of aa. Idk what I’m rambling on about at this point. I just struggle to be happy and I miss weed. Anyways. Later",6
2021-09-21 15:36:28,https://www.reddit.com/r/REDDITORSINRECOVERY/comments/psq7lm/deleted_by_user/,[deleted by user],[removed],1
2021-09-21 13:30:17,https://www.reddit.com/r/REDDITORSINRECOVERY/comments/psnlqs/deleted_by_user/,[deleted by user],[removed],1
2021-09-21 06:58:15,https://www.reddit.com/r/REDDITORSINRECOVERY/comments/psgeg0/tips_on_attending_the_first_wedding_during/,Tips on attending the first wedding during sobriety?,"52 days sober WOOT WOOT! Very proud of myself. I’m attending a wedding this Friday. I’m quite nervous. I’ve been able to handle myself at restaurants and small family get togethers. While this wedding won’t be huge/crazy, I’m scared my urges will take over the fun.

Any and all tips and advice are welcome.

It would be day 56 on Friday, I was thinking of writing a list, or trying to, of 56 reasons to not drink and bring it with me to look at.

EDIT: I have arranged to call my non-official sponsor, but more of a ‘second mom.’ She runs SMART recovery meetings. Her daughter, my best friend, passed away from addiction about 4 years ago. She was the first one I called this last time I needed help to sober up. She is happy to be of assistance. I appreciate everyone taking their time to tell me their experiences. 

I will update everyone when the time comes! For now, I will keep reading!!

***UPDATE***
I’m back at the hotel. I called my sponsor twice. Walked away to breath when urges came up. Left when it was time and didn’t push it. I even had my husband pour my champagne for the toast into his glass. 

I did have one moment where I wanted to snap, but it was childish and the grown woman who basically shamed me for getting a Shirley Temple at the bar go can suck it… 

Im fucking proud of myself. I did it.",19
2021-09-21 01:13:45,https://www.reddit.com/r/REDDITORSINRECOVERY/comments/psc3ns/side_effects_of_staying_clean/,Side effects of staying clean,"Grateful for over 2 years clean. However, I'm still struggling with anxiety and paranoia more than ever. Trying to stay away from the medicinal route but not sure what else I can do.... Anyone else deal with this? If so, how have you learned to cope with it?",11
2021-09-21 00:26:30,https://www.reddit.com/r/REDDITORSINRECOVERY/comments/psbekb/in_crisisor_just_another_boring_night/,In crisis....or just another boring night.,So I'm so close to drinking or ordering some dex online. Wtf is wrong with me. I'd order dex but apparently I can't be trusted so I'm afraid my dad (yes I'm 29 and being watched by my dad lol) will find the dex in the mail and I'd be so ashamed. Another problem is I have an ortho appointment tomorrow and that will pretty much determine whether I can work or not. I also seek pain relief which is the biggest reason I am being like this. Depression also plays a role. I think I'm just ranting at this point. Maybe just need to talk. Honestly though I am just terrified about tomorrow. I really like working. Also I fell asleep and hate being sleepy and depressed. You can give me uplifting words or we can share thoughts of wisdom. ✌☮,2
2021-09-20 23:24:07,https://www.reddit.com/r/REDDITORSINRECOVERY/comments/psafgr/deleted_by_user/,[deleted by user],[removed],9
2021-09-20 22:46:53,https://www.reddit.com/r/REDDITORSINRECOVERY/comments/ps9thh/im_really_opening_up_here_and_hope_it_doesnt_hurt/,Im really opening up here and hope it doesn’t hurt anyway——Hey is there a official chat for those in recovery/ and or inpatient facilities.,"I know we have reddit post and discords, even reddit chats, I'm just not aware of them. Tbh being in a program is really to focus on yourself, but it gets boring that same old routine. N don’t get me wrong talking to peers in nice, but I find online easier to release and speak to,  than in person. Its not just the routine is not being able to really talk to anyone else because no one else can understand, why you aren’t doing much every day except meetings. I just want more peeps to talk to, that get the struggle, thanks.",6
2021-09-20 21:19:51,https://www.reddit.com/r/REDDITORSINRECOVERY/comments/ps8djr/what_do_you_do_if_people_direct_unwanted/,What do you do if people direct unwanted crosstalk at you at a 12-step meeting?,"There are two people that I see at meetings who will not stop cross talking at me. It's really annoying, and they are not offering anything insightful or helpful. I wish it wasn't tolerated. Any advice?",25
2021-09-20 14:17:21,https://www.reddit.com/r/REDDITORSINRECOVERY/comments/ps0i1p/when_i_tappin_down_xanax_can_use_weed_to_sleep/,"When I tappin down Xanax, can use weed to sleep better ?",[removed],3
2021-09-20 08:40:15,https://www.reddit.com/r/REDDITORSINRECOVERY/comments/pru147/new_blog_post/,NEW BLOG POST,[removed],1
2021-09-20 04:55:32,https://www.reddit.com/r/REDDITORSINRECOVERY/comments/prqw2s/just_for_today_september_20_courage_to_change/,Just For Today: September 20- Courage to change,"*“God, grant me the serenity to accept the  things I cannot change, the courage to change the things I can, and the  wisdom to know the difference.”*

**Serenity Prayer**

&#x200B;

Recovery involves change, and change means  doing things differently.  The problem is, many of us resist doing  things differently; what we’re doing may not be working, but at least  we’re familiar with it.  It takes courage to step out into the unknown.   How do we find that courage?

We can look around ourselves at NA meetings.   There, we see others who’ve found they needed to change what they were  doing and who’ve done so successfully.  Not only does that help quiet  our fear that change—any change—spells disaster, it also gives us the  benefit of their experience with what *does* work, experience we can use in changing what *doesn’t.*

We can also look at our own recovery  experience.  Even if that experience, so far, has been limited to  stopping the use of drugs, still we *have* made many changes in our  lives—changes for the good.  Whatever aspects of our lives we have  applied the steps to, we have always found surrender better than denial,  recovery superior to addiction.

Our own experience and the experience of others  in NA tells us that “changing the things I can” is a big part of what  recovery is all about.  The steps and the power to practice them give us  the direction and courage we need to change.  We have nothing to fear.

&#x200B;

**Just for today:**  I welcome change.  With the help of my Higher Power, I will find the courage to change the things I can.

^(Copyright © 1991-2021 by Narcotics Anonymous World Services, Inc. All Rights Reserved)   ",6
2021-09-19 19:35:07,https://www.reddit.com/r/REDDITORSINRECOVERY/comments/prj3l8/how_do_you_get_your_own_room_in_recovery/,how do you get your own room in recovery treatment centers.,"I cant stand sharing a room with another addict, i mean, last time , the farts, puking, snoring, coughing, eating, dicks hanging out, not only that shit but ive had some bad exeriences ,someone just please give me a good reason to let them know i NEED MY own room, please please please.  thanks

i got treatment in a few weeks and i gotta have something up my sleeve,  someone. help me out",3
2021-09-19 19:14:51,https://www.reddit.com/r/REDDITORSINRECOVERY/comments/prirtv/is_discovering_an_entirely_new_or_opposite/,Is discovering an entirely new or opposite version of yourself normal?,"I really feel like im asking a super stupid question. I am going to still try, yes substances and alcohol alter us and we feel different when up and down. My wonder is before I used I was a certain way(friendly, helpful, outgoing). When I used that multiplied, now that im trying to recover i see this new person. (Non friendly, selfish, and def not outgoing) like a rude piece of trash. N now im asking myself is this it, is this who I am now after it all, have I always been really this way, will I ever return back to what I thought was normal?",18
2021-09-19 18:57:13,https://www.reddit.com/r/REDDITORSINRECOVERY/comments/prih9e/coming_off_methadone_85mg_in_2_weeks_getting_sent/,"Coming off Methadone (85mg) in 2 weeks getting sent to inpatient treatment, any help or tips?","I am waiting for a bed to open up in a treatment facility , i'm on 85mg methadone daily.

a bed wont be open for a week to possibly three weeks.

i feel like theres so much. more to be said but cant think clearly caused by this stupid brain fog this methadone gives you. 

so i got roughly 2 weeks till a bed opens up, i also have a cpl DRIVING UNDER SUSPENSION TICKETS I gotta show up for court for.

i have like NO motivation to do anything and noone seems to care, all my family and friends have forgotten or abandened me. it's horrible man. 

theres gotta be someone out there there that can relate and help me though this process, please. 

I AM TERRIFIED. i got all these bills , court payments, i dont know wtf to tell my landlord.   i just dont know,  ask me anything and ill get back to you

I need help in anyway possible to get through this because i need to get my life back together, any tips tricks anything at all, i just seem some sort of comfort knowing that i am not going in there and gonna be suffering super hard for a month or two.

i could go on forever about how i got into this situation and all that and how my little girl deserves better but right now i just want some helpful advice , it's happening in ND, im on housing (section 8) will i lose my home? the only place i have left.  i just dont know what to think, do, how to prepare, what to prepare ect..  thanks",8
2021-09-19 17:03:16,https://www.reddit.com/r/REDDITORSINRECOVERY/comments/prggkd/new_rc_dedicated_sub/,New RC dedicated sub!!!,"Hello recovery family, I figured I'd stop by here to post about a new sub that I opened today. It's a recovery sub dedicated to Research Chemicals. The stigma of RCs is what spurred me to make this as a lot of RC abusers are less likely to speak out due to the obscurity or shame of ""weird"" or ""dirty"" drugs. I myself am in recovery due to a 15 year battle with grey area drugs and I'm looking to build a community of like minded people who are either sober from RCs or have the desire to stop using them. I've had numerous people reach out to me today already after I posted it in the normal RC sub and it inspired me to really take this sub serious. I will be posting daily so it will be a very active sub. Stay safe everyone and remember, THERE IS NO SHAME IN RECOVERY! r/RCRecovery",14
2021-09-19 14:24:12,https://www.reddit.com/r/REDDITORSINRECOVERY/comments/prdf1s/chronic_pain_and_xanax_withdrawal/,Chronic pain and Xanax withdrawal,[removed],2
2021-09-19 12:30:07,https://www.reddit.com/r/REDDITORSINRECOVERY/comments/prb89q/hi_i_am_guy_who_abused_xanax_20mg_at_day_today_is/,"Hi , I am guy who abused Xanax 20+mg at day, today is a third day, today I will take 17.",[removed],1
2021-09-19 05:43:43,https://www.reddit.com/r/REDDITORSINRECOVERY/comments/pr4y8r/deleted_by_user/,[deleted by user],[removed],1
2021-09-19 03:17:29,https://www.reddit.com/r/REDDITORSINRECOVERY/comments/pr3bqf/deleted_by_user/,[deleted by user],[removed],1
2021-09-18 22:55:03,https://www.reddit.com/r/REDDITORSINRECOVERY/comments/pqzyv7/4_years_sober_but_wedding_is_nightmare/,4 years sober but wedding is nightmare,[deleted],56
2021-09-18 19:54:16,https://www.reddit.com/r/REDDITORSINRECOVERY/comments/pqxasq/hi_need_tips_to_help_me_stop_taking_cocaine/,"Hi, need tips to help me stop taking cocaine!","I’ve been a daily user for over a year now! Only days I would not touch anything is if I’m in bed asleep all day! 

I’ve now opened up to my wife who hasn’t had a clue all this time as I’ve had enough now and wanna get off it!! Luckily she is amazing and has stuck by me and trying to help me through it!

Anyway I’m hoping for some tips? I’ve started trying to cut down and only have 1 half a day! (Usually would have at least 2g’s a day!) Is that ok to start with? As don’t think I would manage going cold Turkey!

Any other tips anyone’s got is much appreciated 👍",10
2021-09-18 15:32:22,https://www.reddit.com/r/REDDITORSINRECOVERY/comments/pqsvmv/help_im_about_to_go_through_opioid_withdrawals_i/,"Help, im about to go through opioid withdrawals, i cant deal with the pain, i just cant.",[removed],3
2021-09-18 03:11:28,https://www.reddit.com/r/REDDITORSINRECOVERY/comments/pqhrnd/i_think_husband_is_doing_cocaine_again/,I think husband is doing cocaine again,"A few years ago I realised my husband was using cocaine. He swore he will ever use again but he keeps on hanging with the same friends, I have a nagging feeling that he’s on it again and that  girls and sex come with it. I can see he has plenty of cash on party days.

My question is, will it be bad to ask him to do a drug test? Would you do it for the sake of re building  a relationship?

Edit: the test was positive, I feel I’m done.  So sad…",6
2021-09-18 02:41:06,https://www.reddit.com/r/REDDITORSINRECOVERY/comments/pqhefs/deleted_by_user/,[deleted by user],[removed],3
2021-09-18 01:15:04,https://www.reddit.com/r/REDDITORSINRECOVERY/comments/pqgcwk/36_yes_off_h_struggling_this_week_first_time_this/,36 yes off H. Struggling this week. First time this bad in years.,,22
2021-09-17 22:33:30,https://www.reddit.com/r/REDDITORSINRECOVERY/comments/pqe40w/finally_sober_but_left_with_the_same_problems_i/,"Finally sober, but left with the same problems I had before I started using.","I have over five months of clean time from drug addiction, and its honestly been great. or at least a lot better. My quality of life is better than its been in years, and I do NOT regret finally being able to get sober, and do not plan to start using again.

but the reasons I started using are still there. I started using because for the first time ever, I felt safe inside my own head. my constant anxiety, paranoia, depression, adhd, trauma, gender identity issues,  are still here. yes, sobriety has benefited me 100%. I have moments of happiness. I am no longer on deaths door, and I finally have hope. but its still extremely hard to live comfortably in my brain. and Im absolutely terrified of going back to my old habits, but sometimes I get in such an awful place It almost seems like a better alternative, if only to get out of my own head for a few hours. is this something I will just have to learn to live with? or is there something I can do? (for reference, I am in therapy.)",47
2021-09-17 21:56:14,https://www.reddit.com/r/REDDITORSINRECOVERY/comments/pqdkag/deleted_by_user/,[deleted by user],[removed],4
2021-09-17 19:09:14,https://www.reddit.com/r/REDDITORSINRECOVERY/comments/pqazc4/please_support_i_am_in_recovery_and_here_is_my/,Please support! I am in recovery and here is my new recovery clothing site!,[removed],2
2021-09-17 18:09:28,https://www.reddit.com/r/REDDITORSINRECOVERY/comments/pq9y8n/in_long_term_residential_treatment/,In Long Term Residential Treatment,[removed],1
