Date,URL,Title,Body,Score
2020-02-16 12:56:37,https://www.reddit.com/r/REDDITORSINRECOVERY/comments/f4u8vi/finding_employment_in_sobriety_with_a_mess_of_a/,finding employment in sobriety with a mess of a resume from active addiction,"&#x200B;

hey all.  i'm sooo close to a year sober :) -- but i've been out of work for about 6 weeks now and things are starting to look very bleak in terms of money and opportunities.  i've been on the hunt for jobs and it's bringing up all sorts of issues for me.

most notably is that my resume is full of holes.  i've been fired from pretty much every job i've ever had due to my alcoholism.  there are months long gaps from when i was either deep in active addiction or trying to get sober.  i'm not confident in what any reference from these jobs might say about me.  i currently have one former boss (who is 30 yrs sober, and gets it), and 2 friends (one owns a restaurant, the other is the head of HR at a big company) as my references.

also my work experience consists almost entirely of kitchen work, i am a chef by trade.  as much as i love it, it is just physically too much for me nowadays.  also, not a great environment for continued sobriety due to the hours, stress, drinking culture, etc.  and since i live in a medium sized city, i definitely have a reputation for being unreliable after all these years of fucking up.  plus i'm embarrassed as fuck.  so jobs in the restaurant industry are hard to come by.

anyone have any advice for how to handle this situation?  tips to improve my resume, career fields that might be good options (i have some college education but no degree), or even just a pep talk on how you got through it yourself.  thanks in advance, this has been a really rough time.",7
2020-02-16 12:19:56,https://www.reddit.com/r/REDDITORSINRECOVERY/comments/f4tp50/increased_appetite/,increased appetite,"hi all, former casual stim user and heavy stoner. I noticed that by the fifth week of sobriety I have had an increased appetite. it's not terrible but definitely a significant increase. is this normal has anyone else experienced this?",3
2020-02-16 11:15:09,https://www.reddit.com/r/REDDITORSINRECOVERY/comments/f4sr6u/just_a_quick_opiate_based_question/,Just a quick opiate based question...,"So I'm three weeks clean of a ten year haze. Many of the physical symptoms have really subsided which is bloody amazing, but my hands and feet are constantly dripping with sweat. Any advice on what may help or do I just have to slither around a little longer? Many thanks",19
2020-02-16 10:58:36,https://www.reddit.com/r/REDDITORSINRECOVERY/comments/f4sinz/five_year_celebration_words_of_gratitude/,Five Year Celebration - Words of Gratitude,"Dearest friends,

Five years ago today, I stumbled into the rooms 

And today I am writing to express my gratitude 

My life is evidence that miracles are possible

&#x200B;

In 2015 I was 21 years old and I had had enough

Of bipolar disorder, resentment and vomit

Of broken glass, ashes and loneliness 

But lacking courage to end my life

&#x200B;

So I made my first meeting, took the first step and set fire to my old self. 

&#x200B;

Over the last few years the time spent in these rooms has taught me:

* When uncomfortable or stressed blank –Be patient. **Comfortable silence** **resides within**.
* When failing or controlling – Accept. **Let go**. **Or you will be dragged. Friction burns.**
* When self-centered – Humility. Every time. **Always be kind. No exceptions.**
* When the path feels hard, tread lightly. **If it’s not effortless, it’s not right.** 

With discipline, I have been given the courage to rebuild my life with intention

And in exchange for faith, I have been granted an existence of belonging and serenity

&#x200B;

Brothers and sisters, from love we come and to love we shall return 

Blessed is each fighter that has passed and each still to come

That no addict seeking recovery should ever die

&#x200B;

And if you would like to celebrate with me today, smile. 

&#x200B;

 https://imgur.com/JiO97wK",17
2020-02-15 13:03:00,https://www.reddit.com/r/REDDITORSINRECOVERY/comments/f4d1cg/tell_me_about_your_dating_experiences_in_recovery/,Tell me about your dating experiences in recovery.,"I'm 28 and getting ready to get back into the dating world, which for me means exploring dating apps. I've been clean for 3.5 years. One major thing that is blocking me is how to navigate through the question of ""let's grab a drink sometime"" or telling someone that I dont drink. It's not the first thing I want to talk about when I meet someone. My past is really messy and could be interpreted as a major red flag. I'm embarrassed to some degree of the choices I've made. 

What have been your experiences dating clean? Should I be concerned about this at all or just be up front, maybe even put it on my profile?",22
2020-02-15 06:14:52,https://www.reddit.com/r/REDDITORSINRECOVERY/comments/f483p2/fighting_cravings_former_stim_head/,fighting cravings (former stim head),My cravings have been insane lately- like stupid insane. any suggestions for curbing a wild stim craving?,2
2020-02-15 02:58:37,https://www.reddit.com/r/REDDITORSINRECOVERY/comments/f46h3p/sober_email_pen_pal/,Sober email pen pal?,Been a super lonely road since I got sober I’m living in an area where I don’t know a lot of people and could really use some support. 22 years old.,8
2020-02-14 22:20:25,https://www.reddit.com/r/REDDITORSINRECOVERY/comments/f43od4/am_i_safe_to_smoke_a_joint_right_after_my_mouth/,Am I safe to smoke a joint right after my mouth swab test? its once a week? I’m not a bot,"I get oral swab tested by court every week. The test kit they use is called “Quantisal Oral Fluid Collection device. It says on there website they can detect some drugs can be detected up to several weeks but I’m just talking about smoking a joint after one of my tests, the same day of course and a soon as possible after. Iv read places that thc can only stay in oral fluid up to 3 days.",0
2020-02-14 06:24:08,https://www.reddit.com/r/REDDITORSINRECOVERY/comments/f3qv34/concentration_problems/,concentration problems,"Hello, I am a former casual stimulant user (mostly cocaine and adderall) I found stimulants very useful for when I studied but am finding it harder and harder to concentrate as I ease into my fifth week of recovery. I am currently a grad student so concentration on my studies is imperative. Do any of y'all have suggestions/tips n tricks for getting better concentration while in the early stages of recovery? Does it get easier? Better? Let me know.",3
2020-02-13 20:55:21,https://www.reddit.com/r/REDDITORSINRECOVERY/comments/f3ky5z/my_moms_cravings_are_incredibly_strong_and_i_need/,My mom's cravings are incredibly strong and I need advice.,"My mom has been using for a decade and has been in recovery for about 6 months. After years she finally opened up to me tonight enough to tell me her cravings are worse than ever and she is feeling like everyone has left her alone and she has nothing to do.

While it breaks my heart to hear her like this I imagine that being idle is only making it worse. What are some things you or your loved ones did to keep busy and keep your mind off cravings that felt worthwhile?

Thanks in advance, I'm feeling a little hopeless here and appreciate any advice you may have. Hope I'm posting in the right place.",18
2020-02-13 19:35:12,https://www.reddit.com/r/REDDITORSINRECOVERY/comments/f3jwc1/day_6_empty_lighters/,"Day 6, empty lighters","You ever get super triggered by the most simple things?

*empty lighter*

What a ridiculous thing to cry about. 😂

Please tell me I'm not alone in this. Lol",8
2020-02-13 15:00:27,https://www.reddit.com/r/REDDITORSINRECOVERY/comments/f3fuyj/nightmares_or_super_vivid_dreams/,nightmares or super vivid dreams,i have been sober for a little over a month now and have either been having nightmares or super vivid dreams. I remember this being a problem when i limited my weed intake but its just my dreams are super intense and kinda scary (if not really scary) most of the time. sometimes they are just super realistic. does this go away eventually? maybe not the dreams themselves but just the nature and intensity of them....,13
2020-02-13 11:11:24,https://www.reddit.com/r/REDDITORSINRECOVERY/comments/f3c7t6/thinking_about_ending_my_sobriety_in_a_couple_of/,Thinking about ending my sobriety in a couple of years?,"Wondering how people feel about this kind of approach to recovery. I've been sober for just over two and a half years. My drug of choice was weed but I had occasional issues with drinking more than I wanted to.   


Through my recovery I've come to appreciate how little my addiction has had to do with the substances themselves. I've been an addict because of chronic anxiety and patterns of avoidance. I continue to see this play out with screens: my phone, TV, video games, surfing the internet, etc. I will spend more time than I want to tuned out of the world because the thought of doing what I *actually* want to do (clean my room, study for a test, folding laundry, meditate) is unpleasant and overwhelming.  


The thing is though, my recovery has been very spiritual and based in a practice of mindfulness and acceptance. Through accepting, for example, that I went longer than I wanted to without cleaning my room *and that's ok*, I've been able to shed a lot of the negative self talk (""You're lazy"", ""Your life is a mess"", ""You're never going to amount to anything"", etc) that made facing the less-than-pleasant things in life such an overwhelming and anxiety riddled process.  


Without going into too much detail, my life has changed around quite a bit since I stopped using substances. I feel like I'm in a really good place, and next month I'm going to be submitting an application to grad school. Lately I've been feeling like I could go back to using substances if I wanted to and be ok. Why would I want to? Because despite how much trouble they've caused me, substances have also enriched my life in various ways. Psychedelics have been a huge spiritual tool for me in the past (and made me confront the fact that I needed to stop using for a while). Weed is a very social substance, and I would enjoy being able to connect with certain people in my life in that way again. And I wouldn't mind making a nice boeuf bourguignon and relaxing with a nice glass of red as I sit down to dinner.  


In my mind, substances are no longer any more of an issue than internet usage. They're something that's potentially harmful to me but that means that I need to remain mindful about how I'm using them and the impact they're having on me. So right now my plan is to start grad school in the fall (about 6 months from now), graduate after another two years, and then seriously check in with myself about my relationship to sobriety. All the while I'll be continuing my recovery and working on the patterns of avoidance in my life.  


I'm wondering if anyone can relate to any of this, and/or if people know of anyone who's approached recovery in this way.",8
2020-02-11 17:37:52,https://www.reddit.com/r/REDDITORSINRECOVERY/comments/f2ghw1/leaving_aa/,Leaving AA,"Hi guys,  


Firstly, thank you for reading this :)  


I am sober 1.3 years, got sober at the age of 24 from alcohol, weed and other drugs. Was a huge mess ( surprise) when started my recovery process.  


I got sober in AA, I live in a country where there are no other offline support groups available, I am really starting to understand that AA program is not for me, I am terrified because for the last year my life was heavily centred around it and I do believe that the reason AA worked for me was the incredible and loving support I got from the fellowship. I came to AA where I was at a stage of not caring where to go, very broken. And for the most of first year my mind was elsewhere, I did not really analyse the program, in fact I believed it's better not to, AA will only work if you believe in it and I unfortunately can't hide from myself anymore that I do not believe in some higher power participating in my life on the level of mundane, everyday activities and also do not think that mindset of ""powerlessness"" is the way i want to build my life.  


In a nutshell, I believe the social aspect of recovery community is crucial for my sobriety, and I also very much appreciated the recovery principles of AA - subtracting the God stuff- which I summarised to the principal ""Don't be a selfish \*\*\*\*\*\*\*"" for myself. I thought I will go to meetings and try to ignore the higher power stuff - but it's getting increasingly difficult and feels hypocritical.  


I would appreciate to hear your experience and stories of leaving AA and  tips for staying sober .  I also feel like the insistence of AA members that AA is the only way to stay sober is unhealthy and rigorously overemphasised to be true.",46
2020-02-11 13:39:51,https://www.reddit.com/r/REDDITORSINRECOVERY/comments/f2cqpb/day_4_sobriety_is_hellish/,"Day 4, sobriety is hell-ish","Today is an odd day. My body and mind are shutting down. I don't even feel like a host to this mind of mine, it's just darkness. I can't stop sleeping, which is annoying at best. I don't want to stop sleeping, it's my only comfort. 

Last night i spent hours feverishly carpet surfing, to no avail, of course. I feel like a fool. My blood pressure seems to be remaining low, better when I'm laying down, standing is the worst. I'm dizzy all the time, struggling not to dissociate as all the bad feelings come rushing back. PTSD, hello my old friend. I despise these memories. How silly that once, they were my solitude, forever reminding me of my strength. Now they just seep in like the plague, reminding me of how weak I was to give in. 

I weighed myself on day 2, back down to 105 pounds. I had been doing so well, 116! But I lost it all in those few weeks, shouldn't be surprised. Now I can hardly eat without the urge to vomit. Food has no taste, just bland, foreign mush in my mouth. I force myself to eat anyways, I cannot regain strength from vapor anymore.... 
Day 3 i had parent teacher conferences, i should have been so happy for my kids, they've been doing so well. But i could hardly muster a smile. What kind of mother am i? 

Now, I'm fighting the urge to just go back to sleep. So much to do, no motivation to move. Depression is crippling me. 
I guess that's all i have to say, sorry for my scattered thoughts.",18
2020-02-10 21:27:48,https://www.reddit.com/r/REDDITORSINRECOVERY/comments/f21jum/overdosed_on_saturday_going_to_na_meeting_tomorrow/,"overdosed on saturday, going to NA meeting tomorrow.","I overdosed and thought I Wass going to die in the ER on Saturday. 

100% convinced my heart was going to explode - did only a gram of coke, didn't matter. 

numb arms, back hurt, dizzy, fever like temperature, heart pains.

got discharged, went home, four hours later I went to the club and did more coke.

I don't want to go to an NA meeting tomorrow but I decided I have to.

<3",54
2020-02-10 05:42:08,https://www.reddit.com/r/REDDITORSINRECOVERY/comments/f1okz8/sober_working_doing_good_my_story/,"Sober, working, doing good. My story.","I’ve made such a huge turn around these past few months. 

I started drinking at 14. First time I got drunk i ended up in the hospital 3x over the legal limit but luckily didn’t need my stomach pumped. (I was chubby lol)

First time I started dabbling in pills (benzos,  amphetamines, and opiates) I was 17. I started off with Klonopins. Fell in love.  My cousin got prescribed Ativan and she’d always sell them so I started taking them frequently. Used adderal for no reason at first until I realized how clean my room/house was when taking them lol, I started on opiates when I sprained my ankle and they gave me Vicodin. 

**Here is where my life turned into complete shit** 

I started shooting coke when I was 22 (I’m 24) after my father passed away due to suicide. I had been on that slippery slope since drinking all the time at 17. Then I completely fell off because I was doing coke **a lot** since I was I think 20? Nobody knew I was shooting up. *nobody*. Not even my live in boyfriend. Around that time we were dating 7 years and had fell out of love and had complete opposite work schedules so we barley saw each other even though we lived in our own apartment. Anyway, when we got that apartment is when I started drinking a lot again after slowing down almost completely. (I’ve been an alcoholic since 18/19) 

My troubles really began when I left my then boyfriend in 2018. I was shooting coke but it was every weekend or sometimes every other. We had other issues unrelated to my drugs use and so I left him. I even quit my job. &amp; I’m not proud of this and I’ve apologized and paid him back recently.. buuuut when I left him (he was working) I took all his money, his weed, grabbed some of my clothes, and left. **To clarify:** that was the first and only time I have ever stolen from anybody I’m close to  like that. I’m not an asshole so I don’t rip people off. I just wasn’t in the right state of mind. I was up all night on adderal (I worked full time overnights at that time) and I have a breakdown. But the break up was better for both of us. That’s 1 good thing my addiction did for me. 

I was sober after that for 3-4 months and I was with my now boyfriend. he was sober and he helped me get off all that shit. And then I ended up assisting in his relapse. Once again, not proud at all. 

We started using once every couple months, to once a month, to once a week, to days binges. It all escalated so fast.. I couldn’t stop it (I could have but I was so fucked I didn’t realize how bad I was getting)

**Now here is the worst of my addiction**

It was beginning of last year, 2019 until recently. I started using more and more, and then going on week binges sometimes. I was living with my boyfriend (also an addict and now sober again) outside of Boston. Now, if anybody has ever here of [“Methadone Mile”](https://www3.bostonglobe.com/news/bigpicture/2016/07/16/boston-methadone-mile/cLqxOAY7X9tHiooOGuATAI/story.html?arc404=true) you know where this story is heading. If not, click the link and it’ll tell you all about it. 

If you’re to lazy I’ll summarize it. It’s the Boston, MA. Well Roxbury to be specific. It’s the  “skid row” of Massachusetts. It’s literally a mile of methadone clinics and shelters. There was South Hampton st Shelter. It is **NOT** a good place at all. It’s extremely dangerous. It was a little stretch of road  and that’s where all the drug addicts hung out. You could get **anything**. It was a lawless part of Boston. (As long as there’s no violence) people literally walk up and down the strip yelling “GOT THAT BROWN” “GOT THAT GREASE!” (Grease= potent crack) or you could just walk yourself and yell out “I NEED XYZ”. (Methadone Mile is no more due to the cops “clean sweep” mission after a correctional officer got assaulted on his way to work in the jail that’s it literally 50 ft from south Hampton shelter. I actually saw it and I’m even on the camera footage) Again, **NOT** proud.

Anyway, we started hanging out down there. Shooting coke, meth, herion, crack. Anything we could get our hands on. We were a fucking mess. That lasted the entire summer. We were worn down. Looked like shit. The only advantage we had was his father allowed us to stay there. If not, I guarantee we would have stayed out there. 

So me and my boyfriend became long distance in August. (He’s in prison for violation of probation, he’s now sober too) since then, I slowed down using. I was using every few weeks (unknown to him)  

Then I stopped shooting it and starting smoking coke. Notice the little progress? 

Well. I **FINALLY* stopped since New Years. On New Years, I did *one* line and said to myself “you know what? No. This ends now” and I left the party.  I haven’t touched it since. I know it doesn’t seem like a long time but the amount of good things that have been happening to me.. I’m proud of myself for doing it so long. 

Edit: I even had my cousins boyfriend doing coke right in front of me and offered me. **I declined!**

**Here are some good things that have happened since I’ve stopped using:**

1. I got a job after being unemployed for over a year. (Longest I’ve ever been unemployed) and I actually love my job. 
2. I’ve rekindled my relationship with my mother
3. I’m no longer too fucked up and worrying about my next high that I can help my mom with my 2 younger sisters (5 &amp; 14) 
4. My hair is healthy and my skin is clear. 
5. I’m just overall happier.
6.  I can keep money in my pocket 
7. I’m earning people’s trust back
8. I don’t turn to drugs as soon as something upsets me 
9. I’m just a much better person after all.

**10.** I’M SOBER!",22
2020-02-09 23:49:51,https://www.reddit.com/r/REDDITORSINRECOVERY/comments/f1lb40/i_hid_my_addiction_from_my_family_i_am_8_months/,I hid my addiction from my family. I am 8 months sober now and I feel like I should come clean to them. What do you guys think?,"I spent 2 years with an ugly addiction to painkillers. They were the only thing that mattered in my life at the time and if it wasn’t for my parents, I would of lost everything. They supported me financially during this time and they had no clue about my problem. I’m 8 months sober now and I’m still recovering from the financial ruins i put myself in. A huge part of me wants to tell them, to give them an explanation for everything I put them through. But another part of me says I should leave it alone and not tell them. I don’t want to add extra stress in to their lives. I’ve been battling this for a few months now and I’m not sure what to do. What’s your opinion?",12
2020-02-09 22:04:21,https://www.reddit.com/r/REDDITORSINRECOVERY/comments/f1k0pw/dang_relapsed_even_with_all_of_your_support_well/,"Dang. Relapsed. Even with all of your support. Well, I'm ashamed, and can tell you with 100% certainty now, it's not worth it. I'll be okay. But requesting some shoulders to lean on right now. Haven't told anyone.","It was a snowstorm. I didn't go too hard, but I played in it. I got in trouble with the cops, too. I won't get into specifics but I potentially have a criminal record now. Sorry guys. Hope I can still be accepted here.

So if you're feeling close to a relapse, just know, it's probably not even in your subhuman addictive self's best interest. It gets to a point that the relapse becomes not even suffering. It becomes a boredom you're so used to it's a new torture. Take care. Sending love.

Edit: Gotta say it's pretty beautiful seeing all of you courageous individuals reaching out to support me with your stories of sobriety. I am going to be okay and let me just say congratulations to you all on your defeat of your challenges. It's truly amazing hearing your everyday testimonials and how much they resonate with me. I know I need to find a support group in real life, but with this legal business I mentioned, rehab might end up being part of my plea deal. I'll keep you updated. Sorry I haven't responded to more comments. But I've read them all. Thank you all. We're all together. Stay strong. Love you all.",64
2020-02-09 08:40:10,https://www.reddit.com/r/REDDITORSINRECOVERY/comments/f18qv9/interview_help/,Interview help?,"So 4 months ago when I was about 2 months sober I started volunteering for a nonprofit in my city. It’s been a great opportunity for me, and the intention was to stay there and put in at least a year to start working on cleaning up the awful work history I racked up thanks to active addiction. 

Well, another opportunity came along for a full time position closely related to the volunteer work I’m already doing and I have an interview this week! 

I absolutely love it there and I really hope I get this job. I have faith that I’m on the right path and I know that whatever happens will happen and I’ll survive regardless. But I want to do the best I can and be as prepared as possible. 

I typically interview very well, but I’m worried they’ll ask me why I’ve never stayed anywhere very long and why I was unemployed for two years prior to volunteering there. I don’t know how to answer. I’d rather not tell them I’m a recovering addict. 

Does anyone here have any advice for how to handle this question if it comes up?",11
2020-02-09 03:29:47,https://www.reddit.com/r/REDDITORSINRECOVERY/comments/f15yjt/relapsed_help_calming_down/,Relapsed- help calming down,Hi. Last night I relapsed on my DOC (cocaine) and now I’m scared and panicking and high. Please help tell me it’ll be ok and calm me down.,2
