Date,URL,Title,Body,Score
2020-02-04 00:23:06,https://www.reddit.com/r/REDDITORSINRECOVERY/comments/eyl28p/paws_from_adderallvyvanse/,PAWS from Adderall/Vyvanse?,"Hi all -
I'm 26F (actually tomorrow is my birthday!), 117lb, Native American/Caucasian.

Today I am 180 days clean of adderall/Vyvanse, and I think I may still be experiencing PAWS? I took Vyvsane for 4 years and then switched to Adderall in February of 2019, and quit cold turkey on August 7th, 2019 after having some extreme weight loss / appetite changes, plus a whole bunch of other things.

Has anyone else experienced PAWS from Adderall and/or Vyvanse? I'm having a really hard time with my anxiety most days, and it feels as though I'm constantly pulling myself away from the edge of panic at all times. Some days are better than others, but for the last 3 or so days it's been really bad and I just feel like there's no end in sight.

I went to my PD and they gave me Zoloft, which I requested, because its helped me with my anxiety in the past. I have yet to take it though because I want to try to get through this on my own. 

Any and all help is much appreciated!",2
2020-02-02 19:19:26,https://www.reddit.com/r/REDDITORSINRECOVERY/comments/exy4uz/hey_everyone_i_am_in_agony_right_now_my_stomach/,Hey everyone. I am in agony right now. My stomach wants to jump out of my body. It’s been this way for two days. I haven’t been a heavy user of anything for over 6 months. Is this withdrawal or not?,I messed around with benzos the last 4 months but the worst I did was two weeks in a row. It’s only been a week 100% clean but is it really that? I puked twice last night with zero fever. I have had cold sweats too. I’m so miserable I want to be dead. I can’t do anything. I can’t be productive. I’m so fucking done. Ughhhh. Wtf do I do,2
2020-02-02 18:55:58,https://www.reddit.com/r/REDDITORSINRECOVERY/comments/exxtj4/super_bowl_at_almost_2yr_clean/,"Super bowl, at almost 2yr clean","You know what I hate, about being clean? I mean there are innumerable gifts in sobriety, FROM sobriety, but one thing I still can’t help but hate is when I feel weird. I hate feeling unusual, different, like I can’t participate just because I’m sober. I mean, I got sober SO I COULD participate in life. But there are still things, times, events, where drinking is so woven into the fabric of it, that I can’t help but feel like an outsider.

The super bowl is basically the best example of this for me. 

This year will be my second super bowl sober — I got clean 5/13/2018. I love football, but more than that, I love to get together with people and drink. Even if everyone else was on beer #2, while I was using the last swallow of beer #7 to wash down some oxy in the bathroom before picking up #8. Even if I didn’t know the people that well, or didn’t care about the teams playing. Even if I didn’t especially like the people I was with. It was a day out of the year that I looked forward to, that I felt like I could day-drink in good company and feel good about it. 

The super bowl comes every year, and now I’m clean. I normally feel good, satisfied with my life decisions, but during the super bowl I kinda fall back into feeling weird. But just like super bowl Sunday comes every year, so does Monday. Whether I like it or not. And now I get to wake up on Monday without any embarrassments or regrets. I might be a little afraid people at work will ask me what I did, and I’ll have to admit I just went to the gym then watched it at home with my wife. But at least I don’t have to wake up wondering how I got here, or when I fell asleep, or what I did or said, or what embarrassing place I threw up. 

Today is super bowl Sunday. Since I got clean, I got my private pilot license, and I’m working on my instrument rating. Tomorrow morning, I am meeting my instructor at 4:30am for a flight lesson, to prepare for my checkride that’s scheduled in about 5 weeks. I try not to bitch and moan about my sobriety because truthfully, I get to do things today that I never would have even DREAMED of when I was using. And while I still haven’t totally figured out how to be comfortable in large groups of people without drinking, or how to participate in these big American holidays like the super bowl or 4th of July... I’m deeply appreciative of what I DO have. I have a life now where I get to push myself, where I get to line up difficult challenges and then work really hard to achieve them without colossally fucking up. My wife is pregnant, and now I get to be that dude in a meeting talking about how grateful I am that my child hasn’t seen me piss myself or drive drunk. 

I am immensely, deeply grateful that I now have a life that I’m really proud of. If I have to give up the super bowl for that, then fuck it. It’s an easy choice",40
2020-02-02 18:51:45,https://www.reddit.com/r/REDDITORSINRECOVERY/comments/exxrh1/2_weeks_off_coke_still_very_anxious_will_i_be_ok/,"2 weeks off coke, still very anxious, will I be OK?","Hey guys, 

I didn't do a lot of coke but from time to time on a party I did it. Problem was that every time it was quite good and I only felt worse the day after, so I didn't think that it can do me any harm. Every time after 2 days I was completely alright. The last time I did it was the most I've ever done, it was 2 weeks ago and basically from that time I feel somehow different. It's this constant feeling that I am looking on the world through glass, I don't feel like me. I am thinking all the time if I didn't fuck up my brain permanently and from time to time I have panic attacks about it. I am very sure I don't want any more coke but I am just so scared if I'll go back to normal. I finally was getting good in life after a big accident and a break up and then this happens. 

Also I did quite a lot of alcohol, was getting fucked up probably twice a week. I want to stop drinking for at least a month now till I get back to normal hopefully.

Will I be OK? Should I seek therapist help?

Thanks.",3
2020-02-02 14:42:15,https://www.reddit.com/r/REDDITORSINRECOVERY/comments/extuya/principles_before_personalities/,"""Principles Before Personalities. """," So I’ve been going to Alcoholics Anonymous meetings for quite some time now with my dad. Neither of us drink and he claims to go because he wants to meet people and reconnect with old friends apparently. I just go just for my personal amusement. It’s fun to watch losers talk about their pathetic lives in front of other losers.

But as you would expect, I’m not vocal at all about this at meetings. I just sit there silently trying to blend in without saying anything aside from the shit that everyone else says when everyone holds hands and are in a circle. It’s a feeling of *epicaricacy* that is hidden from everyone else.

I’ve heard some unique stories from my time there. There was once this man who grew up with his adopted family in Tijuana and then one day a robber came murdered his entire family when he wasn’t home. This guy claimed that the event put him in “so much rage” that’s what made him a drinker. When I told The Boy Named Crow about this, he just said “Damn that sucks.”. I said I thought that moment was pretty funny because of how cartoonish it was. It’s kinda weird that this one guy was apparently able to murder an entire household when just trying to kill 2 people on your own can be pretty difficult. It just fell into the realm of unreality.

There always seems to be an old woman with brown hair whenever I go there. I don’t know why.

Yesterday me and dad went to this meeting and this guy was telling this very long story and since we just walked in during the middle of it I don’t really know the whole story and he kept going on about rabbis and god or whatever. The room was really dark which made sense since it was at 10 something PM and I just kept staring at the white LED lights hung on the wall behind him as he spoke and the patterns they made or the ceiling fan and the slow movement it made before it made it’s eventual stop. I remember there was this old guy sitting in a chair in a corner of the room on my right saying stuff like “Oh god is this guy still talking?” but no one except me seemed to notice him when he said that at all.

When the guy finally stopped talking all of a sudden some guy in the crowd got up with his shitty acoustic guitar and started playing some shitty song and singing. I told dad “This song is shit.” and “We should split.”. But dad wanted to stay and said no and I can just go to the car and wait for him if I’d like. But I insisted that “We should go.” and eventually I decided to walk home by myself and asked for house keys, which he gave to me.

I just walked home alone that night listening to some podcast that doesn’t suck and went to sleep not long after returning home. 

&#x200B;

Originally posted here:  [https://i-me-and-myself.neocities.org/personalities.html](https://i-me-and-myself.neocities.org/personalities.html)",0
2020-02-01 21:47:51,https://www.reddit.com/r/REDDITORSINRECOVERY/comments/exhl5y/i_hate_that_i_struggle_with_addiction/,I hate that I struggle with addiction,"I get relief from meetings and I like the fellowship but today I just fucking hate that I'm not ""normal.""

Some days I just wish I could normally use drugs. I'm not going to use tonight but somedays I just hate that I have to do it.",6
2020-02-01 19:03:45,https://www.reddit.com/r/REDDITORSINRECOVERY/comments/exf6wy/friends_who_use/,Friends who use,"Well I've spent the last 8 years building a steady stash of friends who all use drugs because it's where I felt I fitted in to society and made me feel kinda cool I guess to be honest.

The problem is some of them are good friends to me yet like yesterday there was weed ket lsd benzos alcohol all around and while they know not to offer me especially the ket I knew I could get some bumps.

If I hadn't been to my first two NA meetings I would have gave in and got high. I'm happy I woke up today with my near month of sobriety still but I'm so torn because I'm gyming doing meetings but I still get lonley and like human contact.",5
2020-02-01 08:23:18,https://www.reddit.com/r/REDDITORSINRECOVERY/comments/ex62ek/6_months_sober_today/,6 months sober today!!,"I have 6 months sober today and I’m just so happy to be where I am. My counselor told me when I first got l to rehab that they’d “rather be miserable and high than miserable and sober” as a way to convince me that it really does get better- and today I believe them. 

I’ve been able to rebuild so much of my life that I had destroyed. I never thought I’d be here, Reddit...I am so happy.",91
2020-02-01 00:19:15,https://www.reddit.com/r/REDDITORSINRECOVERY/comments/ex1cyt/praying_for_the_addict_who_still_suffers_tonight/,Praying for the addict who still suffers tonight,    Just got the horrible news of a close friend passing. She was in recovery then slowly stopped going to meetings and working with others. This disease kills us. If you are struggling tonight I'm thinking and  praying about you. Please be safe out there and reach out if you need to. RIP close friend you are already missed.,55
