Date,URL,Title,Body,Score
2021-09-25 15:11:36,https://www.reddit.com/r/REDDITORSINRECOVERY/comments/pvdg84/my_20yo_nephew/,My 20yo nephew.,"Sorry. Here's a long winded story. 

My nephew (L) and I have always been close. Closer than his dad, closer than his mom. I've basically been as much of a dad to him as I could be as a single 20-30yo man. He had a shitty middle class upbringing. His dad (my brother) and his mom split when he was an infant as she ran away with my brother and my childhood best friend when I was 19 and 2,000 miles away for ""school."" Some real Jerry Springer shit. My brother is a gambling addict. He's lost two marriages and hundreds of thousands of dollars and is one year clean now and with a new supportive great gf, but this isn't about him. 

My nephew was ostracized at every opportunity at his mom's house, she had three more children after my nephew and had one previous child (5 total) who was adopted by her new husband. L was the one who wasn't ""his"" and they surely let him know and feel that way. L's always been a sweet boy, with some ADHD and wildness in his early youth. His mother and father did not co-parent together at all. There was so much selfish resentment between the two of them that they couldn't get past for L's betterment and well-being that is something I'll never forgive my brother for. 

When L was in middle school he started getting into trouble, not great grades, smoking weed, etc. And then when he got into high school he got into more of the same trouble. He finally went to live with my brother when he was 14/15. He was dropped off by his mom in 2015 and she hasn't tried to make contact with him since, NOT ONE FUCKING TIME. Posting on Facebook with her four other children like nothing was the matter, completely abandoning and forgetting about him. I can't even imagine the place in hell for someone like that. 

He got no help after moving in with with his dad and his step mom. Surprise!! Just hoping that ""love will pave the way"" didn't help at all. And the trouble kept escalating. Fights, expulsions, more weed, stealing pills and thousands of dollars from step mom's mother who lived with them. He was kicked out to my parent's house to protect his youngest siblings (much younger brother and sister to his dad and step mom) as the ultimatum was given to my brother. 

Again, he received no help. My parents were in their late 60s at the time, still working full time and in no condition to deal with a troubled teenager. So I moved in with them to try and help just be able to coexist. As anyone would imagine, the trouble just escalated. Admittedly, my head was in the sand with his troubles, expecting he will find his path. Not excusing myself, but I am a single late thirties man with no children (intentionally) I wasn't equipped or prepared to deal with a troubled 16/17 year old myself.

To the addiction.......in 2019, he started coming home from hanging out with friends really fucked up. It was acknowledged that he smoked weed, but this was different. Slurred speech, disgusting foamy(?) lips, wobbly walking, it wasn't weed. I got a text one day from his gf that he was abusing Xanax and fucking with guns and he denied it when confronted. (I realize now I'm missing so much of his story, but these are all the relevant parts I think) I had one of by best friends come to town in January of 2020 who stayed with us that L was familiar and friendly with. We went to go get pho one night and L was so fucked up he dropped his phone in his soup and was exhibiting such weird behavior at the restaurant (going to refill his own drink, just standing up and hovering around tables) that we just had to leave. When we got home he wanted to go smoke weed with his friend and I told him no, go to your room and just stay there. His room was on the second story. About twenty minutes after telling him to stay in his room, it was too eerily quiet, so I went to check on him and he was nowhere to be found. As you can imagine he jumped out of the window (about twenty feet up) fucked up out of his mind, standing on a rusty pipe while hanging out of the window. He literally could have died as there is nothing but concrete where he landed on his feet. He came knocking on the door about ten minutes later with both feet hurting but somehow avoiding being seriously injured. This was when I determined this couldn't go on any longer and if he wanted to continue living there he would have to get clean and do things my way. 

He was going to meetings and meeting with a therapist. I put a parent monitoring app on his phone that blocked Snapchat and monitored messages. Then the pandemic hit. The therapy center was closed down, and they stopped doing meetings, but he still stayed clean. 

This is a kid who was never pushed to do anything, no sports, no clubs, no music, nothing. He also had no hobbies besides video games, rap music and weed. 

I've been a poker player (mostly online) for the last 13 years. I've never had addiction problems aside from weed, but have usually been able to take breaks whenever I have needed to. I have tried about every drug possible aside from meth and heroin and I guess dare worked on me cause every time I did coke I was afraid my heart would explode. One of the things that makes me think I don't have the same problems other addicts do is I took aderall for work for a period of time and loved the feeling.....too much. The way it made my brain feel and tingle, the feeling of euphoria...it was too good. I stopped immediately. I know addicts don't have that privilege that I do of noticing it and being cognizant of that problem. I try not to judge addicts. I know it is a disease. My best friend (my brother) caused and deals with so much pain from it, I know it's not an addict's fault. It's only your fault when you don't seek help once you recognize it's a problem. 

Anyway, during the pandemic we were all locked inside and he needed something. So he wanted to try poker. And he liked it. He didn't know the game at all at first, and really struggled. But he kept with it and we were so proud of him. He was clean, he had something to be proud of. It was exciting. Then my dad caught the virus in July 20. He fought hard. Was intubated, got off intubation, but didn't make it. The patriarch of the family was gone and our family suffered a devastation we may never recover from. Through all this L stayed clean. In some ways I'm grateful for the pandemic as L had to be inside and learned a new skill, but I also despise everything about it as it took my dad, my hero, my anchor. 

We had to move from the apartment as my mom and dad lived on the property they worked for. So I moved my mom and L out with me to a new house. L thrived at poker during late 20/early 21. Doing things unexpected and taking himself to a different level. There were still personality quirks, ADHD problems, laziness, etc. But not when it came to poker. He loved it and was getting good. He built up a nice portion of money, and although he never understood the value of a dollar, he was decent with his management of it, albeit not going anywhere really to use it. 

After I got fully vaccinated in July, L wanted to go see an old friend he had from before he started using any drugs at all. I was reluctant, but I know I can't keep him in the house forever. He went and spent the night and came home, no big problem. The monitoring app on his phone included a screen lock that only I knew the password to, but he needed it when he was out or else his phone would be useless. So I gave it to him. We got into a random text argument and he deleted the app from his phone out of frustration, but I didn't think much about it because the trust he lost was fully back. He was clean, had a career and money, something I would think he would really have pride in and value. 


 About two weeks later he told me the kid was having a hotel party and asked if he could go. I trusted him again, and allowed it. 

He came home and gave both my mother and myself breakthrough cases of covid as he was unvaccinated. We all recovered, but he maintained a ""sinus infection"" that lasted weeks. About a month after that in late August around 4 pm I thought it was curious he hadn't come out of his room yet that day (he's a poor sleeper and it isn't terribly unusual) but just thought I would see what's up. He was gone. He left his phone behind and I went through it. In his messages were messages about coke, etc. I confronted him when he finally strolled in about 4 hours later and he admitted he had got coke for that one night at the hotel party and got it every night since. His whole bankroll was gone (about 20k) he had been on a 6 week binge right under my nose and again my head was too far in the sand to even realize. There were signs, I should have known. I feel so dumb, but it's not about me. Again, I immediately put the monitoring app back on his phone, along with another keylogging app that tracks what he does. There have been screaming matches and fights and it feels like January '20 all over again. My anxiety through the roof, being unable to eat or sleep, endless pacing. I just love him so much and want him to have a normal healthy productive life and I know he's so damaged from his past he may not want that for himself.

He has seen a psychiatrist who prescribed him ability and buspar, but he's so anti medicine (so frustrating) I know it's gonna be nearly impossible for him to get through the first couple of weeks of limited results and early side effects. 


Which takes us to today. I know he is still finding ways to do coke, he just did last night. I confronted him and he lied at first and I just told him when you want to be mature and honest, I'm here. As I was writing this, he came in my room any apologized for lying and said he had a problem and he really was committed to quitting.  But I don't know if that's honesty or manipulating. I'm kind of stuck. He's also so anti rehab from reading anecdotes on the stupid fucking /cocaine sub. 

Can't imagine anyone reading this whole thing. Thank you if you do. Just kind of stuck, not knowing the next step and this is really cathartic to write this all out. 

Tldr: 20yo nephew, recovering Xanax addict and current coke addict has relapsed and I'm not sure the next step to take. 

❤❤❤

S",15
2021-09-25 03:34:08,https://www.reddit.com/r/REDDITORSINRECOVERY/comments/pv22qn/just_for_today_september_25_the_fourth_step/,Just For Today: September 25 - The Fourth Step - fearing our feelings,"*“We may fear that being in touch with our feelings will trigger an overwhelming chain reaction of pain and panic.”*

**Basic Text, p. 30**

&#x200B;

A common complaint about the Fourth Step is  that it makes us painfully conscious of our defects of character.  We  may be tempted to falter in our program of recovery.  Through surrender  and acceptance, we can find the resources we need to keep working the  steps.

It’s not the awareness of our defects that  causes the most agony—it’s the defects themselves.  When we were using,  all we felt was the drugs; we could ignore the suffering our defects  were causing us.  Now that the drugs are gone, we feel that pain.   Refusing to acknowledge the source of our anguish doesn’t make it go  away; denial *protects* the pain and makes it stronger.  The  Twelve Steps help us deal with the misery caused by our defects by  dealing directly with the defects themselves.

If we hurt from the pain of our defects, we can  remind ourselves of the nightmare of addiction, a nightmare from which  we’ve now awakened.  We can recall the hope for release the Second Step  gave us.  We can again turn our will and our lives over, through the  Third Step, to the care of the God of our understanding.  Our Higher  Power cares for us by giving us the help we need to work the rest of the  Twelve Steps.  We don’t have to fear our feelings.  Just for today, we  can continue in our recovery.

&#x200B;

**Just for today:**  I won’t be afraid of my feelings.  With the help of my Higher Power, I’ll continue in my recovery.

^(Copyright © 1991-2021 by Narcotics Anonymous World Services, Inc. All Rights Reserved)    ",8
2021-09-24 21:34:24,https://www.reddit.com/r/REDDITORSINRECOVERY/comments/puwz7x/going_back_to_real_life/,going back to real life,"my drinking landed me in liver failure. cirrhosis and a handful of associated ills. i eventually did what my friends and family were suggesting and applied for disability, or ssdi as it’s also known.

well, i managed to regain my health and have i have my sobriety. i’ve been on disability for a year and was just notified it will be coming to an end in november. 

i have some residual health things, hey, it is what it is.. i’m alive. i haven’t worked in quite awhile and i am terrified to rejoin the world in this way. 

anyone else go off grid while they were using and successfully re-enter society? thanks",9
2021-09-24 19:55:46,/r/SanDiegoClassifieds/comments/pu5x2i/250_for_3_hour_clinical_study/,$250 for 3 Hour Clinical Study!,,1
2021-09-24 15:51:11,https://www.reddit.com/r/REDDITORSINRECOVERY/comments/pur805/deleted_by_user/,[deleted by user],[removed],1
2021-09-24 08:55:54,https://www.reddit.com/r/REDDITORSINRECOVERY/comments/puj5zf/my_mom_wont_accept_that_i_was_an_addict/,My mom won’t accept that I was an addict.,"My mom is great. She really is. She has always been there for me, stepped in when my dad wasn’t there for me, helped me emotionally or financially (with boundaries), but she just WILL NOT accept that I had an addiction issue. I hid it extremely well from her. There was once she found a little dime baggie when she was grabbing something from my old room, but just gave me “the mom look”.

I’ve been sober for 55 days, so this is all very recent.

I told her I need to stop drinking: she said well, maybe it’s not that big of a problem? You could just have one?

I told her my doctor will not prescribe me ADHD medication (yet) because of my past addictions: she said well maybe the doctor could start you on a really low dose?

I told her I need support not solutions: she doesn’t know how to just support, just wants to “fix”.

It’s frustrating. I have my boundaries, I see a therapist, this has come up in decently casual conversation because I’m becoming more open about it. The thing is though, she as an addict too. A long long long time ago, but I thought she would have some more “you can do it!” Or “it’s a journey” kind of support. 

I think I’m at the point where I need to leave her out of my recovery ups and downs. Or shutting the conversation down.

Last time I was on the phone with her I had to repeat 3 times… mom I was an addict that option is not available for me, talking about managing my ADHD.

It’s tough, she’s my only family member in this state, and she’s been so supportive before. But when I plainly say, “IM AN ADDICT” she shuts down or scatters for a solution.

This is mostly a vent post… advice is welcome.",22
2021-09-24 03:33:08,https://www.reddit.com/r/REDDITORSINRECOVERY/comments/pueu6v/just_for_today_september_24_a_growing_concept_of/,Just For Today: September 24 - A growing concept of God,"*“The only suggested guidelines are that this  Power be loving, caring, and greater than ourselves.  We don’t have to  be religious to accept this idea.  The point is that we open our minds  to believe.”*

**Basic Text, p. 24**

&#x200B;

In a lifelong process of coming to believe, our  understanding of God will change.  The understanding we have when new  in recovery will not be the same when we have a few months clean, nor  will that understanding be the same when we have a few years clean.

Our initial understanding of a Power greater  than ourselves will most likely be limited.  That Power will keep us  clean but, we may think, nothing more.  We may hesitate to pray because  we have placed conditions on what we will ask our Higher Power to do for  us.  “Oh, this stuff is *so* awful, even God couldn’t do anything,” we might say, or “God’s got a lot of people to take care of.  There’s no time for me.”

But, as we grow in recovery, so will our  understanding.  We’ll begin to see that the only limits to God’s love  and grace are those we impose by refusing to step out of the way.  The  loving God we come to believe in is infinite, and the power and love we  find in our belief is shared by nearly every recovering addict around  the world.

&#x200B;

**Just for today:**  The God I am coming to  understand has a limitless capacity for love and care.  I will trust  that my God is bigger than any problem I may have.

^(Copyright © 1991-2021 by Narcotics Anonymous World Services, Inc. All Rights Reserved)    ",7
2021-09-24 01:01:09,https://www.reddit.com/r/REDDITORSINRECOVERY/comments/puctp3/ive_been_clean_for_a_while_and_i_thought_i_might/,I've been clean for a while and I thought I might share my story.,"Feeling my mortality today and I think maybe I’m ready to talk about my journey to sobriety and beyond. It has been a damn long road and I was never sure I would make it this far. 

I got drunk the first time when I was 11, smoked up when I was 16, and started shooting meth when I was 18, and finally got sober when I was 40. Meth was my drug of choice for most of those years, but I went through a coke phase, and a heroin phase, and I was always willing to do whatever substance was put in front of me. Jails, institutions, and death, I found all of em at one point or another. I have been beaten, stabbed, and poisoned. I slept on the streets and ate out of garbage cans, spent six weeks in bed with hep b and c, and went to jail more times than I can remember. I never gave a shit what happened to me or those around me as long as I could get my fix. I can tell you what it was like, what happened, and what it’s like now, but I don’t think I could ever convey how miserable, lonely, angry, and sad I was. As bad as the world I put myself in, it was nothing compared to how horrible my inner world was. That’s what drove my addictive behavior, not the world around me, but the world within.   My story isn’t really unique, many of you have been through the same, or worse. So I’m not gonna spend time telling war stories. I just wanted ya’ll to get some context. 

In 2005, it was all coming to a head, again. My ex-wife had moved 2000 miles away, with our daughter and neither one of them wanted anything to do with me. The only person in the family who would talk to me was my mom. My only ‘friends’ were other junkies, and eviction and life on the streets, again, was looming. Then in the space of 3 days I lost 2 friends, one left my house, went home and did her last shot, she was only 20. the other was screwing around with a pistol while high and shot himself, in front of me. I was broken, physically, mentally, and spiritually. Over the next month I tried to kill myself several times, but I always woke up. I remember thinking “you dumbass you cant even kill yourself.” I felt like the last kid on the playground and I just wanted to go home. Even today I sometimes have those feelings, but those days were some of the darkest in my life.  I checked into a psych ward and then 24 hours later conned my way out. I came to the realization that I couldn’t use anymore, and as I couldn’t seem to successfully off myself, I was gonna have to get sober. But not only did I have no real clue how to get sober, I had no idea how to live once I did. over the years of my addiction I had been to rehab twice. Neither one took, because I didn’t want to do the work. The state of texas put me in a long term rehab that had severe consequences if I used and that did manage to work for a while, but only because I didn’t want to go to prison. But fear only works for so long before you’re like, fuck it. So I was pretty sure nothing would work. 
	
Several months earlier the Alano club had moved in 3 doors down from my house so when the withdrawls eased up I went to a meeting. It was nice, scary, but nice. After I’d gone to a couple meetings I picked a sponsor. I chose someone who I thought, in a pinch, could kick my ass. It was my primary criteria, lol. See I knew I was an asshole and prone to violence so I figured if my sponsor could kick my ass maybe it would force me to behave. I guess it worked. We have come really close to blows once or twice over the years, and he even fired me when I wouldn’t do my forth step (I came crawling back and did the damn step). But we are still friends and he is still my sponsor. So maybe wasted me did something right. My sponsor has a simple plan: read the book and do what it says, go to meetings, work the steps, call your sponsor, do some service work, and don’t fucking use or drink today. We’ll worry about tomorrow when it get here.  I know AA isn’t for everyone, and some folks think it’s hokum, but god damn if it hasn’t worked for me. 

Let me tell you a little bit about my program. I have always been a mostly athiest, still am. But I figured that if praying could keep my sponsor sober why not give it a try. I didn’t have to believe in god to know that talking out loud about my problems could help to overcome or at least come to terms with them, after all shared pain is lessened pain, right? So my first several years I went to a lot of meetings where I tried (not always successfully) to keep my mouth shut and my ears open, read a lot of AA literature (not just the big book), prayed, met with my sponsor regularly, and worked the steeps. all my other efforts at life had failed, and I really had nothing left to lose.  I also got myself into therapy, and tried to really understand why I was an addict. The conclusion I came to was that I was just wired that way. I can get addicted to anything, booze and dope, sure, but other things too.  gambling, hell ya, it gave me a little bit of that same rush. sugar, yep. Binge eating, yep I can do that too. How about starving myself to lose all that binge weight, oh ya.  all this shit came up when I got sober and I had to find a way to get through it. The way my sponsor put it was “When you get here you’re a drunken horse thief, then you get sober.” So getting sober was only the first part of the solution for me. The rest of it was therapy, and learning to pay attention to what was going on in my head, without getting obsessed with it. I’m not there yet but I’m closer than I was. 

I have done more with my life since I got sober than I did in the previous 40 years. Got and kept a good job. Something I never was able to do while using. Hell I even upgraded to a better job a few years ago. I may even get to retire one day! I got a degree, I earned a black belt, lost a shit ton of weight, raised my daughter for 11 years. And I’ve stopped punching people when they piss me off.
 
Sobriety hadn’t been all good stuff though. A lot of the people that I knew back in the day are dead or in prison. I lost my daughter to an overdose in 2018, and in june of this year my girlfriend also died of an overdose. Staying sober for me means I have to handle that shit without getting loaded or just giving up and killing myself. But I’m not going to fucking use again, not today anyway. 
	I hope this isn’t too much of a rambling mess, and that somebody finds some use in it. 

I have to get to bed, early day tomorrow, but I will reply tomorrow after work if anybody wants to know anything else.",34
2021-09-23 17:02:24,https://www.reddit.com/r/REDDITORSINRECOVERY/comments/pu4ncg/does_anyone_use_b12_as_a_supplement_during_paws/,Does anyone use b12 as a supplement during PAWS?,"I've had PAWS for a year now and I'm getting better very slowly. I have this thing where I get rather paranoid that certain things will setback my recovery, because it's been such a gruelling process.

Anyway, my b12 is quite low so I want to start taking a supplement. Is that safe to do so with regards to PAWS recovery. I get enough in my diet so I'm worried that my body is keeping it purposefully low for healing purposes as I know it has some stimulatory effects. This is probably just an irrational fear from me so I'd like to get some input from some people who have used the supplement and still recovered!",7
2021-09-23 14:42:27,https://www.reddit.com/r/REDDITORSINRECOVERY/comments/pu1skx/i_relapsed/,I relapsed,[removed],1
2021-09-23 14:25:07,https://www.reddit.com/r/REDDITORSINRECOVERY/comments/pu1fif/follow_up_on_a_previous_post_about_cognition/,Follow up on a previous post about cognition recovery,"It's been 6 months since I posted, scared that I would never get my brains back. Just wanted to say that they have started to return and I'm confident I'll make a full recovery. This is for the people who may of seen my previous post and want to know how I ended up, it's important to inspire hope during PAWS.",20
2021-09-23 08:48:32,https://www.reddit.com/r/REDDITORSINRECOVERY/comments/ptuh3q/last_night_i_witness_my_5th_od_this_time_it_wasnt/,Last night I witness my 5th OD. This time it wasnt just a close friend or buddy. This time it was my little baby sister. When will enough be enough,[deleted],13
2021-09-23 06:40:44,https://www.reddit.com/r/REDDITORSINRECOVERY/comments/ptsgx7/new_recovery_blog/,NEW RECOVERY BLOG,[removed],3
