Date,URL,Title,Body,Score
2020-06-29 22:17:29,https://www.reddit.com/r/REDDITORSINRECOVERY/comments/hie9an/im_so_scared/,I’m so scared,"My first post so not sure if it’s propper. I’ve been trying to quit on and off for about 6 months now. With coronavirus and being quarantined that went mostly out the window a lot of days and I fell into deep holes. This weekend me and my partner broke up, and going back to live with my parents Lost control the next day and they threw away all the bottles in the house. I had been 3 days abstinent today when I remembered there’s a gallon of industrial 70º alcohol in the kitchen that they bought for cleaning supermarket delivery and I mixed it with some juice and downed it in one go. I really just feel horrible about myself as I’m writing with sweats and shivers unable to sleep. I feel like throwing up just from sheer panic. I know it’s not like drinking car ethanol because the industrial quality won’t allow for any methanol in these high-grade products, but now I’m so scared that drinking car alcohol won’t be beyond me someday if I can’t stop soon. 
	I know I haven’t gotten to the point of screwing up anything in my life yet and I can only thank god for that. But we never know when that can happen, right?
	I just really needed to get this off my chest. 
Thanks in advance for any advice you may have to give in support.",11
2020-06-29 18:06:03,https://www.reddit.com/r/REDDITORSINRECOVERY/comments/hi9zwm/day_3_of_xanax_withdrawal/,Day 3 of Xanax withdrawal,"Hey all, I’m hoping someone in this subreddit has gone through what I’m going through right now and can help give me some guidance on what to expect for the next few weeks. I’m 21 F, around 135 lbs and for the past 2-3 weeks I’ve been doing between 2mg-4mg Xanax daily. Well, 3 days ago I ran out and decided that I was done. The first night after I quit I felt no adverse side effects, but last night I started to feel them. Cold sweats, body tremors & aches, and anxiety. This morning I woke up feeling extremely nauseous and had to leave work early. Had no appetite all day until around noon when I was barely able to eat a small burger. Now I’m sitting in bed and I feel like the room is spinning, my brain is very foggy and it’s hard to focus. I guess I’m just looking for some insight from others who have gone through this process. If anyone has any tips to help the symptoms I would love to hear them. Most of my symptoms so far have been physical, the only mental symptoms have been brain fogginess and anxiety.",44
2020-06-29 17:44:36,https://www.reddit.com/r/REDDITORSINRECOVERY/comments/hi9kr4/cocaine_cravings/,Cocaine cravings,"It’s been almost 4 days since I quit coke and all I can think about is how much I wanna hit a line, I’m literally at work and all that’s on my mind is if I should message the plug for a gram. How do you deal with cravings?",12
2020-06-29 04:00:56,https://www.reddit.com/r/REDDITORSINRECOVERY/comments/hhvtjt/depending_my_happiness_on_others/,Depending my happiness on others,"My whole life I’ve depended my happiness on others. The moment that I have no one to talk to I feel empty, sad, alone, depressed, incomplete. How do I detach my happiness from people and be happy on my own?",13
2020-06-28 21:47:23,https://www.reddit.com/r/REDDITORSINRECOVERY/comments/hhqzu1/relapsed_hard/,Relapsed hard,I don’t know where to start but I’ve few like I’ve dug my self deep this time ...... I literally have nothing I’m living out of my bags and is sobering up at my parents where do I go from here I feel them getting sick of me ..... I need a strangers opinion!,20
2020-06-28 17:10:44,https://www.reddit.com/r/REDDITORSINRECOVERY/comments/hhmj37/cbd/,Cbd,"What's everyone's opinion on this? I got clean from heroin and crack almost 4 years ago.
Have absolutely no desire to go back to that shit. I got clean doing a 12 step program which I won't name but their thing is absolutely no mood or mind altering substances.
I recently started using cbd cause it helps relax me and takes away aches and pain.
So would you consider this a relapse?

It has very little thc and no u really don't feel high like thc does to you. So I'm looking for opinions",31
2020-06-28 16:33:48,https://www.reddit.com/r/REDDITORSINRECOVERY/comments/hhlvdv/not_sure_where_to_turn/,Not sure where to turn,"I have to think but that’s the thing I can’t, I’m so voided out that there’s nothing left in my mind, after so long using substances to “push” myself, it really hurts to be here and have nothing but failure to show. I’m so scared and all I want to do is go back to the days of substance use at least then I felt I was actually doing something. Now I’m almost 30 n have completely given up on myself, I’m so desperate I seek out what other people are doing in hopes to copy them but I’ve carved everything out of myself and feel so pathetic and hopeless, even suicide doesn’t contain the power it use to, now I just exist and it pains me so. I’m hoping I get up and do something but I’m so fucking stupid I would know where to being, idk I think I’m finally going to just say fuck it and use Heroin.",0
2020-06-28 15:03:42,https://www.reddit.com/r/REDDITORSINRECOVERY/comments/hhk7lv/does_anyone_else_miss_the_feeling_just_before_you/,Does anyone else miss the feeling just before you think you’ll OD?,[deleted],5
2020-06-27 16:23:21,https://www.reddit.com/r/REDDITORSINRECOVERY/comments/hh0ria/psychosis_recovering/,Psychosis? recovering?,"not sure if this is the right forum to post to... Im afraid this might be a long post so if you read... I appreciate it. 

Ive been seeing someone for a while now, and im not sure if you guys know anything about cannibis or alcohol induced psychosis or meth.. But he has used all before. Currently he only smokes cigarettes, weed, and drinks beer. I am not a psychologist- but i do work in the medical field and the signs im seeing are pointing directly to psychosis or something along that line.. 

If he drinks or smokes pot.. he becomes so different within a half hour to hour afterwards. he starts thinking that he is dead, he asks me if this is even reality, if we are even here. And then if i say youre not dead, this is reality, he will say “how do you even know?” 

Or he gets paranoid- wont let me touch him because he thinks im going to inject him with something. ?


Theres some things i dont know about his past, but he was in prison for 6 years for grand theft (which he returned the car cause he didnt realize he took the wrong one...thats a whole other story) But his sister has been very vocal saying he has been different and like this since he got out 5 years ago. she does not think this is drugs. 

He has told me some stuff when hes been drinking/smoking but im not completely sure of the whole truth.. He has said things when he gets into these episodes like “i wake up and some dudes on top of me and trying to stick it in me” but he shut down and didnt say anything more. He has said stuff like “well i dont believe counselors are real, maybe some of them, but they just inject you and try to control you” 
sometimes in these episodes he has said “idk what youre gonna do, my privacy has been raped my whole life and who knows im sure ive been injected before” 
or he will just start becoming paranoid about my phone. He doesnt like the camera, so i have tape on my camera on my phone when we drink or if we smoke. I often dont drink with him because he changes so quickly.. i mean 2-3 beers and he is spiralling. He starts taking things apart, he starts destroying the house... nothing he says makes sense. He will start saying random numbers, or just say something weird like “oh yeah i remember nickel” like what?? and ill ask him what he said and he doesnt even know. These episodes havent ever got physical and hes never hurt me. hes raised his voice once and said that i was selling my soul to the devil? And he has hit himself in the face before and called himself a f*ck up. 

I just dont know what im dealing with. I know that he did meth a while ago- but his response to me about it was that he did it and a bunch of bad stuff happened when he did it, and he said he couldnt work and he thought the government was after him, and that he had a really bad experience where he locked himself in the bathroom and took a screw gun and screwed the door shut. (im not sure when this experience/story happened) To my knowledge, he isnt on meth. I mean i see some similarities in these episodes, but if hes not out of my eyesight and i literally watch him change and have these episodes... I mean i dont have an explanation.. I mean theres often times where he grabs my hand and wants me to come pee with him. and other times he is scared of me touching him. And the sex- he is very feely about it. Like he considers it very “special” so in the past few months we have only had sex once, ive given him 2 BJs, and then recently we started having sex and he had been drinking and he stopped right in the middle and put his pants on, grabbed me and said “i wanna make sure we want to have kids first before we keep going..” Which i respect very much-but i keep thinking something is wrong with me where he doesnt find me attractive or something.. like sometimes we have seen each other 3 days in a row without a kiss or even hug because he will say “i dont know you what if you inject me or do something to me” (after hes been drinking and smoking weed)  But he always tells me im so beautiful and how much he likes me, and hes let the word Love slip out a few times. 

I am just at a loss here. Ive mentioned like the psychosis thing and he just jokes about it and says “oh so im in psychosis or im a schizophrenic huh” and then tells me im trippin. Lol 

I mean i know that he has done meth in the past, his old roommate did it and it was a big reason why he kicked him out i guess. But he doesnt talk much about his past with me. Anytime ive brought up the question if he is doing meth or something, he says “you asking me this makes me wanna go do it, that stuff is no good” But its like i know theres 2 people that he is kind of friends with, doesnt see them often but they are meth addicts and his ex girlfriend did meth. He said thats why they arent together- because she needs to be sober. But i dont know how else to explain how he acts.. but its like when would he be doing it? Because if we sit down, open some beers and he is on the couch, hasn’t moved, he was in the car and the store with me when we get beer, and then after a few and few hits of weed he starts spiraling like this? I found one meth pipe when we were cleaning out the house because the back part of the house is kind of destroyed- had to replace the floor and stuff, there was a meth pipe back there and he just shattered it and said “well thats bullshit- i need to get everything in this house cleaned” . Which he kind of has a hoarding issue and he knows he does and so does his family lol— but none of this family seems to have these issues or have ever done drugs- they all seem pretty straight&narrow, all catholic. But yeah..Then like a week later we found like some 14 inch dildo hahaha and he was like “did you put this here??” and it was kind of a joke but then he said “theres so much stuff back there i dont even know about in my house, is this even my house??” 
As far as i know he hasnt used meth since like 3 months ago. He said he tried to do it, and he never wanted to experience it again. So im not sure what to think of that. One time he said something like “i could do dope once a month” and he giggled and im not sure if he was being serious or not. 

But how do i explain these changes that happen? we spend every day together, but we dont always have sleepovers because if he does smoke weed even if he doesnt drink, he gets weird about me being there and doesnt “trust me” enough yet, but he can sleep at my place easily... He sleeps about 5 hours a day. Usually about 1-2hrs hours after he gets off work at 3pm, at my place (my AC works) then he sleeps from about 2am to 6am. 

I just don’t understand how he can be completely normal- drink a few beers and roll a blunt and suddenly he is delusional pretty much. I wanna say its meth- but its just not clicking for me. Especially because its not like he gets weird about the govt or is taking everything apart or anything. He just gets literally delusional- questions life. Will list off a string of numbers randomly. Will say things that dont make any sense and i ask what he is talking about and he doesn’t even know. He will mention a past moment or something, then will go on a rampage about someone hurting his family idk its so confusing.

I care about him deeply, but i just dont know what im dealing with here..",2
2020-06-27 13:09:49,https://www.reddit.com/r/REDDITORSINRECOVERY/comments/hgxa3k/best_sobriety_gift_you_have_or_could_receive/,Best sobriety gift you have or could receive?,My longest and dearest friend is coming up on 1000 days of sobriety.  I have written a heart felt letter which I would like to mail along with a box of small wrapped items to help her celebrate her day. Price is no object but I'm struggling to find the right gift or gifts. What is the best sobriety gift you've received or what do you wish someone had given to you instead of a lame ass sobriety mug?,4
2020-06-27 07:33:41,/r/StopSpeeding/comments/hgs0oy/update_my_relapse_just_over_a_month_ago_after/,"Update: My relapse just over a month ago after four years clean, and reminders why I do NOT need it guys please remind me I dont need it",[deleted],23
2020-06-26 16:24:23,https://www.reddit.com/r/REDDITORSINRECOVERY/comments/hgf9ur/post_relapse_depression/,Post- relapse depression,[deleted],5
2020-06-26 12:46:19,https://www.reddit.com/r/REDDITORSINRECOVERY/comments/hgb53m/need_advice_for_getting_jobs/,Need advice for getting jobs,"So I'm 21 and pretty recently out of rehab. I've been doing some work on the side with friends but I'm looking for a full time job and so far haven't had any success. Prior to rehab, I had lost two jobs for alcohol related reasons and obviously that isn't doing me any favors currently looking for jobs. I'm just looking for any advice on getting jobs for someone in recovery and specifically how to handle the situation of past employers mentioning your alcohol problems to the places I've applied to? Is that something I should be up front about and if so how would I bring it up?",2
2020-06-26 07:52:55,https://www.reddit.com/r/REDDITORSINRECOVERY/comments/hg63wo/suicidal/,Suicidal...,[deleted],59
2020-06-25 12:06:12,https://www.reddit.com/r/REDDITORSINRECOVERY/comments/hfoqj5/jails_institutions_and_death/,"Jails, institutions and death","I’ve been thinking about something lately that I’ve wanted to share with my fellow alcoholics and addicted, and near me, all the meetings are canceled. Not that I attend super regularly nowadays, but I’m still there every month or two. But anyway, I work for a state mental hospital. I’m in the medical records department, basically doing filing and maintaining charts. I work on a unit, near patients.

Now, the place I work, most of the patients are here because they pleaded Not Guilty by Reason of Insanity. Everyone here is committed by the court. 

In the course of my work duties, I see everything about these people. I read their stories, how they were arrested. The particular unit I’m responsible for is 53 guys, (it’s an all male unit, but other units are female) and every single of of them was intoxicated when they committed their “Instant Offense” (that’s what they call whatever you did to have to plead NGI). 

Every single one of them. We gave maybe 10 guys out of 53 that were on their third strike, so they copped a NGI plea to avoid 25-Life under “Three Strikes” laws, basically by exaggerating their symptoms. The rest have various degrees of schizophrenia and  schizoaffective disorders, and more than a few developmental disabilities.

But all of them were high or drunk when they got arrested. A good percentage had been on medication and then stopped, either from neglect or inability to obtain treatment. Some were using drugs to self medicate. 

It strikes me how easily I could be in their place, all the times I was out of my mind on some mix of chemicals and did something crazy. Sometimes I think how easily I could have ended up somewhere like this, until I realize, we’ll, I **did** end up here, I just get to go home every night. 

It seems really telling to me that none of these guys ended up here while they were sober, while they were working a program. 

I don’t know for sure what any of it mean, I just wanted to share. Thanks.",6
2020-06-25 08:42:26,https://www.reddit.com/r/REDDITORSINRECOVERY/comments/hflezo/online_sites/,Online Sites,I am trying to get sober again and have never been real big on the AA/NA meeting but my way isn't working. I have heard about some online meetings and want to give it a try. If y'all could hook me up in the right direction. I did download app but doesn't really have that many meetings.,10
2020-06-24 21:44:01,https://www.reddit.com/r/REDDITORSINRECOVERY/comments/hfdooq/sobriety_gave_me_everything_that_my_addiction/,"""Sobriety Gave Me Everything That My Addiction Promised Me""",[removed],3
2020-06-24 07:54:49,https://www.reddit.com/r/REDDITORSINRECOVERY/comments/hezp2j/todays_the_day_i_finally_fully_commit_to_getting/,Today’s the day I finally fully commit to getting sober!,[deleted],1
2020-06-24 01:05:47,https://www.reddit.com/r/REDDITORSINRECOVERY/comments/heuqnj/flushed_my_pills_today/,Flushed my pills today,"So I've been casually using oxycontin. I know, I know. There is no such thing. I realized that last night when I had the best high of my life and then that was all I could think about for 24 hours.

I used to be addicted to dilaudid for a short period of daily use. Was clean for over four months, had a one time relapse when I found some tramadol, and then relapsed again at the beginning of this month when I got into my mom's safe and swiped a bottle of oxy. I told my partner about the initial relapse, but didn't mention that I was using once or twice a week since.

Because I was freaked out that I was so focused on my high from last night, I confessed to them that I'd been using. We had a long talk and they were very understanding, but they told me I had to flush the pills. It took me an hour of internal arguing to do it. I got so anxious about it I started getting a migraine and thought I was going to throw up.

But I did it. I flushed em. All 15 and a half pills gone.

And I immediately regretted it. I can't possibly get those pills anywhere else. They're from 2013, they don't even make those kind anymore. I'll never experience that high again. Ever.

Opiates have been my fall back for whenever my PTSD got bad. If I had a day where I was just irritable and angry, I could snort 5mg and feel that warmth and go back to being talkative and happy again. It's an easy out. I want it back already. I almost saved one just so I could have one more high, and I so wish I did. I am so angry that I just wasted all of those meds. I know in the long run I would've fallen back into a pit, but trying to cope with my trauma without that crutch is just so much harder. Pills take the weight off my shoulders and let me just relax. Weed just can't do that for me. 

I know I'm just scared of change. I don't want to stop using. I don't have any intrinsic motivation to do it. I just don't want to hurt my partner, because they were an addict themselves and they know the struggle and have helped me through withdrawals and everything. They deserve better. I just can't find a way to believe that I also deserve better. And that's why I've relapsed. And that's why I don't know how long I'll last.

But I guess I just have to take it one step at a time for now. One day clean.",72
2020-06-23 20:09:09,https://www.reddit.com/r/REDDITORSINRECOVERY/comments/heqbuy/any_advicetips_on_not_using_anything_due_to_a/,Any advice/tips on not using anything due to a breakup/work stress?,[deleted],1
2020-06-23 18:04:48,https://www.reddit.com/r/REDDITORSINRECOVERY/comments/heo4ts/im_a_fucked_up_person/,I’m a fucked up person,I just feel completely defeated. I called the rehab back. I cant do this anymore. I’m toxic.,6
2020-06-23 15:22:19,https://www.reddit.com/r/REDDITORSINRECOVERY/comments/hel3ax/i_just_wanted_to_let_you_all_know_that_youre_here/,I just wanted to let you all know that you’re here for a reason and I understand that reason. Your life has value. One day we’re all going to die.,Think about it. Like...your brain and body is going to stop. This world. This life. No more. This is the one life we get. Let’s make sure we’re not wasting it. It’s going to be shitty and amazing and everything in between. Be awake for it. Love love love.,45
2020-06-23 11:06:11,https://www.reddit.com/r/REDDITORSINRECOVERY/comments/heg8ud/treat_addiction_with_ibogain_buy_suboxone_online/,"TREAT ADDICTION WITH IBOGAIN, BUY SUBOXONE ONLINE, WHERE TO BUY OPIOIDS,",[removed],1
2020-06-23 02:35:38,https://www.reddit.com/r/REDDITORSINRECOVERY/comments/he9jqy/supporting_recovery/,Supporting Recovery,"I'm hoping to get some opinions from this community about how to support my partner in getting off of meth.

A month ago he came to me in a paranoid panic and admitted to me that he'd been using for about a year. We got rid of the drugs and I spent the next 7 days detoxing him. Around the end of the week he started expressing that he needed some space and time alone to process. I tried to give him that in the following weeks but he ended up going off the rails much worse culminating in a cross province paranoid binge about a week ago. I've been staying with him while he detoxes since. 

We've got in touch with addiction and mental health supports and have some phone calls this week and want to look into residential recovery programs.

The problem is that he's starting to express that he's going to need some space and time to himself again. As an introvert I totally understand how that could be important and even necessary in his process of recovery but I also know I can't really trust him at this point. I'm terrified of leaving him alone but I also know I can't force him to get clean either and if he truly wants to use it will probably happen.

Sorry for the rant but I would greatly appreciate any advice or opinions about how best to help and not harm his recovery. Thank you.",1
2020-06-23 02:00:30,https://www.reddit.com/r/REDDITORSINRECOVERY/comments/he94ij/im_brand_new_heres_my_story/,I’m brand new! Here’s my story,[deleted],1
2020-06-22 19:26:07,https://www.reddit.com/r/REDDITORSINRECOVERY/comments/he3ao4/how_do_you_cope_with_daily_life_without_drugs_or/,How do you cope with daily life without drugs or alcohol?,[deleted],48
2020-06-22 17:20:19,https://www.reddit.com/r/REDDITORSINRECOVERY/comments/he134h/how_to_get_started/,How to get started?,[deleted],4
