Date,URL,Title,Body,Score
2020-06-19 04:20:22,https://www.reddit.com/r/REDDITORSINRECOVERY/comments/hbwwie/trying_to_recover/,Trying to recover,"It's really hard for me to begin this because I have only recently realized how much help I need. But basically I used heroin for four years and it almost destroyed me. Long story short, I somehow managed to get off that shit but since then (about 8 years ago)  I've been getting by as an alcoholic. By getting by, of course I mean the occasional run in with cops, doing drugs with random folks when the opportunity came up, horrible moments with friends and more recently a broken ankle that I wasn't able to even explain to myself. Somehow though, I still convinced myself I was getting by, because I could hold down a job and function enough. That started to change with COVID. I almost lost my job, cause turns out, haha big surprise, when given extra freedom, all I want to do is drink. 

For the last two months I have tried to stay sober (I say try, cause I have had a slip up and my biggest fear is letting people down, trying is easier than doing). But I'm almost 32 and I no longer have the energy to keep my lifestyle up. 

I've been to all sorts of anonymous style meetings in the past, sometimes by choice, many times as a mandate, but this time around, I haven't actually done anything wrong...I'm just looking to do better!

I guess I'm posting this because I realized I can't stay sober on my own anymore. The first few weeks were easier than I expected, because it was a novelty to not feel shitty every day! But now as time sets in, I'm not so sure. Wondering if any of you folks have some advice or groups or whatever to recommend?",2
2020-06-19 02:03:47,https://www.reddit.com/r/REDDITORSINRECOVERY/comments/hbvaxf/my_best_friend_used_to_abuse_xanax_and_alcohol_is/,My best friend used to abuse Xanax and alcohol. Is it normal for me to still feel broken inside?,"At the end of 2018 and the first half of 2019, my best friend had been prescribed Xanax for his seizures and anxiety. I don't know how but eventually he began to abuse his prescription and mixed it with constant consumption of alcohol as well.

I spent a lot of that winter trying to help him taper off while dealing with his memory lapses, further seizures, and many fights and hurtful words. I told myself that he wasn't himself so I shouldn't take the hurtfulness of his actions to heart.

He developed a toxic mindset and refused to listen to me about my concerns for a very long time. I still have terrible flashbacks to those memories, the fear that he would die, and that I couldn't help him. We live in a foreign country and outside support was non-existent at the time. I remember a time where he woke up in the middle of the night and didnt recognize me or knew who he was himself. He would eat Xanax like candy and chase it with shots.

Due to complicated reasons, I was not able to confide in anyone about what happened and he wouldn't help me either for a long time even after he got better.

Eventually, he got past it. It's been a year now and the memories still hurt me a lot, even though he has made changes to be better, even though he had since apologized to me for all of it.

Is it normal to still be hurting from what happened back then? Am I overreacting by still being upset from those events? Am I allowed to still be hurt or should I just get over it?",14
2020-06-19 00:39:55,https://www.reddit.com/r/REDDITORSINRECOVERY/comments/hbu80w/sober_grid_app/,Sober Grid app,[removed],2
2020-06-19 00:08:36,https://www.reddit.com/r/REDDITORSINRECOVERY/comments/hbtsdj/desperate_to_quit_pain_meds_but_dont_know_where/,"Desperate to quit Pain Meds, but don’t know where to start? Any suggestions, advice, support, or just talking to someone would help a lot...","I want to make this long story short bc it could go on for days... My very first encounter with prescription pain medication was about 6 years ago (I was 23 at the time) when my mom got diagnosed with chronic pain... At the beginning it was hard for her to get prescribed pain meds, so we knew a friend of a friend that had a whole bunch of 5mg OxyCodone bottles stocked up bc he wouldn’t take them... I snagged a few bottles and that’s pretty much where it all started for me...

Once my mom got on her pain management program and was able to get her own meds, she didn’t need to deal with that Oxy dude anymore. However, what she didn’t know is that I continued to keep in contact with him... For a good 4 1/2 years this guy gave me his monthly prescriptions of 120, 5mg OxyCodone for dirt cheap bc I’m young and cute and it probably tickled his ego that I would text him so often practically begging to know when the next time would be that I’d see him 🙄

Of course over time my tolerance had built and I took more and more and would start to run out quick. I’d end having a week of WD’s waiting for his next refill... Eventually I got better with my self-control &amp; was able to manage limiting my daily amounts so that I wouldn’t have to deal with the WD’s while I impatiently awaited his monthly visits to me...

During this whole time, my mom was going thru her pain management program, trying to find the right doctors, ppl who would prescribe her amounts that she could deal with... and eventually she got to a point where she had the loadsssss of 40mg, OxyContin Extended Release &amp; 15mg OxyCodone Instant Release stocked up...

I had convinced her that I could sell those for her to make some money since she wasn’t working at the time and had no income. 
For the last 2.5 years I’ve been selling AND taking my moms pain meds, but now her “stock pile” is gone of course and she’s been “sparing” me a few pills a month to “sell”...
This month she finally told me her pain mgmt dr. Cut her meds back by a lot and she won’t be able to spare me any pills to sell anymore.

At this point the dude I used to get his monthly scripts from had ghosted me about a year ago now... I’ve about drained my bank account buying my own moms pills bc she thinks I’ve been “selling them”, and bc what I would get from her is such high doses of OxyCodone and OxyContin, and the shit I find on the streets doesn’t do shit for me except drain my bank account even more and got me looking desperate calling anyone and everyone I know trying to find more pills.

With how scarce its getting to find them, the costs, and the crazy ass WD’s I’ve been dealing with lately (longest I lasted cold turkey bc I couldn’t find anything was 4 days)...I finally got the courage to call a MAT facility to seek help.

They offer Suboxone and Methadone treatment. And I’m waiting for them to call me back to see if my medical covers their program... but I just don’t know how I feel about replacing one addiction with another? 

I guess I’m just looking for any positive recovery stories or recommendations or just simply support? I’m at this turning point in my life I’m 29, I’m at a great place in my career but I’m starting to fail bc these drugs have taken over my entire life.  

To anyone going thru the same or similar situation, best of luck and I wish you all well...🙏🏼",11
2020-06-18 19:22:58,https://www.reddit.com/r/REDDITORSINRECOVERY/comments/hbpekt/looking_for_books_to_read/,Looking for books to read,What is a book about recovery that has helped you?,3
2020-06-18 16:24:32,https://www.reddit.com/r/REDDITORSINRECOVERY/comments/hbm8x9/what_were_your_plans_for_the_summer_before_covid/,What were your plans for the summer before Covid and BLM?,"For one addiction dealbreaker and consequence, being a broke ass, and/or just being naturally introverted reason or another, I’ve ALWAYS spent my entire summers at home rarely venturing far or wanting to meet someone...I had much higher hopes this year. I didn’t get far enough to make plans but suffice to say plans on making plans changed. It’s interesting to think everyone in the world is experiencing summers like I only have experienced them (I know that’s a blanket statement and not true but if you comment please go along with the color of it which I believe is valid...) 

I’m also not sure where else to put this or ask. I might crosspost it...it looks like a Reddit day for me...",2
2020-06-18 15:05:27,https://www.reddit.com/r/REDDITORSINRECOVERY/comments/hbkqxm/requesting_insight_into_the_challenges_faced_by/,Requesting insight into the challenges faced by those in recovery. The information will be used to facilitate the recovery process via mobile applications.,[removed],1
2020-06-18 02:15:59,https://www.reddit.com/r/REDDITORSINRECOVERY/comments/hb929q/advice_for_quitting_xanax/,Advice for quitting Xanax.,So I’ve been taking about 0.25-0.5 almost daily for a month now. It started as a way just to curb anxiety during a stressful time but I stopped paying attention and started to get reckless. How long will my rebound or withdrawal symptoms last? Tapering beyond a few days is not really an option for me.,8
2020-06-17 17:44:46,https://www.reddit.com/r/REDDITORSINRECOVERY/comments/hb0vhu/are_your_recovery_friends_and_your_regular/,"Are your recovery friends and your ""regular"" friends completely separate groups?","That is, have your recovery friends crossed over into your ""real life""?",23
2020-06-17 00:59:56,https://www.reddit.com/r/REDDITORSINRECOVERY/comments/hakhe6/saving_keytagschips_for_your_kids/,Saving keytags/chips for your kids,"I'm coming up on 3 years clean, and have two kids under two years old.  I haven't regularly attended meetings since I had 1 year clean - although I will always appreciate what the program did for me in early recovery. 

I have been thinking lately that still collecting the black keytags every year could make for a powerful introduction when it comes time to have the conversations about drugs with my kids.  - ""I went through the depths of addiction and collected these every year so that hopefully you don't have to"" kind of thing.

Was wondering if anyone has done this, or plans to do this with their own kids?  I know it's a bit future reaching, but was just something on my mind.",13
2020-06-16 15:23:12,https://www.reddit.com/r/REDDITORSINRECOVERY/comments/haar39/new_here/,New here," Yo,  Hope everyone's is having a good time.  I am a recovering drugs addict, I started drinking at 11 and started consuming cocaine at 16. I quickly become a frequent user of the drug for many years up until I was 20 and got arrested. I soon moved away and to THE BIG CITY and decided to pursue comedy and film.  

Uphill battles are where I strive and I wanted to explore those battles with this video. When I was being a regular user ( When I would party and not realize I had a problem) I would consume 1500$ of cocaine every weekend than in recovery when I would relapse I would consume 3000$. It got worse cause in recovery when I would use I felt such guilt and displeasure it brought me to a really bad place and I wanted to stay in that place as long as I could cause I felt so bad and I knew when I came down I would have to deal with the consequences.  I added that part so no one was confused on why it would get worse in recovery. So I made this video exactly when I wanted to get high. 

I was sitting in my room and I was doing my ""COKE MATH"" and I thought about how I am doing these crazy equations in my head so that I know how much drugs I need to consume for exactly 1 day. And I thought it would be interesting to make a video about it.   So i grabbed the camera and recorded myself doing the math simplifying 1 8 ball into actual time I would spend on it and made a neat video. 

It really helped and it was a nice way to be creative so maybe if anyone needs to write or record how your brain process your addiction and watch it .It's like giving yourself a little review only you will understand. 

Sick.",2
2020-06-16 14:25:33,https://www.reddit.com/r/REDDITORSINRECOVERY/comments/ha9ltb/2_years_clean_off_meth_today_technically/,2 years clean off meth today technically,"I don’t usually keep track of my sobriety as I’ve just grown so much better and stronger from the temptations I once was addicted to, but my snap memories keep me in pace with my old life.

2 years ago today was the last time I smoked meth and later came home from Atlanta and checked myself into rehab. No one knew where I was or how I got to Atlanta from Baltimore. 
I celebrated a little early the other day (telling friends and some family) but I didn’t realize today was my actual sobriety date for meth. I’m also clean from crack, dope, and coke as well. If you’re struggling you can do this. 

I’m 22 right now. don’t let your last stop be jails, rehabs, or halfway houses. I’ll always be different from the drug use. I’ll never be that old person I was before my friends died and I lost my sanity. I work on myself and I identify my flaws and weaknesses. I’m not perfect I still make mistakes I still put myself in bad situations with bad people. 

I wish to never experience the winters in hell I went through but it’s making me the person I am today.",24
2020-06-16 13:30:34,https://www.reddit.com/r/REDDITORSINRECOVERY/comments/ha8iwq/yall_stay_positive/,Y’all stay positive,"New to the subreddit, sounds like a beginner’s meeting in the feed! Hope y’all are doing ok out there- happy to listen to whatever you’re dealing with if you need a sounding board.

I could tell you my story or give my advice but you’ve heard both already.",3
2020-06-16 12:20:42,https://www.reddit.com/r/REDDITORSINRECOVERY/comments/ha75d1/freshish_start/,fresh(ish) start!,"today i am officially out of and quitting cocaine...again lol 

my last sobriety streak was my longest (1 month) but alas i have relapsed. this time, however, i’m broke and realizing that this addiction is ruining my life; it’s not fun anymore. 

taking adderall/vyvanse to mimic the effects of coke as i detox bc i still need to be productive. not good, but not coke. 

i hope everyone has the nicest of days",3
2020-06-16 12:01:55,https://www.reddit.com/r/REDDITORSINRECOVERY/comments/ha6sk0/alcoholicaddict_with_a_few_years_cleansober/,Alcoholic/Addict with a few years clean/sober,"Just wanted to check in since I’m new to this sub. This is an especially difficult time for those who are new to sober living, so just hang in there and don’t give up! Try to find some online meetings if you can (there’s tons of zoom meetings every day) and there are even some meetings in person that are practicing social distancing.

My story is pretty common among addicts/alcoholics- started smoking weed/drinking in high school. Lots of parties and social drinking/ drug use. I always seemed to be the one who would overshoot the mark- often I would drink/take too much or find that one or two was just never enough. There was a lot of experimentation with different combinations of drugs/alcohol but mostly stuck to weed during the day and alcohol at night.

Then I tried coke and that was a game changer- it felt amazing and allowed me to drink WAY more without throwing up or passing out. That was happening a lot so I thought that I had just unlocked the secret to happiness. What I actually found was the combination that would bring me to my knees quicker than ever.

Within a year I was drinking and using every day. It was pretty fun for a while- not going to lie, but I started having so many problems. I would always justify and lie about what I was doing with friends and family. It was like I had two different faces- the public face that I would put on for the girlfriend/family/work which was outgoing, charismatic, successful, and the private face which was consumed with fear, self-doubt, self-pity, selfishness, discomfort, anxiety, and the feeling of impending doom.

Eventually the girlfriend would figure out what I was up to and leave, which was painful so I just poured more drugs/alcohol into that ever deepening pit of despair where my soul once lived. I was terrified of actually feeling my feelings and would much prefer to just be numb.

Then I would put on my happy face and try again. Get another girlfriend, and lie until she eventually left. Rinse and repeat for the next 6 years.

At this point I was starting to get physically sick and unable to function without being loaded. I couldn’t consistently show up to work/school and one by one started losing all the things until I had to move back in with my mom at the age of 27. 

This was where I hit my bottom, alone, drinking and using in my bedroom so my mom wouldn’t catch me (even though she knew- I’m pretty sure everyone knew at that point). I would wake up and not know whether the sun was going down or coming up. Everything hurt, and the drugs/alcohol just stopped working. I was at the jumping off point where I didn’t want to live and I didn’t want to die. 

I had been through rehab a couple times at this point but it was always to get someone off my back, either my girlfriend or my mom. I never actually wanted to get clean/sober and every time I would dry out for a couple months I would just pick back up where I left off. It always got worse, never better.

I thought rehab didn’t work so why bother. But now I was really desperate- I really wanted to stop but I couldn’t. I would wake up and say, “Today we are not going to drink!” And by noon I would be shaking and sweating so bad I would just give up and get loaded.

I finally broke down and told my mom everything and for the first time asked for help and really meant it. I knew that I couldn’t do this on my own- I had been trying to quit for weeks on my own and couldn’t last a single day. I checked back into the outpatient rehab center they had near my house and started going to AA/NA meetings. 

I found that with the support of other addicts and alcoholics I could stay sober for a day, then two days. Before you know it I had a week clean/sober! I felt like drinking every single day that first month and if I didn’t have my ass in a meeting or pick up my phone and call my sponsor I definitely would have drank. 

My sponsor took me through the twelve steps of AA and little by little I started to experience the miracle of recovery. Only by admitting complete defeat was I able to have the spiritual experience that it talks about at the end of the book, “Alcoholics Anonymous” I was finally free!

Some of the things that I learned along the path of recovery- 

Once you are an alcoholic or an addict, it is for life. I can never again safely take another drink without setting in motion the terrible sequence of events which will lead to my death.

As an addict/alcoholic I am physically different than my fellow man who can drink with impunity. I have a mental obsession and a physical allergy to alcohol/drugs which cause me to react differently than my fellows. When I take a drink, the allergy kicks in which renders me unable to control the amount that I drink/use. When I stop the mental obsession kicks in leading me back to the first drink which sets the whole thing in motion once again. 

To this day, there is no cure- all I have is a daily reprieve contingent on the maintenance of my spiritual condition. If I continue to do the things that my sponsor showed me early in recovery- go to meetings, pick up the phone, be of service to others, make amends quickly, take inventory regularly, pray/meditate regularly, and be willing to help out the fellow alcoholic/addict who is still suffering- then I have a pretty good shot at staying sober today.

Today I am living the life that I always dreamed of- I can look at myself in the mirror and smile. I have a great relationship with my family, and my girlfriend (who is also in recovery). My friends are mostly other sober members of AA and we do lots of fun things together- camp outs, potlucks, birthday parties, dances, golfing, and even SCUBA diving! 

I hope this helped somebody who is out there struggling. There are many resources available to you if you need help. My outpatient rehab was covered by my medical insurance and AA/NA is free to those who want it. 

TL, DR: My life was a train wreck, now it’s not! Sobriety date: January 25, 2015",57
2020-06-16 11:10:27,https://www.reddit.com/r/REDDITORSINRECOVERY/comments/ha5tux/a_brother_of_an_addict_seeing_your_advice/,A brother of an addict seeing your advice,"This is all so new to my family I don't know where the right place is to post this so please let me know if I should reach out somewhere else...

**Intro:** My sister has been using (mainly heroin) for the past 9-12 months which started after meeting/connecting with an addict who was a rebound relationship following the conclusion of a painful divorce. She has never had supportive men in her life and has left one destructive relationship to the next. Prior to all of this she has never had (to our knowledge) past experiences with drug use and always said she never understood how/why people used.

**The Discovery:** She lives/lived in Florida and our family first found out about the drug use in October after my mother went down to visit based on suspicions of things feeling ""off"" when they communicated. We then discovered she dug herself into a deep hole of debt and was borrowing/begging/stealing to keep her ""high"" alive. She agreed to come up to North Carolina where we have family living to help her detox and take steps towards recovery. Through her ""detox"" and ""recovery"" while she was back in North Carolina with us she claimed the entire time that she didn't have a problem with drugs and ""only did them occasionally as a social activity with friends"" and insisted that she was done using. She started seeing a therapist while she was here and seemed to be making forward progress with ""normalizing"" but I could tell she had no intentions of staying here. She would frequently mention missing Florida and ""the feel of home"" it gave her.

**The Relapse:** A job opportunity from a past work relationship was presented to her and that gave her the out to leave and head back down to Florida. Against all of our advice she left and began work down there. Communication with her while she was there always felt superficial but she would tell us how good she was doing and how well everything was going. Flash forward a few months later she came back to visit us for Memorial Day but didn't quite seem herself. We learned her addict boyfriend had gotten arrested ""borrowing her car"" without telling her and she found out through friends he was going around telling others the only reason he was with her was that she was his ""cash cow"". She was angry, disgusted, and was adamant that she has ""no interest in being with someone like that"". We were cautiously optimistic but two weeks later my mother got a call from her at 1am to pick her up in Florida because she had been to the hospital from painful hand and foot pain after using. She was hysterically crying and told us she had been using since she went back down and that she didn't want to feel like this anymore, didn't want to have to worry about how she was going to get her next meal, or find a place to sleep. We all got in the car, went down to Florida, and took her back to North Carolina to stay with my mom (who is also a nurse).

**Today:** We had hoped this past experience was her ""bottom"" but after a recent visit I'm not sure it was. She talks about her experiences living with drug dealers, being homeless, using, the ins and outs of drug use, etc. freely. All the music she listens to is about using or drugs and she's now talking to the addict boyfriend again after swearing him off a few weeks ago.

She has been back with us for just over a week and I don't know what to do to get her the help she needs. Our family doesn't have much money and she currently doesn't have insurance. My father thinks inpatient rehab, my mother thinks we cant afford it, and I'm in the middle trying to broker communications. We have no experience dealing with this and the last thing I want is for us to make decisions that we think are best for her without knowing what that truly is.

If nothing is done I am sure she will try to leave again and use.

**Summary**: The above only covers the surface of everything thats been going on. If you have any advice or can share experiences I would be eternally grateful. I'm scared but hopeful if the right steps are taken can help her get to a point of recovery.",3
2020-06-16 07:00:41,https://www.reddit.com/r/REDDITORSINRECOVERY/comments/ha1sr5/hi_everyone_anyone_fancy_an_online_cocaine/,Hi everyone anyone fancy an online Cocaine Anonymous meeting right now?,[https://us02web.zoom.us/j/476082343?pwd=dzNRLzk0YThqZnNJU1VWTU43VEtBUT09](https://us02web.zoom.us/j/476082343?pwd=dzNRLzk0YThqZnNJU1VWTU43VEtBUT09),7
2020-06-16 04:23:15,https://www.reddit.com/r/REDDITORSINRECOVERY/comments/h9zsxu/tomorrow_is_day_1_clean/,Tomorrow is day 1 clean..,"In 9 hours I will be checking into detox.  I’m sitting here in a hotel with a friend.  Thinking to myself the end is here. My mind and body are exhausted.  I’ve barely slept since Thursday and it’s definitely taking its toll.  I’m really nervous about what lies ahead. However,  there is a huge sense of relief that the end of this relapse is near. 

Better things are ahead!",35
