Date,URL,Title,Body,Score,COVID-19 Mentions,Sentiment
2021-03-16 21:06:01,https://www.reddit.com/r/quittingkratom/comments/m6od8x/dont_forget_to_keep_hydrating/,Don’t forget to keep hydrating!,"You can do this. CT is a bitch but I have faith that all of you have the strength to get through it. If anyone ever needs to talk, my inbox is open. Keep drinking water/Gatorade/anything without caffeine or alcohol. And eat some cheese or sugar if you are feeling particularly bad. You can do this.",11,{},"{'label': 'POSITIVE', 'score': 0.9943477511405945}"
2021-03-16 21:00:07,https://www.reddit.com/r/quittingkratom/comments/m6o8t8/weight_loss_or_weight_gain/,Weight Loss Or Weight Gain?,Did any of you lose or gain weight while quitting? I’ve got into the habit of taking kratom on an empty stomach and then eating once I start too feel effects too make it more intense I found out years ago that a fatty meal will  potentiate opiates and I remember ready a study done that proved that too be so but I would prefer too lose weight and think quitting might help but it’s also going too be hard too eat at all knowing I’m expecting the effects of kratom and then not getting them lol,6,{},"{'label': 'NEGATIVE', 'score': 0.9974677562713623}"
2021-03-16 20:32:23,https://www.reddit.com/r/quittingkratom/comments/m6nprm/i_am_struggling_help/,I am struggling! Help!!,I used to inject heroin had been clean for 3 years and started taking kratom to get a legal high. I take like 3 big teaspoons first thing in the morning. I don’t have the will power to tapper myself. Any other suggestions other then rehab?,3,{},"{'label': 'NEGATIVE', 'score': 0.9987117052078247}"
2021-03-16 20:29:33,https://www.reddit.com/r/quittingkratom/comments/m6nnqr/day_27_ct_anxiety/,Day 27 CT Anxiety,I’m on day 27 CT and I noticed I’ve been feeling super anxious lately. I barely even want to step outside but luckily I went for a run today. Does anyone know how to ease the anxiety? Would CBD help?,2,{},"{'label': 'NEGATIVE', 'score': 0.9987055063247681}"
2021-03-16 20:15:30,https://www.reddit.com/r/quittingkratom/comments/m6ne4g/day_1/,Day 1,"Well the day is almost over, no kratom whatsoever, in the mornings its the hardest just feel like dying...nerve pain, body aches,shivers,mornings is when I would always dose so waking up this morning and simply not doing it...was horrible but I didn't touch it, I got my pipe of weed smoked a couple puffs, took a pinch of cbd delta 8 and fell asleep....horror stories I hear about day2 im scared...but it is what it is...not turning back now...trying to stay strong my anxiety came back tonight, im drinking a shot of vodka in low calorie no caffeine drink im relaxed thank god...I hope its not bad to drink alcohol please let me know if it is...because as of now its the only thing that helps me sleep and calms me...until.i wake up to horror..any advice thanks and God bless 🙏",8,{},"{'label': 'NEGATIVE', 'score': 0.9926889538764954}"
2021-03-16 20:13:46,https://www.reddit.com/r/quittingkratom/comments/m6ncy7/gf_and_i_want_to_change_our_diet_as_we_taper_and/,GF and I want to change our diet as we taper and could use some advice.,"The main 3 problems Kratom have caused my girlfriend, that she’s very insecure about (and is the main reason she wants to get off) is heavy weight loss, hair thinning, and possibly acne. 

The problem we both have with Kratom is lack of motivation to eat well. We skip meals often due to appetite suppression. I’ve lost some weight for sure, but not as bad as she has, and I want to find her a quick way to gain a lot of weight because she’s very insecure about it and honestly reaching a breaking point. Does anyone have advice on how to completely overhaul your diet?",3,{},"{'label': 'NEGATIVE', 'score': 0.9987119436264038}"
2021-03-16 20:02:01,https://www.reddit.com/r/quittingkratom/comments/m6n4lb/super_tough_day_but_sticking_to_it/,Super tough day but sticking to it...,Panic attacks suck.,4,{},"{'label': 'NEGATIVE', 'score': 0.9780457019805908}"
2021-03-16 19:07:51,https://www.reddit.com/r/quittingkratom/comments/m6m1ae/3rd_day_of_a_very_fast_taper_running_out/,3rd day of a very fast taper (running out),"So ive done kratom off and on for a few years. I usually buy a bag of about 500 grams and at the end taper and take a month off then buy another. The pandemic kinda screwed that up meaning i buy a new bag before the old one is done. Tapering and the jump off have typically been easy. So this last bag i was like eh ill take it heavy until it's gone. Well Sunday i was like whoa the bag is almost done. I was forced to taper with very little left. Anxiety went extremely high the past few days. Night sweats. Depressed, annoyed, not motivated, or hungry. Now I get it, withdrawal from this is not good. I was consuming 30-35 gpd at the end. I had about 3 yesterday and 2 today. Maybe i have 2 left. I felt so bad the past few days and my girlfriend noticed and thought it was her. So i told her. She was glad I told her. She's the best. Im hoping tomorrow is a bit better, it's real hard to get work done. Reading these posts really help so figured i would write one. Cheers.",2,{'pandemic': 1},"{'label': 'NEGATIVE', 'score': 0.9992771744728088}"
2021-03-16 18:18:32,https://www.reddit.com/r/quittingkratom/comments/m6l0b1/welp_i_fucked_up/,Welp I fucked up,"Started taking kratom a couple months ago as a replacement for my out of control drinking. Been working great so far but ran out on Saturday and wanted to take a break. Got the chills Sunday night and have felt like shit since. Got tested for covid, negative. So I start thinking it’s the fucking kratom. Yup, went and bought more today and now I magically feel better. Goddamnit I should’ve fucking dosed properly. Any advice on tapering off this? I can’t waste away a couple weeks feeling like shit, especially since my midterms are this week. Please helpppp",3,{'covid': 1},"{'label': 'NEGATIVE', 'score': 0.9936954379081726}"
2021-03-16 17:39:41,https://www.reddit.com/r/quittingkratom/comments/m6k5wp/quit_kratom_few_days_ago_wife_told_me_to_leave/,Quit kratom few days ago. Wife told me to leave today. I fucked up by lying to her. Wds suck but have to think it gets better I hope.,,16,{},"{'label': 'NEGATIVE', 'score': 0.9984210729598999}"
2021-03-16 16:59:05,https://www.reddit.com/r/quittingkratom/comments/m6j91x/for_those_of_you_struggling/,For those of you struggling,"Exercise  


I'm not an active person. I absolutely hate getting off my lazy ass and doing simple chores or getting into a sweat. I really don't enjoy the act of exercising either, but let me tell you, its by far the single best thing during any stage of the withdrawal process.  
I can't stress enough how big of a difference this will make. Doesn't have to be anything serious for awhile, just take a 15 minute walk and you'll start seeing results.  
Good luck everybody.",71,{},"{'label': 'POSITIVE', 'score': 0.9965708255767822}"
2021-03-16 15:18:48,https://www.reddit.com/r/quittingkratom/comments/m6gz1q/how_do_you_deal_with_pain/,How do you deal with pain?,"So coming off kratom make me hurt.... not just withdrawal but nerve pain.... originally I was on pain killers because I have a chronic spine condition called Arachnoiditis...
The kratom absolutely helped with the pain... now that I'm quitting the pain that I originally started pain meds for is back with a vengeance...absolute burning nerve pain...how do you all deal with the pain that you started opiates to help?  I have low dose naltrexone and that's supposed to help with pain...but can't start to see if its gonna work until I'm off all opiates....thats where I'm at...",2,{},"{'label': 'NEGATIVE', 'score': 0.9913952946662903}"
2021-03-16 14:57:44,https://www.reddit.com/r/quittingkratom/comments/m6ggvx/cumulative_sleep_deprivation/,Cumulative Sleep Deprivation,"Tell me if any of you can relate to this. It's the same cycle I follow every time I detox kratom or any kind of opioid. 

You get to a point where your physical symptoms are maybe 25% of what they were at the start. Around the end of the first 7 days, you're feeling optimistic. Still shitty, but you're pepped up because you can start to feel yourself really healing. One struggle however persists, fucking sleep! Sometime around the second week, you hit a massive wall. You're constantly exhausted. The 2 hours of sleep a night has finally caught up with you. You feel just as bad as day one. 

This is incredibly frustrating. I am ready to exit the roller coaster, I am ready to move on with my life. It is exceedingly difficult to stay productive like this. Weekend was fantastic, yesterday wasn't great, but not all that bad, today seems about 15% worse. It's the lack of sleep. I know it. 

This is a shot in the dark, I think I've heard em' all, but do you guys have any unconventional methods of helping RLS?",7,{},"{'label': 'NEGATIVE', 'score': 0.9974507689476013}"
2021-03-16 14:41:05,https://www.reddit.com/r/quittingkratom/comments/m6g2z7/im_new_here_disillusioned_and_just_bought_a_scale/,I'm new here. Disillusioned and just bought a scale.,"Hi all. I'm so glad I found this sub. I've been on kratom since 2013, and advocated for that shit. I still don't think it should become illegal. Fuck the war on drugs. I have chronic pain, depression, and anxiety. I got pretty fucked up on pills, and when I got off those, I became an alcoholic. Kratom changed all that for me and I'm grateful. I even spent a good 4 years off antidepressants. But I've been extremely unmotivated and just generally down for a few years now. I've also struggled with my weight. I became very underweight, and just recently managed to get up to 100 lbs (still underweight for me but better). About a year ago I got back on lexapro but as my dose raised, I had scary neurological symptoms. Incapacitating tremors, possibly some kind of seizure. I'd had at least 2 seizures before, one before kratom, one after. I always attributed them to SSRIs but now I'm not so sure about the later one, and my recent tremors. Tomorrow I start Effexor instead and I'm terrified. I also have hair loss but that runs in my family so I'm not sure if it has anything to do with kratom. Anyway, I just bought a scale because I was just using a tablespoon. About 1.5 tbsp a dose, several times a day. I'm going to have to try some kind of taper because I'm in college (at 41!) and have a couple teenagers to keep my eye on. Since I have very little self control, my mom is going to hold onto my big bag for me and give me little bits at a time. Oh, I'm also trying to get off Klonopin 1-2mg a day, but I probably ought to hold off on that... If I can keep getting it. Not sure where I'm going with this but I just wanted to introduce myself and say thank you for the wealth of information. I really hope fucking with my serotonin so much doesn't kill me. I just want to feel alive again. Also scared I'll end up back on pills. Grr.",8,{},"{'label': 'NEGATIVE', 'score': 0.9929624199867249}"
2021-03-16 14:32:25,https://www.reddit.com/r/quittingkratom/comments/m6fvsm/wellbutrin_sorta_just_made_me_forget_that_kratom/,Wellbutrin sorta just made me forget that Kratom exists by accident...,"Okay so right up front, I *had* no intentions of quitting Kratom. It was too valuable of a tool for me for managing my chronic back pain. I broke my spine at 17 by falling off of a ladder and I've been dealing with the after affects of that ever since (I'm 30 now). I was up to anywhere between 15-30gpd depending on how bad my muscles were locked up on a given day.

However the isolation of lockdown was starting to get to me, and I have a history of major depressive episodes, and I was starting to feel it come back in ways that was genuinely impairing my ability to drive, work, etc. So I got back on an antidepressant that's helped me before: Wellbutrin. Well I've been on it for 2 weeks now and I just now realized: I haven't thought about Kratom once in the last 72 hours at least. I haven't even had so much as a runny nose. This is very strange. I suppose I'll keep it up as long as I can manage, and I'm just gonna throw this out into the ether: if you've had trouble quitting cold turkey consider asking a doctor about trying Wellbutrin (I personally take 300mg/day). I went from being a daily kratom user for the last 4-5 years with absolutely no intention of quitting, to forgetting that kratom exists entirely by accident. **Not a suggestion you should consider if you or your family have a history of epilepsy**, and your mileage may vary, but it's just a crazy experience I had that I wanted to throw out there for anyone who finds they are out of ideas.

Also it seems like this would be an interesting thing to study in people. Anyone else have similar experiences?",3,{'lockdown': 1},"{'label': 'NEGATIVE', 'score': 0.99886155128479}"
2021-03-16 14:25:31,https://www.reddit.com/r/quittingkratom/comments/m6fq69/1_12_weeks_into_tapering_by_accident/,1 1/2 weeks into tapering by accident!,So I've posted here before regarding my addiction. I have been addicted to 7-8 tablespoons of kratom a day for almost 3 years now. But as of right now I'm down to 3-4 tablespoons a day. I know it's still an absurd amount but the fact I've within 2 weeks dropped that low is really surprising to me. I take dose and smoke a little bit of weed. I find this help prolong or even trick my brain into thinking I'm taking a higher dose. But this may be a placebo but it's helping me! I'm looking into other supplements such as vitamin's to help with withdrawal pain. I got a long way ahead of me but I'm growing more confident. I just have to find a way to continue lowering doses and remaining as pain free as possible. I'm wondering how long it takes for my body and brain to get use to the lower doses. Thanks for you time of you read this!,3,{},"{'label': 'POSITIVE', 'score': 0.9707117080688477}"
2021-03-16 14:24:48,https://www.reddit.com/r/quittingkratom/comments/m6fpl1/anyone_else_have_this_during_wd/,Anyone else have this during wd,"My face drips like a faucet.... runny nose,  yawns,  and watery eyes, lots of sneezing",3,{},"{'label': 'NEGATIVE', 'score': 0.9980593323707581}"
2021-03-16 13:51:14,https://www.reddit.com/r/quittingkratom/comments/m6exv9/48hrs_off_this_shit/,48hrs off this shit...,"Got 2 hours of sleep last night, some of the worst restless body I've ever felt.  Could not sit still and sleep was laughable....todays....better but still feeling like shit.  Rls has subsided for now... anyone else get the worst part of rls at night then not as much through the day?  I see the light even though I still feel bad.... couple more days... it was nice this morning not having to choke down 30 kratom caps....I have some gabapentin for sleeping tonight...here's to a kratom free life...you can do it... you have to feel like shit...its like life makes you pay for all of that euphoria you got on kratom...everything must be in balance",11,{},"{'label': 'NEGATIVE', 'score': 0.9914675951004028}"
2021-03-16 13:00:44,https://www.reddit.com/r/quittingkratom/comments/m6dr2z/question_for_those_that_tapered_down_to_1_dose/,Question for those that tapered down to 1 dose before bed,When you cut out the dose during the day what amount were you at and when did the WD symptoms go away during the day?  I'm down to a pretty low dose (.9) during the middle of the day but I feel ultra fidgety and I start having an anxious feeling in my stomach about 2 hours before my mid day dose and 2 hours before my dose at bedtime.   I also have been taking a dose at 4AMish which helps me fall back asleep for another 1-2 hours if I'm lucky.  I know I need to cut that dose but I'm not sure how long it will take my body to adjust and quit waking up at 4am.  From what I've read some people aren't even getting 4 hours of sleep so maybe I should just be thankful I can sleep at all.,5,{},"{'label': 'NEGATIVE', 'score': 0.9987682700157166}"
2021-03-16 12:49:34,https://www.reddit.com/r/quittingkratom/comments/m6dhm2/dont_let_sleep_mess_up_your_taper/,Don't let sleep mess up your taper,"So I've gone from 2grams(w/extract) every 4 hours to .9 grams(without extract) 2-3 times per day.  Sleep has been the ongoing struggle and it has made me compromise a few times but I recently did something stupid.  I had an old bag of red ""enhanced"" blend that I bought for sleep and I decided to try using it on top of the small amount of green I had been doing on my taper.  I slept extremely well.  Like best night's sleep in ages.

So what did I do?  I starting doing this every night and guess what?  It worked the first night, sorta not really worked the second night and now I've done it 5 nights in a row with no benefit but I can tell my WD are feeling worse during the day.  Now I have to remove the red from my sleep and pay the price for being an idiot.  This has set back my taper and I was sooo close to .7 at bed and .5 when I wake up around 4am in hopes of catching another hour of sleep.  Tonight I shall try to sleep without the red at all and I'm dreading it but I knew better.  I flushed the red down the toilet so I only have my non-enhanced green left.

Moral of the story?  Don't let your lack of sleep cause you to make compromises that will set back your timeline.",9,{},"{'label': 'NEGATIVE', 'score': 0.9948523640632629}"
2021-03-16 12:36:00,https://www.reddit.com/r/quittingkratom/comments/m6d668/anyone_know_what_to_tell_their_kids/,Anyone know what to tell their kids?,"I want to quit but I couldn't go more than 1 day CT and switched to tapering bc of feeling not well enough to be a parent for my 2 kids, ages 3 & 5. I have to take my 5yo to preschool and I didn't think I could make it. Now I have been tapering and something bad is happening where I barely feel okay for an hour on my 3 doses per day and I used to take my last one before 5pm and hold out til 8am so I could get some sleep... Kratom tends to keep me awake if I take it but now I can't sleep anyway.

I also have parents very much around the kids and so they see me and know my opioid and benzo history. I honestly don't know if I can tell them I was taking kratom. They'd tell me I'm risking my ability to be a parent. Well, yes. I have a hard time explaining being sick to my own kids if I feel bad bc it's obvious fall behind.

Surely there are others who have kids make it off of kratom. How in the world does that happen or what can be done to explain my state of being? They wouldn't know what kratom is anyway but they see me hurting. Advice?",1,{},"{'label': 'NEGATIVE', 'score': 0.9975811243057251}"
2021-03-16 11:59:14,https://www.reddit.com/r/quittingkratom/comments/m6cb7i/day_11_ct/,Day 11 ct!,"Hello fellow quitters,
first of all you are very brave for quitting the green mud!
I am currently in a detox facility (history of all kinds of drugs including meth). 
Physically I am back to normal, but reality and my own situation is sometimes hard to bear.  
I will start a longterm therapy (6 months) in some weeks. I am so happy that there will definitely be no kratom during this time and hopefully after! 
Generally I feel much better than the last 4-5 months of kratom. Only the first year was good, but I realized it very late.

I just want to encourage everybody that a satisfying life without kratom is possible, if you have discipline and patience!",10,{},"{'label': 'POSITIVE', 'score': 0.9244425296783447}"
2021-03-16 11:32:20,https://www.reddit.com/r/quittingkratom/comments/m6bpkl/wierd_pains/,Wierd pains,Anyone else getting wierd stabbing nerve pains? I dont 100 percent know if theres even any correlation between the two but ive been having this wierd health issue for months and have coincidentally been taking kratom for around 4 years before the issue popped up.,4,{},"{'label': 'NEGATIVE', 'score': 0.998539924621582}"
2021-03-16 11:29:11,https://www.reddit.com/r/quittingkratom/comments/m6bn33/tapering_trouble/,Tapering Trouble,Hey all - I’ve been doing a super slow taper for the past few months. I was at 30gpd and have successfully tapered so far to 8-9gpd. It’s getting really hard to go lower though. Every time I cut back lower than 8gpd my anxiety shoots up and I end up getting real short-tempered with my kids. So then I up my dose so my kids don’t suffer. But it’s a yo-yo effect and I can’t seem to get past this taper hump. Any advice or tips?,4,{},"{'label': 'NEGATIVE', 'score': 0.9922394752502441}"
2021-03-16 11:22:24,https://www.reddit.com/r/quittingkratom/comments/m6bhrc/almost_there/,Almost there!,"Hello, first time posting. Around 2 years ago I was introduced to opiates and wasted my money away for a whole year, decided I needed to make some changes and I knew Kratom could help. I weened off the pills with the Kratom successfully. But kept doing the Kratom ever since. A month ago I decided I needed to get off of Kratom all together because it feels like it’s taking away from my life now more than enhancing it. Not as much energy, or any push to go on with the day, pretty much depressed. Anyway, I started weening off Kratom a month ago, I was taking around 70gpd and now I’m 34gpd. I’m noticing more energy, I feel more alive most days now, and I can use the restroom without almost getting a brain hemorrhage. After today, I’m switching to a strain that’s easier to digest and not as strong to help the process even more. My goal is to quit by the beginner of summer! This group has helped me a lot even though I don’t post. Reading gave me that extra push that I needed! That’s all we need in life sometimes is that extra push & support! Thanks, I’ll update in a week or so! ✌🏼",10,{},"{'label': 'NEGATIVE', 'score': 0.9955742359161377}"
2021-03-16 10:48:52,https://www.reddit.com/r/quittingkratom/comments/m6aqqx/3_days_clean/,3 Days Clean,"Finally off kratom and feeling back to normal. Sleep is kinda rough still but thank god for Agmatine, Magnesium, Gabapentin, and Seroquel!",3,{},"{'label': 'NEGATIVE', 'score': 0.5254489779472351}"
2021-03-16 10:22:32,https://www.reddit.com/r/quittingkratom/comments/m6a6f8/6_weeks_2_days_off_that_shit_what_ive_taken_from/,"6 weeks, 2 days off that shit - what ive taken from this","So i ended up needing to go to rehab. Everytime id quit kratom id end up back on alcohol then back on kratom when i stopped drinking. It was constant fucked up cycle i couldnt break on my own. I went to rehab for 30 days. What i really learn was identifying why i use. The drugs and alcohol isnt really the problem its how i deal with my problems. I had no coping skills for anxiety, confrontation or stressful situations - i only knew how to use the second i was uncomfortable. Ive been working on that shit and im feeling a lot better. Not perfect but i feel this times different.

So if u keep relapsing maybe try talking to a mental/behavioral health professional and see if it helps. Peace everyone.. praying for everyone strugglin",30,{},"{'label': 'NEGATIVE', 'score': 0.9979735016822815}"
2021-03-16 09:49:17,https://www.reddit.com/r/quittingkratom/comments/m69h3z/10_days_kratomfree_when_does_everything_stop/,10 days kratom-free - when does everything stop feeling boring and meaningless :(,"I’ve been off kratom (cold turkey) for 10 days now! Feeling pleased with myself and far more energetic than I was at the beginning, and I’m not having many noticeable physical withdrawals now except a bit of tiredness and some weird dreams. But I feel so empty and bored and like everything is meaningless. I feel like I really got to this point with kratom where nothing was really that fun without taking it. I feel like now I’m just doing things to make the time pass and nothing is actually fun or interesting. My country is in lockdown and I reckon the monotony of corona life is probably a huge part of why I became so dependent, so maybe the way I’m feeling is more to do with that than a kratom thing...but I really hoped that I’d quickly relearn to enjoy things sober if I came off it. Has anyone else felt this way? Does it go away? Or do you guys think it’s maybe not a kratom thing, and more of a circumstantial thing?",13,"{'lockdown': 1, 'rona': 1}","{'label': 'NEGATIVE', 'score': 0.9985445737838745}"
2021-03-16 09:29:26,https://www.reddit.com/r/quittingkratom/comments/m692ou/day_3_ct/,Day 3 CT,I'm on day 3 and feeling sick. Does anyone want to be an email pen pal and an accountability partner? Message me. Good luck and God bless.,7,{},"{'label': 'POSITIVE', 'score': 0.9755111932754517}"
2021-03-16 09:25:02,https://www.reddit.com/r/quittingkratom/comments/m68zq7/6_days_kratom_free_help/,6 days kratom free - help!,"Hey all! Long time lurker here 🤨 So I finally just decided I was done with this crap, I had been taking kratom, sometimes the OPMS brand capsules and a ton more of the OPMS liquid kratom extract (which was MUCH stronger in my opinion), and once i decided enough was enough, I signed up for and completed an outpatient medically assisted treatment to detox off kratom (because after trying cold turkey several times and i just couldn’t get past day 3 or 4.) I highly suggest the outpatient detox program - and i’m happy to share with anyone interested! 

Now while its all technically out of my brain/i’m opiate-free, still having trouble with sleeping (which i expected) but I keep having these hot and cold fits, and can’t at all get comfortable laying down, weird back pain snd CONSTANT sneezing...i assume thats part of the detox, anyone know how long it lasts?

And does anyone have tips on anything that will help me sleep? Thanks in advance!",8,{},"{'label': 'NEGATIVE', 'score': 0.9844093918800354}"
