Date,URL,Title,Body,Score,COVID-19 Mentions,Sentiment
2021-03-12 19:49:58,https://www.reddit.com/r/quittingkratom/comments/m3vi6t/fatigue_muscle_aches_day_37_ct/,Fatigue & Muscle Aches Day 37 CT,"Amazed at how long this withdrawal is dragging out. Anyone else experience fatigue and muscle aches at this length (Day 37)? Saw a doctor and all my bloodwork came back good. Even got a COVID antibody test which hasn't come back yet. Doctor had to research kratom, hadn't heard of it. Keep thinking kratom will become mainstream but hasn't happened yet. Although it definitely is getting close to mainstream in my opinion. Crazy thing about Denver is that mushrooms are decriminalized but kratom is illegal, maybe that says something about how serious of a drug k can be.  Anyone reading this thinking of using kratom for the first time, do not think this substance is ok to use everyday (or for some people at all). Alcohol, weed, and kratom are all drugs that if used everyday become a problem that you are oftentimes entirely blind to. I actually probably wouldn't even put kratom on the same level as alcohol, but the place where kratom truly caused problems for me was socially. Performed great in some areas of life (career,fitness), but kratom seemed to make me content with not getting out there socially and perhaps even romantically (have a GF but feel unsatisfied) . Even talking to people off kratom I'm nowhere near as awkward its hard to explain. Things just flow better. I think Kratom dulls your instincts and emotions in a way thats hard to quantify, it takes your edge off that usually gives you that extra oomph in life. This is esp true for users such as myself who would redose throughout the day, its almost certainly better to take 10g in the morning as opposed to 2.5 at 9, 2.5 at 1, 2.5 at 5, 2.5 at 9. With the redoses you brain doesnt have sober time and the WD is maybe more intense based off what I've heard/read. Even with the fatigue and muscle aches, its so satisfying feeling emotions again. Even anger and sadness, such important emotions for our growth. Good luck to everyone on this journey and congrats for realizing how insidious Kratom can be.",8,{'covid': 1},"{'label': 'NEGATIVE', 'score': 0.9850687384605408}"
2021-03-12 19:26:55,https://www.reddit.com/r/quittingkratom/comments/m3v3us/going_into_detox_for_the_first_time_ct_off_of/,Going into Detox for the first time CT off of 65GPD-100GPD-Nervous-Has anyone gone to detox for Kratom?,"Hey, I have finally built up the courage to post on here after months of just reading posts. 

I have been a heavy kratom user for almost 3 years using at least 65GPD sometimes even 100GPD.  I cannot go more than an hour or 2 without either thinking about or taking another dose.  I started this sh\*t thinking it was safe, wow I was wrong.  I am losing my hair, my skin is pale, I don't sleep more than 2 hours at a time which is driving me crazy, 

I have tried to quit this horrible green sh\*t before without success.  I have tried your taper guide but found it hard to stick to.   So I have made the decision to do a medical detox at a private rehab.  I am extremely nervous, I am wondering if anyone has some insight on what to expect and possibly any advice on how to mentally prepare for this? 

Thank you in advance for any help :)",18,{},"{'label': 'NEGATIVE', 'score': 0.9981836676597595}"
2021-03-12 18:58:57,https://www.reddit.com/r/quittingkratom/comments/m3ulkc/microdosing/,Microdosing,"Idk what the stance is here, in this situation, but has anyone else micro dosed to curb withdrawals? By microdosing, I mean literally like, dipping a finger in your bag, and sucking the dusting of K off of it. Sounds gross, tastes gross, but seems like it works. Was worried it would extend withdrawal time, but seems like it’s a small enough dose to just calm that clawing hunger down. Personally I don’t worry about # of days clean. If something helps my brain recognize it doesn’t need or want the K anymore, that’s all I’m concerned about.",2,{},"{'label': 'POSITIVE', 'score': 0.6216112971305847}"
2021-03-12 18:55:47,https://www.reddit.com/r/quittingkratom/comments/m3ujo1/are_dpla_results_immediate/,Are DPLA results immediate,"Seems like there is not much info on how long it takes DPLA to inhibit endorphin degrading enzymes...one poster said endorphin levels were increased 300 percent after a single dose but that's all I've found. He also claimed it was increased for 6 days, something I found hard to believe for a single dose.  Anybody's experience using this supplement to ease wd symptoms would be appreciated.  Also anyone notice prolonged relief after exercise, orgasm ect after taking this supplement?",3,{},"{'label': 'NEGATIVE', 'score': 0.9972237348556519}"
2021-03-12 14:57:49,https://www.reddit.com/r/quittingkratom/comments/m3ppfo/few_months_off_of_it_proud_of_you_guys/,Few months off of it. Proud of you guys.,"I just want to say my life was a mess a few months ago. It was a gradual process that I couldnt ignore anymore. Kratom had become an issue. Caused me to withdrawl from my friends and family. Was not good for me. I started a slow taper and man it was scary but when It was over with, the days following were so underwhelming! It was so much easier quitting without the withdrawls. I recommend optimizing your nutrition to make it even easier.

&#x200B;

# Anyway, I really hope you guys are holding up well. This shit is hard to stop, but just remember this is an investment that you'll forever value as one of the best decisions of your life. I am so grateful I made this decision and I can't begin to imagine what would have happened to me if I continued. I'm so much happier now and I promise you will be too!",12,{},"{'label': 'POSITIVE', 'score': 0.9670588374137878}"
2021-03-12 14:29:16,https://www.reddit.com/r/quittingkratom/comments/m3p3ez/dont_forget_to_hydrate/,Don’t forget to hydrate,"I’ve been told these reminders are annoying, but far more people have told me they help them, so hydration reminders are back. 

And I believe in every single one of you. You can do this. We’re here for you. 

Today is 50 days for me. I’m so proud of myself. And I’m proud of all of you, whether it’s 5 hours, 5 days, 5 weeks, 5 months, or 5 years. We’ve worked so hard for this and I know how hard it’s been, but the other side is so much better. Much love.",61,{},"{'label': 'POSITIVE', 'score': 0.9997826218605042}"
2021-03-12 14:14:50,https://www.reddit.com/r/quittingkratom/comments/m3osgw/withdrawals/,Withdrawals,Has anyone tried to supplement Kratom withdrawals with Opiates?,3,{},"{'label': 'NEGATIVE', 'score': 0.9996248483657837}"
2021-03-12 14:02:26,https://www.reddit.com/r/quittingkratom/comments/m3oiry/so_im_on_my_35th_day_and_i_am_so_so_tired/,So i'm on my 35th day and i am so so tired!,"(Disclaimer!)

"" I am experiencing this sleep debt hell, but this is quite understably not always the case for everyone quitting Kratom, so i hope this won't deterre you away from quitting, so don't worry about this, my case is not very common after the first week of quitting, i am just undoubtedly cursed by the insomnia gods! lol. ""

So three weeks before i quit kratom, i spent awake for 24 hours after everytime i wake up, so 24 one day and the 24 hours the next, so i stayed up for 24 like 10 times before i quit kratom and then when i did quit, my sleep schedule was back ok track except now, i sleep the whole night, but i don't get any REM sleep or deep sleep and for 35 days, discluding the 10 executive days of staying up for 24 hours so i could change my sleep patten, i only got REM and deep sleep like only 4 times in this 35 days sober.
I am tired, i litterly forgot what its like to actually think and enjoy things, and i haven't even had a chance to experience the sobering benafits of quitting Kratom, i litterly feel like i haven't quit kratom.
I have OCD and intrusive thoughts and depression and axiety and PTSD and all of those things are 10x worse because of my impeccable sleep debt.
This is so frustrating! 
I'm scared to take sleeping pills and i thought about smoking weed before bed, but i wouldn't feel comfortable being high and falling asleep, i have a rare condition where i start dreaming before i fall asleep, and i would say that is the culprit, but last night i didn't dream while dozing off.",5,{},"{'label': 'NEGATIVE', 'score': 0.9959114789962769}"
2021-03-12 12:27:30,https://www.reddit.com/r/quittingkratom/comments/m3mgvl/tapering_kratom_liquid_extract_shots/,Tapering kratom liquid extract shots,"Im up to 6 shots a day and this is not financially sustainable. 

What would be the best way to taper liquid shots?

I quit ct last time, but I wasnt working at the time, so I have to taper this time. 

Can you make pretty big cuts initially? Any advice would help.",7,{},"{'label': 'NEGATIVE', 'score': 0.9996052384376526}"
2021-03-12 12:18:56,https://www.reddit.com/r/quittingkratom/comments/m3ma68/65_days_into_ct_30_gpd/,"6,5 days into ct 30 gpd","Wow, this day has been special. All physical wds have vanished. Around noon I noticed my head clearing up and I felt really blissful in one second, than melancholy, than lonely. My emotions are hitting me hard right now. I‘ve read on here often, that kratom numbs you out really bad and I can definitely confirm. I kinda feel reincarnated right now. I wanna talk with friends on a late sommer sunset and laugh etc.. 
What I do really affects my emotions, that didn’t happen during the 2 years on kratom. 
I don’t wanna be alone right now, but I am alone in a hospital bed with no roommates. :(
Has anyone else experienced these intense emotions?",17,{},"{'label': 'POSITIVE', 'score': 0.9593172669410706}"
2021-03-12 11:53:27,https://www.reddit.com/r/quittingkratom/comments/m3lptx/having_some_epiphanies_kava_kratom_and_getting_off/,Having some epiphanies... Kava + kratom and getting off...,"There was a season last year from like March-December where I was taking 1.5g kava extract OR MORE with 7-9g of kratom 3 times per day and my tolerance was SKY HIGH. I could NOT feel kratom no matter the dose without the kava. I think it potentiates it more than anything else I have found to make it where I was more realistically taking 60+gpd. 

Anyways, I was waking up at 4am crazy sweaty with this empty feeling in my chest and finding it hard to breathe UNTIL I took my combo at 7am or earlier... I decided that I needed to cut the kava and proceeded to do so last December. I had 3-5 days where I was in WD no matter how much kratom I took and I was taking probably 30gpd or so in 3-4 doses. 

Over the last few months I've been taking 8g 3x per day and still having inderdose WD. For whatever reason I KEPT TAKING it thinking it was just something I was going to take forever since it was better than drinking and other things blah blah blah all of those excuses you make! 

Now here I am nearly 3 days clean from any kratom and am feeling my old self returning. Noticing the sunset, how beautiful it is outside, finding JOY working in the yard etc. It struck me that now that I'm off WHY IN THE WORLD did I continue the cycle of abuse to myself. Literally dulling me down to nothing making me worthless and not motivated to do anything! I realize now that all I had to do is get through a few days of acutes after a fast taper (using support supplements) and then my LIFE would start to come back. I was literally dealing with interdose WD on a daily basis ANYWAYS! All I can say - and I'm sure I'm not alone in this - that WHY DIDN'T I DO THIS SOONER!",26,{},"{'label': 'NEGATIVE', 'score': 0.9959840774536133}"
2021-03-12 11:17:45,https://www.reddit.com/r/quittingkratom/comments/m3kyc4/day_15_ct_1030gpd_daily_2yrs_feeling_flat/,Day 15 CT (10-30gpd daily 2yrs) feeling FLAT,"The first 10 days of Wd's i had the ""pink cloud effect"" get me through them. Even tho i was withdrawing... the novelty of just feeling emotions again was at least something to look forward to. Now i just feel FLAT. Can't seem to sleep longer than 6 hours of broken sleep a night. This is what ya'll were talking about isn't it? The psychological aspect of cravings is what i'm struggling with the most right now. When i was using it was these moments of feeling exactly like this that i had a dose to look forward to....but we all know where that road leads....straight back to anxiety, anger, discontent, numbness, and the all the other BS that comes we being tethered to a drug. Motivation is non existent. I keep reminding myself this is a marathon and part of the process of recovery. Thanks to everyone on here sharing their stories....it's the one thing that doesn't fail to get my priorities back into perspective. Right here with ya on the path to getting our lives back. Anyone ever needs to chat just swing me a comment or message. All the best",19,{},"{'label': 'NEGATIVE', 'score': 0.5203025341033936}"
2021-03-12 11:05:11,https://www.reddit.com/r/quittingkratom/comments/m3koa4/2_daily_reduction_feels_too_much_for_a_taper/,.2 daily reduction feels too much for a taper... anyone else experience this?,"I’m currently lowering each of my 4 daily doses by .05 every day, so taking .20 gram less a day for the past week.  Every day I feel WORSE than before, as in I DEFINITELY feel withdrawal from cutting just that amount out.  I was using around 16 grams a day and cut down to 12 a day and experienced little to no withdrawal.  It’s going from 11 to 10.8, to 10.6 and 10.4 that I’m starting to feel worse every day.  I really don’t want to have to stay at a dose for a week, then cut .20 every week but it feels like this is the only way.

It’s really awful, I’ve been laying in bed every night in a full blown panic attack thinking of all the mistakes I’ve made in my life, waking up in complete physical pain and brain dog unable to function.  Really bad!  It’s crazy.  I’m pretty certain a rapid taper I did a few years ago wasn’t this difficult, I went from 20 grams to 0 in 5 days and only experienced three days of extreme discomfort then was fine.  Maybe it’s not even worth doing this really slow taper.",3,{},"{'label': 'NEGATIVE', 'score': 0.9992393255233765}"
2021-03-12 09:18:31,https://www.reddit.com/r/quittingkratom/comments/m3igya/anxiety/,Anxiety,"I’ve been tapering my kratom use recently and ran into a little issue.  

Now, when it wears off I get incredibly anxious.  It’s a physiological response - not a mental one.  I get a feeling of impending doom that makes me want to jump out of a window just to stop it.   It reminds me of the anxiety from benzo/alcohol w/d.  It feels exactly the same.   

I haven’t experienced this up until now - this is a new and by far the worst w/d symptom I’ve ever had.  

Is this normal?  I’ve been dependent on kratom for months and up until now could almost skip entire days without too much discomfort.",11,{},"{'label': 'NEGATIVE', 'score': 0.9987198114395142}"
2021-03-12 09:03:56,https://www.reddit.com/r/quittingkratom/comments/m3i6n1/15_days_in/,15 days in...,"My back pain is dissapating, sleep is regular, joints are no longer achey, lungs and sinuses have began to clear up. Digestive system is still not right but that may be caffeine doing some of that. The thing I am so grateful for is not to be having those CRAZY dreams anymore. The dreams were day ruining sometimes. Glad that is gone. Kick ass everyone. I mainly posted this to let people in week one know where I am just 8 days after.",32,{},"{'label': 'NEGATIVE', 'score': 0.9934020638465881}"
2021-03-12 08:52:32,https://www.reddit.com/r/quittingkratom/comments/m3hysh/benzos_for_sleep/,Benzos for sleep,"So kratom is losing any effect it had on me and there’s really no benefit to keep taking it. However my brain still wants it. My withdrawals aren’t severe thank god but the biggest problem is sleep. I have Xanax and just want to take it at bedtime
But for how many days before I start having rebound off that? Like 3 or 4? Thanks guys and gals!",1,{},"{'label': 'NEGATIVE', 'score': 0.9869857430458069}"
2021-03-12 06:40:26,https://www.reddit.com/r/quittingkratom/comments/m3ftk8/little_slip_up/,Little slip up,"I am at 76 days clean from kratom!!! But I drank waaaay too much alcohol over this past weekend, pretty sure I had alcohol poisoning.. so any how on Tuesday I still felt like absolute shit and the gas station by my work sells those extract shots that rhyme with ziza ven and I thought “fuck it, I’ll buy one just to help the day at work go by and give myself some energy and relief from the crippling hangover. I only drank half, Which it worked, I was no longer hungover, I was happy, and even played basketball on lunch with some coworkers. BUT the next couple of days were WEIRD. I’m sure it was still my body recovering from alcohol, but I def felt my body withdrawing and tellin me YO NO MORE OF THAT KRAP! The withdrawal symptoms weren’t that bad cuz I already knew what to expect and I’m in a better head space but it was wild to see how 1 (or really a half) single extract shot could make my body go into immediate withdrawal again. I couldn’t sleep for two days and my emotions were super wack and I had negative thoughts just looping in my mind. But I knew why I felt that way and just let it go. I got a good night sleep last night and got up early today to get exercise and eat a good breakfast and meditate to get myself back on track. I’m not resetting my counter because I told myself 1, and I have no urge or craving after that 1. If anything it reminded me how toxic that shit is and no wonder I started using it daily. Stay strong my friends, things do get better, but you goda change your behavior and give your body the nutrients and nourishment it needs! 

PS: When I quit 76 days ago, the first things I did that helped curb withdrawals like RLS and insomnia and just feeling depressed was EXERCISING TILL I SWEAT(I’d always tell myself it was punishment for what I’d done to my body) and a good daily routine of VITAMINS AND EATING FRUITS VEG AND CLEAN MEAT. If anybody would like my stack of vitamins message me and I will show you.",3,{},"{'label': 'NEGATIVE', 'score': 0.9971377849578857}"
2021-03-12 02:24:50,https://www.reddit.com/r/quittingkratom/comments/m3chyj/day_6_off_kratom_insane_insomnia/,Day 6 off kratom. Insane insomnia!!!?,"Hola mi amigos! I’m on day 6 of quitting and I seem to be through the worst of the withdrawal symptoms, except for the insomnia. I’ve gotten maybe 6 hours of sleep total since I quit CT, none of which was any more than an hour or 2 tops at a time. Usually just chunks of 20 or 30 minutes. I’ve found that when I get in bed and turn out the lights my body feels like it’s trying to jump out of itself. I’m very squirmy and can’t get comfortable. I feel like when my brain has nothing to focus on then there’s this uncontrollable need to move my limbs. Sleep is virtually impossible and I really feel like I’d be in fantastic shape if I could get even just a solid 6 hours. So ultimately I’m wondering if there’s any kind of common timeline for how long this inability to sleep will last and what anyone out there might’ve found to combat it. Thanks friends!",22,{},"{'label': 'NEGATIVE', 'score': 0.9964016675949097}"
2021-03-12 02:00:11,https://www.reddit.com/r/quittingkratom/comments/m3c5z8/daily_checkin_thread_march_12_2021/,"Daily Check-in Thread - March 12, 2021","Welcome to the quittingkratom daily check-in thread. Feel free to post as many updates as you´d like. Visit our reddit Chat Room with 1000+ people, you find the link to the Chat Room in the sidebar. If you have mobile internet you need the official Reddit app. Please help to moderate this subreddit. Reporting rule-breaking or worrisome content is highly encouraged (there is a report button below every posting and comment). Reports are anonymous, we won't be able to see who reported what. If you see someone breaking the rules, spamming, giving bad advice or anything else - don't hesitate to press the report button.",8,{},"{'label': 'NEGATIVE', 'score': 0.9955843091011047}"
2021-03-12 01:44:10,https://www.reddit.com/r/quittingkratom/comments/m3bxz6/im_feeling_so_good/,I‘m feeling so good,"I quit kratom two weeks ago and I feel so much better. I‘ve got so much more energy - it‘s unbelievable. I have felt feelings that I totally forgot even existed. I can get up in the morning without any problems. I go to work without having to think ‚Fuck, when can I get my next dose’. Please do yourself a favour and try to get off kratom! It will bring back your life. 

If you have problems with withdrawals, try phenibut and go for tapering. Withdrawals were pretty mild for me. It was my second attempt, and the first time I got back to kratom, but now I don‘t think I will ever get back to it again. Maybe I will take it once in a while but I don‘t want fall back to my old habit.",4,{},"{'label': 'POSITIVE', 'score': 0.99613356590271}"
2021-03-11 23:05:51,https://www.reddit.com/r/quittingkratom/comments/m399et/scalp_tenderness_hair_loss/,Scalp tenderness? Hair loss?,I quit krarom and am on day 7 CT. Since I quit my scalp is SOOOO TENDER. my hair is half the thickness it used to be. Now my bf is currently massaging my scalp to get the blood flow going. It hurts. I read that kratom stops blood flow to your scalp stopping it from reaching hair follicles. Anyone else notice this? He legit can not pull my hair because ita so tender.,5,{},"{'label': 'NEGATIVE', 'score': 0.9689745306968689}"
2021-03-11 21:59:48,https://www.reddit.com/r/quittingkratom/comments/m37zs7/one_week_cold_turkey/,One week cold turkey,"After taking 1200 mg of extract per day for the past 6 months, I went cold turkey 8 days ago. First couple days sucked, no energy, no appetite, no sleep and plenty of diarrhea. 8 days later I’m feeling much better. I attribute it to a high fiber organic diet, heading to the gym after day 3 every day. (Even though I had no desire to do so) I’m so glad to be where I’m at today. I wouldn’t say my energy is great, but I’m not really sure I have a good base to really compare to at this point. The whole point of this post is to offer some help to those that want to get off the green sludge. For those that can manage I would highly suggest taking Thursday and Friday off of work to give yourself as much time off work. Although I also highly suggest you do your best to get active ASAP, as this will hasten the process and offer relief sooner. Good luck to all and thank you to those who have come before me and offered their advice.",10,{},"{'label': 'NEGATIVE', 'score': 0.9876987934112549}"
2021-03-11 21:36:05,https://www.reddit.com/r/quittingkratom/comments/m37jmt/16_hours_ct_not_doing_well_but_hanging_on/,16 hours Ct not doing well but hanging on,"A slew of emotions have hit me like a bad sunburn
My addiction to kratom started over 6 years ago. But it never got out of control / daily usage until 3 years ago after losing my brother to an accident
I found not only did the kratom ease my physical pain , but it shut off my emotional responses to the mental pain
Well about a week ago I got sick , an for 3 days i laid on the couch , took 3x my normal amount of kratom to feel better. An come 3 days later i couldn't sleep before work
I realized it was no longer working for me mentally. The body high continued , but my mind was racing
As i type this the RLS which is more my upper body is going into full effect an it's quite unbearable. The depression set in days ago , all the pain of my brother's death finally weighing on me. Im new to this forum but reading all your posts has helped me. Helped me see I need , absolutely need to quit. I typically take 3 to 4 gs plus .25 gs of extremely potent extract in the morning plus double that at night to relax. In between I go all day at work without. I know my routine is rather weak / small compared to others but the withdrawls so far seem almost as bad.  
It's a challenge , I think I might have to go the taper route
Regardless taking it hasn't been fully working for days. Just holds off the physical symptoms
Any suggestions , words of encouragement would be appreciated",3,{},"{'label': 'NEGATIVE', 'score': 0.9932050704956055}"
2021-03-11 21:14:33,https://www.reddit.com/r/quittingkratom/comments/m374kx/day_15_appetite_is_back_full_force/,Day 15 Appetite Is Back Full Force,I thought my appetite came back around day 7 but boy was I wrong. It definitely improved from the severe stages of withdrawal but I’m on day 18 and I’ve been eating nonstop for the past 3 days. At the moment I don’t care what I eat I’m just content with satisfying my food craving. That being said I just scarfed down a Bacon King and a 10 piece from Burger King and have one more Burger waiting on the kitchen counter. Thought I’d put that out there for anyone wondering about suppressed appetite from withdrawal. Hang in there.,5,{},"{'label': 'NEGATIVE', 'score': 0.9043555855751038}"
2021-03-11 20:42:42,https://www.reddit.com/r/quittingkratom/comments/m36gy7/day_141/,Day 141,Rough week mentally at work but the end is near. It’s crazy how high stress situations can still send our brain into escapism mode and the thought of using. It’s nefarious to say the least and vigilance is a must. Every day clean is another day stronger though. Much love. 🙏,4,{},"{'label': 'POSITIVE', 'score': 0.9871915578842163}"
