Date,URL,Title,Body,Score,COVID-19 Mentions,Sentiment
2021-03-30 23:18:33,https://www.reddit.com/r/quittingkratom/comments/mgwz34/12dpd_for_two_months/,12dpd for two months,"Hello a have been taking 12gpd (4g three times a day) last two months. Now it is my third day of cold turkey and i feel stomach problems, insomnia, headaches, sleeping problem, restless legs and anxiety. Has anybody experience how long could this last? I underevaluated the risk of kratom and thought that 12gps is too low to suffer from this negative pws.

thank you",5,{},"{'label': 'NEGATIVE', 'score': 0.9982718229293823}"
2021-03-30 22:48:35,https://www.reddit.com/r/quittingkratom/comments/mgwgn7/feeling_great/,Feeling great!,10 days clean I celebrated by hitting a fat ass workout! The endorphins are even better than the opiates and kratom the endorphins from exercise are awesome it's like magic. One day at a time you can do this quitting kratom is a possibility and assurity,20,{},"{'label': 'POSITIVE', 'score': 0.9988442659378052}"
2021-03-30 22:46:00,https://www.reddit.com/r/quittingkratom/comments/mgwf1a/wish_id_have_quit_kratom_sooner/,Wish I’d have quit kratom sooner.,My brain is absolute trash. Even 34 days off of kratom. I can’t even perform my normal basic job without having all this anxiety and negative self talk convincing myself I must suck at my job or I’m terrible at everything just because I can’t keep up. God I hope I can eventually just perform at normal level again. Serving tables isn’t even hard and I’ve managed to do it for 11 years without any anxiety or anything. Now it feels like I’m worse than my first year of serving tables..... hopefully I’ll feel better eventually. Pretty low right now and wish I would’ve followed through with one of my earlier quits or tapers so I wouldn’t have completely ruined things.,26,{},"{'label': 'NEGATIVE', 'score': 0.9996469020843506}"
2021-03-30 22:37:31,https://www.reddit.com/r/quittingkratom/comments/mgw9ro/day_35craving_alcohol_like_an_mf_i_have_never/,Day 35...craving alcohol like an MF! I have never even liked Alcohol!!,Wow!!! Kratom withdrawal is definitely an odd process!!! I hate alcohol normally yet here I am craving it and craving it!! Anyone else experienced this?,11,{},"{'label': 'NEGATIVE', 'score': 0.9881426692008972}"
2021-03-30 21:38:55,https://www.reddit.com/r/quittingkratom/comments/mgv7zm/heres_the_plan/,Here’s the plan,"I came on here last week to tell my story and talk about the plan to quit. I went for a cold Turkey two times last week, and for whatever reason it was so difficult mentally this time. 

I don’t know what the problem was, being that I was tremendously successful in the past until I relapsed. The cravings seemed stronger, the migraine seemed worse, and the ever present feeling of doom felt utterly dominant. I made it two days, used for two, and then made it to day three on the second quit attempt of the week, and it was absolutely nuts how bad I felt, and I caved again.

The difference was, this time it wasn’t immediate relief and “I know this will suck later, but for now it’s okay”. I felt crushed, dull, insanely depressed. I whimpered in the shower, I felt doom, while under the influence of k.

I broke down to my friend. She helped me tremendously quit the first time, and I feel that this time was exceedingly difficult because I had only me to rely on. I thought I could handle it, I couldn’t. I am lucky and eternally grateful that she was so understanding and motivating, even though she herself has never been here. 

I came up with a new formulated plan. I’m gonna do a very aggressive taper, which will mean just one dose a day (right before bedtime) to sleep. The absolute worst symptom for me these last quits was the insomnia. Never ending nights.

I can make it through the shitty days, though they will suck, because people keep me going and I am lucky to have a 12 hour job throughout the week on an alternating schedule. On days off, I will make it a point to exercise as much as possible, and just get to bedtime. 

I’ll start at a 6.6 gram dose, and drop a capsule every 3-5 days, with the help of black seed oil and a few other supplements. I plan to keep this tapering schedule up until May 3, where I go on a work exercise for two weeks. When I go there, I will jump. It might suck (albeit hopefully not as bad due to the taper), but I figure there will be no way for me to purchase any while up there, and I’ll have some of my best friends up there with me to keep me going. That’s the plan. 

What do you guys think? Let me know if you think this is too aggressive, reckless, or what.

Thanks",1,{},"{'label': 'NEGATIVE', 'score': 0.9952470660209656}"
2021-03-30 20:38:12,https://www.reddit.com/r/quittingkratom/comments/mgu4u2/day_2_taper/,Day 2 Taper,"Hey guys. I'm on day 2 of tapering, but i have so little left that Im considering just flushing it and going CT. I'm mentally ready.. but the anxiety of w/d is what keeps me clinging to the last bit I have. Can't decide what I should do. It gives me anxiety to still have it and be on it, but it gives me anxiety thinking about flushing it too. Any advice? I work noc shift and work tonight. Should I continue to taper what I have left? Or should I just go CT and say fuck it? Im so done with this shit. I'm 22/F and my hair is falling out. Not to mention I haven't been able to gain weight since I started this crap. Just currently having a mental crisis/battle Lol.",4,{},"{'label': 'NEGATIVE', 'score': 0.9994059801101685}"
2021-03-30 19:42:21,https://www.reddit.com/r/quittingkratom/comments/mgt477/sleep/,Sleep,How long did it take you guys before you were able to get some sleep? My job is very intense and going a week without sleep might be dangerous for me. I want today to be the day I start quitting but I started taking kratom for RLS so I know it's going to be super bad as I'm already predisposed to it. I can handle the mental side of things easy its just the RLS that scares the hell out of me.,6,{},"{'label': 'NEGATIVE', 'score': 0.9937052130699158}"
2021-03-30 18:40:35,https://www.reddit.com/r/quittingkratom/comments/mgry19/it_gets_easierevery_day_it_gets_a_little/,It gets easier…Every day it gets a little easier…But you gotta do it every day — that’s the hard part. But it does get easier.,Quote from Jogging Baboon from the tv show bojack horseman,33,{},"{'label': 'NEGATIVE', 'score': 0.9541623592376709}"
2021-03-30 18:39:25,https://www.reddit.com/r/quittingkratom/comments/mgrx8u/how_does_kratom_withdrawal_compare_to_benzo_ghb/,How does Kratom withdrawal compare to benzo / ghb/ alcohol withdrawal?,I've never experienced an opiate or kratom withdrawal so I wouldn't know how to compare the experiences. Any info on how a kratom withdrawal would differ from say a benzo withdrawal?,1,{},"{'label': 'NEGATIVE', 'score': 0.9989446997642517}"
2021-03-30 18:25:19,https://www.reddit.com/r/quittingkratom/comments/mgrndt/kratom_toilet/,Kratom -> toilet,"Just flushed the last of kratom. Taking the jump today

Been taking kratom for the last 3 months. Lately iv been taking ~12 caps per day (7.5g). Note that I did have an oxy addiction about 6 months ago before I started taking kratom.

What should I expect in terms of wds? I am hoping that I am jumping off early enough so it won't be that bad. 

I'd like to hear your experiences! How bad was it for you? How bad will it be for me? Any tips / tricks?",2,{},"{'label': 'NEGATIVE', 'score': 0.998539924621582}"
2021-03-30 18:09:50,https://www.reddit.com/r/quittingkratom/comments/mgrbws/has_anyone_quit_kratom_due_to_hair_loss/,Has anyone quit kratom due to hair loss?,Just wondering since I’ve started to experience some hair loss/thinning recently and am starting to think it could be the kratom.,8,{},"{'label': 'NEGATIVE', 'score': 0.9987661838531494}"
2021-03-30 16:52:42,https://www.reddit.com/r/quittingkratom/comments/mgpqfm/small_changes_to_shift/,Small changes to shift,"Wrote down every dose and how I felt 90 min later
Switched to capsules 
My best friend bought me a pill organizer 
Acquired a taste for energy drinks when I am craving
Bought a kettle bell, those days feel much better
“I want to feel better” in place of :
“I need to quit. There no point, no one will know. Fuck it.”",1,{},"{'label': 'NEGATIVE', 'score': 0.9980893731117249}"
2021-03-30 16:25:07,https://www.reddit.com/r/quittingkratom/comments/mgp580/is_anybody_else_falling_asleep_at_work/,IS ANYBODY else falling ASLEEP AT WORK?!,"Hello all, I am so tired. I’ve been tapering I dropped from 14g to 11 3 days ago and I’m sitting here at work so.damn.tired. And unmotivated to do anything. I literally can’t stop yawning and want to take the rest of the day off, but I can’t do that unfortunately lol. I’m just so bleh. My body is like “where is the damn kratom we are freaking out!” And I’m just so tired and unmotivated I am the definition of a sloth right now. It’s been 3 days since dropping my taper and they are more spread out too, I’m not dosing literally every hour on the hour like I used to. I have to wait 3 hours each time and it’s really hard. Does it every get better? 😓

Edit to add* I started out around 25g",5,{},"{'label': 'NEGATIVE', 'score': 0.9991803765296936}"
2021-03-30 15:53:36,https://www.reddit.com/r/quittingkratom/comments/mgofyu/relapse/,Relapse,"I relapsed after four months off the gunk.

I am really not beating myself up for it though. The relapse served a purpose and I learned how to identify some new triggers. 

I do have a question though. I take naltrexone in the beginning to help me out and get some sober time. I used for about two weeks so I actually have two questions:

Do I still need to wait the recommended 7-10 days to take naltrexone even though my relapse was shorter? I don’t want to cause myself unnecessary pain by causing precipitated withdrawal symptoms. Especially since I haven’t used long enough to have too many complications.

Second, are there any supplements that can get this crap out of my system faster? I exercise frequently, drink tons of water, and take agmatine. Is there anything else that wouldn’t just a waste of money?

Thanks for your help! I’m sure I can search for a lot of this stuff, but it helps me to connect with people especially after a relapse.",5,{},"{'label': 'POSITIVE', 'score': 0.9871755242347717}"
2021-03-30 13:47:59,https://www.reddit.com/r/quittingkratom/comments/mgloyw/day_twelve_ct/,Day twelve ct,"So today is day twelve with no extracts and no suboxone. I quit both at the same time. As you can probably imagine, it was...pure hell. I'm to the point where I can function somewhat, but nowhere close to normal yet. Had to put my best friend to sleep at the vet yesterday out of nowhere. One of the worst days of my life. I'm focusing on the positives though. I might wake up in mild withdrawal everyday, but that is still better than waking up addicted to two opioids.  If I didn't go back to that shit after yesterday, I'm never going back! I am a steely eyed missile man aimed at the future. Someone in a previous post said that and it was oddly very helpful. I was feeling anything but strong but I thought about it and I am a steely eyed missile man! So are all of you. Find your inner Clint Eastwood. Strength friends.",10,{},"{'label': 'NEGATIVE', 'score': 0.5438931584358215}"
2021-03-30 13:45:19,https://www.reddit.com/r/quittingkratom/comments/mglmx0/day_20_physically_look_better/,Day 20 PHYSICALLY LOOK BETTER!,"Today is 20 days off of a 80g max almost 4 year habit. Anyone who's been using for a long time and at higher doses you need to read this

Kratom changes the way you look. After being off 20 days I've just now realized this. I literally looked in the mirror and had to take a second glance. I'm not an attractive man by any means, but holy crap this kratom has taken me to the dumps! My hair isn't growing back yet, but it's changing texture. It's softer. My skin is less oily, acne filled, shiny, dry, greasy. The dark spots on my face are slowly starting to fade. My face is less puffy/swollen (possibly from hypothyroid) There are less cracks in my skin. Even my eyes have changed. I didn't realize how dead they looked taking so much kratom. They where so grey dry and lifeless. Now they have a shine to them. When I read posts about people saying they didn't recognize themselves in the mirror I thought they where just exaggerating. I think it's because kratom changes the way you look soooo slowly you just think your aging normally or something. I started taking it at 16 years old, used for about 4 years, and probably aged 10. I swear I went from a baby face 16 year old to a walking dead zombie in 4 years! Just 20 days off and can already see myself coming back.

BTW I still look sickly. I know it will take a while to get back to normal. But If you want something to look forward too after quitting add this to the list. You WILL look and feel better. ",31,{},"{'label': 'NEGATIVE', 'score': 0.9980161190032959}"
2021-03-30 13:32:25,https://www.reddit.com/r/quittingkratom/comments/mglcys/my_story/,My story,"I feel like I have nothing to pull me out of this place. My self esteem Is trash. I have no interests or hobbies that ever last. I have so much pain from a lot of childhood trama. I've tried so hard (have I?)I'm tired or trying. now I have to try to get off of this shit. My boyfriend is so supportive. He wants me off of it. I don't trust myself off of it. I am an emotional mess. My psychiatrist labeled me drug resistant. My therapist is nice but it's all just so hard. I can't even talk to her without taking k first. I'm tired of everything being so hard. I don't know what I'm expecting saying this here, rambling. 

I'm 22F I dropped out of college because of my depression and anxiety (maybe I could do it now that I'm on k HAHA). A year ago I started k. Before that I was always looking for stuff to get high off of. My whole family is full of addicts. I give myself credit. I've never taken anything as hard as them (or have I? Isn't it all the same I'm on a high horse). I have been able to move in with my boyfriend. We share an apartment and I work a shitty customer service job that leads no where. I have never found inspiration or motivation. My sense of self was never able to form and life keeps moving despite all my shit.

I finally took time off to quit this stuff. I made it to day 5 and everything was coming back to me. I was crying constantly. My boyfriend was so supportive. He went out to dinner with my brother and I relapsed. I don't understand how I'll be able to stop. I want to but I don't believe in my ability to. I have bills to pay. I can't take more time off . I fucked up. I don't know what to do. I was told to get a new doctor but I've tried so many anti depressants nothing has worked. I'm afraid my addict mind is talking. Should I get a hobby before I stop so I at least have something? Am I just making excuses? Help",15,{},"{'label': 'NEGATIVE', 'score': 0.9964936375617981}"
2021-03-30 13:17:16,https://www.reddit.com/r/quittingkratom/comments/mgl0q4/just_try/,Just try.,"9+ months off kratom and no desire to go back... EVER! (I was a 25-30gpd user for over 3 years. Tapered for 7 weeks and jumped at 3gpd.) 

Whether you're tapering, or in the thick of acute withdrawals, or experiencing PAWS or even struggling to quit and stay quit, I just want to let you know that **it is possible to quit kratom and to stay quit**. Try, with all your might, to **stay positive**. Try, with every fiber of your being, to **stay as busy / active as positive**. Where the body goes, the mind will follow. Try, even though you may feel like you have nothing to offer and can barely help yourself, to **help someone else today**. Simply holding a door open for someone or telling a loved-one that you love them could make a world of difference in their day and yours. And finally, try to **believe that you WILL get through this** without using again. I believe in you and so do many, many others on this subreddit. And if you slip and fall, as Greg Doucette says, ""**Try harder than last time!**"" You'll be amazed how strong you are... how strong WE are.


Don't forget to give the sidebar materials a read, especially the [READ THIS FIRST if you're new](https://old.reddit.com/r/quittingkratom/comments/7p0qx2/read_this_first_if_youre_new/) guide.",93,{},"{'label': 'POSITIVE', 'score': 0.9024209380149841}"
2021-03-30 13:10:45,https://www.reddit.com/r/quittingkratom/comments/mgkvcp/filling_the_void_and_moving_on/,Filling The Void and Moving On,"21 days off. 

""Nature abhors a vacuum"", a very relatable quote for addicts. It's what I have to tell myself when I quit a substance. Your body will seek equilibrium, don't try to cheat misery. Little distractions here and there can be necessary, we've all got a breaking point. Sitting on the other side of this detox, my real demons are making themselves known again, as they are wont to do. 

Kratom kept me embarrassingly complacent. I was playing this old MMO I rediscovered like it was my job. This is only a minor exaggeration. Now I can't play it for more than about 5 minutes without going, ""meh"". Lots of time has freed up and idle hands will betray me. I had a few drinks last night. Nothing crazy, just a few of those miniature shots you can buy at the liquor store. Problem being, it was a wonderful night! New episode of my favorite podcast came out, laughed so hard I thought I was going to pass out, made myself a great dinner, not a single negative emotion the whole time, slept better than usual. 

There's that positive reinforcement. Alcohol has never been my drug of choice, but I've had issues with it in the past. My last go-around with booze was in fact precipitated by self-medicating kratom w/d. Now, what lead to me drinking last night? I'm 90% better compared to day 1 CT. This isn't even about detox, I'm just fucking bored. I gave my father access to my bank account so he can see what I'm purchasing. If I pull out cash from an ATM I have to show him receipts of what I bought. A useful suggestion for some of you that want to be kept honest. Eh, any minute now I'm going to get an upset text or a phone call. Sort of forgot I'd given him that info, that's why I felt comfortable doing what I did. Alcohol wasn't on my mind for tonight, but now it definitely isn't. 

I can only occupy myself with so many errands, my sober friends are all just acquaintances, my close friends are all still in active addiction.  I'm very happy that the physical withdrawals have subsided, but my big mistake has always been thinking that was the hard part. Today I'm going to buy some new running shoes and see how out of shape I am. I'm getting my vaccine at some point soon, maybe I can take a fucking class or volunteer or something. Suggestions welcome. What are you guys going to replace kratom with?",15,{'vaccine': 1},"{'label': 'NEGATIVE', 'score': 0.9973472356796265}"
2021-03-30 12:22:24,/r/RecreationalKratom/comments/mgjidl/help_very_much_needed/,Help very much needed,,1,{},"{'label': 'POSITIVE', 'score': 0.6838973760604858}"
2021-03-30 12:09:50,https://www.reddit.com/r/quittingkratom/comments/mgjif2/13_days_off_a_crazy_amount_of_kratom/,13 Days Off a crazy amount of Kratom 65-100GPD-Completed a Medical Detox,"Hey! So I am making this post in hopes may help those who may still be struggling to get off this sh*t.  I was an extremely heavy kratom user, got up to 100GPD for almost 3 years.  

I was terrified to go through the withdrawals without help and I am happy I did.  The first 1-5 days were hell but by day 6 I felt better.  Still freezing and hot all the time but I do feel better emotionally and psychologically.  The anxiety is still there but that's the whole reason why I used it. 

I will be completely honest the medical help I got was a lifesaver.  I was prescribed clonidine and gabapentin without these 2 medications I wouldn't have been able to get through.
The clonidine helped with both the hot flashes and cold sweats like crazy to the point of almost not even feeling them.  The withdrawal was bearable and I actually slept through the night 3 which felt awesome.  

I am still going through some PAWS.  All the emotions that I was suppressing with the Kratom has come back 1000x.  My anxiety is through the roof but I am finding exercising has helped tremendously.

I want to thank everyone on this sub-reddit without you to be honest I would still be lost. :)

If anyone wants to talk send me a message I am more than happy to help!",16,{},"{'label': 'POSITIVE', 'score': 0.9792696833610535}"
2021-03-30 11:47:23,https://www.reddit.com/r/quittingkratom/comments/mgiza3/1_year_clean_tomorrow/,1 year clean tomorrow!!!!,"I'm coming up on a year clean tomorrow. These last two weeks I've notice EXTREME irritability, if someone looks at me wrong I flip my lid. Has anyone else had any experience with this? Especially those who are longtime quitters? Any insight would help, although it's been a year I still battle occasional depression and mini manic episodes and depersonalization but they are improving.

Thanks guys.",29,{},"{'label': 'POSITIVE', 'score': 0.9941909909248352}"
2021-03-30 11:37:52,https://www.reddit.com/r/quittingkratom/comments/mgirsk/trouble/,Trouble,"Just need a little support today. I’m coming up on day 11 by the end of the day, but I am really struggling. I took 50mg of naltrexone on Saturday afternoon and it sent me into hellish withdrawals that have lasted up until today. Even though my physical symptoms are virtually gone, the crippling, brain burning, anxiety has returned. I try to meditate but only make it about 25 minutes. I feel like I’m going down a wild river, barely holding on to a wooden log, catching enough air to last me the amount of time I will spend sucked under the rapids. It’s truly moment to moment. On top of that I’ve missed 7 days of work and they’re asking me to have my doctor document I’ve been under care, but I haven’t seen one. I have an appointment with a doctor tomorrow morning - maybe they can help me. They were recommended as someone sympathetic to the disease. I’m sure I’ll bawl my eyes out. I get teary eyed just thinking about it and funny enough some of the few moments I feel relaxed and at ease are after I’ve cried. I haven’t been able to cry in a long time. It’s strange to be joyful at your own discomfort, but this disease is full of contradictions. Godspeed everyone - you’re not alone out there in this, not by a mile.

Love,

          Norman",6,{},"{'label': 'POSITIVE', 'score': 0.5554537177085876}"
2021-03-30 11:19:00,https://www.reddit.com/r/quittingkratom/comments/mgid8k/shilajit_for_paws_and_possibly_acute_wds/,Shilajit for PAWS!! and possibly acute WDs,"Hi all! Just wanted to share something that has been helping me out a lot with PAWS. I just recently got through the acutes but still have been feeling brain fog, fatigue, and some depression. Decided to get some Shilajit. In the past this has been one of the most impact full supplements I’ve taken. Since taking it all my symptoms have vastly improved.

I think one of the main reasons is opiates suppress the HPA axis which results in fatigue. Shilajit does an amazing job at restoring the HPA axis. Also Shilajit has 80 trace minerals and as most of you know kratom depletes you’re body of minerals and nutrients. Along with trace minerals it contains fulvic acid and amino acids. All in all it will help your body rebalance and heal! I don’t know for certain but I’d imagine Kratom reduces testosterone based on the lack of sex drive. Shilajit does an amazing job at boosting testosterone. 

One thing to note is quality matters! If you are gonna get some don’t skimp on the quality. You want Shilajit that is legit and properly filtered and extracted. I’m not sure if I can share brands on here or not but PM me and I’ll let you know what i use or if someone confirms I can I’ll add the brand I use. I’ve used it in the past and I’m very impressed with the quality. Hope this helps!!",13,{},"{'label': 'POSITIVE', 'score': 0.997871994972229}"
2021-03-30 10:39:24,https://www.reddit.com/r/quittingkratom/comments/mghiud/try_kombucha_nac_agmatine/,"Try Kombucha, NAC, Agmatine","Three great things I think people should use among other things to help recover from kratom withdrawl. Kombucha to regrow your stomach flora, NAC to remove heavy metals kratom can have, and Agmatine to lessen the kratom withdrawl effects.",0,{},"{'label': 'NEGATIVE', 'score': 0.9985432624816895}"
