Date,URL,Title,Body,Score,COVID-19 Mentions,Sentiment
2021-03-09 07:08:15,https://www.reddit.com/r/quittingkratom/comments/m1538d/addict_purgatory/,Addict Purgatory,"Good morning quitters. May we all enjoy another day free from that vile weed. I’m at 65 days CT. I think I reported 64 on the progress thread but it’s actually 65. I’m happy to report that I’m free from all of the shitty parts of withdrawal. I wouldn’t say I’m perfectly normal but the truth is, I’m not sure sure I could ever say that. There comes a time at the tail end of your quit where you have to wonder how much of this is w/d or just real life. I think it may be easily confused.

The only thing I’ve noticed now is that I keep having cravings to get fucked up. One of those “just once” things. No real interest in doing Kratom, because it’s bullshit, but something that just feels good. The problem is, there’s nothing out there that will give me that feeling. My system is so clean now, even a blast of thc would handicap me from functioning the way I need to. Blow would make me paranoid and dope would make me sick. The most reasonable substance would be “just one beer” this morning. Ha! Ok. I’d be hammered drunk by noon. 

No, the best thing is to stay the course. Cravings come and go, but my addictive behavior is forever. Just can’t feed that fucking weasel.",28,{},"{'label': 'NEGATIVE', 'score': 0.9830290675163269}"
2021-03-09 05:56:13,https://www.reddit.com/r/quittingkratom/comments/m142tv/just_poured_the_rest_of_my_bags_in_to_the_trash/,Just poured the rest of my bags in to the trash,Haven't really got an addiction going yet but I've felt like it's creeping up lately. Dumped it all after the last dose made me nauseous as all hell and I fully realized this shit sucks,53,{},"{'label': 'NEGATIVE', 'score': 0.9988657236099243}"
2021-03-09 02:00:16,https://www.reddit.com/r/quittingkratom/comments/m111e0/daily_checkin_thread_march_09_2021/,"Daily Check-in Thread - March 09, 2021","Welcome to the quittingkratom daily check-in thread. Feel free to post as many updates as you´d like. Visit our reddit Chat Room with 1000+ people, you find the link to the Chat Room in the sidebar. If you have mobile internet you need the official Reddit app. Please help to moderate this subreddit. Reporting rule-breaking or worrisome content is highly encouraged (there is a report button below every posting and comment). Reports are anonymous, we won't be able to see who reported what. If you see someone breaking the rules, spamming, giving bad advice or anything else - don't hesitate to press the report button.",8,{},"{'label': 'NEGATIVE', 'score': 0.995733916759491}"
2021-03-08 23:12:26,https://www.reddit.com/r/quittingkratom/comments/m0yg9d/endured_day_12/,Endured day 12,Just finishing day 12 and I am crippled with depression and self-resentment. I knew this was coming but I guess part of me maybe thought it wouldn’t be so bad. I couldn’t even make it through a 5 hour shift without throwing a huge fit and being angry about NOTHING. Now I’m at home really sad and just going to end my day. Hopefully tomorrow will be better.,13,{},"{'label': 'NEGATIVE', 'score': 0.9977545142173767}"
2021-03-08 23:00:32,https://www.reddit.com/r/quittingkratom/comments/m0y8ug/failed_day_1_ct_will_try_again_tomorrow/,Failed day 1 CT will try again tomorrow.,"I am a weak person. I do not say that for sympathy. I’ve never been able to follow through with anything in my entire life. I will try again tomorrow, it is all I can do. I hope this doesn’t cost me my job or my relationship but it has to end one way or the other. Tired of being a slave to a plastic water bottle full of baby shit green foul tasting disgusting slime that is making me slowly lose my humanity more everyday. Sorry for the run on sentence. 

Laying in bed rn. Focused on how scared I am of withdrawals and just in general how afraid I am of the future(job, money, relationship etc.) one thing is clear.. in the long run this will be good. Time to pay back all those times I used Kratom to numb out a bad day. I’m gonna feel all those feelings I skipped out on all at once soon I’m afraid. I probably will fail and I’m just being honest. I’m not trying to sound pitiful or get anyone to feel bad for me. I just have no one to talk to and can’t afford therapy. Just had to get it out. I am laying in bed consumed by worry and fear.

If I can make it to pay day, no Kratom, I am buying the big lego Star Wars AT-AT walker and idc if my friends call me a fag for building it or if my gf makes fun of me. I hope that the withdrawals don’t take the happiness out of that. 
Anyways. If you read through this garbage, thanks. Just wanted to get it out. 
-Chris",9,{},"{'label': 'NEGATIVE', 'score': 0.9931579232215881}"
2021-03-08 22:57:44,https://www.reddit.com/r/quittingkratom/comments/m0y70d/my_story_with_kratom/,My Story with Kratom,"My story with Kratom begins with my most recent surgery last year. I've had 10 kidney stone surgeries in my lifetime. From probably around 21-22 years old I've had 1-2 surgeries per year because of those damn things. Around my 8th or 9th surgery I got pretty addicted to pain medication because the doctor irresponsibly dispensed hundreds to me, pretty much at will. The withdrawal was excruciating. 

So, given that experience I was wary about getting back on pain medication after this last surgery, among other reasons. I have an addictive personality, primarily with opiates. I believe it runs in my family given my dad was addicted to Oxycodone throughout my childhood, as well as my mom, although heroin was her drug of choice. My mom eventually died from Heroin overdose in 2016. My sister was also addicted to heroin for many years. She is finally clean. For some reason, opiates just have some sort of grasp on us, and given my anecdotal experiences it seems to be a genetic one. Fortunately I've never tried heroin, and my only opiate addiction experience was with pain pills dispensed by my doctor due to kidney stone surgeries. 

Now, onto Kratom. After this last surgery I opted not to take pain medication and researched alternative options. This is how I discovered Kratom. So I found a local head shop that sold it, drove down and purchased a 90 count bottle of bumble bee premium kratom. I read that I needed to take 6 to feel the effects, so I did. Within 30 minutes the pain was gone and I felt great. Aside from the easement of pain, I felt mentally alert and overall just happy. As the weeks progressed 6 pills daily turned to 8, which turned to 16, which turned to 30 and so on. 1 year later, I found myself taking almost a full 90 count bottle within 1 or 2 days. I started buying larger bottles and packages, and gradually running through them just as fast, simply to chase the feeling I got from that very 1st dose. After some time I no longer needed them for pain, I just enjoyed taking them to play video games. 

I never once thought that I was addicted until a few weeks ago when I realized I haven't written a single article on Medium, a joke in my notepad (I used to do open mic at a comedy club), I hadn't uploaded to my youtube channel or put any work into any single productive side hobby I once pursued since I started taking Kratom. It effectively made me a lazy piece of shit, whose only interest was taking enormous amounts of Kratom and playing video games or watching YouTube.

 I wasted a year of my life being addicted to Kratom before coming to this realization a few weeks ago. I'm currently 2 days off Kratom and the withdrawals suck, although not near as bad as the withdrawal I had from the pain pills a few years ago. I just hate these cold chills.  I've been freezing all day long despite my house being a constant 70°f. My sleeping schedule is fucked and I feel mentally slow. Hopefully this will subside soon. 

Anyway, that's my story in a nut shell. I tried to keep it short. Thanks for reading. I wish you all the best in your recovery.",16,{},"{'label': 'POSITIVE', 'score': 0.9783124923706055}"
2021-03-08 22:45:35,https://www.reddit.com/r/quittingkratom/comments/m0xzjy/5_year_daily_habit_1_month_sober/,5 Year Daily Habit - 1 Month Sober,"Just checking in!

Got a notification from my “Nomo” app (I highly recommend downloading this and using it to track your sobriety) that today marked one month free of Kratom!

I have used this sub to share, to learn, to laugh, and relate to others going through the same struggle as myself. This sub has played a key role in keeping myself accountable and at times, restoring my sanity.

This can be a lonely endeavor if you choose to just white knuckle it and go about it alone.

I was at the lowest spot in my life I had ever been at both mentally and spiritually, and in 31 days, I almost feel as if I have been reborn. 

I am not where I want to be yet, but every day I gain sober, Kratom, and the years I spent as a slave to it, feel more like a distant memory and a valuable experience to learn from.

There is limitless positives and potential available once you get out from this addiction. It’s almost like you finally awake from a long, hazy, foggy dream-like state that Kratom perpetually traps you in.

Good luck to anyone reading this in whatever stage of your recovery you are in! Tapering down, freshly quit, or the long-term quitters who check in occasionally on this sub. 

I have learned a lot especially from the latter..",22,{},"{'label': 'NEGATIVE', 'score': 0.9471681714057922}"
2021-03-08 22:14:28,https://www.reddit.com/r/quittingkratom/comments/m0xff6/14_days_ct_recap/,14 days CT recap,"Damn, 14 days really flew by. I feel like just yesterday I was dealing with acutes and checking this sub every hour. Can't believe I haven't taken kratom in 14 days. Everyday is better than the last. I'd say days 2-4 were the worst, but not too hard. Very anxious, and it was hard to sleep. That's it. Then everyday just gets better and better.  I still toss and turn a little bit before bed. RLS is still there but definitely not as intense as it was week 1. And I find myself wanting to be lazy and not push myself, but of course this is easy to deal with.   


Now on to the good stuff. I wake up after about 6 hours of sleep fully rested. No more morning sickness and walking around dizzy. I actually feel hungry again and I don't have to force myself to eat. Also my poops are incredible lol. Had a few ghost wipes which hasn't happened in years. Music sounds amazing and I'm actually playing guitar again and learning new songs. I actually get excited for things like going on a hike, restuarant, or even just going to the grocery store. I've been motivated to eat healthier. I feel like I owe it to my body for putting it through this crap for years.  


I took kratom everyday for 3 years total, but I'd say 2 years were really good. The last year I was just taking it to feel normal, didn't get high at all. If you are at that point, its time to quit. 

  
**I want to thank this sub for all the wonderful advice you guys have given me. I literally felt so lost and lonely until I found this. Thank you so much!**",16,{},"{'label': 'POSITIVE', 'score': 0.9809356927871704}"
2021-03-08 21:36:12,https://www.reddit.com/r/quittingkratom/comments/m0wqw5/does_anyone_have_any_success_stories_with_hyland/,Does anyone have any success stories with hyland restful leg ?,"So I tried this weekend and caved, unfortunately, because the RLS was just too much for me.

I can handle the depression, anxiety, mood swings and that... But when I try to sit and relax and my entire legs ache and shake just drive me up a wall and I can't take it.

I don't want to try any other substances like gaba or phenubit because those can cause a whole nother mess of problems, but I just discovered the restful legs and was wondering what kind of positive effect people have had.

God I hate the withdrawal. Not being able to sit and relax makes me go insane",1,{},"{'label': 'NEGATIVE', 'score': 0.9987014532089233}"
2021-03-08 20:05:14,https://www.reddit.com/r/quittingkratom/comments/m0v23c/is_it_worth_a_taper/,Is it worth a taper?,"I'll keep this rather short and to the point. I'm certain this has been asked before. Is it worth tapering for 6-8gpd, 3-4mo habit? Obviously I'm trying to do this with as little discomfort as possible. Thanks in advance",3,{},"{'label': 'NEGATIVE', 'score': 0.9918951392173767}"
2021-03-08 18:55:49,https://www.reddit.com/r/quittingkratom/comments/m0tq0v/unexpected_taper_update/,Unexpected taper update,"I've even lost track of the days lol, that must be a good sign. I have big news. We dropped half again of our normal taper drops bringing us down 2.1 gpd every 5 days instead of 1.4 for saturday and sunday. I thought it was going to be a nightmare, and kept waiting and waiting for the horrible withdrawals to kick in and they did not arrive :) Wasn't nearly as bad as I was expecting

Full disclosure I have been using Xanax occasionally to combat the anxiety (going to be eliminating that from my diet when I get fully off kratom), but other than that lots and lots of water and bike riding, magnesium and viatmin C. I was so surprised to not feel that much worse with a bigger drop that I decided to try my new plan to drop one of my 7 doses per day out and down to 6 doses per day, starting today, spreading the time in between doses out longer to one every 2 hours and 50 minutes instead of every 2 hours and 20 minutes. Which is a big deal for because it effectively is another taper drop and sooner than we usually do the drop.

But lately I have noticed I'm not dying for that next dose and glancing at the clock every minute around the 2 hour mark. I have been getting to my 2 hours and 20 minutes dose time and thinking ""ya know, I could probably go another half hour without a dose"" Today's the first time I actually did it! Small milestones lead to bigger ones!

Day's not over yet, and I'm not getting my hopes up too much, so jury's still out but honestly it hasn't been nearly as bad as I thought it would be. But these last few days is the most normal I have felt in months (years really), and now with today's dose skip in consideration, I'm down to 10.2 gpd from 70 gpd several long and hard months ago. And still absolutely zero desire to go back up in dose. We keep this up, I will be completely kratom free in 28 days :)",15,{},"{'label': 'NEGATIVE', 'score': 0.9350633025169373}"
2021-03-08 18:54:46,https://www.reddit.com/r/quittingkratom/comments/m0tpc8/just_started_to_taper_today_ordered_some/,"Just started to taper today, ordered some supplements to make it easier but really not sure what I'm taking, any info appreciated","I ordered some acetyl L-carnitine, agmatine, rhodiola, and valerian root. I'm struggling to find any decent info on what these really even do, dosage, or if it was even safe have taken all at once. If anyone has more details or any links I'd appreciate it.",2,{},"{'label': 'NEGATIVE', 'score': 0.9995288848876953}"
2021-03-08 18:37:47,https://www.reddit.com/r/quittingkratom/comments/m0td97/day_5_barely_any_physical_wd_but_intense/,"Day 5. Barely any physical WD, but intense rage/manic feeling.","I think I thought that the lack of physical symptoms meant I would have a cakewalk. Wrong! It's like this constant rage that I feel, I've snapped at my wife and daughter several times today. I go up to the bedroom and just scream into the pillow, and honestly feel like I could punch a wall at this point. It feels like a rage at myself for quitting. Like, how dare I deprive myself of something that was clearly so helpful and alleviated all those issues I had? I should note that I had rage issues earlier in life but the last four years they've been virtually nonexistent. 

Please tell me this is temporary. I'm literally just keeping to myself because I don't want to be an asshole to the people I love the most. Thanks 😔",8,{},"{'label': 'NEGATIVE', 'score': 0.9887955188751221}"
2021-03-08 18:35:36,https://www.reddit.com/r/quittingkratom/comments/m0tbpw/i_need_help_with_one_symptom_of_wd/,I need help with one symptom of WD,"I have been trying to quit Kratom for the past year now.  I don’t even know how much kratom I take. Usually a TBSP every 3 hours or so. I sometimes have a hard time getting a full nights rest because I’ll wake up in a pool of sweat kicking my legs and rolling over side to side unable to get comfortable until I quick dump a spoonful in my mouth and take a swig of water.  I have been numb for the past 3 years because of it. I feel it is time for real.  The biggest problem I have is what I call “the wiggles”. No matter what I do, I can’t get comfortable. It is unbearable. It is so bad I can’t do anything. I can’t think, talk, eat, or sleep.  I toss and turn and feel like my soul wants to jump out of my body.  The longest I have been able to go was about 17 hours.  Is there anything you guys know of that can mellow me out to get over that hump? I can deal with cold symptoms, depression, running nose, the chills etc... but the discomfort always makes me cave and I end up failing.  My sex drive is gone, my emotions are gone, and I don’t know who I am anymore.  It needs to stop.  I long to be passionate about something....anything again.  Please help. I was contemplating sleeping pills, cbd, and ibuprofen... but I’m afraid it won’t be enough.  Thanks",6,{},"{'label': 'NEGATIVE', 'score': 0.9993512034416199}"
2021-03-08 18:16:32,https://www.reddit.com/r/quittingkratom/comments/m0sxrf/day_75_after_a_6week_taper/,Day 75 after a 6-week taper,"Today is day 75. Acutes have passed, mood is OK, sleeping well. However, yhere is still that feeling of something missing, and I think it's all about getting used to being sober. That missing piece is further and further away each day. Also, I always hear about appetite being lower after quitting, but I've been a bottomless pit. Can't stop eating. I've put on about 8 pounds. Better than being addicted to kratom, though! When I quit, I wrote myself a list to remind myself why I'm quitting. Here are some of the reasons: difficulty or excessive urination, lactation, irregular periods, high anxiety, deep depression almost suicidal, cold sweats, chills, waking up at 3am needing to dose, acne, loss of libido, lack of confidence, regret, shaky hands. Almost all of these were reversed with quitting kratom. And to think I first took it to deal with my depression. Sigh. Good luck quitters!",14,{},"{'label': 'NEGATIVE', 'score': 0.9944490194320679}"
2021-03-08 17:56:06,https://www.reddit.com/r/quittingkratom/comments/m0silo/a_lot_of_us_struggle_with_doctors_understanding/,"A lot of us struggle with doctors understanding about helper meds, but really, there’s no need to do that.","I hope this doesn’t come off as an ad, because I swear to you it’s not lol. I wanted Gabapentin for WD and tried to get it from my psychiatrist but she wouldn’t budge on it. Then I looked online and found many services that will have a doctor call you in minutes and prescribe you helper meds. That goes for Clonidine and Gabapentin (which are the two best helper meds in the game). 


There’s really no need to haggle and plead with doctors who don’t understand. I’m sure many of you know about these services, but to those who don’t, please check it out. It’s a lifesaver. I used QuickMD for my script. Being on Gabapentin (for a week, tops), clonidine, and Wellbutrin is going to make this the most bearable CT I’ve ever done. Don’t let yourself pointlessly suffer when these helper meds are so available and helpful. 

Hope this can help someone get the meds they need. There’s no shame in taking them. WD is the kind of agony that people outside of this lifestyle could never comprehend or suffer through themselves. Don’t let the opinions of people who don’t know what it’s like dissuade you from taking helper meds. 

Peace, love, and fuck kratom ❤️

EDIT: To be clear on the process: I went on the site, wrote that I wanted Gabapentin for help with withdrawals, and within 10 minutes, a doctor called me and prescribed a month’s script. From finding the site to picking up meds it was literally an hour. It costed 75 bucks, but so goddamn worth it.",20,{},"{'label': 'POSITIVE', 'score': 0.98929762840271}"
2021-03-08 17:39:00,https://www.reddit.com/r/quittingkratom/comments/m0s64c/day_14_day_3_unassisted/,Day 14 (Day 3 unassisted),"So at the end of december I ran out, so through new years I spent 8 days only on loperimide and extremely weak poppy tea. I went from 24 pills every 3 hours (4 large bible paper parachutes), down to 6 every 3. When my bag arrived I stayed at 6 every 3 for a few weeks, then did a weak taper. I only lowered my tolerance down to 5 every 3 hours after a whole week tapering, so I got frustrated and held off on quitting until I ran out. Then I'd quit for good. That day came 2 weeks ago, now.

First off let me say my first mini kick back in december/january DID help a fuck ton. First it lowered my tolerance, but even after another month and a half of full on kratom abuse I had a lot of progress saved. When my final dose wore off on the 22nd, I found my withdrawals were shitty but nowhere near as bad as they were in January. Not even as bad as they were on the last day of my mini kick. So don't think you're losing progress if you have a slip up, every single day off kratom helps.

The first 3 days sucked ass. I found my minimum required dose of loperimide was 6 pills. I took 6 every day when I woke up for 3 days. Then when I woke up on day 4, I found I had decreased withdrawal. So I only took 4 and it worked. First day on 4 sucked nearly as bad as the first day quitting on 6, but considering the progress I made I was proud. I continued taking 4 pills every day for another 3 days, then on day 7 lowered to 2. I then got cocky and the very next day lowered down to 1 pill. I was surprised, it worked. So the next day on day 9 I lowered to half a pill. That worked, too! So the next day I tried a quarter pill. That also worked. On day 11 I tried half a quarter pill (literally something stupid like 0.25mg loperimide) and it didn't work, I couldn't sleep. So I just took a quarter pill and it worked.

So finally 3-ish days ago (My sleep schedule has migrated later), I took my last dose. I spent a whole day 100% unassisted and when it came time to sleep I slept as good as if I was on loperimide, which was to say I slept alright. I got 7 hours of sleep but woke up in minor discomfort (extremely mild restlessness, fever but no sweating no matter how hot I got) but once I was up, I felt the same as I did the day before. Definitely not worse, if anything I felt maybe 5% better. So I spent the next day sober and when it came time to go to bed I had some trouble sleeping but once I got to sleep I got 7 hours.

Now it's been 3 days completely unassisted. I haven't taken anything to assist. No magnesium, no other vitamins and no loperimide. I feel pretty damn good now. My depression today decreased, my depression hasn't been bad. It's just been a level of boredom and a lack of enthusiasm to occupy myself but today I found myself laughing at shit and even playing some games (I typically don't have the enthusiasm to game when in w/d) Right now I'd say my restless leg is at literally 0. Not even that lingering shadow of restless leg you sometimes get.

Fucking finally dude. Last time I actually followed through with a kick was when I kicked poppy tea in October, 2019 and even then I wasn't 100% sober. I got down to being able to sleep nearly unassisted but even then I'd take 1 pill of kratom a day just before bed. Now I don't need to take anything to get to sleep.

My favorite bit is not having to worry about eating food. When I was on kratom hard, I wouldn't eat except before bed so I could take high doses of kratom and have it hit in 30 to 60 minutes. The past week I've started eating frequently again. It feels odd being able to eat whenever I want again after having spent 6 months on 1 meal a day. Feels good.",9,{},"{'label': 'NEGATIVE', 'score': 0.9965401887893677}"
2021-03-08 17:17:10,https://www.reddit.com/r/quittingkratom/comments/m0rpgt/rapid_taper_in_two_weeks_and_now_at_ct_feeling_ok/,Rapid taper in two weeks and now at CT - feeling ok!,"Hey all, I posted a while back when I was pretty much at my worst and was feeling really down at the time. I was on a short time frame to quit and decided the best option was to do a really extreme rapid taper to CT since CT was absolutely impossible for me in the past - never made it past 24 hours. So I hit the grind hard and went from around 20-25 gpd to 2 on saturday in a two week span and now at CT and honestly, I don't feel great yet but I feel ok. I think the rapid taper got my body to go through the worst of the withdrawals in a manageable way. I was really scared that once I hit that CT that I would go through even more terrible withdrawals but that hasn't been the case...yet. I could be wrong though since this is a pretty tricky plant here but I am confident that I am totally over this hellashish cycle of addiction.  Just wanted to share my rather different approach to this and show my success. Not everyone has to do a really really slow taper or a really aggressive CT. I found a middle ground that worked so don't be scared to try something different. I feel so much more confident and in less of a brain fog (though that could be from also quitting weed at the same time haha). I wish you all the best and really thank this community of support. Much love <3",4,{},"{'label': 'POSITIVE', 'score': 0.9861606359481812}"
